标题,链接,发布时间,内容
哈哈哈退市吧别祸害人啦,"https://guba.eastmoney.com/news,000007,1004390266.html",2021-02-09 11:03:17,哈哈哈退市吧别祸害人啦
偷偷的买全新好，吓死了所有人,"https://guba.eastmoney.com/news,000007,1004408619.html",2021-02-09 11:32:18,偷偷的买全新好，吓死了所有人
2块5，我看你像250,"https://guba.eastmoney.com/news,000007,1004410035.html",2021-02-09 11:34:57,2块5，我看你像250
就会欺负傻妹妹是吗，无良资本主义,"https://guba.eastmoney.com/news,000007,1004409665.html",2021-02-09 11:33:33,就会欺负傻妹妹是吗，无良资本主义
去哪里哭，吃那么多跌停板,"https://guba.eastmoney.com/news,000007,1004408201.html",2021-02-09 11:31:36,去哪里哭，吃那么多跌停板
傻妹妹才是我，买了你这个股,"https://guba.eastmoney.com/news,000007,1004405223.html",2021-02-09 11:26:02,傻妹妹才是我，买了你这个股
好废啊又跌三个点,"https://guba.eastmoney.com/news,000007,1004403363.html",2021-02-09 11:23:31,好废啊又跌三个点
给我留点过年钱吧，笑死人跌成这样,"https://guba.eastmoney.com/news,000007,1004391751.html",2021-02-09 11:06:11,给我留点过年钱吧，笑死人跌成这样
清仓2.77，已挂2.49建仓。,"https://guba.eastmoney.com/news,000007,1004390320.html",2021-02-09 11:03:56,清仓2.77 ，已挂2.49建仓。
又跌又跌你可真牛逼,"https://guba.eastmoney.com/news,000007,1004389810.html",2021-02-09 11:02:39,又跌又跌你可真牛逼
这个不要脸的公司是应该查一查。,"https://guba.eastmoney.com/news,000007,1004373146.html",2021-02-09 10:39:44,这个不要脸的公司是应该查一查。
手中有票的建议不要割肉。,"https://guba.eastmoney.com/news,000007,1004346230.html",2021-02-09 10:07:23,"主力对倒也要成本的，都这个跌法了，拿住做T降成本吧。要死也拖着主力一起死。





"
缩量了没有可卖的打筹码了,"https://guba.eastmoney.com/news,000007,1004337373.html",2021-02-09 09:57:41,缩量了没有可卖的打筹码了
明天全仓买进,"https://guba.eastmoney.com/news,000007,1004173828.html",2021-02-08 16:22:07,明天全仓买进
主力吃不饱是不会拉升的,"https://guba.eastmoney.com/news,000007,1004333620.html",2021-02-09 09:53:25,主力吃不饱是不会拉升的
明天开盘：暴力抢劫！暴力拉升！暴力涨停！,"https://guba.eastmoney.com/news,000007,1004226523.html",2021-02-08 20:51:58,明天开盘：暴力抢劫！暴力拉升！暴力涨停！
今年亏的最惨的一只股，看不到回本的希望。。。。,"https://guba.eastmoney.com/news,000007,1003859415.html",2021-02-07 15:38:27,"
"
"全新好明显出现了MACD背离现象,后期会有一波拉升","https://guba.eastmoney.com/news,000007,1004321897.html",2021-02-09 09:39:41,"全新好明显出现了MACD背离现象,后期会有一波拉升"
明天”三股”势力疯狂扫货倒计时～～,"https://guba.eastmoney.com/news,000007,1004226268.html",2021-02-08 20:51:02,明天”三股”势力疯狂扫货倒计时～～
忠告不是公告更不是广告：建仓加仓满仓锁仓时刻到来了！,"https://guba.eastmoney.com/news,000007,1004225644.html",2021-02-08 20:47:38,忠告不是公告更不是广告：建仓加仓满仓锁仓时刻到来了！
机构，券商都出完货了，接下来等死,"https://guba.eastmoney.com/news,000007,1004007065.html",2021-02-08 10:40:17,机构，券商都出完货了，接下来等死
人家一听我买了全新好都笑我,"https://guba.eastmoney.com/news,000007,1004087066.html",2021-02-08 13:40:25,人家一听我买了全新好都笑我
真是血亏无敌，看中你这只股真是把治眼睛的钱都亏进去了,"https://guba.eastmoney.com/news,000007,1004085294.html",2021-02-08 13:37:28,真是血亏无敌，看中你这只股真是把治眼睛的钱都亏进去了
对这种一路走阴而且业绩面一塌糊涂的股票，居然还有人说马上起势？疯狂唱多的人估计不,"https://guba.eastmoney.com/news,000007,1004247442.html",2021-02-08 22:26:27,对这种一路走阴而且业绩面一塌糊涂的股票，居然还有人说马上起势？疯狂唱多的人估计不是就是骗子吧
汉富控股那3900万股为什么暂缓拍卖？是汉富控股有钱还债了？两个股东争斗害惨小韭,"https://guba.eastmoney.com/news,000007,994982138.html",2021-01-11 14:37:01,汉富控股那3900万股为什么暂缓拍卖？是汉富控股有钱还债了？两个股东争斗害惨小韭菜了
现在股吧里的疯子是真的多，骗子也多。,"https://guba.eastmoney.com/news,000007,1004233309.html",2021-02-08 21:23:06,现在股吧里的疯子是真的多，骗子也多。
和全新好的名字不配，应改成残旧差,"https://guba.eastmoney.com/news,000007,1004230429.html",2021-02-08 21:10:32,和全新好的名字不配，应改成残旧差
全新好有啥内幕消息麻烦告诉我一下,"https://guba.eastmoney.com/news,000007,1004209757.html",2021-02-08 19:31:07,全新好有啥内幕消息 麻烦告诉我一下
主营业务收入不到一亿就得退市，这是新规,"https://guba.eastmoney.com/news,000007,1004199968.html",2021-02-08 18:32:04,主营业务收入不到一亿就得退市，这是新规
害人不浅！,"https://guba.eastmoney.com/news,000007,1004192876.html",2021-02-08 17:51:38,害人不浅！
机器托们坚守吧！我先走了！,"https://guba.eastmoney.com/news,000007,1004167496.html",2021-02-08 15:56:24,"
"
真的没眼看，不知道啥时候是个头,"https://guba.eastmoney.com/news,000007,1004166704.html",2021-02-08 15:53:20,"
"
继续创新低吧，割肉走人！,"https://guba.eastmoney.com/news,000007,1004167086.html",2021-02-08 15:54:30,"
"
这个股，谁夸谁是托！,"https://guba.eastmoney.com/news,000007,1004166193.html",2021-02-08 15:52:20,托别来！
这个坑是把我坑惨了，爬都爬不出去,"https://guba.eastmoney.com/news,000007,1004165958.html",2021-02-08 15:51:11,"
"
不知道明天又是什么样子了，不会再跌停吧,"https://guba.eastmoney.com/news,000007,1004165738.html",2021-02-08 15:49:43,"
"
今年遇到最大的雷,"https://guba.eastmoney.com/news,000007,1004165305.html",2021-02-08 15:48:25,"
"
真的看不下去了，该不会真的要退市吧,"https://guba.eastmoney.com/news,000007,1004164952.html",2021-02-08 15:47:29,"
"
啥时候才能回本啊，跌了30%,"https://guba.eastmoney.com/news,000007,1004161449.html",2021-02-08 15:36:41,"
"
这个股我真的无力吐槽了，谁爱买谁买吧,"https://guba.eastmoney.com/news,000007,1004159514.html",2021-02-08 15:31:18,"
"
最后上车机会，下午拉涨停板,"https://guba.eastmoney.com/news,000007,1004035528.html",2021-02-08 11:20:28,最后上车机会，下午拉涨停板
今天不错有点盈利，抛了,"https://guba.eastmoney.com/news,000007,1004156867.html",2021-02-08 15:23:31,今天不错有点盈利，抛了
真的血亏啊，能不能让我过个好年,"https://guba.eastmoney.com/news,000007,1004156547.html",2021-02-08 15:22:35,"
"
"去年买过这支股挣钱走的,没想到啊现在会这个样子,[滴汗]","https://guba.eastmoney.com/news,000007,1004155080.html",2021-02-08 15:18:59,"去年买过这支股挣钱走的,没想到啊现在会这个样子,"
被高价位套的，半年是不可能解套了，唯一方法就是割肉抛店，等2块钱再买回来，现在每,"https://guba.eastmoney.com/news,000007,1004152257.html",2021-02-08 15:11:57,被高价位套的，半年是不可能解套了，唯一方法就是割肉抛店，等2块钱再买回来，现在每天都是阴跌，最终就是最低点2块进仓。
深套的不建议割肉，每日做T降成本吧。,"https://guba.eastmoney.com/news,000007,1004114885.html",2021-02-08 14:23:11,"看量能主力现在也不好受，中午那笔单子是对倒，凑量的，要死也拖着主力一起死。加油，千万别卖，、



"
"今天一定有机会,否则年底清仓走人,不要持股过年.","https://guba.eastmoney.com/news,000007,1004089943.html",2021-02-08 13:44:55,"
"
高套被套的唯一能做的就是做T降成本。,"https://guba.eastmoney.com/news,000007,1004108478.html",2021-02-08 14:13:37,五分线做T二分都不少了。庄家的成本也不
说不定跌成1块,"https://guba.eastmoney.com/news,000007,1004078855.html",2021-02-08 13:27:19,说不定跌成1块
1.60-1.80见大底,"https://guba.eastmoney.com/news,000007,1004087476.html",2021-02-08 13:41:05,1.60-1.80见大底
退市吧真是丢人,"https://guba.eastmoney.com/news,000007,1004086412.html",2021-02-08 13:39:20,退市吧真是丢人
就我这样的人居然还能被当韭菜真是太没良心了,"https://guba.eastmoney.com/news,000007,1004083927.html",2021-02-08 13:35:37,就我这样的人居然还能被当韭菜真是太没良心了
天啊后悔死买这个股,"https://guba.eastmoney.com/news,000007,1004082843.html",2021-02-08 13:33:46,天啊后悔死买这个股
等你涨回来孩子都会叫爸爸了,"https://guba.eastmoney.com/news,000007,1004083337.html",2021-02-08 13:34:38,等你涨回来孩子都会叫爸爸了
又跌一个点，没救了,"https://guba.eastmoney.com/news,000007,1004083101.html",2021-02-08 13:33:48,又跌一个点，没救了
受不了了亏死了,"https://guba.eastmoney.com/news,000007,1004078559.html",2021-02-08 13:26:47,受不了了亏死了
2块的股不走留着过年吗,"https://guba.eastmoney.com/news,000007,1004077932.html",2021-02-08 13:25:20,2块的股不走留着过年吗
这个股票难得一见啊，套死我了！,"https://guba.eastmoney.com/news,000007,1003858591.html",2021-02-07 15:28:28,"
"
全民新好！全明星好！,"https://guba.eastmoney.com/news,000007,1004078073.html",2021-02-08 13:25:51,全民新好！全明星好！
今天又是新低，明天只会更低了吧,"https://guba.eastmoney.com/news,000007,1004076471.html",2021-02-08 13:23:01,"
"
今天又新低，狗打架，吓到路人,"https://guba.eastmoney.com/news,000007,1004054048.html",2021-02-08 12:07:32,今天又新低，狗打架，吓到路人
赶紧撤退吧，现在这形势跌得不是一般啊,"https://guba.eastmoney.com/news,000007,1004061798.html",2021-02-08 12:45:05,"
"
赶紧撤退吧，本来就不怎么看好，目前情况看来判断没有错,"https://guba.eastmoney.com/news,000007,1004020127.html",2021-02-08 10:58:04,"
"
有点脑子的都知道现在情况不对了,"https://guba.eastmoney.com/news,000007,1004061998.html",2021-02-08 12:46:25,"
"
南宁人让我笑掉大牙,"https://guba.eastmoney.com/news,000007,1004052510.html",2021-02-08 12:00:08,出来走两步，我能！！！！
打广西南宁人,"https://guba.eastmoney.com/news,000007,1004052328.html",2021-02-08 11:59:02,"广西南宁人买啥跌啥，全新好她已经亏死了，现在又在买好想你，赶紧出来，否则亏死。
"
我关心的是大股东爆仓了没有,"https://guba.eastmoney.com/news,000007,1004032949.html",2021-02-08 11:16:54,我关心的是大股东爆仓了没有
全新好变成全是猪了,"https://guba.eastmoney.com/news,000007,1004031005.html",2021-02-08 11:14:00,全新好变成全是猪了
赶紧撤吧，这垃圾快倒闭了,"https://guba.eastmoney.com/news,000007,1004030511.html",2021-02-08 11:13:14,赶紧撤吧，这垃圾快倒闭了
不会连续跌停吧,"https://guba.eastmoney.com/news,000007,1003939968.html",2021-02-08 09:24:22,不会连续跌停吧
垃圾股，又跌,"https://guba.eastmoney.com/news,000007,1004000030.html",2021-02-08 10:30:29,"
"
18年-20年营业额就没超过一个亿，新规出来了这货注定要ST的了股价应该在1.2,"https://guba.eastmoney.com/news,000007,1003881451.html",2021-02-07 19:56:22,18年-20年营业额就没超过一个亿，新规出来了 这货注定要ST的了 股价应该在1.2-1.5之间
大盘暴跌这货才能涨，大盘好只能跌,"https://guba.eastmoney.com/news,000007,1004017392.html",2021-02-08 10:54:12,大盘暴跌这货才能涨，大盘好只能跌
这股真是没用了！,"https://guba.eastmoney.com/news,000007,1003947459.html",2021-02-08 09:36:05,这股真是没用了！
换茅台大家一起买茅台，一起上茅台6000519贵州茅台,"https://guba.eastmoney.com/news,000007,1003954134.html",2021-02-08 09:42:35,换茅台大家一起买茅台，一起上茅台6000519贵州茅台
每股净资产0.47元，会不会到四毛钱。,"https://guba.eastmoney.com/news,000007,1003940651.html",2021-02-08 09:25:51,每股净资产0.47元，会不会到四毛钱。
这哪还能涨啊跌那么厉害,"https://guba.eastmoney.com/news,000007,1003857742.html",2021-02-07 15:17:53,这哪还能涨啊跌那么厉害
两块多！血亏30%！都是泪,"https://guba.eastmoney.com/news,000007,1003859201.html",2021-02-07 15:36:34,"
"
老大在陆续建仓让这些SB股东看看什么叫扭转乾坤，1亿下周到位[赚大了][赚大了],"https://guba.eastmoney.com/news,000007,1003895791.html",2021-02-07 22:27:46,老大在陆续建仓让这些SB股东看看什么叫扭转乾坤，1亿下周到位
汉富控股最新消息出来了。,"https://guba.eastmoney.com/news,000007,1003891491.html",2021-02-07 21:43:36,汉富控股最新消息出来了。
突然股吧一下这么热闹，不是有人被骗进来接盘就是快拉升了，明天看下表演,"https://guba.eastmoney.com/news,000007,1003893092.html",2021-02-07 21:59:12,突然股吧一下这么热闹，不是有人被骗进来接盘就是快拉升了，明天看下表演
这么多人不看好，看样子又快要涨停了。,"https://guba.eastmoney.com/news,000007,1003892249.html",2021-02-07 21:51:42,这么多人不看好，看样子又快要涨停了。
感觉自己就是个韭菜，坐等被收割,"https://guba.eastmoney.com/news,000007,1003863017.html",2021-02-07 16:21:16,"
"
全新好连续跌停，散户还是及时收手吧,"https://guba.eastmoney.com/news,000007,1003860927.html",2021-02-07 15:57:34,"
"
算了，垃圾股，风险太大了，同等价位的股多得是,"https://guba.eastmoney.com/news,000007,1003865205.html",2021-02-07 16:45:29,"
"
业绩亏损，大股东被平仓，这些是你看空的理由[卖出]。可你想过没有，全新好没商誉呀,"https://guba.eastmoney.com/news,000007,1003714807.html",2021-02-06 06:59:13,业绩亏损，大股东被平仓，这些是你看空的理由。可你想过没有，全新好没商誉呀，资产很干净，是个好壳
就这情况，赶紧跑吧，没入的就别考虑了,"https://guba.eastmoney.com/news,000007,1003875322.html",2021-02-07 18:43:09,"
"
下周一一开盘不知道什么情况了，先跑为妙,"https://guba.eastmoney.com/news,000007,1003856153.html",2021-02-07 15:06:40,"
"
现在应该可以买进了吧？[大笑][大笑][大笑][大笑][大笑][大笑],"https://guba.eastmoney.com/news,000007,1002288096.html",2021-02-02 20:16:07,现在应该可以买进了吧？
就是垃圾公司，我看是涨不起来了,"https://guba.eastmoney.com/news,000007,1003860785.html",2021-02-07 15:55:04,"
"
本来挺看好全新好的，目前看来就是个假大空,"https://guba.eastmoney.com/news,000007,1003860666.html",2021-02-07 15:52:50,
呵呵，亏了20个点而已,"https://guba.eastmoney.com/news,000007,1003860259.html",2021-02-07 15:49:20,"选了全新好，我也只是亏了20个点而已，呵呵
"
周一开盘还不知道啥情况，不会又跌吧？,"https://guba.eastmoney.com/news,000007,1003859468.html",2021-02-07 15:39:13,"
"
不知道该说啥好，赶紧跑吧,"https://guba.eastmoney.com/news,000007,1003859151.html",2021-02-07 15:35:53,"
"
赶紧跑了吧！起码还能剩点钱过年！,"https://guba.eastmoney.com/news,000007,1003859043.html",2021-02-07 15:34:02,"
"
亏得我肉疼，周一赶紧割肉走人,"https://guba.eastmoney.com/news,000007,1003858985.html",2021-02-07 15:33:20,"
"
赶紧清仓了,"https://guba.eastmoney.com/news,000007,1003858183.html",2021-02-07 15:24:04,赶紧清仓了
该不会星期一还要再跌吧，太可怕了,"https://guba.eastmoney.com/news,000007,1003858354.html",2021-02-07 15:26:19,该不会星期一还要再跌吧，太可怕了
没眼看了这价格，看了都心痛,"https://guba.eastmoney.com/news,000007,1003858399.html",2021-02-07 15:26:55,没眼看了这价格，看了都心痛
亏死了，还留着过年吗,"https://guba.eastmoney.com/news,000007,1003858156.html",2021-02-07 15:23:35,亏死了，还留着过年吗
妈啊呀跌成这个惨样，没救了哈哈,"https://guba.eastmoney.com/news,000007,1003858049.html",2021-02-07 15:22:27,妈啊呀跌成这个惨样，没救了哈哈
跑路跑路，我哭了这股没救了,"https://guba.eastmoney.com/news,000007,1003857812.html",2021-02-07 15:18:59,跑路跑路，我哭了这股没救了
一定是被割韭菜了,"https://guba.eastmoney.com/news,000007,1003857593.html",2021-02-07 15:17:36,一定是被割韭菜了
不会吧不是吧，吃那么多个跌停板,"https://guba.eastmoney.com/news,000007,1003856923.html",2021-02-07 15:09:14,不会吧不是吧，吃那么多个跌停板
卖了卖了，这价跌的害怕,"https://guba.eastmoney.com/news,000007,1003856630.html",2021-02-07 15:08:03,卖了卖了，这价跌的害怕
这个妖股的走势真的怕了怕了,"https://guba.eastmoney.com/news,000007,1003854346.html",2021-02-07 15:01:27,"
"
真没见过股票能跌9个跌停板的,"https://guba.eastmoney.com/news,000007,1003854274.html",2021-02-07 15:00:12,"
"
推行注册制不假但是排队时间是真,"https://guba.eastmoney.com/news,000007,1003729343.html",2021-02-06 09:20:03,全新好虽然是壳但是达到上市标准的公司未必等的了时间十个亿对于大公司来说比起等个一年两年还是值得借壳上市这就是时间就是金钱
突然成群结队的拖不停的刷，肯定是有不好的事，都当散户呢这些拖,"https://guba.eastmoney.com/news,000007,1003744035.html",2021-02-06 11:46:49,突然成群结队的拖不停的刷，肯定是有不好的事，都当散户呢这些拖
看来唐小红的智商比陆尔东李强的智商高多了。连陆尔穗也撵不上。,"https://guba.eastmoney.com/news,000007,999609994.html",2021-01-26 09:08:22,看来唐小红的智商比陆尔东李强的智商高多了。连陆尔穗也撵不上。
相信它,"https://guba.eastmoney.com/news,000007,1003828617.html",2021-02-07 10:19:48,相信全新好，一定会涨的
亏了25个点溜了。你们玩的开心[俏皮],"https://guba.eastmoney.com/news,000007,1003825533.html",2021-02-07 09:47:35,亏了25个点溜了。你们玩的开心
买定离手，相信二股东的能力,"https://guba.eastmoney.com/news,000007,1003803656.html",2021-02-07 01:15:37,买定离手，相信二股东的能力
振奋人心的消息，马云马化腾联手打造007全新好百倍入资组合,"https://guba.eastmoney.com/news,000007,1003782466.html",2021-02-06 20:09:50,振奋人心的消息，马云马化腾联手打造007全新好百倍入资组合
年前还有部分子弹股友们投进全新好可以吗,"https://guba.eastmoney.com/news,000007,1003697914.html",2021-02-06 00:24:21,年前还有部分子弹 股友们投进全新好可以吗
"有时觉得散户好可怜,明明是受伤害的人,却要拼命去伤害另一个散户.股票亏是命不好,","https://guba.eastmoney.com/news,000007,1003794657.html",2021-02-06 22:41:36,"有时觉得散户好可怜,明明是受伤害的人,却要拼命去伤害另一个散户.股票亏是命不好吗,不是!是让无良人坑害的,所以散户不要再做无良人了.
"
退市股，有些人就爱自作聪明还想着抄底绝对被埋,"https://guba.eastmoney.com/news,000007,1003744795.html",2021-02-06 11:55:02,退市股，有些人就爱自作聪明 还想着抄底 绝对被埋
扶不起的阿斗，撤了撤了,"https://guba.eastmoney.com/news,000007,1003734395.html",2021-02-06 10:08:51,扶不起的阿斗，撤了撤了
这股价对得起你的名字吗？,"https://guba.eastmoney.com/news,000007,1003730076.html",2021-02-06 09:27:22,这股价对得起你的名字吗？
马上开注册制了，周一就看谁跑得快了,"https://guba.eastmoney.com/news,000007,1003728103.html",2021-02-06 09:08:12,马上开注册制了，周一就看谁跑得快了
怎么这么多看好的,"https://guba.eastmoney.com/news,000007,1003700070.html",2021-02-06 00:55:00,怎么这么多看好的
企业一切都很好，就差一个时机，看好未来重返巅峰。,"https://guba.eastmoney.com/news,000007,1003701480.html",2021-02-06 01:20:25,企业一切都很好，就差一个时机，看好未来重返巅峰。
那些动不动就喷的，就这心态还想在股票赚钱？涨跌不是常事吗？,"https://guba.eastmoney.com/news,000007,1003701171.html",2021-02-06 01:14:12,那些动不动就喷的，就这心态还想在股票赚钱？涨跌不是常事吗？
掐指一算确实是入的好时机,"https://guba.eastmoney.com/news,000007,1003701025.html",2021-02-06 01:11:35,掐指一算确实是入的好时机
公司的基本面、业务状况和未来前景在我看来都没毛病,"https://guba.eastmoney.com/news,000007,1003700943.html",2021-02-06 01:09:19,公司的基本面、业务状况和未来前景在我看来都没毛病
擦老子就不信邪！重仓！给我争气点！,"https://guba.eastmoney.com/news,000007,1003700680.html",2021-02-06 01:03:27,擦老子就不信邪！重仓！给我争气点！
最近有好事发生相信我！,"https://guba.eastmoney.com/news,000007,1003700823.html",2021-02-06 01:07:46,最近有好事发生相信我！
技术走势来看确实走的不是很漂亮耐心等股价拐点吧不过这个价格确实适合上车,"https://guba.eastmoney.com/news,000007,1003699392.html",2021-02-06 00:44:04,技术走势来看确实走的不是很漂亮 耐心等股价拐点吧 不过这个价格确实适合上车
小盘股不太敢下手全新好目前的价格算是低位吗,"https://guba.eastmoney.com/news,000007,1003699239.html",2021-02-06 00:42:36,小盘股不太敢下手全新好目前的价格算是低位吗
股价涨跌的因素很多耐心判断利好利空,"https://guba.eastmoney.com/news,000007,1003697877.html",2021-02-06 00:23:47,股价涨跌的因素很多 耐心判断利好利空
全新好以前好像是做医药类的吧,"https://guba.eastmoney.com/news,000007,1003697149.html",2021-02-06 00:13:52,全新好以前好像是做医药类的吧
资本抱团取暖小散户有苦难言,"https://guba.eastmoney.com/news,000007,1003697048.html",2021-02-06 00:13:26,资本抱团取暖 小散户有苦难言
年底了大户跟大机构都在撤资行情不好啊,"https://guba.eastmoney.com/news,000007,1003697001.html",2021-02-06 00:13:04,年底了 大户跟大机构都在撤资 行情不好啊
全新好的股价走势还是可以期待一下,"https://guba.eastmoney.com/news,000007,1003667744.html",2021-02-05 21:29:54,全新好的股价走势还是可以期待一下
哈哈哈我又来了，总之我是不会退的！,"https://guba.eastmoney.com/news,000007,1003674867.html",2021-02-05 21:58:58,哈哈哈我又来了，总之我是不会退的！
马上就要见到光明了,"https://guba.eastmoney.com/news,000007,1003679881.html",2021-02-05 22:22:58,"马上就要见到光明了
"
从开始炒股就是跟全新好一起的，这一次还是会继续支持，过几天就会好的,"https://guba.eastmoney.com/news,000007,1003676117.html",2021-02-05 22:05:29,从开始炒股就是跟全新好一起的，这一次还是会继续支持，过几天就会好的
我来了，让我的名字给你力量吧,"https://guba.eastmoney.com/news,000007,1003678345.html",2021-02-05 22:15:31,我来了，让我的名字给你力量吧
炒股要有以及判断，不跟风买，不随流卖，有主见才能赚大钱,"https://guba.eastmoney.com/news,000007,1003680213.html",2021-02-05 22:24:18,炒股要有以及判断，不跟风买，不随流卖，有主见才能赚大钱
田螺虾还健在嘛,"https://guba.eastmoney.com/news,000007,1003689247.html",2021-02-05 23:11:58,田螺虾还健在嘛
年后肯定要飞起来的，赶紧抄底赚钱,"https://guba.eastmoney.com/news,000007,1003678204.html",2021-02-05 22:14:43,"
"
散户的力量也是很强大的，但是要一起发力,"https://guba.eastmoney.com/news,000007,1003678016.html",2021-02-05 22:13:53,散户的力量也是很强大的，但是要一起发力
全新好一直在努力，我们选择了，就得一直相信它,"https://guba.eastmoney.com/news,000007,1003677572.html",2021-02-05 22:12:06,全新好一直在努力，我们选择了，就得一直相信它
我本来就想安静持有，但是发现股吧不带脑子唱空的太多了，忍不住出来发发帖。散户能同,"https://guba.eastmoney.com/news,000007,1003680972.html",2021-02-05 22:27:53,我本来就想安静持有，但是发现股吧不带脑子唱空的太多了，忍不住出来发发帖。散户能同心吗？
选了全新好就要做好长线的准备,"https://guba.eastmoney.com/news,000007,1003681441.html",2021-02-05 22:30:28,"





选了全新好就要做好长线的准备"
希望全新好能够早点度过难关,"https://guba.eastmoney.com/news,000007,1003681242.html",2021-02-05 22:28:08,希望全新好能够早点度过难关
大家相信自己经验，别瞎看各种乱七八糟话题和评论,"https://guba.eastmoney.com/news,000007,1003650018.html",2021-02-05 20:12:48,大家相信自己经验，别瞎看各种乱七八糟话题和评论
公司其实很有想法，差一个时机就会爆发，不用操之过急,"https://guba.eastmoney.com/news,000007,1003678486.html",2021-02-05 22:16:14,公司其实很有想法，差一个时机就会爆发，不用操之过急
预测一波，全新好马上起飞,"https://guba.eastmoney.com/news,000007,1003674159.html",2021-02-05 21:57:08,预测一波，全新好马上起飞
