标题,链接,发布时间,内容
价格高收购是壳费高。。现在猪肉都一天一个价。屁凸屁。还26收购。,"https://guba.eastmoney.com/news,002168,339598273.html",2016-04-22 21:27:35,价格高收购是壳费高。。现在猪肉都一天一个价。屁凸屁。还26收购。
我是个新手，发一下牢骚，勿喷。大家都看汪19块收购的，使劲买包括我也一样，这情况,"https://guba.eastmoney.com/news,002168,339564918.html",2016-04-22 20:47:18,我是个新手，发一下牢骚，勿喷。大家都看汪19块收购的，使劲买包括我也一样，这情况现在看来起码要半年以后才会启动，哎，发财梦又破灭了[心碎]
今天通通套住买入的。,"https://guba.eastmoney.com/news,002168,339592134.html",2016-04-22 21:19:52,今天通通套住买入的。
PTP定向增发股票了,"https://guba.eastmoney.com/news,002168,339580851.html",2016-04-22 21:06:32,PTP定向增发股票了
大股东。19买的怕个屁。资本高手。信中利借壳。也不错。,"https://guba.eastmoney.com/news,002168,339565611.html",2016-04-22 20:48:16,大股东。19买的怕个屁。资本高手。信中利借壳。也不错。
