标题,链接,发布时间,内容
通过对周五逐笔复盘，买入大单奇多，而卖盘以小单为主,"https://guba.eastmoney.com/news,002168,345369462.html",2016-04-24 21:37:11,通过对周五逐笔复盘，买入大单奇多，而卖盘以小单为主
现有妖女，真是一群妖魔鬼怪。,"https://guba.eastmoney.com/news,002168,345368719.html",2016-04-24 21:37:05,现有妖女，真是一群妖魔鬼怪。
深圳惠程放心持有，中驰溢价19，深圳惠程超过20,"https://guba.eastmoney.com/news,002168,345225134.html",2016-04-24 20:30:14,深圳惠程放心持有，中驰溢价19，深圳惠程超过20
14号五方主力争夺中拉高吸筹直到尾盘9.1万手封单，全天流进3.7亿，流入资金第,"https://guba.eastmoney.com/news,002168,344941841.html",2016-04-24 18:19:14,14号五方主力争夺中拉高吸筹直到尾盘9.1万手封单，全天流进3.7亿，流入资金第二名，无论唱空与唱多，主力不是傻瓜！好戏还在后面，拭目以待……
深圳惠程大跌能否弹起,"https://guba.eastmoney.com/news,002168,345016557.html",2016-04-24 18:53:06,深圳惠程大跌能否弹起？
后面还有个特大利好，出来再跑路？,"https://guba.eastmoney.com/news,002168,345065754.html",2016-04-24 19:15:09,后面还有个特大利好，出来再跑路？
22号华微电子涨停已经说明一切。不要幻想深圳惠程了。,"https://guba.eastmoney.com/news,002168,345063847.html",2016-04-24 19:14:09,22号华微电子涨停已经说明一切。不要幻想深圳惠程了。
汇金和粤港提前知道消息潜伏？,"https://guba.eastmoney.com/news,002168,344976251.html",2016-04-24 18:34:47,汇金和粤港提前知道消息潜伏？
全国人民都晓得啦！这鸭子要飞！！,"https://guba.eastmoney.com/news,002168,344887596.html",2016-04-24 17:56:44,全国人民都晓得啦！这鸭子要飞！！
中央汇金资产管理有限责任公司  广东粤港股权投资基金有限公司  二股东三股东这次,"https://guba.eastmoney.com/news,002168,344780938.html",2016-04-24 17:11:04,"中央汇金资产管理有限责任公司
广东粤港股权投资基金有限公司
二股东三股东这次要发财了"
都在关注汪超涌  忽视了纪晓文 杨富年  强强联合会怎样 看看我以前的帖子就知道,"https://guba.eastmoney.com/news,002168,343707355.html",2016-04-24 10:06:11,都在关注汪超涌 忽视了纪晓文 杨富年 强强联合会怎样 看看我以前的帖子就知道这才是开始 至于为何要溢价收购 看看吕晓文减持的价格
不要猜了下跌别怕 就怕突然拉涨停然后连续涨停板,"https://guba.eastmoney.com/news,002168,344642036.html",2016-04-24 16:07:50,不要猜了下跌别怕 就怕突然拉涨停然后连续涨停板
风急浪高,"https://guba.eastmoney.com/news,002168,344555340.html",2016-04-24 15:28:20,风急浪高
壳资源贵哦,"https://guba.eastmoney.com/news,002168,344508252.html",2016-04-24 15:06:04,"假设惠程只搞主业，且不说可能倒闭，就按前几年的平均利润，摊到何平夫妇，一年也就赚个几百万，16.5亿至少要100年。
当然卖壳！
本吧里关于买壳卖壳的一篇专业文章将此现象说的很清楚。"
我已经咨询了了有关专家，你猜他们怎么说？,"https://guba.eastmoney.com/news,002168,344424851.html",2016-04-24 14:29:45,我已经咨询了了有关专家，你猜他们怎么说？
"周一涨停价:15.51,挂单买货希望开盘能成交","https://guba.eastmoney.com/news,002168,343371974.html",2016-04-24 08:09:26,"周一涨停价:15.51,挂单买货希望开盘能成交"
说什么的都有，谁能给个理性的分析，而不是瞎扯淡。,"https://guba.eastmoney.com/news,002168,343919497.html",2016-04-24 11:18:17,说什么的都有，谁能给个理性的分析，而不是瞎扯淡。
有个事实：本次收购壳很急。大平台借壳没有悬念,"https://guba.eastmoney.com/news,002168,340542033.html",2016-04-23 07:53:58,溢价114%（19元）购壳。足以证明很急。联想诸多蛛丝马迹，（360改制也很急，流通盘规模，信中利掌门人背景）。即使不是360借壳，也极有可能是中概股回归借壳。本人估计，停牌在即。拭目以待。
几个事实： 一净壳两空壳 汪李和高管19接盘 原德隆系在里面 汇金和社保持股 市,"https://guba.eastmoney.com/news,002168,344283928.html",2016-04-24 13:33:07,"几个事实：
一净壳两空壳
汪李和高管19接盘
原德隆系在里面
汇金和社保持股
市值一百亿的壳
自己想吧
"
申科股份与惠程操作手法一致，也是停牌期间高溢价收购股权，停牌价18.8，收购价3,"https://guba.eastmoney.com/news,002168,344238407.html",2016-04-24 13:15:20,申科股份与惠程操作手法一致，也是停牌期间高溢价收购股权，停牌价18.8，收购价36
此文献给唱多的托们 赶紧回家吧，隔壁老王在你家呢,"https://guba.eastmoney.com/news,002168,344194267.html",2016-04-24 12:58:01,"此文献给唱多的托们
赶紧回家吧，隔壁老王在你家呢"
这些基金，养老进来了。再怎么傻也不会拿钱来发给大家吧！,"https://guba.eastmoney.com/news,002168,344042144.html",2016-04-24 12:01:08,这些基金，养老进来了。再怎么傻也不会拿钱来发给大家吧！
请你爹下来，我好多买几百股,"https://guba.eastmoney.com/news,002168,344165659.html",2016-04-24 12:46:56,请你爹下来，我好多买几百股
麦考林借壳，周一开始连续涨停。,"https://guba.eastmoney.com/news,002168,343994888.html",2016-04-24 11:44:37,麦考林借壳，周一开始连续涨停。
周一直接高开高走。连续三个涨停。,"https://guba.eastmoney.com/news,002168,344000206.html",2016-04-24 11:46:40,周一直接高开高走。连续三个涨停。
麦卡林借壳，不用猜了，周一开始连续涨停。,"https://guba.eastmoney.com/news,002168,343990403.html",2016-04-24 11:43:03,麦卡林借壳，不用猜了，周一开始连续涨停。
这么多人唱空，说明真的要涨了,"https://guba.eastmoney.com/news,002168,343882216.html",2016-04-24 11:05:13,这么多人唱空，说明真的要涨了
反正故事刚开始。卖了的你就等低位进。买了的就控制仓位。有故事就好。,"https://guba.eastmoney.com/news,002168,343881511.html",2016-04-24 11:04:43,反正故事刚开始。卖了的你就等低位进。买了的就控制仓位。有故事就好。
投的是机器人,"https://guba.eastmoney.com/news,002168,343877440.html",2016-04-24 11:03:47,投的是机器人
[图片],"https://guba.eastmoney.com/news,002168,343669735.html",2016-04-24 09:53:21,[图片]
深圳惠程两天走势分析,"https://guba.eastmoney.com/news,002168,343858819.html",2016-04-24 10:57:14,深圳惠程观察主力并没有走，尾盘附近可以买进，观察
看了贴吧，深圳惠程：这股票妖气四射；风急浪高的；小船说翻就翻；一会涨停一会可能跌,"https://guba.eastmoney.com/news,002168,343836971.html",2016-04-24 10:49:48,看了贴吧，深圳惠程：这股票妖气四射；风急浪高的；小船说翻就翻；一会涨停一会可能跌停的。
明天开盘13.7看你们还装不装的起来,"https://guba.eastmoney.com/news,002168,343774214.html",2016-04-24 10:28:52,明天开盘13.7看你们还装不装的起来
看看信任大股东的背景，未来看好！不看好的周一就走,"https://guba.eastmoney.com/news,002168,341281707.html",2016-04-23 16:15:34,看看信任大股东的背景，未来看好！不看好的周一就走
16.4.25深圳惠城周一走势,"https://guba.eastmoney.com/news,002168,343450218.html",2016-04-24 08:36:26,周五破分时线，大量出逃，周一绝对下跌，吧里太多忽悠人的，吧里主流涨现实肯定跌，吧里主流跌现实肯定涨
只要后面有故事。就有的玩。就怕江郎才尽。通通有的玩。,"https://guba.eastmoney.com/news,002168,343503649.html",2016-04-24 08:55:01,只要后面有故事。就有的玩。就怕江郎才尽。通通有的玩。
靠老乡关系。借360是对汪总的侮辱。汪总是何必等人物。难道汪总要靠老乡来赚钱。,"https://guba.eastmoney.com/news,002168,341037256.html",2016-04-23 11:50:18,靠老乡关系。借360是对汪总的侮辱。汪总是何必等人物。难道汪总要靠老乡来赚钱。
可能是诱，可能是空,"https://guba.eastmoney.com/news,002168,343466761.html",2016-04-24 08:41:56,可能是诱，可能是空
各路资金周一虎视深圳惠程，真是不涨停都难，太热了,"https://guba.eastmoney.com/news,002168,343275488.html",2016-04-24 07:35:52,各路资金周一虎视深圳惠程，真是不涨停都难，太热了
该买就买，买就不要怕被套。该卖就卖，卖了还可以低吸。当数个涨停板再度开启的时候，,"https://guba.eastmoney.com/news,002168,341305599.html",2016-04-23 17:38:33,该买就买，买就不要怕被套。该卖就卖，卖了还可以低吸。当数个涨停板再度开启的时候，守住的是回报，卖出的是闷头棒。从大盘行情和主力操作手法看，惠程机会是给足各位的，你受惠了吗？月底前见分晓……
地球人都知道的利好不是利好，若真利好的话，涨停一字板你够不着。,"https://guba.eastmoney.com/news,002168,342190195.html",2016-04-24 00:55:45,"
地球人都知道的利好不是利好，若真利好的话，涨停一字板你够不着。
"
发表意见了，认为主力出货打1，认为主力吸筹打2.,"https://guba.eastmoney.com/news,002168,340872890.html",2016-04-23 10:29:44,发表意见了，认为主力出货打1，认为主力吸筹打2.
一路顺丰，一路发，168，你懂的,"https://guba.eastmoney.com/news,002168,342125397.html",2016-04-23 23:53:28,一路顺丰，一路发，168，你懂的
[图片],"https://guba.eastmoney.com/news,002168,342117799.html",2016-04-23 23:46:33,[图片]
汪潮涌先生向母校清华捐赠一亿元,"https://guba.eastmoney.com/news,002168,342098155.html",2016-04-23 23:27:56,汪潮涌先生向母校清华捐赠一亿元
360借壳？查看周鸿祎资料时无意看到的图片,"https://guba.eastmoney.com/news,002168,340963289.html",2016-04-23 11:12:45,360借壳？查看周鸿祎资料时无意看到的图片
下周重仓跟进！,"https://guba.eastmoney.com/news,002168,342087507.html",2016-04-23 23:18:23,下周重仓跟进！
周末筹集了120万资金，周一不管了全部吃进,"https://guba.eastmoney.com/news,002168,339903122.html",2016-04-23 02:36:12,周末筹集了120万资金，周一不管了全部吃进
潜伏深圳惠程，坐等机构抬轿！安心潜伏，坐等暴富！第一目标20元！！别被甩下车了，,"https://guba.eastmoney.com/news,002168,341365446.html",2016-04-23 18:54:52,潜伏深圳惠程，坐等机构抬轿！安心潜伏，坐等暴富！第一目标20元！！别被甩下车了，切记！有缘人得之！
002387不重组期限将至，公司壳干净且卖壳意愿强烈，机不可失,"https://guba.eastmoney.com/news,002168,341353004.html",2016-04-23 18:50:45,002387不重组期限将至，公司壳干净且卖壳意愿强烈，机不可失
明天卖掉家里竟有的二头猪和一牛来押宝，赌赢了再买回十头小猪和二头小牛，这样可以钱,"https://guba.eastmoney.com/news,002168,341274821.html",2016-04-23 15:51:35,明天卖掉家里竟有的二头猪和一牛来押宝，赌赢了再买回十头小猪和二头小牛，这样可以钱生钱
如果是借壳，那么什么时候发布消息，谁借壳都行，赶紧上涨就是好壳,"https://guba.eastmoney.com/news,002168,341301801.html",2016-04-23 17:25:11,如果是借壳，那么什么时候发布消息，谁借壳都行，赶紧上涨就是好壳
今日日线单针见顶，短期回调目标10.30左右。放天量不涨，主力托盘出货，利好出尽,"https://guba.eastmoney.com/news,002168,339422125.html",2016-04-22 15:05:50,今日日线单针见顶，短期回调目标10.30左右。放天量不涨，主力托盘出货，利好出尽，周一恐低开跌停
呼声越高越不搭边，大家记得巨人回归吗？游久呼声最高，游轮静静的，结果大家都已经知,"https://guba.eastmoney.com/news,002168,341274140.html",2016-04-23 15:49:20,呼声越高越不搭边，大家记得巨人回归吗？游久呼声最高，游轮静静的，结果大家都已经知道了。
这话如何理解！$ 按约定上市公司要保留8.5亿现金，实际上收购也就是10元左右。,"https://guba.eastmoney.com/news,002168,340681066.html",2016-04-23 09:03:46,这话如何理解！$ 按约定上市公司要保留8.5亿现金，实际上收购也就是10元左右。要是还有要求原来股东回购实业资产的话应该是一个比较好的收购标的。
只相当于8亿每股10元价格买个壳太划算了！所以也涨不了多少了！,"https://guba.eastmoney.com/news,002168,341278523.html",2016-04-23 16:04:24,
各位网友别乱猜测，汪肯定大手笔，大家把手中筹码捂住就行。,"https://guba.eastmoney.com/news,002168,341248682.html",2016-04-23 14:18:42,各位网友别乱猜测，汪肯定大手笔，大家把手中筹码捂住就行。
中央汇金是大股东。跟着中央汇金走，有肉吃。,"https://guba.eastmoney.com/news,002168,341268124.html",2016-04-23 15:28:53,中央汇金是大股东。跟着中央汇金走，有肉吃。
复制周一复制九鼎投资的走势。十九元要约收购。,"https://guba.eastmoney.com/news,002168,341267734.html",2016-04-23 15:27:37,复制周一复制九鼎投资的走势。十九元要约收购。
三大牛股 下周爆发,"https://guba.eastmoney.com/news,002168,339560149.html",2016-04-22 20:40:53,快来领取吧
下周一高开高走。周五下车的没有上车机会了。,"https://guba.eastmoney.com/news,002168,341267599.html",2016-04-23 15:27:10,下周一高开高走。周五下车的没有上车机会了。
信中利停牌惠城复牌，有见过这样的重组吗？所以说信中利借壳可能性没有，唯一可能是参,"https://guba.eastmoney.com/news,002168,341256793.html",2016-04-23 14:49:34,信中利停牌惠城复牌，有见过这样的重组吗？所以说信中利借壳可能性没有，唯一可能是参与重组卖壳！至于哪家说都不知道，只能确认的是卖壳价格高于买壳价格19元。
这个票360不来它能跌到7元吗？360来了它能涨到20吗？才14元的价位有必要那,"https://guba.eastmoney.com/news,002168,341265739.html",2016-04-23 15:20:51,这个票360不来它能跌到7元吗？360来了它能涨到20吗？才14元的价位有必要那么纠结吗？
理性分析（360借壳),"https://guba.eastmoney.com/news,002168,339508227.html",2016-04-22 18:36:43,全国首个网络信息安全产业园落户成都 投资130亿.360总部将落户成都.必将借壳成都上市公司000803.拭目以待
惠程这样的股价有钱就加仓，干净的壳就等资产注入，看成一只新股一年内翻倍是没问题的,"https://guba.eastmoney.com/news,002168,341243988.html",2016-04-23 14:00:18,惠程这样的股价有钱就加仓，干净的壳就等资产注入，看成一只新股一年内翻倍是没问题的，问题是无法接受庄家的洗盘……
周一低开5个点，跌停收盘,"https://guba.eastmoney.com/news,002168,341243861.html",2016-04-23 13:59:41,周一低开5个点，跌停收盘
鉴于股吧里比较热闹，估计风险来了，周一把剩下的都清完，落袋为安[大笑],"https://guba.eastmoney.com/news,002168,341227186.html",2016-04-23 13:38:39,鉴于股吧里比较热闹，估计风险来了，周一把剩下的都清完，落袋为安
【投资者传闻求证】360借壳公司？,"https://guba.eastmoney.com/news,002168,339119619.html",2016-04-22 09:13:45,【深圳惠程官方回复】请以公司公告信息为准。
怎么可能是360 ，,"https://guba.eastmoney.com/news,002168,341193274.html",2016-04-23 13:18:31,怎么可能是360，猪都知道不可能的
惠程 好已经贵了,"https://guba.eastmoney.com/news,002168,341186866.html",2016-04-23 13:14:45,丢给庄吧，不可能是360来的
如果这个股重组或卖壳都会被否决，前面几个涨停板了？你们不懂吗？内幕交易、消息泄露,"https://guba.eastmoney.com/news,002168,341168802.html",2016-04-23 13:03:47,如果这个股重组或卖壳都会被否决，前面几个涨停板了？你们不懂吗？内幕交易、消息泄露都是被否原因。
惠程下周拉板,"https://guba.eastmoney.com/news,002168,341152184.html",2016-04-23 12:54:05,如题
360私有化买团中，有两家来自360管理层的公司，而且都在天津，意味着什么,"https://guba.eastmoney.com/news,002168,341122889.html",2016-04-23 12:37:09,天机已泄露，2168肯定是其他的中概股借壳
我不会看股，一个小散的想象,"https://guba.eastmoney.com/news,002168,341102814.html",2016-04-23 12:25:33,顶级资本+高溢价收购=三倍以上的收益吗？如果是，股价上100可能性大。
⋯各個股吧都在唱360借殼⋯華微電子⋯北緯通信⋯等等⋯醉了⋯,"https://guba.eastmoney.com/news,002168,341064963.html",2016-04-23 12:05:36,?各個股吧都在唱360借殼?華微電子?北緯通信?等等?醉了?
一切尘埃落定，大伙都锁仓等停牌吧,"https://guba.eastmoney.com/news,002168,339565983.html",2016-04-22 20:48:48,主力爱拉爱砸由他们去玩，这个价位就算15买也不会亏，等着老汪操作停牌就是了。
转让之快，停牌之频，成立新公司之急都令人遐想。,"https://guba.eastmoney.com/news,002168,340942260.html",2016-04-23 11:02:01,转让之快，停牌之频，成立新公司之急都令人遐想。
不再封板 梦想破碎 回到现实,"https://guba.eastmoney.com/news,002168,340699247.html",2016-04-23 09:12:29,"这里我只想说一句:此股可以做好长时间了！

另外请大家一起欢迎 赢了就走 出来说说话，讨论一下“深圳惠程4月22日分时走势”及“深圳惠程以后操作策略[鼓”

[鼓掌]"
停牌公告,"https://guba.eastmoney.com/news,002168,340682597.html",2016-04-23 09:04:19,停牌公告
深圳惠程：低谷中欲求突破！后期能否直线上升？,"https://guba.eastmoney.com/news,002168,340729731.html",2016-04-23 09:25:42,有望翻红的两支妖股，已出炉！你持有了吗？要的赶快！
不是吹牛，深圳惠程会再现九鼎投资的涨停路径。还有十三个涨停,"https://guba.eastmoney.com/news,002168,339471670.html",2016-04-22 16:51:21,不是吹牛，深圳惠程会再现九鼎投资的涨停路径。还有十三个涨停
此股不错唻，亏得屁股露出来了还能翻倍啊,"https://guba.eastmoney.com/news,002168,340822021.html",2016-04-23 10:07:32,
本来涨的挺好的怎么又跌了？是有利空吗,"https://guba.eastmoney.com/news,002168,339461299.html",2016-04-22 16:15:39,本来涨的挺好的怎么又跌了点？是有利空吗
借壳是肯定的，就看是哪家借壳了,"https://guba.eastmoney.com/news,002168,340720206.html",2016-04-23 09:21:14,借壳是肯定的，就看是哪家借壳了
不管怎样公司换了实际控制人并且是名人，股友们可以想入非非了,"https://guba.eastmoney.com/news,002168,340703407.html",2016-04-23 09:14:34,不管怎样公司换了实际控制人并且是名人，股友们可以想入非非了
明天开始跌！有敢打赌的吗？,"https://guba.eastmoney.com/news,002168,321764913.html",2016-04-13 15:14:50,明天开始跌！有敢打赌的吗？
静默期快结束了吧，这两天360板块要疯狂了,"https://guba.eastmoney.com/news,002168,340699394.html",2016-04-23 09:12:35,静默期快结束了吧，这两天360板块要疯狂了
后市操作建议,"https://guba.eastmoney.com/news,002168,339341145.html",2016-04-22 13:26:10,目前留30%仓位，用30%高抛低吸，剩余按兵不动。提防大盘破位。
大家不会猜来猜去，周一走势震荡的可能性大的多，在里面的朋友可以做做高抛低吸,"https://guba.eastmoney.com/news,002168,340620302.html",2016-04-23 08:32:48,大家不会猜来猜去，周一走势震荡的可能性大的多，在里面的朋友可以做做高抛低吸
还可以,"https://guba.eastmoney.com/news,002168,340610344.html",2016-04-23 08:27:56,还可以
明显是个讲故事的公司,"https://guba.eastmoney.com/news,002168,340588272.html",2016-04-23 08:17:11,明显是个讲故事的公司
准备大额筹资，14以下通吃，持有,"https://guba.eastmoney.com/news,002168,340536013.html",2016-04-23 07:51:18,潜伏
我只想说 尾盘下挫是好事[大笑][赞][大笑][大笑],"https://guba.eastmoney.com/news,002168,340415736.html",2016-04-23 06:54:32,我只想说 尾盘下挫是好事
13.35亿除以7016.77万股等于多少 3.15亿除以1656.87万股等于,"https://guba.eastmoney.com/news,002168,339745580.html",2016-04-23 00:32:43,"13.35亿除以7016.77万股等于多少
3.15亿除以1656.87万股等于多少，
大家算算就知道深圳惠程是否值得留。"
周二估计会涨停,"https://guba.eastmoney.com/news,002168,339898924.html",2016-04-23 02:20:58,周二估计会涨停
对惠程期望越高、失望越大、之前停盘几天还不如不停，10元见。,"https://guba.eastmoney.com/news,002168,339871653.html",2016-04-23 01:28:32,对惠程期望越高、失望越大、之前停盘几天还不如不停，10元见。
八十个跌停不是梦,"https://guba.eastmoney.com/news,002168,339688627.html",2016-04-22 23:27:12,八十个跌停不是梦
出的全是小散今天,"https://guba.eastmoney.com/news,002168,339529596.html",2016-04-22 19:41:41,下来买
15买入的人都成了英雄,"https://guba.eastmoney.com/news,002168,339420940.html",2016-04-22 15:04:18,15买入的人都成了英雄
我真想拿枪爆唱空的头！,"https://guba.eastmoney.com/news,002168,339665426.html",2016-04-22 22:55:43,我真想拿枪爆唱空的头！
14.11已出，赚1元。,"https://guba.eastmoney.com/news,002168,339163545.html",2016-04-22 09:52:20,14.11已出，赚1元。
信中利转A，20天后停牌借壳，29号看信中利的股东大会有分晓…,"https://guba.eastmoney.com/news,002168,339673708.html",2016-04-22 23:06:54,信中利转A，20天后停牌借壳，29号看信中利的股东大会有分晓…
故事讲完了，胜利大逃亡！感谢庄家！,"https://guba.eastmoney.com/news,002168,339423725.html",2016-04-22 15:08:00,上午的高点没有冲过去，140万在15.26元全卖了！
吧里哪里来的这么多水军，把一些厕所帖子全部顶到前面，这素质就别来这吧里混了，欺骗,"https://guba.eastmoney.com/news,002168,320031784.html",2016-04-13 01:50:15,吧里哪里来的这么多水军，把一些厕所帖子全部顶到前面，这素质就别来这吧里混了，欺骗不了惠程吧内人的，小散们看了别上当！我们应该把一些好帖子顶上来！别多想，惠程明天照样板！
这股吧这么火，关注你了找机会上车,"https://guba.eastmoney.com/news,002168,339649487.html",2016-04-22 22:34:47,这股吧这么火，关注你了找机会上车
什么360。中概股也不错。信中利。更好。九鼎不也涨的好。,"https://guba.eastmoney.com/news,002168,339585579.html",2016-04-22 21:12:12,什么360。中概股也不错。信中利。更好。九鼎不也涨的好。
不用猜了，我分析是信中利要转板。仔细研究下新三板转板，就能发现了。一定会赶在新三,"https://guba.eastmoney.com/news,002168,332200748.html",2016-04-20 00:16:45,不用猜了，我分析是信中利要转板。仔细研究下新三板转板，就能发现了。一定会赶在新三板分层之前完成。拭目以待吧各位！半年后就可以改名了，就叫信中利
没守住， 15.16卖了， 14.61又买回。买早啦。,"https://guba.eastmoney.com/news,002168,339450177.html",2016-04-22 15:56:30,"没守住，
15.16卖了，
14.61又买回。买早啦。"
厉害啊！今天居然没有龙虎榜，三个条件一个都没有达到,"https://guba.eastmoney.com/news,002168,339510731.html",2016-04-22 18:49:10,厉害啊！今天居然没有龙虎榜，三个条件一个都没有达到
如果重组有定向增发，则定增对像是不愿看到定增前20天股价上涨的,"https://guba.eastmoney.com/news,002168,339641314.html",2016-04-22 22:23:29,如果重组方案中有定向增发，则定增对像是不愿看到定增前20天股价上涨的，这样会增加他们的定增成本减少收益。所以有设法打压股价的动力。
因此也不靠谱,"https://guba.eastmoney.com/news,002168,339622339.html",2016-04-22 21:59:35,我只想问一句，002168停牌有谁知道，让你们知道的这些消息，已经在开始讲故事了，各位也知道，大宗交易，是要打折的，19元是公开标的价，如果5折，会是什么结果呢，你会花19块去买8块的股吗，
8.89元溢价114%=?我不会算，哪位算算,"https://guba.eastmoney.com/news,002168,339501794.html",2016-04-22 18:07:35,停牌前8.89元，信中利溢价114%买进股份，是不是19元？你们算算是多少？迷糊了。敝人认为一定是为360定身量制。只有这样的流通盘才能装下2000亿以上市值。
就冲着和老大一起出访。股价也是低了。,"https://guba.eastmoney.com/news,002168,339602044.html",2016-04-22 21:31:49,就冲着和老大一起出访。股价也是低了。
买股票就是看大股东的实力。信中利19。买的。难道做亏本生意。控制人为了几个钱。弄,"https://guba.eastmoney.com/news,002168,339607964.html",2016-04-22 21:39:47,买股票就是看大股东的实力。信中利19。买的。难道做亏本生意。控制人为了几个钱。弄虚作假。坏了自己的名声。弄不好要做老的。
早上13.8卖了，搞得中午饭都吃不下,"https://guba.eastmoney.com/news,002168,339477065.html",2016-04-22 17:05:52,早上13.8卖了，搞得中午饭都吃不下
