标题,链接,发布时间,内容
不涨停，这个操手不咋地,"https://guba.eastmoney.com/news,300537,813191439.html",2019-04-01 10:01:42,不涨停，这个操手不咋地
该拉的时候，又吃米田共了,"https://guba.eastmoney.com/news,300537,813178344.html",2019-04-01 09:42:48,该拉的时候，又吃米田共了
广信材料300537强势整理反复向上可能性大！,"https://guba.eastmoney.com/news,300537,805092060.html",2019-02-20 20:19:19,广信材料300537强势整理反复向上可能性大！
真能作,"https://guba.eastmoney.com/news,300537,812875077.html",2019-03-29 13:41:24,该加速的位置不加速，还要玩凹口，这要玩死了，就是作的，加速，不犹豫，鼓励一下
要跳水了嘛,"https://guba.eastmoney.com/news,300537,812600250.html",2019-03-28 16:19:35,要跳水了嘛
没人敢买了，庄家自己害自己,"https://guba.eastmoney.com/news,300537,812199135.html",2019-03-27 14:03:04,没人敢买了，庄家自己害自己
差,"https://guba.eastmoney.com/news,300537,812197779.html",2019-03-27 14:00:54,差
又一个子公司这么多应收账款，如果能收回来，利润将大幅提升，说明收购以前这控股公司,"https://guba.eastmoney.com/news,300537,811968772.html",2019-03-26 19:37:11,又一个子公司这么多应收账款，如果能收回来，利润将大幅提升，说明收购以前这控股公司管理混乱，应收账款如此之大，竟然到现在起诉，早去哪了，也有可能这个就是个局，监管层还是要关注一下
总的来看300537股票走势底气不足、涨势乏力、动能不强！,"https://guba.eastmoney.com/news,300537,811676529.html",2019-03-25 19:23:02,总的来看300537股票走势底气不足、涨势乏力、动能不强！
一看此吧，都是新人,"https://guba.eastmoney.com/news,300537,811733937.html",2019-03-26 08:40:47,初生牛犊不怕虎，一拨新茬韭菜，大股东磨刀霍霍收购忙
这一坨屎没指望了,"https://guba.eastmoney.com/news,300537,811559554.html",2019-03-25 13:31:25,这一坨屎没指望了
今天一字板,"https://guba.eastmoney.com/news,300537,810921747.html",2019-03-22 03:00:53,今天一字板
瘪崽子，有种跌到11元，,"https://guba.eastmoney.com/news,300537,811576729.html",2019-03-25 14:00:59,瘪崽子，有种跌到11元，
李有名死跌,"https://guba.eastmoney.com/news,300537,811496646.html",2019-03-25 10:42:07,李有名死跌
这畜生股上市后没有做一件人事，收购的几家公司全部有问题,"https://guba.eastmoney.com/news,300537,811724389.html",2019-03-26 07:01:33,这畜生股上市后没有做一件人事，收购的几家公司全部有问题
看了看广信的日K，涨了几块钱，真是可以割韭菜了 开割正当时，别累死,"https://guba.eastmoney.com/news,300537,811712649.html",2019-03-26 01:20:15,"看了看广信的日K，涨了几块钱，真是可以割韭菜了
开割正当时，别累死"
明天涨停,"https://guba.eastmoney.com/news,300537,811707568.html",2019-03-25 23:25:55,明天涨停
曾经该股中签，获利没跑，后来在该股上赔了N万，一直关注，就是为了有机会告他们！ ,"https://guba.eastmoney.com/news,300537,811711732.html",2019-03-26 00:50:50,"曾经该股中签，获利没跑，后来在该股上赔了N万，一直关注，就是为了有机会告他们！
别给我机会"
庄怕死,"https://guba.eastmoney.com/news,300537,811454978.html",2019-03-25 09:33:19,庄怕死
挨千刀的,"https://guba.eastmoney.com/news,300537,811620031.html",2019-03-25 14:59:39,挨千刀的
这股不错。现在减持。7月解禁。都是好事。呵呵。,"https://guba.eastmoney.com/news,300537,811683652.html",2019-03-25 20:14:17,跑吧。
怎么小盘,"https://guba.eastmoney.com/news,300537,811513418.html",2019-03-25 11:13:28,怎么小盘
腊鸡股，果然只会跌,"https://guba.eastmoney.com/news,300537,811473456.html",2019-03-25 10:02:37,腊鸡股，果然只会跌
同属化学原料及制品制造业300537股价表现相对300576差距比较大！,"https://guba.eastmoney.com/news,300537,811262495.html",2019-03-23 10:31:08,同属化学原料及制品制造业300537股价表现相对300576差距比较大！
募集资金什么时候能投产,"https://guba.eastmoney.com/news,300537,811205780.html",2019-03-22 21:52:54,募集资金什么时候能投产
跌是一起跌的，不是说没涨的就不会跌，基本面太差了,"https://guba.eastmoney.com/news,300537,811030626.html",2019-03-22 11:20:54,跌是一起跌的，不是说没涨的就不会跌，基本面太差了
散了吧,"https://guba.eastmoney.com/news,300537,811015756.html",2019-03-22 10:57:31,散了吧
大家都散了吧,"https://guba.eastmoney.com/news,300537,811001235.html",2019-03-22 10:34:38,这个票等9月份全部解禁才会涨！
明天一字板开盘,"https://guba.eastmoney.com/news,300537,810829276.html",2019-03-21 15:26:50,"
"
拿出我一年的工资支持你一下，就5万元,"https://guba.eastmoney.com/news,300537,810809993.html",2019-03-21 14:50:21,拿出我一年的工资支持你一下，就5万元
在10分钱上下耽误时间，可怜的孩子。,"https://guba.eastmoney.com/news,300537,810786080.html",2019-03-21 14:17:33,在10分钱上下耽误时间，可怜的孩子。
怎么好行情，搞得怎样，庄是否有前科,"https://guba.eastmoney.com/news,300537,810682134.html",2019-03-21 10:34:31,怎么好行情，搞得怎样，庄是否有前科
股价涨都没涨，就有40多倍的市盈率，可见这股票的业绩多差了，正宗下水道股票，股友,"https://guba.eastmoney.com/news,300537,810643928.html",2019-03-21 09:39:07,股价涨都没涨，就有40多倍的市盈率，可见这股票的业绩多差了，正宗下水道股票，股友别碰呀
这是正宗的，垃圾股，退市股，千万别碰,"https://guba.eastmoney.com/news,300537,810434064.html",2019-03-20 14:48:36,这是正宗的，垃圾股，退市股，千万别碰
上市二年多，没有任何业绩，蒙骗坑害股民,"https://guba.eastmoney.com/news,300537,810305679.html",2019-03-20 10:41:49,上市二年多，没有任何业绩，蒙骗坑害股民
千万别买这个公司股票了，各位股友，亲身经历，被坑惨了，向证监会举报这家公司,"https://guba.eastmoney.com/news,300537,810332067.html",2019-03-20 11:23:37,千万别买这个公司股票了，各位股友，亲身经历，被坑惨了，向证监会举报这家公司
留有资金，准备60日线全仓买进。,"https://guba.eastmoney.com/news,300537,810387687.html",2019-03-20 13:40:55,留有资金，准备60日线全仓买进。
告这个狗垃圾,"https://guba.eastmoney.com/news,300537,810305073.html",2019-03-20 10:40:38,告这个狗垃圾
看样子一季报肯定不好，大家要小心了,"https://guba.eastmoney.com/news,300537,810182354.html",2019-03-19 20:55:43,看样子一季报肯定不好，大家要小心了
从上骗到下，这种公司也能上市？烂到根了,"https://guba.eastmoney.com/news,300537,810160713.html",2019-03-19 18:38:23,从上骗到下，这种公司也能上市？烂到根了
草！什么人还在出啊？,"https://guba.eastmoney.com/news,300537,810099463.html",2019-03-19 14:36:43,草！什么人还在出啊？
蓬缺必补，17块那个缺口迟早是要补的。,"https://guba.eastmoney.com/news,300537,810083537.html",2019-03-19 14:06:30,蓬缺必补，17块那个缺口迟早是要补的。
王八蛋公司，买了这个血本无归,"https://guba.eastmoney.com/news,300537,810078432.html",2019-03-19 13:56:07,王八蛋公司，买了这个血本无归
最弱的5G,"https://guba.eastmoney.com/news,300537,810075727.html",2019-03-19 13:50:27,最弱的5G
这鸟样，太磨人！拉一下解解套立马就走人,"https://guba.eastmoney.com/news,300537,810062444.html",2019-03-19 13:23:54,这鸟样，太磨人！拉一下解解套立马就走人
之前一轮上涨期间，买了这个股票的都吃大亏了，个个哭昏在厕所，远远被创业板大盘抛在,"https://guba.eastmoney.com/news,300537,810024265.html",2019-03-19 11:04:26,之前一轮上涨期间，买了这个股票的都吃大亏了，个个哭昏在厕所，远远被创业板大盘抛在后十八条街。
套盘那么多吗,"https://guba.eastmoney.com/news,300537,809829287.html",2019-03-18 14:48:37,套盘那么多吗
卖盘重，一拉就有出货,"https://guba.eastmoney.com/news,300537,809802487.html",2019-03-18 14:11:03,卖盘重，一拉就有出货
查看了一下，两市有社保资金而又没有大幅连板拉升的股票只有广信材料了。历史告许我们,"https://guba.eastmoney.com/news,300537,809783912.html",2019-03-18 13:38:42,查看了一下，两市有社保资金而又没有大幅连板拉升的股票只有广信材料了。历史告许我们，社保资金看中的票连续拉升不会不来，只有迟来。
快跑，要跳水了,"https://guba.eastmoney.com/news,300537,809782918.html",2019-03-18 13:36:37,快跑，要跳水了
5G得延伸产品，今天已经开始异动，沃特股份最先拉板。,"https://guba.eastmoney.com/news,300537,809756569.html",2019-03-18 11:52:27,5G得延伸产品，今天已经开始异动，沃特股份最先拉板。
纯粹一个骗子垃圾公司,"https://guba.eastmoney.com/news,300537,809745335.html",2019-03-18 11:18:21,纯粹一个骗子垃圾公司
一坨屎,"https://guba.eastmoney.com/news,300537,809741107.html",2019-03-18 11:10:04,一坨屎
隔壁老王，看涨,"https://guba.eastmoney.com/news,300537,809650605.html",2019-03-17 23:16:14,隔壁老王，看涨
我说会曲线那玩艺你信吗？,"https://guba.eastmoney.com/news,300537,809490893.html",2019-03-15 22:49:03,我说会曲线那玩艺你信吗？
人在做天在看,"https://guba.eastmoney.com/news,300537,809432778.html",2019-03-15 14:59:44,庄家去看看容大现在是什么价位，别做的太绝，浪费这么好的行情！
什么时候证监会来查一下，这个公司怎么可以上市的，一点都不规范，这么长时间了，也不,"https://guba.eastmoney.com/news,300537,809420159.html",2019-03-15 14:40:06,什么时候证监会来查一下，这个公司怎么可以上市的，一点都不规范，这么长时间了，也不公布股东户数
公司一直强调是华为供应商以及5G油墨供应商，希望业绩能大幅提升,"https://guba.eastmoney.com/news,300537,809403762.html",2019-03-15 14:10:02,公司一直强调是华为供应商以及5G油墨供应商，希望业绩能大幅提升
继续下垂,"https://guba.eastmoney.com/news,300537,809384738.html",2019-03-15 13:35:43,继续下垂
没人关注,"https://guba.eastmoney.com/news,300537,809353847.html",2019-03-15 11:27:55,没人关注
给力，来个涨停,"https://guba.eastmoney.com/news,300537,809311210.html",2019-03-15 10:13:22,给力，来个涨停
明天纸开跟进，先做个短线。,"https://guba.eastmoney.com/news,300537,809254367.html",2019-03-14 23:13:30,明天纸开跟进，先做个短线。
哥12.95的，放心！！！,"https://guba.eastmoney.com/news,300537,809131820.html",2019-03-14 13:37:24,哥12.95的，放心！！！
嗯嗯，跌停我0K，,"https://guba.eastmoney.com/news,300537,809131101.html",2019-03-14 13:35:56,嗯嗯，跌停我0K，
自娱自乐,"https://guba.eastmoney.com/news,300537,809130469.html",2019-03-14 13:34:34,自娱自乐
这一轮远远落后创业板大盘，无耻垃圾公司,"https://guba.eastmoney.com/news,300537,809117812.html",2019-03-14 13:07:36,这一轮远远落后创业板大盘，无耻垃圾公司
互动平台提问，公司上市是利国利民还是利了孙力这种爆富之人？,"https://guba.eastmoney.com/news,300537,809077692.html",2019-03-14 10:52:22,互动平台提问，公司上市是利国利民还是利了孙力这种爆富之人？
什么叫易跌不涨股，这垃圾就是其中之一，怎么上市的？这种股上市有尼玛什么意义？,"https://guba.eastmoney.com/news,300537,809072545.html",2019-03-14 10:45:19,什么叫易跌不涨股，这垃圾就是其中之一，怎么上市的？这种股上市有尼玛什么意义？
12元买入，准备涨到30卖,"https://guba.eastmoney.com/news,300537,808966986.html",2019-03-13 20:12:36,"12元买，准备涨到30卖
"
次轮严重跑输创业板大盘,"https://guba.eastmoney.com/news,300537,808873754.html",2019-03-13 14:04:31,次轮严重跑输创业板大盘
王八蛋，想着有补涨，没想到反跌。,"https://guba.eastmoney.com/news,300537,808870407.html",2019-03-13 13:58:42,王八蛋，想着有补涨，没想到反跌。
这股也没人玩啊！可怜！可怜！,"https://guba.eastmoney.com/news,300537,808032100.html",2019-03-08 15:27:06,这股也没人玩啊！可怜！可怜！
哥姐妹，都从了吧！,"https://guba.eastmoney.com/news,300537,808825414.html",2019-03-13 11:32:38,哥姐妹，都从了吧！
股票涨也好，跌也好；当下经济不好，5G风口浪尖，智能家居，航空航天以及新能源汽车,"https://guba.eastmoney.com/news,300537,808697333.html",2019-03-12 19:37:46,股票涨也好，跌也好；当下经济不好，5G风口浪尖，智能家居，航空航天以及新能源汽车，广信材料特重油墨应该切入这些市场，安心做实业，才是王道，这样每个人最后都是赢家
截止3月10日公司的股东户数是多少？谢谢！,"https://guba.eastmoney.com/news,300537,809192169.html",2019-03-14 15:09:00,"截止3月10日公司的股东户数是多少？谢谢！
广信材料
广信材料：公司会在定期报告中披露股东人数，谢谢！
(来自深交所互动易)答复时间 2019-03-14 15:09:00"
涨就这样了,"https://guba.eastmoney.com/news,300537,808469249.html",2019-03-12 07:36:44,涨就这样了
次新都拉，就你不拉,"https://guba.eastmoney.com/news,300537,807604502.html",2019-03-07 11:02:32,次新都拉，就你不拉
容大感光的跟屁虫哦[哭],"https://guba.eastmoney.com/news,300537,808297761.html",2019-03-11 11:19:12,容大感光的跟屁虫哦
哈哈，给加仓的机会了,"https://guba.eastmoney.com/news,300537,807893056.html",2019-03-08 10:48:08,哈哈，给加仓的机会了
公司油墨应用狭窄，目前只应用于PCB印刷电路板，光刻胶没有产能。,"https://guba.eastmoney.com/news,300537,807880145.html",2019-03-08 10:29:26,公司前途有限
看看明天咋开盘,"https://guba.eastmoney.com/news,300537,807743368.html",2019-03-07 16:48:45,"流通盘子、题材、业绩、底部成交量都不错，为啥走的这么弱呢？
现在都还没上年线"
王八蛋，每次都是高位放套。,"https://guba.eastmoney.com/news,300537,807707490.html",2019-03-07 14:48:17,王八蛋，每次都是高位放套。
华为战略供应商不起来，那李总要反思了，去年5月份发声的文章还在网上呢,"https://guba.eastmoney.com/news,300537,807637115.html",2019-03-07 12:59:20,华为战略供应商不起来，那李总要反思了，去年5月份发声的文章还在网上呢
担保欠钱的康尼机电都涨停板，垃圾啊,"https://guba.eastmoney.com/news,300537,807636281.html",2019-03-07 12:54:52,担保欠钱的康尼机电都涨停板，垃圾啊
正宗垃圾,"https://guba.eastmoney.com/news,300537,807617211.html",2019-03-07 11:25:28,正宗垃圾
心有多大，舞台才会更大，各路庄稼机构共勉。,"https://guba.eastmoney.com/news,300537,807578746.html",2019-03-07 10:22:54,一会满血复活，高价增发的机构共进退。
明后天冲击年线,"https://guba.eastmoney.com/news,300537,807444748.html",2019-03-06 15:41:08,和容大、东方材料比较，广信该表现表现了！
踏空的渣渣怎么不喊空了，哈哈哈哈哈哈哈哈哈哈哈哈哈哈,"https://guba.eastmoney.com/news,300537,807444145.html",2019-03-06 15:38:03,"踏空的渣渣怎么不喊空了，哈哈哈哈哈哈哈哈哈哈哈哈哈哈
"
踏空的渣渣怎么不骂了，哈哈哈哈哈哈哈哈哈哈哈哈哈哈,"https://guba.eastmoney.com/news,300537,807441528.html",2019-03-06 15:27:29,"踏空的渣渣怎么不骂了，哈哈哈哈哈哈哈哈哈哈哈哈哈哈
"
今天暴跌呀！大盘到顶了，赶紧跑！,"https://guba.eastmoney.com/news,300537,807297127.html",2019-03-06 10:13:39,"今天暴跌呀！大盘到顶了，赶紧跑！
"
踏空的天天骂 真可怜 踏空的天天骂 真可怜 踏空的天天骂 真可怜,"https://guba.eastmoney.com/news,300537,807375650.html",2019-03-06 13:33:29,"踏空的天天骂 真可怜 踏空的天天骂 真可怜 踏空的天天骂 真可怜　
"
踏空者吃不到葡萄说葡萄酸 踏空者吃不到葡萄说葡萄酸 踏空者吃不到葡萄说葡萄酸,"https://guba.eastmoney.com/news,300537,807375094.html",2019-03-06 13:32:34,"踏空者吃不到葡萄说葡萄酸 踏空者吃不到葡萄说葡萄酸 踏空者吃不到葡萄说葡萄酸
"
满上 满上 满上 满上 满上 满上 满上 满上 满上 满上 满上 满上 满上,"https://guba.eastmoney.com/news,300537,807374672.html",2019-03-06 13:31:53,"满上 满上 满上 满上 满上 满上 满上 满上 满上 满上 满上 满上 满上　
"
重大利好：国家对制造业企业大幅减税！！！,"https://guba.eastmoney.com/news,300537,807374387.html",2019-03-06 13:31:33,"

重大利好：国家对制造业企业大幅减税！！！
"
涨停 涨停 涨停 涨停 涨停 涨停 涨停 涨停 涨停,"https://guba.eastmoney.com/news,300537,807373668.html",2019-03-06 13:30:23,"

涨停 涨停 涨停 涨停 涨停 涨停 涨停 涨停 涨停
"
冲啊 冲啊 冲啊 冲啊 冲啊 冲啊 冲啊 冲啊 冲啊,"https://guba.eastmoney.com/news,300537,807373477.html",2019-03-06 13:29:50,"

冲啊 冲啊 冲啊 冲啊 冲啊 冲啊 冲啊 冲啊 冲啊
"
牛来了 牛来了 牛来了 牛来了 牛来了 牛来了 牛,"https://guba.eastmoney.com/news,300537,807373890.html",2019-03-06 13:30:48,"

牛来了 牛来了 牛来了 牛来了 牛来了 牛来了 牛
"
这个王八，大盘跌就假惺惺的样子，畜生，前二天怎么不跟着涨,"https://guba.eastmoney.com/news,300537,807288037.html",2019-03-06 10:00:27,这个王八，大盘跌就假惺惺的样子，畜生，前二天怎么不跟着涨
创业板18天暴涨37%管理层你们是畜生,"https://guba.eastmoney.com/news,300537,807231106.html",2019-03-05 22:34:53,创业板18天暴涨37%管理层你们是畜生
这样的行情，庄家并没有拉，应该未来走极端,"https://guba.eastmoney.com/news,300537,807215950.html",2019-03-05 20:39:45,这样的行情，庄家并没有拉，应该未来走极端
上市来就这样诈骗,"https://guba.eastmoney.com/news,300537,807164263.html",2019-03-05 15:02:52,上市来就这样诈骗
去死吧，王八股,"https://guba.eastmoney.com/news,300537,807153984.html",2019-03-05 14:47:08,去死吧，王八股
小庄又流脓了,"https://guba.eastmoney.com/news,300537,807119916.html",2019-03-05 13:47:35,小庄又流脓了
广信材料过了17.6绝对有行情。,"https://guba.eastmoney.com/news,300537,756424980.html",2018-04-21 12:13:35,长短兼备 先撸个板再说
没有一天跑赢大盘的,"https://guba.eastmoney.com/news,300537,807031376.html",2019-03-05 09:51:56,没有一天跑赢大盘的
欺诈型垃圾公司！,"https://guba.eastmoney.com/news,300537,807028946.html",2019-03-05 09:47:50,欺诈型垃圾公司！
王八蛋，创业板大盘1600了，这个王八还在跌不停！,"https://guba.eastmoney.com/news,300537,807023795.html",2019-03-05 09:37:57,王八蛋，创业板大盘1600了，这个王八还在跌不停！
请问截止2月28日公司的股东户数是多少？谢谢！,"https://guba.eastmoney.com/news,300537,809192159.html",2019-03-14 15:09:00,"请问截止2月28日公司的股东户数是多少？谢谢！
广信材料
广信材料：公司会在定期报告中披露股东人数，谢谢！
(来自深交所互动易)答复时间 2019-03-14 15:09:00"
随波逐流的股票，我走啦，留下的朋友发财。,"https://guba.eastmoney.com/news,300537,806922405.html",2019-03-04 14:54:32,随波逐流的股票，我走啦，留下的朋友发财。
这股盘子太大，拉不动啊！哈哈哈！,"https://guba.eastmoney.com/news,300537,806854954.html",2019-03-04 12:26:02,这股盘子太大，拉不动啊！哈哈哈！
此时不拉等待何时,"https://guba.eastmoney.com/news,300537,806878855.html",2019-03-04 13:38:21,此时不拉等待何时
直接拉稀了，搞什么,"https://guba.eastmoney.com/news,300537,806898426.html",2019-03-04 14:14:29,直接拉稀了，搞什么
有本事等大盘4000了你还原地爬着，我全仓回来买,"https://guba.eastmoney.com/news,300537,806860063.html",2019-03-04 12:59:38,有本事等大盘4000了你还原地爬着，我全仓回来买
都在借势涨停，这股死了[哭],"https://guba.eastmoney.com/news,300537,806800202.html",2019-03-04 10:11:40,都在借势涨停，这股死了
辣鸡 大辣鸡,"https://guba.eastmoney.com/news,300537,806545747.html",2019-03-01 11:25:53,辣鸡 大辣鸡
每股收益0.2673元，净资产6.5476元，是绩优股吗？,"https://guba.eastmoney.com/news,300537,806213673.html",2019-02-27 17:44:19,"300057广信，2018年每股收0.2673，同比下降24%。
每股净资产6.5476元，每股公积金4.3元
这样的股票算是绩优股吗？
我是新股民，请教老师们。
能买进吗？"
广信材料股价超过容大感光是必然和必须的！,"https://guba.eastmoney.com/news,300537,806246226.html",2019-02-27 22:20:06,广信材料股价超过容大感光是必然和必须的！
此股的特性是长的特别慢，但跌起来特别的快，还不是一般的快，真是不可思意。,"https://guba.eastmoney.com/news,300537,806144560.html",2019-02-27 13:50:02,此股的特性是长的特别慢，但跌起来特别的快，还不是一般的快，真是不可思意。
