标题,链接,发布时间,内容
劳资的新股还在，有本事把哥洗出去。8000来块钱不要了,"https://guba.eastmoney.com/news,300837,940448606.html",2020-06-22 13:06:20,劳资的新股还在，有本事把哥洗出去。8000来块钱不要了
安宁就是浙矿的样板！,"https://guba.eastmoney.com/news,300837,940474339.html",2020-06-22 13:49:47,安宁就是浙矿的样板！
明天,"https://guba.eastmoney.com/news,300837,940547042.html",2020-06-22 16:54:18,明天
这是一个煤矿，产能过剩,"https://guba.eastmoney.com/news,300837,940540920.html",2020-06-22 16:22:43,这是一个煤矿，产能过剩
江浙新股，第二次上大当！余生再也不敢碰那一带的新股了！,"https://guba.eastmoney.com/news,300837,940507514.html",2020-06-22 14:42:51,江浙新股，第二次上大当！余生再也不敢碰那一带的新股了！
今天建仓的，明天加仓百分之20,"https://guba.eastmoney.com/news,300837,940535441.html",2020-06-22 15:55:16,今天建仓的，明天加仓百分之20
买了100股，明天割肉了！太弱！,"https://guba.eastmoney.com/news,300837,940533760.html",2020-06-22 15:48:14,买了100股，明天割肉了！太弱！
千载难逢，中了500股，涨跌我都无所谓，不就那么多，留着心安慰,"https://guba.eastmoney.com/news,300837,940440469.html",2020-06-22 12:29:31,千载难逢，中了500股，涨跌我都无所谓，不就那么多，留着心安慰
天鲲都不能帮助你起飞。,"https://guba.eastmoney.com/news,300837,940478565.html",2020-06-22 13:56:21,天鲲都不能帮助你起飞。
跌停收盘,"https://guba.eastmoney.com/news,300837,940480835.html",2020-06-22 14:00:20,跌停收盘
