标题,链接,发布时间,内容
量萎缩今天倒霉是肯定。。,"https://guba.eastmoney.com/news,600074,737644125.html",2017-12-20 03:24:58,量萎缩今天倒霉是肯定。。
流虻公司！,"https://guba.eastmoney.com/news,600074,716897212.html",2017-10-13 13:25:47,流虻公司！
相信庄家 大家一起来挣钱。,"https://guba.eastmoney.com/news,600074,737643134.html",2017-12-20 03:07:02,相信庄家 大家一起来挣钱。
董秘，周晧林。要么不辞而别，要么被两派争夺控制权逼疯了。也是一个可怜之人，大家也,"https://guba.eastmoney.com/news,600074,728201920.html",2017-11-14 20:48:49,董秘，周晧林。要么不辞而别，要么被两派争夺控制权逼疯了。也是一个可怜之人，大家也别骂他了。
停牌还这么热闹，不急出来,"https://guba.eastmoney.com/news,600074,716962699.html",2017-10-13 15:45:11,停牌还这么热闹，不急出来
方大炭素是不是要回调。,"https://guba.eastmoney.com/news,600074,737639174.html",2017-12-20 01:56:38,方大炭素是不是要回调。
这时上市谁都死,"https://guba.eastmoney.com/news,600074,735883086.html",2017-12-11 08:53:16,这时上市谁都死，负面消息一堆堆，如果上市后市问题更多，还不如等。。。有好的买家资金注入是最好。
今天挂.能买到吗？。,"https://guba.eastmoney.com/news,600074,728893888.html",2017-11-16 11:45:36,今天挂.能买到吗？。
保千里就是信任和流动性危机，换控制股东重新做人，注入流动资金盘活业务，肯定能走出,"https://guba.eastmoney.com/news,600074,737580710.html",2017-12-19 17:47:04,"保千里就是信任和流动性危机，换控制股东重新做人，注入流动资金盘活业务，肯定能走出来的
大部分人可能会割在地板上"
作为持股者,"https://guba.eastmoney.com/news,600074,717338398.html",2017-10-15 22:38:51,"无论出于什么心,都会支持所持股票公司才正常,你可以说出于正义指出公司问题,但相信之人不是弱智便是撞坏了个脑。"
大家都着挨板吧！哎,"https://guba.eastmoney.com/news,600074,735851750.html",2017-12-10 21:23:04,大家都着挨板吧！哎
这副牌至少5个跌停板以上没得跑,"https://guba.eastmoney.com/news,600074,737623118.html",2017-12-19 22:28:52,这副牌至少5个跌停板以上没得跑
散户多[想一下]。,"https://guba.eastmoney.com/news,600074,737618536.html",2017-12-19 21:49:01,散户多。
保千里会不会是第二个欣泰电气？想想都怕……,"https://guba.eastmoney.com/news,600074,737494312.html",2017-12-19 12:35:12,保千里会不会是第二个欣泰电气？想想都怕……
证券最近经,"https://guba.eastmoney.com/news,600074,721110405.html",2017-10-24 13:07:03,证券最近经
