标题,链接,发布时间,内容
历史又迎新起点，金锅铁底潜龙升！,"https://guba.eastmoney.com/news,600197,588532776.html",2017-01-16 13:39:58,太可怕了，这股价值这么高！
[心碎]准备拉了,"https://guba.eastmoney.com/news,600197,588527784.html",2017-01-16 13:31:25,[心碎]准备拉了
干，一个字,"https://guba.eastmoney.com/news,600197,588414079.html",2017-01-16 09:50:22,干，一个字
还是现金申购好。这样起码冻结的资金不会缩水，何况现在中签率比以前更低了,"https://guba.eastmoney.com/news,600197,588189847.html",2017-01-14 13:29:53,还是现金申购好。这样起码冻结的资金不会缩水，何况现在中签率比以前更低了
什么数据都比同行青青稞酒高，股价却比人家低3块左右每股为什么？为什么？为什么？请,"https://guba.eastmoney.com/news,600197,563269171.html",2016-10-28 17:05:28,什么数据都比同行青青稞酒高，股价却比人家低3块左右每股为什么？为什么？为什么？请老股民解释一下！我觉得此股潜力股！对吗？
