标题,链接,发布时间,内容
就爱这口,"https://guba.eastmoney.com/news,600238,970254756.html",2020-10-12 23:07:17,就爱这口
肯定搞免税店,"https://guba.eastmoney.com/news,600238,970064106.html",2020-10-12 10:46:47,肯定搞免税店
椰岛白酒，口感不错,"https://guba.eastmoney.com/news,600238,970213329.html",2020-10-12 19:05:20,椰岛白酒，口感不错
椰岛酒,"https://guba.eastmoney.com/news,600238,970140108.html",2020-10-12 14:13:17,椰岛酒
椰岛酒厂，好,"https://guba.eastmoney.com/news,600238,969970478.html",2020-10-11 20:41:00,椰岛酒厂，好
年底前 加大关注椰岛 个人观点,"https://guba.eastmoney.com/news,600238,969201375.html",2020-10-02 13:24:58,
这个下跌通道上轨好滑溜啊！操盘手画得一手好线！,"https://guba.eastmoney.com/news,600238,969758996.html",2020-10-09 15:07:55,这个下跌通道上轨好滑溜啊！操盘手画得一手好线！
海南椰岛变成今天这个样子，到底是谁的责任？,"https://guba.eastmoney.com/news,600238,969631973.html",2020-10-09 09:32:28,海南椰岛变成今天这个样子，到底是谁的责任？
全是钉子户，哪来的上百手卖单，简直就是扯蛋！,"https://guba.eastmoney.com/news,600238,969648851.html",2020-10-09 09:58:34,全是钉子户，哪来的上百手卖单，简直就是扯蛋！
海南要发展，必须做大做强国资,"https://guba.eastmoney.com/news,600238,969135745.html",2020-10-01 13:14:27,海南要发展，必须做大做强国资
冯彪一幅贪相，又无能，拖累了椰岛,"https://guba.eastmoney.com/news,600238,969048715.html",2020-09-30 16:08:28,冯彪一幅贪相，又无能，拖累了椰岛
北大仓君妃酒是民企，,"https://guba.eastmoney.com/news,600238,969018771.html",2020-09-30 14:43:19,北大仓君妃酒是民企，
还是椰岛好。有涨有跌。,"https://guba.eastmoney.com/news,600238,969025804.html",2020-09-30 14:56:54,还是椰岛好。有涨有跌。
[图片],"https://guba.eastmoney.com/news,600238,968958034.html",2020-09-30 13:11:13,[图片]
海南马世界合作伙伴玉龙马业才是专业养马的，罗牛山一个养猪的懂个锤子？椰岛还手握一,"https://guba.eastmoney.com/news,600238,968820370.html",2020-09-30 03:34:19,海南马世界合作伙伴玉龙马业才是专业养马的，罗牛山一个养猪的懂个锤子？椰岛还手握一张体彩执照，这个风口都涨不动，真的看不明白了！！！
北大仓君妃酒是酱香型白酒，茅台也是酱香型白酒。酱香型白酒可以做大做强。赶紧收购北,"https://guba.eastmoney.com/news,600238,968916936.html",2020-09-30 10:53:46,北大仓君妃酒是酱香型白酒，茅台也是酱香型白酒。酱香型白酒可以做大做强。赶紧收购北大仓君妃酒啊！
北大仓君妃酒为你报时,"https://guba.eastmoney.com/news,600238,968914892.html",2020-09-30 10:51:32,北大仓君妃酒为你报时
大过节的还来砸单，打算买棺材吗？,"https://guba.eastmoney.com/news,600238,968864463.html",2020-09-30 09:42:08,大过节的还来砸单，打算买棺材吗？
你不是说你有一个赛马小镇项目？你是随跌不随涨啊？酿酒起飞没你事，彩票概念没你事，,"https://guba.eastmoney.com/news,600238,968688516.html",2020-09-29 14:00:59,你不是说你有一个赛马小镇项目？你是随跌不随涨啊？酿酒起飞没你事，彩票概念没你事，现在赛马概念也没你啥事
还没被抓进去啊,"https://guba.eastmoney.com/news,600238,968589576.html",2020-09-29 10:05:59,还没被抓进去啊
我上车了。,"https://guba.eastmoney.com/news,600238,958225204.html",2020-08-24 14:45:34,我上车了。
北大仓君妃酒为你报时,"https://guba.eastmoney.com/news,600238,968620274.html",2020-09-29 10:52:01,北大仓君妃酒为你报时
干脆把黑龙江省的北大仓君妃酒收购了。北大仓君妃酒是酱香型白酒，前途广大，值得收购,"https://guba.eastmoney.com/news,600238,968610057.html",2020-09-29 10:35:44,干脆把黑龙江省的北大仓君妃酒收购了。北大仓君妃酒是酱香型白酒，前途广大，值得收购啊！
节日喜庆气氛的阴暗面,"https://guba.eastmoney.com/news,600238,968606895.html",2020-09-29 10:29:52,节日喜庆气氛的阴暗面
作死了,"https://guba.eastmoney.com/news,600238,968585913.html",2020-09-29 10:01:20,作死了
海口大曲真是难喝,"https://guba.eastmoney.com/news,600238,967807192.html",2020-09-25 11:38:38,海口大曲真是难喝
太没人气了,"https://guba.eastmoney.com/news,600238,968434078.html",2020-09-28 16:19:39,太没人气了
上星期出了3000手，今天又是4000手，哪个大佬退场了？,"https://guba.eastmoney.com/news,600238,968367273.html",2020-09-28 14:05:30,上星期出了3000手，今天又是4000手，哪个大佬退场了？
五块多的本，怎么搞啊,"https://guba.eastmoney.com/news,600238,967946388.html",2020-09-25 17:32:26,五块多的本，怎么搞啊
衡水老白干要入股吗,"https://guba.eastmoney.com/news,600238,967946275.html",2020-09-25 17:31:33,衡水老白干要入股吗
没救了,"https://guba.eastmoney.com/news,600238,967880253.html",2020-09-25 14:25:06,没救了
大胆干吧。外围一片大好,"https://guba.eastmoney.com/news,600238,967799165.html",2020-09-25 11:24:49,大胆干吧。外围一片大好
这个人是谁？,"https://guba.eastmoney.com/news,600238,967686199.html",2020-09-25 08:48:20,这个人是谁？
消费板块耻辱的存在,"https://guba.eastmoney.com/news,600238,967533787.html",2020-09-24 14:41:17,基本上是酒类，消费品类唯一做成这个球样的
看看椰岛分时脉博。只有一个人在战斗。,"https://guba.eastmoney.com/news,600238,967460687.html",2020-09-24 12:08:32,看看椰岛分时脉博。只有一个人在战斗。
提个建议给椰岛！别做什么椰汁饮料了，你已经被椰树甩了几条街，永远干不过人家的。不,"https://guba.eastmoney.com/news,600238,967261906.html",2020-09-23 21:28:27,提个建议给椰岛！别做什么椰汁饮料了，你已经被椰树甩了几条街，永远干不过人家的。不如利用海岛地理优势养乌龟，龟甲，龟血，王8蛋都是大补药材，符合大健康理念，彪子就是龟头了。
一年多了，终于卖了一瓶海王酒！纪念一下！[胜利]业务员都不见了！劲酒都不知道卖了,"https://guba.eastmoney.com/news,600238,966902396.html",2020-09-22 18:40:35,一年多了，终于卖了一瓶海王酒！纪念一下！业务员都不见了！劲酒都不知道卖了多少！海王酒，价格贵，瓶子丑，设计太差了！
重大利好：中国中烟欲借壳椰岛上市，椰岛目前市值仅19亿，溢价5000倍以上,"https://guba.eastmoney.com/news,600238,967214992.html",2020-09-23 16:47:06,重大利好：中国中烟欲借壳椰岛上市，椰岛目前市值仅19亿，溢价5000倍以上
500箱鹿龟酒一抢而空,"https://guba.eastmoney.com/news,600238,967211049.html",2020-09-23 16:24:46,"今天看晚了。。。。没抢到。。。。






　　"
10分钟一根毛也没有，厉害了，再减持一会，减持100分钟,"https://guba.eastmoney.com/news,600238,967030842.html",2020-09-23 10:15:30,10分钟一根毛也没有，厉害了，再减持一会，减持100分钟
靠它了,"https://guba.eastmoney.com/news,600238,967003761.html",2020-09-23 09:43:52,靠它了
这个股好垃圾,"https://guba.eastmoney.com/news,600238,966857776.html",2020-09-22 15:14:20,这个股好垃圾
堂堂上市公司，都不如椰风，椰树等牌子响亮，弄得倒像是它们的山寨产品，老彪子你真让,"https://guba.eastmoney.com/news,600238,966786031.html",2020-09-22 13:26:31,堂堂上市公司，都不如椰风，椰树等牌子响亮，弄得倒像是它们的山寨产品，老彪子你真让大家寒心！
“白白嫩嫩，我从小喝到大”，一一椰岛椰汁，上市公司荣誉产品，股票代码600238,"https://guba.eastmoney.com/news,600238,966771491.html",2020-09-22 12:51:23,“白白嫩嫩，我从小喝到大”，一一椰岛椰汁，上市公司荣誉产品，股票代码600238，购买前请认准“椰岛”商标哦！
这个股票操盘手每天九点半上班。每天只许弄点差价发二百四十元工资，可以不跟大盘自由,"https://guba.eastmoney.com/news,600238,966763967.html",2020-09-22 12:07:33,这个股票操盘手每天九点半上班。每天只许弄点差价发二百四十元工资，可以不跟大盘自由发挥，自然波动。庄家出国办事被什么缠住了，目前只能这样。
下跌趋势依然形成，待企稳后开始反弹再进,"https://guba.eastmoney.com/news,600238,966707777.html",2020-09-22 10:21:32,下跌趋势依然形成，待企稳后开始反弹再进
朋友都醒醒吧！彪子是欠光大兴陇800多万，之前还欠各路债主，那可不是什么小数目，,"https://guba.eastmoney.com/news,600238,962712508.html",2020-09-08 10:29:03,朋友都醒醒吧！彪子是欠光大兴陇800多万，之前还欠各路债主，那可不是什么小数目，不然它也不会被轮候冻结。轮候是什么意思？都懂吗？
5.8的本这辈子有没有机会？,"https://guba.eastmoney.com/news,600238,966463957.html",2020-09-21 13:41:31,5.8的本这辈子有没有机会？
如果ST椰岛也养驴和养猪，股价一定涨很高！,"https://guba.eastmoney.com/news,600238,966378714.html",2020-09-21 10:13:13,如果ST椰岛也养驴和养猪，股价一定涨很高！
今天超市买一盒椰岛椰子9.9元！比椰树好感觉！,"https://guba.eastmoney.com/news,600238,966305959.html",2020-09-20 23:02:09,今天超市买一盒椰岛椰子9.9元！比椰树好感觉！
换到生益科技了,"https://guba.eastmoney.com/news,600238,966412313.html",2020-09-21 11:04:23,换到生益科技了
敢跌就买，敢涨就卖掉，哈哈！,"https://guba.eastmoney.com/news,600238,966405803.html",2020-09-21 10:52:55,敢跌就买，敢涨就卖掉，哈哈！
大厦比股，耽误我20％的利润。,"https://guba.eastmoney.com/news,600238,966393892.html",2020-09-21 10:34:32,大厦比股，耽误我20％的利润。
彪哥找到资源增发股份，搞起,"https://guba.eastmoney.com/news,600238,966351192.html",2020-09-21 09:37:37,彪哥找到资源增发股份，搞起
海南第五张免税牌发给椰岛了,"https://guba.eastmoney.com/news,600238,966055840.html",2020-09-18 15:02:35,海南第五张免税牌发给椰岛了
海南岛是最热的经济体。大量投资不断进场。,"https://guba.eastmoney.com/news,600238,966258438.html",2020-09-20 12:01:53,海南岛是最热的经济体。大量投资不断进场。
彪子卖货了,"https://guba.eastmoney.com/news,600238,966118686.html",2020-09-18 20:11:48,彪子卖货了
江湖骗子的他，印证了，天在看！,"https://guba.eastmoney.com/news,600238,886349389.html",2019-11-14 08:27:46,江湖骗子的他，印证了，天在看！
冯彪诈骗犯啊心里面虚啊,"https://guba.eastmoney.com/news,600238,946308344.html",2020-07-14 12:30:23,冯彪诈骗犯啊心里面虚啊
[图片],"https://guba.eastmoney.com/news,600238,959919367.html",2020-08-28 15:53:57,[图片]
海王,"https://guba.eastmoney.com/news,600238,966036833.html",2020-09-18 14:38:27,海王
全是套路………,"https://guba.eastmoney.com/news,600238,890420860.html",2019-12-06 11:57:21,"全是套路………
"
珍惜钱包，远离江湖骗子,"https://guba.eastmoney.com/news,600238,888115186.html",2019-11-23 17:08:01,珍惜钱包，远离江湖骗子
一个健康的灵魂里应该有有爱知识和勇气，相反从冯彪的一言一行看不见高贵的灵魂，处处,"https://guba.eastmoney.com/news,600238,941891492.html",2020-06-29 22:01:49,一个健康的灵魂里应该有有爱知识和勇气，相反从冯彪的一言一行看不见高贵的灵魂，处处谎话连篇，只有肮脏的骗局，贪婪的灵魂！上天会眷顾这样的人渣吗？
被二十日均线压的上不去。,"https://guba.eastmoney.com/news,600238,965931948.html",2020-09-18 11:12:37,被二十日均线压的上不去。
海王酒太甜了！,"https://guba.eastmoney.com/news,600238,966037226.html",2020-09-18 14:40:00,海王酒太甜了！
这个股票在玩1.2.3谁动谁是苟的游戏，来，都别买，4小时0成交,"https://guba.eastmoney.com/news,600238,966024759.html",2020-09-18 14:25:25,这个股票在玩1.2.3谁动谁是苟的游戏，来，都别买，4小时0成交
海王酒太甜了！,"https://guba.eastmoney.com/news,600238,966007295.html",2020-09-18 14:03:29,海王酒太甜了！
公司遲早會被玩死去！,"https://guba.eastmoney.com/news,600238,965989359.html",2020-09-18 13:37:47,公司遲早會被玩死去！
彪子身陷圈中，翻不过栏杆。,"https://guba.eastmoney.com/news,600238,965914640.html",2020-09-18 10:47:23,彪子身陷圈中，翻不过栏杆。
新希望养猪挣了大钱啊！发了大财啊！,"https://guba.eastmoney.com/news,600238,965938876.html",2020-09-18 11:23:36,新希望养猪挣了大钱啊！发了大财啊！
ST椰岛应该和万科A一样养猪挣钱！,"https://guba.eastmoney.com/news,600238,965906229.html",2020-09-18 10:37:33,ST椰岛应该和万科A一样养猪挣钱！
此股已废！,"https://guba.eastmoney.com/news,600238,965897719.html",2020-09-18 10:27:18,此股已废！
涨,"https://guba.eastmoney.com/news,600238,965882013.html",2020-09-18 10:07:58,涨
快快跑主力再逃小心被套啊,"https://guba.eastmoney.com/news,600238,965873040.html",2020-09-18 09:58:28,快快跑主力再逃小心被套啊
憨憨,"https://guba.eastmoney.com/news,600238,965655402.html",2020-09-17 14:03:53,憨憨
能像海马一样也发几个股价异动的公告吗，,"https://guba.eastmoney.com/news,600238,965652344.html",2020-09-17 13:59:55,能像海马一样也发几个股价异动的公告吗，
泄气了哟[撇嘴],"https://guba.eastmoney.com/news,600238,965631439.html",2020-09-17 13:30:56,泄气了哟
国资接手吧,"https://guba.eastmoney.com/news,600238,965521937.html",2020-09-17 10:03:59,国资接手吧
上蹦下窜的洗盘手法已经在椰岛上没反应了！基本上全是忠诚的钉子户！,"https://guba.eastmoney.com/news,600238,965559900.html",2020-09-17 10:49:40,上蹦下窜的洗盘手法已经在椰岛上没反应了！基本上全是忠诚的钉子户！
别跌呀！岛民们还等着喝我的庆功酒呢,"https://guba.eastmoney.com/news,600238,965544435.html",2020-09-17 10:29:00,别跌呀！岛民们还等着喝我的庆功酒呢
我感觉是对倒,"https://guba.eastmoney.com/news,600238,965506004.html",2020-09-17 09:48:47,我感觉是对倒
饮酒话多。咋天涨了点，今天开盘竞价居然又有数据了。,"https://guba.eastmoney.com/news,600238,965486956.html",2020-09-17 09:27:40,饮酒话多。咋天涨了点，今天开盘竞价居然又有数据了。
女并俩娘们儿，彪子真不想弄好椰岛了。,"https://guba.eastmoney.com/news,600238,965375285.html",2020-09-16 16:49:09,女并俩娘们儿，彪子真不想弄好椰岛了。
十一之前能涨到六元，我就买一箱鹿龟酒赏给大家！,"https://guba.eastmoney.com/news,600238,965353227.html",2020-09-16 15:14:15,十一之前能涨到六元，我就买一箱鹿龟酒赏给大家！
今天放量了,"https://guba.eastmoney.com/news,600238,965338790.html",2020-09-16 14:47:11,的
定制酒,"https://guba.eastmoney.com/news,600238,965281189.html",2020-09-16 13:20:18,定制酒
椰岛大股东持600155五千多万股，市值6亿多，为何不卖点还债呢？,"https://guba.eastmoney.com/news,600238,964325140.html",2020-09-12 07:37:55,就欠几百万，有钱为何不还
没必要这么洗吧？都是亏损户或是钉子户了，谁会交出筹码？,"https://guba.eastmoney.com/news,600238,965204023.html",2020-09-16 10:29:08,没必要这么洗吧？都是亏损户或是钉子户了，谁会交出筹码？
五粮液多少钱抄底？向石墨烯看齐！,"https://guba.eastmoney.com/news,600238,965200146.html",2020-09-16 10:24:31,五粮液多少钱抄底？向石墨烯看齐！
过节啦！送父母，长辈养生酒,"https://guba.eastmoney.com/news,600238,965168621.html",2020-09-16 09:50:08,过节啦！送父母，长辈养生酒
养生酒，老品牌，信赖就好！,"https://guba.eastmoney.com/news,600238,965165003.html",2020-09-16 09:45:24,养生酒，老品牌，信赖就好！
冯彪忽悠增持椰岛几年了，也不见履行承诺，却花7.5亿购买华创，这不是吃里扒的扎种,"https://guba.eastmoney.com/news,600238,962954275.html",2020-09-08 20:10:00,冯彪忽悠增持椰岛几年了，也不见履行承诺，却花7.5亿购买华创，这不是吃里扒的扎种吗？
感觉椰岛在河北衡湖缘酒业加工宝岛白和海王酒,"https://guba.eastmoney.com/news,600238,965017085.html",2020-09-15 15:22:52,减少运输成本
观察一个月了，发现原来都是散户在玩。,"https://guba.eastmoney.com/news,600238,964214900.html",2020-09-11 14:56:59,观察一个月了，发现原来都是散户在玩。
坐骄子干满仓啊,"https://guba.eastmoney.com/news,600238,964818443.html",2020-09-15 09:34:49,坐骄子干满仓啊
我在某猫上看了看保健酒，觉得吧！椰岛鹿龟酒还真是相比其它酒要便宜。坚定持有。坚定,"https://guba.eastmoney.com/news,600238,964806681.html",2020-09-15 09:10:10,我在某猫上看了看保健酒，觉得吧！椰岛鹿龟酒还真是相比其它酒要便宜。坚定持有。坚定买酒，坚定宣传。
衡湖缘酒业是干啥的,"https://guba.eastmoney.com/news,600238,964887183.html",2020-09-15 10:56:17,椰岛酒业与衡湖缘酒业战略合作签约仪式2020年9月2日在海口成功举行。
穷光蛋，破落户，欠债大王东方君盛妄想有人帮他抬轿子，每天400多万的成交额等着破,"https://guba.eastmoney.com/news,600238,964725441.html",2020-09-14 18:10:06,穷光蛋，破落户，欠债大王东方君盛妄想有人帮他抬轿子，每天400多万的成交额等着破产吧！
主力s了么？还是压根就没有主力？,"https://guba.eastmoney.com/news,600238,964874006.html",2020-09-15 10:38:55,主力s了么？还是压根就没有主力？
沪指即将最后的反攻至3286点后--瞬间变绿万股跌停,"https://guba.eastmoney.com/news,600238,964898635.html",2020-09-15 11:13:37,噎到噎不倒
有识之士共吸4.55--因为沪指要跳水了椰岛是跳水龙头,"https://guba.eastmoney.com/news,600238,964881893.html",2020-09-15 10:49:47,吸的就是龙头
沪指再次触及3263点后椰岛才不倒反而拉升,"https://guba.eastmoney.com/news,600238,964866566.html",2020-09-15 10:28:52,哈哈
前高后低，上午涨，下午暴跌,"https://guba.eastmoney.com/news,600238,964861540.html",2020-09-15 10:22:34,前高后低，上午涨，下午暴跌
这个股不拉到10元，成交量不会过千万,"https://guba.eastmoney.com/news,600238,964855067.html",2020-09-15 10:13:43,这个股不拉到10元，成交量不会过千万
别洗盘了，这股不拉到6块你根本买不到筹码,"https://guba.eastmoney.com/news,600238,964843668.html",2020-09-15 10:00:06,别洗盘了，这股不拉到6块你根本买不到筹码
空狗们出来，叫唤几声,"https://guba.eastmoney.com/news,600238,964838070.html",2020-09-15 09:55:04,空狗们出来，叫唤几声
200万子弹就打光了，要不要我拿低保卡支援一下？,"https://guba.eastmoney.com/news,600238,964834604.html",2020-09-15 09:51:32,200万子弹就打光了，要不要我拿低保卡支援一下？
昨晚做梦是大和证券借壳椰岛,"https://guba.eastmoney.com/news,600238,964819963.html",2020-09-15 09:36:31,真的哦
涨了好多了，能拉挺吗,"https://guba.eastmoney.com/news,600238,964831258.html",2020-09-15 09:47:51,涨了好多了，能拉挺吗
大和证券借壳的理由第一大股东北京的第二椰岛和贵州的华创有渊源并且华创这名这业务就是证券,"https://guba.eastmoney.com/news,600238,964822465.html",2020-09-15 09:38:52,关键是华创还没上市
竞价没人买,"https://guba.eastmoney.com/news,600238,964811833.html",2020-09-15 09:23:31,竞价没人买
椰岛的血亲老表康美已经登仙了，这破落户被穷光蛋牢牢把持住这辈子都不会起身了。,"https://guba.eastmoney.com/news,600238,964724991.html",2020-09-14 18:07:20,椰岛的血亲老表康美已经登仙了，这破落户被穷光蛋牢牢把持住这辈子都不会起身了。
椰岛最近利空出尽，碾压空狗,"https://guba.eastmoney.com/news,600238,964575998.html",2020-09-14 11:05:29,椰岛最近利空出尽，碾压空狗
停牌了停牌了--这次是卖壳,"https://guba.eastmoney.com/news,600238,964683064.html",2020-09-14 15:00:34,但愿啊
獐子岛进了局子--椰岛也快了,"https://guba.eastmoney.com/news,600238,964680989.html",2020-09-14 14:56:53,好玩
这最后一笔把狗托都全砸趴下了,"https://guba.eastmoney.com/news,600238,964686869.html",2020-09-14 15:08:14,这最后一笔把狗托都全砸趴下了
椰树牌椰汁是不是他家的？,"https://guba.eastmoney.com/news,600238,964432282.html",2020-09-13 14:55:33,椰树牌椰汁是不是他家的？
空狗们，踏空了吧，快来报到,"https://guba.eastmoney.com/news,600238,964677573.html",2020-09-14 14:51:26,空狗们，踏空了吧，快来报到
涨停啊,"https://guba.eastmoney.com/news,600238,964534466.html",2020-09-14 10:07:57,涨停啊
到六月三十号，公司有一万五千多股东，这些股东平时不喝酒吗？喝酒不买公司的洒试试吗,"https://guba.eastmoney.com/news,600238,964423686.html",2020-09-13 12:29:31,到六月三十号，公司有一万五千多股东，这些股东平时不喝酒吗？喝酒不买公司的洒试试吗？
这股死了，大家该干嘛干嘛去。别搁这死股身上浪费时间了！！！！！！！！！！！！！！,"https://guba.eastmoney.com/news,600238,964505192.html",2020-09-14 09:30:09,这股死了，大家该干嘛干嘛去。别搁这死股身上浪费时间了！！！！！！！！！！！！！！！！！！！！！！！！
同志们拿下4.59.阵地,"https://guba.eastmoney.com/news,600238,964058829.html",2020-09-11 10:27:09,同志们拿下4.59.阵地
好好的股票搞成这样醉了,"https://guba.eastmoney.com/news,600238,964213687.html",2020-09-11 14:54:57,好好的股票搞成这样醉了
椰岛收盘4.44，你s定了！,"https://guba.eastmoney.com/news,600238,964212196.html",2020-09-11 14:53:00,椰岛收盘4.44，你s定了！
想买没卖盘几手几手的买吧,"https://guba.eastmoney.com/news,600238,964173062.html",2020-09-11 14:01:12,想买没卖盘几手几手的买吧
各位大佬，能不能拉升一点再抛？,"https://guba.eastmoney.com/news,600238,964142666.html",2020-09-11 13:18:56,各位大佬，能不能拉升一点再抛？
这他么的半小时一根毛的成交都没有，一堆老铁干瞪眼,"https://guba.eastmoney.com/news,600238,964140998.html",2020-09-11 13:16:11,这他么的半小时一根毛的成交都没有，一堆老铁干瞪眼
二马虎三,"https://guba.eastmoney.com/news,600238,964048873.html",2020-09-11 10:15:43,二马虎三
退市,"https://guba.eastmoney.com/news,600238,963995287.html",2020-09-11 09:23:04,退市
