标题,链接,发布时间,内容
永新华成为第一大股东，ST天目实力大增！,"https://guba.eastmoney.com/news,600671,966176983.html",2020-09-19 10:20:54,永新华成为第一大股东，ST天目实力大增！
大股东应该是和卖口罩的说好了，叫卖口罩的来拍，结果永新华来搅局，而永新华应该是二,"https://guba.eastmoney.com/news,600671,966167522.html",2020-09-19 08:06:52,大股东应该是和卖口罩的说好了，叫卖口罩的来拍，结果永新华来搅局，而永新华应该是二股东那边的，现在被永新华抢了，二股东自认成控股股东了，都是高手啊
原来去年早看上了天目药业的资源准备搞文化旅游健康呀,"https://guba.eastmoney.com/news,600671,966023416.html",2020-09-18 14:23:47,原来去年早看上了天目药业的资源准备搞文化旅游健康呀
去年他们就谋划好了！,"https://guba.eastmoney.com/news,600671,966085950.html",2020-09-18 16:30:07,去年他们就谋划好了！
中药跟文化在一起能不能擦出一点火花能不能让二股东解套？,"https://guba.eastmoney.com/news,600671,966095445.html",2020-09-18 17:21:22,中药跟文化在一起能不能擦出一点火花 能不能让二股东解套？
神仙打架,"https://guba.eastmoney.com/news,600671,965955710.html",2020-09-18 12:16:00,"2200--青岛国资 2468--长城兄弟
预测最终2200获得 2468是长城进来恶心抬价的　


2020 9 18 12点15分预测"
高兴啥呢，利好出货了,"https://guba.eastmoney.com/news,600671,965980003.html",2020-09-18 13:27:53,高兴啥呢，利好出货了
诉讼庭审直播，散户赔偿问题成为焦点。,"https://guba.eastmoney.com/news,600671,966126192.html",2020-09-18 21:06:59,诉讼庭审直播，散户赔偿问题成为焦点。
现二股东2685万股是大股东了？,"https://guba.eastmoney.com/news,600671,966117681.html",2020-09-18 20:04:14,？？？
牛人，换股东总是好事,"https://guba.eastmoney.com/news,600671,966022584.html",2020-09-18 14:22:41,牛人，换股东总是好事
最后拍得价竞猜，我猜4.2亿左右,"https://guba.eastmoney.com/news,600671,965951094.html",2020-09-18 11:54:27,最后拍得价竞猜，我猜4.2亿左右
钱多人傻没办法，花近5个亿控股官司缠身的天目，仰天大笑,"https://guba.eastmoney.com/news,600671,966087722.html",2020-09-18 16:40:14,这钱轻轻松松买家年盈利5000万以上的科技公司，在科创板上市什么概念？
文化公司拍医药公司？？？什么鬼,"https://guba.eastmoney.com/news,600671,966001587.html",2020-09-18 13:55:05,文化公司拍医药公司？？？什么鬼
牛人！一字缩量涨停开始,"https://guba.eastmoney.com/news,600671,966083003.html",2020-09-18 16:16:12,牛人！一字缩量涨停开始
永新华瑞文化发展有限公司也不是做药企白瞎天目药企的资源了长城不是哎。,"https://guba.eastmoney.com/news,600671,965996003.html",2020-09-18 13:47:22,永新华瑞文化发展有限公司也不是做药企白瞎天目药企的资源了长城不是哎。
18块都疯抢，18以下小散手里的股票不会不要，第一阶段目标价18块，大家坐稳了，,"https://guba.eastmoney.com/news,600671,966068651.html",2020-09-18 15:28:17,18块都疯抢，18以下小散手里的股票不会不要，第一阶段目标价18块，大家坐稳了，火箭要起飞了
天目被永新华拍走,"https://guba.eastmoney.com/news,600671,965975012.html",2020-09-18 13:21:31,"

4.81亿 18元/股　这个永新华集团 兜兜转转一圈 做文化的跑来拍走药业公司 莫名其妙。。。"
