标题,链接,发布时间,内容
主力在含蓄地吃。,"https://guba.eastmoney.com/news,600797,634476899.html",2017-04-27 09:54:02,主力在含蓄地吃。
融资盘在交出筹码了,"https://guba.eastmoney.com/news,600797,634493433.html",2017-04-27 10:11:49,千万别轻易做融资
跌破11块82,"https://guba.eastmoney.com/news,600797,634492670.html",2017-04-27 10:10:25,跌破11块82
今天盘子有利于主力低位大量吸筹，下跌很容易，上涨吃力。如果今天顽强上扬，就表明持,"https://guba.eastmoney.com/news,600797,634489535.html",2017-04-27 10:08:23,今天盘子有利于主力低位大量吸筹，下跌很容易，上涨吃力。如果今天顽强上扬，就表明持股坚持是正确的。我是满仓赌徒。
跌停最好了。,"https://guba.eastmoney.com/news,600797,634485878.html",2017-04-27 10:04:09,跌停最好了。
跌掉20几点，克意打压，恶庄意要迫小九交带血筹码。,"https://guba.eastmoney.com/news,600797,634475998.html",2017-04-27 09:53:29,跌掉20几点，克意打压，恶庄意要迫小九交带血筹码。
目前看来小散们又蠢蠢欲动了 如果以这个价格入套的资金多 以后十块都难回去了,"https://guba.eastmoney.com/news,600797,634465178.html",2017-04-27 09:39:00,"目前看来小散们又蠢蠢欲动了
如果以这个价格入套的资金多
以后十块都难回去了"
曾经在一则公告中看到，浙大网新会以优厚的分红回报投资者，今晚就出年报了，不要忽悠,"https://guba.eastmoney.com/news,600797,634438007.html",2017-04-27 08:34:41,曾经在一则公告中看到，浙大网新会以优厚的分红回报投资者，今晚就出年报了，不要忽悠投资者啊
11块八，快破了吧,"https://guba.eastmoney.com/news,600797,634455456.html",2017-04-27 09:24:31,11块八，快破了吧
明天的年报和季报中如果智慧生活的总收入和占比上去，毛利率稳定的话我决定长期持有浙,"https://guba.eastmoney.com/news,600797,634454319.html",2017-04-27 09:20:54,明天的年报和季报中如果智慧生活的总收入和占比上去，毛利率稳定的话我决定长期持有浙大网新，至于社保爱咋咋的。
鲁信创投 打造专业化国有创投平台,"https://guba.eastmoney.com/news,600797,634436342.html",2017-04-27 08:30:28,券商股正在酝酿一波大涨国海证券000750爆发大
激活自己，就能显现出生命的颜色。,"https://guba.eastmoney.com/news,600797,634403839.html",2017-04-27 05:24:48,激活自己，就能显现出生命的颜色。
恐怖！破了月布林线中轨,"https://guba.eastmoney.com/news,600797,634084283.html",2017-04-26 13:23:15,2014年12月破过，第二个月就开始大涨，2016年1月破过，第二个月就开始大涨。这一次又破了，5月份开始大涨！好一个不破不立玩的不错哦。干！扒光了干！
北方的公司没事吼一声:唵是一带一路关联公司，连涨五天(例山推股份)。南方的公司利,"https://guba.eastmoney.com/news,600797,622178061.html",2017-03-28 22:15:46,北方的公司没事吼一声:唵是一带一路关联公司，连涨五天(例山推股份)。南方的公司利好一大串，每拉几分钱，就连跌三天(例浙大网新)。
看这阵势华通云重组浙大网新可能性大增。。,"https://guba.eastmoney.com/news,600797,633997737.html",2017-04-26 10:24:44,看这阵势华通云重组浙大网新可能性大增。。
两周套22点，艹,"https://guba.eastmoney.com/news,600797,634252947.html",2017-04-26 18:48:01,两周套22点，艹
可是后来我明白了，人的一生，是落子无悔的棋，,"https://guba.eastmoney.com/news,600797,634283603.html",2017-04-26 20:05:58,可是后来我明白了，人的一生，是落子无悔的棋，
下次改名浙大华通[献花],"https://guba.eastmoney.com/news,600797,623335043.html",2017-03-31 08:36:11,下次改名浙大华通
哥们看完我的贴子可能少亏甚至不亏绝对盈利也不是很难,"https://guba.eastmoney.com/news,600797,631265986.html",2017-04-20 13:58:20,如果你说你有钱那就是大错特错了。因为再多的钱也吃不消几个下跌波。
这股没救了，走人。。。,"https://guba.eastmoney.com/news,600797,621856000.html",2017-03-28 10:26:36,这股没救了，走人。。。
坐等新低,"https://guba.eastmoney.com/news,600797,634141447.html",2017-04-26 14:50:06,坐等新低
小散恐慌之时，就是庄得意之际！越慌越抛。金条变成稻草。从吧里一片哀嚎看，已心灰意,"https://guba.eastmoney.com/news,600797,634090654.html",2017-04-26 13:34:28,小散恐慌之时，就是庄得意之际！越慌越抛。金条变成稻草。从吧里一片哀嚎看，已心灰意冷，从股价看，已成稻草。快了！。。。。
这个恶庄在出货大家不要接盘,"https://guba.eastmoney.com/news,600797,634080900.html",2017-04-26 13:17:25,这个恶庄在出货大家不要接盘
即时走势骗局,"https://guba.eastmoney.com/news,600797,634039293.html",2017-04-26 11:27:30,容后补上内容
这个恶庄洗盘太厉害,"https://guba.eastmoney.com/news,600797,634079030.html",2017-04-26 13:14:15,这个恶庄洗盘太厉害
这到底是怎么啦？主力如此疯狂！,"https://guba.eastmoney.com/news,600797,634074130.html",2017-04-26 13:03:15,这到底是怎么啦？主力如此疯狂！
吓死宝宝了清仓了,"https://guba.eastmoney.com/news,600797,634074089.html",2017-04-26 13:02:05,吓死宝宝了清仓了
老时间跳水，不服来辩,"https://guba.eastmoney.com/news,600797,634006841.html",2017-04-26 10:38:14,老时间跳水，不服来辩
股价已经很低了，珍惜手上筹码,"https://guba.eastmoney.com/news,600797,634041705.html",2017-04-26 11:32:21,股价已经很低了，珍惜手上筹码
跌的时候比谁都快涨的时候就没份,"https://guba.eastmoney.com/news,600797,634038604.html",2017-04-26 11:27:28,跌的时候比谁都快涨的时候就没份
垃圾股！！割肉抛货,"https://guba.eastmoney.com/news,600797,634032198.html",2017-04-26 11:16:16,垃圾股！！割肉抛货
还要跌,"https://guba.eastmoney.com/news,600797,623421647.html",2017-03-31 11:02:43,还要跌
又快到11点20分了，该跳水了。主力做事情守信用啊。。 证监会该查了，我搬个板凳,"https://guba.eastmoney.com/news,600797,634023268.html",2017-04-26 11:01:23,"又快到11点20分了，该跳水了。主力做事情守信用啊。。
证监会该查了，我搬个板凳看戏。"
低吸,"https://guba.eastmoney.com/news,600797,622122915.html",2017-03-28 19:54:22,的时候。
今天好像还有一丁点儿拉升的机会 不过看情况主力是铁了心套现了 今天不拉就等着破1,"https://guba.eastmoney.com/news,600797,633989736.html",2017-04-26 10:13:56,"今天好像还有一丁点儿拉升的机会
不过看情况主力是铁了心套现了
今天不拉就等着破10了
不过别慌，网新破十大盘也好不了
破三千可以随地捡货了"
天天早上红下午就大绿，每天这么多卖单！垃圾股,"https://guba.eastmoney.com/news,600797,633981092.html",2017-04-26 10:02:41,天天早上红下午就大绿，每天这么多卖单！垃圾股
今天破12,"https://guba.eastmoney.com/news,600797,633994666.html",2017-04-26 10:20:48,今天破12
现在三成仓，你不给希望我是不会全仓杀进的,"https://guba.eastmoney.com/news,600797,633990335.html",2017-04-26 10:13:34,现在三成仓，你不给希望我是不会全仓杀进的
主力太狠了，能否让散户缓口气？别老做缺德事行不！,"https://guba.eastmoney.com/news,600797,633985737.html",2017-04-26 10:09:10,主力太狠了，能否让散户缓口气？别老做缺德事行不！
这个价格还是比较危险的…,"https://guba.eastmoney.com/news,600797,633502916.html",2017-04-25 10:52:44,这个价格还是比较危险的…
股缘梦炒股悟语（71）主力只做不说,"https://guba.eastmoney.com/news,600797,633852014.html",2017-04-25 22:55:53,目标：打造世界级高分子材料全产业生态平台
我没有上车可能还有很多人没有乘上末班车！心不甘呵！[怒],"https://guba.eastmoney.com/news,600797,633823471.html",2017-04-25 21:45:49,我没有上车可能还有很多人没有乘上末班车！心不甘呵！
强烈呼吁史总增持！,"https://guba.eastmoney.com/news,600797,633780765.html",2017-04-25 20:16:07,强烈呼吁史总增持！
澄清公告一出，浙大网新被打啪啪响，领跌多个板块。,"https://guba.eastmoney.com/news,600797,633688673.html",2017-04-25 16:44:39,明天再出个澄清公告，浙大网新被打出屎。
反正我不上当GBN反正我不上当反正我不上当,"https://guba.eastmoney.com/news,600797,633806573.html",2017-04-25 21:11:27,V反正我不上当
两油一拉！全死翘翘.,"https://guba.eastmoney.com/news,600797,633747665.html",2017-04-25 18:58:51,你也加油，这波洗干净了
静静等新低,"https://guba.eastmoney.com/news,600797,633634731.html",2017-04-25 14:57:26,静静等新低
赚了不喜，赔了不恼,"https://guba.eastmoney.com/news,600797,633711941.html",2017-04-25 17:34:21,看看吧！看看吧！心太小了！谁能帮我变大！
已经九阴真经了，还想怎样,"https://guba.eastmoney.com/news,600797,633632120.html",2017-04-25 14:55:56,2
国家队也就是来浑水摸鱼的， 都说社保不能亏钱 不割散户哪来的利润？ 看看梅雁吉祥,"https://guba.eastmoney.com/news,600797,633698176.html",2017-04-25 17:04:29,"国家队也就是来浑水摸鱼的，
都说社保不能亏钱
不割散户哪来的利润？
看看梅雁吉祥曾经多么风光？
潮水退去死的都是贪婪的小散！"
澄清其实就是此地无银三百两，第四季没走，第一季走了，要不不会是这走势,"https://guba.eastmoney.com/news,600797,633535443.html",2017-04-25 11:53:14,澄清其实就是此地无银三百两，第四季没走，第一季走了，要不不会是这走势
刻意打压，毫不收敛。证监会好好查！,"https://guba.eastmoney.com/news,600797,633604805.html",2017-04-25 14:18:54,刻意打压，毫不收敛。证监会好好查！
恍惚间,"https://guba.eastmoney.com/news,600797,633663378.html",2017-04-25 15:51:31,恍惚间
可以骂娘吗？随便砸，反正等到29号[好困惑],"https://guba.eastmoney.com/news,600797,633650480.html",2017-04-25 15:24:41,可以骂娘吗？随便砸，反正等到29号
我的牛牛牛股--精选优质爆发发发发发发发发发发,"https://guba.eastmoney.com/news,600797,633649741.html",2017-04-25 15:21:46,基本面大改善、脱帽预期强烈、实质流通盘仅仅一
看盘面像恶庄砸盘甩货出逃,"https://guba.eastmoney.com/news,600797,633648499.html",2017-04-25 15:20:48,恶庄砸盘甩货出逃
社保基本上清仓了！昨天的公告只是欲盖弥彰。年报也好不了。,"https://guba.eastmoney.com/news,600797,633601171.html",2017-04-25 14:12:06,社保基本上清仓了！昨天的公告只是欲盖弥彰。年报也好不了。
全体散户应该联合起来 要求浙大网新赔偿 说个大跌的理由,"https://guba.eastmoney.com/news,600797,633642147.html",2017-04-25 15:09:19,全体散户应该联合起来 要求浙大网新赔偿 说个大跌的理由
图形难看而已，又没有跌几个点，纯属黎明前的黑暗。坚持就是胜利!,"https://guba.eastmoney.com/news,600797,633615532.html",2017-04-25 14:33:11,图形难看而已，又没有跌几个点，纯属黎明前的黑暗。坚持就是胜利!
网新高管们的七块多减持是有意义的说，这次十二块多增持也是有意义的说。如此善良的高,"https://guba.eastmoney.com/news,600797,633637281.html",2017-04-25 15:02:16,网新高管们的七块多减持是有意义的说，这次十二块多增持也是有意义的说。如此善良的高管，有意思的说………哈哈哈
就差我那点票呀，14.28元卖了，就开始拉升呀[哭][哭],"https://guba.eastmoney.com/news,600797,625757829.html",2017-04-07 13:31:10,就差我那点票呀，14.28元卖了，就开始拉升呀
流通市值100亿元了,"https://guba.eastmoney.com/news,600797,633636256.html",2017-04-25 15:00:33,流通市值100亿元了
真是不要脸还跌,"https://guba.eastmoney.com/news,600797,633632068.html",2017-04-25 14:54:16,真是不要脸还跌
你们为啥要砸盘？不明白！,"https://guba.eastmoney.com/news,600797,633604308.html",2017-04-25 14:17:20,你们为啥要砸盘？不明白！
融资的被杀完了吗？,"https://guba.eastmoney.com/news,600797,633622441.html",2017-04-25 14:40:37,融资的被杀完了吗？
年报估计不咋滴,"https://guba.eastmoney.com/news,600797,633625886.html",2017-04-25 14:46:19,年报估计不咋滴
砸的开心不，各种姿势满足你了没，开心了那就继续到高潮,"https://guba.eastmoney.com/news,600797,633625135.html",2017-04-25 14:45:41,砸的开心不，各种姿势满足你了没，开心了那就继续到高潮
请各位投票更名： A、浙大网砸； B、浙大网套； C、浙大网欺； D、其他（请列,"https://guba.eastmoney.com/news,600797,633620206.html",2017-04-25 14:38:29,"请各位投票更名：
A、浙大网砸；
B、浙大网套；
C、浙大网欺；
D、其他（请列举）"
垃圾中的战斗机！,"https://guba.eastmoney.com/news,600797,633600659.html",2017-04-25 14:10:13,垃圾中的战斗机！
买买买。让我们小散们全买起。让庄去割肉吧。千万别割肉给庄。庄要出货早出了。不会压,"https://guba.eastmoney.com/news,600797,633593130.html",2017-04-25 14:00:47,买买买。让我们小散们全买起。让庄去割肉吧。千万别割肉给庄。庄要出货早出了。不会压低价格出货的。让我们小散去打败融券，去打败想让我们割肉的庄。筹码为王！这个盘子也不大。哈哈哈！咱们小散有力量！
又开始装死了，麻痹,"https://guba.eastmoney.com/news,600797,633591187.html",2017-04-25 13:57:19,又开始装死了，麻痹
大盘涨要出货应该往上做，网新常常大笔低5分往下做。主力想低价增发，这么干合规吗？,"https://guba.eastmoney.com/news,600797,633575124.html",2017-04-25 13:34:34,大盘涨要出货应该往上做，网新常常大笔低5分往下做。主力想低价增发，这么干合规吗？
不管是不是社保基金干的，这里面有蓄意择时打压股价的做法。比如利用11：20后面散,"https://guba.eastmoney.com/news,600797,633572960.html",2017-04-25 13:32:10,不管是不是社保基金干的，这里面有蓄意择时打压股价的做法。比如利用11：20后面散户看盘点做跟风砸盘动作，大笔整数成交低报5分左右的价格等，应该查一下！
还有驴宝挤了脑袋的在砸盘啊,"https://guba.eastmoney.com/news,600797,633524005.html",2017-04-25 11:27:50,一单30多万股哦
继续进仓[大笑][大笑],"https://guba.eastmoney.com/news,600797,633565599.html",2017-04-25 13:20:59,继续进仓
"浙大类股票好像一直不怎么样，经常要st,不像北大类，清华类，可能同浙大教授自肥有","https://guba.eastmoney.com/news,600797,623336931.html",2017-03-31 08:43:29,"浙大类股票好像一直不怎么样，经常要st,不像北大类，清华类，可能同浙大教授自肥有关。经常很便宜价格股权激励，减持。与浙大名不副实[不屑]"
握草，今天走的什么套路,"https://guba.eastmoney.com/news,600797,633565141.html",2017-04-25 13:18:27,
大盘涨你要死不活，大盘跌你比谁都跌得快，垃圾,"https://guba.eastmoney.com/news,600797,633559365.html",2017-04-25 13:08:06,大盘涨你要死不活，大盘跌你比谁都跌得快，垃圾
请问600979在停牌期间基金是如何减持的？,"https://guba.eastmoney.com/news,600797,632884784.html",2017-04-24 09:38:50,2016年10月26日，公司十大流通股显示：8个基金在且还有增持，接着停牌至2017年1月初开盘，那基金死如何在停牌期间（2016年4季度）减持的？
网新不会结束,"https://guba.eastmoney.com/news,600797,464618722.html",2016-07-22 10:57:59,"从上涨到现在，虽然涨幅也不小了，但一个涨停没有，一个热门股榜没上，我想是不会结束的，所有的回调都是买入的机会。直到涨停板、龙虎榜、热门榜一一上过，就可以考虑走人了！

个人拙见！勿笑勿喷勿骂！"
很明显有傻子砸盘压价,"https://guba.eastmoney.com/news,600797,633520950.html",2017-04-25 11:23:36,2
"大势疲软时,也有俏丽挺扬的股票；大势趋升时,也有晦气滑降的股票。","https://guba.eastmoney.com/news,600797,633543171.html",2017-04-25 12:17:40,"大势疲软时,也有俏丽挺扬的股票；大势趋升时,也有晦气滑降的股票。
"
急了，紧张了，发公告澄清。,"https://guba.eastmoney.com/news,600797,633315487.html",2017-04-24 21:48:53,急了，紧张了，发公告澄清。
然后,"https://guba.eastmoney.com/news,600797,633533062.html",2017-04-25 11:46:03,然后
为何道歉，看看股价和涨幅就知道报道是否属实了,"https://guba.eastmoney.com/news,600797,633517660.html",2017-04-25 11:17:28,2
垃圾股，砸他妈庄家,"https://guba.eastmoney.com/news,600797,633525639.html",2017-04-25 11:31:30,杀
主力想干什么？,"https://guba.eastmoney.com/news,600797,626564112.html",2017-04-10 09:12:13,别忘了浙大网新6月就符合新规可低价定增，这就给了盘中主力先出货的时间，其后极有可能再砸盘压盘确保低价定增，定增后主力再把出的货在低位接回，岂不一举两得，目前盘中主力还是在出货阶段哟，呵呵。。。。。。
垃圾啊跌那么多还跌,"https://guba.eastmoney.com/news,600797,633523768.html",2017-04-25 11:29:09,垃圾啊跌那么多还跌
什么情况放量下跌,"https://guba.eastmoney.com/news,600797,633523867.html",2017-04-25 11:27:33,什么情况放量下跌
他娘的发生什么事了，全卖了不玩了,"https://guba.eastmoney.com/news,600797,633522989.html",2017-04-25 11:27:08,他娘的发生什么事了，全卖了不玩了
难道涨一千点你再涨么,"https://guba.eastmoney.com/news,600797,633518736.html",2017-04-25 11:20:12,2
中国证劵报，浙大散户呼吁你出来道歉！,"https://guba.eastmoney.com/news,600797,633407086.html",2017-04-25 07:05:43,中国证劵报，浙大散户呼吁你出来道歉！
兴业投资黄金周评：七周连跌 新年假期来临黄金,"https://guba.eastmoney.com/news,600797,633515677.html",2017-04-25 11:16:13,国务院新设立7个自贸试验区 概念股望爆发
宁波港601018祝浙大网新大涨,"https://guba.eastmoney.com/news,600797,478124231.html",2016-07-25 10:13:29,宁波港601018祝浙大网新涨停板
只有上涨才是最有力的反击，光澄清有毛用,"https://guba.eastmoney.com/news,600797,633496533.html",2017-04-25 10:42:10,2
对不实报道及时作出回应，还算个负责任的公司！,"https://guba.eastmoney.com/news,600797,633474736.html",2017-04-25 10:09:56,对不实报道及时作出回应，还算个负责任的公司！
中国证券报是证监会的机关报。他们不可能造谣吧？,"https://guba.eastmoney.com/news,600797,633320893.html",2017-04-24 21:58:44,中国证券报是证监会的机关报。他们不可能造谣吧？
1414要死了快跑。。。,"https://guba.eastmoney.com/news,600797,622507943.html",2017-03-29 15:05:50,1414要死了快跑。。。
再看这个贴子，掌握好回调节奏,"https://guba.eastmoney.com/news,600797,547060512.html",2016-08-31 20:39:12,"如果，如果，如果，如果允许可能离开20元股价区，掌握好回调节奏 (2016-07-10 23:33:54)


绝对支撑位才能返弹"
大盘后期走势爆出，走还是留现在很明了！,"https://guba.eastmoney.com/news,600797,633353331.html",2017-04-24 23:11:55,"大盘后期走势爆出，走还是留现在很明了！
"
社保基金没减持，为什么跌成这样? 各基本面均可，股价也不高，为什么不涨? 肯定有,"https://guba.eastmoney.com/news,600797,633326301.html",2017-04-24 22:08:12,"社保基金没减持，为什么跌成这样?
各基本面均可，股价也不高，为什么不涨?
肯定有问题嘛"
加仓吧  浙大网新    明天停牌,"https://guba.eastmoney.com/news,600797,627786595.html",2017-04-12 14:20:44,加仓吧浙大网新明天停牌
一定会涨起来的，做云计算，大数据，重组如果成功的话，市盈率将达百倍以上，不出意外,"https://guba.eastmoney.com/news,600797,633298125.html",2017-04-24 21:10:45,一定会涨起来的，做云计算，大数据，重组如果成功的话，市盈率将达百倍以上，不出意外的话，今年底前股价会上30以上。
不知道浙大网新的龙井系统还在升级吗？,"https://guba.eastmoney.com/news,600797,633296501.html",2017-04-24 21:06:59,不知道浙大网新的龙井系统还在升级吗？
11元可以大胆买入,"https://guba.eastmoney.com/news,600797,633021392.html",2017-04-24 13:01:36,11元可以大胆买入
又回到两个月前的价格，垃圾。,"https://guba.eastmoney.com/news,600797,630770780.html",2017-04-19 15:08:21,"又回到两个月前的价格，垃圾。
"
白耍一天,"https://guba.eastmoney.com/news,600797,620784305.html",2017-03-24 15:03:05,白耍一天
查阅资料，社保3月到4月持续增持浙大网新，截至4月20日止占位十大流通股东共7位,"https://guba.eastmoney.com/news,600797,632814697.html",2017-04-24 05:09:22,查阅资料，社保3月到4月持续增持浙大网新，截至4月20日止占位十大流通股东共7位。
融资200w抄底 奶奶的,"https://guba.eastmoney.com/news,600797,632937573.html",2017-04-24 10:36:18,融资200w抄底 奶奶的
浙大网新，什么时候出年报？,"https://guba.eastmoney.com/news,600797,633188186.html",2017-04-24 17:20:23,浙大网新，什么时候出年报？
谁能从某时就看出自己的未来,"https://guba.eastmoney.com/news,600797,633188329.html",2017-04-24 17:20:24,谁能从某时就看出自己的未来
大家休息都别聊了,"https://guba.eastmoney.com/news,600797,633145466.html",2017-04-24 16:00:01,明白一个道理，减持就是胜利，
汉界观点，股市平稳，持股待涨。,"https://guba.eastmoney.com/news,600797,622033834.html",2017-03-28 16:08:19,重 大 利 好 ， 重 现 利 多 。
已经低于定增价了，会不会定增失败,"https://guba.eastmoney.com/news,600797,633120921.html",2017-04-24 15:15:52,已经低于定增价了，会不会定增失败
散户们可以恳请史烈继续增持或搞个员工持股 否则股价下跌要破十了,"https://guba.eastmoney.com/news,600797,633096049.html",2017-04-24 14:46:14,"散户们可以恳请史烈继续增持或搞个员工持股
否则股价下跌要破十了"
下三个点位11.97，11，10块 就等着融资来砸破啦,"https://guba.eastmoney.com/news,600797,631334777.html",2017-04-20 15:27:19,"下三个点位11.97，11，10块
就等着融资来砸破啦"
新低会来么？,"https://guba.eastmoney.com/news,600797,631228762.html",2017-04-20 13:07:20,新低会来么？
开始工作,"https://guba.eastmoney.com/news,600797,633049584.html",2017-04-24 13:43:43,开始工作
主力互干把市场搞坏了 游资干散户，社保干游资，散户装装死，融资先完蛋 散户呢也别,"https://guba.eastmoney.com/news,600797,633042098.html",2017-04-24 13:33:05,"主力互干把市场搞坏了
游资干散户，社保干游资，散户装装死，融资先完蛋
散户呢也别瞎割肉了
目前这个点再跌相对不肉疼了吧
融资客估计还要死一批先"
十二块三组织反击一下 可能能坚持一天反弹 破完加速下跌破十块,"https://guba.eastmoney.com/news,600797,631259707.html",2017-04-20 13:51:41,"十二块三组织反击一下
可能能坚持一天反弹
破完加速下跌破十块"
小散们团结起来，从现在起只进不出，反正没赚了。把主力洗出去。让主力丢掉筹码亏钱走,"https://guba.eastmoney.com/news,600797,633004507.html",2017-04-24 12:18:37,小散们团结起来，从现在起只进不出，反正没赚了。把主力洗出去。让主力丢掉筹码亏钱走路。哈哈哈。
社保基金还有仓位 不可能减持 9000万股至少还有6000万,"https://guba.eastmoney.com/news,600797,632970430.html",2017-04-24 11:19:05,社保基金还有仓位 不可能减持 9000万股至少还有6000万
冲锋号吹响 融资的兄弟们自救啊,"https://guba.eastmoney.com/news,600797,632956424.html",2017-04-24 11:00:04,冲锋号吹响 融资的兄弟们自救啊
操纵股价砸盘卖股票的这些东西,"https://guba.eastmoney.com/news,600797,630627250.html",2017-04-19 11:16:25,他们在做胎的时候，被驴吊挤着脑袋啦
刚12.3捡了点。真是爽。要再低再捡。。。哈哈哈。建仓才不到十分之一。多来来。准,"https://guba.eastmoney.com/news,600797,632918647.html",2017-04-24 10:12:54,刚12.3捡了点。真是爽。要再低再捡。。。哈哈哈。建仓才不到十分之一。多来来。准备再添点。
浙大网新惨遭社保基金弃盘， 前十大流通股股东已不见社保基金踪影 难怪跌成狗屎了,"https://guba.eastmoney.com/news,600797,632743613.html",2017-04-23 22:47:58,"浙大网新惨遭社保基金弃盘，
前十大流通股股东已不见社保基金踪影
难怪跌成狗屎了"
早上新闻里说的浙大网新在四季度遭社保基金减持绝对有问题，公开信息是10月26日增,"https://guba.eastmoney.com/news,600797,632863925.html",2017-04-24 08:55:09,早上新闻里说的浙大网新在四季度遭社保基金减持绝对有问题，公开信息是10月26日增持重仓，然后停牌到1月6日，那么社保基金如何能在四季度大笔减持，难道是大宗交易？公开信息也没有
扶不起的阿斗，这大王吧！狗庄天天出货！,"https://guba.eastmoney.com/news,600797,624720740.html",2017-04-05 11:26:45,扶不起的阿斗，这大王吧！狗庄天天出货！
