标题,链接,发布时间,内容
问题是现在有不造假的？,"https://guba.eastmoney.com/news,603766,884782767.html",2019-11-06 09:30:26,问题是现在有不造假的？
天杀,"https://guba.eastmoney.com/news,603766,884781415.html",2019-11-06 09:26:57,天杀
难道华尔街老哼要说准了。。。退？,"https://guba.eastmoney.com/news,603766,884780271.html",2019-11-06 09:23:44,难道华尔街老哼要说准了。。。退？
完犊子，股市最怕这样磨难两可的消息，又有些人要恐慌了[困顿]，申明本人不多也不空,"https://guba.eastmoney.com/news,603766,884779206.html",2019-11-06 09:21:02,完犊子，股市最怕这样磨难两可的消息，又有些人要恐慌了，申明本人不多也不空。
无论正面还是负面消息对此刻的隆鑫通用都是利好，都会提高流动性,"https://guba.eastmoney.com/news,603766,884776732.html",2019-11-06 09:11:40,无论正面还是负面消息对此刻的隆鑫通用都是利好，都会提高流动性
财务造假可能就有可能退市了 隆鑫通用卖出为宜,"https://guba.eastmoney.com/news,603766,884773550.html",2019-11-06 08:51:17,财务造假可能就有可能退市了隆鑫通用卖出为宜
底部收不到筹码，就发利空，看来要动刀子了！等着抄底吧！中国股市，如今像隆鑫通用这,"https://guba.eastmoney.com/news,603766,884769669.html",2019-11-06 08:14:42,底部收不到筹码，就发利空，看来要动刀子了！等着抄底吧！中国股市，如今像隆鑫通用这样的低价股，还有吗？激智科技，红宇新材，双汇发展，万里石……，看看它们的股价，业绩，历史分红！
您好！隆华公司是否参与部队无人机招投标？,"https://guba.eastmoney.com/news,603766,890807121.html",2019-12-09 15:11:15,"您好！隆华公司是否参与部队无人机招投标？
隆鑫通用
隆鑫通用：目前暂时没有，谢谢关注(来自：上交所)
(来自全景·路演天下)答复时间 2019-12-09 15:11:15"
您好！隆华公司是否参与部队无人机招投标？,"https://guba.eastmoney.com/news,603766,890786529.html",2019-12-09 15:10:53,"您好！隆华公司是否参与部队无人机招投标？
隆鑫通用
隆鑫通用：目前暂时没有，谢谢关注
(来自上证e互动)答复时间 2019-12-09 15:10:53"
此次MLF中标利率下调，将会引导贷款市场报价利率LPR下调，利好实体经济！！！,"https://guba.eastmoney.com/news,603766,884693630.html",2019-11-05 16:39:48,"此次MLF中标利率下调，将会引导贷款市场报价利率LPR下调，利好实体经济！！！
企业融资成本将进一步降低，对二级市场股价也有一定刺激作用！"
