标题,链接,发布时间,内容
行情不好，但是我还是忍不住满仓,"https://guba.eastmoney.com/news,000038,583206696.html",2016-12-27 19:16:43,行情不好，但是我还是忍不住满仓
深大通,"https://guba.eastmoney.com/news,000038,583155427.html",2016-12-27 15:57:26,深大通
深大通:关于签订募集资金三方监管协议的公告,"https://guba.eastmoney.com/news,000038,582868103.html",2016-12-26 19:35:19,"公告日期：2016-12-27
证券代码：000038 证券简称：深大通 公告编号：2016-162



深圳大通实业股份有限公司



关于签订募集资金三方监管协议的公告



本公司及董事会全体成员保证公告内容的真实、准确、完整，没有虚假记载、误导性陈述或重大遗漏。



深圳大通实业股份有限公司（以下简称“公司”）于2015年12月18日收



到中国证券监督管理委员会出具的《关于核准深圳大通实业股份有限公司向曹林芳等发行股份购买资产并募集配套资金的批复》（证监许可[2015]2944 号），核准公司非公开发行不超过 134,671,886 股新股募集本次发行股份购买资产的配套资金。根据瑞华会计师事务所（特殊普通合伙）出具的瑞华验字[2016]48030016《验资报告》验证，公司本次非公开发行人民普通股（A 股）134,671,886股，募集资金总额人民币2,749,999,912.12元，扣除发行费用后，实际募集资金净额人民币2,719,949,913.02元。



为规范公司募集资金管理,切实保护投资者权益,根据有关法律法规及中国证监会《上市公司监管指引第 2 号——上市公司募集资金管理和使用的监管要求》、公司《募集资金管理办法》等规定, 公司签署了如下募集资金三方监管协议：



公司、广州证券股份有限公司、上海浦东发展银行股份有限公司青岛高科园支行签署了募集资金专户储存三方监管协议，募集资金专户账号为69110155000000189，该专户用于公司研发中心项目募集资金的存储和使用；



上述募集资金三方监管协议的主要内容如下：



一、公司已在开户行（指上海浦东发展银行股份有限公司青岛高科园支行）开设募集资金专项账户（以下简称“专户”），该专户仅用于公司本次募集资金的存储和使用，不得用作其他用途。



二、公司和开户行应当共同遵守《中华人民共和国票据法》、《支付结算办法》、《人民币银行结算账户管理办法》等法律、法规、规章。



三、广州证券股份有限公司（以下简称“广州证券”）作为公司的独立财务顾问，应当依据有关规定指定独立财务顾问主办人或者其他工作人员对公司募集资金使用情况进行监督。广州证券应当依据《深圳证券交易所主板上市公司规范运作指引（2015 年修订）》以及公司制订的募集资金管理制度履行其督导职责，并可以采取现场调查、书面问询等方式行使其监督权。公司和开户行应当配合广州证券的调查与查询。广州证券每半年对公司募集资金的存放和使用情况进行一次现场检查。



四、公司授权广州证券指定的项目主办人刘亚勇、石峰可以随时到开户行查询、复印公司专户的资料；开户行应及时、准确、完整地向其提供所需的有关专户的资料。



项目主办人向开户行查询公司专户有关情况时应出具本人的合法身份证明；广州证券指定的其他工作人员向开户行查询公司专户有关情况时应出具本人的合法身份证明和单位介绍信。



五、开户行按月（每月15日之前）向公司出具对账单，并抄送广州证券。



开户行应保证对账单内容真实、准确、完整。



六、公司一次或12个月以内累计从专户中支取的金额超过5000万元或募集



资金净额（发行募集资金总额扣除发行费用后的净额）的10%的，开户行应及时



以邮件方式通知广州证券，同时将专户的支出清单邮寄给广州证券。



七、广州证券有权根据有关规定更换指定的项目主办人。广州证券更换项目主办人的，应将相关证明文件书面通知开户行，同时按本协议第十一条的要求向公司、开户行书面通知更换后的项目主办人联系方式。更换项目主办人不影响本协议的效力。



八、开户行连续三次未及时向广州证券出具对账单或向广州证券通知专户大额支取情况，以及存在未配合广州证券调查专户情形的，公司或者广州证券可以要求公司单方面终止本协议并注销募集资金专户。



九、本协议自公司、开户行、广州证券三方法定代表人或其授权代表签署并加盖各自单位公章之日起生效，至专户资金全部支出完毕并依法销户之日起失效。



广州证券义务至持续督导期结束之日，即2017年12月31日解除。



如广州证券在该项目下的持续督导责任提前终止，自广州证券持续督导责任终止之日，广州证券在本协议项下的义务解除。



若至持续督导义务完成之日即2017年12月31日，公司募集资金尚未使用



完毕，本协议有效期延长至本专户内的募集资金使用完毕之日。



特此公告



……
[点击查看PDF原文]
提示：本网不保证其真实性和客观性，一切有关该股的有效信息，以交易所的公告为准，敬请投资者注意风险。
展开阅读全文"
百元大票 百大600865的俗名 名字特响亮 三江购物的股价有点高不可攀 百元大票肯定会成为第二只三江购物！机不可失,"https://guba.eastmoney.com/news,000038,580974148.html",2016-12-20 10:02:00,"在淅江正宗阿里新零售，唯我杭州百大集团600865可以取代三江购物做新龙头！
百大，肿瘤医院，即将敲定。一个肿瘤药的概念，可以让股票翻了好几倍。百大第一目标必将突破三十元。"
天量阴柱后一天的底部红十字介入比较稳妥,"https://guba.eastmoney.com/news,000038,583081276.html",2016-12-27 13:23:24,天量阴柱后一天的底部红十字介入比较稳妥
好安静,"https://guba.eastmoney.com/news,000038,583077451.html",2016-12-27 13:15:29,好安静
观察量能变化,"https://guba.eastmoney.com/news,000038,583078222.html",2016-12-27 13:17:02,观察量能变化
开始冲吧！,"https://guba.eastmoney.com/news,000038,583078004.html",2016-12-27 13:16:34,开始冲吧！
重大违法公司要强制退市……走不走你们看吧……,"https://guba.eastmoney.com/news,000038,583077781.html",2016-12-27 13:16:13,重大违法公司要强制退市……走不走你们看吧……
为啥主力不拉 换一直打压,"https://guba.eastmoney.com/news,000038,583073745.html",2016-12-27 13:07:05,为啥主力不拉 换一直打压
该起航了,"https://guba.eastmoney.com/news,000038,583072547.html",2016-12-27 13:03:41,该起航了
厦门游资要拉了，刚才短信通知！！！加油,"https://guba.eastmoney.com/news,000038,583062203.html",2016-12-27 12:10:15,厦门游资要拉了，刚才短信通知！！！加油
此股在年报前能维持这个股价也不容易了，期间可能会拉一下，但是，最终也就这样了,"https://guba.eastmoney.com/news,000038,583062147.html",2016-12-27 12:09:50,此股在年报前能维持这个股价也不容易了，期间可能会拉一下，但是，最终也就这样了
我问,"https://guba.eastmoney.com/news,000038,582692205.html",2016-12-26 11:03:28,现在是不是到买进的时候了？
好样的，有点意思！[赞][赞][赞],"https://guba.eastmoney.com/news,000038,583042348.html",2016-12-27 11:11:28,好样的，有点意思！
哈哈跌停,"https://guba.eastmoney.com/news,000038,582980796.html",2016-12-27 09:16:19,哈哈跌停
深大通:关于按期收回银行理财产品本金和收益的公告(2016/12/27),"https://guba.eastmoney.com/news,000038,582867945.html",2016-12-26 19:34:48,"公告日期：2016-12-27
证券代码：000038 证券简称：深大通 公告编号：2016-161



深圳大通实业股份有限公司



关于按期收回银行理财产品本金和收益的公告



本公司及董事会全体成员保证公告内容的真实、准确、完整，没有虚假记载、误导性陈述或重大遗漏。



深圳大通实业股份有限公司2016年11月18日与青岛银行总行营业部签订



《青岛银行“速决速胜”人民币公司理财产品协议书》，使用闲置募集资金 7,100



万元人民币购买保本浮动收益型理财产品（内容见本公司于2016年11月19日



在巨潮资讯网www.cninfo.com.cn披露的公告）。上述理财产品本金和收益已按合



同约定于2016年12月20日到期赎回，赎回本金7,100万元及收益192,964.38



元。



特此公告



深圳大通实业股份有限公司董事会



二〇一六年十二月二十六日




[点击查看PDF原文]
提示：本网不保证其真实性和客观性，一切有关该股的有效信息，以交易所的公告为准，敬请投资者注意风险。
展开阅读全文"
成败就看能否守住此点！,"https://guba.eastmoney.com/news,000038,582862106.html",2016-12-26 19:10:39,成败就看能否守住此点！
我看,"https://guba.eastmoney.com/news,000038,582142294.html",2016-12-23 13:08:06,可怜的人们，该股在这个位置如果在卖出就是寻死！
查不多可以跑了，马上要解禁。,"https://guba.eastmoney.com/news,000038,582770213.html",2016-12-26 14:21:01,查不多可以跑了，马上要解禁。
短期走势相对强于大盘，散户该何去何从！,"https://guba.eastmoney.com/news,000038,582766790.html",2016-12-26 14:14:35,短期走势相对强于大盘，散户该何去何从！
相信你下午暴力拉升,"https://guba.eastmoney.com/news,000038,582722450.html",2016-12-26 12:28:25,相信你下午暴力拉升
每天都是要死不活的,"https://guba.eastmoney.com/news,000038,582699504.html",2016-12-26 11:17:14,每天都是要死不活的
今年定增价20.42元/股[空仓][空仓][空仓][空仓][空仓][空仓][空仓,"https://guba.eastmoney.com/news,000038,582692886.html",2016-12-26 11:04:39,今年定增价20.42元/股
麻痹，水军还没走啊？继续跌。什么时候这帮孙子走了，再拉。,"https://guba.eastmoney.com/news,000038,582592609.html",2016-12-26 01:00:51,麻痹，水军还没走啊？继续跌。什么时候这帮孙子走了，再拉。
继续关注：金牛化工，银鸽投资。稳健股：登海种,"https://guba.eastmoney.com/news,000038,582545482.html",2016-12-25 18:53:25,继续关注：金牛化工，银鸽投资。稳健股：登海种
特此声明！本人已经半仓成本47！希望以前关注我的朋友收到消息！特此声明！,"https://guba.eastmoney.com/news,000038,582180283.html",2016-12-23 14:07:33,特此声明！本人已经半仓成本47！希望以前关注我的朋友收到消息！特此声明！
这一把火到位就可以了,"https://guba.eastmoney.com/news,000038,582449883.html",2016-12-24 18:05:34,这一把火到位就可以了
大行情开启！买入此龙头,"https://guba.eastmoney.com/news,000038,582449154.html",2016-12-24 17:57:56,大行情开启！买入此龙头
怎么没有看到12月份的，信息全部都是11月份[为什么][为什么],"https://guba.eastmoney.com/news,000038,582413818.html",2016-12-24 13:02:31,怎么没有看到12月份的，信息全部都是11月份
请问何时恢复股市T+O,"https://guba.eastmoney.com/news,000038,582324676.html",2016-12-23 21:32:55,请问何时恢复股市T+O
大通没戏了，从哪来回哪去，我等着[大笑][大笑][大笑][财力][财力][财力],"https://guba.eastmoney.com/news,000038,582322894.html",2016-12-23 21:25:44,大通没戏了，从哪来回哪去，我等着
完喽，完喽，没戏喽！,"https://guba.eastmoney.com/news,000038,573939144.html",2016-11-29 14:47:07,完喽，完喽，没戏喽！
又跌,"https://guba.eastmoney.com/news,000038,574253922.html",2016-11-30 11:17:43,
看到大通董秘暖意盈怀，我决定周一入了！[微笑][微笑][微笑],"https://guba.eastmoney.com/news,000038,582307173.html",2016-12-23 20:25:24,看到大通董秘暖意盈怀，我决定周一入了！
大通没戏了，从哪里来回哪里去，我等着[大笑][大笑][大笑][大笑][大笑][大,"https://guba.eastmoney.com/news,000038,582289235.html",2016-12-23 19:06:44,大通没戏了，从哪里来回哪里去，我等着
新一轮下跌，开始了，预测30,"https://guba.eastmoney.com/news,000038,582232372.html",2016-12-23 15:36:48,新一轮下跌，开始了，预测30
要死啊,"https://guba.eastmoney.com/news,000038,582211238.html",2016-12-23 14:55:12,要死啊
狗股，没好过一天的,"https://guba.eastmoney.com/news,000038,582173775.html",2016-12-23 13:57:40,狗股，没好过一天的
关注宇通客车,"https://guba.eastmoney.com/news,000038,582171571.html",2016-12-23 13:54:23,单自已挂自己吃，中单疯狂出！
当前经济金融领域的五大潜在风险,"https://guba.eastmoney.com/news,000038,582138052.html",2016-12-23 12:54:36,孝顺父母、以德报怨，转命运最快速迅猛 2016-06
...,"https://guba.eastmoney.com/news,000038,582133223.html",2016-12-23 12:32:19,
前期炒作被套在中字头大盘股中的，这次一定要把,"https://guba.eastmoney.com/news,000038,582113544.html",2016-12-23 11:29:16,收盘分析： 日高继续不定
烂股，买了你倒霉,"https://guba.eastmoney.com/news,000038,582102539.html",2016-12-23 11:10:58,割肉了
都没人发帖了，要涨了,"https://guba.eastmoney.com/news,000038,582043953.html",2016-12-23 09:42:21,都没人发帖了，要涨了
与指数飘红不相称,"https://guba.eastmoney.com/news,000038,582025201.html",2016-12-23 08:53:12,近期回落的中小创中质地优良标的，可考虑逐步接
重大利好消息已经放出!,"https://guba.eastmoney.com/news,000038,581999780.html",2016-12-23 01:55:14,重大利好消息已经放出!
反弹结束，逃命去吧,"https://guba.eastmoney.com/news,000038,581964706.html",2016-12-22 21:53:16,反弹结束，逃命去吧
12月14日参考,"https://guba.eastmoney.com/news,000038,581964658.html",2016-12-22 21:53:07,12月14日参考
我有一种感覺今晚美加息，我大A股己利空出尽明,"https://guba.eastmoney.com/news,000038,581923987.html",2016-12-22 19:30:47,我有一种感覺今晚美加息，我大A股己利空出尽明
请问何时恢复股市T+O,"https://guba.eastmoney.com/news,000038,581923936.html",2016-12-22 19:30:35,请问何时恢复股市T+O
与指数飘红不相称,"https://guba.eastmoney.com/news,000038,581919712.html",2016-12-22 19:16:55,近期回落的中小创中质地优良标的，可考虑逐步接
那么,"https://guba.eastmoney.com/news,000038,581914044.html",2016-12-22 18:57:35,那么
终于又开新帖了，散户进来看,"https://guba.eastmoney.com/news,000038,581906739.html",2016-12-22 18:29:11,终于又开新帖了，散户进来看
深圳本地股涨时你不涨，传媒涨时你不涨，连房地产涨你也不跟！姜剑，你们现在主营到底,"https://guba.eastmoney.com/news,000038,581724086.html",2016-12-22 10:42:07,深圳本地股涨时你不涨，传媒涨时你不涨，连房地产涨你也不跟！姜剑，你们现在主营到底是什么？
于是,"https://guba.eastmoney.com/news,000038,581905171.html",2016-12-22 18:22:58,于是
明天中阴线,"https://guba.eastmoney.com/news,000038,581412266.html",2016-12-21 12:46:03,明天中阴线
给市场以期待,"https://guba.eastmoney.com/news,000038,581888059.html",2016-12-22 17:26:52,给市场以期待
笨小孩,"https://guba.eastmoney.com/news,000038,581502691.html",2016-12-21 15:31:27,在香港本地，最具价值的当属阴宅领域。香港是一个对风水学非常信奉的地区，对阴宅的风水非常的讲究，常人寻一地而不可得。在寸土寸金的香港一块好的墓地可以说是万金不换，阴宅领域中的龙头当属福泽集团（港股代码08108）、公司地处九龙，集团主营业务就是墓地领域、聘请有多位风水大师！当前股价远低于其本身价值，在深港通开通资金南下的冲击下必定一飞冲天！前两天08108福泽集团逆势拉升，涨幅达到8%，开启了拉升的帷幕。接下来的时间必定能够连续拉升上涨，朋友们可以尽早买入，在春节之前可以连续获得收益，早买早盈利！
5555555555,"https://guba.eastmoney.com/news,000038,581882996.html",2016-12-22 17:10:09,5555555555
时,"https://guba.eastmoney.com/news,000038,581882345.html",2016-12-22 17:08:03,时
12.15股市分析（喜欢的朋友记得点赞！感谢） 冲,"https://guba.eastmoney.com/news,000038,581879526.html",2016-12-22 16:58:20,继续关注：金牛化工，银鸽投资。稳健股：登海种
归功于上周老,"https://guba.eastmoney.com/news,000038,581868361.html",2016-12-22 16:24:14,归功于上周老
我问,"https://guba.eastmoney.com/news,000038,581808737.html",2016-12-22 14:10:04,是否到了买进的时候？
2017年股市相对安全且机会较多的是在沪市,"https://guba.eastmoney.com/news,000038,581757188.html",2016-12-22 11:47:43,2017年股市相对安全且机会较多的是在沪市
44,"https://guba.eastmoney.com/news,000038,581747233.html",2016-12-22 11:23:31,44
鸡精难道还没出 完 货 吗,"https://guba.eastmoney.com/news,000038,581731785.html",2016-12-22 10:55:29,千刀万剐 的 鸡精难道还没出完货吗
你会删我会发。反正没事,"https://guba.eastmoney.com/news,000038,581730414.html",2016-12-22 10:52:58,s
深大通压力和支撑位在哪？还有持有价值吗？,"https://guba.eastmoney.com/news,000038,576477475.html",2016-12-06 23:22:23,
千刀万剐的鸡精难道还没出完货吗,"https://guba.eastmoney.com/news,000038,581710129.html",2016-12-22 10:19:55,！
怎么回事,"https://guba.eastmoney.com/news,000038,581675734.html",2016-12-22 09:22:00,怎么回事
2017年股市相对安全且机会较多的是在沪市,"https://guba.eastmoney.com/news,000038,581670793.html",2016-12-22 09:05:54,2017年股市相对安全且机会较多的是在沪市
绩差股是彻底没戏了,"https://guba.eastmoney.com/news,000038,581668580.html",2016-12-22 08:57:32,绩差股是彻底没戏了
这股何时才能启动,"https://guba.eastmoney.com/news,000038,581635241.html",2016-12-22 00:00:03,这股何时才能启动
呢吗，吧里这帮水军不走，大通永远不会上涨。,"https://guba.eastmoney.com/news,000038,581624242.html",2016-12-21 22:54:05,呢吗，吧里这帮水军不走，大通永远不会上涨。
我出了，受不了了，祝大家发财…,"https://guba.eastmoney.com/news,000038,577070637.html",2016-12-08 13:48:59,我出了，受不了了，祝大家发财…
高手速来  妖股,"https://guba.eastmoney.com/news,000038,581582195.html",2016-12-21 20:12:13,秒杀 上峰水泥 000420 4 元 不到
此公司自诩为新媒体广告公司，前期高送转如此好的机会提升公司形象都不把握，股价跌成,"https://guba.eastmoney.com/news,000038,581561726.html",2016-12-21 18:47:51,此公司自诩为新媒体广告公司，前期高送转如此好的机会提升公司形象都不把握，股价跌成狗在所难免
上海国资股还将轮番上涨,"https://guba.eastmoney.com/news,000038,581512272.html",2016-12-21 15:57:39,上海国资股还将轮番上涨
上海国资股还将轮番上涨,"https://guba.eastmoney.com/news,000038,581493073.html",2016-12-21 15:07:09,上海国资股还将轮番上涨
44,"https://guba.eastmoney.com/news,000038,581467439.html",2016-12-21 14:23:08,44
44等着你,"https://guba.eastmoney.com/news,000038,581463480.html",2016-12-21 14:17:00,44等着你
快到44啦,"https://guba.eastmoney.com/news,000038,581444766.html",2016-12-21 13:49:10,快到44啦
促进加工贸易创新发展？好,"https://guba.eastmoney.com/news,000038,581415904.html",2016-12-21 12:59:22,促进加工贸易创新发展？好
这是好消息啊,"https://guba.eastmoney.com/news,000038,581415807.html",2016-12-21 12:59:01,这是好消息啊
要买也买没有漲的股票，高山风口的事谁都不愿干,"https://guba.eastmoney.com/news,000038,581415716.html",2016-12-21 12:58:49,要买也买没有漲的股票，高山风口的事谁都不愿干
可以小仓位进场参与下，切记不要恋战！,"https://guba.eastmoney.com/news,000038,581415400.html",2016-12-21 12:57:42,可以小仓位进场参与下，切记不要恋战！
既然是热点，哪里能暗自，矛盾,"https://guba.eastmoney.com/news,000038,581415327.html",2016-12-21 12:57:29,既然是热点，哪里能暗自，矛盾
水皮杂谈天时地利人和红十月改变谁的信仰？,"https://guba.eastmoney.com/news,000038,581414996.html",2016-12-21 12:56:16,水皮杂谈天时地利人和红十月改变谁的信仰？
还没到44吗？等？,"https://guba.eastmoney.com/news,000038,581414950.html",2016-12-21 12:56:06,还没到44吗？等？
与机构反思维好些,"https://guba.eastmoney.com/news,000038,581414034.html",2016-12-21 12:52:56,与机构反思维好些
"没人真看多,老子一直空仓,又要千古跌停了,开空大挣","https://guba.eastmoney.com/news,000038,581413992.html",2016-12-21 12:52:51,"没人真看多,老子一直空仓,又要千古跌停了,开空大挣"
各大机构集体翻多，小散们要小心啦，机构又开始是设套了。,"https://guba.eastmoney.com/news,000038,581413934.html",2016-12-21 12:52:34,各大机构集体翻多，小散们要小心啦，机构又开始是设套了。
指数要注意了，个股还是看多！,"https://guba.eastmoney.com/news,000038,581413873.html",2016-12-21 12:52:28,指数要注意了，个股还是看多！
你啥时候唱空过？,"https://guba.eastmoney.com/news,000038,581413834.html",2016-12-21 12:52:15,你啥时候唱空过？
别忽悠就是不买,"https://guba.eastmoney.com/news,000038,581413776.html",2016-12-21 12:52:02,别忽悠就是不买
别逗了，机构集体翻多？早跑完啦，集体看戏还差不多。,"https://guba.eastmoney.com/news,000038,581413741.html",2016-12-21 12:51:57,别逗了，机构集体翻多？早跑完啦，集体看戏还差不多。
鸡狗唱多，股市大跌！小散赶快跑！,"https://guba.eastmoney.com/news,000038,581413689.html",2016-12-21 12:51:42,鸡狗唱多，股市大跌！小散赶快跑！
说条求。股票害死我了,"https://guba.eastmoney.com/news,000038,581413649.html",2016-12-21 12:51:36,说条求。股票害死我了
看看600543的表现是不是越来越强了？事实就是事实,"https://guba.eastmoney.com/news,000038,581413523.html",2016-12-21 12:51:10,看看600543的表现是不是越来越强了？事实就是事实
一出新闻研报推荐。就会跌。。。,"https://guba.eastmoney.com/news,000038,581413479.html",2016-12-21 12:50:58,一出新闻研报推荐。就会跌。。。
紫金矿业，卷土重来，指日可待。,"https://guba.eastmoney.com/news,000038,581413422.html",2016-12-21 12:50:44,紫金矿业，卷土重来，指日可待。
心态第一，策略第二，技术只有屈居第三。撑死胆大的，饿死胆小的,"https://guba.eastmoney.com/news,000038,581413317.html",2016-12-21 12:50:23,心态第一，策略第二，技术只有屈居第三。撑死胆大的，饿死胆小的
妖王又停牌了看看那些人怎么玩还怎么比赛,"https://guba.eastmoney.com/news,000038,581413273.html",2016-12-21 12:50:12,妖王又停牌了看看那些人怎么玩还怎么比赛
我只知道我今天的股票还是跌了。,"https://guba.eastmoney.com/news,000038,581413213.html",2016-12-21 12:49:57,我只知道我今天的股票还是跌了。
"越来越多庄来了,该升的股都升了.就这股没有升","https://guba.eastmoney.com/news,000038,581413168.html",2016-12-21 12:49:47,"越来越多庄来了,该升的股都升了.就这股没有升"
有魔用？背离很久了，双顶很快就成型了。,"https://guba.eastmoney.com/news,000038,581413111.html",2016-12-21 12:49:35,有魔用？背离很久了，双顶很快就成型了。
啥子解放军？我还以为主力介入了！,"https://guba.eastmoney.com/news,000038,581413051.html",2016-12-21 12:49:19,啥子解放军？我还以为主力介入了！
操纵者＋跟随者。不抛弃。不放弃就跟追新股一样连板。,"https://guba.eastmoney.com/news,000038,581412971.html",2016-12-21 12:49:02,操纵者＋跟随者。不抛弃。不放弃就跟追新股一样连板。
不是这么说的,"https://guba.eastmoney.com/news,000038,581412798.html",2016-12-21 12:48:17,不是这么说的
四川双马，读者传媒成就了这批淘金者。,"https://guba.eastmoney.com/news,000038,581412746.html",2016-12-21 12:48:03,四川双马，读者传媒成就了这批淘金者。
估计收网了割吧,"https://guba.eastmoney.com/news,000038,581412688.html",2016-12-21 12:47:48,估计收网了割吧
能不能让我分点钱啊！,"https://guba.eastmoney.com/news,000038,581412624.html",2016-12-21 12:47:32,能不能让我分点钱啊！
真有这么厉害，只要 万本钱，一年下来估计都上千万了，还用在这混？,"https://guba.eastmoney.com/news,000038,581412513.html",2016-12-21 12:47:01,真有这么厉害，只要 万本钱，一年下来估计都上千万了，还用在这混？
明天走势要是 这就是股市的弊病 好就跟进,"https://guba.eastmoney.com/news,000038,581412465.html",2016-12-21 12:46:49,明天走势要是 这就是股市的弊病 好就跟进
人气上升，明天跳空高开,"https://guba.eastmoney.com/news,000038,581412323.html",2016-12-21 12:46:15,人气上升，明天跳空高开
说的容易做起来难,"https://guba.eastmoney.com/news,000038,581412167.html",2016-12-21 12:45:44,说的容易做起来难
