标题,链接,发布时间,内容
凡是加这加那的一切都是骗局,"https://guba.eastmoney.com/news,000605,546678455.html",2016-08-31 08:40:32,看见就恶心
球球8582 77780，民间牛散李福空间里有此股走势预测，买卖点分析很准，大家,"https://guba.eastmoney.com/news,000605,546673727.html",2016-08-31 08:11:33,球球8582 77780，民间牛散李福空间里有此股走势预测，买卖点分析很准，大家可以参考一下，进空间看就可以了，不谢，友备：111
机会与风险并在，有人看到风险有人看到机会,"https://guba.eastmoney.com/news,000605,546668116.html",2016-08-31 07:33:46,机会与风险并在，有人看到风险有人看到机会
渤海股份:关于项目预中标的提示性公告,"https://guba.eastmoney.com/news,000605,546385130.html",2016-08-30 11:41:46,"公告日期：2016-08-30
 证券代码：000605 证券简称：渤海股份 公告编号：2016-062

渤海水业股份有限公司

关于项目预中标的提示性公告

本公司及董事会全体成员保证公告内容的真实、准确和完整，没有虚假记载、误导性陈述或者重大遗漏。

2016年8月29日，河北省政府采购网公示了《卢龙县水处理及其他市政工程 PPP 项 目 预 中 标 公 告 》（http://www.ccgp-hebei.gov.cn/zfcg/preBidingAnncDetail_33665.html），渤海水业股份有限公司（以下简称“公司”）全资子公司天津市滨海水业集团有限公司（以下简称“滨海水业”）与嘉诚环保工程有限公司（以下简称“嘉诚环保”）组成的联合体被确定为卢龙县水处理及其他市政工程PPP项目预中标供应商。

一、项目预中标公示情况

项目名称：卢龙县水处理及其他市政工程PPP项目

采购单位：卢龙县环境保护局

预中标供应商：嘉诚环保工程有限公司、天津市滨海水业集团有限公司联合体

预中标报价：资本金财务内部收益率6.9%

项目概况：卢龙县水处理及其他市政工程PPP项目规划实施范围内的建设内容包含的22个子项目，其中自营项目1个，非自营项目21个（包括非经营项目2个，准经营项目19个）。

畜禽养殖类建设养殖小区49个；建设污水处理设施总处理规模10.5万吨/天；供水规模11.43万吨/天；污泥、粉浆水沉淀物、排泄物等综合利用项目处理能力18万吨/年；供热面积63.53万m2/年；新建污水收集管网115.57km，新建供水管网124.6km，新建供热管网1.74km。

二、中标公示事项对公司的影响

该项目若顺利实施，将对公司未来的经营业绩产生积极影响。

三、风险提示

该项目最终能否取得中标通知书和签署合同仍有不确定性。联合体如取得中标通知书，滨海水业将与嘉诚环保签订具体合作协议，相关协议内容需另行召开董事会审议通过后进行公告，并提交股东大会审议。公司将密切关注该项目的进展情况并及时履行信息披露义务，敬请广大投资者注意投资风险，同时请关注公司在指定信息披露媒体刊登的相关公告。

特此公告。

渤海水业股份有限公司董事会

2016年8月30日


[点击查看PDF原文]
提示：本网不保证其真实性和客观性，一切有关该股的有效信息，以交易所的公告为准，敬请投资者注意风险。"
都是看空的，明天必涨！！,"https://guba.eastmoney.com/news,000605,546507152.html",2016-08-30 16:22:21,都是看空的，明天必涨！！
观察了好久，和同力水泥一样的操盘手法，明天大概率跌停，奉劝大家该跑跑别上当了[胜,"https://guba.eastmoney.com/news,000605,545831421.html",2016-08-29 13:29:58,观察了好久，和同力水泥一样的操盘手法，明天大概率跌停，奉劝大家该跑跑别上当了
渤海股份预中标水处理PPP项目,"https://guba.eastmoney.com/news,000605,546397421.html",2016-08-30 12:33:22,"来源：中国证券网 
　　渤海股份午间公告，公司全资子公司滨海水业与嘉诚环保组成的联合体预中标卢龙县水处理及其他市政工程PPP项目。


　　据了解，该PPP项目规划实施范围内的建设内容包含22个子项目。其中畜禽养殖类建设养殖小区49个；建设污水处理设施总处理规模 10.5万吨/天；供水规模11.43万吨/天；污泥、粉浆水沉淀物、排泄物等综合利用项目处理能力18万吨/年；供热面积63.53万m2/年； 新建污水收集管网115.57km，新建供水管网124.6km，新建供热管网1.74km。该项目若顺利实施，将对渤海股份未来的经营业绩产生积极影响。
（来源：中国证券网 2016-08-30 12:31） [点击查看原文]"
这是钓鱼线啊,"https://guba.eastmoney.com/news,000605,546608434.html",2016-08-30 22:14:18,这是钓鱼线啊
渤海股份四哥为大家解析后市(附图）,"https://guba.eastmoney.com/news,000605,546582228.html",2016-08-30 20:49:40,渤海股份四哥为大家解析后市(附图）
启动,"https://guba.eastmoney.com/news,000605,546577441.html",2016-08-30 20:35:16,启动
你受益终生的！,"https://guba.eastmoney.com/news,000605,546577142.html",2016-08-30 20:34:22,你受益终生的！
将启动,"https://guba.eastmoney.com/news,000605,546576874.html",2016-08-30 20:33:36,将启动
似的,"https://guba.eastmoney.com/news,000605,546576659.html",2016-08-30 20:32:58,似的
605应该又是温州人坐的短庄,"https://guba.eastmoney.com/news,000605,546343527.html",2016-08-30 10:31:57,"看看前一段的2552
再看看605
一模一样的手法
别在幻想了，能跑赶紧跑"
正宗温州帮砸盘！有本事明天继续砸[想一下][想一下],"https://guba.eastmoney.com/news,000605,546516887.html",2016-08-30 16:54:09,正宗温州帮砸盘！有本事明天继续砸
八月收官之战，需要一只妖股,"https://guba.eastmoney.com/news,000605,546563341.html",2016-08-30 19:51:55,"今天的走势就不谈了，看的打瞌睡，据说因为太无聊可能会引发全国股民打扑克，所以姚记扑克的庄家估计疑问这种走势对该股是个利好，所以午盘和2点左右拉了一下。。。。。白云电器，短线做这一波，今日调整，我先减了些仓位，另外今日我私下关注的濮阳惠成和金字火腿明日可继续关注。另外今日尾盘私下的福利吉林化纤，买进的就放心持有，没有买进的鬼股不建议你们操作，因为这些都是短线操作，节奏比较快。短期市场已经进入了筑顶阶段，同时短期市场上涨空间已经被打开，市场后续反弹概率增大，所选个股特点比较鲜明，后市有望超越大盘。

明天是八月份的最后一个交易日了，你这个月的收益如何？收益不理想的可以觅先知，先知给你更多的机会。股市永不缺机会，大涨走出上涨趋势，是机会，就算他大跌，那也是跌出机会，总之，都是大机会。

既然涨跌都是机会，为什么你很难赚钱，天天还亏钱呢，因为你把握不住这些机会，你眼中的机会不是明确清晰必胜的，而是模模糊糊的机会，或者/应该/也许这笔交易能赚钱，而不是肯定赚钱。也就可以觅鬼股了。

从近日整体格局观察，股指延续震荡横盘，盘面热点方面缺乏明显持续性，昨日强势的PPP概念今日全线熄火，板块一日游格局下市场赚钱效应欠缺，以致量能再度萎缩，市场整体维持弱势，操作上基于盘面热点轮动较快，对于市场新热点短线不宜盲目追高，整体操作仍以控制仓位，快速博弈为宜。"
都看好是“”预“”中标别瞎买，来给主力接盘。,"https://guba.eastmoney.com/news,000605,546462793.html",2016-08-30 14:44:14,都看好是“”预“”中标别瞎买，来给主力接盘。
啥公告都跑来发，还预中标，不知多少人看见开板不计成本杀进去。,"https://guba.eastmoney.com/news,000605,546481469.html",2016-08-30 15:10:04,不出公告还好点，现在看啦庄家人品不咋样。这类走势明天会低开低走，或者横一天，短期暂时没希望回来。
利好出货接下来继续跌,"https://guba.eastmoney.com/news,000605,546529913.html",2016-08-30 17:40:19,利好出货接下来继续跌
振幅巨大，什么情况，无利空啊！,"https://guba.eastmoney.com/news,000605,546519399.html",2016-08-30 17:03:00,振幅巨大，什么情况，无利空啊！
居然没龙虎榜,"https://guba.eastmoney.com/news,000605,546509794.html",2016-08-30 16:30:53,居然没龙虎榜，庄家太坏了
这主力不知道怎么想的 早上打压得莫名其妙 早上21.21接了一丁点 现在看来明天能出得来,"https://guba.eastmoney.com/news,000605,546414663.html",2016-08-30 13:22:30,这主力不知道怎么想的 早上打压得莫名其妙 早上21.21接了一丁点 现在看来明天能出得来
3个投标项目，现在中了2个，之前的一个3.3亿，市场反应不大，我估计只要是没股价,"https://guba.eastmoney.com/news,000605,546400175.html",2016-08-30 12:45:19,3个投标项目，现在中了2个，之前的一个3.3亿，市场反应不大，我估计只要是没股价没接近年内的天量高点，这次是最大的一个PPP项目19亿，渤海市值40多亿，这二个项目加起来半个多市值了，下午会有什么反应吗？是打开跌停板，套一批天天跟消息走的割肉团，还是冲破24元大关，好期待。随便怎么样跌，不希望一下午趴在跌停价上，太无聊，流量用不完啊，随便怎么玩只要好玩就可以，买渤海是价值投资40亿市值比创业板还少，怕毛啊。
哈哈跑了是对的，又跌停了。,"https://guba.eastmoney.com/news,000605,546460683.html",2016-08-30 14:41:14,哈哈跑了是对的，又跌停了。
明天涨停,"https://guba.eastmoney.com/news,000605,546502347.html",2016-08-30 16:06:58,明天涨停
这股莫名其妙跌停了！还好忍住没抄底！,"https://guba.eastmoney.com/news,000605,546477865.html",2016-08-30 15:03:52,这股莫名其妙跌停了！还好忍住没抄底！
跌停是什么情况？这样的炒家走了是好事。,"https://guba.eastmoney.com/news,000605,546389527.html",2016-08-30 11:58:00,跌停是什么情况？这样的炒家走了是好事。
怎么没龙虎榜，求解,"https://guba.eastmoney.com/news,000605,546485622.html",2016-08-30 15:19:15,怎么没龙虎榜，求解
追高了，昙花一现。,"https://guba.eastmoney.com/news,000605,546447466.html",2016-08-30 14:20:48,追高了，昙花一现。
小散们赶快过来看看吧，会让你受益终生的！,"https://guba.eastmoney.com/news,000605,546422164.html",2016-08-30 13:36:28,小散们赶快过来看看吧，会让你受益终生的！
看来跌停是肯定了,"https://guba.eastmoney.com/news,000605,546464309.html",2016-08-30 14:46:07,看来跌停是肯定了
这个中标新闻就是个骗局 和威海股份那年似的,"https://guba.eastmoney.com/news,000605,546411972.html",2016-08-30 13:17:26,把散户骗进来后就停牌 然后等了几个月开盘暴跌
按历史经验来说没来由的直接跌停其实不惨！这种来回拉锯的下跌最惨！哎！,"https://guba.eastmoney.com/news,000605,546471592.html",2016-08-30 14:54:39,按历史经验来说没来由的直接跌停其实不惨！这种来回拉锯的下跌最惨！哎！
这股庄家真缺德,"https://guba.eastmoney.com/news,000605,546469497.html",2016-08-30 14:52:12,这股庄家真缺德
向跌停进发了,"https://guba.eastmoney.com/news,000605,546460108.html",2016-08-30 14:40:16,向跌停进发了
明天低开。炒底的又套了。,"https://guba.eastmoney.com/news,000605,546463150.html",2016-08-30 14:44:39,明天低开。炒底的又套了。
下午套人啊！,"https://guba.eastmoney.com/news,000605,546446763.html",2016-08-30 14:19:42,下午套人啊！
昨天最低点卖了，只赚了2个点[摊手]真是不会炒股。,"https://guba.eastmoney.com/news,000605,449135583.html",2016-07-15 07:11:59,昨天最低点卖了，只赚了2个点真是不会炒股。
渤海股份今天为何跌停？要不要走啊,"https://guba.eastmoney.com/news,000605,546384386.html",2016-08-30 11:39:25,渤海股份今天为何跌停？要不要走啊
跌停价买的，没想到打开一看,"https://guba.eastmoney.com/news,000605,546444788.html",2016-08-30 14:16:15,跌停价买的，没想到打开一看
有本事还砸到跌停 反正中标19个亿  反正砸盘的温州帮沙逼,"https://guba.eastmoney.com/news,000605,546429097.html",2016-08-30 13:48:52,有本事还砸到跌停 反正中标19个亿 反正砸盘的温州帮沙逼
哈哈！还真没赌错，明天平开就走。,"https://guba.eastmoney.com/news,000605,546429926.html",2016-08-30 13:50:21,哈哈！还真没赌错，明天平开就走。
虽然精确命中了唯一个跌停板被套,"https://guba.eastmoney.com/news,000605,546353405.html",2016-08-30 10:45:27,个人认为是强势洗盘，主力在这个位置出货可能性不大。
不看好，下午还是跌,"https://guba.eastmoney.com/news,000605,546432054.html",2016-08-30 13:53:59,不看好，下午还是跌
一天套两批 牛,"https://guba.eastmoney.com/news,000605,546423454.html",2016-08-30 13:38:50,一天套两批 牛
外盘大于内盘，资金流是负值的，就是庄做了个向下T+0,"https://guba.eastmoney.com/news,000605,546429600.html",2016-08-30 13:49:41,而已
22.90已出,"https://guba.eastmoney.com/news,000605,546418376.html",2016-08-30 13:29:30,22.90已出
卢龙县水处理及其他市政工程PPP项目19亿,"https://guba.eastmoney.com/news,000605,546419421.html",2016-08-30 13:31:17,项目名称为卢龙县水处理及其他市政工程PPP项目；项目预算约19亿；项目实施机构为河北省秦皇岛市卢龙县环境保护局；项目建设期为2年；项目地点为河北省秦皇岛市卢龙县。
渤海股份:关于第五届监事会第十六次会议决议的公告,"https://guba.eastmoney.com/news,000605,542286307.html",2016-08-25 20:17:32,"公告日期：2016-08-26
 证券代码：000605 证券简称：渤海股份 公告编号：2016-058

渤海水业股份有限公司

关于第五届监事会第十六次会议决议的公告

本公司及监事会全体成员保证公告内容的真实、准确和完整，没有虚假记载、误导性陈述或者重大遗漏。

渤海水业股份有限公司（以下简称“公司”）第五届监事会第十六次会议通知于2016年8月15日以电子邮件方式发出。本次会议于2016年8月25日9:30以通讯表决的方式召开,由监事会主席冯文清主持会议，本次应参会监事5人，实际参与表决5人。本次会议召开符合《公司法》以及《公司章程》的有关规定。

会议由监事会主席冯文清主持，经与会监事认真讨论并表决，形成如下决议：1、《2016年半年度报告及报告摘要》

表决结果：5票同意，0票反对，0票弃权，本议案获得表决通过。

详细内容见同日披露的《2016年半年度报告及报告摘要》。

2、《关于公司2016年半年度募集资金存放与使用情况专项报告的议案》表决结果：5票同意，0票反对，0票弃权，本议案获得表决通过。

详细内容见同日披露的《2016年半年度募集资金存放与使用情况专项报告》。

渤海水业股份有限公司监事会

2016年8月25日


[点击查看PDF原文]
提示：本网不保证其真实性和客观性，一切有关该股的有效信息，以交易所的公告为准，敬请投资者注意风险。"
不管利好利空，这股股性短线回调已经形成。,"https://guba.eastmoney.com/news,000605,546424436.html",2016-08-30 13:40:33,不管利好利空，这股股性短线回调已经形成。
危险哦！小心为上,"https://guba.eastmoney.com/news,000605,546424193.html",2016-08-30 13:40:07,危险哦！小心为上
每次放量都是下跌的开始，现在不跑明天等死？,"https://guba.eastmoney.com/news,000605,546423562.html",2016-08-30 13:39:01,每次放量都是下跌的开始，现在不跑明天等死？
依然上不去，明天还是跌！,"https://guba.eastmoney.com/news,000605,546423149.html",2016-08-30 13:38:20,依然上不去，明天还是跌！
这么快就尿玩了[大笑][大笑][大笑][大笑][大笑],"https://guba.eastmoney.com/news,000605,546422378.html",2016-08-30 13:36:53,这么快就尿玩了
