标题,链接,发布时间,内容
没人愿买，没人愿卖,"https://guba.eastmoney.com/news,002116,371983963.html",2016-05-04 09:30:24,没人愿买，没人愿卖
提前发布年报利好重组机器人目标42元,"https://guba.eastmoney.com/news,002116,314843869.html",2016-04-10 18:11:55,"长泰机器人自主研发的“长沙一号”工业机器人正式服务中国航天，航天首次应用中国自主品牌机器人。该项目是公司在打磨领域的又一突破。项目工件镁含量为90%，极为易燃。同时需要进行打磨。此技术领先行业至少5年。公司业务从系统集成起步，逐步发展到线体供应商和成套设备供应商，再到今天的本体供应商，公司的自主品牌研发从开始就与终端客户紧密联系在一起。在经过上百个项目实施经验的积累过程中，公司将终端客户的具体需求与控制系统研发设计上进行嵌入式的开发，目标是使得公司自主品牌的机器人打破机器人应用的“独立王国”，朝“即连即用”的方向发展。正源于此使得公司自主品牌机器人操作简便，在焊接和搬运码垛应用程序可通过简单的菜单式选择实现，获得客户认可。市场推广上，区别与目前许多其他自主品牌机器人在终端客户和集成商之间的责任矛盾，公司具备成套智能设备集成能力，在为客户提供成套智能设备的同时，配套使用公司自主品牌的工业机器人。凭借公司多年发展中积累的市场资源，加之政策扶持，使得公司自主品牌的工业机器人得以快速投放市场，已在焊接、搬运码垛行业广泛应用！！！全球人工智能技术大会召开 概念股炒作持续升温4月22日中国海城关注改名上海智能工程设计有限公司
【全球人工智能技术大会召开 概念股炒作持续升温】爱建证券建议投资者从两个维度选择A股中人工智能的相关标的：1、提供人工智能技术和设备的相关公司；2、基于人工智能技术和设备提供相关行业解决方案的相关公司。具体个股方面，爱建证券建议投资者关注川大智胜、科大讯飞、中国海城。
　　恰逢人工智能(AI)诞辰60周年，谷歌AlphaGo与世界围棋冠军李世石上演“世纪人机大战”，将人工智能的关注度推到了前所未有的高度。4月22日，北京国家会议中心将隆重举办“2016全球人工智能技术大会(GAITC)暨人工智能60周年纪念活动启动仪式”。此次活动由中国人工智能学会发起，联合中国仪器仪表学会、中国电子学会、中国自动化学会、中国认知科学学会、中国通信学会、中国机械工程学会、中国图象图形学学会、中国系统仿真学会、中国电工技术学会、中国指挥与控制学会、中国中文信息学会、中国航海学会、中国宇航学会、中国制冷学会、中国电影电视技术学会、中国农业工程学会、中国照明学会、中国金属学会、中国造纸学会等20余家国家一级学会，共同开启庆祝人工智能诞辰60周年智能化时代的新征程。纪念人工智能学科诞辰60周年是全球科技界的盛会，也是我国首次多学科、大跨度交叉的合作之举。让我们共襄盛举，结盟同行，一起对60年来人工智能科技发展历程进行深刻总结和隆重纪念，传承和弘扬人工智能科技的科学精神、激发全国科技工作者的创新热情和造福人类的抱负。
“人工智能60周年纪念活动”启动仪式将发布中国纪念人工智能60周年北京宣言，发布中国纪念人工智能60周年十大重点和百场专项纪念活动。届时将有老中青三代智能领域科技工作者近千人共同见证这一历史时刻！
爱建证券建议投资者从两个维度选择A股中人工智能的相关标的：1)提供人工智能技术和设备的相关公司；2)基于人工智能技术和设备提供相关行业解决方案的相关公司。具体个股方面，爱建证券建议投资者关注川大智胜、科大讯飞、中国海城注入长泰机器人，改名上海智能工程设计有限公司！重点关注002116中国海城！目标13个涨停板追赶机器人！42元"
中国海诚签2.1亿美元PVC项目承包合同,"https://guba.eastmoney.com/news,002116,287696038.html",2016-03-27 20:03:05,"来源：证券时报网 
　　中国海诚(002116)3月27日晚间公告，公司全资子公司中国轻工业长沙工程有限公司联合辽宁方大工程设计有限公司与DEJENA化学工程公司签订了《埃塞俄比亚默克莱市年产6万吨PVC树脂综合性生产厂的设计、供货、施工、安装、调试、培训、运行和维护管理的总承包交钥匙项目》，长沙子公司为项目总承包商。
　　合同约定长沙子公司承担提格莱州默克莱市年产6万吨PVC工程设计、采购、施工总承包工作。合同总金额为2.1亿美元，工程工期30个月。
　　中国海诚表示，项目建成后将成为埃塞俄比亚日产量最大的PVC项目，标志着公司在化工行业工程总承包领域取得了重要成绩。
（来源：证券时报网 2016-03-27 20:01） [点击查看原文]"
中国海诚获阿联酋16亿文化纸工程大单,"https://guba.eastmoney.com/news,002116,316143792.html",2016-04-11 09:18:05,"来源：中国证券网 
　　4月11日早间，中国海诚公告，全资子公司中国中轻国际工程有限公司(以下简称：北京子公司)4月7日和中国机械进出口(集团)有限公司以联合体的方式签订了阿联酋ITTIHAD国际投资有限公司投资的《年产33万吨文化纸工程》总承包合同。北京子公司为项目总承包商，负责该项目的设计、采购、施工、指导开机、质保管理等工作，合同额为2.555亿美元，约合16.54亿元人民币，占公司2015年度营业收入35.24%。主合同自签订日起正式生效，总工期为自合同启动之日起22个月。
　　本工程内容主要包括一条850吨/日商品浆碎解线、33万吨/年文化用纸生产线(含小裁)及相关配套的两台50吨燃气锅炉和污水处理厂等辅助设施。
　　公司称，该合同的正常履行对公司提升海外项目的总包能力、扩大行业影响力及在合同期内相应年度的经营业绩将会产生积极影响。
（来源：中国证券网 2016-04-11 09:16） [点击查看原文]"
什么时候召开股东大会，大家有点效率好不好？人家都是公布年报时确定股东大会召开日期,"https://guba.eastmoney.com/news,002116,916364861.html",2016-05-11 10:22:00,"什么时候召开股东大会，大家有点效率好不好？人家都是公布年报时确定股东大会召开日期的 
中国海诚
中国海诚：由于公司正在申请非公增发，此事项亦需提交股东大会审议。为提高工作效率，公司决定将年度股东大会和审议非公增发的股东大会合并召开。公司非公增发事项已经中轻集团上报国资委，公司将在国资委审批通过之后发出召开年度股东大会的通知。
(来自深交所互动易)答复时间 2016-05-11 10:22:00"
开跌[大笑],"https://guba.eastmoney.com/news,002116,368652041.html",2016-05-03 09:36:11,开跌
经营与党务分开是加强党的领导的中央统一部署，为此，贵司一个副总裁辞去副总裁职务，,"https://guba.eastmoney.com/news,002116,916361889.html",2016-05-12 14:31:00,"经营与党务分开是加强党的领导的中央统一部署，为此，贵司一个副总裁辞去副总裁职务，专职纪委书记，但该书记最近制定各部门的年度生产指标，请问是公司没有人呢，还是一种欺骗股民和当组织的行为？ 
中国海诚
中国海诚：公司下属各部门的年度经营指标是由公司总裁为首的高管层会同相关部门共同制定，由公司总裁最后决定的。
(来自深交所互动易)答复时间 2016-05-12 14:31:00"
垃圾！跑输大盘！,"https://guba.eastmoney.com/news,002116,355474228.html",2016-04-28 15:33:24,垃圾！跑输大盘！
必红,"https://guba.eastmoney.com/news,002116,355078721.html",2016-04-28 09:59:47,必红
13.28,"https://guba.eastmoney.com/news,002116,352788621.html",2016-04-27 14:07:22,13.28
竞价吓死宝宝啦，跌七个点，开盘跌两个点,"https://guba.eastmoney.com/news,002116,352520407.html",2016-04-27 09:28:51,竞价吓死宝宝啦，跌七个点，开盘跌两个点
买入吧。即将大涨,"https://guba.eastmoney.com/news,002116,351627931.html",2016-04-26 20:00:11,呵呵
4月21号的机构调研报告怎么没看见,"https://guba.eastmoney.com/news,002116,351067893.html",2016-04-26 10:49:00,"参与单位名称：东北证券：王小勇，汇添富：赵剑、叶丛飞。申万宏源：陆玲玲，朱雀投资：李树荣，晨燕资产：谢艳萍、詹凌燕、王观。
上市公司接待人员姓名：董事长：严晓俭，财务总监、董事会秘书：胡小平；董事会办公室主任：马志伟；证券事务代表：杨艳卫。
2016年4月18日、21日，公司在1217会议室接待了机构投资者的调研。交流之前，调研投资者首先签署了《承诺书》。

具体交流问题如下:
问题：如何保证未来公司业绩的稳健增长，有哪些措施？
回答：国内经济增长进入新常态，面对新常态，公司要进行转型。主业方面，要练好内功，降本增效，提升竞争力，继续为业主提供精品超值服务。在业务领域选择上，要继续沿产业链延伸，开拓新兴业务领域，进入智能装备、节能环保、垃圾焚烧、污水处理、化工医药、市政公用、创业园区等新的业务领域，寻找新的增长点。同时，公司准备设立投资公司，服务于公司专业发展。要加快科研成果商业化、产业化转换。要积极利用国家“一带一路”等政策利好，积极实施“走出去”战略，重点关注东南亚，非洲和拉丁美洲地区。在工程总承业务发展模式上要有创新，向BOT、PPP模式转变。

问题：如何应对向新兴业务领域转型慢？
回答：在新兴业务领域转型方面，公司顶层设计不够及时，激励力度不够大，不明显。公司在考虑更直接有效的激励措施，加快转型。

问题中轻集团的国企改革进展如何？中轻集团对公司定位如何？
公司是中轻集团下属唯一一家上市公司，集团公司全力支持公司上市公司，包括此次公司实施定增注资长泰公司。
集团公司还有一些科研院所、外经合作、装备制造等业务板块，科研院所包括四家国家级的研究院中国制浆造纸研究院、中国食品发酵工业研究院、中国日用化学工业研究院、中国皮革和制鞋工业研究院；科研院所业务板块、外经合作板块以及装备制造板块与公司对接较高。

问题：锂电池隔膜研发进展情况，是否会进行产业化？
回答：该项目符合国家产业政策，利用公司在造纸行业的技术优势采用造纸法研发锂离子电池隔膜技术，用于替代进口产品的产业化。目前，已经取得实验室研究的阶段性成果，下一步主要工作是研究满足产业化要求的相关技术和逐步扩大试验电池的功率，改进和完善既有研究成果，使研究项目最终能够达到产业化要求。至于该项目研发成功之后公司是否会生产运营，公司将根据市场需求情况和项目建设的经济分析结论，考虑采取自主产业化，合作产业化，转让技术等多种形式。

问题：公司未来工程总承包业务的发展思路？
回答：公司从上市开始进行从以设计为主业向以工程总承包业务为主业转型。公司所处的轻工工程建设领域项目总体投资体量不大，空间规模较小。公司工程总承包业务要积极进入新兴的业务领域，比如节能环保、垃圾焚烧、污水处理、化工医药、市政公用等新的业务领域。同时，在地域选择上，积极实施“走出去”战略，重点关注东南亚，非洲和拉丁美洲等地区市场。

问题：预计2016年新签订单的体量和规模？
回答：国内轻工行业整体投资依然没有好转，剔除公司公告的两个大单项目，公司新签订单压力依然较大。

问题：公司2015年新签订单下滑20%以上对公司今年业绩的影响？
回答：公司去年新签订单下降会影响公司今年的营业收入。而今年新签的两个大的项目会有利于今明两年的业绩。

问题：公司订单执行周期？
回答：设计订单执行周期较短，一般3-6个月即可完成。金额大的总承包业务执行周期一般2-3年，金额小的1年之内即可完成。 

问题： 公司定增方案调整情况？
回答：主要是对定价方式进行了调整，以及去掉了原来方案中增资长泰公司的员工持股计划。定价方式由锁价发行改为询价发行，原来方案中长泰公司员工持股计划进行增资不符合国资委相关文件规定，因此，去掉了员工持股计划。

问题：长泰公司的现状怎样？业务领域？机器人业务的工程技术人员有多少?
回答：长泰公司的发展比较缺资金，从2015年10月31日审计结果来看，是亏损的。因此，公司此次增资长泰公司采用资产基础法进行评估增资。长泰公司的三大业务领域包括制浆造纸智能装备、工业机器人应用系统以及智能化立体仓储系统。长泰公司机器人业务主要服务行业包括汽车、航天军工、轨道交通、民爆、白色家电等行业。从事机器人业务的工程技术人员有100名左右。

问题：预计长泰公司未来什么时候可以形成增长？
回答：从公司定向增发实施审批流程来看，如果顺利的话，预计在2016年底左右完成定增事项。希望在海诚投入以后会形成业绩拐点，实现增长。
展开阅读全文"
[牛][牛][牛][牛][牛][牛],"https://guba.eastmoney.com/news,002116,351329838.html",2016-04-26 14:43:05,
我想知道有谁这几天做T＋0的！,"https://guba.eastmoney.com/news,002116,348054358.html",2016-04-25 14:47:32,我想知道有谁这几天做T＋0的！
我也是醉了，大盘没新低，这股票却创调整以来的新低，主力不给力啊，再跌，我补仓的不,"https://guba.eastmoney.com/news,002116,347231290.html",2016-04-25 10:03:45,我也是醉了，大盘没新低，这股票却创调整以来的新低，主力不给力啊，再跌，我补仓的不等了，清了！
换手率极低，庄家还一直压盘,"https://guba.eastmoney.com/news,002116,350983767.html",2016-04-26 09:38:17,换手率极低，庄家还一直压盘
"这公司的领导进入了法眼,","https://guba.eastmoney.com/news,002116,348728990.html",2016-04-25 19:07:53,"法眼就是. 喝咖啡. 半月内见.

大家会知道股票的方向了."
明天继续大跌!,"https://guba.eastmoney.com/news,002116,335257633.html",2016-04-20 19:03:48,明天继续大跌!
什么情况?,"https://guba.eastmoney.com/news,002116,347110852.html",2016-04-25 09:24:28,什么情况?
中国海诚：神奇平均线解盘,"https://guba.eastmoney.com/news,002116,343955520.html",2016-04-24 11:31:12,单击两次图片看K线，日线收盘为准。日线收盘在指标线以上满仓，日线收盘在指标线以下空仓。股友那么多，不可能都发送个股指标图，以后每天根据博文大盘指标线操作，就可以大赚小赔。庄家的操盘手法不同，指标计算的价位就不同，股票不同指标的平均线就不同。指标计算出的价位有时接近5日均线，有时接近10日均线，有时接近20日均线，有时接近30日均线，有时接近40日均线，有时接近50日均线，有时接近60日均线，有时接近70日均线，有时接近80日均线。波段操作：当日收盘放量突破指标线买进，当日收盘跌破指标线卖出。如果买到强势股就能够坚持到每一波段的次高点，如果买到弱势股就只能控制风险，指标不可能适合所有股票都赚大钱。弱势股反复跌破指标线，就只能根据大盘指标线来操作，其它别无办法。指标只能亏一万赚两万，不可能一点都不吃亏。
大跌中成交量并没有放大，20日，21日，数据,"https://guba.eastmoney.com/news,002116,343287055.html",2016-04-24 07:39:40,大跌中成交量并没有放大，20日，21日，数据
中国海诚:2016年4月18日及2016年4月21日投资者关系活动记录表,"https://guba.eastmoney.com/news,002116,737358526.html",2016-04-22 00:00:00,"公告日期：2016-04-22
证券代码：002116 证券简称：中国海诚



中国海诚工程科技股份有限公司投资者关系活动记录表



投资者关系活动类别 机构投资者调研

参与单位名称

及人员姓名 东北证券：王小勇，汇添富：赵剑、叶丛飞。

申万宏源：陆玲玲，朱雀投资：李树荣，晨燕资产：谢艳萍、詹凌燕、王观

时 间 2016年4月18日 14:00—15:30

2016年4月21日 10:30—12:00

地 点 公司1217会议室

上市公司接待人员姓名 董事长：严晓俭，财务总监、董事会秘书：胡小平；董事会办公室主任：马志伟；证券事务代表：杨艳卫。

投资者关系活动

主要内容介绍 2016年4月18日、21日，公司在1217会议室接待了机构投资者的调研。交流之前，调研投资者首先签署了《承诺书》。



具体交流问题如下:

问题：如何保证未来公司业绩的稳健增长，有哪些措施？

回答：国内经济增长进入新常态，面对新常态，公司要进行转型。主业方面，要练好内功，降本增效，提升竞争力，继续为业主提供精品超值服务。在业务领域选择上，要继续沿产业链延伸，开拓新兴业务领域，进入智能装备、节能环保、垃圾焚烧、污水处理、化工医药、市政公用、创业园区等新的业务领域，寻找新的增长点。同时，公司准备设立投资公司，服务于公司专业发展。要加快科研成果商业化、产业化转换。要积极利用国家“一带一路”等政策利好，积极实施“走出去”战略，重点关注东南亚，非洲和拉丁美洲地区。在工程总承业务发展模式上要有创新，向BOT、PPP模式转变。



问题：如何应对向新兴业务领域转型慢？

回答：在新兴业务领域转型方面，公司顶层设计不够及时，激励力度不够大，不明显。公司在考虑更直接有效的激励措施，加快转型。



问题中轻集团的国企改革进展如何？中轻集团对公司定位如何？

公司是中轻集团下属唯一一家上市公司，集团公司全力支持公司上市公司，包括此次公司实施定增注资长泰公司。

集团公司还有一些科研院所、外经合作、装备制造等业务板块，科研院所包括四家国家级的研究院中国制浆造纸研究院、中国食品发酵工业研究院、中国日用化学工业研究院、中国皮革和制鞋工业研究院；科研院所业务板块、外经合作板块以及装备制造板块与公司对接较高。



问题：锂电池隔膜研发进展情况，是否会进行产业化？

回答：该项目符合国家产业政策，利用公司在造纸行业的技术优势采用造纸法研发锂离子电池隔膜技术，用于替代进口产品的产业化。目前，已经取得实验室研究的阶段性成果，下一步主要工作是研究满足产业化要求的相关技术和逐步扩大试验电池的功率，改进和完善既有研究成果，使研究项目最终能够达到产业化要求。至于该项目研发成功之后公司是否会生产运营，公司将根据市场需求情况和项目建设的经济分析结论，考虑采取自主产业化，合作产业化，转让技术等多种形式。



问题：公司未来工程总承包业务的发展思路？

回答：公司从上市开始进行从以设计为主业向以工程总承包业务为主业转型。公司所处的轻工工程建设领域项目总体投资体量不大，空间规模较小。公司工程总承包业务要积极进入新兴的业务领域，比如节能环保、垃圾焚烧、污水处理、化工医药、市政公用等新的业务领域。同时，在地域选择上，积极实施“走出去”战略，重点关注东南亚，非洲和拉丁美洲等地区市场。



问题：预计2016年新签订单的体量和规模？

回答：国内轻工行业整体投资依然没有好转，剔除公司公告的两个大单项目，公司新签订单压力依然较大。



问题：公司2015年新签订单下滑20%以上对公司今年业绩的影响？

回答：公司去年新签订单下降会影响公司今年的营业收入。而今年新签的两个大的项目会有利于今明两年的业绩。



问题：公司订单执行周期？

回答：设计订单执行周期较短，一般3-6个月即可完成。金额大的总承包业务执行周期一般2-3年，金额小的1年之内即可完成。 



问题： 公司定增方案调整情况？

回答：主要是对定价方式进行了调整，以及去掉了原来方案中增资长泰公司的员工持股计划。定价方式由锁价发行改为询价发行，原来方案中长泰公司员工持股计划进行增资不符合国资委相关文件规定，因此，去掉了员工持股计划。



问题：长泰公司的现状怎样？业务领域？机器人业务的工程技术人员有多少?

回答：长泰公司的发展比较缺资金，从2015年10月31日审计结果来看，是亏损的。因此，公司此次增资长泰公司采用资产基础法进行评估增资。长泰公司的三大业务领域包括制浆造纸智能装备、工业机器人应用系统以及智能化立体仓储系统。长泰公司机器人业务主要服务行业包括汽车、……

提示：本网不保证其真实性和客观性，一切有关该股的有效信息，以交易所的公告为准，敬请投资者注意风险。
展开阅读全文"
这样鸟股，机构太多，十大股东控股太多，没有庄家，也就是庄家太多，不可能拉的，你的,"https://guba.eastmoney.com/news,002116,337315081.html",2016-04-21 09:56:13,这样鸟股，机构太多，十大股东控股太多，没有庄家，也就是庄家太多，不可能拉的，你的想，如果你拉起来，你的成本就高了，其他机构就受益清仓
为什么打压呢,"https://guba.eastmoney.com/news,002116,337571566.html",2016-04-21 14:11:29,为什么打压呢
成交低迷，今天也就这样了。,"https://guba.eastmoney.com/news,002116,337584234.html",2016-04-21 14:22:08,成交低迷，今天也就这样了。
[哭]来个涨停[为什么][为什么][为什么][不屑][哭][哭][不屑][不屑],"https://guba.eastmoney.com/news,002116,337400919.html",2016-04-21 11:14:16,来个涨停[不屑][不屑][不屑]
停牌啦,"https://guba.eastmoney.com/news,002116,337254739.html",2016-04-21 09:22:20,停牌啦
大家出个什么劲啊，此股票又没涨，基本面还不错，补涨的可能性极大，是进的时候啊。,"https://guba.eastmoney.com/news,002116,334478876.html",2016-04-20 11:31:34,大家出个什么劲啊，此股票又没涨，基本面还不错，补涨的可能性极大，是进的时候啊。
我买入了,"https://guba.eastmoney.com/news,002116,333945556.html",2016-04-20 09:11:58,我买入了
"横有多长,树有多高","https://guba.eastmoney.com/news,002116,329398957.html",2016-04-18 20:20:30,"目前,,,,,横的不少. 就看树起来多高了."
广发安享灵活配置混合型证券投资基金基金份额持有人大会表决票基金份额持有人姓名或名称证件号码(身份证件号营业执照号),"https://guba.eastmoney.com/news,002116,330444148.html",2016-04-19 07:06:51,"公告日期：2016-04-19
　　附件三：广发安享灵活配置混合型证券投资基金基金份额持有人大会表决票基金份额持有人姓名或名称
证件号码(身份证件号/营业执照号)
（以权益登记日份额为准）
基金份额持有人持有份额
审议事项 同意 反对 弃权
《关于广发安享灵活配置混合型证券
投资基金修改基金合同相关事项的议
案》
基金份额持有人/受托人签名或盖章
2016年月日
重要提示：
1、机构投资者通过其管理的产品投资本基金的，投资者出具的本表决票表决意见视同其管理全部产品的投票意见。
2、请以打“√”方式在审议事项后注明表决意见。持有人必须选择一种且只能选择一种表决意见。本表决意见代表基金份额持有人在权益登记日所持全部基金份额的表决意见。表决意见未选、多选或字迹无法辨认或意愿无法判断、相互矛盾但其他各项符合会议通知规定的表决票均视为投票人放弃表决权利，其所持全部基金份额的表决结果均计为“弃权”。签名或盖章部分填写不完整、不清晰或未能提供有效证明基金份额持有人身份或代理人经有效授权的证明文件的，或未能在规定时间之内送达本公告规定的收件人的表决票计为无效表决票。

[点击查看PDF原文]
提示：本网不保证其真实性和客观性，一切有关该股的有效信息，以沪深交易所的公告为准，敬请投资者注意风险。"
今天机器人概念股都涨了，唯有这货稳跌！！！！！,"https://guba.eastmoney.com/news,002116,329206733.html",2016-04-18 17:15:41,今天机器人概念股都涨了，唯有这货稳跌！！！！！
