标题,链接,发布时间,内容
海欣食品能有几个涨停，一，人造肉，二，健康食品是每一个人都(追求的百年品牌，三，,"https://guba.eastmoney.com/news,002702,830003755.html",2019-05-13 19:47:25,海欣食品能有几个涨停，一，人造肉，二，健康食品是每一个人都(追求的百年品牌，三，产能不足，收购一个年产两万吨的新厂才4500万，真是比上市公司自建划算很多，还节约时间。这种收购才是企业扩大产能做大做强的样子。
是利好，在网上买过海欣的产品，品质不错，价格实惠，特别适合现代工薪阶层，是聚会吃,"https://guba.eastmoney.com/news,002702,829961587.html",2019-05-13 18:27:16,是利好，在网上买过海欣的产品，品质不错，价格实惠，特别适合现代工薪阶层，是聚会吃火锅的好材料，只要产能跟得上，应该可以做得很大，更何况是名牌产品
利好的话今天就不会跌了，主力的消息比我们知道要早,"https://guba.eastmoney.com/news,002702,830000682.html",2019-05-13 19:34:15,利好的话今天就不会跌了，主力的消息比我们知道要早
明天跌停不谢！,"https://guba.eastmoney.com/news,002702,829963342.html",2019-05-13 18:30:46,明天跌停不谢！
肯定涨停,"https://guba.eastmoney.com/news,002702,829999633.html",2019-05-13 19:31:58,肯定涨停
假拉然后下跌,"https://guba.eastmoney.com/news,002702,829977323.html",2019-05-13 18:51:38,假拉然后下跌
理论明天跌停[鼓掌][鼓掌][鼓掌],"https://guba.eastmoney.com/news,002702,829963312.html",2019-05-13 18:30:34,理论明天跌停
从利好公告可以看出海欣明天收红，希望多涨点[赞][赞][赞],"https://guba.eastmoney.com/news,002702,829960776.html",2019-05-13 18:26:03,从利好公告可以看出海欣明天收红，希望多涨点
廖吹吹学员抢了吗,"https://guba.eastmoney.com/news,002702,829960891.html",2019-05-13 18:26:28,
向三全学习吧,"https://guba.eastmoney.com/news,002702,829694276.html",2019-05-13 11:26:23,向三全学习吧
明天跌停板洗盘，打到4块以下,"https://guba.eastmoney.com/news,002702,829951152.html",2019-05-13 18:09:04,明天跌停板洗盘，打到4块以下
两市现在 优质 小盘 低价 高端 的食品消费百年老字号的股，也就只剩下海欣了，大,"https://guba.eastmoney.com/news,002702,829944175.html",2019-05-13 17:55:12,两市现在 优质 小盘 低价 高端 的食品消费百年老字号的股，也就只剩下海欣了，大家好好珍惜吧！
各位老板早上好，前段时间我清仓。现在回来了，计划本周末开始拉升，本轮计划拉升到1,"https://guba.eastmoney.com/news,002702,829927822.html",2019-05-13 17:25:35,各位老板早上好，前段时间我清仓。现在回来了，计划本周末开始拉升，本轮计划拉升到18元左右，请各位老板积极配合。
"关于收购资产框架协议风险提示,注意风险,这只是意向协议,建议逢高卖出观望","https://guba.eastmoney.com/news,002702,829927676.html",2019-05-13 17:25:14,"本框架协议仅为意向性协议，本次股权收购的具体事项，各方将根据尽职调
查、审计及评估结果等做进一步协商谈判，并依法履行相应的决策和审批程序，
从而签署正式股权转让协议。本框架协议及其后续的协议或合同的履行存在不确
定性风险。公司将按照《公司章程》及相关法律法规的规定，依法履行审批及信
息披露义务，敬请广大投资者注意投资风险。"
全仓买入，我是赌徒今亏了3仟多,"https://guba.eastmoney.com/news,002702,829921573.html",2019-05-13 17:12:20,全仓买入，我是赌徒今亏了3仟多
明天解套没问题？盈利估计没多少,"https://guba.eastmoney.com/news,002702,829918966.html",2019-05-13 17:07:25,明天解套没问题？盈利估计没多少
湛江海南哈哈好，海南岛到内陆大桥什么时通车,"https://guba.eastmoney.com/news,002702,829917316.html",2019-05-13 17:04:34,湛江海南哈哈好，海南岛到内陆大桥什么时通车
一发利好，一群小丑急得上串下跳，至于吗？公司收购标的资产，扩大经营规模，证监会鼓,"https://guba.eastmoney.com/news,002702,829915917.html",2019-05-13 17:01:46,一发利好，一群小丑急得上串下跳，至于吗？公司收购标的资产，扩大经营规模，证监会鼓励兼并重组！
长恒做人造肉业务吗,"https://guba.eastmoney.com/news,002702,829915891.html",2019-05-13 17:01:39,长恒做人造肉业务吗
请问公司的素肉丸冷冻多长时间才算过期？,"https://guba.eastmoney.com/news,002702,829900946.html",2019-05-15 14:32:00,"请问公司的素肉丸冷冻多长时间才算过期？ 
海欣食品
海欣食品：您好，感谢您的关注。公司无“素肉丸”这个产品，谢谢。
(来自深交所互动易)答复时间 2019-05-15 14:32:00"
我想恒兴为什么卖？,"https://guba.eastmoney.com/news,002702,829900308.html",2019-05-13 16:32:59,我想恒兴为什么卖？
最新人造肉题材股，集合竞价低于5％的涨幅可以抢！,"https://guba.eastmoney.com/news,002702,823664768.html",2019-05-06 00:24:10,最新人造肉题材股，集合竞价低于5％的涨幅可以抢！
长红,"https://guba.eastmoney.com/news,002702,829881709.html",2019-05-13 16:04:58,非洲猪瘟，就让海欣食品上位。
看来真做掉了，明天看竞价了,"https://guba.eastmoney.com/news,002702,829880249.html",2019-05-13 16:02:41,看来真做掉了，明天看竞价了
B林明天触中轨，观察主力何动作再决定,"https://guba.eastmoney.com/news,002702,829863091.html",2019-05-13 15:32:07,B林明天触中轨，观察主力何动作再决定
操盘手发来日内交易掉了50手，明天补回5.66走，5.46竞价成交,"https://guba.eastmoney.com/news,002702,829854311.html",2019-05-13 15:17:28,操盘手发来日内交易掉了50手，明天补回5.66走，5.46竞价成交
两天来，股价是风云跌宕。预估上涨，持有,"https://guba.eastmoney.com/news,002702,829849841.html",2019-05-13 15:10:03,两天来，股价是风云跌宕。预估上涨，持有
明天跌,"https://guba.eastmoney.com/news,002702,829844501.html",2019-05-13 15:01:34,明天跌
抄底了，明天吃肉,"https://guba.eastmoney.com/news,002702,829843459.html",2019-05-13 14:59:23,抄底了，明天吃肉
先弄1万股,"https://guba.eastmoney.com/news,002702,829837651.html",2019-05-13 14:51:56,先弄1万股
刚才的8000手大单呢，调皮的猪力，尼玛吓人吗,"https://guba.eastmoney.com/news,002702,829834857.html",2019-05-13 14:48:01,刚才的8000手大单呢，调皮的猪力，尼玛吓人吗
核按钮,"https://guba.eastmoney.com/news,002702,829834070.html",2019-05-13 14:47:07,核按钮
各种不解释！！坚定持有！！上看10块钱,"https://guba.eastmoney.com/news,002702,829830688.html",2019-05-13 14:43:18,各种不解释！！坚定持有！！上看10块钱
等碰10日线就能反弹了,"https://guba.eastmoney.com/news,002702,829831355.html",2019-05-13 14:44:00,等碰10日线就能反弹了
换手率挺高啊，这是几个意思，有没有高手分析一下,"https://guba.eastmoney.com/news,002702,829824345.html",2019-05-13 14:35:58,换手率挺高啊，这是几个意思，有没有高手分析一下
明天上去有几个涨停,"https://guba.eastmoney.com/news,002702,829821051.html",2019-05-13 14:31:59,明天上去有几个涨停
赶紧好涨了,"https://guba.eastmoney.com/news,002702,829814698.html",2019-05-13 14:25:02,赶紧好涨了
割肉的都是韭菜,"https://guba.eastmoney.com/news,002702,829813033.html",2019-05-13 14:23:16,割肉的都是韭菜
差不多 拉涨停了 呼叫万手哥,"https://guba.eastmoney.com/news,002702,829809516.html",2019-05-13 14:19:20,差不多 拉涨停了 呼叫万手哥
今天看来能红吗？,"https://guba.eastmoney.com/news,002702,829809372.html",2019-05-13 14:19:03,今天看来能红吗？
有本事拉红,"https://guba.eastmoney.com/news,002702,829808922.html",2019-05-13 14:18:13,有本事拉红
V型反转时刻到了，大家为国护盘！满仓干！,"https://guba.eastmoney.com/news,002702,829804167.html",2019-05-13 14:13:29,V型反转时刻到了，大家为国护盘！满仓干！
交大昂立涨停,"https://guba.eastmoney.com/news,002702,829801993.html",2019-05-13 14:11:16,交大昂立涨停
明天低开买进,"https://guba.eastmoney.com/news,002702,829802433.html",2019-05-13 14:11:34,明天低开买进
现在上车，反弹了,"https://guba.eastmoney.com/news,002702,829790762.html",2019-05-13 13:57:55,现在上车，反弹了
还好早上换了来伊份，这个垃圾,"https://guba.eastmoney.com/news,002702,829790031.html",2019-05-13 13:56:52,还好早上换了来伊份，这个垃圾
兄弟们拿好，10块钱妥妥的！！别听狗拖叫唤,"https://guba.eastmoney.com/news,002702,829780779.html",2019-05-13 13:44:54,兄弟们拿好，10块钱妥妥的！！别听狗拖叫唤
大单托，割韭菜,"https://guba.eastmoney.com/news,002702,829779976.html",2019-05-13 13:43:35,大单托，割韭菜
还不跑等死,"https://guba.eastmoney.com/news,002702,829777939.html",2019-05-13 13:41:14,还不跑等死
再不卖等会就没机会了、等死,"https://guba.eastmoney.com/news,002702,829769020.html",2019-05-13 13:29:15,再不卖等会就没机会了、等死
一个假拉把我骗进上顶，救命啊万手哥,"https://guba.eastmoney.com/news,002702,829767813.html",2019-05-13 13:27:44,一个假拉把我骗进上顶，救命啊万手哥
龙头---京粮控股开始发力啦！,"https://guba.eastmoney.com/news,002702,829763409.html",2019-05-13 13:22:02,海欣加油！
假拉,"https://guba.eastmoney.com/news,002702,829762936.html",2019-05-13 13:21:24,假拉
