标题,链接,发布时间,内容
大家跟我去双塔,"https://guba.eastmoney.com/news,002702,830642339.html",2019-05-14 13:46:09,大家跟我去双塔
利好出货，牛逼,"https://guba.eastmoney.com/news,002702,830639618.html",2019-05-14 13:44:05,利好出货，牛逼
散户别动，这样玩废了,"https://guba.eastmoney.com/news,002702,830637538.html",2019-05-14 13:42:28,散户别动，这样玩废了
人造肉还是选双塔[鼓掌],"https://guba.eastmoney.com/news,002702,830635625.html",2019-05-14 13:40:56,人造肉还是选双塔
该拉了吧,"https://guba.eastmoney.com/news,002702,830630039.html",2019-05-14 13:36:53,该拉了吧
一条公告引起上万人关注就这结果[大笑][大笑][大笑],"https://guba.eastmoney.com/news,002702,830627748.html",2019-05-14 13:35:05,一条公告引起上万人关注就这结果
洗盘结束，午后拉,"https://guba.eastmoney.com/news,002702,830588304.html",2019-05-14 13:02:06,洗盘结束，午后拉
1个月不换股,"https://guba.eastmoney.com/news,002702,830623417.html",2019-05-14 13:31:53,1个月不换股
怎么感觉像是在人为压盘呀[亏大了],"https://guba.eastmoney.com/news,002702,830619502.html",2019-05-14 13:28:32,怎么感觉像是在人为压盘呀
等主力等导火索[大笑],"https://guba.eastmoney.com/news,002702,830615196.html",2019-05-14 13:25:14,等主力等导火索
会不会突然涨停,"https://guba.eastmoney.com/news,002702,830587637.html",2019-05-14 13:01:21,会不会突然涨停
这股真垃圾啊,"https://guba.eastmoney.com/news,002702,830610425.html",2019-05-14 13:21:22,这股真垃圾啊
今日涨停价6.03[大笑][大笑][大笑],"https://guba.eastmoney.com/news,002702,830603585.html",2019-05-14 13:15:45,今日涨停价6.03
成交量又回到几十手的交易了,"https://guba.eastmoney.com/news,002702,830600700.html",2019-05-14 13:13:26,成交量又回到几十手的交易了
这么多人关注了，大资金流相信很快就会有了，要玩就玩点前瞻性[鼓掌][鼓掌][鼓掌,"https://guba.eastmoney.com/news,002702,830598036.html",2019-05-14 13:11:16,这么多人关注了，大资金流相信很快就会有了，要玩就玩点前瞻性
同样是收购，看表现吧,"https://guba.eastmoney.com/news,002702,830578253.html",2019-05-14 12:51:16,同样是收购，看表现吧
上面堆筹要有5万手，主力动用资金抢筹要二千万元左右,"https://guba.eastmoney.com/news,002702,830568961.html",2019-05-14 12:42:04,上面堆筹要有5万手，主力动用资金抢筹要二千万元左右
海欣食品拟4500万元收购长恒食品 并购同业解决产能瓶颈 e公司 05-13 1,"https://guba.eastmoney.com/news,002702,830556169.html",2019-05-14 12:29:22,"海欣食品拟4500万元收购长恒食品 并购同业解决产能瓶颈
e公司
05-13 18:34
关注
产能已接近饱和的“速冻鱼肉制品第一股”海欣食品（(002702）拟通过并购同业扩大产能。
海欣食品5月13日晚间公告，公司当日与恒兴集团、海南中城、长恒食品等签署《股权收购框架协议》。各方就公司拟以总价不超过4500万元收购恒兴集团、海南中城所持有的长恒食品100%股权的事项达成初步意向。
作为一家主要从事速冻鱼肉制品与速冻肉制品的食品加工公司，海欣食品2012年登陆A股市场，是其所在行业内首家上市公司，被称为速冻鱼肉制品第一股。海底捞、杨国福、中石化以及沃尔玛、永辉、大润发、家乐福等著名连锁超市都是其重要客户。
值得注意的是，目前海欣食品产能已基本饱和。5月10日接受机构调研时，海欣食品表示产能已基本饱和，但淡旺季产能利用率有差异，且旺季还可加开班次，整体还有潜力可挖。公司旗下高端鱼极系列产品随着销量的增长，出现了缺货断货的现象，一定程度上限制了高端产品的增长。去年公司在东山新增2条高端生产线，解决了目前产能问题。目前有产能扩张和整合的需求和规划，将优先选择福州本地产能升级，未来视市场情况也可走出去进行多点布局。
调研纪录披露不久，海欣食品就率先选择福州同业企业展开并购。
按照5月13日披露的协议，海欣食品拟斥资4500万元现金长恒食品100%股权。长恒食品位处福建连江县，2013年成立注册资本2500万元。公司主营范围是生产水产加工品鱼糜制品（非即食类）、速冻食品（速冻肉制品）（凭许可证经营）等。
海欣食品表示，如果本次交易能顺利实施并完成后续工作，将为公司未来扩大、整合并升级公司产能结构奠定基础，以便于公司进一步落实高端差异化战略，有利于提升公司业务规模和盈利水平。
事实上，海欣食品所处的速冻调理制品行业经历了2005到2012年的高速增长期，之后行业增速放缓，随着2013到2014年行业大量新增产能的集中释放，市场同质低价竞争日益激烈。目前行业仍处于洗牌整合期，但行业主要企业均形成了自己的差异化竞争优势，行业两级分化的竞争格局日益明朗，市场行业集中度进一步提升。
行业内小厂家在产品质量、渠道、客户、成本和规模等方面不具备优势；同时国家对生产安全，食品安全，环保等方面的政策监管趋严，以及材料成本、人工成本、运费等上升，又进一步压缩了小企业的生存空间，这将加速不规范企业的出清和行业的整合，市场将向大的全国性品牌集中。换言之，并购同业成为规模化企业提高产能和市占率的必由之路。
值得注意的是，近期大热的“人造肉”概念也牵涉到加工速冻食品的海欣食品。5月7到8日，海欣食品更一度拉出二连板，但随后公司澄清与“人造肉”产业并无关系。
海欣食品5月8日公告解释，公司仅使用少量大豆蛋白类原材料，不生产“人造肉”产品。公司主营业务构成包括速冻肉制品、速冻鱼肉制品和常温休闲鱼肉制品，无人造肉产品。就美国Beyond Meat公司的相关产品和技术，公司目前无人才和技术方面的储备。
截至5月13日收盘，海欣食品收报5.48元/股，最新市值26.35亿元。"
天天长上影线，散户太多了，主力也实力有限，大主力又看不上,"https://guba.eastmoney.com/news,002702,830550652.html",2019-05-14 12:23:40,浮筹巨多，不能带量突破箱体上缘6.3都是白搭
死马当活马医，守住你别让我失望，因为我一抛掉它就是喜欢涨停，我不会再上当了，陪你,"https://guba.eastmoney.com/news,002702,830544918.html",2019-05-14 12:17:50,死马当活马医，守住你别让我失望，因为我一抛掉它就是喜欢涨停，我不会再上当了，陪你到海枯石烂
看好的加仓，不看好的离开，我们是冲海欣可以做成海天那样巨无霸来的，下午吸货，。4,"https://guba.eastmoney.com/news,002702,830529013.html",2019-05-14 12:00:57,看好的加仓，不看好的离开，我们是冲海欣可以做成海天那样巨无霸来的，下午吸货，。45度向上，一直接到百亿市值，滕只管好业务
上午老板去泡妞了，下午老板回来开仓放粮，家里没米的请排队领号,"https://guba.eastmoney.com/news,002702,830525038.html",2019-05-14 11:56:22,上午老板去泡妞了，下午老板回来开仓放粮，家里没米的请排队领号
昨天放大量滞涨，今天又是放量下跌，连续几天资金净流出，肯定要出消息维稳股价了，不,"https://guba.eastmoney.com/news,002702,830005836.html",2019-05-13 19:58:54,昨天放大量滞涨，今天又是放量下跌，连续几天资金净流出，肯定要出消息维稳股价了，不就花了5000万买了一个公司嘛，都还没有用起来创造价值，哪里来利好？也哪里来利空？炒股最怕就是自欺欺人，不能够认识当下，连续几天放量下跌大资金在流出，又不是缩量下跌洗盘，你们还意淫？难怪套的怀疑人生。
5.37到5.48可以买点压压底仓，5.66出货，以后再跌五个点加仓，主力不希望,"https://guba.eastmoney.com/news,002702,830463562.html",2019-05-14 11:04:27,5.37到5.48可以买点压压底仓，5.66出货，以后再跌五个点加仓，主力不希望看到我，我就要给海欣的散户出主意，望所有人参考
昨天说涨停，几个板的兄弟出来走两步[滴汗][微笑],"https://guba.eastmoney.com/news,002702,830508978.html",2019-05-14 11:40:45,昨天说涨停，几个板的兄弟出来走两步
提前布局，加紧入场[大笑][大笑][大笑],"https://guba.eastmoney.com/news,002702,830508349.html",2019-05-14 11:40:18,提前布局，加紧入场
看好就持有！个人观点问题不大,"https://guba.eastmoney.com/news,002702,830508016.html",2019-05-14 11:39:50,看好就持有！个人观点问题不大
散户太多走,"https://guba.eastmoney.com/news,002702,830501499.html",2019-05-14 11:34:04,散户太多走
预祝收购成功！！！[鼓掌][鼓掌][鼓掌],"https://guba.eastmoney.com/news,002702,830476274.html",2019-05-14 11:15:03,预祝收购成功！！！
拉高出货,"https://guba.eastmoney.com/news,002702,830471299.html",2019-05-14 11:10:27,拉高出货
"开盘前就说了,逢高卖出,观望,现在市场比较混乱,注意风险","https://guba.eastmoney.com/news,002702,830471254.html",2019-05-14 11:10:25,"开盘前就说了,逢高卖出,观望,现在市场比较混乱,注意风险"
这弱?,"https://guba.eastmoney.com/news,002702,830467331.html",2019-05-14 11:07:38,这弱?
走了，下午要绿,"https://guba.eastmoney.com/news,002702,830463080.html",2019-05-14 11:04:04,走了，下午要绿
傻逼主力你自己玩吧不赔了,"https://guba.eastmoney.com/news,002702,830462260.html",2019-05-14 11:03:28,傻逼主力你自己玩吧不赔了
感觉还有故事啊！,"https://guba.eastmoney.com/news,002702,830455051.html",2019-05-14 10:58:03,感觉还有故事啊！
突破5.8吧，我跟。,"https://guba.eastmoney.com/news,002702,830448782.html",2019-05-14 10:53:20,拓展空间
真垃圾,"https://guba.eastmoney.com/news,002702,830442863.html",2019-05-14 10:49:03,真垃圾
炒股最好的办法就是不去看，免的等下手痒把他卖了，到时涨停就会后悔死了！,"https://guba.eastmoney.com/news,002702,830442732.html",2019-05-14 10:48:56,炒股最好的办法就是不去看，免的等下手痒把他卖了，到时涨停就会后悔死了！
下午会不会翻绿？,"https://guba.eastmoney.com/news,002702,830438940.html",2019-05-14 10:46:05,下午会不会翻绿？
冲高回落,"https://guba.eastmoney.com/news,002702,830430983.html",2019-05-14 10:40:08,冲高回落
双塔飞了,"https://guba.eastmoney.com/news,002702,830432004.html",2019-05-14 10:41:09,双塔飞了
怎么往下来呢,"https://guba.eastmoney.com/news,002702,830428877.html",2019-05-14 10:38:28,怎么往下来呢
大盘配合也涨不起来，基本可以撤了,"https://guba.eastmoney.com/news,002702,830420220.html",2019-05-14 10:31:47,大盘配合也涨不起来，基本可以撤了
大单拖着出货,"https://guba.eastmoney.com/news,002702,830372927.html",2019-05-14 09:47:42,大单拖着出货
高抛低吸主力成本很低,"https://guba.eastmoney.com/news,002702,830417161.html",2019-05-14 10:29:45,高抛低吸主力成本很低
大盘都起来了，飞啊,"https://guba.eastmoney.com/news,002702,830416319.html",2019-05-14 10:29:20,大盘都起来了，飞啊
一一一后来者居上一一一,"https://guba.eastmoney.com/news,002702,824605809.html",2019-05-07 10:33:17,山珍海味高端人造肉一一一海欣食品一一一冲击涨停
大盘起来了，这还不乘胜追击！,"https://guba.eastmoney.com/news,002702,830410810.html",2019-05-14 10:24:06,大盘起来了，这还不乘胜追击！
盘子小的股实力庄都不喜欢碰,"https://guba.eastmoney.com/news,002702,830404567.html",2019-05-14 10:17:51,盘子小的股实力庄都不喜欢碰
看好海欣[献花],"https://guba.eastmoney.com/news,002702,830405948.html",2019-05-14 10:19:38,看好海欣
还是劝不亏钱的卖了吧，如此垃圾别浪费时间，一天就四个小时交易一周就五天，时间就是,"https://guba.eastmoney.com/news,002702,830403534.html",2019-05-14 10:16:38,还是劝不亏钱的卖了吧，如此垃圾别浪费时间，一天就四个小时交易一周就五天，时间就是金钱
这个死抓住不放，免的后悔,"https://guba.eastmoney.com/news,002702,830403262.html",2019-05-14 10:16:22,这个死抓住不放，免的后悔
今天进的全部套牢,"https://guba.eastmoney.com/news,002702,830402635.html",2019-05-14 10:15:45,今天进的全部套牢
垃圾海欣反弹无力,"https://guba.eastmoney.com/news,002702,830394062.html",2019-05-14 10:06:51,垃圾海欣反弹无力
感觉这货没有真正主力进去,"https://guba.eastmoney.com/news,002702,830395889.html",2019-05-14 10:08:38,主力：就是不想进，就是想等等，具体等什么，我也不知道
海天的妹妹海欣加油看好你,"https://guba.eastmoney.com/news,002702,830386265.html",2019-05-14 10:00:19,海天的妹妹海欣加油看好你
明天必然跌停,"https://guba.eastmoney.com/news,002702,829905106.html",2019-05-13 16:41:05,明天必然跌停
走全仓！下午进半仓！,"https://guba.eastmoney.com/news,002702,830380638.html",2019-05-14 09:54:52,走全仓！下午进半仓！
大单流入，赶紧抢吧,"https://guba.eastmoney.com/news,002702,830384759.html",2019-05-14 09:58:47,大单流入，赶紧抢吧
现在散户真着急，庄家刚刚还在梳头，准备吃早饭！,"https://guba.eastmoney.com/news,002702,830376746.html",2019-05-14 09:50:54,现在散户真着急，庄家刚刚还在梳头，准备吃早饭！
志在长远，有远见，不是一般人！！！,"https://guba.eastmoney.com/news,002702,830371586.html",2019-05-14 09:46:10,志在长远，有远见，不是一般人！！！
借利好拉高出货,"https://guba.eastmoney.com/news,002702,830370217.html",2019-05-14 09:45:10,借利好拉高出货
低吸,"https://guba.eastmoney.com/news,002702,830367490.html",2019-05-14 09:42:46,低吸
老夫的感悟：海欣食品没让我失望,"https://guba.eastmoney.com/news,002702,830365740.html",2019-05-14 09:41:09,今后一日三餐需备上海欣产品，感恩
跳水,"https://guba.eastmoney.com/news,002702,830363863.html",2019-05-14 09:39:31,跳水
太弱了吧,"https://guba.eastmoney.com/news,002702,830365159.html",2019-05-14 09:40:41,太弱了吧
明天开盘逃命机会^_^,"https://guba.eastmoney.com/news,002702,829863081.html",2019-05-13 15:32:06,明天开盘逃命机会^_^
加油加油加油,"https://guba.eastmoney.com/news,002702,830361496.html",2019-05-14 09:37:08,加油加油加油
"逢高卖出,建议观望,布局纺织,群星玩具也可以","https://guba.eastmoney.com/news,002702,830348099.html",2019-05-14 09:23:19,"逢高卖出,建议观望,布局纺织逢高卖出,建议观望,布局纺织,群星玩具也可以"
快跑吧,"https://guba.eastmoney.com/news,002702,830345910.html",2019-05-14 09:20:56,快跑吧
今天完蛋,"https://guba.eastmoney.com/news,002702,830342686.html",2019-05-14 09:17:21,今天完蛋
？,"https://guba.eastmoney.com/news,002702,830342130.html",2019-05-14 09:16:38,？
美国人造肉回调结束昨晚上开始上涨，今天国内人造肉概念万绿一点红，维维海欣带领！,"https://guba.eastmoney.com/news,002702,830337713.html",2019-05-14 09:09:50,美国人造肉回调结束昨晚上开始上涨，今天国内人造肉概念万绿一点红，维维海欣带领！
昨天有朋友说:感觉这个票可以长期持有，同感啊！现在的年轻人，未来的消费主力军，昨,"https://guba.eastmoney.com/news,002702,830335381.html",2019-05-14 09:05:48,昨天有朋友说:感觉这个票可以长期持有，同感啊！现在的年轻人，未来的消费主力军，昨天在沃尔玛看到了海欣的鱼极，很亲切哦，今后加大购买力度，哈哈哈！
为国护盘的日子到了，关键节点，大家提好裤子，别掉链子啊！[鼓掌],"https://guba.eastmoney.com/news,002702,830331057.html",2019-05-14 08:58:22,为国护盘的日子到了，关键节点，大家提好裤子，别掉链子啊！
今天高开低走！！！[摊手],"https://guba.eastmoney.com/news,002702,830323528.html",2019-05-14 08:41:36,今天高开低走！！！
海欣今天想上车的朋友估计连车票都买不到！,"https://guba.eastmoney.com/news,002702,830322083.html",2019-05-14 08:33:18,海欣今天想上车的朋友估计连车票都买不到！
人造肉王者归来,"https://guba.eastmoney.com/news,002702,830310821.html",2019-05-14 08:06:22,昨晚欧美股市暴跌，唯独人造肉股票逆势大涨，今天我们的A股也将跟随，人造肉将王者归来
昨夜美国大傻，欧洲三傻都跌了，今天有机会买到低点股票,"https://guba.eastmoney.com/news,002702,830307412.html",2019-05-14 07:52:52,昨夜美国大傻，欧洲三傻都跌了，今天有机会买到低点股票
4块横盘吸筹好久，拉高之时就是出货时候,"https://guba.eastmoney.com/news,002702,830276406.html",2019-05-14 07:05:55,4块横盘吸筹好久，借利好拉高出货，就等韭菜们入场了，今天暂时别指望了，拉高赶紧跑
长江经济带？海欣算吧，上海本地股,"https://guba.eastmoney.com/news,002702,830234139.html",2019-05-14 05:46:10,长江经济带？海欣算吧，上海本地股
大厦将倾，一地鸡毛,"https://guba.eastmoney.com/news,002702,830266584.html",2019-05-14 06:59:52,大厦将倾，一地鸡毛
人造肉！王者归来，三连涨,"https://guba.eastmoney.com/news,002702,830236165.html",2019-05-14 05:55:03,人造肉！王者归来，三连涨
唱空唱多能把股价唱起唱落，那就唱吧！真看好就别买，不看好卖出，还坚信海欣能做成海,"https://guba.eastmoney.com/news,002702,830133179.html",2019-05-14 00:15:50,唱空唱多能把股价唱起唱落，那就唱吧！真看好就别买，不看好卖出，还坚信海欣能做成海天就慢慢加仓
睡了，与海欣一起做个好梦！大家晚安！海欣食品，花这么少的钱买公司，是在做梦吧?,"https://guba.eastmoney.com/news,002702,830121177.html",2019-05-13 23:46:32,睡了，与海欣一起做个好梦！大家晚安！海欣食品，花这么少的钱买公司，是在做梦吧?
收购时间表都列出来了，海欣食品很有良心，点赞！！！,"https://guba.eastmoney.com/news,002702,830119456.html",2019-05-13 23:42:35,收购时间表都列出来了，海欣食品很有良心，点赞！！！
励害了,"https://guba.eastmoney.com/news,002702,830091019.html",2019-05-13 22:49:12,励害了
谁能看出来，机构今天是买还是卖，股价未来3天是涨还是跌？,"https://guba.eastmoney.com/news,002702,830117039.html",2019-05-13 23:37:00,谁能看出来，机构今天是买还是卖，股价未来3天是涨还是跌？
"Beyond Mea,表妹又涨了！","https://guba.eastmoney.com/news,002702,830104991.html",2019-05-13 23:17:50,"Beyond Mea,表妹又涨了！"
海欣食品，花这么少的钱，买公司，是在做梦吧?,"https://guba.eastmoney.com/news,002702,830103829.html",2019-05-13 23:14:34,海欣食品，花这么少的钱，买公司，是在做梦吧?
如果能拿下长恒，海欣4500w捡到宝了 详见下图 所在地连江 重点国家开发县市，,"https://guba.eastmoney.com/news,002702,830080644.html",2019-05-13 22:28:20,"如果能拿下长恒，海欣4500w捡到宝了 详见下图
所在地连江 重点国家开发县市，过不了多久海欣板块会多一个福建自贸区 年产值2亿 刨去成本 净利润没8000w也有1亿 收购的4500w半年回本
以下图片为网上截图 非本人自淫 供参考"
哈哈哈哈哈哈哈哈哈，买对了。,"https://guba.eastmoney.com/news,002702,830092340.html",2019-05-13 22:51:27,哈哈哈哈哈哈哈哈哈，买对了。
14年收购鱼极股价从11元最高涨到39元，这次收购股价从5元涨到多少呢？大家说说,"https://guba.eastmoney.com/news,002702,830022128.html",2019-05-13 20:32:53,14年收购鱼极股价从11元最高涨到39元，这次收购股价从5元涨到多少呢？大家说说
先看8块把,"https://guba.eastmoney.com/news,002702,830070394.html",2019-05-13 22:09:11,先看8块把
再说一下，明天食品行业应该还是大涨！对外贸易股利好，宏辉果蔬，可以关注,"https://guba.eastmoney.com/news,002702,830075351.html",2019-05-13 22:18:54,再说一下，明天食品行业应该还是大涨！对外贸易股利好，宏辉果蔬，可以关注
海欣食品(002702)的故事从今起开讲,"https://guba.eastmoney.com/news,002702,830070815.html",2019-05-13 22:10:08,就来亨受美好过程吧！
上午发帖！！上看10块！有人不信！！！看到公告，我想说真的良心帖,"https://guba.eastmoney.com/news,002702,830070054.html",2019-05-13 22:09:04,上午发帖！！上看10块！有人不信！！！看到公告，我想说真的良心帖
晚间利好个股2019.5.13,"https://guba.eastmoney.com/news,002702,830065710.html",2019-05-13 22:02:11,"【澳洋健康：子公司就工业大麻事宜签署合作协议】澳洋健康控股子公司阜宁澳洋与黑龙江赵光农场签订战略合作协议。双方就工业大麻的种植、工业大麻麻皮的收购等事宜达成协议；公司拟通过该合作协议为工业大麻纤维的生产提供稳定、可靠地原料供应。同时，阜宁澳洋与江苏省纺织工业设计研究院签订战略合作协议，双方就工业大麻纤维生产、技术研发事宜达成一致意见。另外，阜宁澳洋三期16万吨/年差别化粘胶短纤项目A线达到试生产状态。
【海欣食品：拟不超4500万元收购长恒食品】海欣食品与恒兴集团、海南中城、长恒食品等签署《股权收购框架协议》。各方就公司拟以总价不超过4500万元收购恒兴集团、海南中城所持有的长恒食品100%股权的事项达成初步意向。
【普邦股份：中标近3亿元项目】普邦股份于近日收到深圳市前海开发投资控股有限公司发来的《中标通知书》，确认公司为前海桂湾公园项目绿化景观工程施工总承包Ⅰ标项目的中标单位。中标价格为29,633.544190万元。 
【东宏股份：控股股东拟增持不超2%股份】东宏股份控股股东东宏集团计划未来6个月内增持公司股份，拟增持金额不少于2000万元，不超过1亿元，增持数量不超过512.83万股（占公司总股本的2%），拟增持价格不超过16元/股。
【方正科技：举牌方拟增持5000万元至1.5亿元公司股份】方正科技股东曾远彬及其一致行动人计划5月11日起的未来6个月内，增持公司股份金额不低于5000万元，不超过1.5亿元。此前，方正科技获曾远彬及其一致人举牌，持股比例达5%。
【中联重科：拟回购公司2.5%至5%股份用于员工持股计划】中联重科拟使用自有资金以集中竞价方式回购公司A股股份，全部用于员工持股计划。本次回购股份的数量不低于总股本的2.5%，不超总股本的5%；回购股份的价格不超人民币7.63元/股；预计本次回购资金总额不超297,913.31万元，资金来源为自有资金。
【东百集团：拟回购7500万元至1.5亿元公司股份】东百集团拟回购资金不低于7500万元，不超过1.5亿元，回购价格不超过7.5元/股
（来源：中汇国控的财富号 2019-05-13 22:02） [点击查看原文]"
请大家帮我解读哈这段话是啥意思？谢谢,"https://guba.eastmoney.com/news,002702,830058463.html",2019-05-13 21:48:37,本公司部分产品有使用大豆蛋白类原材料，属于上述大豆蛋白肉的范畴。人造肉产品相对于传统自然肉在营养，疾病预防，环境和资源保护方面具备一定优势。公司对相关领域的前沿技术予以关注和跟踪！
明天会涨我改性,"https://guba.eastmoney.com/news,002702,830030756.html",2019-05-13 20:55:26,明天会涨我改性
跌破5.3满仓干[大笑][大笑],"https://guba.eastmoney.com/news,002702,830033818.html",2019-05-13 21:06:01,跌破5.3满仓干
今天买2300股5.497的本，不知道明天怎么样？,"https://guba.eastmoney.com/news,002702,830032335.html",2019-05-13 21:03:01,今天买2300股5.497的本，不知道明天怎么样？
跌破5.3加仓干[鼓掌][鼓掌],"https://guba.eastmoney.com/news,002702,830033410.html",2019-05-13 21:04:56,跌破5.3加仓干
海欣食品：拟不超4500万元收购长恒食品,"https://guba.eastmoney.com/news,002702,829899905.html",2019-05-13 16:31:29,"来源：证券时报
　　 海欣食品(002702)5月13日晚间公告，公司当日与恒兴集团、海南中城、长恒食品等签署《股权收购框架协议》。各方就公司拟以总价不超过4500万元收购恒兴集团、海南中城所持有的长恒食品100%股权的事项达成初步意向。 

（文章来源：证券时报） [点击查看原文]"
百年企业，长线大牛！,"https://guba.eastmoney.com/news,002702,830031421.html",2019-05-13 21:00:10,百年企业，长线大牛！
感觉这支股应该长期持有，,"https://guba.eastmoney.com/news,002702,830024311.html",2019-05-13 20:37:21,感觉这支股应该长期持有，
2点43和2点46出现了将近万手护盘，虽然撤单比较快，但可以反应出主力维持股价意,"https://guba.eastmoney.com/news,002702,829969126.html",2019-05-13 18:38:21,2点43和2点46出现了将近万手护盘，虽然撤单比较快，但可以反应出主力维持股价意图。今日晚上又有利好，明天收红应该没问题。具体涨幅多少明天收盘看了！
