标题,链接,发布时间,内容
铁汉，既然有业绩你还不涨，我都为你加仓勒[献花][献花][献花],"https://guba.eastmoney.com/news,300197,612401004.html",2017-02-28 10:14:29,铁汉，既然有业绩你还不涨，我都为你加仓勒
垃圾就是垃圾再多的利好也就是配合庄稼出货而已！,"https://guba.eastmoney.com/news,300197,612400321.html",2017-02-28 10:13:21,垃圾就是垃圾再多的利好也就是配合庄稼出货而已！
今天估计会爆射一下，同意的点赞,"https://guba.eastmoney.com/news,300197,612362963.html",2017-02-28 08:33:16,今天估计会爆射一下，同意的点赞
铁汉解禁是利好: 常言道:众人拾柴火焰高，解禁（三月份）的都是战略投资者，非散户,"https://guba.eastmoney.com/news,300197,612316917.html",2017-02-27 22:37:56,"铁汉解禁是利好:
常言道:众人拾柴火焰高，解禁（三月份）的都是战略投资者，非散户也。
他们都实力非凡，不挣个60%
以上，不够口呀。
所以，197会在三月收个大阳线。"
铁汉的传统，利好一出庄家准跑。,"https://guba.eastmoney.com/news,300197,612315509.html",2017-02-27 22:30:21,铁汉的传统，利好一出庄家准跑。
缺口补完了。那些被拖害死的人有多少。证明了周五我说的话。待大涨,"https://guba.eastmoney.com/news,300197,612109496.html",2017-02-27 10:37:54,缺口补完了。那些被拖害死的人有多少。证明了周五我说的话。待大涨
跟屁虫。看 蒙草的。,"https://guba.eastmoney.com/news,300197,612133149.html",2017-02-27 11:28:32,11111
铁汉生态今天终于有点起色咯，大家把票拿住咯[献花][献花][献花],"https://guba.eastmoney.com/news,300197,612108164.html",2017-02-27 10:35:18,铁汉生态今天终于有点起色咯，大家把票拿住咯
今年的园林龙头出来了  300495   预测收益从1.75亿到3.7亿,"https://guba.eastmoney.com/news,300197,612084978.html",2017-02-27 09:52:09,今年的园林龙头出来了 300495 预测收益从1.75亿到3.7亿
菲达环保，PPP概念，滞涨的大气治理概念股。1.23亿贵州金织垃圾焚烧PPP模式稳步推进。可以留意,"https://guba.eastmoney.com/news,300197,563198781.html",2016-10-28 14:00:19,菲达环保，PPP概念，滞涨的大气治理概念股。1.23亿贵州金织垃圾焚烧PPP模式稳步推进。可以留意
明白了，2016年12月15日，大股东刘水将6000万股以11..57元每股的价,"https://guba.eastmoney.com/news,300197,611597067.html",2017-02-24 13:15:13,明白了，2016年12月15日，大股东刘水将6000万股以11..57元每股的价钱转让给珠海横滨，总价7亿元，7亿元可不是闹着玩的，相信珠海横滨对公司是看好的，有眼光的战略投资。最近股价的调整或许是有阴谋诡计，三月份的限售股解禁给了这阴谋以理由，但是大宗交易的6000万股11.57元每股总价7亿的事实 ，已经封杀了股价的下跌，（可参看元力股份的大宗交易股价走势），一个市值只有180亿元的公司 ，在手大定单竟有110多亿，可想而知未来业绩和股价的走势了，这也看出大股东打压股价吸筹的用心 ，只可惜了散户在股价即将拉升之即交出了带血筹码！
此吧分为两个极端的派别啊！ 叫涨的估计是已经建仓或者是稍微有点被套的！ 喊跌的估,"https://guba.eastmoney.com/news,300197,611986044.html",2017-02-26 17:29:11,"此吧分为两个极端的派别啊！
叫涨的估计是已经建仓或者是稍微有点被套的！
喊跌的估计是想进仓还嫌高，看涨又担心踏空的！"
RSI反转开始[牛],"https://guba.eastmoney.com/news,300197,611934872.html",2017-02-26 09:34:57,RSI反转开始
缺口即将补完，将大涨了，等着瞧，,"https://guba.eastmoney.com/news,300197,611931721.html",2017-02-26 08:57:15,缺口即将补完，将大涨了，等着瞧，
三月份巨大解禁股，估计和蒙草生态一样走势，暴跌开始,"https://guba.eastmoney.com/news,300197,611890201.html",2017-02-25 22:32:07,三月份巨大解禁股，估计和蒙草生态一样走势，暴跌开始
终于跑了！汉子借利好出货！为什么！汉子！拜拜,"https://guba.eastmoney.com/news,300197,461881526.html",2016-07-21 20:37:43,终于跑了！汉子借利好出货！为什么！汉子！拜拜
中的标和东方园林比太小了是后者十分之一，东方园林市值才多少,"https://guba.eastmoney.com/news,300197,611788135.html",2017-02-25 08:44:07,中的标和东方园林比太小了是后者十分之一，东方园林市值才多少
持有铁汉生态已两年了，已经成股东！相信铁汉生态！风雨同舟，不离不弃！,"https://guba.eastmoney.com/news,300197,611613835.html",2017-02-24 13:51:43,持有铁汉生态已两年了，已经成股东！相信铁汉生态！风雨同舟，不离不弃！
中标和东方园林比太小了，前者是后者十分之一，东方园林市值多少，比一比。,"https://guba.eastmoney.com/news,300197,611788340.html",2017-02-25 08:46:11,中标和东方园林比太小了，前者是后者十分之一，东方园林市值多少，比一比。
主力，散户快跑光了！赶紧砸1把 [不屑],"https://guba.eastmoney.com/news,300197,611637361.html",2017-02-24 14:42:11,主力，散户快跑光了！赶紧砸1把 [不屑]
东方园林暴起，新中标的铁汉像个娘们，等爷日呢,"https://guba.eastmoney.com/news,300197,611633152.html",2017-02-24 14:33:07,[大便][大便][大便][大便][不赞][大便]
为了员工持股能拿到较低的价格而拼命压股价，却伤害了广大小股东的心，值得吗？,"https://guba.eastmoney.com/news,300197,611625433.html",2017-02-24 14:16:56,为了员工持股能拿到较低的价格而拼命压股价，却伤害了广大小股东的心，值得吗？
铁汉每中一个标就得二次下跌，预中标要下跌，正式公布中标又要下跌，估计再中几次股价,"https://guba.eastmoney.com/news,300197,611589291.html",2017-02-24 12:44:59,铁汉每中一个标就得二次下跌，预中标要下跌，正式公布中标又要下跌，估计再中几次股价要跌到8元以下
"锥子扎不血的（197）,利好麻木了。 错错…是底不反弹！！！铁汉，我会拿牢你的，","https://guba.eastmoney.com/news,300197,611595370.html",2017-02-24 13:10:53,"锥子扎不血的（197）,利好麻木了。
错错…是底不反弹！！！铁汉，我会拿牢你的，不到3.3日，不会卖的！！！"
天天他妈的半死不活得，垃圾啊！,"https://guba.eastmoney.com/news,300197,611528397.html",2017-02-24 10:07:59,天天他妈的半死不活得，垃圾啊！
跌不动就涨了,"https://guba.eastmoney.com/news,300197,611524759.html",2017-02-24 10:01:47,跌不动就涨了
国泰基金也是来压盘的，看来没好了。[不赞],"https://guba.eastmoney.com/news,300197,611518073.html",2017-02-24 09:49:52,国泰基金也是来压盘的，看来没好了。[不赞]
此股已死只有跌的份了，老子放这股已经有大半年了，他妈的就是不涨，这股一点价值也没,"https://guba.eastmoney.com/news,300197,611514770.html",2017-02-24 09:43:36,此股已死只有跌的份了，老子放这股已经有大半年了，他妈的就是不涨，这股一点价值也没有了，老子走了！
创新低吧，否则太不够意思啊,"https://guba.eastmoney.com/news,300197,611460347.html",2017-02-24 01:33:06,创新低吧，否则太不够意思啊
明天早上能否冲高呢？期盼中,"https://guba.eastmoney.com/news,300197,611327302.html",2017-02-23 14:39:11,同题
够心寒，拿了半年多，套了半年多,"https://guba.eastmoney.com/news,300197,611309081.html",2017-02-23 14:00:54,够心寒，拿了半年多，套了半年多
苦口婆心的劝也没用，不要看到有大单托着就想买，都是骗人的！大股东真想买就不会计较,"https://guba.eastmoney.com/news,300197,611292991.html",2017-02-23 13:25:32,苦口婆心的劝也没用，不要看到有大单托着就想买，都是骗人的！大股东真想买就不会计较几分钱，其实大单托着就是掩护抛售，散户们醒醒吧！醒醒吧！！！
垃圾股杀跌,"https://guba.eastmoney.com/news,300197,611310725.html",2017-02-23 14:04:25,垃圾股杀跌
垃圾拜拜,"https://guba.eastmoney.com/news,300197,611300320.html",2017-02-23 13:42:29,垃圾拜拜
什么庄家,"https://guba.eastmoney.com/news,300197,611284508.html",2017-02-23 13:05:22,天天跌，吹牛第一名
大单托，小单出！1亿7千多万解禁股，出利好就是高位出货！此底不是底。[空仓][空,"https://guba.eastmoney.com/news,300197,611271456.html",2017-02-23 12:05:26,大单托，小单出！1亿7千多万解禁股，出利好就是高位出货！此底不是底。
此股已死只有跌的份了，老子放这股已经有大半年了，他妈的就是不涨，这股一点价值也没,"https://guba.eastmoney.com/news,300197,611247265.html",2017-02-23 11:01:45,此股已死只有跌的份了，老子放这股已经有大半年了，他妈的就是不涨，这股一点价值也没有了，老子走了！
妈的，你要不就跌的痛快点，把缺口填上！,"https://guba.eastmoney.com/news,300197,611246412.html",2017-02-23 11:00:10,妈的，你要不就跌的痛快点，把缺口填上！
补缺就迅速11.7. 不要天天磨,"https://guba.eastmoney.com/news,300197,611209992.html",2017-02-23 09:51:17,1111
铁汉生态,"https://guba.eastmoney.com/news,300197,611238755.html",2017-02-23 10:44:36,发布利好消息，引诱我们散户买股，股东解押套现，法理不容！
没记性，套死你们，都成了大股东的菜，那样多的股票你不去买，非要买铁汉，不买他会死,"https://guba.eastmoney.com/news,300197,611228253.html",2017-02-23 10:24:52,没记性，套死你们，都成了大股东的菜，那样多的股票你不去买，非要买铁汉，不买他会死？！劝不住，就不值得可怜，亏死你，你先去查查大股东的品德吧！
垃圾垃圾大垃圾,"https://guba.eastmoney.com/news,300197,611202154.html",2017-02-23 09:35:20,垃圾垃圾大垃圾
明天爆发,"https://guba.eastmoney.com/news,300197,611094170.html",2017-02-22 19:07:18,明天爆发
[胜利][胜利]收盘跌3%，不要问为什么！,"https://guba.eastmoney.com/news,300197,610657064.html",2017-02-21 11:41:31,收盘跌3%，不要问为什么！
===&#183;新投资机会：首单PPP资产证券化，花落谁家？&#183;===    首批“PPP,"https://guba.eastmoney.com/news,300197,611122840.html",2017-02-22 21:22:23,"===·新投资机会：首单PPP资产证券化，花落谁家？·===
首批“PPP 证券化”项目已上报发改委 共计41单


2月22日消息，发改委今日公布消息称，截至目前，各地区共上报项目41单，其中污水垃圾处理项目21单，公路 交通项目11单，城市供热、园区基础设施、地下综合管廊、公共停车场等项目7单，能源项目2单。



争夺：谁是首单PPP资产证券化

1、碧水源（300070）：

2017年2月3日，“太平洋证券新水源污水处理 服务收费收益权资产支持专项计划”在机构间私募产品报价与服务系统成功发行，成为市场首单落地的PPP资产证券化项目。
该PPP资产证券化项目发行总规模8.4亿元，采用结构化分层设计，其中优先级8亿元，共分为10档，评级均为AA+；次级0.4亿。
本次专项计划由新疆昆仑新水源科技股份有限公司作为发起人并担任特定原始权益人，由太平洋证券股份有限公司担任计划管理人并进行交易安排。
基础资产系特定原始权益人新水源公司依据《特许经营协议》在特定期间内因提供污水处理 服务产生的向付款方收取污水处理服务费及其他应付款项的收费收益权,污水处理服务费付款方为乌鲁木齐市水务 局。
根据该专项计划交易结构安排，优先级6-10档在第五年设置原始权益人利率调整选择权，并附投资者回售权、特定原始权益人赎回权，同时新水源公司为专项计划提供差额补足义务，并将污水处理服务收费权质押为差额补足义务及支付回售和赎回款项的义务提供不可撤销的质押担保。
新水源公司股东分别是乌鲁木齐市国资委 实际控制的乌鲁木齐昆仑环保 集团有限公司和上市公司北京碧水源科技股份有限公司，二者分别为该专项计划提供了无条件的不可撤销的连带责任保证担保。首单项目的成功落地为国内PPP项目资产证券化指明了方向。"
你得知道,"https://guba.eastmoney.com/news,300197,611052660.html",2017-02-22 15:58:39,3月份解禁成本在8.30元左右。你明白的。
铁汉的套路深，砸股吸髓把你坑,"https://guba.eastmoney.com/news,300197,611022205.html",2017-02-22 14:35:45,[不赞]
主力阴险,"https://guba.eastmoney.com/news,300197,611019889.html",2017-02-22 14:31:08,主力有动作，大家看出什么名堂来了么？
垃圾,"https://guba.eastmoney.com/news,300197,611006894.html",2017-02-22 14:04:55,垃圾
买入？,"https://guba.eastmoney.com/news,300197,611000794.html",2017-02-22 13:51:56,撒币！
不要用中标大单呀所谓ppp概念呀骗人了，散户也不是傻子，限售股解禁前抛售，都看的,"https://guba.eastmoney.com/news,300197,610997468.html",2017-02-22 13:44:58,不要用中标大单呀所谓ppp概念呀骗人了，散户也不是傻子，限售股解禁前抛售，都看的出！
疯狂的减持，恶意的打压，用股民的资金买理财，就没人过问吗？,"https://guba.eastmoney.com/news,300197,610957182.html",2017-02-22 11:26:57,[大便]
铁汉是纯流氓股,"https://guba.eastmoney.com/news,300197,610935605.html",2017-02-22 10:42:32,[不赞]
巨量解禁来临，风声鹤唳！,"https://guba.eastmoney.com/news,300197,610959569.html",2017-02-22 11:32:56,再多的利好，也挡不住套利的解禁。
铁汉生态,"https://guba.eastmoney.com/news,300197,610959374.html",2017-02-22 11:32:24,既然业绩这么好，又要做宣传，股价下跌，又在想骗我们散户的血汗钱吗？太无耻！
天天就是借利好减持，这样的股是正常吗？,"https://guba.eastmoney.com/news,300197,610955141.html",2017-02-22 11:22:47,[不赞]
发不出贴了，是谁在操控贴吧？请广大股民揭露这张丑恶的脸,"https://guba.eastmoney.com/news,300197,610953261.html",2017-02-22 11:18:50,[不赞]
行情回暖有人要跑,"https://guba.eastmoney.com/news,300197,610938515.html",2017-02-22 10:48:30,[不赞]
跌晗剩菜你个大阳痿股！真衰！,"https://guba.eastmoney.com/news,300197,610891735.html",2017-02-22 09:03:28,跌晗剩菜你个大阳痿股！真衰！
乖乖！昨日5亿六千万，今日又中标5亿七千万，要疯了！明日非要跌停不可！后天发个公,"https://guba.eastmoney.com/news,300197,610845756.html",2017-02-21 23:54:43,乖乖！昨日5亿六千万，今日又中标5亿七千万，要疯了！明日非要跌停不可！后天发个公告，未来一年再也没有中标合同了也许股价会涨停！
有大单！！晚上估计有公告,"https://guba.eastmoney.com/news,300197,610720641.html",2017-02-21 14:48:19,有大单！！晚上估计有公告。有些人消息比我们灵通
跌汉生胎可以退市了！,"https://guba.eastmoney.com/news,300197,610820722.html",2017-02-21 21:32:35,跌汉生胎可以退市了！
明天所有PPP公司都会上攻！！！,"https://guba.eastmoney.com/news,300197,610731311.html",2017-02-21 15:14:41,看好此股和300495
大单买入！难道是员工增持,"https://guba.eastmoney.com/news,300197,610720004.html",2017-02-21 14:46:43,大单买入！难道是员工增持
创业板里第一退市股票，垃圾公司不行了，倒闭[大便][大便][大便][大便][大便,"https://guba.eastmoney.com/news,300197,610710692.html",2017-02-21 14:28:23,创业板里第一退市股票，垃圾公司不行了，倒闭[大便][大便][大便][大便][大便][大便][大便][大便]
明显为员工低价持股在打压,"https://guba.eastmoney.com/news,300197,610695856.html",2017-02-21 13:55:24,明显为员工低价持股在打压
CNMDB，骂了也不解恨,"https://guba.eastmoney.com/news,300197,610701824.html",2017-02-21 14:08:52,[大便][大便][大便][大便][不赞][大便]
尾盘要跳水,"https://guba.eastmoney.com/news,300197,610698076.html",2017-02-21 14:00:25,尾盘要跳水
居然被猛草超过了[不赞],"https://guba.eastmoney.com/news,300197,610695422.html",2017-02-21 13:54:38,居然被猛草超过了[不赞]
没爹的股,"https://guba.eastmoney.com/news,300197,610686729.html",2017-02-21 13:35:08,没爹的股
创业板涨你跌，创业板跌你也跌，环保涨你不涨，环保股跌你也跌——无赖一个,"https://guba.eastmoney.com/news,300197,610669879.html",2017-02-21 12:43:33,创业板涨你跌，创业板跌你也跌，环保涨你不涨，环保股跌你也跌——无赖一个
不知道这吊股算不算创业板，反正不管创业板怎么涨，他就是不涨，垃圾啊,"https://guba.eastmoney.com/news,300197,610630595.html",2017-02-21 10:40:57,不知道这吊股算不算创业板，反正不管创业板怎么涨，他就是不涨，垃圾啊
看不出来啊，中标就跌，有猫腻，谁买套谁！赶快跑吧，11元见，10元尝试买点，7元,"https://guba.eastmoney.com/news,300197,610639728.html",2017-02-21 11:00:09,看不出来啊，中标就跌，有猫腻，谁买套谁！赶快跑吧，11元见，10元尝试买点，7元满仓，100多亿的合同在手，也是跌跌不休，合同越多跌的越凶！
我的4万亿准备买此股，诸位放心玩儿吧[怒][怒][怒],"https://guba.eastmoney.com/news,300197,610614375.html",2017-02-21 10:07:37,我的4万亿准备买此股，诸位放心玩儿吧
利好必跌！,"https://guba.eastmoney.com/news,300197,610612634.html",2017-02-21 10:04:17,利好必跌！
警惕创业板指数迟迟不能突破1868点、再次考验17,"https://guba.eastmoney.com/news,300197,610612540.html",2017-02-21 10:04:14,"要防止2017年鸡年变光鸡,股市血本无归"
这吊股真他妈的让人无语，垃圾啊！,"https://guba.eastmoney.com/news,300197,610611492.html",2017-02-21 10:02:00,这吊股真他妈的让人无语，垃圾啊！
融资3千万，明天开盘开始买入，12元20以下筹码有多少要多少！主力兄弟，请给机会,"https://guba.eastmoney.com/news,300197,610502759.html",2017-02-20 20:24:39,融资3千万，明天开盘开始买入，12元20以下筹码有多少要多少！主力兄弟，请给机会！
铁汉生态：一飞冲天！,"https://guba.eastmoney.com/news,300197,610499703.html",2017-02-20 20:10:33,铁汉生态：一飞冲天！
只要龙头继续涨停 其他个股就会跟风,"https://guba.eastmoney.com/news,300197,610561125.html",2017-02-21 04:11:45,只要龙头继续涨停 其他个股就会跟风
11.7的缺口没，上窜也窜不到哪去，静等11.5,"https://guba.eastmoney.com/news,300197,610462619.html",2017-02-20 17:25:48,11.7的缺口没，上窜也窜不到哪去，静等11.5
本周主力攻击目标：PPP公司,"https://guba.eastmoney.com/news,300197,610385164.html",2017-02-20 14:23:29,大胆介入！
不中标万亿不会涨，养老金正猛低吸,"https://guba.eastmoney.com/news,300197,610355984.html",2017-02-20 13:39:24,[大便][大便][不赞]
出公告挖坑呢，货出不完了,"https://guba.eastmoney.com/news,300197,610339079.html",2017-02-20 13:13:04,RT
彻底废了这股,"https://guba.eastmoney.com/news,300197,610335362.html",2017-02-20 13:06:36,彻底废了这股
上午洗盘挖坑，中午出公告，可惜我换大篮筹了。,"https://guba.eastmoney.com/news,300197,610323673.html",2017-02-20 12:40:33,上午洗盘挖坑，中午出公告，可惜我换大篮筹了。
标准的利益输送,"https://guba.eastmoney.com/news,300197,610304143.html",2017-02-20 11:47:43,大笔打压，协议交易，解禁的出货。
