标题,链接,发布时间,内容
我的儿，别玩了，开始吧！,"https://guba.eastmoney.com/news,300338,584813681.html",2017-01-03 14:39:35,我的儿，别玩了，开始吧！
马上更名,"https://guba.eastmoney.com/news,300338,584770064.html",2017-01-03 13:14:47,马上更名开元恒企
我的儿明天必涨！,"https://guba.eastmoney.com/news,300338,584603941.html",2017-01-02 21:21:08,
开始出货,"https://guba.eastmoney.com/news,300338,584707819.html",2017-01-03 10:24:10,开始出货
请问董秘开元仪器截至2016年12月31日股东人数多少？谢谢。,"https://guba.eastmoney.com/news,300338,584681954.html",2017-01-03 09:36:47,请问董秘开元仪器截至2016年12月31日股东人数多少？谢谢。
假如英国实现“脱欧”，其实是利好于中国……,"https://guba.eastmoney.com/news,300338,584599642.html",2017-01-02 20:59:12,汽车：智能汽车风口再起
洗呀洗，天天洗有意思吗？我就是不出，逢低还进货！,"https://guba.eastmoney.com/news,300338,584444081.html",2017-01-01 20:12:15,洗呀洗，天天洗有意思吗？我就是不出，逢低还进货！
2015年报百大股票池深度研报（完整版）,"https://guba.eastmoney.com/news,300338,584455710.html",2017-01-01 22:55:08,巴菲特是这样看待做空
我的儿，庄家不负我心啊！这样多好！,"https://guba.eastmoney.com/news,300338,584206318.html",2016-12-30 16:30:52,"大家好！
才是真的好！
在大盘如此状况！
此股已相当不易！
大家且超且珍惜吧！"
明年失败者：小看了无杠杆的改革牛、国家牛，“	,"https://guba.eastmoney.com/news,300338,584430000.html",2017-01-01 16:37:07,11月数据超预期 新能源汽车产业重回正轨
跌破上一波的低点了,"https://guba.eastmoney.com/news,300338,584410792.html",2017-01-01 11:51:20,跌破上一波的低点了
今天等着伤心吧,"https://guba.eastmoney.com/news,300338,584131937.html",2016-12-30 13:29:15,今天等着伤心吧
都是成交13手12手什么意思？,"https://guba.eastmoney.com/news,300338,584136916.html",2016-12-30 13:40:13,都是成交13手12手什么意思？
刚才低点进，又赚了一笔！,"https://guba.eastmoney.com/news,300338,584101639.html",2016-12-30 11:32:22,"在这个熊市，有你真幸福啊！
低点进，高点炮！"
开元仪器你是涨停！快快！,"https://guba.eastmoney.com/news,300338,584080526.html",2016-12-30 10:52:05,开元仪器你是涨停！快快！
对你爱爱不完，砸坑就加仓，稳赚了！,"https://guba.eastmoney.com/news,300338,584076372.html",2016-12-30 10:44:57,对你爱爱不完，砸坑就加仓，稳赚了！
我的儿，很稳吗！ 慢慢爬，每天3个点的收入！多好！,"https://guba.eastmoney.com/news,300338,583895944.html",2016-12-29 17:26:47,我的儿，很稳吗！不急，慢慢爬，每天3个点的收入！多好！
希望每天涨不停！,"https://guba.eastmoney.com/news,300338,583988408.html",2016-12-30 00:03:32,希望每天涨不停！
炒股机器人横空出世！,"https://guba.eastmoney.com/news,300338,584027251.html",2016-12-30 09:06:53,慧眼看大盘——大盘风向
清仓的机构不少啊。不清，今天肯定有人给你拉涨停板，现在看来熬不住,"https://guba.eastmoney.com/news,300338,547950361.html",2016-09-02 14:43:22,停太久
诱多，,"https://guba.eastmoney.com/news,300338,583793196.html",2016-12-29 13:27:53,诱多，
下午两点发动攻势！大家坐稳了啊！,"https://guba.eastmoney.com/news,300338,583782092.html",2016-12-29 13:00:01,下午两点发动攻势！大家坐稳了啊！
有意思吗,"https://guba.eastmoney.com/news,300338,583703578.html",2016-12-29 09:44:52,连续打压，成交量急剧萎缩，弄得量比只有0.2几了
我的儿，洗得差不多了！拉吧！,"https://guba.eastmoney.com/news,300338,583722334.html",2016-12-29 10:15:15,我的儿，洗得差不多了！拉吧！
昨天已经回本啦，静看每天3%的收益！,"https://guba.eastmoney.com/news,300338,583470359.html",2016-12-28 15:14:17,"只要看着就有收入！
太美了！
爽啊！
这么稳定的股票哪找去！
还重组！
没利空！
只有利好！
等着吧！"
上下都好别不动[牛][牛][牛],"https://guba.eastmoney.com/news,300338,583404796.html",2016-12-28 13:05:38,上下都好别不动
赛摩电气  涨停,"https://guba.eastmoney.com/news,300338,583363313.html",2016-12-28 10:53:30,1111
比比,"https://guba.eastmoney.com/news,300338,583362006.html",2016-12-28 10:51:21,300466 赛莫电气 涨停了 看看人家
我的儿，崛起吧！,"https://guba.eastmoney.com/news,300338,583323110.html",2016-12-28 09:47:53,"我的儿！
快点！
我看好你啊！"
开元仪器（300338）积聚涨升能量 投资价值彰显,"https://guba.eastmoney.com/news,300338,582719303.html",2016-12-26 12:14:26,"12 月15 日，公司公告，公司发行股份及支付现金购买资产并募集配套资金事项获得有条件通过。公司以定增+现金方式购买恒企教育100%股权（作价12 亿元，其中现金支付40%，总计4.8 亿元，以14.62 元发行4924.8 万股，总计7.2 亿元）和中大英才70%股权（作价1.82 亿元，其中现金支付50%，总计9100 万，以14.62 元/股发行622.4 万股，总计9100 万）;同时拟向4 名特定投资者募配4.7 亿元（14.62 元/股），用于支付重组现金及中介费用，交易前后实际控制人不变。本次定增过会，公司或正式成为A 股最纯正且具备内生增长的职教龙头标的！

公司原主业为提供燃料智能化管理系统化解决方案及智能煤质检测仪器设备销售，本次交易完成后，公司主业将新增教育培训业务，正式迈入职业教育市场。一方面，通过积极发展第二主业，战略布局教育培训产业;另一方面，培育新的利润增长点，助力公司分享职业教育市场增长红利，显著增强盈利能力。综上，预计2016-18 年EPS 为0.02 元、0.48 元、0.66元，对应PE 为1503 倍、56 倍、40 倍。"
钱哪里去了？,"https://guba.eastmoney.com/news,300338,386725526.html",2016-05-12 13:25:54,钱哪里去了？
让人烦很感动,"https://guba.eastmoney.com/news,300338,387312771.html",2016-05-13 09:31:22,和好的好的
勿太积极操作,"https://guba.eastmoney.com/news,300338,583155060.html",2016-12-27 15:56:14,目前控盘度很高了，大趋势下谨慎接高位盘，你能把握到主力思路跟好趋势
庄家今天横盘吸了一天的货，未来必涨！,"https://guba.eastmoney.com/news,300338,583137948.html",2016-12-27 15:06:35,"豪爽啊！
明天还吸货！
大家都给庄交货吧！
除了庄！
就是我！
多爽啊！"
听我话的今天爽了吧，下午继续，明天继续，未来继续！,"https://guba.eastmoney.com/news,300338,583067870.html",2016-12-27 12:41:40,听我话的今天爽了吧，下午继续，明天继续，未来继续！
启明星啊，这是要反转啊！幸亏没出来！啊哈！,"https://guba.eastmoney.com/news,300338,582887188.html",2016-12-26 20:36:09,"启明星啊，这是要反转啊！幸亏没出来！啊哈！
已经跌落那么多！
怕什么！"
赛模电气要涨挺，这货得跟随啊！,"https://guba.eastmoney.com/news,300338,582985988.html",2016-12-27 09:29:33,激动的字都不会打了！
这货今天要涨的节奏啊，低开高走啊！以前都是高开低走！深套！,"https://guba.eastmoney.com/news,300338,582983483.html",2016-12-27 09:23:28,这货今天要涨的节奏啊，低开高走啊！以前都是高开低走！
跌地我不爽啊，为啥不趁大盘使劲跌啊！明天必涨！,"https://guba.eastmoney.com/news,300338,582776331.html",2016-12-26 14:32:33,跌地我不爽啊，为啥不趁大盘使劲跌啊！明天必涨！
这货绝壁抗跌啊！不怕不怕！,"https://guba.eastmoney.com/news,300338,582789661.html",2016-12-26 14:57:36,这货绝壁抗跌啊！不怕不怕！
B涨！B涨！B涨！B涨！,"https://guba.eastmoney.com/news,300338,582780152.html",2016-12-26 14:39:32,B涨！B涨！B涨！B涨！B涨！
这股要反转，要涨了！加油，火箭拉升！,"https://guba.eastmoney.com/news,300338,582673431.html",2016-12-26 10:33:21,这股要反转，要涨了！加油，火箭拉升！
马上红盘，明天必涨！不信打赌！,"https://guba.eastmoney.com/news,300338,582773830.html",2016-12-26 14:27:55,马上红盘，明天必涨！不信打赌！
主力，我的儿，哈哈，听话，拉升吧！,"https://guba.eastmoney.com/news,300338,582758080.html",2016-12-26 13:58:51,主力，我的儿，哈哈，听话，拉升吧！
怎么样开始拉升了吧，放心好了！已经跌的太多！主力也没票了！,"https://guba.eastmoney.com/news,300338,582750041.html",2016-12-26 13:43:29,怎么样开始拉升了吧，放心好了！已经跌的太多！主力也没票了！
周一必涨，周一必涨！我已全仓@！,"https://guba.eastmoney.com/news,300338,582470873.html",2016-12-24 22:00:45,周一必涨，周一必涨！我已全仓@！
不得不说，这比还挺抗跌的！,"https://guba.eastmoney.com/news,300338,582644801.html",2016-12-26 09:51:35,
冲杯咖啡点根烟，无聊亏损又一天，天天指望次日,"https://guba.eastmoney.com/news,300338,582603904.html",2016-12-26 06:38:41,把去年‘救市’时放宽的投资比例再收回来这个比
妈的滞涨啊，刚说完，你诚心和老子做对啊！你跌10%我就加10的仓位！,"https://guba.eastmoney.com/news,300338,582632740.html",2016-12-26 09:35:40,妈的滞涨啊，刚说完，你诚心和老子做对啊！你跌10%我就加10的仓位！
今天必涨吧！哈哈！,"https://guba.eastmoney.com/news,300338,582629541.html",2016-12-26 09:30:05,"不怕不怕！
已经跌了那么多！"
今晚12点挂单跑路，争取躲过黑周一,"https://guba.eastmoney.com/news,300338,582585554.html",2016-12-25 23:28:19,今晚12点挂单跑路，争取躲过黑周一
恢复人气，稳定健康发展，避免股灾，必须要治本,"https://guba.eastmoney.com/news,300338,582448195.html",2016-12-24 17:48:21,恢复人气，稳定健康发展，避免股灾，必须要治本
股票都被大股东和机构玩坏了增发送股和股本疯狂,"https://guba.eastmoney.com/news,300338,582368737.html",2016-12-24 06:59:28,股票都被大股东和机构玩坏了增发送股和股本疯狂
下周一必大涨！铁定地，必红盘！坚定地持有！,"https://guba.eastmoney.com/news,300338,582337855.html",2016-12-23 22:27:57,下周一必大涨！铁定地，必红盘！
这里面有庄，而且庄的成本很低，所以很任性！,"https://guba.eastmoney.com/news,300338,582223623.html",2016-12-23 15:14:53,这里面有庄，而且庄的成本很低，所以很任性！
真跟老子玩阴跌啊！老子就地卧倒！装死！,"https://guba.eastmoney.com/news,300338,582182080.html",2016-12-23 14:10:23,真跟老子玩阴跌啊！老子就地卧倒！装死！
没有实质利空，却有重组利好！,"https://guba.eastmoney.com/news,300338,582181425.html",2016-12-23 14:09:25,"试问有几个重组通过了的！
还是有条件通过！
这就是放长线钓大鱼！"
这票筹码高度集中，主力介入很深，26之上都还在买，平均成本23.昨天洗掉一部分日,"https://guba.eastmoney.com/news,300338,582131098.html",2016-12-23 12:22:22,这票筹码高度集中，主力介入很深，26之上都还在买，平均成本23.昨天洗掉一部分日后40以上没问题
有能耐打到25以下，老子全仓买入,"https://guba.eastmoney.com/news,300338,581454450.html",2016-12-21 14:03:14,有能耐打到25以下，老子全仓买入
不怕大跌，就怕阴跌！你可别跟我玩！,"https://guba.eastmoney.com/news,300338,582088616.html",2016-12-23 10:49:13,"！
连个波段都做不了！"
目前很稳，主要还是我们小散在玩，剩下都是能抗的跌的小散了，关键也要抗涨啊！,"https://guba.eastmoney.com/news,300338,582069730.html",2016-12-23 10:19:47,"不要上了狗庄的当，我们已经亏了很多，怕什么，坚持就是胜利！
我就不怕跌！
不怕跌！
不怕跌！
不涨两个板就是不出！
怎样！放他10几年也无所谓！
无所谓！
反正也就是瞄一眼！
就当放银行了！
不怕跌！
就怕涨啊！
涨两个板，我就拿不住了！"
今天必大涨啊，哥哥兄弟们上啊，咬庄！,"https://guba.eastmoney.com/news,300338,582041494.html",2016-12-23 09:38:29,今天必大涨啊，哥哥兄弟们上啊，咬庄！
想要爹爹手中的筹码，那你就涨停吧，两个涨停我就给你！,"https://guba.eastmoney.com/news,300338,582042367.html",2016-12-23 09:39:57,"想要爹爹手中的筹码，那你就涨停吧，两个涨停我就给你！
否则我就捂着！
因为没有实质利空啊！
我就认这一条！"
创业板就是无厘头，什么情况都有可能发生，专治各种不服！,"https://guba.eastmoney.com/news,300338,581980931.html",2016-12-22 22:56:20,创业板就是无厘头，什么情况都有可能发生，专治各种不服！
放量杀跌呀,"https://guba.eastmoney.com/news,300338,581964474.html",2016-12-22 21:52:29,放量杀跌呀
你有本事就跌停，我也欢迎！,"https://guba.eastmoney.com/news,300338,581785412.html",2016-12-22 13:28:42,你有本事就跌停，我也欢迎！
下午死到位得了 别磨叽,"https://guba.eastmoney.com/news,300338,581751743.html",2016-12-22 11:32:29,下午死到位得了 别磨叽
不是说没量。今天量来了。哈哈哈哈！,"https://guba.eastmoney.com/news,300338,581843440.html",2016-12-22 15:12:31,不是说没量。今天量来了。哈哈哈哈！
明天必涨，已全仓！跌这么狠，怎么也得反弹一下吧！,"https://guba.eastmoney.com/news,300338,581846311.html",2016-12-22 15:19:41,"不用思考什么原因！
跌狠了！
必须得涨！"
毕竟是从几元钱涨上来的，庄家看来是在出货了！,"https://guba.eastmoney.com/news,300338,581919422.html",2016-12-22 19:15:52,毕竟是从几元钱涨上来的，庄家看来是在出货了！
亏死了，刚用上上策买了这只股票，眼看着就要跌停了。,"https://guba.eastmoney.com/news,300338,581816910.html",2016-12-22 14:24:42,亏死了，刚用上上策买了这只股票，眼看着就要跌停了。
我已看穿庄家的小把戏，利用高管减持打压一下而已！,"https://guba.eastmoney.com/news,300338,581847972.html",2016-12-22 15:23:57,"这纯粹是人造的利空！
就不是利空！
明白了吧！
傻庄！
因为没有实质性的利空！
毕竟会反弹的！"
明天必涨！其实主力就是利用高管减持的消息打压股票！,"https://guba.eastmoney.com/news,300338,581845844.html",2016-12-22 15:18:24,"因为减持的那点量真的无所谓！
小题大做！
是庄家的拿手好戏！"
有本事庄家搞跌停，那我就欢迎,"https://guba.eastmoney.com/news,300338,581784215.html",2016-12-22 13:26:37,有本事庄家搞跌停，那我就欢迎
S低价业绩优小盘军工股票002560通达股份目前股价严重低估正式最佳介入时机，明,"https://guba.eastmoney.com/news,300338,581779433.html",2016-12-22 13:17:02,S低价业绩优小盘军工股票002560通达股份目前股价严重低估正式最佳介入时机，明年创造奇迹再现股市江湖
太狠了吧，过会天天跌，什么玩法？,"https://guba.eastmoney.com/news,300338,581776893.html",2016-12-22 13:11:40,太狠了吧，过会天天跌，什么玩法？
建议公司开除陈方驰，为个人小小套利引发股价大跌！,"https://guba.eastmoney.com/news,300338,581754442.html",2016-12-22 11:39:24,建议公司开除陈方驰，为个人小小套利引发股价大跌！
打到坑人的董秘！！,"https://guba.eastmoney.com/news,300338,581750809.html",2016-12-22 11:30:26,最知道内幕的人，锁盘前出逃了！
兄弟们速来300515，同样公司，次新股，同时也调整到位。,"https://guba.eastmoney.com/news,300338,581723189.html",2016-12-22 10:40:36,兄弟们速来300515，同样公司，次新股，同时也调整到位。
所谓的重组，就是扩大圈钱的范围，继续圈钱？,"https://guba.eastmoney.com/news,300338,581736381.html",2016-12-22 11:03:53,所谓的重组，就是扩大圈钱的范围，继续圈钱？
大家都散了，这股东不是人，不断减持，自己都不看好！,"https://guba.eastmoney.com/news,300338,581733425.html",2016-12-22 10:58:32,大家都散了，这股东不断减持，自己都不看好！
没有必要打到停板吧！,"https://guba.eastmoney.com/news,300338,581707387.html",2016-12-22 10:15:40,没有必要打到停板吧！
什么意思，别人唱多让散户送死你就通过，我说实话你就不通过！！没有买卖就没有伤害，,"https://guba.eastmoney.com/news,300338,581696304.html",2016-12-22 09:58:55,什么意思，别人唱多让散户送死你就通过，我说实话你就不通过！！没有买卖就没有伤害，高管集体跑路了！！
没有买卖就没有伤害，高管集体跑路了,"https://guba.eastmoney.com/news,300338,581693049.html",2016-12-22 09:54:09,没有买卖就没有伤害，高管集体跑路了
礼拜五出的是钓鱼线，后果……,"https://guba.eastmoney.com/news,300338,580467685.html",2016-12-18 18:00:17,礼拜五出的是钓鱼线，后果……
你在玩什么把戏？死庄,"https://guba.eastmoney.com/news,300338,581453540.html",2016-12-21 14:01:53,你在玩什么把戏？死庄
就这点量，，，怎么出货！,"https://guba.eastmoney.com/news,300338,581438947.html",2016-12-21 13:40:42,不如来点猛的？
，在借大盘情,"https://guba.eastmoney.com/news,300338,581428862.html",2016-12-21 13:24:40,，在借大盘情
没出息的股东，一天也就100来万！,"https://guba.eastmoney.com/news,300338,581401538.html",2016-12-21 11:58:42,没出息的股东，一天也就100来万！
你！,"https://guba.eastmoney.com/news,300338,581428305.html",2016-12-21 13:23:49,你！
子已经不行了,"https://guba.eastmoney.com/news,300338,581427920.html",2016-12-21 13:23:13,子已经不行了
，没有庄家！,"https://guba.eastmoney.com/news,300338,581427594.html",2016-12-21 13:22:39,，没有庄家！
借大盘情,"https://guba.eastmoney.com/news,300338,581427291.html",2016-12-21 13:22:14,借大盘情
因为周级别上出现这,"https://guba.eastmoney.com/news,300338,581426738.html",2016-12-21 13:21:21,因为周级别上出现这
老子坚守,"https://guba.eastmoney.com/news,300338,581426403.html",2016-12-21 13:20:46,老子坚守
公司过会,"https://guba.eastmoney.com/news,300338,581426152.html",2016-12-21 13:20:19,公司过会
看来公司大股东并不看好自己的公司，在借大盘情况不错，不断减持！,"https://guba.eastmoney.com/news,300338,581395433.html",2016-12-21 11:38:31,看来公司大股东并不看好自己的公司，在借大盘情况不错，不断减持！
公司大股东在不断地减持，没有庄家！,"https://guba.eastmoney.com/news,300338,581391988.html",2016-12-21 11:30:11,庄家也不愿为别人做嫁衣！
300多手的破买单，也来牛逼！弄死你！,"https://guba.eastmoney.com/news,300338,581339050.html",2016-12-21 10:07:40,
枣泥马！诚心跟爷斗气是吧！我再给你砸下来！,"https://guba.eastmoney.com/news,300338,581337862.html",2016-12-21 10:06:00,
怎么样，爷走了，你就得跳水！,"https://guba.eastmoney.com/news,300338,581336655.html",2016-12-21 10:04:12,
你这个健脾！爷爷走了！你自己玩吧！今天旅游是封口！,"https://guba.eastmoney.com/news,300338,581335200.html",2016-12-21 10:02:02,
没钱借钱也得拉升啊，否则你怎么出货！蠢货！,"https://guba.eastmoney.com/news,300338,581324317.html",2016-12-21 09:45:25,"没钱借钱也得拉升啊，否则你怎么出货！蠢货！
你妈筹码都在你手里呢！
你不拉升谁会接盘！
买涨不买跌！
你知道不！"
你妈，想出货，你得拉啊！不拉怎么出货！蠢货！,"https://guba.eastmoney.com/news,300338,581321927.html",2016-12-21 09:41:39,你妈，想出货，你得拉啊！不拉怎么出货！蠢货！
这孙子已经不行了,"https://guba.eastmoney.com/news,300338,581293058.html",2016-12-21 07:49:30,这孙子已经不行了
这股在制造假象啊,"https://guba.eastmoney.com/news,300338,581199779.html",2016-12-20 19:16:20,这股在制造假象啊
一会怎么出来这么多卖单,"https://guba.eastmoney.com/news,300338,581199737.html",2016-12-20 19:16:14,一会怎么出来这么多卖单
采取高抛低吸为上策,"https://guba.eastmoney.com/news,300338,581199674.html",2016-12-20 19:15:56,采取高抛低吸为上策
退个税算利好吗,"https://guba.eastmoney.com/news,300338,581199455.html",2016-12-20 19:15:08,退个税算利好吗
第1,"https://guba.eastmoney.com/news,300338,581199050.html",2016-12-20 19:13:48,"第一绩优低估小盘成涨股
002394联发股份：总市值为55亿，主营纺织、进能源、环保行业，18亿闲钱进行风险投资和投资理财（还没公告投向），国外再投资初达成意向。16年业绩超1.1元/股市盈率近14倍，17年业绩约超1.4元/股现市盈率约12倍。适合分批买进长线持有（走势非常磨叽）几年的价值投资，高业绩还年年增涨，高业绩价值投资跌下去也会涨上来，业绩是股价的基石，追逐题材行情的结果甘苦自知。呼叫高手"
开元仪器:关于将获得湖南省战略性新兴产业科技攻关与重大科技成果转化专项资金补助的公告,"https://guba.eastmoney.com/news,300338,581149070.html",2016-12-20 16:24:54,"公告日期：2016-12-20
证券代码： 300338 证券简称：开元仪器 公告编码： 2016-123 号
长沙开元仪器股份有限公司
关于将获得湖南省战略性新兴产业科技攻关
与重大科技成果转化专项资金补助的公告
长沙开元仪器股份有限公司（以下简称“公司”）近日收到长沙市财政局、
长沙市科学技术局，长沙市经济和信息化委员会发布的《关于下达 2016 年省战
略性新兴产业科技攻关与重大科技成果转化专项资金的通知》（长财企指
[2016]102 号），根据该通知，公司的“智能化 X 荧光煤质在线元素分析系统”
项目将获得该专项资金 2,000,000 元，公司已向政府相关部门开具《财政拨款收
款凭据》，但截止本公告日尚未收到该专项资金。
以上专项资金属于政府补助，公司对该专项资金将根据《企业会计准则》相
关规定进行会计处理，公司将会结合项目实际情况在项目实施期内分阶段确认为
营业外收入，具体的会计处理将以会计师事务所年度审计确认后的结果为准。
特此公告。
长沙开元仪器股份有限公司董事会
2016 年 12 月 20 日
本公司及董事会全体成员保证公告内容的真实、准确和完整，没有虚假
记载、误导性陈述或重大遗漏。
[点击查看PDF原文]
提示：本网不保证其真实性和客观性，一切有关该股的有效信息，以交易所的公告为准，敬请投资者注意风险。"
开元仪器:关于全资子公司软件产品增值税退税获得审批的公告,"https://guba.eastmoney.com/news,300338,581149212.html",2016-12-20 16:25:19,"公告日期：2016-12-20
证券代码：300338 证券简称：开元仪器 公告编码：2016-122号

长沙开元仪器股份有限公司

关于全资子公司软件产品增值税退税获得审批的公告本公司及董事会全体成员保证公告内容的真实、准确和完整，没有虚假记载、误导性陈述或重大遗漏。

根据财政部、国家税务总局《关于软件产品增值税政策的通知》(财税

[2011]100号)的有关规定，增值税一般纳税人销售其自行开发生产的软件产品，

按 17%税率征收增值税后，对其增值税实际税负超过 3%的部分实行即征即退政

策。

长沙开元仪器股份有限公司（以下简称“公司”）全资子公司长沙开元平方软件有限公司申请软件产品增值税退税款3,324,309元，于2016年12月19日获长沙市高新区国家税务局审批通过，目前公司尚未收到该笔退税款。

根据《企业会计准则》及相关规定，以上退税所得将计入公司2016年度营

业外收入，将对公司2016年度损益产生积极影响，具体的会计处理以会计师事

务所年度审计确认后的结果为准。

特此公告。

长沙开元仪器股份有限公司董事会

2016年12月20日


[点击查看PDF原文]
提示：本网不保证其真实性和客观性，一切有关该股的有效信息，以交易所的公告为准，敬请投资者注意风险。"
我的儿你到底要吸多少啊！？！,"https://guba.eastmoney.com/news,300338,581103420.html",2016-12-20 14:34:54,我的儿你到底要吸多少啊！？！
我的儿：8手就把你打下来了！别丢爸的脸了！,"https://guba.eastmoney.com/news,300338,581097554.html",2016-12-20 14:25:13,我的儿：8手就把你打下来了！别丢爸的脸了！
大家对明天大盘怎么看？,"https://guba.eastmoney.com/news,300338,581089625.html",2016-12-20 14:11:53,大家对明天大盘怎么看？
明天开始买股,"https://guba.eastmoney.com/news,300338,581089574.html",2016-12-20 14:11:49,明天开始买股
儿啊，在这么折腾，跌可要揍你了！,"https://guba.eastmoney.com/news,300338,581089423.html",2016-12-20 14:11:35,"败家子啊！
多好的机会！
都让你浪费了！
混蛋！"
