标题,链接,发布时间,内容
分总比不分好,"https://guba.eastmoney.com/news,600340,654237036.html",2017-06-12 18:55:08,分总比不分好
今天大胆买进，乘胜追击,"https://guba.eastmoney.com/news,600340,654465564.html",2017-06-13 09:13:22,，
真龙在渊-华夏幸福，雄安481+大湾320平方公里,"https://guba.eastmoney.com/news,600340,634118336.html",2017-04-26 14:17:03,"这些都是有据可查的开发数据。
华夏幸福-京津冀地产巨擘，乘上“千年大计”东风：1）京津冀资源禀赋优越：根据2016年报数据，公司90%的土地储备、94%的收入在河北；按照新华社报道，雄安新区是“继深圳经济特区和上海浦东新区之后又一具有全国意义的新区，是千年大计、国家大事”。公司在环北京及京津冀区域取得优势布局。2）新区内曾签约合作协议，涉及面积481.2 万方：在2014 年12 月31 日和2015 年8 月28 日，公司公告分别与白洋淀及雄县政府分别签订《整体合作开发协议》，签约整体开发面积分别为300 平方公里和181.2 平方公里，合计潜在供给481.2 平方公里，乘上国家级新区“千年大计”的东风。
预计公司17-19 年公司EPS 为2.98、4.05、5.26，股价150也不算高。

华夏幸福在粤港澳大湾区储备有近320平方公里园区!
于2017年3月29日召开第六届董事会第十次会议审议通过了《关于与东莞市中堂镇人民政府及东莞实业投资控股集团有限公司签署＜合作备忘录＞的议案》,同意公司与广东省东莞市中堂镇人民政府及东莞实业投资控股集团有限公司签署《关于整体合作开发建设经营广东省东莞市中堂镇约定区域的合作备忘录》（以下简称“本备忘录”），并同意公司董事会授权总裁带领业务团队组成项目组，在遵循本备忘录约定的原则和内容基础上，与东莞实业投资控股集团有限公司共同参与中堂镇委托区域PPP项目采购程序，提交响应文件。
广东省东莞市中堂镇行政区划内约定区域（以下简称“合作区域”）的整体开发各事项与乙方、丙方进行合作。合作区域占地面积约为19.6平方公里，北至东江北干流、东至107国道、西至中堂镇边界、南至中堂水道，面积以实际测量为准。
2016年12月20日,华夏幸福基业股份有限公司公告宣布,该公司同意公司董事会授权总裁带领业务团队组成项目组,参与广东省惠州市惠阳区合作区域PPP项目采购程序。
　　惠阳区政府将惠州市惠阳区行政区划内约定区域的整体开发各事项与社会资本进行合作,合作区域为惠阳区镇隆镇全镇行政区域范围,占地面积约为150平方公里。
2017年2月8日华夏幸福基业股份有限公司宣布,于当天召开的董事会审议同意公司与广东中山市民众镇人民政府、中国宜兴环保科技工业园管理委员会签署合作备忘录,并同意公司董事会授权总裁带领业务团队组成项目组,参与PPP项目采购程序,提交响应文件。两项合作共涉及合作面积59平方公里。
2017年1月19日晚间，华夏幸福基业股份有限公司发布公告称，公司与广东省佛山市高明区人民政府签署《合作备忘录》(产业小镇)，将受托为高明区行政区两宗划内约定区域进行投资、开发、建设、招商及运营等工作的合作，合作区域面积共计61平方公里。
2017年3月15日，华夏幸福基业股份有限公司与广东省佛山市政府签署备忘录，拟合作开发特色小镇。佛山市南海区丹灶镇行政区划内约定区域，占地面积约为6.88平方公里。
2016年5月30日晚间，华夏幸福基业股份有限公司披露，公司董事会审议通过了《关于签订＜整体合作开发建设经营广东省江门高新区约定区域合作备忘录＞的议案》，同意其与江门高新技术产业开发区管理委员会、江门市江海区人民政府签订合作备忘录。
　　据观点地产新媒体了解，江门高新技术产业开发区管理委员会将以江门高新区辖区内约定区域的整体开发各事项与华夏幸福进行合作，委托区域占地面积约为24.8平方公里。
　　其中，区域一占地面积约21.2平方公里，区域范围为胜利南路延长线以东、连海路以西、江中高速、青年河、彩虹路、云沁路以南、会港大道以北。区域二占地面积约3.6平方公里，为江门水道以东、张围河以西、乐民街以南、会港大道以北的江海区行政管辖范围。区域一为先期启动区，区域二作为远期规划开发区域"
高层：雄安是中国新型城镇化的信号,"https://guba.eastmoney.com/news,600340,654456988.html",2017-06-13 08:46:35,
中国证券报 特色小镇地方政策密集发布 运营规划等诸多难题待解 2017年6月13日 01:32,"https://guba.eastmoney.com/news,600340,654457015.html",2017-06-13 08:46:47,"中国证券报 特色小镇地方政策密集发布 运营规划等诸多难题待解
2017年06月13日 01:32来源：中国证券报 编辑：东方财富网
摘要
日前，住房和城乡建设部办公厅下发了《关于做好第二批全国特色小镇推荐工作的通知》，要求第二批300个国家级特色小镇在6月30日前申报完成。这是全国特色小镇继2016年10月公布首批127个名单后，面临又一次扩容。近日，有多个省市出台关于特色小镇的名单和相关政策，一些上市公司也相继公告特色小镇相关项目。中国证券报记者近日走访了相关上市公司、政府部门、中介机构和专家学者。多位业内人士表示，尽管特色小镇未来市场规模巨大，但仍面临特色培育、运营规划和筹资模式等方面的困难。

地方政策密集发布

A股企业入局

诸多问题待解"
昨晚分的钱不见了？这太坑了，股价低了有毛用,"https://guba.eastmoney.com/news,600340,654449327.html",2017-06-13 08:18:02,昨晚分的钱不见了？这太坑了，股价低了有毛用
雄安新区规划方案9月将提交中央审查而非国务院,"https://guba.eastmoney.com/news,600340,654257913.html",2017-06-12 19:46:47,
请问贵公司，未来是否增持股票稳定股价,"https://guba.eastmoney.com/news,600340,660571916.html",2017-06-26 10:01:41,【问】请问贵公司，未来是否增持股票稳定股价 【答】华夏幸福：您好！感谢您对公司的关注。公司股权相关重大事项，请您关注公司公告。¶¶2017-06-26 10:01:41 §
证券时报 交通部：有力支持雄安新区综合交通运输建设 2017年06月12日 20:09来源：证券时报,"https://guba.eastmoney.com/news,600340,654449025.html",2017-06-13 08:17:40,"证券时报 交通部：有力支持雄安新区综合交通运输建设
2017年06月12日 20:09来源：证券时报 编辑：东方财富网
摘要
【交通部：有力支持雄安新区综合交通运输建设】6月12日，京津冀交通一体化领导小组第七次会议暨雄安新区综合交通运输体系建设领导小组第一次会议召开，领导小组组长、交通运输部组书记杨传堂、部长李小鹏出席会议并强调，要加快推进京津冀交通一体化率先突破，有力支持雄安新区综合交通运输体系建设，为京津冀协同发展和雄安新区建设提供坚强交通保障。（证券时报）"
十年来市值涨幅最大的牛股之二（第一是三安光电），15倍市盈率，全流通，上证50，,"https://guba.eastmoney.com/news,600340,654436695.html",2017-06-13 07:25:33,十年来市值涨幅最大的牛股之二（第一是三安光电），15倍市盈率，全流通，上证50，雄安概念，长期持有
股友们:今天挺关键的，关注华幸的开盘价哦！[鼓掌],"https://guba.eastmoney.com/news,600340,654436049.html",2017-06-13 07:23:28,股友们:今天挺关键的，关注华幸的开盘价哦！
股友关注今天华幸的开盘价哦！挺关键的。[鼓掌],"https://guba.eastmoney.com/news,600340,654428700.html",2017-06-13 06:47:52,股友关注今天华幸的开盘价哦！挺关键的。
代表委员热议房地产：,"https://guba.eastmoney.com/news,600340,654419948.html",2017-06-13 05:59:51,直接影响通胀这一可能
华夏12日调入上证50,"https://guba.eastmoney.com/news,600340,652632230.html",2017-06-08 11:14:24,12日股权登记，进了看看
600340今天大概率低开!但必会高走!,"https://guba.eastmoney.com/news,600340,654386611.html",2017-06-13 02:43:26,600340今天大概率低开!但必会高走!
今天是洗盘呢，还是洗盘呢？？？,"https://guba.eastmoney.com/news,600340,652599364.html",2017-06-08 10:14:55,你猜
土豆土豆，我是地瓜：该股属逆市品种，目前选择下跌，首先分时进入调整，之将影响日线,"https://guba.eastmoney.com/news,600340,652650206.html",2017-06-08 11:51:54,土豆土豆，我是地瓜：该股属逆市品种，目前选择下跌，首先分时进入调整，之将影响日线级调整。短线不宜作此股，长线也需用部分筹码作高抛低吸。
地产股里有下一个茅台即地产茅台毛利率95%华夏幸福，只有地产股才能延续漂亮50,"https://guba.eastmoney.com/news,600340,654348110.html",2017-06-12 23:46:08,地产股里有下一个茅台即地产茅台毛利率95%华夏幸福，只有地产股才能延续漂亮50
清仓,"https://guba.eastmoney.com/news,600340,652592830.html",2017-06-08 10:04:11,
华夏幸福尾盘净流入超出5000万,"https://guba.eastmoney.com/news,600340,654289549.html",2017-06-12 21:04:27,华夏幸福尾盘净流入超出5000万
凭借雄安中心区及雄安外围周边大面积地块，华夏幸福还会延续超过茅台盈利能力并继续让股东们幸福乃至整个华夏都过得幸福哈哈哈长期持股舍它还有谁？,"https://guba.eastmoney.com/news,600340,654363459.html",2017-06-13 00:47:37,凭借雄安中心区及雄安外围周边大面积地块，华夏幸福还会延续超过茅台盈利能力并继续让股东们幸福乃至整个华夏都过得幸福哈哈哈长期持股舍它还有谁？
说好的价值投资呢？我买到不伪价值股吧.,"https://guba.eastmoney.com/news,600340,652653562.html",2017-06-08 12:00:55,说好的价值投资呢？我买到不伪价值股吧.
看好的人很多，筹码也集中，价格也不高，有话题，持续增长也不差，可它涨得就慢。慢慢,"https://guba.eastmoney.com/news,600340,654356584.html",2017-06-13 00:18:15,看好的人很多，筹码也集中，价格也不高，有话题，持续增长也不差，可它涨得就慢。慢慢来不要紧，希望一直涨。
明天卖的话要扣税吗？头一次遇到，不懂,"https://guba.eastmoney.com/news,600340,654356100.html",2017-06-13 00:17:12,明天卖的话要扣税吗？头一次遇到，不懂
终于没发利好公告明天涨六个点,"https://guba.eastmoney.com/news,600340,654348941.html",2017-06-12 23:50:01,终于没发利好公告明天涨六个点
入选上证50指数,"https://guba.eastmoney.com/news,600340,654346959.html",2017-06-12 23:42:36,"【入选指数】2017-06-12是公司入选上证50指数
600340"
入选上证50指数,"https://guba.eastmoney.com/news,600340,654346569.html",2017-06-12 23:40:12,600340【入选指数】2017-06-12是公司入选上证50指数
请问分红所得明天卖会亏吗,"https://guba.eastmoney.com/news,600340,654297266.html",2017-06-12 21:24:08,"我今天尾盘截图了，刚才看了下，分红1万。之前虽然也有过分红，但都是小金额，从来没注意过。
请问如果我明天卖，20%的税是什么意思？换个说法，如果明天开盘涨幅是0的情况下，不算印花税，手续费，
我一共要交多少税？"
明天卖出可以派到现金吗？,"https://guba.eastmoney.com/news,600340,654136327.html",2017-06-12 15:05:30,明天卖出可以派到现金吗？
红利到帐，资产缩水,"https://guba.eastmoney.com/news,600340,654251336.html",2017-06-12 19:30:39,红利到帐，资产缩水
我的账户显示陈本34.93现价34.94，这现价不是35.60吗？为何显示34.,"https://guba.eastmoney.com/news,600340,654280687.html",2017-06-12 20:42:37,我的账户显示陈本34.93现价34.94，这现价不是35.60吗？为何显示34.94啊？
明天分红1800，股票亏3600，净赚-1800,"https://guba.eastmoney.com/news,600340,654243079.html",2017-06-12 19:11:19,明天分红1800，股票亏3600，净赚-1800
已经快到鬼门关了，随时要做好撤离准备了，过不去就要悲剧了,"https://guba.eastmoney.com/news,600340,654092863.html",2017-06-12 13:57:48,已经快到鬼门关了，随时要做好撤离准备了，过不去就要悲剧了
华夏幸福园区将接纳数万亿“飞地经济”企业！看不到这点能赢？,"https://guba.eastmoney.com/news,600340,654315762.html",2017-06-12 22:09:47,政治风险不存在了，现股价应在70以上。超级机构强行打压，为做大长行情！
资产注入马上就要到啦！拉阔,"https://guba.eastmoney.com/news,600340,654312637.html",2017-06-12 22:02:43,无实力的ST都要被淘汰！000780*ST平能，成稀缺品！后期必定抢筹暴涨！净资产4.02元，股价4.08元，煤炭供给侧，国资委控股，央企混改龙头，煤电联婚，资产注入，整体上市预期……概念多多！大股东国电集团实力雄厚！与神华集团经已停牌谋划大计！虽然是ST也是价值！此价套了安心打新股！000780*ST平能
华夏幸福助力航天事业发展 作为中国领先的产业新城运营商，华夏幸福长期在航天产业深,"https://guba.eastmoney.com/news,600340,654288031.html",2017-06-12 21:00:27,"华夏幸福助力航天事业发展
作为中国领先的产业新城运营商，华夏幸福长期在航天产业深耕布局，并将航天产业作为其发力的10大主力产业之一，迄今已经打造了固安航天产业园、固安卫星导航产业园、怀来航天产业园等产业园区，并引进了国内外诸多航天领域的龙头企业。
如今，华夏幸福航天产业板块布局已经形成了以宇航产业为先导，航天技术应用、航天服务业为基础的国际、国内联动发展的产业集群。"
旧闻:上海证券交易所与中证指数有限公司宣布，将于6月12日调整上证50、上证18,"https://guba.eastmoney.com/news,600340,654262294.html",2017-06-12 19:58:10,"旧闻:上海证券交易所与中证指数有限公司宣布，将于6月12日调整上证50、上证180、上证380等指数的样本股。
其中，华夏幸福正式调入上证50指数样本股。
明天看它怎么折腾！"
600340华夏幸福 股价近期在10日均线之上运行，横盘时间较长，预计此股后期将,"https://guba.eastmoney.com/news,600340,654286360.html",2017-06-12 20:56:39,600340华夏幸福 股价近期在10日均线之上运行，横盘时间较长，预计此股后期将持续维持在震荡上行的走势，短期内虽有回调，但暂时并无大跌，可继续持仓。、
重磅新闻：和晶科技(300279)雄安雄安雄安雄安雄安雄安“智慧树”阿里云,"https://guba.eastmoney.com/news,600340,654228017.html",2017-06-12 18:28:53,"“智慧树”阿里云打造学前教育行业联合解决方案，探索互联网+教育的创新运营模式

2017年6月12日 和晶科技(300279)：10转增18转增上市日"
分完红明天是不是要狂跌,"https://guba.eastmoney.com/news,600340,654254186.html",2017-06-12 19:38:05,分完红明天是不是要狂跌
无论今日涨与跌，尾市时间段准备补仓60手。成本将进一步摊薄！坚定做长线。,"https://guba.eastmoney.com/news,600340,654059183.html",2017-06-12 12:53:07,无论今日涨与跌，尾市时间段准备补仓60手。成本将进一步摊薄！坚定做长线。
民币兑美元汇率继续贬,"https://guba.eastmoney.com/news,600340,654252545.html",2017-06-12 19:33:53,债市多项重磅监管新规拟出 统一监管之势正在加
《华夏幸福下周最高我看到42元》,"https://guba.eastmoney.com/news,600340,653484180.html",2017-06-10 12:21:57,"滚哥提前放话提前发帖，提前接受检验接受你我见证！

你认为呢？"
明天除权除息的价格是多少？,"https://guba.eastmoney.com/news,600340,654243364.html",2017-06-12 19:11:17,明天除权除息的价格是多少？
"中航地产，华夏幸福,发图给咨询股友无关涨跌据此操作后果自负。","https://guba.eastmoney.com/news,600340,654221750.html",2017-06-12 18:12:32,中航地产，华夏幸福
浙商中拓000906，超跌反弹，三位大佬介入，连续涨停在即,"https://guba.eastmoney.com/news,600340,654242063.html",2017-06-12 19:08:10,浙商中拓000906，超跌反弹，三位大佬介入，连续涨停在即。马云携手浙江首富鲁冠球父子以及浙江富豪李书福一举向浙商中拓砸进至少五个亿
华夏幸福下周正式计入上证50，至少一次涨停！,"https://guba.eastmoney.com/news,600340,653084197.html",2017-06-09 11:15:47,下周突破在即
分红不公告明天闷着分？,"https://guba.eastmoney.com/news,600340,654235636.html",2017-06-12 18:51:15,分红不公告明天闷着分？
赶快跑,"https://guba.eastmoney.com/news,600340,654114091.html",2017-06-12 14:32:51,赶快跑
今天抛的人是有理由的，避免红利税。明天再抛的人会有理由吗？,"https://guba.eastmoney.com/news,600340,654181330.html",2017-06-12 16:41:29,那就是坚决不看好，恐惧心过重的人。
(600340)&#160;华夏幸福：2016年年度分红，10派6.600000000(含,"https://guba.eastmoney.com/news,600340,654190636.html",2017-06-12 17:01:51,(600340) 华夏幸福：2016年年度分红，10派6.600000000(含税)，税后10派6.600000红利发放日——2017年6月13 日
华夏幸福、陆家嘴、金融街等公司2016年拟分红总额也均在10亿元以上。 值得注意,"https://guba.eastmoney.com/news,600340,654189590.html",2017-06-12 16:59:23,"华夏幸福、陆家嘴、金融街等公司2016年拟分红总额也均在10亿元以上。
值得注意的是，上述81只拟分红总额超过亿元的公司中，招商银行、上汽集团、兴业银行、中国建筑、广汽集团、宝钢股份、洋河股份、申万宏源、华夏幸福等9家绩优公司最新总市值均在1000亿元以上。"
每一次调整都是买入的机会，明天幸福华夏,"https://guba.eastmoney.com/news,600340,654036951.html",2017-06-12 11:51:58,
603979,"https://guba.eastmoney.com/news,600340,654167387.html",2017-06-12 16:07:40,金诚信（603979）净资产高达8.29元，从今年3月21.62元高点下来的出现5小浪调整.10送3含权即将实施
明天会涨,"https://guba.eastmoney.com/news,600340,653995940.html",2017-06-12 10:41:43,明天会涨
我们已经最后一次给大家拉升了，只有10分钟，跑不跑随你们，我们已经仁至义尽了,"https://guba.eastmoney.com/news,600340,654012144.html",2017-06-12 11:05:49,我们已经最后一次给大家拉升了，只有10分钟，跑不跑随你们，我们已经仁至义尽了
尾盘买进来了，等待分红，调整是好事，大家不要慌，长期投资才是真正获利的长久之计，,"https://guba.eastmoney.com/news,600340,654141362.html",2017-06-12 15:13:31,尾盘买进来了，等待分红，调整是好事，大家不要慌，长期投资才是真正获利的长久之计，那些唱空的都是想低价买进的，不要在意眼前波动，能做t的做t，把握不准的就持股不动，反正套不了你，只是时间问题！
好久上48,"https://guba.eastmoney.com/news,600340,654152556.html",2017-06-12 15:35:36,好久上48
两市今日维持绿盘调整走势，沪指在经历了连续拉升之后，上方长期均线的压制作用较强，,"https://guba.eastmoney.com/news,600340,654151824.html",2017-06-12 15:35:05,两市今日维持绿盘调整走势，沪指在经历了连续拉升之后，上方长期均线的压制作用较强，目前量能不足，短线有开展技术调整的需求。上周超跌的填权股和兜底增持概念引领了一波小盘股行情，白酒，家用电器在指数低位企稳后连续拉升，推动上证50指数继续上行。今日汽车板块再度接力炒作，炒作至高位的次新股和高送转板块今日是重灾区，场内资金的风险偏好普遍较低，且蓝筹股与题材股二者之间的跷跷板效应依然较为明显。后市可关注业绩较好的超跌小盘股和低位蓝筹股的补涨行情。
又要督查了，上次督查是ppt项目。这次应该是ppp项目,"https://guba.eastmoney.com/news,600340,654151477.html",2017-06-12 15:33:46,又要督查了，上次督查是ppt项目。这次应该是ppp项目
华夏幸福2017若结算1000亿，每股收益可达4元左右,"https://guba.eastmoney.com/news,600340,643015724.html",2017-05-16 17:44:31,"在5月16日举行的河北辖区上市公司投资者集体接待日活动上，华夏幸福(600340)证券事务代表齐麟表示，公司2016年年报已披露，预计2017年销售额为1450亿元。预计园区住宅配套、城市地产施工面积合计约4068.8万平方米，预计竣工面积合计约550.3万平方米。
2016年报结算收入500多亿，每股收益2.2元，若结算1000亿，则每股收益4元左右。"
给你们机会不要，老想着我会骗你们，知道后果了吧，补仓啊，坚持啊，继续,"https://guba.eastmoney.com/news,600340,654075635.html",2017-06-12 13:27:05,给你们机会不要，老想着我会骗你们，知道后果了吧，补仓啊，坚持啊，继续
我明白的告诉你们，又给了你们一次重新做人的机会，快跑吧[不屑],"https://guba.eastmoney.com/news,600340,654069243.html",2017-06-12 13:15:03,我明白的告诉你们，又给了你们一次重新做人的机会，快跑吧[不屑]
每股分红6毛6..今天跌就差不多了，还被套着呢,"https://guba.eastmoney.com/news,600340,654120057.html",2017-06-12 14:42:07,每股分红6毛6..今天跌就差不多了，还被套着呢
难道我买的是假的“漂亮50”？,"https://guba.eastmoney.com/news,600340,654131886.html",2017-06-12 14:58:31,难道我买的是假的“漂亮50”？
今天开始加入上证50,"https://guba.eastmoney.com/news,600340,654113062.html",2017-06-12 14:31:17,坚信这个平台是新的开始
老是亏,"https://guba.eastmoney.com/news,600340,654129367.html",2017-06-12 14:55:38,老是亏
这垃圾股有多少骗多少,"https://guba.eastmoney.com/news,600340,654128369.html",2017-06-12 14:53:30,这垃圾股有多少骗多少
明天分多少今天跌多少羊毛出在羊身上,"https://guba.eastmoney.com/news,600340,654127682.html",2017-06-12 14:53:27,明天分多少今天跌多少羊毛出在羊身上
完蛋了，快跑,"https://guba.eastmoney.com/news,600340,654127202.html",2017-06-12 14:51:57,完蛋了，快跑
又破位了，危险了。,"https://guba.eastmoney.com/news,600340,654127483.html",2017-06-12 14:52:12,又破位了，危险了。
华夏幸福，你让我如何幸福？,"https://guba.eastmoney.com/news,600340,654126583.html",2017-06-12 14:51:04,看看冀东装备彪悍雄风，买了华夏幸福的我，丝毫没有幸福模样。
不会又到35.53的位置吧！,"https://guba.eastmoney.com/news,600340,654120643.html",2017-06-12 14:43:45,不会又到35.53的位置吧！
担心红利税而抛出，真是不明智了。,"https://guba.eastmoney.com/news,600340,654117179.html",2017-06-12 14:37:57,该涨就是要涨
40元以上买进的进来唠诉一下现在的心得，,"https://guba.eastmoney.com/news,600340,654078915.html",2017-06-12 13:32:48,40元以上买进的进来唠诉一下现在的心得，
这是你们自己不跑的，九别怪我们心狠手辣了,"https://guba.eastmoney.com/news,600340,654022129.html",2017-06-12 11:23:02,这是你们自己不跑的，九别怪我们心狠手辣了
快跑！下午收盘仅涨半个点,"https://guba.eastmoney.com/news,600340,654009236.html",2017-06-12 11:01:06,快跑！下午收盘仅涨半个点
大便股！拉掉了！！,"https://guba.eastmoney.com/news,600340,654110850.html",2017-06-12 14:27:43,[大便]
都不要分红了吗？,"https://guba.eastmoney.com/news,600340,654103650.html",2017-06-12 14:16:39,都不要分红了吗？
这是什么票,"https://guba.eastmoney.com/news,600340,654108915.html",2017-06-12 14:24:48,后悔买这只票，赶快卖出，浪费时间
准备破釜沉舟一回,"https://guba.eastmoney.com/news,600340,654073734.html",2017-06-12 13:23:17,准备破釜沉舟一回
鸡冻装备板了啊，加油,"https://guba.eastmoney.com/news,600340,654107343.html",2017-06-12 14:22:05,鸡冻装备板了啊，加油
浪费时间,"https://guba.eastmoney.com/news,600340,654107031.html",2017-06-12 14:21:38,浪费时间
垃圾股,"https://guba.eastmoney.com/news,600340,654075931.html",2017-06-12 13:27:38,垃圾股
看看格力电器,"https://guba.eastmoney.com/news,600340,654106857.html",2017-06-12 14:21:11,看看格力电器
两阴夹阳，完蛋,"https://guba.eastmoney.com/news,600340,654102974.html",2017-06-12 14:14:41,两阴夹阳，完蛋
早上发动进攻 下午全盘回砸 明早接着低开 想跑 T+1伺候 割的韭菜就是你 呵呵,"https://guba.eastmoney.com/news,600340,654102871.html",2017-06-12 14:14:22,早上发动进攻 下午全盘回砸 明早接着低开 想跑 T+1伺候 割的韭菜就是你 呵呵
不涨就是要跌了 垃圾！,"https://guba.eastmoney.com/news,600340,654098370.html",2017-06-12 14:07:14,不涨就是要跌了 垃圾！
破位下行 卖套套 呵呵 烂股,"https://guba.eastmoney.com/news,600340,654097572.html",2017-06-12 14:06:33,呵呵 去了 烂股
垃圾票,"https://guba.eastmoney.com/news,600340,654084255.html",2017-06-12 13:42:21,垃圾票，赶快跑
