标题,链接,发布时间,内容
大多数人看空的时候，就是买入等涨停的气候，华夏加油,"https://guba.eastmoney.com/news,600340,722612152.html",2017-10-27 10:37:46,大多数人看空的时候，就是买入等涨停的气候，华夏加油
罪过 昨天万科A 保利地产 荣盛发展 华夏幸福同时出的三季报 华夏幸福数据综合是最好的 那三家开盘全涨 这个市场很邪恶 短期走势真是 谁资金大谁说的算 感叹,"https://guba.eastmoney.com/news,600340,722575207.html",2017-10-27 09:39:45,罪过 昨天万科A 保利地产 荣盛发展华夏幸福同时出的三季报 华夏幸福数据综合是最好的 那三家开盘全涨 这个市场很邪恶 短期走势真是 谁资金大谁说的算 感叹！
一熊到底！,"https://guba.eastmoney.com/news,600340,722601688.html",2017-10-27 10:21:33,号称漂亮50金股华夏幸福怎么这么熊？看看万科、保利甚至廊坊发展。。。。，真个大熊！！！
华夏幸福贱到没人要,"https://guba.eastmoney.com/news,600340,722598233.html",2017-10-27 10:16:27,这么贱的价格不怕机构来抢筹值得我们深思！
买入，坐等等涨停,"https://guba.eastmoney.com/news,600340,722606414.html",2017-10-27 10:28:19,买入，坐等等涨停
互联网金融 信雅达(600571)传统业务保持领先，金融科技稳步布局,"https://guba.eastmoney.com/news,600340,722608205.html",2017-10-27 10:31:07,"信雅达(600571)传统业务保持领先，金融科技稳步布局 
研报日期：2017-10-12
信雅达(600571)
公司近五年业绩基本稳定。公司 2017 年上半年营业收入为 5.72 亿元，同比增长 10.90%，归母净利润为 4,468.77 万元，同比下降 29.26%。 2016年公司营业收入为 13.85 亿元，同比增长 28.70%，近五年 CAGR 为 15.33%；归母净利润为 1.23 亿元，同比增长 1.30%，近五年 CAGR 为 18.28%。公司2016 年归母净利润增长显着低于营业收入增长，主要是因 2014 年、 2015年公司利用闲置资金进行了证券投资，而 2016 年该部分投资减少幅度较大，导致非经常性损益下降较多， 2016 年扣非后归母净利润为 1.12 亿，同比增长 25.56%。
以银行为主的金融 IT 市场有望继续快速增长。 根据 IDC 数据显示，2015 年我国银行业整体 IT 投资为 831.06 亿元，同比增长 11.92%，预计 2020年投资规模达到 1,351.3 亿元， 2015-2020 年 CAGR 为 10.21%。 银行业 IT解决方案的增长速度较快， IDC 数据显示， 2015 年我国银行业 IT 解决方案市场规模为 225.20 亿元，同比增长 23.5%，估计 2016 年市场规模为 277.20亿元，同比增长 23.1%，预计 2020 年市场规模有望达到 612.11 亿元，2016-2020 年 CAGR 为 21.9%。
公司传统业务领域继续保持领先优势。 公司在流程银行、影像系统、呼叫中心等市场保持领先优势。公司自 2008 年起开展流程银行业务，流程银行中标率在国内多年维持在 90%以上，同时流程银行的理念在保险行业也得到应用； IDC 数据显示， 公司影像系统业务目前市占率也保持领先。公司的流程银行业务与影像系统具有紧密的联系，公司能通过两种业务实现较好的协同； 根据 IDC 数据，公司 2014 年呼叫中心在银行市场的市占率约为 11.1%。公司的影像系统和呼叫中心业务均不限于银行业，在证券、保险等非银金融机构也具有广泛的应用。
内生发展和外延并购，持续加码金融科技。 公司使用生物识别、大数据、人工智能等技术， 从“银行业务流程优化”、“金融数据分析”、“风险预警”和“数字化营销”四个方面协助传统金融机构从电子化向智慧型转型。 同时，公司并购科匠信息实现金融业务的移动化；设立泛泰科技布局消费金融；参股趣链科技，积极探索区块链技术与金融的结合。
投资建议： 
在公司现有软件服务、硬件产品销售、系统维护以及环保产品等业务保持稳健增长的前提假设下，我们预计公司 2017、 2018 以及 2019 年的 EPS分别为 0.34、 0.41 和 0.48 元，对应 P/E 分别为 43.44 倍、 36.02 倍和 30.77倍。目前 IT 服务行业最新市盈率（ TTM，整体法，剔除负值）为 45.10 倍，考虑到公司在持续加码金融科技的同时， 积极拓展金融业务移动化、消费金融、供应链金融等领域，我们认为公司的估值仍具有一定的上升空间，因此首次给予其“增持”评级。
风险提示： 
市场竞争风险；坏账风险；新业务发展不及预期风险等。[长城国瑞证券有限公司]"
但股市总是熊长牛短。,"https://guba.eastmoney.com/news,600340,722605834.html",2017-10-27 10:27:30,但股市总是熊长牛短。
这业绩28应该不远，马上有希望了,"https://guba.eastmoney.com/news,600340,722603760.html",2017-10-27 10:24:42,这业绩28应该不远，马上有希望了
你才日A股,"https://guba.eastmoney.com/news,600340,722601692.html",2017-10-27 10:21:34,你才日A股
沪市以上涨9个点报收，盘面上，两市个股普涨，高送转、智能穿戴、OLED概念、家用,"https://guba.eastmoney.com/news,600340,722598406.html",2017-10-27 10:16:45,沪市以上涨9个点报收，盘面上，两市个股普涨，高送转、智能穿戴、OLED概念、家用电器、家居用品。
运气越来越好了。,"https://guba.eastmoney.com/news,600340,720282632.html",2017-10-21 23:01:20,运气越来越好了。
真尼玛的炒蛋,"https://guba.eastmoney.com/news,600340,722597195.html",2017-10-27 10:14:43,恶心
这走势！服了吗？,"https://guba.eastmoney.com/news,600340,722574202.html",2017-10-27 09:37:54,这走势！服了吗？
社保还增持呢?,"https://guba.eastmoney.com/news,600340,722594308.html",2017-10-27 10:10:02,社保还增持呢?
现在卖都是赔钱何必!,"https://guba.eastmoney.com/news,600340,722593817.html",2017-10-27 10:09:06,现在卖都是赔钱何必!
傻x们年报半年报才统计基金总数,"https://guba.eastmoney.com/news,600340,722591734.html",2017-10-27 10:05:37,傻x们年报半年报才统计基金总数
深股通第一套。,"https://guba.eastmoney.com/news,600340,722589918.html",2017-10-27 10:02:50,深股通第一套。
也许是最后的低价,"https://guba.eastmoney.com/news,600340,722588931.html",2017-10-27 10:01:20,待验证
不是不涨，是没到时候,"https://guba.eastmoney.com/news,600340,722587880.html",2017-10-27 09:59:54,不是不涨，是没到时候
果然下跌,"https://guba.eastmoney.com/news,600340,722586252.html",2017-10-27 09:57:38,三季报出来了，谈不上利空，但似乎不影响华夏持续震荡。。
华厦刚涨了一点见红,"https://guba.eastmoney.com/news,600340,716394741.html",2017-10-12 10:56:13,华厦刚涨了一点见红，就有人看得很好了，看来一厢情愿的人心火急火辽了，明天再给你一棒你就会清醒。
变成“中国建筑”的跟班！,"https://guba.eastmoney.com/news,600340,722584035.html",2017-10-27 09:54:35,变成“中国建筑”的跟班！
妖孽！我喜欢[大笑],"https://guba.eastmoney.com/news,600340,722581057.html",2017-10-27 09:49:56,妖孽！我喜欢
现在只能指望孟惊增持了,"https://guba.eastmoney.com/news,600340,722580183.html",2017-10-27 09:48:31,现在只能指望孟惊增持了
无论怎样，就是不涨,"https://guba.eastmoney.com/news,600340,722579163.html",2017-10-27 09:46:40,无论怎样，就是不涨
年报每股利润有3块了，亏本不卖,"https://guba.eastmoney.com/news,600340,722576945.html",2017-10-27 09:42:50,年报每股利润有3块了，亏本不卖
死球一个,"https://guba.eastmoney.com/news,600340,722576250.html",2017-10-27 09:41:35,死球一个
每股增值2元，那么45本，到现在的人还有多少？我就28买入，信不信由你,"https://guba.eastmoney.com/news,600340,722550144.html",2017-10-27 08:13:19,每股增值2元，那么45本，到现在的人还有多少？我就28买入，信不信由你
大势已去,"https://guba.eastmoney.com/news,600340,722572180.html",2017-10-27 09:34:07,面对现实吧
经营性净现金流-227亿元，请问还有其他上市公司比这个还差么？,"https://guba.eastmoney.com/news,600340,722421364.html",2017-10-26 22:18:46,环京房产冰封真的看来不是传言啊，千年大计太厉害了。估计明年政策还要持续，毕竟是核心工程。环京禁止搞城市连片贴边开发
华夏幸福近期盈利所要具备的三大策略,"https://guba.eastmoney.com/news,600340,722184694.html",2017-10-26 13:59:11,华夏幸福近期盈利所要具备的三大策略
明天估计能创个新低吧，少也先跌3个点,"https://guba.eastmoney.com/news,600340,722348919.html",2017-10-26 19:29:27,明天估计能创个新低吧，少也先跌3个点
满仓满仓满仓华夏幸福必幸福。,"https://guba.eastmoney.com/news,600340,722556865.html",2017-10-27 08:46:17,
公司2017年三季报列示的7-9月利润总额13.97亿，交的所得税5.81亿，所,"https://guba.eastmoney.com/news,600340,724036507.html",2017-10-31 17:47:05,【问】公司2017年三季报列示的7-9月利润总额13.97亿，交的所得税5.81亿，所得税率高达41.8%，我推测是因为递延所得税资产增加导致的，请问这些递延所得税资产是什么原因产生的？这些递延所得税资产在什么时候会去冲抵所得税？ 【答】华夏幸福：您好！关于财务信息，请您关注公司公告。谢谢！¶¶2017-10-31 17:47:05 §
根本不想看，爱咋咋滴。,"https://guba.eastmoney.com/news,600340,722528461.html",2017-10-27 06:08:48,根本不想看，爱咋咋滴。
万化很安全，沧州就不行了。。,"https://guba.eastmoney.com/news,600340,722521801.html",2017-10-27 05:27:23,万化很安全，沧州就不行了。。
恒生连涨是节后大盘上涨的先兆,"https://guba.eastmoney.com/news,600340,722511966.html",2017-10-27 04:25:43,9月废纸价格涨势逆天 70家纸厂最高上涨450元/吨
天怒雷九霄。,"https://guba.eastmoney.com/news,600340,722484990.html",2017-10-27 01:57:55,天怒雷九霄。
压单做盘，kdj和MACD金叉共振，一只穿云箭马上升空,"https://guba.eastmoney.com/news,600340,721183387.html",2017-10-24 14:59:14,压单做盘，kdj和MACD金叉共振，一只穿云箭马上升空
经营活动产生的现金流量净额(元) -224亿,"https://guba.eastmoney.com/news,600340,722382084.html",2017-10-26 20:41:35,"经营活动产生的现金流量净额(元) -224亿

这公司在干嘛啊，花出去这么多钱不收回来，我真担心资金链断裂"
华夏净利润增速和每股收益增速的差距。这是由于华夏净资产中含有105亿永续债造成的,"https://guba.eastmoney.com/news,600340,722320323.html",2017-10-26 18:24:14,华夏净利润增速和每股收益增速的差距。这是由于华夏净资产中含有105亿永续债造成的，永续债不计入负债相当于股份，三季报股东应得利润=每股收益2.02×29.55亿股=59.69亿，公司报表净利润62.28亿，差距2.59亿，这一块利润属于永续债所有者。
好股，关注,"https://guba.eastmoney.com/news,600340,722148988.html",2017-10-26 12:52:43,好股，关注
华帝属粤港澳大湾区股票,"https://guba.eastmoney.com/news,600340,722462808.html",2017-10-27 00:19:55,华帝属粤港澳大湾区股票
收益再高股价不涨又有蛋用,"https://guba.eastmoney.com/news,600340,722448212.html",2017-10-26 23:32:54,收益再高股价不涨又有蛋用
拿钱封板，主力，作一次领头羊。,"https://guba.eastmoney.com/news,600340,722432751.html",2017-10-26 22:49:52,拿钱封板，主力，作一次领头羊。
Explor第二笔无担保可转换债券的私募发售交割完,"https://guba.eastmoney.com/news,600340,722431032.html",2017-10-26 22:44:48,利好来袭：中科曙光齐翔腾达东方电气 铁汉生
延期披露三季报；山东海化：前三季净利增长近7倍 社保、易方。,"https://guba.eastmoney.com/news,600340,722417106.html",2017-10-26 22:06:38,延期披露三季报；山东海化：前三季净利增长近7倍 社保、易方。
绷紧了资金链到头了增长率也就和万科打平！,"https://guba.eastmoney.com/news,600340,722423687.html",2017-10-26 22:24:56,万科的现金流可是净180亿啊。说明万科还没有发全力。
别的股吧唱空像真的一样，有模有样，分析的有点。,"https://guba.eastmoney.com/news,600340,722421329.html",2017-10-26 22:18:42,别的股吧唱空像真的一样，有模有样，分析的有点。
三季度汇金和社保沒减持华夏幸福是好事。而社保和证金加仓的800多万股远没有基金减,"https://guba.eastmoney.com/news,600340,722420544.html",2017-10-26 22:16:39,三季度汇金和社保沒减持华夏幸福是好事。而社保和证金加仓的800多万股远没有基金减持的多，再加上离场的18000个小散的股票，这些数量不小的股票不知被何路神仙所接？
华夏幸福预收帐款为什么那么大?,"https://guba.eastmoney.com/news,600340,722403785.html",2017-10-26 21:33:37,华夏幸福预收帐款为什么那么大?
[图片],"https://guba.eastmoney.com/news,600340,722414200.html",2017-10-26 21:58:45,[图片]
1314就是傻蛋一个,"https://guba.eastmoney.com/news,600340,722419272.html",2017-10-26 22:12:57,1314就是傻蛋一个
三季度汇金和社保没减持华夏幸福是好事！而社保和证金加仓的800多万股远没有鸡们减,"https://guba.eastmoney.com/news,600340,722418569.html",2017-10-26 22:10:51,三季度汇金和社保没减持华夏幸福是好事！而社保和证金加仓的800多万股远没有鸡们减持的多，再加上三季度离场的18000个小散的股票这些数量不小的股票不知被何路神仙接了？这也许是好事！
我买4.5万股华夏幸福就是看中他的特色小镇题材,"https://guba.eastmoney.com/news,600340,722418409.html",2017-10-26 22:10:20,"以前并不知道有这股票，真到雄安板块出来也没注意，近期翻看雄安题材才发现这有趣的特色小镇，很实在的理念，房子要升值要有人买
1）要环境好
2）能找到工作，这是关乎民生的大计 
3）产业集中，地方政府有收入，美国很多城市破产就因为付出多，城市入不敷出，以至恶性循环，房子再好，你没工作岗位，你会在这里生活吗？
当然做为短线炒家这种理念是没有的，这也就是华夏一直不涨的原因
短线借2017特色小镇展览会暨特色小镇创新发展大会如果有资金炒作，或许有可能做个反弹，别的就没什么了，近期应该没戏，不如持币等大盘调整"
那个丁**肯定也有华夏幸福，就是套的太深了，每天无聊打发时间拿大家开心，你们这真,"https://guba.eastmoney.com/news,600340,696146941.html",2017-08-25 18:40:30,"那个丁**肯定也有华夏幸福，就是套的太深了，每天无聊打发时间拿大家开心，你们这真配合他。不理他不就行了！
理他干啥，以后谁再理他，谁就是猪！"
意料之中，没什么好奇怪,"https://guba.eastmoney.com/news,600340,722411778.html",2017-10-26 21:52:48,"看华夏的历年财务报表，基本上都是1季0.5元左右，2季1元偏上概率，3季0.3元左右，4季多些猜测，应该都是园区结算期利润就变化大，光靠卖房是没多少业绩的
3季报现在股东户变少，筹码集中，是唯一的看点，至少社保113和证金没有减持，筹码锁定性比较稳，欠缺的就是增量资金进场，没有就跌，有就涨，短线看来没希望，大盘调整前也不会爆跌"
不对吧每股现金流负这么多?   难道到处赊账?有问题啊!,"https://guba.eastmoney.com/news,600340,722298182.html",2017-10-26 17:37:28,不对吧每股现金流负这么多? 难道到处赊账?有问题啊!
公司三季报净利是62.28亿，总股本29.55亿，每股收益应该是62.28/29,"https://guba.eastmoney.com/news,600340,722392060.html",2017-10-26 21:05:46,公司三季报净利是62.28亿，总股本29.55亿，每股收益应该是62.28/29.55=2.11元，为什么报告中是2.02元呢?
华夏幸福操作记录，累计盈利9000余元，没有见不得人的,"https://guba.eastmoney.com/news,600340,722264704.html",2017-10-26 16:27:27,让有些人别叽叽歪歪的了
华夏已经跌无可跌了，为什么还要看空？市值1500亿()股价45块，一点也不高！,"https://guba.eastmoney.com/news,600340,722390245.html",2017-10-26 21:01:10,华夏已经跌无可跌了，为什么还要看空？市值1500亿()股价45块，一点也不高！
32元尽快止跌，否则又没有底了,"https://guba.eastmoney.com/news,600340,708789506.html",2017-09-25 09:40:44,主力真的有那么多货吗，为啥如此阴跌？
全年预计2.4每股盈利。现价13倍PE。说贵不贵，说便宜也不见得。,"https://guba.eastmoney.com/news,600340,722380904.html",2017-10-26 20:38:43,全年预计2.4每股盈利。现价13倍PE。说贵不贵，说便宜也不见得。
明天5个点左右，三季报三个点，那两个公告每一个一个点，，，OK啦，兄弟们快乐！三,"https://guba.eastmoney.com/news,600340,722348573.html",2017-10-26 19:28:43,明天5个点左右，三季报三个点，那两个公告每一个一个点，，，OK啦，兄弟们快乐！三季报符合预期。希望可以连续十年都保持35%，兄弟们一起发财！
明天竞价32，不知道能不能买到啊！,"https://guba.eastmoney.com/news,600340,722304273.html",2017-10-26 17:49:31,明天竞价32，不知道能不能买到啊！
600340:华夏幸福关于河北新型显示产业发展基金完成基金业协会备案的进展公告,"https://guba.eastmoney.com/news,600340,722276642.html",2017-10-26 16:51:30,"公告日期：2017-10-27
证券简称：华夏幸福 证券代码：600340 编号：临2017-301



华夏幸福基业股份有限公司关于河北新型显示产业发展基金完成基金业协会备案的进展公告



本公司董事会及全体董事保证本公告内容不存在任何虚假记载、误导性陈述或者重大遗漏，并对其内容的真实性、准确性及完整性承担个别及连带责任。



华夏幸福基业股份有限公司（以下简称“华夏幸福”或“公司”）于2016年11月14日召开公司第五届董事会第九十一次会议，并于2016年12月1日召开公司2016年第十三次临时股东大会，审议通过了关于签署《合作框架协议》暨关联交易的相关议案，同意公司作为有限合伙人参与投资由公司关联方知合资本管理有限公司（下称“知合资本”）发起设立的河北新型显示产业发展基金（以下简称“显示基金”），基金规模为100亿元人民币，其中公司作为有限合伙人将出资29.99亿元（具体内容详见公司于2016年11月16日发布的临2016-277号和临2016-282号公告、2016年12月2日发布的临2016-304号公告）。



公司于2017年6月27日披露《华夏幸福关于参与投资河北新型显示产业发展基



金暨关联交易事项的进展公告》，显示基金已获工商核准注册登记，公司作为有限合伙人与普通合伙人知合资本已按照《合作框架协议》的约定，与其他有限合伙人签署了《河北新型显示产业发展基金（有限合伙）合伙协议》（具体内容详见公司于2017年6月27日发布的临2017-193号公告）。



近日，显示基金已完成中国证券投资基金业协会的备案手续，具体备案情况如下：



基金名称：河北新型显示产业发展基金（有限合伙）；



管理人名称：知合资本管理有限公司；



托管人名称：中国光大银行股份有限公司；



备案编码：SW3117；



备案日期：2017年10月25日。



公司将根据后续进展及时履行信息披露义务，敬请广大投资者注意投资风险。



特此公告。



华夏幸福基业股份有限公司董事会



2017年10月27日




[点击查看PDF原文]
提示：本网不保证其真实性和客观性，一切有关该股的有效信息，以交易所的公告为准，敬请投资者注意风险。
展开阅读全文"
垃圾，还不涨[不赞][不赞][不赞][不赞]。,"https://guba.eastmoney.com/news,600340,722349634.html",2017-10-26 19:30:57,垃圾，还不涨[不赞][不赞][不赞][不赞]。
业绩真TM好，三季度每股收益2元，股价30，增速35%，这样的股市场找不到了。2,"https://guba.eastmoney.com/news,600340,722300160.html",2017-10-26 17:41:30,"业绩真TM好，三季度每股收益2元，股价30，增速35%，这样的股市场找不到了。2017,利润大概85亿，每股收益2.9元。
成熟的市场市盈率应该与业绩增速看齐。即便是万科，其市盈率也高达20倍，凭啥亏待华夏？还有那些百倍以上市盈率的垃圾股一大推，业绩还是负增长，甚至亏损也照样能走牛。说白了就是主力机构不带散户玩，一波雄安套牢太多散户，等散户大部分割肉就涨了。
白马股，大盘股，散户太看好，洗盘时间要很长。这么大的盘子也不是一两家主力机构能玩的转的。"
