标题,链接,发布时间,内容
融资盘剩余下跌空间1.5%左右,"https://guba.eastmoney.com/news,600340,721748272.html",2017-10-25 15:57:25,核电用钢龙头中标海外项目 翻倍涨幅望引领板块
明天31.94拭目以待,"https://guba.eastmoney.com/news,600340,721717548.html",2017-10-25 14:52:17,明天31.94拭目以待
明日未必还能够继续大涨或大跌,"https://guba.eastmoney.com/news,600340,721719616.html",2017-10-25 14:55:46,明日未必还能够继续大涨或大跌
今天休整一下 明后天休整一下会有不错的表现,"https://guba.eastmoney.com/news,600340,721718046.html",2017-10-25 14:53:11,今天休整一下 明后天休整一下会有不错的表现
明日未必还能够继续大涨。,"https://guba.eastmoney.com/news,600340,721714392.html",2017-10-25 14:46:36,明日未必还能够继续大涨。
最后都是指标股拉升一波行情结束，熔断前后展开,"https://guba.eastmoney.com/news,600340,721711525.html",2017-10-25 14:41:34,最后都是指标股拉升一波行情结束，熔断前后展开
等回踩,"https://guba.eastmoney.com/news,600340,721709533.html",2017-10-25 14:37:59,等回踩
华夏暴涨在即，赶紧上车！,"https://guba.eastmoney.com/news,600340,721703597.html",2017-10-25 14:26:58,"根据分析，






可能吗？
做梦吧！"
今天买的全套牢了,"https://guba.eastmoney.com/news,600340,721680847.html",2017-10-25 13:44:11,哦耶
尾盘会绿吧,"https://guba.eastmoney.com/news,600340,721655295.html",2017-10-25 12:48:24,这鸟股
这个股票 看来只要冲高就赶快卖 后面就会跌下来 再买回来 天天做小波段 也是可以,"https://guba.eastmoney.com/news,600340,721682395.html",2017-10-25 13:46:51,这个股票 看来只要冲高就赶快卖 后面就会跌下来 再买回来 天天做小波段 也是可以的
均线压力大，换调整到位的牛股,"https://guba.eastmoney.com/news,600340,721668403.html",2017-10-25 13:21:51,中航飞机 调整到位，随时拔地而起。
汇川技术智能制造中心开工仪式隆重举行 2017-10-24 汇川技术news 1,"https://guba.eastmoney.com/news,600340,721347297.html",2017-10-24 21:57:34,"汇川技术智能制造中心开工仪式隆重举行
2017-10-24 汇川技术news
10月24日上午，汇川技术智能制造中心在苏州市吴中区汇川技术二期厂区隆重举行开工仪式。
吴中区委书记、吴中经济技术开发区工委书记唐晓东先生，吴中区委常委、政府副区长徐行先生，吴中经济技术开发区工委副书记、管委会副主任顾玉琪先生，吴中经济技术开发区工委委员、管委会副主任顾建明先生，吴中经济技术开发区工委委员、管委会副主任朱凤泉先生，太湖新城吴中管理委员会副主任周学斌先生，深圳建业工程集团股份有限公司董事长黄朝凯先生，汇川技术朱兴明总裁及汇川技术高管团队等出席了开工典礼。
沙画师用指尖艺术的表演形式向现场观众描绘了汇川技术壮丽的发展历程
汇川技术总裁朱兴明向来宾表示热烈欢迎。在致辞中，朱总分享了做企业的“四个责任”：
一、为客户创造价值，这是做企业的首要目标。
二、为员工创造机会。汇川技术从2008年落户吴中，生产规模逐渐扩大，为吴中区引进了许多高层次的人才，为吴中区的发展提供不竭的动力。同时也让这些人才在吴中这片创新热土充分施展拳脚，收获光明前途。
三、为股东创造财富。作为一家上市公司，汇川技术从2008年入驻苏州时100多亿的市值，经过近十年的高速发展，到今天市值已近500亿。
四、为社区创造繁荣。初入吴中，扎根吴中，汇川技术的发展，得到了吴中区政府的大力帮助，同时，也为吴中创造了社区繁荣。进入中国特色社会主义的新时代，汇川技术将以崭新的面貌，勇当区域内企业典范，带动吴中区产业发展。
深圳建业工程集团股份有限公司董事长黄朝凯先生代表施工单位表态，以精品工程为汇川助力，并表达了对汇川技术未来的衷心祝愿。
吴中区委书记、吴中经济技术开发区工委书记唐晓东先生对汇川技术智能制造中心开工表达了衷心的祝愿。他指出，汇川技术作为中国智造的实践者和推进工业文明的担当者，多年来与吴中区政府紧密合作，取得了丰硕的成果。汇川技术智能制造中心开工，预示着汇川借着新时代中国特色社会主义的东风，昂首迈向新的未来。吴中区政府充分尊重企业创新、创业精神，配合企业做好政府层面服务，携手汇川打造区域内高新技术产业基地。
仪式最后，来宾和朱总共同点亮象征汇川技术蓬勃发展的创新树。
汇川技术智能制造中心的建成，将极大地提升公司的智能制造水平和研发实力，推进汇川向工业4.0迈进的步伐，助力汇川二次腾飞！"
600305做短线的请离开。,"https://guba.eastmoney.com/news,600340,721658652.html",2017-10-25 12:59:58,600305做短线的请离开。
大盘不拉，大盘下午资金难留,"https://guba.eastmoney.com/news,600340,721657481.html",2017-10-25 12:55:43,雄安概念最大漏网之鱼：南方汇通应该是雄安最强
不敢说最低价抄底，但敢说这里就是底部,"https://guba.eastmoney.com/news,600340,719204595.html",2017-10-19 15:05:13,拭目以待
机会是留给有耐心的人！,"https://guba.eastmoney.com/news,600340,721565594.html",2017-10-25 09:52:08,主力压盘太明显（近几日都是这样），谁也不知道该股什么时候拉升，也许近日也许一周也许一个月。总之年底前要有一波拉升。有耐心就拿着！
