标题,链接,发布时间,内容
600340:华夏幸福关于拟签订整体合作开发建设经营安徽省六安市约定区域的合作协议及其专项结算补充协议的公告,"https://guba.eastmoney.com/news,600340,722274731.html",2017-10-26 16:47:34,"公告日期：2017-10-27
证券简称：华夏幸福 证券代码：600340 编号：临2017-300



华夏幸福基业股份有限公司关于拟签订整体合作开发建设经营安徽省六安市约定区域的合作协议及其专项结算补充协议的公告



本公司董事会及全体董事保证本公告内容不存在任何虚假记载、误导性陈述或者重大遗漏，并对其内容的真实性、准确性及完整性承担个别及连带责任。



重要提示：



合同类型：合作协议及其专项结算补充协议



合同生效条件：合同由双方法定代表人或其授权代表签署并加盖公章且经本公司董事会



审议通过之日起生效。



合同履行期限：25年，自协议生效之日起计算。



本协议中六安经济技术开发区管委会与公司约定的合作开发区域占地面积以实际测量



为准，所涉及具体建设用地面积需以政府最终批准的规划为准。



对上市公司当期业绩的影响：该合同履行对公司2017年的资产总额、净资产和净利润



等不构成重大影响。对未来几年公司的净资产和净利润将产生一定的影响,具体数额目前还无法预测,今后将在定期报告中披露。



本项目实施可能存在的主要风险为合同履行期限较长，存在可能遭遇不可抗力因素影响



的风险。敬请广大投资者注意风险。



一、合同审议情况



华夏幸福基业股份有限公司(以下简称“公司”或“乙方”)已于2017年10月取得《中标通知书》，确认公司为安徽省六安经济技术开发区产业新城PPP项目中标单位（具体内容详见公司于2017年10月14日发布的临2017-283号公告）。



公司于2017年10月26日召开第六届董事会第二十六次会议，审议通过了《关于签订整体合作开发建设经营安徽省六安市约定区域的合作协议及其专项结算补充协议的议案》,同意公司与六安经济技术开发区管委会（以下简称“甲方”）签署《关于整体合作开发建设经营安徽省六安市约定区域的合作协议》及《关于整体合作开发建设经营安徽省六安市约定区域的合作协议的专项结算补充协议》（以下合称“本协议”）。具体内容如下：



二、合同的双方当事人



甲方：六安经济技术开发区管委会



乙方：华夏幸福基业股份有限公司



三、合同主要条款



（一）项目概况



甲方将以安徽省六安市行政区划内约定区域（以下简称“合作区域”）的整体开发各事项与乙方进行合作，合作区域北至刘安路，南至312国道，西至迎宾大道，东至瓦西干渠。合作区域面积以实际测量为准。



（二）合作内容



甲方负责整个区域内的开发建设管理工作，主要负责履行政府职能、主导重大事项决策、确定标准规范、提供政策支持、实施项目监管。甲方按约定负责协调相关部门进行合作区域内规划建设用地的前期土地征转并形成建设用地，按照甲乙双方约定的开发进度提供建设用地并依法进行供地。



乙方负责投入资金全面协助甲方进行合作区域的投资、开发、建设、招商及运营等工作，并根据本协议约定享有相应的收益，乙方保证按时完成本协议约定的各项工作，具体包括在合作区域的开发中根据规划要求提供“九通一平”等基础设施建设、公共设施建设、土地整理投资、产业发展服务、规划咨询与设计、物业管理、运营维护等工作。



（三）合作开发排他性与合作期限



1、在本协议项下双方的合作是排他性的，非经乙方同意不可撤销或变更。



2、本项目的合作期限为25年，自本协议生效之日起计算。



（四）项目公司



本协议签署后，乙方将授权其下属全资子公司华夏幸福产业新城投资有限公司在合作区域内独资成立专门从事合作区域开发建设经营的具有独立法人资格的项目公司。项目公司成立后，本协议约定应由乙方享有、承担的权利、义务和责任全部转由该项目公司承担。



（五）政府付费资金来源和保障



本着诚实守信、合作共赢、共同发展和“谁投资，谁受益”原则，甲方承诺将合作区域内所新产生的收入的地方留成部分（即扣除上缴中央、安徽省、六安市级部分后的收入）按国家规定缴纳至地方财政后，按照约定比例留存后纳入财政预算支出管理和中长期财政规划，通过安排预算支出，作为支付乙方服务费用的资金来源，并完善各项收支手续，以保障乙方各项服务费用的顺利支付。



合作区域内所新产生的收入是指合作期限内合作区域内单位与个人经营活动新产生的各类收入，主要包括税收收入（原有企业原址产生的税收收入除外）、土地使用权出让收入、其他非税收入（含专项收入和专项基金等）。



（六）乙方收取服务费用的对外项目和结算方式



1、就基础设施建设、公共设施建设项目，甲方应向乙方支付建设服务费用，具体包括建设成本……
[点击查看PDF原文]
提示：本网不保证其真实性和客观性，一切有关该股的有效信息，以交易所的公告为准，敬请投资者注意风险。
展开阅读全文"
股吧的气氛已经明显不对了，不是因为唱空如何,"https://guba.eastmoney.com/news,600340,722318585.html",2017-10-26 18:20:29,隐约中感到乏味的唱多已经失去意义了，有些长线资金开始思索未来了。
中报符合预期，稳健！,"https://guba.eastmoney.com/news,600340,722317956.html",2017-10-26 18:19:04,中报符合预期，稳健！
中国恒大~华夏幸福 2017年上半年中国恒大暴涨6倍，下半年华夏幸福该涨多少？,"https://guba.eastmoney.com/news,600340,722308589.html",2017-10-26 17:58:19,"中国恒大~华夏幸福
2017年上半年中国恒大暴涨6倍，下半年华夏幸福该涨多少？
这两家公司又很多相似的之处。"
竞猜 竞猜 三季报净利润会达到多少亿,"https://guba.eastmoney.com/news,600340,722236053.html",2017-10-26 15:22:36,
600340:华夏幸福第六届董事会第二十六次会议决议公告,"https://guba.eastmoney.com/news,600340,722274732.html",2017-10-26 16:47:34,"公告日期：2017-10-27
证券简称：华夏幸福 证券代码：600340 编号：临2017-299



华夏幸福基业股份有限公司



第六届董事会第二十六次会议决议公告



本公司董事会及全体董事保证本公告内容不存在任何虚假记载、误导性陈述或者重大遗漏，并对其内容的真实性、准确性及完整性承担个别及连带责任。



一、董事会会议召开情况



华夏幸福基业股份有限公司（以下简称“公司”）于2017年10月20日以



邮件方式发出召开第六届董事会第二十六次会议的通知，会议于2017年10月



26日在北京市朝阳区佳程广场A座7层会议室以现场结合通讯方式召开并表决。



本次会议应参与表决的董事8名，实际参与表决的董事8名。本次会议由公司董



事长王文学先生主持，公司董事会秘书及监事列席了本次会议。会议的召集、召开及表决程序符合《中华人民共和国公司法》及《华夏幸福基业股份有限公司章程》的规定。



二、董事会会议审议情况



(一)审议通过《2017年第三季度报告全文及正文》



表决结果：8票同意，0票反对，0票弃权。



具体内容详见上海证券交易所网站同日公告的华夏幸福基业股份有限公司《2017年第三季度报告全文》及《2017年第三季度报告正文》。



(二)审议通过《关于签订整体合作开发建设经营安徽省六安市约定区域的合作协议及其专项结算补充协议的议案》



表决结果：8票同意，0票反对，0票弃权。



具体内容详见上海证券交易所网站同日公告的临2017-300号公告。



特此公告。



华夏幸福基业股份有限公司董事会



2017年10月27日




[点击查看PDF原文]
提示：本网不保证其真实性和客观性，一切有关该股的有效信息，以交易所的公告为准，敬请投资者注意风险。
展开阅读全文"
擦，这股散户太多了，感觉一时半会没戏啊，爱咋地咋地吧，反正洗不出去我,"https://guba.eastmoney.com/news,600340,703382330.html",2017-09-13 16:22:27,擦，这股散户太多了，感觉一时半会没戏啊，爱咋地咋地吧，反正洗不出去我
坐等三季报看黑庄压盘被打脸 无视业绩成长无视大盘 一心压盘要带血的筹码 真心疯癫,"https://guba.eastmoney.com/news,600340,722204275.html",2017-10-26 14:28:48,坐等三季报看黑庄压盘被打脸 无视业绩成长无视大盘 一心压盘要带血的筹码 真心疯癫
二点半跳水跌停，拭目以待,"https://guba.eastmoney.com/news,600340,722176202.html",2017-10-26 13:46:09,二点半跳水跌停，拭目以待
这股不是不胀，是证监压的不能涨。,"https://guba.eastmoney.com/news,600340,722220900.html",2017-10-26 14:54:15,这股不是不胀，是证监压的不能涨。
无论从业绩还是基金成本来算，都是顶部区域,"https://guba.eastmoney.com/news,600340,722181180.html",2017-10-26 13:53:43,无论从业绩还是基金成本来算，都是顶部区域
冲上40元，让空狗们看看。,"https://guba.eastmoney.com/news,600340,722194319.html",2017-10-26 14:14:05,冲上40元，让空狗们看看。
截止9.30基金剩35家，金额14亿，都获利出局了。,"https://guba.eastmoney.com/news,600340,722180783.html",2017-10-26 13:53:09,截止9.30基金剩35家，金额14亿，都获利出局了。
为什么我中不了新股[哭]，是不是因为资金少的都。,"https://guba.eastmoney.com/news,600340,722179603.html",2017-10-26 13:51:24,为什么我中不了新股，是不是因为资金少的都。
个股历史市盈率,"https://guba.eastmoney.com/news,600340,721879172.html",2017-10-25 21:39:26,之前在上海证券交易所的数据栏内可以查询个股的历史市盈率，现在查不到了。请问，有谁知道该如何查询？麻烦告诉我。谢谢！
年复合增长率30以上，做股东等分红随便你洗盘压盘我就不卖杂了，还删我贴[不赞],"https://guba.eastmoney.com/news,600340,722166681.html",2017-10-26 13:31:06,年复合增长率30以上，做股东等分红随便你洗盘压盘我就不卖杂了，还删我贴[不赞]
华夏幸福半年不会大涨，还是换股了。,"https://guba.eastmoney.com/news,600340,722150196.html",2017-10-26 12:57:19,[不赞]
在40%左右的业绩增速面前 所有的砸压都是苍白无力的 这个时候压只能压走短线的,"https://guba.eastmoney.com/news,600340,722077194.html",2017-10-26 10:23:08,如题
加仓华夏幸福，不喜勿喷，谢谢,"https://guba.eastmoney.com/news,600340,722160460.html",2017-10-26 13:20:38,加仓华夏幸福，不喜勿喷，谢谢
风口即将到来：雄安新区规划。,"https://guba.eastmoney.com/news,600340,722157542.html",2017-10-26 13:15:21,风口即将到来：雄安新区规划。
买买买。 不要倒在黎明前。,"https://guba.eastmoney.com/news,600340,722154761.html",2017-10-26 13:09:57,"买买买。
不要倒在黎明前。"
精准避开一轮又一轮……？,"https://guba.eastmoney.com/news,600340,722122252.html",2017-10-26 11:33:23,精准避开一轮又一轮……？
今天肯定涨没有悬念,"https://guba.eastmoney.com/news,600340,720532795.html",2017-10-23 09:21:28,今天肯定涨没有悬念
洗盘中，耐心等,"https://guba.eastmoney.com/news,600340,722128879.html",2017-10-26 11:47:32,洗盘中，耐心等
华夏幸福面对14多万的投资人严重不作为，建议罢免董事长。,"https://guba.eastmoney.com/news,600340,722075850.html",2017-10-26 10:21:15,华夏幸福面对14多万的投资人严重不作为，建议罢免董事长。
你们说今天会不会涨？,"https://guba.eastmoney.com/news,600340,722082973.html",2017-10-26 10:31:41,你们说今天会不会涨？
大盘屡创新高  它什么样子呵呵,"https://guba.eastmoney.com/news,600340,722112770.html",2017-10-26 11:17:44,你们玩
今天还不能买，三季报出来还要跌一波。,"https://guba.eastmoney.com/news,600340,722106675.html",2017-10-26 11:07:57,今天还不能买，三季报出来还要跌一波。
下蹲一下起跳？[想一下],"https://guba.eastmoney.com/news,600340,722111583.html",2017-10-26 11:15:55,下蹲一下起跳？
真正的大牛股，这走势太棒了，有点四大行的味道了，哈哈，先进点。,"https://guba.eastmoney.com/news,600340,722108080.html",2017-10-26 11:10:15,真正的大牛股，这走势太棒了，有点四大行的味道了，哈哈，先进点。
好人好报，坏人孬报，这话永远对！,"https://guba.eastmoney.com/news,600340,721163377.html",2017-10-24 14:26:36,"本来不想咒人，没水准，看了股吧一些愚民对华夏幸福王八吃秤砣的样子，甚是好笑。
你们持股本与我无干，我也看空也与之无干，何必说些难听的话，
事实上我是个嫉恶如仇的人，一般也不吃嘴上这种亏。
有人觉得骂人过瘾就骂吧，你怎么骂我我就怎么还给你。
这个吧里大多数活跃的人群，总觉得买入并持有华夏就是干大事，
我等看空华夏的就是小p民，这不知道谁给你们的自信，谁给你们的那份霸气！
事实将证明谁是对的，无需诅咒，诅咒别人就是诅咒你自己！"
唉还是茅台牛     跟你说实话吧 买茅台就是赌博  主力做庄,"https://guba.eastmoney.com/news,600340,722093283.html",2017-10-26 10:47:04,唉还是茅台牛 跟你说实话吧 买茅台就是赌博 主力做庄
天天跌 常年亏损害人企业。,"https://guba.eastmoney.com/news,600340,722098582.html",2017-10-26 10:55:12,天天跌 常年亏损害人企业。
这是假的上证50吧？。。。,"https://guba.eastmoney.com/news,600340,722089706.html",2017-10-26 10:41:39,这是假的上证50吧？。。。
我10点抛了，你们抛了吗？这股不要担心买不到，什么时候卖都是对的，总有更低的价让你买的。,"https://guba.eastmoney.com/news,600340,721625721.html",2017-10-25 11:31:04,我10点抛了，你们抛了吗？这股不要担心买不到，什么时候卖都是对的，总有更低的价让你买的。
还涨不过大盘？,"https://guba.eastmoney.com/news,600340,722067608.html",2017-10-26 10:10:08,这票整整错过一波牛市
我10点抛了，你们抛了吗？华夏幸福什么时候卖都是对的，总有更低的价让你买的。,"https://guba.eastmoney.com/news,600340,721626933.html",2017-10-25 11:32:52,我10点抛了，你们抛了吗？华夏幸福什么时候卖都是对的，总有更低的价让你买的。
不出意外今天茅台的走势就是明天华夏的走势,"https://guba.eastmoney.com/news,600340,722068008.html",2017-10-26 10:10:41,不出意外今天茅台的走势就是明天华夏的走势
我只想告诉你们 在华夏里是浪费行情 它是会涨但是短期很难有起色,"https://guba.eastmoney.com/news,600340,722071774.html",2017-10-26 10:15:42,它启动的时候价格就算高在进就来的急 懂吗
大盘3200时，华夏是35元，现在大盘3400了，华夏竟然是31元,"https://guba.eastmoney.com/news,600340,722076167.html",2017-10-26 10:21:43,大盘3200时，华夏是35元，现在大盘3400了，华夏竟然是31元
看主力表演真的很爽小心新股民被吓着,"https://guba.eastmoney.com/news,600340,722074767.html",2017-10-26 10:19:43,看主力表演真的很爽小心新股民被吓着
砸砸砸，不怕把趋势砸坏就砸，狗崽子们 晕。,"https://guba.eastmoney.com/news,600340,722073606.html",2017-10-26 10:18:06,砸砸砸，不怕把趋势砸坏就砸，狗崽子们 晕。
明天31.95拭目以待,"https://guba.eastmoney.com/news,600340,721708337.html",2017-10-25 14:35:48,
价值股因为雄安概念被沉沦了,"https://guba.eastmoney.com/news,600340,722069331.html",2017-10-26 10:12:28,可悲
趋势面前，一切卖单都是纸老虎。,"https://guba.eastmoney.com/news,600340,722067390.html",2017-10-26 10:09:52,趋势面前，一切卖单都是纸老虎。
大环境下，没有价值的股票，终将淘汰,"https://guba.eastmoney.com/news,600340,722062804.html",2017-10-26 10:03:37,大环境下，没有价值的股票，终将淘汰
华夏幸福大涨4天，今天要调整了,"https://guba.eastmoney.com/news,600340,722053144.html",2017-10-26 09:51:13,华夏幸福大涨4天，今天要调整了，估计跌3%左右
看不懂，喜事当丧事过？,"https://guba.eastmoney.com/news,600340,722052060.html",2017-10-26 09:49:48,3季度业绩大幅增长，0.45，业绩只有0.17的智飞生物在29元之上很坚挺，盘子还大得多！疫苗股，3季度0.45，还有很多增长题材，怕什么呢？搞不懂！
中孚实业向上拐点出现抢进,"https://guba.eastmoney.com/news,600340,722037110.html",2017-10-26 09:25:13,"提示:证监会正严密监控恶意做空行为,并将予以严"
华夏幸福盈利今年2.9元 明年4元 后年5.15元。,"https://guba.eastmoney.com/news,600340,722034347.html",2017-10-26 09:18:54,华夏幸福盈利今年2.9元 明年4元 后年5.15元。
哈哈，茅台要涨停了,"https://guba.eastmoney.com/news,600340,722034940.html",2017-10-26 09:20:01,哎，就怕货比货啊
华夏现在的股价决不是庄家打压所止！,"https://guba.eastmoney.com/news,600340,716344122.html",2017-10-12 09:19:46,华夏现在的股价决不是庄家打压所止！现在华夏的朋很多友们都认为现在的股价是庄家打压所止，但本人确有不同看法，，我认为庄家有二种，一种是恶庄，操作手段就是高抛低吸，刻意打压等等恶劣手段，赚散户的血汗钱！赚点蝇头小利！但是它们一般不会在绩优大蓝筹股中操作的！它们的活动中心在中小板，创业板！还有一种庄家我认为是良庄，它们一般是根据它们的信息优势、政策面等等利好预期，选好标的提前布局！等待时机成熟，集中力量强力拉升！赚企业和股票上涨的钱！赚大钱！我不知道华夏里有没有庄家，但华夏里肯定没有恶庄！华夏的土壤根本不合适它们！华夏现在的情况，我认为还是形势不明朗、时机未到所止，华夏现在还有许多不确定因素，比如雄安的问题等等，如果一切都差不多确定了，预期基本明朗了，到那时我们就会得到我们的收获！是瓜？是豆？还是什么？但愿大家能种什么收到什么！而且还是大丰收！
请问公司具有建筑工程施工总承包一级及以上资质、市政公用工程施工总承包一级及以上资,"https://guba.eastmoney.com/news,600340,724036498.html",2017-10-31 17:47:05,【问】请问公司具有建筑工程施工总承包一级及以上资质、市政公用工程施工总承包一级及以上资质和房地产开发一级资质。具有10亿元人民币及以上资金规模的基金管理经验。投标人或其下属企业近五年（2012年10月1日至今）具有绿色三星的项目业绩，近五年（2012年10月1日至今）具有10万平方米及以上物业运营管理业绩等以上要求吗？ 【答】华夏幸福：您好！感谢您的关注。请您以公司公开信息为准。谢谢！¶¶2017-10-31 17:47:05 §
华夏幸福的新城复制模式有一个问题，就是员工队伍会越来越庞大，管理起来越来越困难。,"https://guba.eastmoney.com/news,600340,724036492.html",2017-10-31 17:47:05,【问】华夏幸福的新城复制模式有一个问题，就是员工队伍会越来越庞大，管理起来越来越困难。建议公司采用人工智能辅助很多业务，在以后的复制中可以减少对人员数量的依赖。 【答】华夏幸福：您好！感谢您的建议。¶¶2017-10-31 17:47:05 §
明天神华和国电复牌，大唐会否跟风来个一字板？。,"https://guba.eastmoney.com/news,600340,721990709.html",2017-10-26 05:28:46,明天神华和国电复牌，大唐会否跟风来个一字板？。
散户看帐户：钱去哪儿了？ 心再次碎了,"https://guba.eastmoney.com/news,600340,717298366.html",2017-10-15 17:34:01,五万股，到今天亏万
还有20个亿融资需要清洗，估计半年还不够,"https://guba.eastmoney.com/news,600340,721700071.html",2017-10-25 14:20:27,还有20个亿融资需要清洗，估计半年还不够
请问目前股东人数是多少人？,"https://guba.eastmoney.com/news,600340,721653935.html",2017-10-25 11:35:45,"【问】请问目前股东人数是多少人？ 【答】华夏幸福：您好！根据半年报披露，截至2017年6月30日，公司股东人数146,568户。关于股东人数，您可在公司披露的定期报告中查询。谢谢！¶¶2017-10-25 11:35:45 §"
国产航母下水日期临近 海洋信息化领域迎机遇（,"https://guba.eastmoney.com/news,600340,721883840.html",2017-10-25 21:49:44,是谁在侵吞贾跃亭的乐视和蔡成功的大风厂？
直觉很重要。,"https://guba.eastmoney.com/news,600340,721854518.html",2017-10-25 20:37:24,直觉很重要。
深圳本地＋雄安概念，下午涨停啊华强。,"https://guba.eastmoney.com/news,600340,721757954.html",2017-10-25 16:19:38,深圳本地＋雄安概念，下午涨停啊华强。
尤其是小盘股,"https://guba.eastmoney.com/news,600340,721847721.html",2017-10-25 20:19:19,需要留意的是
今天可能会跌停，散户别急着进！每次拉高，都疯。,"https://guba.eastmoney.com/news,600340,721796817.html",2017-10-25 18:02:01,今天可能会跌停，散户别急着进！每次拉高，都疯。
不怕跌，在这个价位就买一点，套住的补一点,"https://guba.eastmoney.com/news,600340,719052395.html",2017-10-19 10:50:40,不怕跌，在这个价位就买一点，套住的补一点
今天还是会跌 和大对着干的 主力一定会让收绿 中央要查一下了,"https://guba.eastmoney.com/news,600340,719023676.html",2017-10-19 10:21:24,今天还是会跌 和大对着干的 主力一定会让收绿 中央要查一下了
只是来看看，我不说话。[不说了]。,"https://guba.eastmoney.com/news,600340,721652211.html",2017-10-25 12:38:02,只是来看看，我不说话。[不说了]。
有毒  新手  有人带玩么？,"https://guba.eastmoney.com/news,600340,721715654.html",2017-10-25 14:48:56,有毒 新手 有人带玩么？
融资创新低,"https://guba.eastmoney.com/news,600340,721763429.html",2017-10-25 16:32:57,明天晚上出季报，不出意外又是连跌几天，这股进50就是个错误
早知道买世贸了，人家都跌破净资产了，幸福啥时候跌破净资产我再加仓吧。华山论贱，华,"https://guba.eastmoney.com/news,600340,721808079.html",2017-10-25 18:40:30,早知道买世贸了，人家都跌破净资产了，幸福啥时候跌破净资产我再加仓吧。华山论贱，华夏是我买的五只股票中最垃圾的，没有之一。
航天机电(600151)融资融券信息(06-10),"https://guba.eastmoney.com/news,600340,721805818.html",2017-10-25 18:33:10,航天机电(600151)融资融券信息(06-10)
没想到啊，又来一小T,"https://guba.eastmoney.com/news,600340,721699221.html",2017-10-25 14:18:52,主力施舍
你好，请问公司预计2017年扣除非经常性损益后的净利润增长百分比大约是多少？,"https://guba.eastmoney.com/news,600340,724036487.html",2017-10-31 17:47:05,【问】你好，请问公司预计2017年扣除非经常性损益后的净利润增长百分比大约是多少？ 【答】华夏幸福：您好！关于公司业绩情况，请您关注公司公告。谢谢！¶¶2017-10-31 17:47:05 §
请问公司有没有进军租房市场或者以租代购业务的计划？此外，公司在雄安地区是否有实际,"https://guba.eastmoney.com/news,600340,721653970.html",2017-10-25 11:35:45,【问】请问公司有没有进军租房市场或者以租代购业务的计划？此外，公司在雄安地区是否有实际业务开展？ 【答】华夏幸福：您好！公司在部分产业新城内开发了人才公寓，为园区企业员工提供租赁房屋。关于雄安新区业务情况，请您参见公司公告。谢谢！¶¶2017-10-25 11:35:45 §
请问（关于禁止洋垃圾入境推进固体废物进口管理。,"https://guba.eastmoney.com/news,600340,721766193.html",2017-10-25 16:39:59,请问（关于禁止洋垃圾入境推进固体废物进口管理。
您好，请问公司的营业利润主要来自哪些业务，能说得通俗易懂一点吗？我读书少初中文化,"https://guba.eastmoney.com/news,600340,721749566.html",2017-10-25 16:00:22,"您好，请问公司的营业利润主要来自哪些业务，能说得通俗易懂一点吗？我读书少初中文化，真的，谢谢。 
华夏幸福
华夏幸福：您好！公司是中国领先的产业新城运营商，核心产品为产业新城和产业小镇。关于公司营业利润具体业务来源，您可以参考公司2017年中期报告中对营业收入和营业成本分行业的列示，主要包括产业发展服务、基础设施建设、土地整理、综合服务、物业管理服务、园区住宅配套、城市地产开发以及酒店、俱乐部及其他。谢谢！
答复时间 2017-10-31 17:47:05"
