标题,链接,发布时间,内容
呵呵，已亏了差不多一个板,"https://guba.eastmoney.com/news,600571,575377877.html",2016-12-02 23:32:07,呵呵，已亏了差不多一个板
大盘深回调可能性很大， 信雅达为什么今天开盘， 我们有必要去好好想想。,"https://guba.eastmoney.com/news,600571,575220998.html",2016-12-02 15:04:21,"大盘深回调可能性很大，
信雅达为什么今天开盘，
我们有必要去好好想想。"
信雅达对公司的市值不善管理，股价跌去80%也不急，看来是准备卖壳了！不过80多亿,"https://guba.eastmoney.com/news,600571,575332796.html",2016-12-02 20:41:19,信雅达对公司的市值不善管理，股价跌去80%也不急，看来是准备卖壳了！不过80多亿的壳还是太贵！估计股价会继续受到打压！
二，高潮没,"https://guba.eastmoney.com/news,600571,575360549.html",2016-12-02 22:10:51,二，高潮没
散帖的你妈还活着,"https://guba.eastmoney.com/news,600571,575358351.html",2016-12-02 22:02:30,散帖的你妈还活着
[傲][傲][傲][傲][傲][傲][傲][傲][不赞][不赞],"https://guba.eastmoney.com/news,600571,575336691.html",2016-12-02 20:52:25,[不赞][不赞]
今天买了一部分，等跌8%再买点。低价船票，干嘛不买啊。,"https://guba.eastmoney.com/news,600571,575330737.html",2016-12-02 20:34:56,今天买了一部分，等跌8%再买点。低价船票，干嘛不买啊。
停牌前一天跌了两个多点，出了5700股，留了一百股底仓，今天复牌21.74最后的,"https://guba.eastmoney.com/news,600571,575260232.html",2016-12-02 16:43:38,停牌前一天跌了两个多点，出了5700股，留了一百股底仓，今天复牌21.74最后的一百股也卖了。留下的兄弟发财！
停个锤子牌不停牌还跌不到这个位置,"https://guba.eastmoney.com/news,600571,575292732.html",2016-12-02 18:19:35,停个锤子牌不停牌还跌不到这个位置
看到下面的缺口了吗？,"https://guba.eastmoney.com/news,600571,575287377.html",2016-12-02 18:02:02,继续盘整中 如果吃掉了下方的缺口才适合轻量介入 20.8-20.5之间获得支撑
很大影响。与定增规模相比，今年仅不到123,"https://guba.eastmoney.com/news,600571,575024109.html",2016-12-02 09:29:15,很大影响。与定增规模相比，今年仅不到
私募调研露出选股蛛丝马迹?这些票有望率先反弹冲击涨停.随后发出,"https://guba.eastmoney.com/news,600571,575254782.html",2016-12-02 16:28:18,私募调研露出选股蛛丝马迹?这些票有望率先反弹冲击涨停.随后发出
600571:信雅达关于A股股票复牌的提示性公告,"https://guba.eastmoney.com/news,600571,574823989.html",2016-12-01 16:39:56,"公告日期：2016-12-02
证券代码：600571 证券简称：信雅达 公告编号：临2016-091



信雅达系统工程股份有限公司



关于A股股票复牌的提示性公告



本公司董事会及全体董事保证本公告内容不存在任何虚假记载、误导性陈述或者重大遗漏，



并对其内容的真实性、准确性和完整性承担个别及连带责任。



信雅达系统工程股份有限公司（以下简称“公司”）因拟终止重大资产重组（以下简称“本次重组”）,披露了《信雅达系统工程股份有限公司关于重大事项停牌公告》，公司股票自2016年11月28日起停牌。2016年11月29日，公司以通讯方式召开了第六届董事会第七次会议，会议审议并通过了《终止重大资产重组的议案》，决定终止本次重组。2016年11月29日，公司收到了独立财务顾问中国国际金融股份有限公司发来的《中国国际金融股份有限公司关于信雅达系统工程股份有限公司终止重大资产重组事项之独立财务顾问核查意见》，公司于2016年11月30日在上海证券交易所网站（http://www.sse.com.cn）上进行了披露。 2016年12月1日10:00—11：30，公司在上海证券交易所“上证 e互动”网络平台（http://sns.sseinfo.com)的“上证e访谈”栏目召开了投资者说明会，就终止本次重组与投资者进行了沟通和交流，详见公司同日刊载于指定媒体及上海证券交易所网站的《信雅达系统工程股份有限公司关于终止重大资产重组投资者说明会召开情况的公告》（公告编号：临2016-090）。按照相关规定，经公司向上海证券交易所申请，公司股票将于2016年12月2日开市起复牌。



公司指定的信息披露媒体为中国证券报、上海证券报和上海证券交易所网站



（www.sse.com.cn），有关信息均以上述指定媒体发布的公告为准，敬请广大投资者关注本公司相关公告，注意投资风险。



特此公告。



信雅达系统工程股份有限公司董事会



2016年12月1日




[点击查看PDF原文]
提示：本网不保证其真实性和客观性，一切有关该股的有效信息，以交易所的公告为准，敬请投资者注意风险。
展开阅读全文"
服,"https://guba.eastmoney.com/news,600571,575236779.html",2016-12-02 15:38:28,服
这股太牛叉了，股价从210到21,"https://guba.eastmoney.com/news,600571,575223563.html",2016-12-02 15:08:28,这股太牛叉了，股价从210到21
21已挂单。,"https://guba.eastmoney.com/news,600571,575182839.html",2016-12-02 14:11:29,21已挂单。
烧纸啦！祝一路好走。,"https://guba.eastmoney.com/news,600571,575216364.html",2016-12-02 14:57:18,每天一次
看好这股的散户太多了，这是前期暴涨以后跌下来的股票的通病，从股东人数就能看出来，,"https://guba.eastmoney.com/news,600571,575214996.html",2016-12-02 14:55:30,看好这股的散户太多了，这是前期暴涨以后跌下来的股票的通病，从股东人数就能看出来，散户不懂的分析，只懂得跌的多以后就会涨得多，越来越多的散户杀进来然后被套，吧里一群叫嚣着不卖和跌了就补仓的散户，试想你是主力你会拉吗，此股目前的走势只能表明是去年增发的股票在出货，信雅达要发展，必须寻求新的并购标的，但这是个长期的过程，短期内没行情，价格应该在18-23之间徘徊，个人观点，不喜勿喷！
为什么这么悲观！既然买了这个票就说明你曾看好过,"https://guba.eastmoney.com/news,600571,575204539.html",2016-12-02 14:40:57,为什么这么悲观！既然买了这个票就说明你曾看好过
坚决不卖，不要问为什么,"https://guba.eastmoney.com/news,600571,575207439.html",2016-12-02 14:45:05,坚决不卖，不要问为什么
为什么还没有跌停？,"https://guba.eastmoney.com/news,600571,575194246.html",2016-12-02 14:26:56,挂跌停价加仓，等了快一天磨叽了快一天还没有买到，钝刀子磨人啊
可以分批进货了,"https://guba.eastmoney.com/news,600571,575195090.html",2016-12-02 14:28:04,可以分批进货了
洗铸完毕，涨停时刻到了。,"https://guba.eastmoney.com/news,600571,575172500.html",2016-12-02 13:57:06,洗铸完毕，涨停时刻到了。
[图片],"https://guba.eastmoney.com/news,600571,575191441.html",2016-12-02 14:23:20,[图片]
苦海无涯,"https://guba.eastmoney.com/news,600571,575190657.html",2016-12-02 14:22:15,苦海无涯
借势打压，目的是洗出散户，持有，稳住,"https://guba.eastmoney.com/news,600571,575188111.html",2016-12-02 14:18:31,借势打压，目的是洗出散户，持有，稳住
从走势看还有新低,"https://guba.eastmoney.com/news,600571,575187770.html",2016-12-02 14:18:00,从走势看还有新低
重组失败  暴跌开始,"https://guba.eastmoney.com/news,600571,575187349.html",2016-12-02 14:17:23,跑呀
就这样继续,"https://guba.eastmoney.com/news,600571,575184027.html",2016-12-02 14:13:05,就这样继续
真是垃圾。,"https://guba.eastmoney.com/news,600571,575178770.html",2016-12-02 14:05:53,真是垃圾。
我就知道五个点左右震荡。就这尿性,"https://guba.eastmoney.com/news,600571,575176362.html",2016-12-02 14:02:40,我就知道五个点左右震荡。就这尿性
这怎么回事，别的股票复盘后都拉涨，你涨一分能死呀？,"https://guba.eastmoney.com/news,600571,575173717.html",2016-12-02 13:58:54,这怎么回事，别的股票复盘后都拉涨，你涨一分能死呀？
借势快打 一下达到20.39,"https://guba.eastmoney.com/news,600571,575172419.html",2016-12-02 13:56:58,周一继续阴跌 然后阴跌一周磨盘 我们一起来捡鱼
往下打 快点要不一会来不及；,"https://guba.eastmoney.com/news,600571,575169443.html",2016-12-02 13:52:39,
借势猛打  打到跌停吃货   周一继续阴跌,"https://guba.eastmoney.com/news,600571,575167281.html",2016-12-02 13:49:31,一直到18 我们一起来捡鱼
我的目标价是趺停,"https://guba.eastmoney.com/news,600571,575072105.html",2016-12-02 10:35:17,我的目标价是趺停
最好连破新低,"https://guba.eastmoney.com/news,600571,575151555.html",2016-12-02 13:26:43,三个跌停捡筹码呵呵
你他妈的还不如一个垃圾退市股。,"https://guba.eastmoney.com/news,600571,575158960.html",2016-12-02 13:37:43,你他妈的还不如一个垃圾退市股。
目标价位42不变！,"https://guba.eastmoney.com/news,600571,575157477.html",2016-12-02 13:35:26,
放量下挫，下午继续屠城行动，真是血流成河。那些还在接飞弹的，说你們什么好呢？,"https://guba.eastmoney.com/news,600571,575120697.html",2016-12-02 11:58:02,放量下挫，下午继续屠城行动，真是血流成河。那些还在接飞弹的，说你們什么好呢？
[大便][大便][大便][大便][大便][大便][大便][大便][大便],"https://guba.eastmoney.com/news,600571,575148655.html",2016-12-02 13:22:04,[大便][大便][大便][大便][大便][大便][大便][大便][大便]
砍刀爷爷是杭州的，信雅达去考查过的。其他话不能多说，希望大家擦亮眼，果断撤离。不,"https://guba.eastmoney.com/news,600571,575130845.html",2016-12-02 12:37:18,砍刀爷爷是杭州的，信雅达去考查过的。其他话不能多说，希望大家擦亮眼，果断撤离。不要做小太监。
走了吧！没戏！要是乡长早上就高开了,"https://guba.eastmoney.com/news,600571,575142896.html",2016-12-02 13:13:03,走了吧！没戏！要是乡长早上就高开了
卖了 ，哎我的心好累啊啊,"https://guba.eastmoney.com/news,600571,575139370.html",2016-12-02 13:06:54,真操蛋
卖了卖了，收不了了,"https://guba.eastmoney.com/news,600571,575139054.html",2016-12-02 13:06:14,啊啊啊啊啊
重组失败，不算停牌一周才跌5个点，相当于一天跌1个点，已经很不错了^_^心态放宽,"https://guba.eastmoney.com/news,600571,575090354.html",2016-12-02 11:01:19,重组失败，不算停牌一周才跌5个点，相当于一天跌1个点，已经很不错了^_^心态放宽就不难受了
"跌停我也不出,小散们顶住!","https://guba.eastmoney.com/news,600571,575042645.html",2016-12-02 09:56:34,"跌停我也不出,小散们顶住!"
每只股票不管跌还是涨，每跌十个点补一次，不赚20个点不走。咬紧牙关，坚持到底。,"https://guba.eastmoney.com/news,600571,575129655.html",2016-12-02 12:32:28,"每只股票不管跌还是涨，每跌十个点补一次，不赚20个点不走。咬紧牙关，坚持到底。
耐得住寂寞，经得起诱惑。
大不了活到老，买到老，说不定哪天就成股东了。"
停牌2周，12月12日复牌！首日低开5个点，然后急挫8个点附近向上收4个点左右形,"https://guba.eastmoney.com/news,600571,573000382.html",2016-11-26 21:42:11,停牌2周，12月12日复牌！首日低开5个点，然后急挫8个点附近向上收4个点左右形成双针，同时也是对已经消化过的利空再度确认消化。13日起股价曲折向上。暂时看这么远，当然也不能忽视大盘的情况。
现在卖出的绝对无脑,"https://guba.eastmoney.com/news,600571,575031921.html",2016-12-02 09:42:02,现在卖出的绝对无脑
为什么不跌停？，？，？，,"https://guba.eastmoney.com/news,600571,575040088.html",2016-12-02 09:53:08,为什么不跌停？，？，？，
没有幻想了，真他妈垃圾，割肉走了,"https://guba.eastmoney.com/news,600571,575059878.html",2016-12-02 10:19:43,没有幻想了，真他妈垃圾，割肉走了
太垃圾，前一次反弹就应该走！这狗庄太坏了，韭菜全套里面了，天天公告忽悠人！这家1,"https://guba.eastmoney.com/news,600571,575119041.html",2016-12-02 11:53:08,太垃圾，前一次反弹就应该走！这狗庄太坏了，韭菜全套里面了，天天公告忽悠人！这家1公司在杭州本地名声也不好，算了，走人！
趋势向下，走坏了，底不知在那。恶炒过，一两年没大行情。,"https://guba.eastmoney.com/news,600571,575101170.html",2016-12-02 11:17:53,趋势向下，走坏了，底不知在那。恶炒过，一两年没大行情。
这应该是有人直接在二级市场减持了吧。 等公告,"https://guba.eastmoney.com/news,600571,575099751.html",2016-12-02 11:15:47,"这应该是有人直接在二级市场减持了吧。
等公告"
是中邮一直在出货吗？,"https://guba.eastmoney.com/news,600571,575093554.html",2016-12-02 11:06:13,是中邮一直在出货吗？
今天反应过度了，不就是重组终止嘛，事先大家都已经知道的事情了，今天应该是利空出尽,"https://guba.eastmoney.com/news,600571,575090599.html",2016-12-02 11:01:39,今天反应过度了，不就是重组终止嘛，事先大家都已经知道的事情了，今天应该是利空出尽，理智的操作是今天应该逢低买入，之所以今天跌这么多，很有可能被狗庄利用消息疯狂打压吸货，后面几天的走势可以证明我的判断，已经被套的散户朋友们千万不要割肉，不要中了狗庄的圈套。
明年的这个时候再看了[心碎],"https://guba.eastmoney.com/news,600571,575088709.html",2016-12-02 10:58:46,明年的这个时候再看了[心碎]
狗屎,"https://guba.eastmoney.com/news,600571,575087508.html",2016-12-02 10:57:21,狗屎
重组告吹，大盘也上了几百点，不急，21以下再接,"https://guba.eastmoney.com/news,600571,575083824.html",2016-12-02 10:51:48,重组告吹，大盘也上了几百点，不急，21以下再接
分批建仓,"https://guba.eastmoney.com/news,600571,575081007.html",2016-12-02 10:47:30,分批建仓
跌停,"https://guba.eastmoney.com/news,600571,575071204.html",2016-12-02 10:34:20,跌停
这斯为什么跌，重组失败吗，重组本来就没涨呀，就是不重组也不至于这般跌呀,"https://guba.eastmoney.com/news,600571,575079252.html",2016-12-02 10:44:56,这斯为什么跌，重组失败吗，重组本来就没涨呀，就是不重组也不至于这般跌呀
这个垃圾股怎么还有人买呢？,"https://guba.eastmoney.com/news,600571,575079237.html",2016-12-02 10:44:53,赶紧散了吧
既然选择了就看好它吧，任它抗风暴雨我自持股不动！,"https://guba.eastmoney.com/news,600571,575078596.html",2016-12-02 10:44:00,既然选择了就看好它吧，任它抗风暴雨我自持股不动！
怎么多看空的  ？证明要涨起来了,"https://guba.eastmoney.com/news,600571,575077812.html",2016-12-02 10:42:57,怎么多看空的 ？证明要涨起来了
忍不住满仓了,"https://guba.eastmoney.com/news,600571,575076896.html",2016-12-02 10:41:39,忍不住满仓了
满仓了,"https://guba.eastmoney.com/news,600571,575076567.html",2016-12-02 10:41:16,满仓了
傻瓜赚钱方法就是和股吧里的气氛反着做,"https://guba.eastmoney.com/news,600571,575075452.html",2016-12-02 10:39:36,股吧现在哀鸿一片，正是买的时候，呵呵。必赚。
18见,"https://guba.eastmoney.com/news,600571,575071528.html",2016-12-02 10:34:34,18见
太尼玛会挑日子了,"https://guba.eastmoney.com/news,600571,575071035.html",2016-12-02 10:33:56,太尼玛会挑日子了
我靠，SB庄这么王八蛋！确实没想到,"https://guba.eastmoney.com/news,600571,575070198.html",2016-12-02 10:32:55,我靠，SB庄这么王八蛋！确实没想到
血淋淋的教训多忘了，中石油一拉大盘必跌，深港通开通，主力借利好出货，小散又成接盘,"https://guba.eastmoney.com/news,600571,575069194.html",2016-12-02 10:31:26,血淋淋的教训多忘了，中石油一拉大盘必跌，深港通开通，主力借利好出货，小散又成接盘侠，割完割港澳同胞
很简单，不买就完啦。,"https://guba.eastmoney.com/news,600571,575067553.html",2016-12-02 10:29:18,让他自己耍去
垃圾股,"https://guba.eastmoney.com/news,600571,575066991.html",2016-12-02 10:28:26,垃圾股
跌多一点，我就想看看！,"https://guba.eastmoney.com/news,600571,575065660.html",2016-12-02 10:26:51,跌多一点，我就想看看！
赶上行情啦……调整行情,"https://guba.eastmoney.com/news,600571,575065212.html",2016-12-02 10:26:27,赶上行情啦……调整行情
大盘面临调整，这B已错过行情。等吧,"https://guba.eastmoney.com/news,600571,575064288.html",2016-12-02 10:25:05,大盘面临调整，这B已错过行情。等吧
搬个板凳等跌停[哭],"https://guba.eastmoney.com/news,600571,575062004.html",2016-12-02 10:22:15,搬个板凳等跌停
有种跌停！狗,"https://guba.eastmoney.com/news,600571,575061724.html",2016-12-02 10:22:01,有种跌停！狗
目测破位，30分钟死叉,"https://guba.eastmoney.com/news,600571,575058701.html",2016-12-02 10:17:59,目测破位，30分钟死叉
刚发了看空的帖子就被托攻击,"https://guba.eastmoney.com/news,600571,575053996.html",2016-12-02 10:12:03,刚发了看空的帖子就被托攻击
3天吧龄的托都出来了,"https://guba.eastmoney.com/news,600571,575022952.html",2016-12-02 09:26:55,3天吧龄的托都出来了
给你们早说了，阴跌到18,"https://guba.eastmoney.com/news,600571,575042234.html",2016-12-02 09:56:07,给你们早说了，阴跌到18
再砸低点,"https://guba.eastmoney.com/news,600571,575041010.html",2016-12-02 09:54:23,再砸低点
尼玛的，刚刚跌2个多点时，正忙着转钱进来准备买，又上去了。有种再跌吗！,"https://guba.eastmoney.com/news,600571,575034358.html",2016-12-02 09:45:24,尼玛的，刚刚跌2个多点时，正忙着转钱进来准备买，又上去了。有种再跌吗！
本来想减仓，一看那么多唱空狗，果断持股不动,"https://guba.eastmoney.com/news,600571,562530238.html",2016-10-26 15:02:40,本来想减仓，一看那么多唱空狗，果断持股不动
上午稍微再洗一洗，下午拉,"https://guba.eastmoney.com/news,600571,575027137.html",2016-12-02 09:34:54,别告诉别人
爽歪歪,"https://guba.eastmoney.com/news,600571,575025140.html",2016-12-02 09:31:18,爽歪歪
22.2买入2000股,"https://guba.eastmoney.com/news,600571,575024944.html",2016-12-02 09:30:49,哦
信雅达  你妈,"https://guba.eastmoney.com/news,600571,575024305.html",2016-12-02 09:29:28,信雅达 你妈
害得我做了几天的梦，梦醒了还是要面对现实,"https://guba.eastmoney.com/news,600571,575022607.html",2016-12-02 09:26:18,害得我做了几天的梦，梦醒了还是要面对现实
补跌，看看恒生跌了几天？,"https://guba.eastmoney.com/news,600571,575022535.html",2016-12-02 09:26:00,补跌，看看恒生跌了几天？
看筹码,"https://guba.eastmoney.com/news,600571,575019109.html",2016-12-02 09:19:05,看筹码洗的不错呀
这票真有意思，没有因为重组而上涨，却因为终止而下跌,"https://guba.eastmoney.com/news,600571,575021301.html",2016-12-02 09:23:45,这票真有意思，没有因为重组而上涨，却因为终止而下跌
停盘几天，大盘上天，同概念大涨，它补跌？真是垃圾公司,"https://guba.eastmoney.com/news,600571,575021128.html",2016-12-02 09:23:26,停盘几天，大盘上天，同概念大涨，它补跌？真是垃圾公司
不重组也不至于天天跌,"https://guba.eastmoney.com/news,600571,575020095.html",2016-12-02 09:21:11,不重组也不至于天天跌
脚趾头想一想，也会是低开，把利空能当利好么？自欺欺人。,"https://guba.eastmoney.com/news,600571,575019245.html",2016-12-02 09:19:19,脚趾头想一想，也会是低开，把利空能当利好么？自欺欺人。
跌停不可怕，可以加仓；可怕的是涨停，不知怎样操作，两成仓，去留很纠结,"https://guba.eastmoney.com/news,600571,574931551.html",2016-12-01 21:50:07,跌停不可怕，可以加仓；可怕的是涨停，不知怎样操作，两成仓，去留很纠结
心情也很矛盾，既希望涨停，又希望低开，因为仓位不大，低开想补仓,"https://guba.eastmoney.com/news,600571,574997619.html",2016-12-02 07:41:07,心情也很矛盾，既希望涨停，又希望低开，因为仓位不大，低开想补仓
gg，信雅达，没有故事了,"https://guba.eastmoney.com/news,600571,574855195.html",2016-12-01 18:02:29,啊啊
连续20个涨停，哈,"https://guba.eastmoney.com/news,600571,574905122.html",2016-12-01 20:37:54,连续20个涨停，哈
信雅达明日涨还是跌，大家积极参与留言！！,"https://guba.eastmoney.com/news,600571,574903853.html",2016-12-01 20:34:23,信雅达明日涨还是跌，大家积极参与留言！！
涨停板！,"https://guba.eastmoney.com/news,600571,574955672.html",2016-12-01 23:06:56,涨停板！
关于信雅达股份有限公司的监管工作函,"https://guba.eastmoney.com/news,600571,789133608.html",2016-12-02 00:00:00,"公告日期：2016-12-02
标题：关于信雅达股份有限公司的监管工作函 
证券代码：600571 
证券简称：信雅达 
监管类型：监管工作函 
涉及对象：上市公司 
处分日期：2016-12-02 10:28:19 
处理事由：对独立董事任职资格事项明确监管要求 


[点击查看PDF原文]
提示：本网不保证其真实性和客观性，一切有关该股的有效信息，以交易所的公告为准，敬请投资者注意风险。"
明天复牌吗？,"https://guba.eastmoney.com/news,600571,574943346.html",2016-12-01 22:25:08,明天复牌吗？
信雅达股票是个妖股,"https://guba.eastmoney.com/news,600571,574635895.html",2016-12-01 10:32:03,信雅达股票是个妖股
几号复牌？,"https://guba.eastmoney.com/news,600571,574403515.html",2016-11-30 16:48:23,几号复牌？
什么叫新三板，对股价有影响吗？,"https://guba.eastmoney.com/news,600571,574429361.html",2016-11-30 17:55:26,什么叫新三板，对股价有影响吗？
看样子，这个股票要完蛋啊，幸亏走了，明天要大跌了,"https://guba.eastmoney.com/news,600571,574828697.html",2016-12-01 16:53:17,哎，命吧，认了
信雅达什么时候复牌呀?,"https://guba.eastmoney.com/news,600571,574768864.html",2016-12-01 14:39:27,
马丹的怎么有复牌了，早知道这烂货复牌我就不进002433了仓位有点重郁闷。,"https://guba.eastmoney.com/news,600571,574906368.html",2016-12-01 20:41:22,跌是跌不到哪儿去的，涨也不会离谱22到24之间晃荡呗
跌,"https://guba.eastmoney.com/news,600571,574835603.html",2016-12-01 17:12:31,"从近几个交易日看 信雅达底部筹码特别是20元及以下
.筹码明显松动，结合庄家近期对股价的打压，可以看出庄家已经提前得到信息横盘派发。明天开盘一个字 应为跌势。"
曾经的重仓股，又恨又爱！但我知道:信雅达肯定要跌破20块，准备在18接货！那些重,"https://guba.eastmoney.com/news,600571,574900177.html",2016-12-01 20:24:26,曾经的重仓股，又恨又爱！但我知道:信雅达肯定要跌破20块，准备在18接货！那些重组失败还唱多的人，不要怕，跌破18以后还会起来！
权威解读：不会跌停开盘。低开急挫，随大盘波动。,"https://guba.eastmoney.com/news,600571,574849778.html",2016-12-01 17:48:04,权威解读：不会跌停开盘。低开急挫，随大盘波动。
孙捷哥 哥帅气的照片都去我的空间里看哦,"https://guba.eastmoney.com/news,600571,574787301.html",2016-12-01 15:06:12,"孙捷哥
哥帅气的照片都去我的空间里看哦"
重大喜讯…大家可以分析下信雅达股价走势：从今年重组停牌到目前，股价一直平衡在22,"https://guba.eastmoney.com/news,600571,574867543.html",2016-12-01 18:43:28,重大喜讯…大家可以分析下信雅达股价走势：从今年重组停牌到目前，股价一直平衡在22左右，可以说今年以来，即使大盘上涨20%，但信雅达还是重组前价位，可谓是股价已经反映了重组的流产，所以明天终止重组了，可以走出自己独有的行情，等待新的标的入场！！！大家可以今晚放松享受，用美好的心情来迎接信雅达的复牌！！！！！
请大家看看重组消息公布时信雅达的股价，24.81元，也就是说即便没重组公司股价也,"https://guba.eastmoney.com/news,600571,574868350.html",2016-12-01 18:46:29,请大家看看重组消息公布时信雅达的股价，24.81元，也就是说即便没重组公司股价也值这个价！
别怕，最近重组失败复盘涨停多了去了，只要庄肯拉，明天五个点以上[微笑],"https://guba.eastmoney.com/news,600571,574851919.html",2016-12-01 17:53:43,别怕，最近重组失败复盘涨停多了去了，只要庄肯拉，明天五个点以上
明天乐观向上,"https://guba.eastmoney.com/news,600571,574841714.html",2016-12-01 17:28:02,目前就那个上海狗叫得最凶 不必过分担心
技术形态看起来要涨啊,"https://guba.eastmoney.com/news,600571,572951786.html",2016-11-26 20:22:44,停牌在这个位置 看空的都是踏空的吧
