标题,链接,发布时间,内容
说子公司挂牌新三板不是利好的，请看图！ 图上有两家公司的子公司挂牌新三板，公告日,"https://guba.eastmoney.com/news,600571,574482027.html",2016-11-30 20:46:22,"说子公司挂牌新三板不是利好的，请看图！
图上有两家公司的子公司挂牌新三板，公告日期是5月3日，公告都是提前一天发的，所以只要看他们两家公司5月3日的股票走势就知道了。"
复牌时间？,"https://guba.eastmoney.com/news,600571,574325152.html",2016-11-30 14:02:49,看公告是12月1日召开说明会，随后复牌。应该指的是后天复牌12月2日、星期五？
孙捷把吧主收买了,"https://guba.eastmoney.com/news,600571,574651962.html",2016-12-01 10:55:42,孙捷把吧主收买了
从拉升到210元，到股灾后的一年里从未离开信雅达。守住静待花开。,"https://guba.eastmoney.com/news,600571,574490665.html",2016-11-30 21:11:43,从拉升到210元，到股灾后的一年里从未离开信雅达。守住静待花开。
今天的“上证E互动”并没有太多实质上的解答，只是官方回复了公司的一些已公告基本面,"https://guba.eastmoney.com/news,600571,574656281.html",2016-12-01 11:02:00,今天的“上证E互动”并没有太多实质上的解答，只是官方回复了公司的一些已公告基本面。今天晚些应该会公告，希望能够明日复牌交易。
好坏不管也没法，还不如静下心来喝着茶慢慢等着栀栀花开[微笑][微笑],"https://guba.eastmoney.com/news,600571,574638384.html",2016-12-01 10:35:28,好坏不管也没法，还不如静下心来喝着茶慢慢等着栀栀花开
利好,"https://guba.eastmoney.com/news,600571,574571382.html",2016-12-01 08:20:17,说一个月内不再重组， 一个月后呢， 这次重组是考虑公司利益才放弃的， 对公司是利好，， 明眼人一看就明白。 坐等傻逼砸盘，重仓接盘，守他一个月！！！！！！！
恒生，金证不出问题估计开盘涨,"https://guba.eastmoney.com/news,600571,574532260.html",2016-11-30 23:21:37,恒生，金证不出问题估计开盘涨
这么多看空的，看空能赚钱吗？至少几个跌停，那大盘得回到1000点，还炒什么股票，,"https://guba.eastmoney.com/news,600571,574502275.html",2016-11-30 21:45:37,这么多看空的，看空能赚钱吗？至少几个跌停，那大盘得回到1000点，还炒什么股票，回家养猪吧
明天跌停,"https://guba.eastmoney.com/news,600571,574401838.html",2016-11-30 16:43:49,明天跌停
爽了，大盘调整，他复牌，最少一个跌停。,"https://guba.eastmoney.com/news,600571,574447066.html",2016-11-30 18:54:46,爽了，大盘调整，他复牌，最少一个跌停。
子公司新三板上市，大利好,"https://guba.eastmoney.com/news,600571,574388476.html",2016-11-30 16:04:46,子公司新三板上市，大利好
我的影响力为什么一个星星都没有了呢，我本来是有三颗星的，怎么回事？,"https://guba.eastmoney.com/news,600571,574340433.html",2016-11-30 14:25:23,我的影响力为什么一个星星都没有了呢，我本来是有三颗星的，怎么回事？
停个一年，连板二十个就好了,"https://guba.eastmoney.com/news,600571,574093739.html",2016-11-29 21:41:11,停个一年，连板二十个就好了
有更优秀的重组目标了，放弃老的目标,"https://guba.eastmoney.com/news,600571,574214395.html",2016-11-30 10:16:42,上市公司披露重大资产重组预案或草案后主动终止重大资产重组进程的，其重组冷淡期为一个月，一个月后重新开始。
别意淫了。 看看合众思壮吧！,"https://guba.eastmoney.com/news,600571,574228546.html",2016-11-30 10:37:12,"别意淫了。
看看合众思壮吧！"
600571:信雅达关于终止重大资产重组的公告,"https://guba.eastmoney.com/news,600571,574046567.html",2016-11-29 19:26:37,"公告日期：2016-11-30
证券代码：600571 证券简称：信雅达 编号：临2016-086



信雅达系统工程股份有限公司



关于终止重大资产重组的公告



本公司董事会及全体董事保证本公告内容不存在任何虚假记载、误导性陈述或者重大遗漏，并对其内容的真实性、准确性和完整性承担个别及连带责任。



信雅达系统工程股份有限公司（以下简称“信雅达”、“公司”）因筹划重大事项，于2016年2月22日发布了《关于重大事项停牌公告》，本公司股票自当日起停牌。2月27日，公司发布了《关于重大资产重组停牌公告》，进入重大资产重组程序。



一、本次筹划重大资产重组的基本情况：



（一）筹划重大资产重组的背景、原因



目前，我国软件和信息技术服务行业与传统产业的深度融合正成为时代潮流，其中随着国内金融信息化进程的深化和加速，金融IT产业作为技术含量强、产业附加值高、投资规模大的细分产业，其投入持续保持快速增长趋势。



本次重大资产重组符合金融IT行业的发展趋势和公司自身在金融IT领域的



发展布局，拟收购的标的资产与公司均属于软件和信息技术服务业，具有良好的协同效应。借助本次并购，公司将进一步完善金融IT解决方案的场景应用，有利于提高公司在金融IT行业快速发展过程中的竞争能力。



（二）重组框架



本次重大资产重组包括发行股份及支付现金购买资产和发行股份募集配套资金。前者是公司拟以发行股份及支付现金的方式购买关键、钟铃、钟钊、肖燕林、李克等五人合计持有的北京金网安泰信息技术有限公司（以下简称“金网安泰”）80%的股权，后者是公司拟向北京水杉兴和投资管理合伙企业（有限合伙）、天津鼎杰资产管理有限公司、杭州焱热实业有限公司、杭州普华济舟投资合伙企业（有限合伙）（以下简称“水杉兴和、天津鼎杰、杭州焱热、杭州普华”）等四名特定投资者发行股份募集配套资金。本次重组不会导致公司实际控制权发生变更，也不构成借壳上市。



公司于2016年5月25日召开第六届董事会第二次会议和第六届监事会第二



次会议，审议通过了《关于公司发行股份及支付现金购买资产并募集配套资金暨关联交易方案的议案》等相关议案。



二、 公司在推进重大资产重组期间所做的主要工作



（一） 推进重大资产重组所做的主要工作



1、本次重大资产重组停牌以来，公司及有关各方积极推进重组相关的各项工作，聘请了独立财务顾问中国国际金融股份有限公司、审计机构天健会计师事务所（特殊普通合伙）、资产评估机构坤元资产评估有限公司及法律顾问浙江天册律师事务所四家中介机构，对标的资产开展相应的审计、评估、法律、尽职调查等工作，对交易方案进行了审慎的协商与论证，并按照相关规定及时披露进展公告。



2、2016年5月25日，公司召开第六届董事会第二次会议和第六届监事会



第二次会议，审议通过了《关于公司发行股份及支付现金购买资产并募集配套资金暨关联交易方案的议案》等相关议案。公司与相关方签署了《发行股份及支付现金购买资产协议》、《盈利预测补偿协议》及《股票认购合同》。



3、2016年6月14日，根据上海证券交易所问询函，公司修改并披露《发



行股份及支付现金购买资产并募集配套资金暨关联交易报告书（草案）（修订稿）》及其摘要。



4、公司于2016年6月17日召开了公司2016年第一次临时股东大会，审议



通过了本次重组的相关议案。



5、2016年6月30日，公司披露了《关于调整本次发行股份及支付现金购



买资产并募集配套资金暨关联交易方案的公告》。2016年 6月 17 日，中国证



监会披露了《关于上市公司发行股份购买资产同时募集配套资金的相关问题与解答》（以下简称“《相关问题与解答》”），为符合《相关问题与解答》的规定，第六届董事会第三次会议审议决定对公司本次发行股份及支付现金购买资产并募集配套资金方案中的募集配套资金额及用途进行调整。



6、公司于2016年7月22日收到中国证监会出具的《中国证监会行政许可



项目审查一次反馈意见通知书》（161722号）。



7、公司于 2016年 9月2日向中国证监会提交了《关于延期回复中国证监



会一次反馈意见的请示》，特申请延期上报反馈意见回复及相关材料。



8、2016年10月19日，公司召开了第六届董事会第五次会议，审议并通过



了《关于向中国证监会申请中止重大资产重组审查的议案》，决定向中国证监会申请中止本次重大资产重组审查。



9……
[点击查看PDF原文]
提示：本网不保证其真实性和客观性，一切有关该股的有效信息，以交易所的公告为准，敬请投资者注意风险。
展开阅读全文"
同花顺，东方财富，恒生电子，汇金股份全部大涨，基本不用担心,"https://guba.eastmoney.com/news,600571,574229682.html",2016-11-30 10:38:54,同花顺，东方财富，恒生电子，汇金股份全部大涨，基本不用担心
从2015.6.15到现在信雅达涨跌幅度在所有股票排名,"https://guba.eastmoney.com/news,600571,574225771.html",2016-11-30 10:33:05,多的不用说 起码是个补涨反弹类型 3000多只股票排倒数第五 不必过分担心！！！ 后面走势保持乐观
9月9日，证监会正式发布新修订的上市公司重组管理办法，其中规定，上市公司披露重大,"https://guba.eastmoney.com/news,600571,574173087.html",2016-11-30 09:05:32,9月9日，证监会正式发布新修订的上市公司重组管理办法，其中规定，上市公司披露重大资产重组预案或草案后主动终止重大资产重组进程的，其重组冷淡期由原来的最短三个月改为一个月。
一个月之内不重组？什么鬼？不太符合常规哦,"https://guba.eastmoney.com/news,600571,574090642.html",2016-11-29 21:32:17,有什么蹊跷？
信雅达：终止资产重组,"https://guba.eastmoney.com/news,600571,574077576.html",2016-11-29 20:53:54,"来源：证券时报网 
　　信雅达(600571)11月29日晚公告，由于本次重大资产重组的时间进度晚于预期，公司与交易对方就相关事项协商后未形成一致意见，决定终止本次重组。公司将在12月1日召开投资者说明会，本次投资者说明会召开之后，公司将及时申请公司股票复牌，计划在披露投资者说明会召开情况公告同时股票复牌。 
（来源：证券时报网 2016-11-29 20:52） [点击查看原文]"
啥时复牌？,"https://guba.eastmoney.com/news,600571,574122127.html",2016-11-29 23:19:39,啥时复牌？
股价要大跌了,"https://guba.eastmoney.com/news,600571,574131308.html",2016-11-30 00:19:12,股价要大跌了
600571:信雅达:中国国际金融股份有限公司关于信雅达系统工程股份有限公司终止重大资产重组事项之独立财务顾问核查意见,"https://guba.eastmoney.com/news,600571,574046169.html",2016-11-29 19:25:30,"公告日期：2016-11-30
中国国际金融股份有限公司关于



信雅达系统工程股份有限公司



终止重大资产重组事项



之



独立财务顾问核查意见



独立财务顾问



二零一六年十一月



声明



中国国际金融股份有限公司（以下简称“本独立财务顾问”）接受委托，担任信雅达系统工程股份有限公司（以下简称“信雅达”、“上市公司”或“公司”）发行股份购买资产并募集配套资金暨关联交易（以下简称“本次重大资产重组”或“本次交易”）的独立财务顾问。



本独立财务顾问依照《上市公司重大资产重组管理办法》、《关于规范上市公司重大资产重组若干问题的规定》、《上海证券交易所股票上市规则》、上海证券交易所《上市公司重大资产重组信息披露及停复牌业务指引》等法律、法规的规定以及中国证监会的相关要求，按照证券行业公认的业务标准、道德规范，本着诚实信用、勤勉尽责的态度，经过审慎核查，对信雅达终止本次重大资产重组事项出具核查意见。



本独立财务顾问提请广大投资者认真阅读信雅达董事会发布的关于终止重大资产重组事项的公告。



本独立财务顾问受信雅达委托，担任本次重大资产重组的独立财务顾问，按照相关规定审慎核查了本次重大资产重组终止的原因，出具核查意见如下：



一、本次重大资产重组的基本情况



在本次重组过程中，信雅达严格按照中国证券监督管理委员会（以下简称“中国证监会”）、上海证券交易所（以下简称“上交所”）的有关规定，组织相关各方积极推进本次重组，主要历程如下：



信雅达系统工程股份有限公司因筹划重大资产收购事项，经申请，公司股票已于2016



年2月22日开市起停牌。2016年2月27日公司披露了《重大资产重组停牌公告》，确认



该事项对公司构成了重大资产重组。2016年3月29日，2016年4月29日，公司披露了《重



大资产重组继续停牌的公告》。停牌期间，公司每5个交易日发布一次重大资产重组进展情



况。



2016年5月25日公司召开了第六届第二次董事会会议，会议审议并通过了《信雅达



系统工程股份有限公司发行股份及支付现金购买资产并募集配套资金暨关联交易（草案）》及相关议案，并于2016年5月27日在上海证券交易所网站（www.sse.com.cn）及指定报刊上进行了披露。



上海证券交易所对公司本次重大资产重组相关文件进行事后审核，并于2016年6月6



日出具了《关于对信雅达系统工程股份有限公司发行股份及支付现金购买资产并募集配套资金暨关联交易报告书（草案）信息披露的问询函》（上证公函【2016】0614 号）。2016年6月13日，公司披露了《关于上海证券交易所对本公司发行股份及支付现金购买资产并募集配套资金暨关联交易报告书（草案）信息披露的问询函的回复》及草案修订稿。



经向上交所申请，公司股票于2016年6月14日复牌。



2016年6月16日，公司召开了2016年第一次临时股东大会，会议审议通过了关



于公司发行股份及支付现金购买资产并募集配套资金暨关联交易的相关议案，并在上海证券交易所网站（www.sse.com.cn）及指定报刊上进行了披露。



2016年6月29日，公司召开了第六届第三次董事会会议，审议通过了《关于修订



〈信雅达系统工程股份有限公司发行股份及支付现金购买资产并募集配套资金暨关联交易（草案修订稿）〉》及其摘要等与本次重组相关的议案，并在上海证券交易所网站（www.sse.com.cn）及指定报刊上进行了披露。



2016年6月30日，公司收到上交所《关于对信雅达系统工程股份有限公司重组标



的资产股权转让事项的问询函》（上证公函【2016】0807号）。2016年7月9日，公司



披露了《关于上海证券交易所对信雅达系统工程股份有限公司重组标的资产股权转让事项的问询函的回复》。



2016年7月8日，公司收到中国证券监督管理委员会（以下简称“中国证监会”）



出具的《中国证监会行政许可申请受理通知书》（161722 号），本次重组事项获中国证



监会受理。



2016年7月22日，公司收到中国证监会出具的《中国证监会行政许可项目审查一



次反馈意见通知书》（161722号）。中国证监会要求在收到通知之日起30个工作日内报



送有关书面反馈回复……
[点击查看PDF原文]
提示：本网不保证其真实性和客观性，一切有关该股的有效信息，以交易所的公告为准，敬请投资者注意风险。
展开阅读全文"
600571:信雅达关于终止重大资产重组的说明,"https://guba.eastmoney.com/news,600571,574046568.html",2016-11-29 19:26:37,"公告日期：2016-11-30
 信雅达系统工程股份有限公司



关于终止重大资产重组的说明



信雅达系统工程股份有限公司（以下简称“公司”）于2016年5月25日召



开第六届董事会第二次会议和第六届监事会第二次会议，审议通过了《关于公司发行股份及支付现金购买资产并募集配套资金暨关联交易方案的议案》等相关议案。现经本次交易各方友好协商，决定终止本次重大资产重组事项。具体情况说明如下：



一、 终止筹划本次重大资产重组的原因



本次重大资产重组自启动以来，公司及有关各方均积极推进本次重组的相关工作。由于本次重大资产重组的时间进度晚于预期，公司向交易对方提出：由于本次交易的相关事项核查导致重组进度晚于预期，重组相关协议中关于业绩承诺的部分条款需考虑做相应的延长及调整；交易对方认为：鉴于重组进度晚于预期不是其主观因素所导致，故不同意调整有关条款，若业绩承诺条款作调整，则对价条款也应相应调整。公司与交易对方就上述事项协商后未形成一致意见，决定终止本次重组。11月29日，公司第六届董事会第七次会议和第六届监事会第五次会议审议通过了《关于公司终止重大资产重组的议案》。



二、 终止本次重组事项的具体过程



2016年10月19日，公司发布了《关于向中国证监会申请中止重大资产重



组审查的公告》：由于本次交易涉及重大事项需进一步核查，我公司预计无法在反馈意见回复到期日前向中国证监会提交新的申请文件，经公司第六届董事会第五次会议审议通过了《关于向中国证监会申请中止重大资产重组审查的议案》，决定向中国证监会申请中止审查本次重大资产重组事项，公司独立董事对上述议案发表了同意的独立意见。



根据《中国证监会行政许可项目审查一次反馈意见通知书》的要求，公司本次重组涉及核查事项所需资料较多，各中介机构对相关资料的收集、论证和完善还需要一定的时间，导致公司本次重大资产重组的时间进度晚于原先预期。



为了最大限度维护公司权益及全体股东利益，公司向交易对方提出：由于本次交易的相关事项核查导致重组进度晚于预期，重组相关协议中关于业绩承诺的部分条款需考虑做相应的延长及调整；交易对方认为：鉴于重组进度晚于预期不是其主观因素所导致，故不同意调整有关条款，若业绩承诺条款作调整，则对价条款也应相应调整。公司与交易对方就上述事项协商后未形成一致意见。



2016年11月15日，公司与交易对方再次沟通意见，交易各方对重组方案



调整事项仍存在较大分歧。



2016年11月25日，公司与交易对方就重组方案调整事项继续协商但仍未



能达成一致意见。遂经交易各方友好协商，并经公司于2016年11月29日召开



的第六届董事会第七次临时会议和第六届监事会五次会议审议通过，交易各方决定终止本次重大资产重组。



公司独立董事对于本次终止本次重大资产重组事项发表了独立意见，认为：公司董事会就终止本次重大资产重组事项履行了相应的审批程序，同意终止本次重大资产重组事项。



本次重大资产重组的独立财务顾问中国国际金融股份有限公司经过核查，为终止本次重大资产重组事项出具了核查意见，认为终止程序符合上海证券交易所《上市公司重大资产重组信息披露及停复牌业务指引》等相关法律法规的规定。



公司将于2016年12月1日上午10:00-11:30，通过上海证券交易所“上证e



互动”网络平台的“上证e访谈”栏目召开投资者说明会，说明本次公司终止重



大资产重组的相关情况。



三、披露预案之日上市公司前十大股东、前十大流通股东、交易对方及其他内幕信息知情人在自查期间买卖上市公司股票的情况



根据上海证券交易所《上市公司重大资产重组信息披露及停复牌业务指引》的要求，公司需要对方案披露之日公司前十大股东、前十大流通股东、交易对方及其他内幕信息知情人在自查期间买卖公司股票行为进行自查，自查期间为自本次重组方案披露之日（2016年5月27日）起，至公司股票因终止本次重组事项开始停牌前一交易日（2016年11月25日）止。公司已就自查内容向中国证券登记结算有限公司上海分公司提起查询申请，目前暂未取得交易数据，待取得交易数据并完成相关自查后，公司会及时予以上报。



四、本次重大资产重组终止事项是否构成交易一方或多方违约、违约责任及已采取或拟采取的措施



公司与相关各方签署了《收购意向书》、《信雅达系统工程股份有限公司与关键、钟铃、肖燕林、钟钊、李克之发行股份及支付现金购买资产协议》、《信雅达系统工程股份有限公司与关键、钟铃、肖燕林、钟钊、李克之盈利预测补偿协议》、《……
[点击查看PDF原文]
提示：本网不保证其真实性和客观性，一切有关该股的有效信息，以交易所的公告为准，敬请投资者注意风险。
展开阅读全文"
权威解读：12月4号公告第一次次说明停牌情况，并发布12月8日召开说明会提示性公,"https://guba.eastmoney.com/news,600571,573535998.html",2016-11-28 15:13:29,权威解读：12月4号公告第一次次说明停牌情况，并发布12月8日召开说明会提示性公告，12月11日发布复牌公告。就这么简单，就一流程，什么都不会增加。如果12月8日说明会提示性公告晚一周，则所有顺延一周。停牌时间2周--4周。
今年不开盘了,"https://guba.eastmoney.com/news,600571,574088141.html",2016-11-29 21:25:06,今年不开盘了
虽然本人已经清空信雅达，但还是希望它能好起来，后悔中，感觉三联版的可能性非常高,"https://guba.eastmoney.com/news,600571,574081095.html",2016-11-29 21:03:59,虽然本人已经清空信雅达，但还是希望它能好起来，后悔中，感觉三联版的可能性非常高
