标题,链接,发布时间,内容
怎么这样？,"https://guba.eastmoney.com/news,600645,208506990.html",2015-10-26 09:53:02,600645和大盘相比，果然是大跌啊。
这是要干嘛啊,"https://guba.eastmoney.com/news,600645,208500878.html",2015-10-26 09:40:32,这是要干嘛啊
发行36亿布局生态园林+最低价药业+保健品！！！,"https://guba.eastmoney.com/news,600645,208433887.html",2015-10-25 15:46:07,"发行36亿布局生态园林+最低价药业+保健品！！！




[2015-07-31]四环生物(000518):拟募资36亿元,布局生态园林领域

中国证券报
四环生物7月30日晚间公布2015年非公开发行股票预案,计划募集资金不超过36.0
5亿元,用于投资生态园林工程项目以及收购用材林等公司股权.公司股票7月31日开市
起复牌.
布局园林业务
根据预案, 本次非公开发行股票的发行对象为陈建国,陶永生,倪利锋,强雪忠,申
万宏源领航9号, 中欧盛世景鑫4号,泰达宏利价值成长234号,齐鲁碧辰5号和昆山创投
共九名特定对象,发行价格为5.33元/股,发行股票数量预计不超过67644.38万股,募集
资金总额不超过36.05亿元,扣除发行费用后将用于投资生态园林工程项目以及收购用
材林等公司股权(湖南盛丰100%股权,广西洲际100%股权和江西高峰65%股权).
昆山创投为公司第二大股东, 发行前持有公司股权比例为3.09%,本次发行后持有
公司股权比例为3.39%, 发行前后持股比例均低于5%.其他八名发行对象与发行人不存
在关联关系.
根据预案,生态园林工程项目总投资为23.6亿元.拟以募集资金增资全资子公司江
苏晨薇,由其分别在江阴市新桥镇,徐霞客镇,江西省新余市以及九江市德安县建立248
13.08亩苗圃基地,负责实施生态园林工程项目.
双主业发展
自2001年以来, 医药行业竞争日趋激烈,原材料及人力资源成本日益上涨,行业形
势愈发严峻.针对经营形势的变化,公司一方面坚持以创新,在原有业务方面深挖潜力,
扩展客户以夯实主业根基, 加强市场销售开发,生产技术进步和内部降本增效,使公司
生产经营工作保持正常发展,但经营业绩及效益在短期内难以快速增长.为增强公司竞
争力,提升盈利能力,,公司积极寻求其他战略性产业的发展机会,以优化改善上市公司
的业务组合和盈利能力.
当前我国新型城镇化空间较大, 从城市发展轨迹来看,城市化中后期转向精细化,
园林绿化等配套投资占比逐渐提升.新型城镇化驱动,将带来生态园林行业新一轮发展
.其中市政园林政府支出逐年稳步增加, 未来几年每年市场规模在1800亿元左右.按照
发达国家发展经验, 城镇化超过70%之前,住房建设规模将保持快速增长,可以预见,地
产园林将面临长期稳定发展局面。来源000518四环生物[媒体报道]栏目。



(注:看[经营分析]栏目[保健品]已产生利润,属健康行业。增发:2015年拟非公开发行股票数量不超过67,644.38万股,发行价格:5.33元/股.(2015年9月11日股东大会通过)。拟募资36亿元,布局生态园林领域，随时都会停牌。)"
下星期一开盘5个点以上，周五60元出58元再次入2万股，加底仓8千股共28000,"https://guba.eastmoney.com/news,600645,208343917.html",2015-10-24 11:18:38,下星期一开盘5个点以上，周五60元出58元再次入2万股，加底仓8千股共28000股，成本已降为49元，十月底数钱累到手抽筋
这股还要补跌，现在价位高了。,"https://guba.eastmoney.com/news,600645,208464120.html",2015-10-25 22:14:50,这股还要补跌，现在价位高了。
21世纪人类健康时代的到来--是永恒的主题,"https://guba.eastmoney.com/news,600645,208428971.html",2015-10-25 14:27:23,健康产业已成为带动整个国民经济增长的强大动力，美国的医疗服务、医药生产、健康管理等健康行业增加值占GDP比重超过15%，加拿大、日本等国健康产业增加值占GDP比重也超过了10%。在中国，健康产业仅占中国国民生产总值的4~5%，也低于一些发展中国家，而在发达国家这一比例普遍超过15%，健康产业成为拉动国民经济发展的巨大动力。例如美国的健康产业约为1.5万亿美元，中国只有400亿美元，而中国的人口有13亿2000万，美国人口约3亿多，美国人口仅占中国人口比例的23.1%，由此可以预测中国健康产业的市场发展潜力巨大。
金卫值那么多钱，协和又该值多少钱呢？协和恐不止十个金为吧？虽然我的仓位没够但愿5,"https://guba.eastmoney.com/news,600645,208463661.html",2015-10-25 22:10:16,金卫值那么多钱，协和又该值多少钱呢？协和恐不止十个金为吧？虽然我的仓位没够但愿50再买，但看金卫值那么多钱还那么抢手我打算明天起再次加仓。
大家都看好，肯定成不了牛股！,"https://guba.eastmoney.com/news,600645,208053307.html",2015-10-23 07:58:51,大家都看好，肯定成不了牛股！
“入境宜缓，抄底不急，当心滚木礌石”,"https://guba.eastmoney.com/news,600645,205901635.html",2015-10-11 14:41:38,"协和这次大悲剧，已经上演，在周一，这出大戏就将拉开帷幕。

持有协和的朋友，痛苦是难免的，这没有办法，这是中国股市式的悲哀，最好的办法，在没有打开以前，就像忘掉自己身上的伤疤一样，忘掉你持有协和；在打开时候，如果打开股价较高，应立马卖出，今后有的是机会；如果打开时股价较低，你自己看着办。

如巴老般，无一股的朋友，坐在一旁，就权当看一出惊悚屠杀案，刺激刺激你慵懒的神经。

如果没有一股的朋友，却想买协和，巴老送你11字箴言：“入境宜缓，抄底不急，当心滚木礌石。”
特别是已经持有了冠昊的朋友，更得谨慎，基本面协和不如冠昊，你没有那么急。

炒股一定得牢牢记住：我们是小散，力量弱，不能去当解放军。"
《北都新闻》主题为健康及抗衰老的第21期FHC饭局成功举行，瑞斯坦干细胞中心的王,"https://guba.eastmoney.com/news,600645,208399315.html",2015-10-25 02:28:19,《北都新闻》主题为健康及抗衰老的第21期FHC饭局成功举行，瑞斯坦干细胞中心的王铁博士深入浅出地介绍了自体干细胞、脐带干细胞和脐带血的定义，国际国内采用细胞技术针对帕金森、脑萎缩、骨关节再生、黑色素瘤、血管壁修复等治疗技术的发展，癌症、心脑血管病症早早期（极限可提前十年）检测预防，抗衰老和人体细胞基质存贮等应用，给我们展开了一幅健康及抗衰老的美丽画卷。源优生物科技吴博士介绍了他们在张江高科技园的建设进展和针对上海地区对抗衰老需求的高端人群服务产品：自体细胞基质的提取、培养与回输；脐带细胞基质输入；自体细胞基质存储。使大家可以直观就近地体验给大家带来的福利。参加此期FHC饭局的人员来自上海经信委、中宏保险、平安保险、领慧财富、宏图高科、墨尔本大学、新华电力、闸北区社区服务公司、瑞斯坦、源优生物科技、北都资本等单位。
烈火喷油，股市的热度将会持续多久？,"https://guba.eastmoney.com/news,600645,208326269.html",2015-10-24 07:44:15,"距离发布降准降息中心数千里之外的巴老，通过距离自己眼帘数十厘米的手机，看到了这则消息。

股市，将再度成为各路形色大军的角逐场；
股市，将重新成为万众资金的亮剑地。

不要问我股市的热度会燃放多久，
你得去问股市的宽松政策会持续多久；
不要问我股市的热度会燃放多久，
你得去看看实体经济企稳、好转没有。

现在，如果你问我选择进攻还是防守，
巴老气宇轩昂、斩钉截铁告诉你，第一是进攻，然后才是防守；
现在，如果你问巴老牵手协和是否天长地久，
巴老羞涩的告诉你，从前几天开始，巴老就准备一直相拥；
现在，如果你问巴老，协和是不是巴老的唯有，
巴老惭愧的告诉你，协和只是巴老的只有，与大鳄们角逐高送转这些题材股，才是巴老的主有。

如果某一天，你在其它股吧里看到巴老亮小剑，你勿须猜测巴老的多情，
巴老的根和脉，血和水，已经交织在协和、冠昊里。

多舌的巴老，祝大家周末快乐；
伟大的协和，将铸大家的财富梦！"
好股.目前在低部.持有,"https://guba.eastmoney.com/news,600645,208414642.html",2015-10-25 10:32:37,好股.目前在低部.持有
200元再考虑是否卖掉一点,"https://guba.eastmoney.com/news,600645,208413269.html",2015-10-25 10:11:53,200元再考虑是否卖掉一点
涨,"https://guba.eastmoney.com/news,600645,208413093.html",2015-10-25 10:09:04,后期持续看好，换手就能看出来。主力已经换完
看三季报业绩如何再下手，,"https://guba.eastmoney.com/news,600645,208305072.html",2015-10-23 22:36:26,看三季报业绩如何再下手，
亏损是硬伤。兼并收购失败是结果,"https://guba.eastmoney.com/news,600645,208401321.html",2015-10-25 05:12:07,上市公司最可怕的是亏损。新规定让你随时退市。南京新百为什么能成功
中原协和今年业绩巨亏是致命伤，,"https://guba.eastmoney.com/news,600645,208360207.html",2015-10-24 15:13:11,中原协和今年业绩巨亏是致命伤，
华泰，你到底是做空还是做多,"https://guba.eastmoney.com/news,600645,208391970.html",2015-10-24 23:03:14,华泰，你到底是做空还是做多
既然股友们把协和说的这么好，你们坚守吧，我撤了！,"https://guba.eastmoney.com/news,600645,208393634.html",2015-10-24 23:30:23,"大家都看好的东西，我就不去挣抢了。
留下一句话，大家如果看好、想赚钱，就闭嘴吧！
等公布了三季报，它就是一颗地雷。不想受伤的就走吧！"
也许大家都没有想到，中源协和恐遭举牌,"https://guba.eastmoney.com/news,600645,208316925.html",2015-10-24 01:21:04,近期中源协和复牌后走势相对较强 ，跌停打开后一直横盘，且巨量换手，猫腻就出在这巨量换手上，控股股东持股不过26.1%，近期天量巨资在打开跌停后疯狂接盘，如果中源协和真的有那么好，3年千亿，10年6000亿，那我只能说，专业机构有他们的判断，等李总布局好了，这些分散持股的机构将开始举牌，而一旦举牌，一定是已经预先分散收集筹码逼近51%了，并且把股价做高，举牌之时，李总要么花巨资接盘回去，要么让出公司，主动权都在这几天接盘的资金手里，也许再想想。。。。。。。？
中长线布局600645，是二市最有潜力股票！,"https://guba.eastmoney.com/news,600645,206656890.html",2015-10-15 16:45:04,"中长线布局600645，是二市最有潜力股票！

今天流出资金排第一，是清仓了配资股民；明天或许有惯性下跌可能？

但下跌是中长线建仓的良机，600645是年底或者明年的大牛股……！拭目以待？

为什么？以后慢慢说来……"
健康中国对中源协和一点影响也没有吗？,"https://guba.eastmoney.com/news,600645,208301516.html",2015-10-23 22:07:58,为什么一点表现都没有呢？那些两天连续涨20%的股票，就大健康概念影响程度不见得就比中源协和大，甚至连中源协和的十分之一都没有。是金子总会发光的，中源协和正在忍气吞声。
今日霜降=双降，央行真会安排时间,"https://guba.eastmoney.com/news,600645,208348544.html",2015-10-24 12:26:23,一万亿的宽松
真的不动，只有控盘力超强才做得到,"https://guba.eastmoney.com/news,600645,208363134.html",2015-10-24 15:58:01,"真的不动，只有控盘力超强才做得到//@tan5 :央妈发布利好:双降!周一股市大涨，中源协和你还敢赖着不动吗?
股友1783un3735
很抱歉，您访问的帖子不存在
很抱歉，您访问的帖子不存在
2015/10/23 10:48:34中源协和吧"
短期看多的太多了，看来我还有50买入的机会，龙头达安已经疲惫，这个板块下周初应来,"https://guba.eastmoney.com/news,600645,208270286.html",2015-10-23 18:57:31,短期看多的太多了，看来我还有50买入的机会，龙头达安已经疲惫，这个板块下周初应来调整。
康盛内部明显分两派 一派是大股东金卫的人。一派是中源协和+中民投。 现在金卫 南,"https://guba.eastmoney.com/news,600645,208360553.html",2015-10-24 15:19:10,"康盛内部明显分两派 一派是大股东金卫的人。一派是中源协和+中民投。 现在金卫 南京闹得欢 康盛没有任何公告。中源协和已经明面上中止 中民投可是一刻不停 不过中民投可是不需要公告。现在大家静等康盛的公告吧
股友d03773t296
很抱歉，您访问的帖子不存在
很抱歉，您访问的帖子不存在
2015/10/24 14:24:24中源协和吧"
中国脐带血被南京新百联合金卫医疗拿下 看昨晚南京新百公告 怪不得这两天不敢拉,"https://guba.eastmoney.com/news,600645,208326136.html",2015-10-24 07:41:15,中国脐带血被南京新百联合金卫医疗拿下 看昨晚南京新百公告 怪不得这两天不敢拉
从头到位中源协和就没跟金卫谈过 根本不了持股康盛25%的第一大股东  恶意满满。,"https://guba.eastmoney.com/news,600645,208360228.html",2015-10-24 15:13:32,"从头到位中源协和就没跟金卫谈过 根本不了持股康盛25%的第一大股东 恶意满满。而且康盛应该是有内线同意的 大股东又用自己的人马翻牌而已。最终要看康盛花落谁家 中民投拿康盛可是一刻都没停止 筹码收集够了搞不好一天就通过大宗交易扭转一切。一切都还未知 南京新百合金卫先出招了 就看中民投干嘛
股友d03773t296
很抱歉，您访问的帖子不存在
很抱歉，您访问的帖子不存在
2015/10/24 14:24:24中源协和吧"
事情看起来还没完 中民投已经拿下了康盛人生6.99%的股权。25%以上即可控股。,"https://guba.eastmoney.com/news,600645,208358981.html",2015-10-24 14:56:27,"事情看起来还没完 中民投已经拿下了康盛人生6.99%的股权。25%以上即可控股。大宗交易可是快得很。现在金卫故意拿走co境内脐带血 是一种防御手段 因为它不想失去康盛第一大股东位置 从种种迹象来看 中源协和对康盛是典型的恶意收购 很强势 金卫拉南京百货出招报控股地位。退一万步讲没了国内业务 拿下一个康盛亚洲业务没什么不好。
股友d03773t296
很抱歉，您访问的帖子不存在
很抱歉，您访问的帖子不存在
2015/10/24 14:24:24中源协和吧"
李这次伤透了大量主力的心，不会帮他拉了。有机会还全砸盘的。,"https://guba.eastmoney.com/news,600645,208267975.html",2015-10-23 18:42:38,李这次伤透了大量主力的心，不会帮他拉了。有机会还全砸盘的。
大盘下星期将暴涨，快进协和，今天最少3个点以上，晚上数钱,"https://guba.eastmoney.com/news,600645,208165129.html",2015-10-23 13:33:06,大盘下星期将暴涨，快进协和，今天最少3个点以上，晚上数钱
快跑！！,"https://guba.eastmoney.com/news,600645,207882014.html",2015-10-22 11:51:20,此股。高位融资盘，配资盘太多。入境宜缓，担心高位融资配资的滚木雷石，此股30元价格介入较合理！！今天中午收盘前拉升，庄家下午出货意图明显。持股的速速抛出。大跌就在眼前！！！
调整,"https://guba.eastmoney.com/news,600645,208333042.html",2015-10-24 09:19:22,还有调整要求，换手调整之后有大幅度涨幅，立贴为证
重大利好，央行明日降准降息,"https://guba.eastmoney.com/news,600645,208276163.html",2015-10-23 19:28:27,重大利好，央行明日降准降息
600645目前根本没有自己的核心优势技术，只是一个空架子。，新买的资产是有业绩,"https://guba.eastmoney.com/news,600645,208323793.html",2015-10-24 06:54:42,"600645目前根本没有自己的核心优势技术，只是一个空架子。，新买的资产是有业绩的，不过有不务正业或主业目前无法突破的嫌疑
//@雪莲1128 :明年初赶超长春高新，后年超茅苔
中源协和资讯
借力自贸区政策深化6 1产业布局 中源协和收购鸿港投资
 　　中源协和22日晚间公告称，公司将出资1.47亿元，收购天津滨海协和投资有限公司持有的天津鸿港投资有限公司100%股权，此项收购将使上市公司获得鸿港投资位于天津空港物流加工区内工业用房的全部土地使用权，用于完善公司6 1产业布局，构建各业务板块的集约经营框架，使未来上市公司将...
2015/10/23 1:11:58中源协和吧"
借力自贸区政策深化6 1产业布局 中源协和收购鸿港投资,"https://guba.eastmoney.com/news,600645,208042454.html",2015-10-23 01:11:58,"来源：中国证券网 
　　中源协和22日晚间公告称，公司将出资1.47亿元，收购天津滨海协和投资有限公司持有的天津鸿港投资有限公司100%股权，此项收购将使上市公司获得鸿港投资位于天津空港物流加工区内工业用房的全部土地使用权，用于完善公司6 1产业布局，构建各业务板块的集约经营框架，使未来上市公司将受益于天津自贸区高端制造业的产业升级。
　　中源协和所在的天津空港经济区是天津重要的高端制造业聚集区之一，未来，这里也将承担天津自贸区机场片区的主要职能。天津市正在这一区域推动“产城融合”的全新发展路径，经济区拥有更多城市和社会功能。正是在这一背景下，中源协和抓住国家宏观政策机遇，使政策红利为上市公司所用。中源协和在进行此次收购后，将根据公司细胞及基因双核驱动和6 1的产业布局，对厂区进行整体规划，根据业务需要适时建设相应的研发、生产等基地项目，进一步提高厂区的利用率，优化资源配置，有助于公司业务整合，逐步建立全产业链的集约化经营，实现规模效益和聚集效应。
　　目前看，收购的每年摊销费用与租金数额差别不大，但长久下来能给公司留下一部分资产；有了这部分资产，公司能够更好的根据经营需要，合理规划经营场地同时，利用公司目前的区位优势，把国内、国际人才、资金通过港口和空港吸引过来。
　　公告显示，本次交易是按照评估价值交易，没有溢价，上市公司以公允价值获得土地使用权，从长远看，这部分资产也或将受益于京津冀一体化和自贸区相关政策，有望实现更高的土地使用权利用效能。同时，也将避免因土地使用权租赁交易过程中的不确定性给上市公司带来的风险。
　　完成收购后，鸿港投资将纳入上市公司合并报表。由于本次交易构成关联交易，该事项还需提交股东大会审议。
（来源：中国证券网 2015-10-23 01:11） [点击查看原文]"
天量资金接盘，高位横盘，震荡清洗浮筹，后市有望,"https://guba.eastmoney.com/news,600645,208317213.html",2015-10-24 01:29:55,"近期中源协和复牌后走势相对较强 ，跌停打开后一直横盘，且巨量换手，猫腻就出在这巨量换手上，控股股东持股不过26.1%，近期天量巨资在打开跌停后疯狂接盘，如果中源协和真的有那么好，3年千亿，10年6000亿，那我只能说，专业机构有他们的判断，等李总布局好了，这些分散持股的机构将开始举牌，而一旦举牌，一定是已经预先分散收集筹码逼近51%了，并且把股价做高，举牌之时，李总要么花巨资接盘回去，要么让出公司，主动权都在这几天接盘的资金手里，也许再想想。。。。。。。？
现在流动性太泛滥了，那些基金们都不知道该怎么花钱了，花不出去，愁啊，把中源协和这种概念的上市公司控盘，实在是保值之道，把市值做高，控盘了，想怎么保值就怎么保值，你说呢？不用担心，现在50多的价位收到，把股价拉到200，再质押或证券资产打包等等按30%（60的价位啊，天）可以套出全部资金，再来搞其他的，就是空手套白狼，那么多的公司不都这么玩的么？"
全天深v震仓，尾盘不拉反压价58.14，看来庄家手上的筹码还不够啊，星期一继续洗！,"https://guba.eastmoney.com/news,600645,208223842.html",2015-10-23 15:04:07,全天深v震仓，尾盘不拉反压价58.14，看来庄家手上的筹码还不够啊，星期一继续洗！
中源协和这么好的标的，为什么证金不增持。[牛],"https://guba.eastmoney.com/news,600645,208294740.html",2015-10-23 21:19:04,中源协和这么好的标的，为什么证金不增持。
前者不走，后者怎么拉？？,"https://guba.eastmoney.com/news,600645,208279697.html",2015-10-23 19:45:38,目前是新老庄的博弈，老庄贪，新庄肯定不高兴拉；看看那些个火箭股，都是接力的，都很有觉悟，这只股的老庄等重大利好出货，新庄等着筹码，所以大家需要耐心等
都想来投机，还不如去买彩票。都想当暴发户谁买单,"https://guba.eastmoney.com/news,600645,208263105.html",2015-10-23 18:09:28,都想来投机，还不如去买彩票。都想当暴发户谁买单
从没听说过中源协和高层公开谈及过收购北科生物剩余股权的事！！,"https://guba.eastmoney.com/news,600645,207229880.html",2015-10-19 18:49:25,从没听说过中源协和高层公开谈及过收购北科生物剩余股权的事！！
600645:中源协和:北京中源协和投资管理有限公司审计报告,"https://guba.eastmoney.com/news,600645,207997944.html",2015-10-22 19:04:33,"公告日期：2015-10-23
600645:中源协和:北京中源协和投资管理有限公司审计报告
[点击查看PDF原文]
提示：本网不保证其真实性和客观性，一切有关该股的有效信息，以交易所的公告为准，敬请投资者注意风险。"
托儿们，都别再股吧里叫唤了，唱多唱空都没用,"https://guba.eastmoney.com/news,600645,208240027.html",2015-10-23 16:05:34,今天这走势，也就中源协和能做出来
有意,"https://guba.eastmoney.com/news,600645,208237254.html",2015-10-23 15:52:43,正好昨天价？
60元已出20000股。刚才58元又进了，孙子们给我冲吗啊，晚上数钱,"https://guba.eastmoney.com/news,600645,208136234.html",2015-10-23 11:39:46,60元已出20000股。刚才58元又进了，孙子们给我冲吗啊，晚上数钱
上午出货了吧,"https://guba.eastmoney.com/news,600645,208226933.html",2015-10-23 15:12:29,上午出货了吧
中源协和是好股，但是他就是涨幅最小,"https://guba.eastmoney.com/news,600645,208086155.html",2015-10-23 10:05:43,有个性
十月下旬股友只有两个工作，买入持有，年前卖出，数钱过年,"https://guba.eastmoney.com/news,600645,208183591.html",2015-10-23 14:03:21,十月下旬股友只有两个工作，买入持有，年前卖出，数钱过年
今日基因投资策略：要抓紧健康中国风口，关注提供医疗器械的新开源与紫鑫药业,"https://guba.eastmoney.com/news,600645,208178410.html",2015-10-23 13:55:24,"今天投资策略建议，不能小视健康中国这个概念它会很热，所以必须关注基因里面的两只向医院医疗机构供应先进医疗器械的新开源与紫鑫。
这波健康中国概念最早受益的必然是医疗器械股，政策下来医院肯定利用这个机会升级早该淘汰的落后设备，其实最主要是有回扣拿，你懂的，呵呵。
那么紫鑫比较被大家知道是提供基因测序仪，大家比较不知道了是新开源，所以重点说下，新开源的全资子公司呵尔医疗有自己专利的新一代基于dna基因技术的宫颈癌早期筛查设备。目前宫颈癌设备已经跟不上时代，看好未来巨大的升级市场空间，同时新开源参股投资一家瑞典乳腺癌早期预警医疗器械公司，可以说新开源未来是a股唯一布局乳腺癌与宫颈癌早期预防检测的公司，纯正的医疗器械健康中国受益股。"
太狗篮子了,"https://guba.eastmoney.com/news,600645,208171077.html",2015-10-23 13:43:31,完犊子
新兴生物股中市盈率最低，大家看着办,"https://guba.eastmoney.com/news,600645,208161233.html",2015-10-23 13:25:55,
死逼，有本事跌停。,"https://guba.eastmoney.com/news,600645,208166473.html",2015-10-23 13:35:30,死逼，有本事跌停。
今天645走成这样都是巴山野老害了，谁叫你骂仟源新开源是垃圾基因股？,"https://guba.eastmoney.com/news,600645,208159711.html",2015-10-23 13:22:52,人家就打你脸了，记住每只股都有自己的价值，不能小看任何一只股。
怎么这么弱，跌的那么爽快。,"https://guba.eastmoney.com/news,600645,208157010.html",2015-10-23 13:17:36,怎么这么弱，跌的那么爽快。
中源协和的魅力在于干细胞概念的独特性，理应享受高溢价,"https://guba.eastmoney.com/news,600645,207999316.html",2015-10-22 19:11:58,"中源概念独特，主力被套其中，进几日融资额大增，看好。
这两天公司频传利好，多一份谨慎！"
