标题,链接,发布时间,内容
为何说新开源有可能成为健康中国概念的妖股，值得赶紧介入，分析如下：,"https://guba.eastmoney.com/news,600645,208143329.html",2015-10-23 12:14:49,"健康中国政策最早受益者就是医院及医疗机构需要升级的器械设备提供商，因为我判断政策会使国家会加大投入预算来加快淘汰医院的落后设备，也就是升级硬件。
那么我们知道现在女性的患癌第一是乳腺癌第二是宫颈癌，目前a股只有新开源有在布局乳腺癌与宫颈癌早期预防检测所需的新一代器械设备，新开源的设备都是属于新一代技术的高科技产品，是要来淘汰落后的设备，只要健康中国战略实施医院就有钱来向新开源购买，所以新开源受益很大，当然这是基本面分析。
再说技术面，今天虽然新开源涨停，但是前面k线图犹如一个圆弧抛物线，走得非常弱，严重跑输创业板指数，再者短短几天股东数量就急减20%多，可谓洗盘成果卓越，调整充分。
加之新开源只有八千多万流通盘，筹码有限。以上都是新开源能成为这一波健康中国概念妖股的理由，当然不推荐短线散户介入，因为妖股调整会很疯狂了，但是长线投资者还有机构是值得关注留意的。"
中源协和左手是倚天剑--检测，右手是屠龙刀--可以精准治疗,"https://guba.eastmoney.com/news,600645,208011770.html",2015-10-22 20:26:56,中源协和左手是倚天剑--检测，右手是屠龙刀--可以精准治疗，双剑合璧 天下无双
垃圾盘子太大，庄天天做T，小散搞不过它。我早上一换北陆药业。过几天再换回来,"https://guba.eastmoney.com/news,600645,208141758.html",2015-10-23 12:04:28,垃圾盘子太大，庄天天做T，小散搞不过它。我早上一换北陆药业。过几天再换回来
绿头中源!,"https://guba.eastmoney.com/news,600645,208139950.html",2015-10-23 11:55:08,绿头中源!
走势最差的，中源协和，千山基因，冠昊生物,"https://guba.eastmoney.com/news,600645,208092446.html",2015-10-23 10:15:59,倒数第一是中源协和
没有一点和协的样子。叫中国对抗算了！,"https://guba.eastmoney.com/news,600645,208101989.html",2015-10-23 10:32:07,垃圾烯
不知道守护基本道德的下场就象中源协和一样，还会有资金愿意抬起起吗？,"https://guba.eastmoney.com/news,600645,208101567.html",2015-10-23 10:31:34,不知道守护基本道德的下场就象中源协和一样，还会有资金愿意抬起起吗？
为什么不涨，主力吃货不够，不到拉升的条件,"https://guba.eastmoney.com/news,600645,208094956.html",2015-10-23 10:20:32,换手率那么大，庄吃的货不够，散户吃够了。
完了.60.18全仓进了一万股又被套了.,"https://guba.eastmoney.com/news,600645,208092218.html",2015-10-23 10:15:19,完了.60.18全仓进了一万股又被套了.
今天怎么操作呢,"https://guba.eastmoney.com/news,600645,208090947.html",2015-10-23 10:13:27,一直在出货，很无奈
反弹基本到位，小心主力反手下杀,"https://guba.eastmoney.com/news,600645,208085299.html",2015-10-23 10:04:06,不管长线短线，提防主力和大盘一起共振下跌，反弹也走完了abc三浪，小心
又在出货怎么办啊？谁能告诉我！,"https://guba.eastmoney.com/news,600645,208082460.html",2015-10-23 09:59:29,又在出货怎么办啊？谁能告诉我！
分享为何我又能精准预测基因测序这波行情在小市值基因股！,"https://guba.eastmoney.com/news,600645,208077434.html",2015-10-23 09:50:30,"随着仟源的大爆发，经常看完贴子的朋友肯定知道我前期一直力推仟源还有小市值基因股，仟源北陆新开源这三只小市值基因股。
理由，本人长期专研基因测序概念，知根知底必能精确分析大势，每只股都是花费巨大的精力时间去专研，真的好才拿出来推荐。本人不是托，只是喜欢卖弄才华而已。
那么我早就发现大市值基因股问题多多，一业绩普遍超过200多pe，而小市值基因股pe普遍100多而已，这是极度不正常现象，我们知道小盘股普遍应该享有更高pe，这说明小市值基因股严重低估，需要修正。
还有大市值基因股很快会碰到80%魔咒，关于什么80%魔咒下回再讲。
反正我并非看空大市值基因股，我也知道他们基本面优良，当我们认为他们短期比较没机会而已，长线我还是看好他们了，反正基因测序一定是未来a股最火爆题材这是本人一直坚定的信仰。
如果踏空了仟源没关系，我目前已经专研的新开源，并对其子公司呵尔医疗全面专研，发现新开源不得了，一旦被市场挖掘它也会成健康中国概念里的明显股。大家可以关注，我挖掘了很多呵尔医疗的资料也发出与大家共享了。"
今日健康中国基因测序看点：谈谈呵尔医疗的医疗器械市场前景,"https://guba.eastmoney.com/news,600645,208060299.html",2015-10-23 08:57:58,"最近专门研究新开源的全资子公司呵尔医疗，对它的产品非常感兴趣。因此专门打电话给医院朋友，分享下我所得到信息。
宫颈癌确实是最容易癌变的妇科病，我在想女人多少都有妇科病，因此宫颈癌检测是非常有市场前景了。
那么谈到了现在宫颈癌一些常见检测手段都不尽如人意，现在外面的一些手段最直接的是yd镜查看颈口，看是否有增生组织，以及糜烂情况，如果直接看到有肿瘤当然就是得癌症了。这种方法非常原始，无法深入细胞学。
因此现在比较常见的的就是tct检测.
后来查阅的大量有关tct检测技术优劣，与呵尔医疗的dna细胞检测技术进行对比，结论，呵尔医疗的这套系统更加先进，运用的dna技术，对人员经验技术要求较低，漏症率低，高效率，如果说tct是win xp那么呵尔医疗的dna细胞检查设备就是win10，升级是必要的。所以看好呵尔医疗的器械市场替换前景。
再加上新开源投资瑞典的那家乳腺癌早期预警器械公司，可以预见未来新开源成两市在乳腺癌与宫颈癌早期检测预防的唯一战略布局的公司。
ps 乳腺癌与宫颈癌分列女性癌症第一第二位，堪称女性第一杀手。"
同志们开始数钱了！,"https://guba.eastmoney.com/news,600645,208066860.html",2015-10-23 09:27:11,同志们开始数钱了！
呵呵，600645这次4个跌停，引来无数大神级别的老股友。难道是我在开盘前在几十,"https://guba.eastmoney.com/news,600645,208029115.html",2015-10-22 22:25:27,呵呵，600645这次4个跌停，引来无数大神级别的老股友。难道是我在开盘前在几十个热门吧和医药吧发的600645基本面的帖子的效果么？
今天涨停，53元的本已入28000股，周六开始数钱,"https://guba.eastmoney.com/news,600645,208048099.html",2015-10-23 06:34:01,今天涨停，53元的本已入28000股，周六开始数钱
发现基因测序概念股里面有一只兼具健康中国概念就是新开源呵尔医疗！,"https://guba.eastmoney.com/news,600645,208051130.html",2015-10-23 07:28:44,"一、由呵尔医疗制造并拥有发明专利的“SPICM-DNA型全自动细胞肿瘤筛查分析系统”在液基细胞学制片的基础上对细胞进行DNA染色，并对其进行定量分析和检测，以确定细胞核内DNA的含量，同时能观察到细胞核的特征;
     二、DNA含量增加和异常倍体的出现是宫颈癌及癌前病变细胞特征。因此，可通过比较细胞核内DNA含量的变化，辅助细胞形态诊断宫颈癌及癌前病变；
     三、全国部分医疗机构的临床数据显示：将全自动细胞DNA定量分析技术与常规形态细胞学检测相结合，应用于癌前病变的筛查，两种方法联合应用，可提高癌及癌前病变的检出率；
     四、该技术自动化程度较高、易于掌握，便于在基层医院推广和使用，可以在一定程度上有效缓解基层医疗机构有经验细胞学医师不足，是一种适合于大规模基层普查宫颈癌前病变的筛查方法。
------------------------------------------------------------
之前我提出仟源不仅是基因测序概念股还是二胎概念，果然没多久仟源就随二胎板块大涨了。上面的呵尔医疗就是基因测序概念股新开源的全资子公司。这次健康中国概念最受益或涨幅最大就是医疗器械，比如龙头九安医疗，新开源的呵尔医疗的器械产品明显比九安的更加高科技先进，市场前景更加广阔。预见未来全国大部分医疗机构都会淘汰现有落后的检测器械，向呵尔医疗购买这种新型高科技设备。
因为它争对的是最容易癌变的妇科病：宫颈癌。还有新开源投资一家瑞典医疗器械公司产品是争对乳腺癌早期预警检测了。新开源的健康中国概念还未被挖掘，最近走势也是打压明显，很适合机构趁打压慢慢建仓布局。值得关注！"
600645:中源协和关于收购天津鸿港投资有限公司100%股权暨关联交易的公告,"https://guba.eastmoney.com/news,600645,207997676.html",2015-10-22 19:03:10,"公告日期：2015-10-23
 中源协和细胞基因工程股份有限公司

关于收购天津鸿港投资有限公司100%股权暨关联交易的公告

本公司董事会及全体董事保证本公告内容不存在任何虚假记载、误导性陈述或者重大遗漏，并对其内容的真实性、准确性和完整性承担个别及连带责任。

重要内容提示：

●公司决定购买天津滨海协和投资有限公司持有的天津鸿港投资有限公司100%股权。

●过去12个月与同一关联人进行的交易以及与不同关联人进行的交易类别相关的交易的累计次数为1次：公司出资1440万元与嘉兴银宏晋宝投资合伙企业（有限合伙）等共同投资设立广东中源协和生物科技有限公司（暂定名）。

一、关联交易概述

（一）关联交易基本情况

经友好协商，公司决定购买天津滨海协和投资有限公司（以下简称“滨海协和”）持有的天津鸿港投资有限公司（以下简称“鸿港投资”）100%股权。

根据北京华信众合资产评估有限公司出具的华信众合评报字【2015】第T1013号资产评估报告，经资产基础法评估，鸿港投资截止2015年8月31日净资产账面价值为12,155.67万元，评估价值为14,750.35万元，增值额为2,594.68万元。根据评估结果，双方经协商确定交易价格为14,750.35万元。

公司与滨海协和于2015年10月22日签署了《股权转让协议》。

（二）关联关系

滨海协和与本公司属于同一实际控制人李德福先生控制的企业，根据《上海证券交易所股票上市规则》的规定，本次交易构成关联交易。

（三）本次关联交易需提交公司股东大会审议；本次关联交易不构成《上市

公司重大资产重组管理办法》规定的重大资产重组。

二、关联方介绍

公司名称：天津滨海协和投资有限公司

注册住所：天津空港经济区保航路1号航空产业支持中心645F27室

法定代表人：李德福

注册资本：21040万人民币

公司类型：有限责任公司

经营范围：对基础设施建设、农业、工业、贸易、制造业、证券金融业、物流业、教育、体育、环保、能源、交通、生物医药业、广告业进行投资及投资管理；国际、国内贸易；各类设备及原材料批发、零售；产业投资咨询及中介服务；房地产中介咨询；自有房屋租赁，物业管理（依法须经批准的项目，经相关部门批准后方可开展经营活动）

实际控制人：李德福

滨海协和公司自成立以来致力于投资管理服务等主营业务。截止至2014年年底，经审计的资产总额为22,851万元、资产净额为19,243万元、净利润为-472万元。

除法定代表人同为李德福外，滨海协和与上市公司不存在产权、业务、资产、债权债务、人员等方面的关系。

三、关联交易标的基本情况

（一）基本情况

本次交易标的为滨海协和持有的鸿港投资100%股权。交易标的产权清晰，不存在抵押、质押及其他任何限制转让的情况，不涉及诉讼、仲裁事项或查封、冻结等司法措施，不存在妨碍权属转移的其他情况。

公司名称：天津鸿港投资有限公司

公司住所：天津空港经济区东九道45号

法定代表人：李德福

注册资本：16000万人民币

公司类型：有限责任公司（法人独资）

成立日期：2004年9月8日

经营范围：以自有资金对基础设施建设、农业、工业、贸易、制造业、物流业、广告业进行投资管理，投资咨询，自有房屋租赁，物业管理（依法须经批准的项目，经相关部门批准后方可开展经营活动）

股东及持股比例：

序号 股东名称 持股比例（%）

1 天津滨海协和投资有限公司 100%

（二）主要财务指标

根据具有从事证券业务资格的瑞华会计师事务所出具的瑞华专审字【2015】12010048号审计报告，鸿港投资的主要财务数据如下：

单位：万元

项目 2014年12月31日 2015年8月31日

资产总额 24,615.95 19,984.86

……
[点击查看PDF原文]
提示：本网不保证其真实性和客观性，一切有关该股的有效信息，以交易所的公告为准，敬请投资者注意风险。
展开阅读全文"
中源协和转让投资管理公司股权聚焦主业发展,"https://guba.eastmoney.com/news,600645,208042552.html",2015-10-23 01:15:58,"来源：中国证券网 
　　10月22日晚，中源协和发布公告，公司决定将持有旗下子公司的北京中源协和投资管理公司90%的股权转让给北京银宏春晖投资管理公司，公司表示，投资管理公司资产后，会将精力聚焦于主业发展，未来，则会选择合适的合作伙伴参与公司并购基金。
　　公告显示，本次交易价格为1345.31万元。上市公司可以收回部分投资资金，有助于补充公司流动资金；公司退出中源投资公司的投资和运营管理，将专注于从事细胞和基因业务。
　　中源协和推动的6 1战略，是在做实产业基础上以并购重组等外延式发展做大市值规模，实现股东价值最大化。此次虽然上市公司转让了旗下投资管理公司股权，但并不意味着公司改变了既往战略。中源协和表示，将选择适合的合作伙伴参与公司并购基金，实现公司符合发展战略和产业链布局的技术、项目和企业的并购；因此本次交易符合公司的发展战略，利于公司集中精力聚焦主业发展，加速推进和实现公司在主营业务方面的产业链整合与产业扩张。
　　由于本次交易构成关联交易，还需股东大会审议通过。
（来源：中国证券网 2015-10-23 01:14） [点击查看原文]"
看好了中源协和就拿着,"https://guba.eastmoney.com/news,600645,208049238.html",2015-10-23 06:57:01,"看好了中源协和就拿着
中源协和资讯
600645:中源协和关于收购天津鸿港投资有限公司100%股权暨关联交易的公告
公告日期：2015-10-23 中源协和细胞基因工程股份有限公司 关于收购天津鸿港投资有限公司100%股权暨关联交易的公告 本公司董事会及全体董事保证本公告内容不存在任何虚假记载、误导性陈述或者重大遗漏，并对其内容的真实性、准确性和完整性承担个别及连带责任。 重要内容提示：...
2015/10/22 19:03:10中源协和吧"
600645:中源协和关于控股股东部分股权解除质押和质押的公告,"https://guba.eastmoney.com/news,600645,207997618.html",2015-10-22 19:02:53,"公告日期：2015-10-23
证券代码：600645 证券简称：中源协和 公告编号：2015-107

中源协和细胞基因工程股份有限公司

关于控股股东部分股权解除质押和质押的公告

本公司董事会及全体董事保证本公告内容不存在任何虚假记载、误导性陈述或者重大遗漏，并对其内容的真实性、准确性和完整性承担个别及连带责任。

2015年10月22日，中源协和细胞基因工程股份有限公司（以下简称“公司”“本公司”）接到控股股东天津开发区德源投资发展有限公司（以下简称“德源投资”）的通知，德源投资于2015年10月20日将原质押（质押登记日为2015年10月14日）给北方国际信托股份有限公司的本公司3,500,000股无限售流通股解除质押；于2015年10月21日将原质押（质押登记日为2015年9月14日）给天津信托有限责任公司的本公司5,000,000股无限售流通股解除质押；上述解除质押已在中国证券登记结算有限责任公司上海分公司办理了相关手续。

同时，德源投资将其持有的本公司无限售条件流通股8,500,000股股份质押给天津信托有限责任公司进行融资。质押期间为2015年10月22日至2015年11月11日。上述质押已于2015年10月21日在中国证券登记结算有限责任公司上海分公司办理了股票质押登记手续。

截至本公告日，德源投资共持有公司股份100,464,900股，占公司股份总数的26.010%，本次质押股份8,500,000股，占公司股份总数的2.201%，累计质押股份100,450,000股，占公司股份总数的26.006%。

特此公告。

中源协和细胞基因工程股份有限公司董事会

2015年10月23日


[点击查看PDF原文]
提示：本网不保证其真实性和客观性，一切有关该股的有效信息，以交易所的公告为准，敬请投资者注意风险。"
大师 请问您觉得中源协和这个股怎么样？,"https://guba.eastmoney.com/news,600645,208039923.html",2015-10-23 00:11:46,"大师 请问您觉得中源协和这个股怎么样？
岩林w
春夏秋冬，一年就买四只股票，供参考...
2015一季度300208，二季度000042，三季度002669， 
2015/7/2 16:39:46康达新材吧"
老奸巨滑，今日肯定有不少人上当卖出,"https://guba.eastmoney.com/news,600645,207965942.html",2015-10-22 15:51:48,老奸巨滑，今日肯定有不少人上当卖出
中源协和向关联方转让子公司90%股权,"https://guba.eastmoney.com/news,600645,208033436.html",2015-10-22 22:58:45,"中源协和（600645）周四晚间发布公告称，公司决定将持有的北京中源协和投资管理有限公司90%的股权以1345.31万元价格转让给北京银宏春晖投资管理有限公司，并于2015年10月22日签订了股权转让合同。

公告显示，中源投资公司注册资本为3000万元，经营范围为投资管理、股权投资、资产管理、投资咨询、企业管理咨询。经成本法评估，中源投资公司截止评估基准日2015年8月31日总资产账面价值为1499.06万元，评估价值为1499.06万元，评估无增减值变化。

中源协和表示，公司向北京银宏春晖公司出让中源投资公司的股权，可以收回部分投资资金，有助于补充公司流动资金；同时，公司退出中源投资公司的投资和运营管理，专注于从事细胞和基因业务，公司将选择适合的合作伙伴参与公司并购基金，实现公司符合发展战略和产业链布局的技术、项目和企业的并购。

因北京银宏春晖公司与中源协和属于同一实际控制人李德福控制的企业，根据相关规定，本次交易构成关联交易。（全景网）"
对于今天一系列公告的简单解读,"https://guba.eastmoney.com/news,600645,208026077.html",2015-10-22 22:03:40,"一句话：买公司就是买一宗工业用地包括厂房，属于购置固定资产一类；卖公司是为了专注搞主业，细胞基因方面的； 综合来说就是一个中性消息，不好不坏。

摘录（更详细说明，引用公告里的话，免得网友被垃圾帖误导）：
1/第一个收购的公司：通过收购鸿港投资 100%股权，公司同时获得鸿港投资位于天津空港物流加工区东九道 45 号段工业用房的全部土地使用权，公司将对厂区进行整体规划，根据业务需要适时建设相应的研发、生产等基地项目，进一步提高厂区的利用率，优化资源配置，有助于公司业务整合，逐步建立全产业链的集约化经营，实现规模效益和聚集效应；同时，通过本次关联交易可以减少公司与鸿港投资的持续性日常关联交易，减少公司每年用于支付租金的现金支出；此外，本次收购也能有效避免因土地使用权租赁交易过程中的不确定性而给公司带来的风险，取得的土地使用权也因京津冀发展、自贸区发展有望实现资产增值。因此，本次收购有利于公司推进落实公司发展战略，实现持续健康发展。
2/公司向北京银宏春晖公司出让中源投资公司的股权，可以收回部分投资资金，有助于补充公司流动资金；同时，公司退出中源投资公司的投资和运营管理，专注于从事细胞和基因业务，公司将选择适合的合作伙伴参与公司并购基金，实现公司符合发展战略和产业链布局的技术、项目和企业的并购；因此本次交易符合公司的发展战略，利于公司集中精力聚焦主业发展，加速推进和实现公司在主营业务方面的产业链整合与产业扩张，推动公司健康、快速成长，符合公司及全体股东的合法权益。本次转让股权不会对公司财务状况和经营成果产生较大影响。"
医药行业市盈率最低的股大家翻翻研究下,"https://guba.eastmoney.com/news,600645,208028384.html",2015-10-22 22:20:12,敖东
敖东的基本面研究研究吧，协和故事太多。,"https://guba.eastmoney.com/news,600645,208028202.html",2015-10-22 22:18:47,
医药股今天48只涨停，好股都在里面,"https://guba.eastmoney.com/news,600645,207987118.html",2015-10-22 17:50:04,48只涨停的里面都是有含金量的，中源协和主力太弱，但中源协和是好股。某些程度上比那48只还优秀，还有潜力。
健康中国建设规划(2016-2020年)基因测序，医疗器械。,"https://guba.eastmoney.com/news,600645,208019689.html",2015-10-22 21:20:27,国家卫生计生委已全面启动《健康中国建设规划(2016-2020年)》编制工作，“健康中国”有望写入相关文件，十八届五中全会将于下周召开，看来主题炒作开始爆发了。
