标题,链接,发布时间,内容
证监会主席助理：沪指价值投资理念确立 全力维护市场稳定运行 证券时报&#183;e公司01,"https://guba.eastmoney.com/news,600737,742287934.html",2018-01-19 12:59:11,"证监会主席助理：沪指价值投资理念确立 全力维护市场稳定运行
证券时报·e公司01-19 09:31
证监会主席助理张慎峰今日在参加第一届新时代资本论坛时表示，2018年要牢牢把握高质量发展要求，建设富有国际竞争力的资本市场，牢牢守住不发生系统性风险的底线，打好防范风险重大攻坚战，全力维护资本市场稳定运行。"
珍惜筹码啊， 这庄家没筹码了！,"https://guba.eastmoney.com/news,600737,742270992.html",2018-01-19 11:23:09,珍惜筹码啊， 这庄家没筹码了！
"大盘3100点时,糖业股价9.37元","https://guba.eastmoney.com/news,600737,742248437.html",2018-01-19 10:34:55,"业绩好,定增好,混改好,为何会颠倒股价.三百点白白浪费[不赞]"
中糖基本面:郑糖空头，业绩十亿（假如某集团说的可能），估值17倍，农业票按估值算,"https://guba.eastmoney.com/news,600737,742266670.html",2018-01-19 11:13:53,中糖基本面:郑糖空头，业绩十亿（假如某集团说的可能），估值17倍，农业票按估值算不会太高，20倍PE算就是200亿市值，总资产235亿，净资产70亿。现在167亿市值不算低估，周期股按PB估值得话达2.42。真的不便宜，这也是为什么现在无什么资金进场的原因，假如现价买入，博取的是市场情绪的钱，也就是赚傻逼的钱，你认为这个市场还有多少傻逼，至少股灾到现在还交易的人不比你笨吧。
你妈的批涨几分，跌几天，,"https://guba.eastmoney.com/news,600737,742270331.html",2018-01-19 11:21:43,你妈的批涨几分，跌几天，
8.16加仓， 下午8.5卖！,"https://guba.eastmoney.com/news,600737,742257650.html",2018-01-19 10:54:18,8.16加仓， 下午8.5卖！
把剩余的全部挂单8.1， 庄家有多少筹码敢丢！,"https://guba.eastmoney.com/news,600737,742268107.html",2018-01-19 11:16:48,把剩余的全部挂单8.1， 庄家有多少筹码敢丢！
现在要果断加仓，非常像启动信号,"https://guba.eastmoney.com/news,600737,742217533.html",2018-01-19 09:32:39,勇者胜
进入了一个新的盘整期,"https://guba.eastmoney.com/news,600737,742223102.html",2018-01-19 09:44:21,进入了一个新的盘整期，多空双方的意见快要达成一致了，如果未来有三个以上交易日能连续突破8.5，那么多方将winner-take-all，会起飞一阵子。
MSCI中国标地中粮糖业不涨反跌,"https://guba.eastmoney.com/news,600737,742245792.html",2018-01-19 10:29:26,MSCI中国标地股多数已经大幅上涨，中粮糖业不涨反跌。MSCI来中国股市肯定是赚钱的不是来送钱的，现在炒高的一部分标地股几乎不会是MSCI入市的首选，明修栈道，暗渡陈仓，在股市也运用自如，
庄家在试盘，下午正式拉升！,"https://guba.eastmoney.com/news,600737,742257299.html",2018-01-19 10:53:37,庄家在试盘，下午正式拉升！
今天中糖收阳算我输。收在8元附近。,"https://guba.eastmoney.com/news,600737,742248549.html",2018-01-19 10:35:11,今天中糖收阳算我输。收在8元附近。
下周开始补涨行情！,"https://guba.eastmoney.com/news,600737,742256717.html",2018-01-19 10:52:36,下周开始补涨行情！
向上取不到量，就会向下取量，这么简单的看盘技术都没有，一个劲无脑做多？！这跟捐钱,"https://guba.eastmoney.com/news,600737,742244844.html",2018-01-19 10:27:23,向上取不到量，就会向下取量，这么简单的看盘技术都没有，一个劲无脑做多？！这跟捐钱没区别，还有一些二货竞然买入博中地复牌投机。傻的可爱。
"白糖旺季不旺，销售不及预期,使得盘面悲观气氛加剧，t糖厂兑付甘蔗款，资金压力也偏","https://guba.eastmoney.com/news,600737,742230450.html",2018-01-19 09:58:12,"白糖旺季不旺，销售不及预期,使得盘面悲观气氛加剧，t糖厂兑付甘蔗款，资金压力也偏大。国内柳州现货报价6040-6170元/吨。除了经销商库存偏低外，短期缺乏利好，后期关注现货价格能否在6000元/吨位置企稳。操作上前期空单持有，5-9正套持有。"
今天低位股反弹的好。中糖？！,"https://guba.eastmoney.com/news,600737,742229712.html",2018-01-19 09:56:44,今天低位股反弹的好。中糖？！
地产、生化兄弟复牌渐行渐近，兄弟得道，中粮飞天!!!,"https://guba.eastmoney.com/news,600737,742213983.html",2018-01-19 09:19:14,地产、生化兄弟复牌渐行渐近，兄弟得道，中粮飞天!!!
阿斗。 高开低走。图形一好就变盘。,"https://guba.eastmoney.com/news,600737,742218061.html",2018-01-19 09:34:06,"阿斗。
高开低走。图形一好就变盘。"
今天应该能表现一番！,"https://guba.eastmoney.com/news,600737,742213869.html",2018-01-19 09:18:44,今天应该能表现一番！
不敢买大涨的股票， 守住中糖越来越觉得笨！,"https://guba.eastmoney.com/news,600737,742221523.html",2018-01-19 09:41:22,不敢买大涨的股票， 守住中糖越来越觉得笨！
大盘大涨再创新高！ 中糖烂！,"https://guba.eastmoney.com/news,600737,742220749.html",2018-01-19 09:39:50,大盘大涨再创新高！ 中糖烂！
跳空高开！今天冲击8.5！,"https://guba.eastmoney.com/news,600737,742214342.html",2018-01-19 09:21:00,跳空高开！今天冲击8.5！
不到8.30就是假的。逢高减仓。做t,"https://guba.eastmoney.com/news,600737,741809192.html",2018-01-17 10:18:43,不到8.30就是假的。逢高减仓。做t
今天四只糖业股走势一模一样，何解？,"https://guba.eastmoney.com/news,600737,741946274.html",2018-01-17 17:48:11,今天四只糖业股走势一模一样，何解？
报警吧。这打压。。。不是一般的弱势，是3400股中，中粮糖业敢叫垃圾，没人敢拿第,"https://guba.eastmoney.com/news,600737,741620019.html",2018-01-16 11:49:20,报警吧。这打压。。。不是一般的弱势，是3400股中，中粮糖业敢叫垃圾，没人敢拿第一。。。
差啊差！ 早上7.99买的居然又被套了！,"https://guba.eastmoney.com/news,600737,741474437.html",2018-01-15 15:16:47,差啊差！ 早上7.99买的居然又被套了！
差不多了，可以拉了。你妹的。,"https://guba.eastmoney.com/news,600737,741894888.html",2018-01-17 14:23:47,差不多了，可以拉了。你妹的。
操盘手操到家了，把融资散户都震出来了，哪来的成交量，你们就对倒吧！对得起散户？,"https://guba.eastmoney.com/news,600737,741659051.html",2018-01-16 14:11:56,操盘手操到家了，把融资散户都震出来了，哪来的成交量，你们就对倒吧！对得起散户？
老伙计下午加油啊！,"https://guba.eastmoney.com/news,600737,741855248.html",2018-01-17 12:09:45,老伙计下午加油啊！
大家知道为什么只涨大盘股,"https://guba.eastmoney.com/news,600737,742201162.html",2018-01-19 03:34:16,因为小散都是深套在中小创，老子就是天天涨大盘，因为套着的小散又没有资金追，股逼你割肉才有钱买，等你一旦割肉追大盘股，机构会让你轻松赚钱吗？到时候一切换，左右挨耳光
今天涨到8.5,"https://guba.eastmoney.com/news,600737,742203895.html",2018-01-19 06:53:07,今天涨到8.5
此股为啥天天跌？？？？,"https://guba.eastmoney.com/news,600737,742151572.html",2018-01-18 17:09:34,此股为啥天天跌？？？？
你有这个能力控盘打压，还不如停止打压，让小散慢慢抄上去，也不会高到哪里去，打压了,"https://guba.eastmoney.com/news,600737,742120211.html",2018-01-18 14:53:27,你有这个能力控盘打压，还不如停止打压，让小散慢慢抄上去，也不会高到哪里去，打压了二年多化了多少银子这笔帐你们算过吗？还有股权激励，大股东都忘了吗？6月将到，定增也快了，这种打压其实得不偿失，费时费化，弄不好被其他新庄看中拿个现成的。
尾盘拉升下,"https://guba.eastmoney.com/news,600737,742108971.html",2018-01-18 14:29:01,尾盘拉升下
这么好的机会不涨，浪费一天时间！,"https://guba.eastmoney.com/news,600737,742123883.html",2018-01-18 15:01:36,这么好的机会不涨，浪费一天时间！
弱庄拉尾盘，狗庄等散户拉盘，拉起来就跑吧！不拉的话更加要跑……,"https://guba.eastmoney.com/news,600737,742109436.html",2018-01-18 14:29:58,弱庄拉尾盘，狗庄等散户拉盘，拉起来就跑吧！不拉的话更加要跑……
不死不活啊！ 垃圾！,"https://guba.eastmoney.com/news,600737,742114385.html",2018-01-18 14:41:03,不死不活啊！ 垃圾！
就剩几分钟， 赶快拉！,"https://guba.eastmoney.com/news,600737,742114193.html",2018-01-18 14:40:37,就剩几分钟， 赶快拉！
大盘3465.中粮2638的价格，800点白涨，不是恶意压制股价难道还是善意的，,"https://guba.eastmoney.com/news,600737,742109941.html",2018-01-18 14:31:08,大盘3465.中粮2638的价格，800点白涨，不是恶意压制股价难道还是善意的，好个不要脸的公司
一直感觉要大涨的前奏！,"https://guba.eastmoney.com/news,600737,742111169.html",2018-01-18 14:33:50,一直感觉要大涨的前奏！
烂庄， 这样砸盘啊！ 为什么不拉升！,"https://guba.eastmoney.com/news,600737,742109347.html",2018-01-18 14:29:48,烂庄， 这样砸盘啊！ 为什么不拉升！
那么多狗托 唱多，不跌才怪,"https://guba.eastmoney.com/news,600737,742093509.html",2018-01-18 13:52:36,那么多狗托 唱多，不跌才怪
再来个7600手！,"https://guba.eastmoney.com/news,600737,742079889.html",2018-01-18 13:19:48,再来个7600手！
这垃圾清仓走路，,"https://guba.eastmoney.com/news,600737,742073571.html",2018-01-18 12:52:15,这垃圾清仓走路，
下午冲击8.5， 收盘8.35左右！,"https://guba.eastmoney.com/news,600737,742040975.html",2018-01-18 10:41:58,下午冲击8.5， 收盘8.35左右！
中粮集团2017年利润总额创历史新高，4板块年内完成混改 2018-01-17,"https://guba.eastmoney.com/news,600737,742067333.html",2018-01-18 12:00:52,"中粮集团2017年利润总额创历史新高，4板块年内完成混改
2018-01-17 10:08 Wind
证券时报报道，中粮集团消息，中粮集团2017年利润总额创历史新高，年营业收入4825亿元，利润总额118亿元，资产总额达到5388亿元。两年来共有6家专业化公司通过混改、员工持股、上市和设立基金等股权运作方式引资270亿元。截至目前，已有十四家专业化公司完成混改或实现股权多元化。饲料、酒业、粮谷和纺织将在2018年底完成混改，十八家专业化公司全部实现股权多元化。"
昨天融资买了1900多万， 今天下午涨！,"https://guba.eastmoney.com/news,600737,742048079.html",2018-01-18 10:58:40,昨天融资买了1900多万， 今天下午涨！
不搞几个大单！没什么量， 看来庄家很折磨！,"https://guba.eastmoney.com/news,600737,742047785.html",2018-01-18 10:57:58,不搞几个大单！没什么量， 看来庄家很折磨！
今天能到8.5， 明天就能涨停！,"https://guba.eastmoney.com/news,600737,742037318.html",2018-01-18 10:33:17,今天能到8.5， 明天就能涨停！
无量无行情，洗洗睡吧。,"https://guba.eastmoney.com/news,600737,742042157.html",2018-01-18 10:44:49,无量无行情，洗洗睡吧。
回来吧，回来了,"https://guba.eastmoney.com/news,600737,655222924.html",2017-06-14 16:18:32,"明天股灾就整整两周年了，两年来股市血雨腥风让人唏嘘不已，而期间个人的经历也不承让股市多少，终于在离开过、彷徨过、犹豫过之后，该回来了，也是时候回来了！未来的12-18个月，期待更加精彩的剧情上演！这一次我们是要开飞机呢，还是拉火车呢，还是AI/VR/YY呢
离开了18个月，差点都不会发帖了
回来是回来了，只是不知何处可以栖身。姑且将帖子发在屯河之中，希望新老好友能为我指一处安身之地，谢谢各位！
长风破浪会有时，直挂云帆济沧海。与各位共勉同进！"
