标题,链接,发布时间,内容
广告多，看多的多，此股无戏 1今天盘面成交压力不大，但是没有任何举动，慢步拉高，,"https://guba.eastmoney.com/news,601933,540274408.html",2016-08-24 20:37:45,"广告多，看多的多，此股无戏
1今天盘面成交压力不大，但是没有任何举动，慢步拉高，迅速下跌，出货特征，做差价。
2股价支撑4.57
3 8.25上涨红盘收。"
涨是一两天的事情，跌起来是一两周的事情！,"https://guba.eastmoney.com/news,601933,541830245.html",2016-08-25 11:54:00,暴风雨还在后头，先买进银行股做安全护航！
这种走势，不知道的还以为涨停了,"https://guba.eastmoney.com/news,601933,548507770.html",2016-09-05 14:05:39,实际上是天天如此，清仓走人，换股
别骂了，这股就这尿性,"https://guba.eastmoney.com/news,601933,549220675.html",2016-09-07 13:58:04,相信骂的人也没亏多少吧，不就是不涨么
号称450赶紧买入的家伙跑哪里去了？这只是开始，两元见，不见不散,"https://guba.eastmoney.com/news,601933,550086935.html",2016-09-09 14:32:44,号称450赶紧买入的家伙跑哪里去了？这只是开始，两元见，不见不散
一分钱玩几天，好醉人哟！,"https://guba.eastmoney.com/news,601933,550034783.html",2016-09-09 13:04:27,一分钱玩几天，好醉人哟！
今天是島形反转回踩确认完毕。是中期反转最凶猛的一种走势。,"https://guba.eastmoney.com/news,601933,432900794.html",2016-07-01 17:06:35,今天是島形反转回踩确认完毕。是中期反转最凶猛的一种走势。
我又不想说话了，自己把握吧。,"https://guba.eastmoney.com/news,601933,550245544.html",2016-09-09 23:25:52,我又不想说话了，自己把握吧。
都说了要中长线持有。过4.98小高点就在眼前。,"https://guba.eastmoney.com/news,601933,550129286.html",2016-09-09 15:54:51,都说了要中长线持有。过4.98小高点就在眼前。
看看600415的表现,"https://guba.eastmoney.com/news,601933,555221664.html",2016-09-28 10:40:34,
每天都是上压下托，弄死股民为止,"https://guba.eastmoney.com/news,601933,547822005.html",2016-09-02 10:27:56,每天都是上压下托，弄死股民为止
又横上了[想一下][想一下][想一下][想一下][想一下][想一下][想一下][,"https://guba.eastmoney.com/news,601933,553446518.html",2016-09-23 10:13:08,又横上了
收盘价4.42,"https://guba.eastmoney.com/news,601933,554802317.html",2016-09-27 10:36:44,收盘价4.42
受不了了啊一天亏了一万啊哭晕了,"https://guba.eastmoney.com/news,601933,554338236.html",2016-09-26 14:53:04,受不了了啊一天亏了一万啊哭晕了
搶在養老金前提前佈局[大笑][大笑][大笑],"https://guba.eastmoney.com/news,601933,562852591.html",2016-10-27 13:12:26,搶在養老金前提前佈局
每天早上涨一点点，下午又开始跌了。每天几分钱，已经玩了一个月了。福建人的股不能玩,"https://guba.eastmoney.com/news,601933,552124544.html",2016-09-19 10:41:47,每天早上涨一点点，下午又开始跌了。每天几分钱，已经玩了一个月了。福建人的股不能玩
