标题,链接,发布时间,内容
谁看不懂啊，压盘无尽版！,"https://guba.eastmoney.com/news,601933,567343769.html",2016-11-10 10:31:37,好股能压得住吗？还不是散们没有力量，没有进来当轿夫的散吗？这股压过了春夏秋冬，要压到白发苍苍的时候。
大家感谢我吧，每次我一卖就涨，不跟张屎弟兄玩了，拜拜。,"https://guba.eastmoney.com/news,601933,567366966.html",2016-11-10 11:06:19,大家感谢我吧，每次我一卖就涨，不跟张屎弟兄玩了，拜拜。
僵尸股。,"https://guba.eastmoney.com/news,601933,567360103.html",2016-11-10 10:55:51,只会吸血。
刚才又是一笔大单砸盘！,"https://guba.eastmoney.com/news,601933,567347659.html",2016-11-10 10:37:05,砸砸砸！使劲地砸！砸成稀巴烂！
不要说五元，连五毛都站不稳！,"https://guba.eastmoney.com/news,601933,567344447.html",2016-11-10 10:32:36,傻逼
又涨了三分，有人就又兴奋起来了。,"https://guba.eastmoney.com/news,601933,567338035.html",2016-11-10 10:23:11,看看万科，买万科的人才有理由兴奋。拿着永辉就会傻笑。
今天普涨行情，永辉还是垃圾一枚。,"https://guba.eastmoney.com/news,601933,567335428.html",2016-11-10 10:19:19,垃圾永远是垃圾。
感觉源源不断的出货，何时是尽头啊,"https://guba.eastmoney.com/news,601933,567333475.html",2016-11-10 10:16:30,"每天都在源源不断的出货，到底什么时候能出完啊
期盼恒大来收拾他们"
卧槽 我的600908呀 日 换亏大了 两成了 唉,"https://guba.eastmoney.com/news,601933,567332833.html",2016-11-10 10:15:26,卧槽 我的600908呀 日 换亏大了 两成了 唉
目测永辉即将大涨！,"https://guba.eastmoney.com/news,601933,567276938.html",2016-11-10 07:26:44,麻袋准备好了吗？
我最近看到的一只股！,"https://guba.eastmoney.com/news,601933,567327107.html",2016-11-10 10:07:27,这几天涨了有20%左右了，就是一个星期之内的事。这狗屎超市一年了，我见过垃圾股没见过这么垃圾的。
永辉超市蒸蒸日上,"https://guba.eastmoney.com/news,601933,567314827.html",2016-11-10 09:49:15,永辉超市蒸蒸日上
敢不敢雄一把！看着揪心，食之无味，丢之亏本……,"https://guba.eastmoney.com/news,601933,567313839.html",2016-11-10 09:47:51,敢不敢雄一把！看着揪心，食之无味，丢之亏本……
即使今年过年涨到5元，也不稀罕！,"https://guba.eastmoney.com/news,601933,567201545.html",2016-11-09 22:44:09,今年的持股结局是去年的错误选择，去年种的的恶因今年承受，前世种的恶因今世承受。今年赚不了钱，也好久不赚钱了，去年之前赚的钱是糊涂账，一波大跌彻底抹消，时至今日我对赚钱的体验愈久愈淡，现在感觉股市赚钱如同天荒夜谭了。成本就在5元上方，每当感觉快要解套的时候，就再次开启噩梦之旅。仿佛五元以上的价位高贵奢侈得可望而不可及。去年买入此股之前，我虽然有些收获，但只是表面的，水平绝对不如绒花，现在就是实事求是地说话，那个时候真不如，如就不会坐上一波滑梯了。持有了永辉超市，使我到现在都失去了回本的机会，但是有得必有失，失去得到了的比失去了的从长远看，更宝贵一些。永辉超市可以做我的老师了，是永辉给了我当头一棒让我尽早的脱离了错误之路。我还有个发现，就是绒花们也不过如此了。因为绒花们、兜兜木有嘎们进入股市后，已经忘记了初衷，说这句话就当我提个醒，乐不乐意听是他们的事情了。或者他们的水平、境界等等因素使然，毕竟活着不易。今年初4元买入，今年底涨到5元就赚1元了，绒花们几十万元的持股量足以使（他）她们过上小康生活，不仅两个月以后大放烟花欢度春节元宵，还可以绰绰有余地买到明年的iphone8。 但对于我而言，这垃圾股两个月以后涨到5元又有什么值得高兴的呢？这一年的持有永辉超市，等于使我虚度了一年。今年好股不少，失去了买入的机会，实在毫无办法。这个永辉出来，以后我不会再选择第二个永辉股。为什么我要说勿忘初衷？因为不少人进入这个地方逐渐迷失了初衷，沉迷在了价值投资的陷阱里了。要论价值投资，首当买入工商银行。但是，工商银行的股价给予了股民什么，其实没有给予最初的预期，只能说是资金比放在银行当存款强一点而已。也许，不少人抱有的想法就是这么知足，那也不可厚非。但是对于自认为是高手的人而言，选择永辉超市股票无异于选择了一记属于他们自己的耳光而已。结合我的自身经历，结合我当前所处的种种困境，这个股票就是个陷阱，人生的动力就是靠股票上涨完成的，而该股没有发挥了我希望发挥的作用。本不想在股吧发帖了，感觉没必要。但时不时地进股吧看看，隔三差五总有人发一些其它的帖子，太弱了包括弱到爆的这些蠢猪。我只是做中性的客观评价或者只是自己的一点观点而已。乐不乐意是别人的事与我无关，只是不想再看到股吧还有如此的人发表些酸葡萄的话或者只有自己的葡萄甜的话，感觉想呕吐。什么都是无止尽的，也许他们已经达到了上限。现在唯一感到可悲的不是别人，而是自己，知道这股是滞胀的垃圾，但偏偏就是脱不开身子，与这些弱智共守这垃圾股，时不时地会使我灰心丧气。我难以接受们的帖子，真受不了。到现在很难以置信，却又不得不信。现在不卖不能割肉是一个原因，还有个原因就是不服气不甘心被套这么久而中途放弃。否则，重要的事情说一遍：调仓换股！
稳如泰山,"https://guba.eastmoney.com/news,601933,567310806.html",2016-11-10 09:43:16,稳如泰山
压你妹夫。滚开。不识时务的东西,"https://guba.eastmoney.com/news,601933,567306633.html",2016-11-10 09:35:57,压你妹夫。滚开。不识时务的东西
苏宁的坑挖的好呀 不摸年线都不好意思,"https://guba.eastmoney.com/news,601933,567301607.html",2016-11-10 09:23:46,苏宁的坑挖的好呀 不摸年线都不好意思
股民讨论会：永辉超市股价好不好！,"https://guba.eastmoney.com/news,601933,566959577.html",2016-11-09 12:02:11,大家都可以发表意见看法（兜兜、绒花除外），针对今年的走势，还可以针对今天的走势，特别是参考一下今天商业百货板块的排行榜。
特朗普来了[大笑],"https://guba.eastmoney.com/news,601933,566973415.html",2016-11-09 12:57:07,特朗普来了
永辉超市,"https://guba.eastmoney.com/news,601933,567025879.html",2016-11-09 14:37:14,永辉超市
滞涨股，垃圾股。,"https://guba.eastmoney.com/news,601933,566875933.html",2016-11-09 09:36:45,买入该股真尼玛有眼光，真尼玛高手，真尼玛是磨洋工！买入这么垃圾的股真是三生不幸。
小王八不行么 哈哈 不看你了。大家跟着苏宁做吧 这货没独立行情,"https://guba.eastmoney.com/news,601933,566899128.html",2016-11-09 10:13:45,小王八不行么 哈哈 不看你了。大家跟着苏宁做吧 这货没独立行情
双十一概念股忽然抗跌,"https://guba.eastmoney.com/news,601933,566910624.html",2016-11-09 10:31:27,双十一概念股忽然抗跌
看看宁波中百是怎样的涨法？,"https://guba.eastmoney.com/news,601933,566887606.html",2016-11-09 09:56:12,问答题：持有永辉超市赚钱，还是持有宁波中百赚钱？买入中百的牛逼还是买入永辉的牛逼？这就区分出来水平了。而不是在永辉里持有不动，脑子里幻想个下跌就有散户割肉跑的场景或者拿上涨的股票说事又有人去追高被套了，然后就暗自高兴，自认为与众不同了，比一般散户聪明了。实际不是这样的啊，假如永辉超市涨到4.9元的时候，买入的人多还是卖出的人多？不也就是赚着走的人多吗？因此，上涨后赚了卖的散户很多，而不是自认为的追高被套的人很多。兜兜就是这样暗自高兴的人，这样的人最好不要再抛头露面了，免得说些脑中风的话。这样，我也可以潜水继续忍一段时间了。
阳痿时间太久了，恐怕难以治好,"https://guba.eastmoney.com/news,601933,566882472.html",2016-11-09 09:48:00,阳痿时间太久了，恐怕难以治好
你要能收到4.51 我明天看高你一线 那就真超我预期了,"https://guba.eastmoney.com/news,601933,566628493.html",2016-11-08 14:53:15,你要能收到4.51 我明天看高你一线 那就真超我预期了
换手率排名前20的个股中，,"https://guba.eastmoney.com/news,601933,453103008.html",2016-07-18 13:38:01,换手率排名前20的个股中，
把狼引来了,"https://guba.eastmoney.com/news,601933,566619787.html",2016-11-08 14:38:55,把狼引来了
嚓 比我预期要强点呀 今天走的,"https://guba.eastmoney.com/news,601933,566621979.html",2016-11-08 14:42:24,嚓 比我预期要强点呀 今天走的
明天看你量咋走吧 要是放到2.0以上 那看来是双11资金开始进场了 这周有的玩喽,"https://guba.eastmoney.com/news,601933,566640142.html",2016-11-08 15:16:45,明天看你量咋走吧 要是放到2.0以上 那看来是双11资金开始进场了 这周有的玩喽 散户拿好了 哎 大家赚点钱也好弥补下双11的消费么
你要把拖单全部多加一位数 我估计你可以直接不战而胜了 哈哈哈哈 小散直接就帮你把,"https://guba.eastmoney.com/news,601933,566598174.html",2016-11-08 14:02:59,你要把拖单全部多加一位数 我估计你可以直接不战而胜了 哈哈哈哈 小散直接就帮你把山头攻陷了 哈哈哈哈
哈哈哈 下午不拉起来没有覆盖行轰炸 你就是只咬了钩的小王八 我看中子头表演去了。,"https://guba.eastmoney.com/news,601933,566589814.html",2016-11-08 13:48:44,哈哈哈 下午不拉起来没有覆盖行轰炸 你就是只咬了钩的小王八 我看中子头表演去了。大盘一转好 还是次新股好拉升呀
唉。失败呀 哥可是卖了无锡银行买的你呀 人家都涨了五个点了快 你还套我一个点[哭,"https://guba.eastmoney.com/news,601933,566530504.html",2016-11-08 11:18:44,唉。失败呀 哥可是卖了无锡银行买的你呀 人家都涨了五个点了快 你还套我一个点 你说我虚拟盘咋玩？？？
唉 这多头是个猪 把资金分开买 不如集中买 做个小拉升 阵地都能防守得住 这货这,"https://guba.eastmoney.com/news,601933,566580587.html",2016-11-08 13:32:30,唉 这多头是个猪 把资金分开买 不如集中买 做个小拉升 阵地都能防守得住 这货这么买票 不会是个暴发户吧？哪儿有这么打仗的 你这山头能攻下来见鬼了 打一打还歇会 你找等他调援兵回头你来个地毯式轰炸叫他全军覆没？那也太黑了
量还差点 空头撤的有点快 要来一波密集点的交易才好吸引市场注意力 记住有双11在,"https://guba.eastmoney.com/news,601933,566577152.html",2016-11-08 13:26:40,量还差点 空头撤的有点快 要来一波密集点的交易才好吸引市场注意力 记住有双11在 多高都不算高 哈哈哈哈
下午要普涨了[微笑] 大家抓紧钱袋子哦 看灰灰下午咋给量了 紧接着就是双11 主,"https://guba.eastmoney.com/news,601933,566552379.html",2016-11-08 12:17:27,下午要普涨了 大家抓紧钱袋子哦 看灰灰下午咋给量了 紧接着就是双11 主力再不拉一下 那确实脑子坏掉了 不知道是川普胜还是希拉里
我去 坑不够深呀 4.40都没到 哎 下午还是没戏,"https://guba.eastmoney.com/news,601933,566546552.html",2016-11-08 11:55:41,我去 坑不够深呀 4.40都没到 哎 下午还是没戏
唉 双11来了 你说这是砸还是不砸？砸吧出力不讨好 不砸吧 窝子和诱饵打了一个多,"https://guba.eastmoney.com/news,601933,566476601.html",2016-11-08 09:52:09,唉 双11来了 你说这是砸还是不砸？砸吧出力不讨好 不砸吧 窝子和诱饵打了一个多月了。大鱼一条没上 郁闷呀
绿了，绿了，永辉又绿了！,"https://guba.eastmoney.com/news,601933,566527016.html",2016-11-08 11:13:08,饭桶们，快看！
两分就涨不了吗？算了，撤了,"https://guba.eastmoney.com/news,601933,566511974.html",2016-11-08 10:48:30,两分就涨不了吗？算了，撤了
永远是恢心,"https://guba.eastmoney.com/news,601933,566506432.html",2016-11-08 10:39:17,永远是恢心
还在吸啊。。。,"https://guba.eastmoney.com/news,601933,566485817.html",2016-11-08 10:06:35,还在吸啊。。。
大家都以为4.43不破，一根长阴就好看啦。 从历史走势看，烂泥扶不上墙，这票就是,"https://guba.eastmoney.com/news,601933,566363246.html",2016-11-08 00:10:34,"大家都以为4.43不破，一根长阴就好看啦。
从历史走势看，烂泥扶不上墙，这票就是这样，能换的还是换了吧。"
今儿又让看空的人吃了个小糖块！可是跌停呢？看空的人你们居心叵测啊！哪有那么多跌停,"https://guba.eastmoney.com/news,601933,566362473.html",2016-11-08 00:04:54,今儿又让看空的人吃了个小糖块！可是跌停呢？看空的人你们居心叵测啊！哪有那么多跌停，给你机会让你去拿便宜筹码？做梦
一个字[买入]二个字[买入][买入]三个字[买入][买入][买入]……,"https://guba.eastmoney.com/news,601933,566340242.html",2016-11-07 22:23:41,一个字二个字三个字……
静静等待明天的挖坑活动 哈哈哈 先破4.40 哥们我挂4.21 我等你哦,"https://guba.eastmoney.com/news,601933,566340025.html",2016-11-07 22:22:51,嘿嘿 坑是必须要挖地 人是一定要埋滴 没有压缩哪儿来蹦高
瞎买一只，都比永辉走的强！,"https://guba.eastmoney.com/news,601933,566193342.html",2016-11-07 14:51:11,垃圾股！
没本事赚，美其名曰“输的起的人”,"https://guba.eastmoney.com/news,601933,566192581.html",2016-11-07 14:49:52,
从近来走势看，永辉应该出问题了，推测如下，不喜勿喷。 一、大股东做专机遇难，概率,"https://guba.eastmoney.com/news,601933,566150485.html",2016-11-07 13:38:40,"从近来走势看，永辉应该出问题了，推测如下，不喜勿喷。
一、大股东做专机遇难，概率57%
二、大股东不鸟机构投资者，众基金扎堆，群龙无首，概率57%
三、某东及牛奶与大股东经营理念分歧，概率57%
四、大股东增持近6个亿肯定不会亏钱出，但有减持期限要求，短期无做盘计划，概率57%
五、不尽之处大家补，但不管哪种情况，大股东都过五七，他们家族的习惯。"
只能这样说了，好自为之吧。,"https://guba.eastmoney.com/news,601933,566224819.html",2016-11-07 16:07:42,若不是今年之前抢反弹买进这垃圾股，我今年是不会持有这股的，我也没必要再说为什么了。一则没有这样义务，二来股价波动剧烈，我不可能时时刻刻去说涨跌的，没精力。实际上，去年买进来的人到现在都还亏着。即使说是赚钱的，也只不过是今年底部买进来的人，不管是一直持有不动，还是不断任性摊低成本，最终到现在赚了多少各自也心里清楚。当然买进该股的人长远的话，应该不会亏的。若与存银行相比的话，是这么的心态也好，这样的目标为止也罢，绝对可以跑赢银行利息。但是，就这三脚猫的水平，绝对会跑输大盘。举个栗子：龙元建设，这股的底部与永辉相比如何，近期高点与永辉相比又如何？其它栗子我也不一一地合盘拖出了。因为，我还在受去年之害的负面影响。现在即使还处于亏损，但只能默默承受了。我认为的股市高手不是这样的，首先是不会选择参与永辉超市。在这里自称高手的或许只是比拿着盲目买卖股票的人强一步而已，五十步笑百步。按今年的两市股票而定，姑且是两平里的数。平与赚的水平就差很多了，毕竟股市高手是一赚的，而永辉高手是两平的。平就证明不是赚的料，弄不好迷迷糊糊就会进去七亏的行列。好股用得着这么长时间墨迹吗？高手有这么长时间不赚或赚五毛的吗？脸皮厚就继续隔三差五冒出来在股吧吹牛逼吧。只是真是搞笑得令人痒痒的不行了而已。
永辉超市是在洗盘吗？,"https://guba.eastmoney.com/news,601933,566231894.html",2016-11-07 16:29:13,真正的洗盘会有这么长的时间，给人每天可以考虑买入的机会吗？今年翻倍的强势股，有哪个股没有洗过盘，洗盘的时候又有谁买进去了？永辉超市股票的高手买进去了吗？不是要么找不到，要么就是即使看到了也不敢买进吗？犹豫之中，不就涨起了吗？ 现在的韭菜也在不断地聪明起来，不就看中了永辉超市的不涨滞涨，姑且说是稳健。然后韭菜也会看研报，也会看到业绩的披露，不就会大批大批地买入永辉超市股票吗？这不正是大神祖宗级别高手的真实写照吗？这样的高手不稀缺，而且是多如牛毛，而非凤毛麟角。这股可能就是蜗牛股了，要成为牛股，我看难。已经深套的没有办法，没有套住的而继续往里钻的实在是自找囫囵了。一失手已然成为千古之恨，那些频频失手或茫然不知的人又能如何了？
今天吸筹特别好[微笑],"https://guba.eastmoney.com/news,601933,566196330.html",2016-11-07 14:56:10,今天吸筹特别好
唉。还是一幅半死不活的样子,"https://guba.eastmoney.com/news,601933,566062610.html",2016-11-07 10:05:54,唉。还是一幅半死不活的样子
看看所属行业涨幅榜，猪脑袋！,"https://guba.eastmoney.com/news,601933,566201544.html",2016-11-07 15:06:13,看看所属行业涨幅榜，猪脑袋！
明天你买的进吗？？？？？？,"https://guba.eastmoney.com/news,601933,566198274.html",2016-11-07 14:59:48,明天你买的进吗？？？？？？
收盘一咒、永灰草屎去死吧！,"https://guba.eastmoney.com/news,601933,566224720.html",2016-11-07 16:07:24,收盘一咒、永灰草屎去死吧！
卖光你个大垃圾 哈哈哈哈哈,"https://guba.eastmoney.com/news,601933,566197121.html",2016-11-07 14:57:30,卖光你个大垃圾 哈哈哈哈哈
好当家、京东方、铜陵有色、旗滨集团，开始低价股革命了。,"https://guba.eastmoney.com/news,601933,566142609.html",2016-11-07 13:23:58,好当家、京东方、铜陵有色、旗滨集团，开始低价股革命了。
京东方都拉了3个点,"https://guba.eastmoney.com/news,601933,566138288.html",2016-11-07 13:15:29,京东方都拉了3个点
601933:永辉超市第三届董事会第十三次会议决议公告,"https://guba.eastmoney.com/news,601933,562982046.html",2016-10-27 20:32:07,"公告日期：2016-10-28
证券代码：601933 证券简称：永辉超市 公告编号：临-2016-55



永辉超市股份有限公司



第三届董事会第十三次会议决议公告



本公司董事会及全体董事保证本公告内容不存在任何虚假记载、误导性陈述或者重大遗漏，并对其内容的真实性、准确性和完整性承担个别及连带责任。



永辉超市股份有限公司（以下简称“永辉超市”或“公司”）第三届董事会第十三次会议于2016年10月26日以现场结合通讯方式在公司左海总部三楼会议室A召开。应参加会议董事11人，实际参加会议董事11人。会议的通知、召开符合《公司法》及其他相关规定。经与会全体董事审议和表决，通过如下决议：



一、关于批准报出《永辉超市股份有限公司2016年第三季度报告》的议案



根据有关法律、法规及《上海证券交易所股票上市规则》，公司编制了《永辉超市股份有限公司2016年第三季度报告》（未经审计），报告从重大事项及2016年第三季度财务报表等方面如实反映了公司2016年度第三季度的经营运行情况。经审议，公司董事会同意报出上述报告。



(以上议案同意票11票、反对票0票、弃权票0票)



二、关于关闭福州滨江丽景店等两家门店及福建平和分公司的议案



同意关闭福州滨江丽景店等两家门店及福建平和分公司，具体情况如下：



1、福州滨江丽景店



该店因租赁合同到期及该物业整体拆迁，同意该店提前终止营业并注销，损失预计在50万元左右。以上损失已在2016年9月份计提入账。



2、四川宜宾银龙店



因该店业主与其他商户纠纷影响到门店长期无法正常营业且培育潜力不大，同意对该店终止营业并注销，损失预计在1,120万元左右。以上损失已在2016年9月份计提入账。



3、福建平和分公司



该分公司主要为收购平和琯溪密柚而设立，现公司已对供应链进行优化并暂停了上述经营业务，同意注销该分公司。该分公司终止营业预计没有财务损失。



(以上议案同意票11票、反对票0票、弃权票0票)



三、关于调整华通银行设立方案的议案



在经第三届董事会第十一次会议审议通过的原华通银行设立方案基础上，为确保批筹进度，同意调整总投资金额至24亿元及各发起人股权结构，详见有关专项公告。除上述调整外，发起文件其余条款不变。



(以上议案同意票11票、反对票0票、弃权票0票)



特此公告。



永辉超市股份有限公司董事会



2016年10月28日




[点击查看PDF原文]
提示：本网不保证其真实性和客观性，一切有关该股的有效信息，以交易所的公告为准，敬请投资者注意风险。
展开阅读全文"
永辉超屎基本成干粑粑股了，日晒雨淋，无色无味了，浪费时间，走人,"https://guba.eastmoney.com/news,601933,566064200.html",2016-11-07 10:08:22,永辉超屎基本成干粑粑股了，日晒雨淋，无色无味了，浪费时间，走人
空方炮来了！,"https://guba.eastmoney.com/news,601933,565613139.html",2016-11-05 12:19:02,看本页右上图。
坚信明天我们不会流泪！,"https://guba.eastmoney.com/news,601933,565826390.html",2016-11-06 16:39:08,走了，在这无底洞里没法生存下去了，看样子，是要流血了。[心碎]
可以解密了：丢卒计划！,"https://guba.eastmoney.com/news,601933,565823043.html",2016-11-06 16:18:40,没办法，今天公开也不迟。明天只要还没有打到跌停板之前，快速抛股逃跑。大股东将会暗中减仓亿元以上，要让不明真相的白马王子、白马公主们长期蹲守在这个残坑里呆着，最终与土壤腐朽在一起。
什马破烂，4.50买的100万股竞被套住咯[滴汗],"https://guba.eastmoney.com/news,601933,565442822.html",2016-11-04 19:02:04,什马破烂，4.50买的100万股竞被套住咯
机构密集调研超市，行情来了吗？,"https://guba.eastmoney.com/news,601933,565322980.html",2016-11-04 13:46:34,机构密集调研超市，行情来了吗？
真无聊呀 扔了 我的铁建上周把红旗今天都能大赚 我的603031次新股追高买 套,"https://guba.eastmoney.com/news,601933,565363356.html",2016-11-04 14:48:28,真无聊呀 扔了 我的铁建上周把红旗今天都能大赚 我的603031次新股追高买 套了两周 最多跌15％到今天也赚了7个多点 就是永辉 不涨也不跌 实在不刺激 唉 没庄可悲
我4元钱买的好当家，永辉没再增持了，不过马上,"https://guba.eastmoney.com/news,601933,565360358.html",2016-11-04 14:43:39,我4元钱买的好当家，永辉没再增持了，不过马上
四句逆耳忠言！,"https://guba.eastmoney.com/news,601933,565348550.html",2016-11-04 14:25:55,能涨的股票才是牛股，能赚到钱的人才是牛人。不能涨的股就是熊股，不能赚钱的人就是熊人。
永辉是垃圾股，什么人会持有？,"https://guba.eastmoney.com/news,601933,565346468.html",2016-11-04 14:22:41,在这股里，现在听到永辉就反胃想吐。真羡慕逮住双马的人们，真正的高手啊。在这里的，都是些被套成一级残废的人，这算啥子一回事嘛！有兜兜绒花这样的人坐镇，这股不知道还有没有戏了？高手们出来发表一下高人一等的言论吧，不要怕，四川双马里的散户不会来听的。
今晚继续永辉拧盖子,"https://guba.eastmoney.com/news,601933,565336076.html",2016-11-04 14:06:49,今晚继续永辉拧盖子
大笔卖出10000手，什么情况。,"https://guba.eastmoney.com/news,601933,565333006.html",2016-11-04 14:01:36,大笔卖出10000手，什么情况。
要横盘多久[心碎],"https://guba.eastmoney.com/news,601933,565305959.html",2016-11-04 13:17:10,要横盘多久[心碎]
張老闆堅而不射，完全無視奶茶炸弹[大笑][大笑][大笑],"https://guba.eastmoney.com/news,601933,564911060.html",2016-11-03 14:04:08,張老闆堅而不射，完全無視奶茶炸弹
明日大盘新高 永辉没戏呀,"https://guba.eastmoney.com/news,601933,564984010.html",2016-11-03 16:24:13,明日大盘新高 永辉没戏呀
这只股有没有谁给个明灯啊,"https://guba.eastmoney.com/news,601933,565261738.html",2016-11-04 11:10:29,这只股有没有谁给个明灯啊
双十一跟这厮有没关系？[不屑],"https://guba.eastmoney.com/news,601933,565120983.html",2016-11-04 01:04:47,双十一跟这厮有没关系？[不屑]
十年以后还是这价格，亲价给老娘顶上去[赞][俏皮][献花],"https://guba.eastmoney.com/news,601933,565036241.html",2016-11-03 19:21:03,十年以后还是这价格，亲价给老娘顶上去
