标题,链接,发布时间,内容
金亚科技:关于公司股票存在被暂停上市风险的提示性公告(2016/12/19),"https://guba.eastmoney.com/news,300028,580775681.html",2016-12-19 17:10:53,"公告日期：2016-12-19
证券代码：300028 证券简称：金亚科技 公告编号：2016-142



金亚科技股份有限公司



关于公司股票存在被暂停上市风险的提示性公告



本公司及其董事会全体成员保证公告内容真实、准确和完整，没有虚假记载、误导性陈述或重大遗漏。



一、 基本情况



因中兴华会计师事务所（特殊普通合伙）对金亚科技股份有限公司（以下简称“公司”）2015年度财务报表出具了无法表示意见的审计报告。根据《深圳证券交易所创业板股票上市规则（2014年修订）》第13.1.1第（五）项、第13.1.2第（五）项等的规定,若连续两年的财务会计报告均被注册会计师出具否定或无法表示意见的审计报告，深圳证券交易所可能暂停公司股票上市。



二、 公司董事会已经和将要采取的工作措施



公司根据董事会要求组成专项小组，对“无法表示意见”涉及事项进行逐一核查落实，就相关事项作出了具体安排部署，积极消除涉及事项。具体进展情况如下：



1、关于“无法表示意见”涉及事项第1项、第2项、第4项，因该三项事



项涉及2015年期初数据，由于截至目前，公司尚未收到中国证监会的调查结论，



因此尚无法判断调查结论对公司2015年期初数据的影响程度。



2、关于“无法表示意见”涉及事项第2项，公司于2016年5月10日发布



了《补充公告》（公告编号：2016-066），经公司确认尚未发现2015年公司实际



控制人存在非经营性占用行为。前述事项尚待2016年年报时一并经会计师事务



所进行确认。



3、关于“无法表示意见”涉及事项第3项，公司已于2016年6月9日聘请



具有证券从业资格的会计师事务所对联营企业鸣鹤鸣和进行审计，以达到消除该事项的条件。截至本报告披露日，审计工作已完成，会计师事务所正根据审计结果拟制相应报告，公司将根据报告结论严格履行披露义务。



公司在本年度认真贯彻国家有关法律法规、部门规章、规范性文件和公司内部规章制度，确保公司建立良好的内部控制环境，并认真按照内部控制制度严格执行；公司通过降低运营成本，大力拓展新兴市场，升级核心技术等举措，进一步加强综合竞争力。



三、 其他事项



1、根据相关规定，公司需每五个交易日发布一次《股票可能被暂停上市的



风险提示公告》，直至暂停上市风险消除或者深圳证券交易所作出公司股票暂停上市的决定；



2、请投资者持续关注本公司前述事项的相关进展，注意投资风险，理性投



资。



特此公告！



金亚科技股份有限公司 董事会



二〇一六年十二月十九日




[点击查看PDF原文]
提示：本网不保证其真实性和客观性，一切有关该股的有效信息，以交易所的公告为准，敬请投资者注意风险。
展开阅读全文"
持有“金亚科技”的股友恭喜了，我只能这样说如新股中签。,"https://guba.eastmoney.com/news,300028,574450705.html",2016-11-30 19:08:56,持有“金亚科技”的股友恭喜了，我只能这样说如新股中签。
意见要求,"https://guba.eastmoney.com/news,300028,580773765.html",2016-12-19 17:04:29,意见要求
和所有非蓝筹股票的波动本质是一样的,"https://guba.eastmoney.com/news,300028,580770188.html",2016-12-19 16:53:24,和所有非蓝筹股票的波动本质是一样的
风险解除喽！公告也不发了！！,"https://guba.eastmoney.com/news,300028,580267599.html",2016-12-17 09:33:49,风险解除喽！公告也不发了！！
现在是什么情况呀,"https://guba.eastmoney.com/news,300028,580763912.html",2016-12-19 16:37:33,现在是什么情况呀
持股过节,"https://guba.eastmoney.com/news,300028,351586060.html",2016-04-26 19:08:18,今天又是一大片被洗的，割肉的疼么？
金亚科技 现在不要开盘 一定要过完春节在开盘，估计开盘后10过板,"https://guba.eastmoney.com/news,300028,580748896.html",2016-12-19 15:56:22,金亚科技 现在不要开盘 一定要过完春节在开盘，估计开盘后10过板
不会又半夜鸡叫了，发公告吧！以前都是这样，公告吗？晚上11点61发布出来,"https://guba.eastmoney.com/news,300028,580694720.html",2016-12-19 14:05:11,不会又半夜鸡叫了，发公告吧！以前都是这样，公告吗？晚上11点61发布出来
和所有非蓝筹股票的波动本质是一样的,"https://guba.eastmoney.com/news,300028,580673135.html",2016-12-19 13:30:25,和所有非蓝筹股票的波动本质是一样的
在国民经济中占重要地位,"https://guba.eastmoney.com/news,300028,580663670.html",2016-12-19 13:13:13,在国民经济中占重要地位
银行对具备发展潜力的钢铁煤炭骨干企业实施债转股,"https://guba.eastmoney.com/news,300028,580638853.html",2016-12-19 11:41:39,银行对具备发展潜力的钢铁煤炭骨干企业实施债转股
如何识别高送转是馅饼还是陷阱,"https://guba.eastmoney.com/news,300028,580569504.html",2016-12-19 09:42:24,如何识别高送转是馅饼还是陷阱
近期流动性或趋于紧张,"https://guba.eastmoney.com/news,300028,580566874.html",2016-12-19 09:38:06,近期流动性或趋于紧张
百元金亚正向我们款款走来[赞][赞][赞],"https://guba.eastmoney.com/news,300028,580468160.html",2016-12-18 18:03:38,百元金亚正向我们款款走来
具备发展潜力的钢铁煤炭骨干企业,"https://guba.eastmoney.com/news,300028,580553667.html",2016-12-19 09:00:38,具备发展潜力的钢铁煤炭骨干企业
今晚没有公告应该是好事，下个星期一早上7点多看公告吧，明天不会发的。,"https://guba.eastmoney.com/news,300028,580192519.html",2016-12-16 21:32:57,今晚没有公告应该是好事，下个星期一早上7点多看公告吧，明天不会发的。
或不达标产能,"https://guba.eastmoney.com/news,300028,580525269.html",2016-12-19 00:21:14,或不达标产能
和所有非蓝筹股票的波动本质是一样的,"https://guba.eastmoney.com/news,300028,580522339.html",2016-12-18 23:52:40,和所有非蓝筹股票的波动本质是一样的
银行业金融机构加强金融债权管理,"https://guba.eastmoney.com/news,300028,580515353.html",2016-12-18 22:55:43,银行业金融机构加强金融债权管理
今天通过特殊通道溢价5%拋了一半 剩下一半赌重组了,"https://guba.eastmoney.com/news,300028,575756391.html",2016-12-05 10:27:46,"今天通过特殊通道溢价5%拋了一半
剩下一半赌重组了"
急，我的500股金亚咋办？,"https://guba.eastmoney.com/news,300028,580425557.html",2016-12-18 11:48:07,"急，我的500股金亚咋办？
"
守了半年多，终于把我洗出去了,"https://guba.eastmoney.com/news,300028,580481356.html",2016-12-18 19:29:13,守了半年多，终于把我洗出去了
对违规新增产能的企业,"https://guba.eastmoney.com/news,300028,580488227.html",2016-12-18 20:14:12,对违规新增产能的企业
出售企业有效资产逃废金融债务,"https://guba.eastmoney.com/news,300028,580447530.html",2016-12-18 15:58:03,出售企业有效资产逃废金融债务
僵尸企业,"https://guba.eastmoney.com/news,300028,580434463.html",2016-12-18 13:46:21,僵尸企业
是不是公司忘记发风险公告了，礼拜一发？,"https://guba.eastmoney.com/news,300028,580422232.html",2016-12-18 11:07:22,求解
意见同时鼓励符合条件的钢铁煤炭企业开展并购重组,"https://guba.eastmoney.com/news,300028,580416667.html",2016-12-18 10:04:26,意见同时鼓励符合条件的钢铁煤炭企业开展并购重组
解除退市，重组成功。在加上这班年青有为的才俊领导金亚科技。金亚科技一定是最牛企业,"https://guba.eastmoney.com/news,300028,580312310.html",2016-12-17 13:52:54,解除退市，重组成功。在加上这班年青有为的才俊领导金亚科技。金亚科技一定是最牛企业股。开盘至少也得50个涨停，最牛金亚科技。新一代领导人更牛
董秘你好，想问一下，为什么12月16日没有发风险提示的公告？不会是忘了吧？？？,"https://guba.eastmoney.com/news,300028,580398093.html",2016-12-18 01:48:22,"董秘你好，想问一下，为什么12月16日没有发风险提示的公告？不会是忘了吧？？？
金亚退
金亚科技：投资者您好，感谢您对公司的关心与支持！公司严格按照相关法律法规履行披露义务，具体公告详见中国证监会创业板指定信息披露媒体巨潮资讯网刊登的相关公告。
答复时间 2017-01-17 17:18:00"
改进公司治理结构,"https://guba.eastmoney.com/news,300028,580387168.html",2016-12-17 22:45:48,改进公司治理结构
忐忑,"https://guba.eastmoney.com/news,300028,580363379.html",2016-12-17 19:43:06,公司需每五个交易日发布一次《股票可能被暂停上市的风险提示公告》，是“需”而不是“必须”。不过按常规确实应该发公告，难道要出审计公告？难道要复牌？可千万别·····尤其是后个疑问千万别成真
大盘收到3117点，,"https://guba.eastmoney.com/news,300028,580375915.html",2016-12-17 21:18:05,大盘收到3117点，
产品有竞争力,"https://guba.eastmoney.com/news,300028,580353857.html",2016-12-17 18:32:14,产品有竞争力
工信部近日联合下发《关于钢铁煤炭行业化解过剩产能金融债权债务问题的若干意见》,"https://guba.eastmoney.com/news,300028,580329965.html",2016-12-17 15:42:58,工信部近日联合下发《关于钢铁煤炭行业化解过剩产能金融债权债务问题的若干意见》
没有谁能救赎。,"https://guba.eastmoney.com/news,300028,580302037.html",2016-12-17 12:43:10,没有谁能救赎。
看看万福生科，一样类型的股票，也是提示退市风险第一股什么的，看看现在什么情况，金,"https://guba.eastmoney.com/news,300028,580234350.html",2016-12-17 02:10:26,看看万福生科，一样类型的股票，也是提示退市风险第一股什么的，看看现在什么情况，金亚科技要走一样的路线
跌的没底线，公司欠外债大多。开盘又是一轮要命的事。[哭][哭][哭][哭][哭],"https://guba.eastmoney.com/news,300028,580301647.html",2016-12-17 12:39:59,跌的没底线，公司欠外债大多。开盘又是一轮要命的事。
不得抽贷,"https://guba.eastmoney.com/news,300028,580297218.html",2016-12-17 11:59:49,不得抽贷
创业板刷新调整新低,"https://guba.eastmoney.com/news,300028,580295984.html",2016-12-17 11:50:51,创业板刷新调整新低
要求银行严控违规新增钢铁煤炭产能的信贷投放,"https://guba.eastmoney.com/news,300028,580289963.html",2016-12-17 11:22:10,要求银行严控违规新增钢铁煤炭产能的信贷投放
相信童童的眼光，她选了个负责任的老公，有错必纠、有担当、有作为的男人,"https://guba.eastmoney.com/news,300028,580270962.html",2016-12-17 09:51:34,相信童童的眼光，她选了个负责任的老公，有错必纠、有担当、有作为的男人
董秘今天忘记发退市风险公告了,"https://guba.eastmoney.com/news,300028,580143585.html",2016-12-16 18:35:58,董秘今天忘记发退市风险公告了
大而化之之谓圣，即将转型为竞技平台[微笑][胜利][胜利],"https://guba.eastmoney.com/news,300028,580223532.html",2016-12-16 23:54:03,大而化之之谓圣，即将转型为竞技平台
下午再上六个点,"https://guba.eastmoney.com/news,300028,580214411.html",2016-12-16 23:02:00,下午再上六个点
此刻今天进的游资只能硬着头皮吃,"https://guba.eastmoney.com/news,300028,580212478.html",2016-12-16 22:52:34,此刻今天进的游资只能硬着头皮吃
大盘再探底会在哪里止跌,"https://guba.eastmoney.com/news,300028,580208340.html",2016-12-16 22:34:22,大盘再探底会在哪里止跌
幸亏抛了，回来看看兄弟们，加油！,"https://guba.eastmoney.com/news,300028,580139832.html",2016-12-16 18:24:23,幸亏抛了，回来看看兄弟们，加油！
都是港通，怎么差距就这么大呢,"https://guba.eastmoney.com/news,300028,580178120.html",2016-12-16 20:42:53,都是港通，怎么差距就这么大呢
升套中！搞的不爽。解套难呀！谁能帮忙解套！,"https://guba.eastmoney.com/news,300028,580170882.html",2016-12-16 20:18:34,升套中！搞的不爽。解套难呀！谁能帮忙解套！
行政处罚是不是已经下来了？都快两年了。,"https://guba.eastmoney.com/news,300028,580161126.html",2016-12-16 19:44:15,行政处罚是不是已经下来了？都快两年了。
听说金亚科技收购世纪游轮了，进来求真假？,"https://guba.eastmoney.com/news,300028,580091702.html",2016-12-16 16:00:55,听说金亚科技收购世纪游轮了，进来求真假？
金亚科技重组对象揭秘,"https://guba.eastmoney.com/news,300028,579986029.html",2016-12-16 12:29:05,"我认为不可能是361,腾讯,金蚂蚁,王健林,不是一个档次的,金亚科技就是个垃圾,人家是何等企业,金亚科技屁都不是,人家是大象,金亚科技就是个屎壳郎,拣大象的一小坨粪便安家,屎壳郎总归是屎壳郎,找个重组对象也只能是个屎壳郎."
东方金钰吧,"https://guba.eastmoney.com/news,300028,580083865.html",2016-12-16 15:38:10,东方金钰吧
错过花，你会收获雨，错过雨，你会遇到彩虹，失去也许就是收获的开始。股市中的努力不,"https://guba.eastmoney.com/news,300028,580016504.html",2016-12-16 13:43:23,"错过花，你会收获雨，错过雨，你会遇到彩虹，失去也许就是收获的开始。股市中的努力不是每一次都会有结果的，但奇遇就在自己的努力。
"
看着股吧赤身的骂人，我觉得这钱赚的安逸,"https://guba.eastmoney.com/news,300028,579997227.html",2016-12-16 13:10:38,看着股吧赤身的骂人，我觉得这钱赚的安逸
先汇率、再国债、股市已经全面杀跌,"https://guba.eastmoney.com/news,300028,579997174.html",2016-12-16 13:10:32,先汇率、再国债、股市已经全面杀跌
我之所以当时不再说黄金，第一我不想再影响大家,"https://guba.eastmoney.com/news,300028,579994591.html",2016-12-16 13:04:20,我之所以当时不再说黄金，第一我不想再影响大家
还要停多久，过春节的钱都在没了。,"https://guba.eastmoney.com/news,300028,579987717.html",2016-12-16 12:37:15,还要停多久，过春节的钱都在没了。
这行情不如继续关着，明年开春在开盘,"https://guba.eastmoney.com/news,300028,579635782.html",2016-12-15 14:19:27,这行情不如继续关着，明年开春在开盘
东方金钰吧,"https://guba.eastmoney.com/news,300028,579887121.html",2016-12-16 09:19:24,东方金钰吧
大调本质，非因害怕美国加息,"https://guba.eastmoney.com/news,300028,579883531.html",2016-12-16 09:07:51,大调本质，非因害怕美国加息
我之所以当时不再说黄金，第一我不想再影响大家,"https://guba.eastmoney.com/news,300028,579844848.html",2016-12-16 01:04:37,我之所以当时不再说黄金，第一我不想再影响大家
我之所以当时不再说黄金，第一我不想再影响大家,"https://guba.eastmoney.com/news,300028,579835883.html",2016-12-15 23:54:37,我之所以当时不再说黄金，第一我不想再影响大家
券商,"https://guba.eastmoney.com/news,300028,579828484.html",2016-12-15 23:19:29,券商
下午再上六个点,"https://guba.eastmoney.com/news,300028,579816363.html",2016-12-15 22:35:13,下午再上六个点
今日分享600053九鼎投资002691冀凯股份,"https://guba.eastmoney.com/news,300028,579816338.html",2016-12-15 22:35:12,今日分享600053九鼎投资002691冀凯股份
不用多想了，重组肯定成功，复盘没十个根本开不了板，没买的40左右买就行了，这票能,"https://guba.eastmoney.com/news,300028,579122602.html",2016-12-14 10:57:48,不用多想了，重组肯定成功，复盘没十个根本开不了板，没买的40左右买就行了，这票能涨到百
壳资源紧缺，重组毕成功，让踏空狗哭去吧,"https://guba.eastmoney.com/news,300028,579805962.html",2016-12-15 22:02:36,壳资源紧缺，重组毕成功，让踏空狗哭去吧
金亚科技本次重组必成功让踏空狗哭去吧,"https://guba.eastmoney.com/news,300028,579805372.html",2016-12-15 22:00:36,金亚科技本次重组必成功让踏空狗哭去吧
300028就凭这个号码也值100亿,"https://guba.eastmoney.com/news,300028,579713636.html",2016-12-15 17:20:20,300028就凭这个号码也值100亿
金亚科技在这班优秀年青的领导下，将会走向辉煌。加油王洪伶等一班领导们，你们最棒。,"https://guba.eastmoney.com/news,300028,579578502.html",2016-12-15 12:09:16,金亚科技在这班优秀年青的领导下，将会走向辉煌。加油王洪伶等一班领导们，你们最棒。相信你们
是不是蚂蚁金服借壳上市？？？？,"https://guba.eastmoney.com/news,300028,579594337.html",2016-12-15 13:11:03,是不是蚂蚁金服借壳上市？？？？
金亚复牌跌两个板,"https://guba.eastmoney.com/news,300028,579111240.html",2016-12-14 10:42:56,金亚复牌跌两个板
会不会是下一个万福生科呢？,"https://guba.eastmoney.com/news,300028,579553703.html",2016-12-15 11:11:41,会不会是下一个万福生科呢？
年底大家小心点，还中国股市更加小心,"https://guba.eastmoney.com/news,300028,579489343.html",2016-12-15 09:33:54,年底大家小心点，还中国股市更加小心
是不是蚂蚁金服借壳上市？？？？,"https://guba.eastmoney.com/news,300028,579379702.html",2016-12-14 21:15:08,是不是蚂蚁金服借壳上市？？？？
重组失败，本月开牌。。。,"https://guba.eastmoney.com/news,300028,578409300.html",2016-12-12 16:54:35,嗯嗯
文明交流,"https://guba.eastmoney.com/news,300028,579081914.html",2016-12-14 10:05:32,看了吧里很多贴子，总体感觉理性交流的不多，很多股友用粗话，脏话，相互开骂。不知道是何意?相信能在吧里发贴的，都应该是持有金亚科技的人，我们散户，只要持有，就会从内心上说希望股票拉升。但在吧里，极端看空，或是低级到都看不下去的语气胡思八道。要么无知?要么就是另有所图？真心希望吧里能文明交流，能百花齐放，百家争鸣！能真正达到相得益彰！
退市股还买，我已看死金亚,"https://guba.eastmoney.com/news,300028,579035088.html",2016-12-14 07:51:32,退市股还买，我已看死金亚
躲过了300242明家联合的两根大阴线 却没有躲过金亚科技可能会退市的命运,"https://guba.eastmoney.com/news,300028,578709439.html",2016-12-13 11:22:03,本人入市一年多，去年躲过了股灾和熔断，算是幸运儿，昨天开盘后名家联合在亏1个点左右的行情下，我果断清仓离场了，不为别人的，只因为看均线破位，而且量能还进一步放大，处于绝对的弱势的行情下，我看不准就走了，尾盘名家联合接近跌停，今天继续大跌8个多点，深感欣慰，不过可惜的是重仓的金亚科技300028停牌，公告说是可能是要退市，各位怎么看？
还是出售香港金亚这个事，出售亏损子公司也是重大资产重组,"https://guba.eastmoney.com/news,300028,578921441.html",2016-12-13 20:08:04,还是出售香港金亚这个事，出售亏损子公司也是重大资产重组
开盘公布退市,"https://guba.eastmoney.com/news,300028,578734735.html",2016-12-13 12:43:23,开盘公布退市
金亚与大盘,"https://guba.eastmoney.com/news,300028,578496098.html",2016-12-12 20:52:44,只希望停牌期间别出审计公告。至于大盘，再次股灾几乎不可能，否则中国····，所以，中国股市会有大动作
什么重大重组？不会把优质资产出售了？剩个空壳然后赔偿退市？,"https://guba.eastmoney.com/news,300028,578241408.html",2016-12-12 12:08:38,什么重大重组？不会把优质资产出售了？剩个空壳然后赔偿退市？
哪位大神告诉我什么时候可以开盘啊,"https://guba.eastmoney.com/news,300028,578804935.html",2016-12-13 14:53:44,哪位大神告诉我什么时候可以开盘啊
两成,"https://guba.eastmoney.com/news,300028,309551384.html",2016-04-06 16:20:25,两成
