标题,链接,发布时间,内容
沪港通深港通都通了 请问何时恢复开通股市T+O交,"https://guba.eastmoney.com/news,300028,581862931.html",2016-12-22 16:07:34,沪港通深港通都通了 请问何时恢复开通股市T+O交
兄弟姐妹们！！！360游戏，，，，，烈火雄风。搞起。。。。。名字叫陆軍1259。,"https://guba.eastmoney.com/news,300028,581821544.html",2016-12-22 14:32:45,兄弟姐妹们！！！360游戏，，，，，烈火雄风。搞起。。。。。名字叫陆軍1259。。。。有一起玩＼的没
对300028的一点看法,"https://guba.eastmoney.com/news,300028,581095827.html",2016-12-20 14:22:15,"金亚目前的首要任务就是保证公司的盈利状态，在这个重要的时间节点，能够看到他们也在积极努力的奋斗，包括剥离资产等等，如果公司退市了对咱们肯定不是好事，目前能做的就是等待，为金亚科技祈福。
虽然金亚只是WCA的参股方，但是也是唯一一家参股上市公司，在银川政府的主导下，同时电竞在政策红利影响下发展的越来越好，未来WCA肯定是中国电竞头一家实现盈利而且最大盈利的公司，在这样的情况下，金亚科技肯定是占据了先发优势，如果金亚真的像大家说的那么危险，WCA怕是早都离得远远地。
除了现在正在布局的所谓泛娱乐的这些内容，金亚科技自己的主营业务也是很强大的，在地区肯定是龙头地位了，只要公司好好运作，肯定能转危为安，还是一句话，目前就是等待，为金亚科技祈福。
拿票的人肯定是希望能赚钱，至于天天在这里喷的，就不知道手里有没有票了。"
预期明年大盘将上20000点，全网首发，如有雷同纯属娱乐[大笑]金亚月底能公布个,"https://guba.eastmoney.com/news,300028,581748851.html",2016-12-22 11:26:35,预期明年大盘将上20000点，全网首发，如有雷同纯属娱乐金亚月底能公布个预案不
险资涉及的股票要注意回避！,"https://guba.eastmoney.com/news,300028,581736011.html",2016-12-22 11:03:11,险资涉及的股票要注意回避！
涉及淘汰落后和过剩产能企业和项目名单,"https://guba.eastmoney.com/news,300028,581720197.html",2016-12-22 10:35:46,市场预计或有4000亿元左右资金将先期逐步入场
明日上证，创业双双下杀，造成恐慌之势。但3000,"https://guba.eastmoney.com/news,300028,581670599.html",2016-12-22 09:05:10,明日上证，创业双双下杀，造成恐慌之势。但3000
怎么睡不着觉呢,"https://guba.eastmoney.com/news,300028,581647285.html",2016-12-22 04:18:35,怎么睡不着觉呢
股吧现在一堆一年多的小号回复什么“看中公司内在价值”啥意思，现在拼命唱多啥意思，,"https://guba.eastmoney.com/news,300028,581547268.html",2016-12-21 17:48:34,股吧现在一堆一年多的小号回复什么“看中公司内在价值”啥意思，现在拼命唱多啥意思，日了狗，害怕。。。。。
看看这要死不活的行情还是关了好，重组成功最少最少最少也有两个板，安心过大年。[胜,"https://guba.eastmoney.com/news,300028,581639240.html",2016-12-22 00:42:26,看看这要死不活的行情还是关了好，重组成功最少最少最少也有两个板，安心过大年。
怎么这么多傻逼刷屏，闲的蛋疼。,"https://guba.eastmoney.com/news,300028,581639092.html",2016-12-22 00:40:13,怎么这么多傻逼刷屏，闲的蛋疼。
上联 大非减持小非减持机构减持聪明股民都在减,"https://guba.eastmoney.com/news,300028,581631311.html",2016-12-21 23:32:48,上联 大非减持小非减持机构减持聪明股民都在减
砸盘的狗比散开！！！,"https://guba.eastmoney.com/news,300028,581623903.html",2016-12-21 22:52:21,砸盘的狗比散开！！！
其实你们付出了很多，可是与得到太不相称了。你,"https://guba.eastmoney.com/news,300028,581622496.html",2016-12-21 22:45:46,其实你们付出了很多，可是与得到太不相称了。你
上证指数，圆月弯刀,"https://guba.eastmoney.com/news,300028,581610516.html",2016-12-21 21:54:57,上证指数，圆月弯刀
老帖一直顶多是些啥鬼啊！全部看多，注意啦,"https://guba.eastmoney.com/news,300028,581608465.html",2016-12-21 21:47:06,老帖一直顶多是些啥鬼啊！全部看多，注意啦
毕竟创业板本周,"https://guba.eastmoney.com/news,300028,581602902.html",2016-12-21 21:25:21,毕竟创业板本周
浮大泽的人,"https://guba.eastmoney.com/news,300028,581601683.html",2016-12-21 21:21:01,浮大泽的人
快跑，等套,"https://guba.eastmoney.com/news,300028,581574864.html",2016-12-21 19:44:07,快跑，等套
你麻比，我发的贴一会就被删除了。,"https://guba.eastmoney.com/news,300028,537316608.html",2016-08-20 23:55:37,你麻比，我发的贴一会就被删除了。反正一句话，现在这个价位，越跌，越买进。低开也买，放量大跌洗盘也买。只能说在黎明前了。不要下车就对了。但愿能发出去。
哈哈，还想玩我？[想一下],"https://guba.eastmoney.com/news,300028,581544474.html",2016-12-21 17:38:01,哈哈，还想玩我？
幸亏抛了，回来看看兄弟们，加油！,"https://guba.eastmoney.com/news,300028,581430184.html",2016-12-21 13:26:52,幸亏抛了，回来看看兄弟们，加油！
看到公告安心了,"https://guba.eastmoney.com/news,300028,581536988.html",2016-12-21 17:12:48,看到公告安心了
高盛认为万科当前的市值与宝能,"https://guba.eastmoney.com/news,300028,581527535.html",2016-12-21 16:41:36,要求银行严控违规新增钢铁煤炭产能的信贷投放
360打坦克。有来的吗？？来就加！！名字叫。。。。。陆軍1259,"https://guba.eastmoney.com/news,300028,581506521.html",2016-12-21 15:41:40,360打坦克。有来的吗？？来就加！！名字叫。。。。。陆軍1259
开源证券高级策略分析师杨海表示,"https://guba.eastmoney.com/news,300028,581476307.html",2016-12-21 14:37:07,组织实施停止贷款
兄弟们。没事无聊。360游戏，打坦克。有来的吗？,"https://guba.eastmoney.com/news,300028,581442518.html",2016-12-21 13:45:55,兄弟们。没事无聊。360游戏，打坦克。有来的吗？
仰帆控股虚增营业收入遭证监会罚款60万元，金亚罚多少？,"https://guba.eastmoney.com/news,300028,581306086.html",2016-12-21 09:01:27,"仰帆控股(600421)遭证监会调查逾两年终于结案。仰帆控股12月20日晚间公告，公司19日收到中国证监会《行政处罚事先告知书》，公司涉嫌信息披露虚假案已由中国证监会调查完毕，中国证监会依法拟对公司及相关人员作出行政处罚。

　　与此同时，中天系四度举牌潜伏逾三年的仰帆控股，公司间接控股股东仰帆投资拟筹划实际控制人变更。随着历时逾两年的立案调查最终落地，仰帆控股的控股权转让或将提速。

　　公告显示，仰帆控股在2012年、2013年年度中虚假记载营业收入。对此，证监会决定，责令公司改正违法行为，给予警告，并处以60万元罚款；对负直接责任的主管人员钱汉新、滕祖昌、龚晓超、周伟兴、黄丽华给予警告，并分别处以30万元罚款；对其他直接责任人员朱忠良、黎地、华伟、徐军、彭惠珍、范震东、刘丽萍、江波、张斌、闻彩兵、陈杰、林征南给予警告，并分别处以10万元罚款。

　　仰帆控股原名为*ST国药，2004年至2011年，公司主营业务为医药制品的生产、销售及流通；2012年至2013年，公司主营业务为钢材贸易；2014年公司主营为内燃机配件业务。但由于经营规模较小，可支配资产少，公司重组在所难免。

　　仰帆控股2016年三季报显示，公司今年1到9月实现营业收入2033万元，同比下降11.40%；归属于上市公司股东的净利润-99万元，同比下降1065.94%。其中子公司上海奥柏内燃机配件有限公司的订单减少，导致销售收入下降。

　　值得注意的是，仰帆控股于2014年12月2日收到中国证监会《调查通知书》。因公司涉嫌信息披露违法违规，证监会决定对公司进行立案调查。此后两年间，仰帆控股都没有实质性的资本运作披露。

　　根据证监会出具的《行政处罚事先告知书》，仰帆控股2012年和2013年年度报告均存在虚假记载营业收入情况。调查显示，2012年5月，仰帆控股设立子公司上海鄂欣实业有限公司(以下简称“鄂欣实业”)具体开展钢材贸易业务。

　　2012年度，鄂欣实业对不应当确认为收入的4笔钢材销售确认收入4115万元，由此导致公司2012年年度报告披露的4919万元营业收入中，有4115万元是虚增的。2013年度，鄂欣实业继续对不应当确认为收入的16笔钢材销售确认收入1.03亿元，由此导致公司 2013年年度报告披露的1.11亿元营业收入中，有1.03亿元是虚增的。

　　与此同时，中天系早在2013年就对仰帆控股完成了首次举牌，展开对仰帆控股控股权的争夺。去年三季报显示，中天系通过旗下全资子公司上海天纪投资有限公司和浙江恒顺投资有限公司，合共持有仰帆控股21.59%股份，虽然其后未有再继续增持，但已超过现控股股东仰帆投资及其一致行动人20.53%的持股比例。

　　按照现行法规，上市公司董事、监事和高管近36个月受到证监会处罚的、近12个月受到交易所公开谴责的不能进行增发、配股、发行可转债及定向增发。但是发行债券、资产重组及涉及到实际控制人变更都是可行的。随着证监会历时逾两年的立案调查最终结束，仰帆控股的控股权转让或将提速。"
但仍有相当数量的流通盘在外,"https://guba.eastmoney.com/news,300028,581451104.html",2016-12-21 13:58:18,积极稳妥开展并购贷款业务
由此估算,"https://guba.eastmoney.com/news,300028,581420972.html",2016-12-21 13:11:13,切实遏制逃废金融债务行为
目前看，如果没有实质性的利好，明天你们一不小,"https://guba.eastmoney.com/news,300028,581415143.html",2016-12-21 12:56:49,目前看，如果没有实质性的利好，明天你们一不小
赌徒命运的区別就是中外股市的区别,"https://guba.eastmoney.com/news,300028,581415121.html",2016-12-21 12:56:42,赌徒命运的区別就是中外股市的区别
若再剔除自然人刘元生持有的1.23%股份以及11.93%的H股股份,"https://guba.eastmoney.com/news,300028,581406360.html",2016-12-21 12:19:44,地方资产管理公司
恒大共计持有15.532亿股万科A股,"https://guba.eastmoney.com/news,300028,581378505.html",2016-12-21 11:07:58,对于钢铁煤炭行业
偷着乐吧，大盘跌成狗了，哈哈哈哈哈哈哈哈哈哈哈哈~~,"https://guba.eastmoney.com/news,300028,579659580.html",2016-12-15 14:56:28,
大盘这么弱势，希望金亚晚点复牌，一复牌就出好消息,"https://guba.eastmoney.com/news,300028,581099980.html",2016-12-20 14:29:25,大盘这么弱势，希望金亚晚点复牌，一复牌就出好消息，然后一字涨停
当年的勤上光电，供参考。,"https://guba.eastmoney.com/news,300028,536499204.html",2016-08-19 22:55:43,当年的勤上光电，供参考。
但有不小杠杆在里面,"https://guba.eastmoney.com/news,300028,581336156.html",2016-12-21 10:03:26,或不达标产能
但美联储表态对于2017年加息预期的调整较大,"https://guba.eastmoney.com/news,300028,581307128.html",2016-12-21 09:05:40,但美联储表态对于2017年加息预期的调整较大
成本相对较低,"https://guba.eastmoney.com/news,300028,581302272.html",2016-12-21 08:48:50,意见要求银行业金融机构要加大涉及钢铁煤炭企业不良资产的转让力度
咱们要相信金亚 相信领导层有这个能力,"https://guba.eastmoney.com/news,300028,581249492.html",2016-12-20 22:12:13,咱们要相信金亚 相信领导层有这个能力
明日上证，创业双双下杀，造成恐慌之势。但3000,"https://guba.eastmoney.com/news,300028,581278203.html",2016-12-21 01:53:59,明日上证，创业双双下杀，造成恐慌之势。但3000
国债期货大跌,"https://guba.eastmoney.com/news,300028,581276426.html",2016-12-21 01:19:55,国债期货大跌
尼玛，你们会看公告不，这智商，这次重组跟香港金亚半毛钱关系都没,"https://guba.eastmoney.com/news,300028,581237749.html",2016-12-20 21:22:34,"截止本公告披露之日，公司以及有关各方正在积极推进涉及重大资产重组事项的相关工作，交易双方已达成初步意向协议，有关标的资产的研究分析、交易方案的磋商论证等工作仍在进展过程中。为维护投资者利益，避免公司股价异常波动，根据深圳证券交易所的相关规定，公司股票继续停牌。停牌期间，公司将根据相关规定及时履行信息披露义务，每五个交易日披露一次相关事项进展公告。待相关工作完成后召开董事会审议本次重大资产重组的相关议案，及时公告并按照要求办理后续复牌事宜。


看见没：交易双方已达成初步意向协议，有关标的资产的研究分析、交易方案的磋商论证等工作仍在进展过程中。


目前还只是达成初步意向协议，还在论证，就看成不成功，香港金亚都已经交割完成，还需要认证飞机啊"
金亚科技:关于重大资产重组停牌进展公告(2016/12/15),"https://guba.eastmoney.com/news,300028,579345431.html",2016-12-14 19:43:39,"公告日期：2016-12-15
证券代码：300028 证券简称：金亚科技 公告编号：2016-141



金亚科技股份有限公司



关于重大资产重组停牌进展公告



本公司及其董事会全体成员保证公告内容真实、准确和完整，没有虚假记载、误导性陈述或重大遗漏。



金亚科技股份有限公司（以下简称“公司”）因筹划重大资产重组事项，公司股票于2016年12月1日上午开市起停牌并披露了《关于重大资产重组停牌公告》（公告编号：2016-137）。停牌期间，公司于2016年12月8日披露了《《关于重大资产重组停牌进展的公告》（公告编号：2016-139）。



截止本公告披露之日，公司以及有关各方正在积极推进涉及重大资产重组事项的相关工作，交易双方已达成初步意向协议，有关标的资产的研究分析、交易方案的磋商论证等工作仍在进展过程中。为维护投资者利益，避免公司股价异常波动，根据深圳证券交易所的相关规定，公司股票继续停牌。停牌期间，公司将根据相关规定及时履行信息披露义务，每五个交易日披露一次相关事项进展公告。待相关工作完成后召开董事会审议本次重大资产重组的相关议案，及时公告并按照要求办理后续复牌事宜。



公司本次筹划的重大资产重组事项仍存在不确定性。根据相关规定，公司每五个交易日至少披露一次可能被暂停上市的风险提示性公告，直至暂停上市风险消除或者深圳证券交易所作出公司股票暂停上市的决定。敬请广大投资者注意投资风险。



特此公告！



金亚科技股份有限公司 董事会



二〇一六年十二月十四日




[点击查看PDF原文]
提示：本网不保证其真实性和客观性，一切有关该股的有效信息，以交易所的公告为准，敬请投资者注意风险。"
按5个交易日出进展公告算，应该22号晚再发公告，看看就知道答案，祈祷中[拜神][,"https://guba.eastmoney.com/news,300028,581159965.html",2016-12-20 16:56:47,按5个交易日出进展公告算，应该22号晚再发公告，看看就知道答案，祈祷中
金亚科技:上市公司并购重组财务顾问专业意见附表第2号——重大资产重组,"https://guba.eastmoney.com/news,300028,551629945.html",2016-09-14 19:57:32,"公告日期：2016-09-14


上市公司并购重组财务顾问专业意见附表

第2号——重大资产重组

上市公司名称 金亚科技股份有限公司 独立财务顾问名称 国海证券股份有限公司

证券简称 金亚科技 证券代码 300028

交易类型 购买□出售其他方式□

交易对方 周旭辉 是否构成关联交易 是否□

本次重组概况 金亚科技拟向周旭辉转让其持有的香港金亚100%股权

判断构成重大资产重组 拟出售的资产在最近一个会计年度所产生的营业收入占上市公司同期经审

的依据 计的合并财务会计报告营业收入的比例达到50%以上。

公司拟通过协议转让方式出售公司持有的香港金亚100%的股权，并由交易

对方周旭辉先生以其对公司的债权冲抵本次交易应支付的对价。本次交易价

方案简介

格以资产评估机构对拟出售资产截至评估基准日进行评估而出具的评估结

论确定的评估值为基础，并经公司与交易对方协商确定。

核查意见

序号 核查事项 备注与说明

是 否

一、交易对方的情况

1.1 交易对方的基本情况

1.1.1 交易对方的名称、企业性质、注册地、主要办公地 不适用，本次交易

点、法定代表人、税务登记证号码与实际情况是否 对方均为自然人

相符

1.1.2 交易对方是否无影响其存续的因素 不适用，本次交易

对方均为自然人

1.1.3 交易对方为自然人的，是否未取得其他国家或者地是

区的永久居留权或者护照

1.1.4 交易对方阐述的历史沿革是否真实、准确、完整， 不适用，本次交易

不存在任何虚假披露 对方均为自然人

1.2 交易对方的控制权结构

1.2.1 交易对方披露的产权及控制关系是否全面、完整、 不适用，本次交易

真实 对方均为自然人

1.2.2 如交易对方成立不足一年或没有开展实际业务，是 不适用，本次交易

否已核查交易对方的控股股东或者实际控制人的 对方均为自然人

情况

1.2.3 是否已核查交易对方的主要股东及其他管理人的 不适用，本次交易

基本情况 对方均为自然人

1.3 交易对方的实力

1.3.1 是否已核查交易对方从事的主要业务、行业经验、 不适用，本次交易

经营成果及在行业中的地位 对方均为自然人

1.3.2 是否已核查交易对方的主要业务发展状况 不适用，本次交易……
[点击查看PDF原文]
提示：本网不保证其真实性和客观性，一切有关该股的有效信息，以交易所的公告为准，敬请投资者注意风险。
展开阅读全文"
复盘直接把名改了，才叫厉害   中国网游,"https://guba.eastmoney.com/news,300028,575335037.html",2016-12-02 20:47:30,"复盘直接把名改了，才叫厉害
中国网游"
据入选机构人士透露,"https://guba.eastmoney.com/news,300028,581079225.html",2016-12-20 13:54:55,据入选机构人士透露
养老金相比社保基金风险偏好更低,"https://guba.eastmoney.com/news,300028,581126566.html",2016-12-20 15:18:55,养老金相比社保基金风险偏好更低
WCA上央视了~,"https://guba.eastmoney.com/news,300028,580796969.html",2016-12-19 18:16:27,WCA又上央视了。。。给金亚加10分，
市场震荡回落 人气比较低迷,"https://guba.eastmoney.com/news,300028,581054004.html",2016-12-20 13:07:46,市场震荡回落 人气比较低迷
低位盘整了一年或半年之长的，基本上没有涨过的,"https://guba.eastmoney.com/news,300028,581054040.html",2016-12-20 13:07:45,低位盘整了一年或半年之长的，基本上没有涨过的
南京银行和新钢股份等个股,"https://guba.eastmoney.com/news,300028,581048517.html",2016-12-20 12:47:55,南京银行和新钢股份等个股
看完飞乐音响8月25日的重大资产重组，我的心碎一地，话不多说了，我已经做好心理准,"https://guba.eastmoney.com/news,300028,580884021.html",2016-12-19 22:57:57,看完飞乐音响8月25日的重大资产重组，我的心碎一地，话不多说了，我已经做好心理准备接受事实了。
如何看待今日的冲高回落,"https://guba.eastmoney.com/news,300028,581036286.html",2016-12-20 11:51:40,如何看待今日的冲高回落
预计未来基本养老金在权益类产品的首批投资规模大约在4000,"https://guba.eastmoney.com/news,300028,581033378.html",2016-12-20 11:41:55,预计未来基本养老金在权益类产品的首批投资规模大约在4000
再加上预估全国所有省平均委托管理比例大约在35.6%,"https://guba.eastmoney.com/news,300028,580996239.html",2016-12-20 10:34:29,再加上预估全国所有省平均委托管理比例大约在35.6%
对此,"https://guba.eastmoney.com/news,300028,580940039.html",2016-12-20 08:51:11,对此
那位大神能够说说今天的公告是什么意思，利好还是利空,"https://guba.eastmoney.com/news,300028,580844282.html",2016-12-19 20:42:59,那位大神能够说说今天的公告是什么意思，利好还是利空
过几天看看重大资产重组进展就知道这次是卖资产还是有大动作。,"https://guba.eastmoney.com/news,300028,580815761.html",2016-12-19 19:21:09,过几天看看重大资产重组进展就知道这次是卖资产还是有大动作。
好多托顶老帖啊！疯了，这种股开盘给机会也不敢进！东方财富就要废在托的手中,"https://guba.eastmoney.com/news,300028,580742047.html",2016-12-19 15:37:45,好多托顶老帖啊！疯了，这种股开盘给机会也不敢进！东方财富就要废在托的手中
如医药生物,"https://guba.eastmoney.com/news,300028,580891967.html",2016-12-19 23:36:10,如医药生物
还指着回本呢，就这个没戏了,"https://guba.eastmoney.com/news,300028,580891496.html",2016-12-19 23:33:18,还指着回本呢，就这个没戏了
盛大借壳灞,"https://guba.eastmoney.com/news,300028,580866645.html",2016-12-19 21:53:18,盛大借壳灞
甩掉了不良资产包袱，公司进展很快，是一家好公司,"https://guba.eastmoney.com/news,300028,580873646.html",2016-12-19 22:16:47,甩掉了不良资产包袱，公司进展很快，是一家好公司
明日上证，创业双双下杀，造成恐慌之势。但3000,"https://guba.eastmoney.com/news,300028,580869093.html",2016-12-19 22:01:06,明日上证，创业双双下杀，造成恐慌之势。但3000
意见鼓励银行业金融机构进行贷款重组,"https://guba.eastmoney.com/news,300028,580857410.html",2016-12-19 21:23:17,意见鼓励银行业金融机构进行贷款重组
要你360来收购，人家养老金要入驻了，金亚才不稀罕你360呢,"https://guba.eastmoney.com/news,300028,580847267.html",2016-12-19 20:51:42,要你360来收购，人家养老金要入驻了，金亚才不稀罕你360呢
明天大盘跌,"https://guba.eastmoney.com/news,300028,580836288.html",2016-12-19 20:20:51,明天大盘跌
今天会提前暴跌！不能做对冲的赶快跑！,"https://guba.eastmoney.com/news,300028,580836261.html",2016-12-19 20:20:42,今天会提前暴跌！不能做对冲的赶快跑！
不久又暂停了另一家保险公司参与股票买卖,"https://guba.eastmoney.com/news,300028,580804200.html",2016-12-19 18:43:14,不久又暂停了另一家保险公司参与股票买卖
通过调整贷款期限,"https://guba.eastmoney.com/news,300028,580799755.html",2016-12-19 18:27:48,通过调整贷款期限
