标题,链接,发布时间,内容
再砸狠点，砸深点！ 哈哈。,"https://guba.eastmoney.com/news,600933,735077285.html",2017-12-07 09:30:59,再砸狠点，砸深点！ 哈哈。
今日破15吗？,"https://guba.eastmoney.com/news,600933,735091021.html",2017-12-07 09:56:55,今日破15吗？
在砸2元呗,"https://guba.eastmoney.com/news,600933,735091010.html",2017-12-07 09:56:54,在砸2元呗
"据神秘人士透露此票明天将有大大的惊喜,望大家不要错过机会!!!","https://guba.eastmoney.com/news,600933,735003304.html",2017-12-06 21:33:54,"据神秘人士透露此票明天将有大大的惊喜,望大家不要错过机会!!!"
SB，不敢砸了，哈哈,"https://guba.eastmoney.com/news,600933,734761756.html",2017-12-06 09:46:58,。。。。。。。。。。。
使劲砸，加油！ 哈哈。,"https://guba.eastmoney.com/news,600933,735082700.html",2017-12-07 09:41:47,使劲砸，加油！ 哈哈。
"TMD, 快点砸下来！ 急人！","https://guba.eastmoney.com/news,600933,734813407.html",2017-12-06 11:26:24,"TMD, 快点砸下来！ 急人！"
今天卖了  远离新股,"https://guba.eastmoney.com/news,600933,734960864.html",2017-12-06 18:13:23,今天卖了 远离新股
现金为王，等待机会！ 哈哈。,"https://guba.eastmoney.com/news,600933,735077646.html",2017-12-07 09:31:55,现金为王，等待机会！ 哈哈。
明天15.20元左右吸回来！ 以免踏空。,"https://guba.eastmoney.com/news,600933,734951383.html",2017-12-06 17:39:54,明天15.20元左右吸回来！ 以免踏空。
谁敢在80元以下卖掉的，出门必定给车给压SI!立贴为证！很灵验的！,"https://guba.eastmoney.com/news,600933,727641651.html",2017-11-13 16:38:49,"谁敢在80元以下卖掉的，出门必定给车给压SI!立贴为证！很灵验的！
超级新能源车概念股！
近期新股都是10多个涨停或以上，看看掌阅科技（603533），聚灿光电(300708)，阿科力(603722)，合盛硅业(603260)，等等近期上市的几十只新股就知道了。
持有的人，记得每天一大早都挂涨停价买进，让机构都没法买进！一直到80元！"
600933,"https://guba.eastmoney.com/news,600933,735019259.html",2017-12-06 22:37:50,"今日市场主要“芯片”、超跌股反弹为主，这波杀跌虽然个股跌幅很大，也释放了不少风险，但单靠一针就说市场站稳，那只是个人的“贪念”所致，相信很多人只看到金针探底，而忽略了整数关点缺口，股神1号指标还未出现指标，目前仍然空仓。关注次新股。
今天金针探底，你又能赚多少？"
昨天15.55元割肉清仓了。明天低点再吸回来！,"https://guba.eastmoney.com/news,600933,734902739.html",2017-12-06 15:05:42,昨天15.55元割肉清仓了。明天低点再吸回来！
已割肉的小散都在等明天低点杀入！ 哈哈。,"https://guba.eastmoney.com/news,600933,734951807.html",2017-12-06 17:41:14,已割肉的小散都在等明天低点杀入！ 哈哈。
故事又一次达到高峰！,"https://guba.eastmoney.com/news,600933,735009001.html",2017-12-06 21:56:35,"故事又一次达到高峰！
"
"明天大盘红盘几率大,借势逃跑吧,机会不","https://guba.eastmoney.com/news,600933,734987578.html",2017-12-06 20:28:47,多了.
"新股跌成这样,就该差丫的!!","https://guba.eastmoney.com/news,600933,734983002.html",2017-12-06 20:05:43,"新股跌成这样,就该差丫的!!"
怎么一下跑出来这么多唱多能手，明天完蛋了。狗托唱多你们懂得,"https://guba.eastmoney.com/news,600933,734946097.html",2017-12-06 17:22:26,
明天逢低可以买入了，三成建仓，高抛低吸。,"https://guba.eastmoney.com/news,600933,734959427.html",2017-12-06 18:07:44,明天逢低可以买入了，三成建仓，高抛低吸。
初步止跌，初步，,"https://guba.eastmoney.com/news,600933,734958524.html",2017-12-06 18:04:00,初步止跌，初步，
忍无可忍，老子将中签的1000股全卖了，原以为会到58。[滴汗],"https://guba.eastmoney.com/news,600933,734772512.html",2017-12-06 10:08:06,忍无可忍，老子将中签的1000股全卖了，原以为会到58。
"今天走势很健康,有望","https://guba.eastmoney.com/news,600933,734595208.html",2017-12-05 16:44:48,"今天走势很健康,有望"
好趋势！临收盘涨了2个点！,"https://guba.eastmoney.com/news,600933,734928155.html",2017-12-06 16:23:51,好趋势！临收盘涨了2个点！
明天要是来个跌停就等于新股重新上市了！,"https://guba.eastmoney.com/news,600933,734566389.html",2017-12-05 15:41:28,明天要是来个跌停就等于新股重新上市了！
明天涨停、涨停、涨停！,"https://guba.eastmoney.com/news,600933,731972785.html",2017-11-26 15:31:53,明天涨停、涨停、涨停！
爱柯迪再起风云？风险是否化解的关键一点！！,"https://guba.eastmoney.com/news,600933,734615288.html",2017-12-05 17:45:49,爱柯迪再起风云？风险是否化解的关键一点！！
爱柯迪 主力疯狂涌入！或许这是最后的机会。,"https://guba.eastmoney.com/news,600933,734591534.html",2017-12-05 16:35:30,
趋势已经很明显，切不可再犯错误!,"https://guba.eastmoney.com/news,600933,734736559.html",2017-12-06 07:29:58,"趋势已经很明显，切不可再犯错误!
"
市值排名27位的公司，长线发展看好,"https://guba.eastmoney.com/news,600933,734612935.html",2017-12-05 17:38:17,长线值得持有
新股回落期，理性看待股票涨跌,"https://guba.eastmoney.com/news,600933,734613281.html",2017-12-05 17:39:25,新股回落期，理性看待股票涨跌
爱柯迪这家企业，彻底没有戏了。谁敢跟你做生意。垃圾。,"https://guba.eastmoney.com/news,600933,734920499.html",2017-12-06 15:57:50,垃圾公司
炒新需谨慎,"https://guba.eastmoney.com/news,600933,734920900.html",2017-12-06 15:59:07,次新股走势震荡，炒新需谨慎
中签的小散们还有没走的吗？,"https://guba.eastmoney.com/news,600933,734784981.html",2017-12-06 10:30:51,中签的小散们还有没走的吗？
皮海洲：次新股为何暴跌 真实的原因在这里！,"https://guba.eastmoney.com/news,600933,734906181.html",2017-12-06 15:14:17,次新股为什么出现暴跌走势？舆论方面很容易将其与管理层对高送转行为的监管联系在一起。在12月1日证监会例行举行的新闻发布会上，证监会再次剑指上市公司高送转行为。证监会新闻发言人高莉表示，时值2017年年末，证监会再次提醒投资者，对于“高送转”等概念，应理性分析，警惕“高送转”游戏陷阱。证监会将持续对上市公司“高送转”行为保持高压监管态势，加大对上市公司推出“高送转”方案的问询力度，强化与二级市场交易核查的监管联动，加强对“高送转”上市公司的现场检查，尤其对其中长期没有现金分红的“铁公鸡”严格监管。
和它一天开盘的中曼石油，昨天就接近破发了！,"https://guba.eastmoney.com/news,600933,734904046.html",2017-12-06 15:08:59,和它一天开盘的中曼石油，昨天就接近破发了！
明天继续打压吸筹，有低点再杀入！,"https://guba.eastmoney.com/news,600933,734904002.html",2017-12-06 15:08:54,明天继续打压吸筹，有低点再杀入！
企稳了吗，还亏10几个点，求涨不停,"https://guba.eastmoney.com/news,600933,734903480.html",2017-12-06 15:07:35,企稳了吗，还亏10几个点，求涨不停
耐心等待底部确认,"https://guba.eastmoney.com/news,600933,734898608.html",2017-12-06 14:57:18,耐心等待底部确认
螳螂捕蝉黄雀在后国家对进场,"https://guba.eastmoney.com/news,600933,734891775.html",2017-12-06 14:44:41,螳螂捕蝉黄雀在后，国家对进场，前期庄家够喝一壶了。
次新强势拉伸都没涨5毛钱，估计是这个价位间反复磨了，人家上市就狂圈钱这说明公司是很缺钱不会让你们这么快解套,"https://guba.eastmoney.com/news,600933,734894586.html",2017-12-06 14:49:55,次新强势拉伸都没涨5毛钱，估计是这个价位间反复磨了，人家上市就狂圈钱，这说明公司是很缺钱，不会让你们这么快解套！！！
怎么上去就怎么下来,"https://guba.eastmoney.com/news,600933,734893581.html",2017-12-06 14:48:03,怎么上去就怎么下来
你到拉个涨停板啊,"https://guba.eastmoney.com/news,600933,734890571.html",2017-12-06 14:42:25,你到拉个涨停板啊
把我的500股狠狠地砸在你们脸上，滚，永远不要让我再看见你们！……,"https://guba.eastmoney.com/news,600933,734886475.html",2017-12-06 14:34:35,把我的500股狠狠地砸在你们脸上，滚，永远不要让我再看见你们！……
上市开板……,"https://guba.eastmoney.com/news,600933,734492159.html",2017-12-05 13:53:26,11月17日上市拉三板即开板，12月5日跌破发！时间只用了九个交易日………。还有没有更烂的次新股？
次新拉伸，还不动，想耍流氓？？,"https://guba.eastmoney.com/news,600933,734882216.html",2017-12-06 14:26:36,。。。。。。。
德生科技都大涨了，你还磨蹭什么,"https://guba.eastmoney.com/news,600933,734881450.html",2017-12-06 14:25:08,德生科技都大涨了，你还磨蹭什么
可算见点红,"https://guba.eastmoney.com/news,600933,734881436.html",2017-12-06 14:25:05,可算见点红，要不快变成石女了
