标题,链接,发布时间,内容
大单都再砸--逃逃逃中单死定,"https://guba.eastmoney.com/news,601607,620311941.html",2017-03-23 14:42:46,
中单死定了小单逃好了,"https://guba.eastmoney.com/news,601607,620308625.html",2017-03-23 14:37:24,
在B股的带动下，将来回震荡,"https://guba.eastmoney.com/news,601607,620253931.html",2017-03-23 13:21:45,RT
这票没希望了,"https://guba.eastmoney.com/news,601607,620186917.html",2017-03-23 11:09:11,注意
业绩稳健增长，关注国企改革进展及外延式扩张,"https://guba.eastmoney.com/news,601607,620166696.html",2017-03-23 10:38:09,
2017年的热点是大数据 云计算 人工智能等三类涉及数字经济的板块,"https://guba.eastmoney.com/news,601607,620154100.html",2017-03-23 10:19:02,"没有数据的场景不可能实现人工智能。大数据就是人工智能的引爆点，云计算、大数据、人工智能趋向“三位一体”
在欧美国家 走势最牛的股票就是大数据银信科技300231就是三方面的龙头 盘子小 股价低 这才是优势
次新银行前一波是小银行，下一波是600919江苏银行江苏银行与德邦证券发起设立国内首支消费金融ABS创新投资基金
与华为技术有限公司于2017年3月21日签订了战略合作协议 江苏银行变华为通讯股了"
今天会飞吗,"https://guba.eastmoney.com/news,601607,620120044.html",2017-03-23 09:28:37,今天会飞吗
满仓，爽,"https://guba.eastmoney.com/news,601607,620117672.html",2017-03-23 09:23:11,满仓，爽
该三处房产虽未经评估,"https://guba.eastmoney.com/news,601607,620085809.html",2017-03-23 06:32:01,房子是用来住的、不是用来炒的
这么多喊好的，明天必须跌了，肯定的,"https://guba.eastmoney.com/news,601607,620032357.html",2017-03-22 22:52:49,这么多喊好的，明天必须跌了，肯定的
601607:上海医药关于提请股东大会给予董事会配发、发行、处理股份的一般性授权的公告,"https://guba.eastmoney.com/news,601607,619943519.html",2017-03-22 18:18:37,"公告日期：2017-03-23
证券代码：601607 证券简称：上海医药 编号：临2017-016



债券代码：136198 债券简称：16 上药01



上海医药集团股份有限公司



关于提请股东大会给予董事会配发、发行、处理股份的一般性授权的公告



本公司董事会及全体董事保证本公告内容不存在任何虚假记载、误导性陈述或者重大遗漏，并对其内容的真实性、准确性和完整性承担个别及连带责任。



上海医药集团股份有限公司（以下简称“公司”）于2017年3月21日召开



的第六届董事会第五次会议审议通过了《关于提请股东大会给予董事会配发、发行、处理股份的一般性授权议案》，具体内容如下：



提请股东大会无条件一般性授权公司董事会于有关期间内决定公司单独或同时配发、发行及/或处理A股及/或H股，并就该等事项订立协议、发出股份发售建议、或授予购股权或转股权，发行A股及/或H股总面值不得超过本议案获股东大会通过之日公司已发行的A股及/或H股各自总面值的20%。上述有关期间指本议案获股东大会通过之日起至下列最早日期止的期间：1、本议案通过后公司下届年度股东大会结束时；2、本议案通过后12个月届满当日；3、公司股东于任何股东大会上通过决议撤销或修订根据本决议赋予董事会授权的日期。



根据中国相关法律法规，即使获得一般性授权，如果发行A股新股仍需获得



股东大会批准。



该议案尚需提交公司股东大会审议。



特此公告。



上海医药集团股份有限公司



董事会



二零一七年三月二十三日




[点击查看PDF原文]
提示：本网不保证其真实性和客观性，一切有关该股的有效信息，以交易所的公告为准，敬请投资者注意风险。
展开阅读全文"
601607:上海医药关于聘请会计师事务所的公告,"https://guba.eastmoney.com/news,601607,619943516.html",2017-03-22 18:18:36,"公告日期：2017-03-23
证券代码：601607 证券简称：上海医药 编号：临2017-015



债券代码：136198 债券简称：16 上药01



上海医药集团股份有限公司



关于聘请会计师事务所的公告



本公司董事会及全体董事保证本公告内容不存在任何虚假记载、误导性陈述或者重大遗漏，并对其内容的真实性、准确性和完整性承担个别及连带责任。



上海医药集团股份有限公司（以下简称“公司”）于2017年3月21日召开



的第六届董事会第五次会议审议通过了《关于聘请会计师事务所的议案》。



鉴于普华永道中天会计师事务所（特殊普通合伙）、罗兵咸永道会计师事务所为具有证券相关业务资格的国际知名会计师事务所，对Ａ股和Ｈ股均有较为丰富的审计经验，对国内、国际会计准则理解较为深刻，可以同时满足中国大陆和香港两地监管机构和投资者的要求。公司拟续聘普华永道中天会计师事务所（特殊普通合伙）为公司2017年度境内审计机构，拟续聘罗宾咸永道会计师事务所为公司2017年度境外审计机构。



该议案尚需提交公司股东大会审议。



特此公告。



上海医药集团股份有限公司



董事会



二零一七年三月二十三日




[点击查看PDF原文]
提示：本网不保证其真实性和客观性，一切有关该股的有效信息，以交易所的公告为准，敬请投资者注意风险。
展开阅读全文"
601607:上海医药:内部控制审计报告,"https://guba.eastmoney.com/news,601607,619883268.html",2017-03-22 15:40:06,"公告日期：2017-03-23
601607:上海医药:内部控制审计报告
[点击查看PDF原文]
提示：本网不保证其真实性和客观性，一切有关该股的有效信息，以交易所的公告为准，敬请投资者注意风险。"
扣非净利润增长加速，分销业务增长趋势良好,"https://guba.eastmoney.com/news,601607,619803035.html",2017-03-22 13:31:41,
子弹准备就绪，冲冲冲！,"https://guba.eastmoney.com/news,601607,619852101.html",2017-03-22 14:46:25,子弹准备就绪，冲冲冲！
这类股票的行情有一个极重要的特点就是,"https://guba.eastmoney.com/news,601607,619677548.html",2017-03-22 09:52:18,这类股票的行情有一个极重要的特点就是
昨发了18个公告真心不值钱啊,"https://guba.eastmoney.com/news,601607,619762495.html",2017-03-22 12:01:59,昨发了18个公告真心不值钱啊
若连续多日无法超过前一天最高价,"https://guba.eastmoney.com/news,601607,619731236.html",2017-03-22 11:04:35,若连续多日无法超过前一天最高价
便有滞涨转弱之迹象,"https://guba.eastmoney.com/news,601607,619731055.html",2017-03-22 11:04:23,便有滞涨转弱之迹象
工商业龙头根基扎实，业绩增长稳健,"https://guba.eastmoney.com/news,601607,619678153.html",2017-03-22 09:53:03,
",利用上下震荡洗盘","https://guba.eastmoney.com/news,601607,619676937.html",2017-03-22 09:51:41,",利用上下震荡洗盘"
将没有耐心的跟风盘和短线客清洗出局,"https://guba.eastmoney.com/news,601607,619676583.html",2017-03-22 09:50:33,将没有耐心的跟风盘和短线客清洗出局
绩优大牛股！,"https://guba.eastmoney.com/news,601607,619672572.html",2017-03-22 09:45:20,绩优大牛股！
601607:上海医药关于拟发行债务融资产品的公告,"https://guba.eastmoney.com/news,601607,619523911.html",2017-03-21 19:42:45,"公告日期：2017-03-22
证券代码：601607 证券简称：上海医药 编号：临2017－011



债券代码：136198 债券简称：16上药 01



上海医药集团股份有限公司



关于拟发行债务融资产品的公告



本公司董事会及全体董事保证本公告内容不存在任何虚假记载、误导性陈述或者重大遗漏，并对其内容的真实性、准确性和完整性承担个别及连带责任。



为进一步拓宽上海医药集团股份有限公司（以下简称“公司”或“本公司”）融资渠道，优化公司债务结构,合理控制财务成本，同时使公司能够灵活选择融资工具， 及时满足资金需求，根据相关规定，公司拟发行不超过等值于70亿元人民币的债务融资产品，包括短期融资券、超短期融资券、中期票据、公司债券、资产支持证券和其他短期及中长期债务融资产品。



一、发行方案



1、发行规模



公司拟申请发行不超过等值于70亿元人民币的债务融资产品，包括短期融资券、



超短期融资券、中期票据、公司债券、资产支持证券和其他短期及中长期债务融资产品。



2、发行时间



公司将根据实际资金需求情况，在相关产品监管审批或注册有效期内一次性或分期发行。



3、募集资金用途



公司发行债务融资产品募集的资金将用于补充公司营运资金，偿还债务等。



4、发行期限



公司拟注册发行的各类短期债务融资产品的融资期限不超过1年（含1年），



拟注册发行的各类中长期债务融资产品的融资期限不超过5年（含5年），具体发



行期限将根据公司的资金需求以及市场情况确定。



5、决议有效期



本决议的有效期为经公司股东大会审议通过之日起12个月，或者公司股东大会



就此作出新的决议之日起，以孰早为准。



二、发行相关的授权事项



为更好的把握债务融资产品的发行时机，提高融资效率，特提请股东大会授权本公司董事会并由董事会转授权董事会执行委员会全权办理债务融资产品发行相关具体事宜，包括但不限于：



1、依据国家法律法规、监管部门的有关规定和政策及公司股东大会、董事会决议，制定和实施发行的具体方案、决定债务融资产品发行上市的具体事宜，包括但不限于根据公司需要及市场情况与主承销商协商确定或调整发行的品种、各品种金额、是否分期发行及在注册通知书或监管批文有效期内决定各期限发行金额的安排、发行时机、还本付息的期限和方式、发行方式、是否设置回售条款或赎回条款、确定并聘请中介机构、承销方式、定价方式、票面利率或确定方式、募集资金使用的具体细节、偿债保证措施、担保等增信事项、债务融资产品上市与发行等。



2、根据监管机构意见和/或市场条件的变化，对发行方案及发行相关文件进行必要的修改和调整。



3、代表公司进行债务融资产品发行、上市相关的谈判，签署与债务融资产品发行及上市相关的合同、协议等法律文件，进行适当的信息披露。



4、采取所有必要的行动，决定/办理其他与发行、上市相关的具体事宜。



5、上述授权事项自股东大会审议通过之日起12个月内有效。



三、发行相关的审批程序



本次公司发行债务融资产品的发行方案及授权事项尚需提交公司股东大会审议批准，并报相关主管部门获准发行后方可实施。公司将按照有关法律、法规的规定及时披露相关发行情况。



特此公告。



上海医药集团股份有限公司



董事会



二零一七年三月二十二日




[点击查看PDF原文]
提示：本网不保证其真实性和客观性，一切有关该股的有效信息，以交易所的公告为准，敬请投资者注意风险。
展开阅读全文"
上海医药净利润率才百分之三 还不如存三年定期  为何,"https://guba.eastmoney.com/news,601607,619652991.html",2017-03-22 09:04:18,上海医药净利润率才百分之三 还不如存三年定期 为何
美国给中国送来礼包，它可能改变历史,"https://guba.eastmoney.com/news,601607,619603209.html",2017-03-22 00:54:16,老美的几个最新数据看起来不错。石油，黄金，大
智能汽车产业规划望年内出台 带动三大产业升级,"https://guba.eastmoney.com/news,601607,619567468.html",2017-03-21 22:01:40,没人追高 打的在高也是回落
601607:上海医药关于2017年度担保计划的公告,"https://guba.eastmoney.com/news,601607,619523623.html",2017-03-21 19:41:51,"公告日期：2017-03-22
证券代码：601607 证券简称：上海医药 编号：临2017－010



债券代码：136198 债券简称：16上药 01



上海医药集团股份有限公司



关于2017年度担保计划的公告



本公司董事会及全体董事保证本公告内容不存在任何虚假记载、误导性陈述或者重大遗漏，并对其内容的真实性、准确性和完整性承担个别及连带责任。



重要内容提示:



2017年度，上海医药集团股份有限公司（以下简称“本公司”、“公司”或



“上海医药”）及下属子公司预计提供不超过等值于人民币1,348,139.90



万元（下同）担保，占2016年12月31日本公司经审计归属于上市公



司股东净资产的42.63%。其中：上海医药本部2017年度对外担保计划



额度为人民币226,000万元，涉及被担保单位4家；上海医药的控股子



公司2017年度对外担保计划额度为人民币832,139.90万元，涉及被担



保单位68家；上海医药本部及控股子公司对2017年预计新增合并范围



业务提供的担保计划额度为人民币290,000万元。



截至公告披露日，本公司及控股子公司实际对外担保余额为人民币



219,795.85万元，占2016年12月31日公司经审计归属于上市公司股东



的净资产的6.95%。



2017年度对外担保计划中提供的担保均按股比提供或有反担保保障。



截至公告披露日，本公司及控股子公司无逾期担保事项。



一、担保情况概述



为适应本公司业务发展需要，满足本公司及下属子公司担保融资需求，经本公司第六届董事会第五次会议审议通过，同意2017年度本公司及下属子公司预计提供不超过等值于人民币1,348,139.90万元的担保，并提交本公司股东大会审议，同时拟提请股东大会授权本公司董事会并由董事会转授权公司管理层在上述担保额度内按公司担保管理制度相关规定负责落实担保的具体实施工作。



上述担保计划决议的有效期自2016年度股东大会批准之日起至2017年度股



东大会召开之日止。



（一）上海医药本部2017年度对外担保计划额度为人民币226,000万元。



上述担保涉及被担保单位4家，明细为：



单位：人民币，万元



被担保方



序 是否为公 计划担保 是否按股比担保



号 担保方名称 被担保方名称 司合并报 额度 担保方式 或有反担保



表范围内



企业



上海医药集团股 中国国际医药（控 是 连带责任担保 按股比担保



1 份有限公司 股）有限公司 130,000



上海医药集团股上海实业医药科 是 连带责任担保 按股比担保



2 份有限公司 技(集团)有限公司 55,000



Vitaco Health



上海医药集团股 Limited、 按股比担保或有



3 份有限公司 Vitaco Health 是 41,000 连带责任担保 反担保



……
[点击查看PDF原文]
提示：本网不保证其真实性和客观性，一切有关该股的有效信息，以交易所的公告为准，敬请投资者注意风险。
展开阅读全文"
601607:上海医药2017年度日常关联交易公告,"https://guba.eastmoney.com/news,601607,619523517.html",2017-03-21 19:41:30,"公告日期：2017-03-22
证券代码：601607 证券简称：上海医药 编号：临2017－008



债券代码：136198 债券简称：16上药 01



上海医药集团股份有限公司



2017年度日常关联交易公告



本公司董事会及全体董事保证本公告内容不存在任何虚假记载、误导性陈述或者重大遗漏，并对其内容的真实性、准确性和完整性承担个别及连带责任。



重要内容提示：



本公司预计2017年度日常关联交易金额占本公司最近一期经审计净资产绝对值低



于5%，不需要提交股东大会审议。



本次日常关联交易系本公司日常经营所需,属于正常经营行为,以市场价格为基础



协商定价,公平合理,对本公司持续经营能力、盈利能力及资产独立性等不会产生不利影响,不会对关联方形成较大依赖。



一、日常关联交易基本情况



（一）日常关联交易履行的审议程序



本公司第六届五次董事会于2017年3月21日审议通过了《关于2017年度日常关联交



易/持续关连交易的议案》，预计的2017年度日常关联交易金额将不超过人民币14,550万元，



占本公司最近一期经审计净资产绝对值低于5%，不需要提交股东大会审议。



本次日常关联交易符合《公司法》、《证券法》、《股票上市规则》和《公司章程》等有关规定。本次日常关联交易已经获得独立董事事前认可，并由其发表了独立意见。本次日常关联交易必要且持续，不影响公司的独立性。交易价格按市场价格确定，定价公允、合理。不存在损害公司及股东特别是中、小股东利益的情形。董事会审议日常关联交易时，公司关联董事周军主动回避了《关于2017年度日常关联交易/持续关连交易的议案》的表决，八位非关联董事全部投票同意，表决程序合法有效。



其他正在执行的日常关联交易实际履行情况详见本公司于同日公布的公告临2017-009



号《关于追认2016年度与江西南华医药有限公司日常关联交易超额部分的公告》。



（二）前次日常关联交易的预计和执行情况



1、本公司于2016年3月18日召开的五届二十一次董事会通过《关于公司2016年度日



常关联交易/持续关连交易的议案》：2016年1-12月，本公司及附属企业与上实集团及其附



属企业、上海上实及其附属企业（包括上药集团及其附属企业）预计发生日常关联交易将不超过人民币14,000万元。其中：向上实集团及其附属企业、上海上实及其附属企业(包括上药集团及其附属企业)销售产品、提供劳务等将不超过人民币1,000万元；向上实集团及其



附属企业、上海上实及其附属企业(包括上药集团及其附属企业)采购产品、接受劳务等将不超过人民币3,000万元；向上药集团及其附属企业承租房屋及生产设备等将不超过人民币10,000万元（详见公司公告临2016-015号）。本公司及附属企业2016年1—12月日常关联交易实际金额未超过上述董事会批准之金额，具体如下：



单位：人民币，万元



关联交易类别 关联人 上年（前次）上年（前次）实预计金额与实际发



预计金额 际发生金额 生金额差异较大的



原因



向关联人购买 上海新先锋药业有限公司 2,950.00 -



原材料及设备 小计 2,950.00 -



向关联人提供 上海英达莱物业有限公司 500.00 421.75



上海新先锋药业有限公司 500.00 61.60 实际发生金额小于



劳务 预计金额的主要原



小计 1,000.00 483.35 因是由于未发生相



上海上投招标有限公……
[点击查看PDF原文]
提示：本网不保证其真实性和客观性，一切有关该股的有效信息，以交易所的公告为准，敬请投资者注意风险。
展开阅读全文"
601607:上海医药第六届监事会第四次会议决议公告,"https://guba.eastmoney.com/news,601607,619523516.html",2017-03-21 19:41:30,"公告日期：2017-03-22
证券代码：601607 证券简称：上海医药 编号：临2017－007



债券代码：136198 债券简称：16上药 01



上海医药集团股份有限公司



第六届监事会第四次会议决议公告



本公司监事会及全体监事保证本公告内容不存在任何虚假记载、误导性陈述或者重大遗漏，并对其内容的真实性、准确性和完整性承担个别及连带责任。



一、监事会会议召开情况



上海医药集团股份有限公司（以下简称“本公司”）第六届监事会第四次会议（以下简称“本次会议”）于2017年3月21日在上海市太仓路200号召开。会议通知于2017年3月6日以电子邮件的形式送达公司全体监事。本次会议应到监事3名，实到监事3名，符合《中华人民共和国公司法》和本公司章程关于监事会召开法定人数的规定。本次会议由徐有利监事长主持。



二、监事会会议审议情况



本次会议审议通过以下议案：



1、《上海医药集团股份有限公司2016年度监事会工作报告》



该报告尚需提交股东大会审议。



表决结果：赞成3票，反对0票，弃权0票。



2、《上海医药集团股份有限公司2016年度财务决算报告》



该议案尚需提交股东大会审议。



表决结果：赞成3票，反对0票，弃权0票。



3、《上海医药集团股份有限公司2016年年度报告及摘要》



内容详见上海证券交易所网站www.sse.com.cn。



该议案尚需提交股东大会审议。



表决结果：赞成3票，反对0票，弃权0票



4、《上海医药集团股份有限公司2016年度利润分配预案》



该议案尚须提交股东大会审议。



表决结果：赞成3票，反对0票，弃权0票。



5、《上海医药集团股份有限公司关于支付2016年度审计费用的议案》



该议案尚需提交股东大会审议。



表决结果：赞成3票，反对0票，弃权0票。



6、《上海医药集团股份有限公司2017年度财务预算报告》



该议案尚需提交股东大会审议。



表决结果：赞成3票，反对0票，弃权0票



7、《上海医药集团股份有限公司关于变更内部职工股和职工持股会承诺的议案》



该议案尚需提交股东大会审议。



表决结果：赞成3票，反对0票，弃权0票



（以上2、3、4、5、6、7项内容详见本公司公告临2017-006号）



特此公告。



上海医药集团股份有限公司



监事会



二零一七年三月二十二日




[点击查看PDF原文]
提示：本网不保证其真实性和客观性，一切有关该股的有效信息，以交易所的公告为准，敬请投资者注意风险。
展开阅读全文"
601607:上海医药独立董事的独立意见(1),"https://guba.eastmoney.com/news,601607,619522976.html",2017-03-21 19:39:47,"公告日期：2017-03-22
601607:上海医药独立董事的独立意见
[点击查看PDF原文]
提示：本网不保证其真实性和客观性，一切有关该股的有效信息，以交易所的公告为准，敬请投资者注意风险。"
22.75-22.80逃逃逃逃,"https://guba.eastmoney.com/news,601607,619425393.html",2017-03-21 14:50:52,
泪大喜奔啊这货二年了没涨过4个点,"https://guba.eastmoney.com/news,601607,619338224.html",2017-03-21 11:29:36,泪大喜奔啊这货二年了没涨过4个点
万亿电视市场有望重塑,"https://guba.eastmoney.com/news,601607,619384128.html",2017-03-21 13:41:20,中医药法通过 利好产业发展
高出1分出逃逃,"https://guba.eastmoney.com/news,601607,619379207.html",2017-03-21 13:33:39,
MACD绿柱倒鸭嘴己形成，逢反弹清仓。,"https://guba.eastmoney.com/news,601607,619043547.html",2017-03-20 16:50:03,MACD绿柱倒鸭嘴己形成，逢反弹清仓。
上海医药起飞在即,"https://guba.eastmoney.com/news,601607,615895389.html",2017-03-10 10:07:44,上海医药起飞在即
说什么都没用，这涨那涨，反正股民的资金不涨。再说没信的了,"https://guba.eastmoney.com/news,601607,618962522.html",2017-03-20 13:55:50,说什么都没用，这涨那涨，反正股民的资金不涨。再说没信的了
全球的股市都是慢牛，唯有大A股一直熊市无限期，人家一直慢牛，一直新高,"https://guba.eastmoney.com/news,601607,618962166.html",2017-03-20 13:55:03,全球的股市都是慢牛，唯有大A股一直熊市无限期，人家一直慢牛，一直新高
这个垃圾永远就能跟欧菲光后面提鞋，欧菲光已经起飞了，你还在后面,"https://guba.eastmoney.com/news,601607,618937246.html",2017-03-20 13:10:32,这个垃圾永远就能跟欧菲光后面提鞋，欧菲光已经起飞了，你还在后面
光控基因编辑器有望关闭致癌基因 4股望爆发 来,"https://guba.eastmoney.com/news,601607,618915268.html",2017-03-20 11:44:42,冬播春耕正当时 提前布局两类股
真慘，股本是你十分之一的股票，成交量都比你大，真的只剩小散在玩了,"https://guba.eastmoney.com/news,601607,618892834.html",2017-03-20 11:02:37,真慘，股本是你十分之一的股票，成交量都比你大，真的只剩小散在玩了
没有对手。无人之境,"https://guba.eastmoney.com/news,601607,618863713.html",2017-03-20 10:12:54,上海医药就没有玩。
摩根大通减持上海医药14万股 套现317万港币,"https://guba.eastmoney.com/news,601607,560321391.html",2016-10-20 08:28:31,港交所最新资料显示，上海医药(02607)主要股东摩根大通于2016年10月12日，场内减持公司好仓14.99万股，套现317.09846万港币，成交均价21.154港币，最高成交价21.167港币。变动后持有权益8411.2091万股，于公司已发行股份占比10.98%。(双双
本周四下午两点买，天机不可泄漏，信则有，不信则无。,"https://guba.eastmoney.com/news,601607,559501696.html",2016-10-17 22:41:59,本周四下午两点买，天机不可泄漏，信则有，不信则无。
