标题,链接,发布时间,内容
遭举牌 反击注入优质资产 ：银座股份600858 必,"https://guba.eastmoney.com/news,601607,618832469.html",2017-03-20 09:18:09,大数据产业十三五规划年内发布（附概念股）
刘明忠：打造产融一体企业集团,"https://guba.eastmoney.com/news,601607,618827788.html",2017-03-20 08:59:54,成交惨不忍赌，央行加息，房价暴跌成落汤鸡吗？
东风破东风破东风破,"https://guba.eastmoney.com/news,601607,618796204.html",2017-03-20 01:06:58,东风破
房子是用来住的、不是用来炒的,"https://guba.eastmoney.com/news,601607,618751933.html",2017-03-19 18:59:28,那就是扎堆卖房
神华牛逼。谁知道上海医药的分红,"https://guba.eastmoney.com/news,601607,618735224.html",2017-03-19 17:01:05,rt
电子陶瓷应用不断拓展 氧化锆材料将逐步放量,"https://guba.eastmoney.com/news,601607,618481056.html",2017-03-18 00:56:34,药品市场准入放开 增量品种有望受益
此股目前不要想它大涨大跌，有人还没有买够，拿它做市值打打新股不错，安全[微笑],"https://guba.eastmoney.com/news,601607,618449768.html",2017-03-17 21:55:44,此股目前不要想它大涨大跌，有人还没有买够，拿它做市值打打新股不错，安全
但今年11月26日,"https://guba.eastmoney.com/news,601607,618440120.html",2017-03-17 21:19:12,首先就要将这个漏洞堵死
再调整调整，后面定能一飞冲天,"https://guba.eastmoney.com/news,601607,618341293.html",2017-03-17 15:33:38,再调整调整，后面定能一飞冲天
上海医药作为龙头之一，分销业务将通过内生、外延双重动力，实现高于行业平均的增长,"https://guba.eastmoney.com/news,601607,618341022.html",2017-03-17 15:32:15,上海医药作为龙头之一，分销业务将通过内生、外延双重动力，实现高于行业平均的增长
@小蜜蜂3号 [不说了]。。。。。。。。。。。,"https://guba.eastmoney.com/news,601607,618144662.html",2017-03-17 09:12:08,月线收官战明天将打响，阳线收官已无悬念，是诱
买股被套后怎么样才能快速解套？,"https://guba.eastmoney.com/news,601607,618068296.html",2017-03-16 22:44:20,"买股被套后怎么样才能快速解套？
"
空头我跟你这仗打定了，你压，我加码有本事破我21.73元,"https://guba.eastmoney.com/news,601607,617888084.html",2017-03-16 14:09:52,空头我跟你这仗打定了，你压，我加码
IPO加速冲击“壳”价值 投资者可把握结构性行情,"https://guba.eastmoney.com/news,601607,618074075.html",2017-03-16 23:07:27,东兴证券：华东医药强烈推荐评级
斗倒底--斗倒底,"https://guba.eastmoney.com/news,601607,617913433.html",2017-03-16 14:48:55,
加息利空兑现变利好！2017是智能年？,"https://guba.eastmoney.com/news,601607,618030635.html",2017-03-16 20:40:21,"加息利空兑现变利好！2017是智能年？
"
根本就是死股。,"https://guba.eastmoney.com/news,601607,617904168.html",2017-03-16 14:34:28,没有人玩。老庄在都咳嗽。
上周基金调研27家上市公司 医药相关行业受关注,"https://guba.eastmoney.com/news,601607,617935766.html",2017-03-16 15:34:31,调整为主 短期无趋势性行情
自选股里就你绿，nnd.,"https://guba.eastmoney.com/news,601607,617902856.html",2017-03-16 14:32:35,自选股里就你绿，nnd.
21.75-21.80-再吃再吃,"https://guba.eastmoney.com/news,601607,617891430.html",2017-03-16 14:14:52,
21.74-吃吃吃吃吃吃,"https://guba.eastmoney.com/news,601607,617889996.html",2017-03-16 14:13:14,
头肩顶已现，清仓！,"https://guba.eastmoney.com/news,601607,617887589.html",2017-03-16 14:09:07,头肩顶已现，清仓！
好再砸--正长,"https://guba.eastmoney.com/news,601607,617877810.html",2017-03-16 13:53:37,
业绩优良的品种还有机会,"https://guba.eastmoney.com/news,601607,617832243.html",2017-03-16 11:59:00,"业绩优良的品种还有机会
"
要注意MACD绿柱出现倒鸭嘴走势。,"https://guba.eastmoney.com/news,601607,617828368.html",2017-03-16 11:46:20,要注意MACD绿柱出现倒鸭嘴走势。
是只阳痿的票。没戏了[不赞],"https://guba.eastmoney.com/news,601607,565958314.html",2016-11-07 03:13:27,
看好,"https://guba.eastmoney.com/news,601607,558581098.html",2016-10-14 09:14:55,看好
二是作出明确的规定,"https://guba.eastmoney.com/news,601607,616492072.html",2017-03-12 20:14:47,不过先是12月3日
不惜丢掉,"https://guba.eastmoney.com/news,601607,617609062.html",2017-03-15 19:41:03,不惜丢掉
主力积极信号 今日大盘或有巨变,"https://guba.eastmoney.com/news,601607,617613053.html",2017-03-15 19:54:08,"主力积极信号 今日大盘或有巨变
"
稀缺标的重,"https://guba.eastmoney.com/news,601607,617609289.html",2017-03-15 19:41:52,稀缺标的重
总体风险,"https://guba.eastmoney.com/news,601607,617608932.html",2017-03-15 19:40:43,总体风险
上海医药还是,"https://guba.eastmoney.com/news,601607,617608287.html",2017-03-15 19:38:02,上海医药还是
业绩，总市值，行业地位各方面看，上海医药还是可以持有的！！,"https://guba.eastmoney.com/news,601607,572204552.html",2016-11-24 15:36:40,耐心持有，逢低加仓！
08月31日(周三)大盘前瞻:压制盘面存深意 或只为,"https://guba.eastmoney.com/news,601607,617426781.html",2017-03-15 11:43:28,"儿童用药概念价格太高了,有回调的可能吗？"
人工智能最具潜力的龙头－－银信科技－盘小绩优 股价低 高成长性 肯定一飞冲天 机会来了,"https://guba.eastmoney.com/news,601607,617347401.html",2017-03-15 09:28:00,银信科技300231是人工智能+大数据+IT服务的先驱+云计算运维龙头 主导未来世界的仍然是人工智能、大数据和IT业！
MA日线四线聚焦，双针立地，KDJ金叉，MACD绿柱缩短，即将水上金叉，岂能不涨,"https://guba.eastmoney.com/news,601607,616715981.html",2017-03-13 14:35:44,MA日线四线聚焦，双针立地，KDJ金叉，MACD绿柱缩短，即将水上金叉，岂能不涨？
机构观点：券商改革突破超预期，千呼万唤组,"https://guba.eastmoney.com/news,601607,617313028.html",2017-03-15 06:07:38,广西物流产业龙头；三季报业绩每股收益0.50元.5
上海医药值得相信！！,"https://guba.eastmoney.com/news,601607,615920064.html",2017-03-10 10:46:58,上海医药值得相信！！
牛股到 人工智能是当今市场最热门的题材 游资主力开始建仓金融股中的人工智能龙头银信科技 坚决买入 长线持有 必有厚报,"https://guba.eastmoney.com/news,601607,617092473.html",2017-03-14 14:23:01,"银信科技300231是人工智能的金融股外加大数据和IT行业龙头股 主导未来世界的仍然是人工智能、大数据和IT业！合理价应在30元之上
不要融资买股和买融资标的 一跌抛盘很多 大盘股都没人炒了 套牢盘太多了"
大利好，601607,"https://guba.eastmoney.com/news,601607,617114123.html",2017-03-14 14:59:13,ＲＴ
本月是中小创高送转最高潮期，赶紧带上钱袋子买冰川网络，连板行情要启动了,"https://guba.eastmoney.com/news,601607,616988384.html",2017-03-14 10:24:14,盘子小，业绩好，指标到位，无套牢，2017最赚钱的游戏行业，只等大佬来拉
M头了，大家快跑,"https://guba.eastmoney.com/news,601607,615943862.html",2017-03-10 11:27:35,M头了，大家快跑
内陆自贸区申建步入冲刺阶段 重庆或入列首批内,"https://guba.eastmoney.com/news,601607,616811441.html",2017-03-13 19:11:23,见兔撒鹰，蛇打七寸
深交所发布深港通细则 超级利好券商板块 国海证,"https://guba.eastmoney.com/news,601607,616798168.html",2017-03-13 18:15:30,PPP与健康中国概念有望反复活跃
割肉了~,"https://guba.eastmoney.com/news,601607,616731176.html",2017-03-13 15:00:49,割肉了~
上海医药,"https://guba.eastmoney.com/news,601607,615923395.html",2017-03-10 10:52:09,作为国内第三大药品流通商，上海医药现有分销网路覆盖21省，目前正积极实施并购策略，将打造一省一平台，未来将扩展到28个省份，其中西南及东北地区将是扩张重点，16年三季度公司已在云南和黑龙江布局。我们相信，两票制及营改增改革有望助力公司加速并购布局。公司亦预期，并购增量预计每年将贡献3-4个百分点的增量。同时，通过分销产品结构调整、规模集约等方式，公司分销业务盈利能力亦有望维持稳定。
M頭~,"https://guba.eastmoney.com/news,601607,616726512.html",2017-03-13 14:52:15,M頭~
大神解读下韩国为毛要部署萨德？,"https://guba.eastmoney.com/news,601607,616573921.html",2017-03-13 09:36:08,大神解读下韩国为毛要部署萨德？
跑吧！新股发的太多了，市场难以承受！,"https://guba.eastmoney.com/news,601607,616573753.html",2017-03-13 09:35:36,跑吧！新股发的太多了，市场难以承受！
我花钱买格力空调的郁闷和找罪受的过程,"https://guba.eastmoney.com/news,601607,616569096.html",2017-03-13 09:24:49,债转股实施渐进 受益三主线：
上海自由贸易试验区人工智能龙头科大智能300222是当今市场最热门的题材 将一飞冲天上百元！机会,"https://guba.eastmoney.com/news,601607,616516748.html",2017-03-12 23:17:31,上海自由贸易试验区人工智能龙头科大智能300222是当今市场最热门的题材 将一飞冲天上百元！
601607:上海医药澄清公告,"https://guba.eastmoney.com/news,601607,616143351.html",2017-03-10 20:22:21,"公告日期：2017-03-11
证券代码：601607 证券简称：上海医药 编号：临2017-005



债券代码：136198 债券简称：16上药01



上海医药集团股份有限公司



澄清公告



本公司董事会及全体董事保证本公告内容不存在任何虚假记载、误导性陈述或者重大遗漏，并对其内容的真实性、准确性和完整性承担个别及连带责任。



一、传闻简述



近日，Bloomberg新闻社发布报道称：私募基金CVC Capital Partners与



中国制药公司上海医药集团股份有限公司（以下简称“本公司”、“公司”）正在商讨联合竞购德国制药公司 Stada Arzneimittel AG公司（以下简称“Stada”）的有关交易。



二、澄清声明



上海医药集团股份有限公司就相关报告内容进行了核实，现澄清说明如下：国际化发展是公司十三五规划期间的重要战略举措，公司持续关注海外优质资产的并购机会。本公司近期与多个欧美医药企业进行过初步接触，目前没有向包括 Stada 在内的任何一家公司发出过正式意向。本公司目前生产经营情况正常，不存在应披露而未披露事项，后续公司将遵照法律法规及上市规则等要求，根据项目进展及时履行信息披露义务。



本公司郑重提醒广大投资者，上海证券交易所网站



(http://www.sse.com.cn）、香港联合交易所有限公司网站



（http://www.hkexnews.hk）、《上海证券报》和《证券时报》为公司指定信息披露媒体，本公司发布的信息以在上述指定网站、报刊刊登的公告为准，敬请投资者理性投资，注意风险。



特此公告。



上海医药集团股份有限公司



董事会



二零一七年三月十一日




[点击查看PDF原文]
提示：本网不保证其真实性和客观性，一切有关该股的有效信息，以交易所的公告为准，敬请投资者注意风险。
展开阅读全文"
尤其是业绩亏损公司,"https://guba.eastmoney.com/news,601607,616483325.html",2017-03-12 19:04:58,上市公司进行定向增发
果股友有任何大盘及2涨停节奏呀！！！呵呵呵呵,"https://guba.eastmoney.com/news,601607,616470494.html",2017-03-12 17:28:12,2涨停节奏呀！！！呵呵呵呵
老百姓用药更便利了～,"https://guba.eastmoney.com/news,601607,616470528.html",2017-03-12 17:28:04,老百姓用药更便利了～
出售空闲的或投资性的非生产性房产,"https://guba.eastmoney.com/news,601607,616439649.html",2017-03-12 13:23:05,以及住宅所带的11个车位
上海医药：未向Stada发出过正式并购意向,"https://guba.eastmoney.com/news,601607,616149570.html",2017-03-10 20:47:19,"来源：中国证券网
　　上海医药10日晚间公告，近日有媒体报道称，私募基金CVC Capital Partners与公司正在商讨联合竞购德国制药公司Stada的有关交易。对此，公司表示，公司近期与多个欧美医药企业进行过初步接触，目前没有向包括Stada在内的任何一家公司发出过正式意向。本公司目前生产经营情况正常，不存在应披露而未披露事项。
（来源：中国证券网 2017-03-10 20:45）[点击查看原文]"
上海医药：未向德国制药公司Stada发出正式并购意向,"https://guba.eastmoney.com/news,601607,616154765.html",2017-03-10 21:07:32,"来源：证券时报网
　　上海医药(601607)3月10日晚间公告，近日有媒体报道称，私募基金CVC Capital Partners与公司正商讨联合竞购德国制药公司Stada。经核实，公司近期与多个欧美医药企业进行过初步接触，目前没有向包括Stada在内的任何一家公司发出过正式意向。
　　
（来源：证券时报网 2017-03-10 21:05）[点击查看原文]"
完全可以给优质公司以政策性支持,"https://guba.eastmoney.com/news,601607,616351439.html",2017-03-11 20:40:06,并且在定增股份解禁时
共持有家上市公司股份 鲁信创投 另有,"https://guba.eastmoney.com/news,601607,616200215.html",2017-03-11 01:44:21,年底环保股要大涨四成？珠三角万千企业停产环保
胃癌新药，岳阳兴长，胃癌疫苗，芜湖康卫,"https://guba.eastmoney.com/news,601607,616188807.html",2017-03-10 23:51:15,涨停预报：周二热点题材，这些股票先受益
上海医药深度报告：被低估的医药商业+工业龙头,"https://guba.eastmoney.com/news,601607,608391485.html",2017-02-14 10:00:25,"推荐逻辑：公司为医药流通未来“3+X”格局中的3大全国性流通企业之一，内生与外延均将受益于“两票制”新政，分销业务加速增长迹象明确；2）零售的DTP 药房存处方外流预期，工业领域长短期均有持续增长动力；3）上海市国企改革已启动，存员工持股预期；4）预计未来3 年利润复合增速13-15%，当前对应2017 年PE 仅15 倍，其估值被低估。

　　分销：借“两票制”东风，内生外延均迎来发展契机。“两票制”实施后，龙头公司将迎利好，未来医药流通格局呈“3+X”：“3”为全国性公司国药控股、华润医药、上海医药，其市占率合计约38%，预计3 年后达到50%以上；“X”

　　为区域性龙头，预计3 年后本省的市占率达30-50%。全国性龙头尚不存在成长天花板，公司商业将迎来内生和外延式增长。外延方面，上海医药是为数不多的、对大标的有并购能力的公司，外延动力充足，未来3 年发展目标是扩展到26-28 个省份；内生方面，公司前期已进行了良好的业务布局，目前覆盖全国三级医院比例从2013 年的27%提升至72%、覆盖医疗机构数超过2013 年的2倍，非优势区域业务迎来放量契机。预计未来3 年公司分销板块增速为约18%。

　　零售：“DTP+大健康云商”布局处方外流。处方外流为零售行业未来最大增长点，公司零售业态丰富，包括连锁药店、合办药房、DTP 药房等，可多方位承接处方外流。DTP 药房在公司零售板块中最具看点，该模式已打通处方药产业链，在新特药领域实现处方外流，公司目前拥有国内最大的DTP 业务，2015年销售额25 亿元，市占率约30%，且已与百余家医院实现HIS 系统的对接，有望抢占处方外流先机。公司正在通过“大健康云商”探索完整的互联网健康管理模式，打造医院、药企、药店、患者之间互联互通的平台，未来平台的盈利点或将从DTP 业务向健康管理延伸，实现互联网医疗盈利模式的落地。

　　工业：产品策略、医保目录调整、一致性评价、研发、制剂出口等酝酿长期增长。1）实行产品聚焦与渠道整合，占工业收入比重60%的高毛利率重点品种增速维持10-15%，盈利能力不断提升；2）重点品种双歧杆菌三联活菌、注射用二丁酰环磷腺苷钙、瓜蒌皮、多糖铁复合物、强肾片等（合计占工业收入比约10%）有望在2017 年新一轮医保目录调整中进入全国医保；3）2013 年提早布局一致性评价，已启动50 余个品种，有望占领市场先机；4）重视产品研发，研发支出占工业收入比例达5%，储备1 类新药多替泊芬、7 类新药TNFa 受体Fc 融合蛋白、2 类新药CD20 单抗等抗肿瘤、心血管领域的多个重磅品种；5）瑞舒伐他汀获FDA 批准，预计未来2 年将有10 多个品种在海外市场获批上市。

　　盈利预测与估值：采取相对估值，给予2017 年工业业务15 倍PE，商业业务25 倍PE，公司合理股价为27.95 元/股。公司各业务均是细分行业翘楚，龙头优势突出，在行业变革中强者恒强，布局的大健康等业务酝酿新增长点，且存国企改革预期。"
元股预计年每股收益.(元)  长源,"https://guba.eastmoney.com/news,601607,614769079.html",2017-03-07 12:59:09,贵广网络最低价小盘次新股 国企改革 低估元
参麦注射液、双黄连注射液、清开灵注射液、莲必治注射液、热毒宁注射液、喜炎平注射液,"https://guba.eastmoney.com/news,601607,613708890.html",2017-03-03 19:46:50,参麦注射液、双黄连注射液、清开灵注射液、莲必治注射液、热毒宁注射液、喜炎平注射液、鱼腥草注射液、痰热清注射液等都限二级及以上医疗机构使用。而这些使用受限的中药注射剂品种中，不乏一些销售额超亿元、甚至十亿元的产品。
过新年要太平那么太平洋下午收盘必须翻红盘涨不,"https://guba.eastmoney.com/news,601607,614032111.html",2017-03-05 06:38:50,为啥都是看多的
上药部分产品将有望率先完成评价并占领市场先机，从而赢得更大市场份额。,"https://guba.eastmoney.com/news,601607,615922825.html",2017-03-10 10:51:45,上药部分产品将有望率先完成评价并占领市场先机，从而赢得更大市场份额。
预计未来3年利润复合增速13-15%，当前对应2017年PE仅15倍，其估值被低估。,"https://guba.eastmoney.com/news,601607,615928806.html",2017-03-10 11:01:53,预计未来3年利润复合增速13-15%，当前对应2017年PE仅15倍，其估值被低估。
她突然重磅出手互联网金融！神！上海医药,"https://guba.eastmoney.com/news,601607,611248605.html",2017-02-23 11:04:32,"603000人民网联手中信恒达筹建“人民信金融” 预计2017年平台交易量30亿
· 零壹财经 · 2月06日 11:32

近日，由人民网和中信恒达支付有限公司联手筹建的“人民信金融”面向社会发出招聘消息，对市场、机构、产品、合规等多部门岗位人才进行招聘，要求应聘者至少需要有2~3年工作经验和经济、金融等相关专业学历。

招聘信息还显示，人民信金融目前业务共分为三个部分：资产拍卖、保险理财、资产交易，其预计2017年平台交易量为30亿元，预计网络司法拍卖交易量为8亿元。

人民信金融是人民网与中信资产旗下中信恒达支付联合筹建的互联网金融平台，该平台项目于2016年7月12日正式启动。"
上海医药的业绩这几年都是在稳步提升的,"https://guba.eastmoney.com/news,601607,615924951.html",2017-03-10 10:55:35,
只剩小散，弱勢,"https://guba.eastmoney.com/news,601607,615924352.html",2017-03-10 10:54:18,只剩小散，弱勢
国企改革下上药后续值得看好,"https://guba.eastmoney.com/news,601607,615924001.html",2017-03-10 10:53:54,国企改革下上药后续值得看好
上药重点品种已进入逾8省份的医保增补目录，将有望在2017年目录调整中进入全国医保，为公司发展带来新契机。,"https://guba.eastmoney.com/news,601607,615923218.html",2017-03-10 10:52:22,上药重点品种已进入逾8省份的医保增补目录，将有望在2017年目录调整中进入全国医保，为公司发展带来新契机。
上海医药作为龙头之一，分销业务将通过内生、外延双重动力，实现高于行业平均的增长,"https://guba.eastmoney.com/news,601607,615922834.html",2017-03-10 10:51:39,藉助两票制政策全国推行，上海医药作为龙头之一，分销业务将通过内生、外延双重动力，实现高于行业平均的增速。同时，医药零售布局亦将打造增长点。此外，提早布局仿制药一致性评价及多个品种有望于2017年进入国家医保目录，有望驱升医药工业板块增速。国企改革亦有望形成催化剂
国家级两票制推行，上药必然强者恒强,"https://guba.eastmoney.com/news,601607,615922354.html",2017-03-10 10:50:36,国家级两票制推行，上药必然强者恒强
上药以DTP特色的医药零售布局在国内亦处于领先地位，发展前景乐观。,"https://guba.eastmoney.com/news,601607,615921711.html",2017-03-10 10:49:27,上药以DTP特色的医药零售布局在国内亦处于领先地位，发展前景乐观。
上海医药现有分销网路覆盖达到了21省,"https://guba.eastmoney.com/news,601607,615921481.html",2017-03-10 10:49:24,上海医药现有分销网路覆盖达到了21省
上海医药作为行业龙头之一，分销业务将通过内生、外延双重动力，实现高于行业平均的增速,"https://guba.eastmoney.com/news,601607,615920861.html",2017-03-10 10:48:04,上海医药作为行业龙头之一，分销业务将通过内生、外延双重动力，实现高于行业平均的增速
上海医药的医药制造业务历来稳健发展，不过，新行业政策有望协助其发展提速,"https://guba.eastmoney.com/news,601607,615917691.html",2017-03-10 10:43:15,上海医药的医药制造业务历来稳健发展，不过，新行业政策有望协助其发展提速
我们相信，两票制及营改增改革有望助力公司加速并购布局。,"https://guba.eastmoney.com/news,601607,615916815.html",2017-03-10 10:41:36,我们相信，两票制及营改增改革有望助力公司加速并购布局。
让风暴来的更猛烈,"https://guba.eastmoney.com/news,601607,615913161.html",2017-03-10 10:36:00,2017年1月，卫计委正式印发“国家级”两票制方案，争取到2018年在全国全面推开。
本股的走势分析和重大注意事项 必看会发财的！机会来了,"https://guba.eastmoney.com/news,601607,612732803.html",2017-03-01 10:28:33,"银信科技300231 IT行业龙头股 正常合理价应在30元之上，主导未来世界的仍然是IT业及其服务业！
所有与人类活动相关的产业已经离不开IT服务业，移动互联，物联网，车联网，云网，移动支付等等等，都离不开IT服务，前景不可限量！
IT 基础设施第三方服务站上风口，迎来千亿市场空间：银行、电信、政府等重点行业用户的 IT 投资规模不断扩大，其对系统安全、稳定性要求也不断提高。数据中心 IT 基础设施服务市场在这些大型高端客户的带动之下快速发展。
融资股盘子大 套牢盘多 亏的机会多且每天要交利息 融资股的时代已经结束 不如小盘股升得快"
A股上市公司“上海医药”发布公告称,"https://guba.eastmoney.com/news,601607,615899116.html",2017-03-10 10:13:35,A股上市公司“上海医药”发布公告称，其境外全资子公司上海实业医药科技（集团）有限公司拟以自有资金2000万美元参与投资设立美国白沛思创投基金第五期。
本股的走势分析和重大注意事项 必看会发财的！,"https://guba.eastmoney.com/news,601607,612728958.html",2017-03-01 10:22:32,"银信科技300231 IT行业龙头股 正常合理价应在30元之上，主导未来世界的仍然是IT业及其服务业！
所有与人类活动相关的产业已经离不开IT服务业，移动互联，物联网，车联网，云网，移动支付等等等，都离不开IT服务，前景不可限量！
IT 基础设施第三方服务站上风口，迎来千亿市场空间：银行、电信、政府等重点行业用户的 IT 投资规模不断扩大，其对系统安全、稳定性要求也不断提高。数据中心 IT 基础设施服务市场在这些大型高端客户的带动之下快速发展。
融资股盘子大 套牢盘多 亏的机会多且每天要交利息 融资股的时代已经结束 不如小盘股升得快"
值得加仓,"https://guba.eastmoney.com/news,601607,615892841.html",2017-03-10 10:04:00,
这无疑是一条“金光大道”,"https://guba.eastmoney.com/news,601607,615890049.html",2017-03-10 09:59:47,这无疑是一条“金光大道”
支持优质公司做大做强,"https://guba.eastmoney.com/news,601607,615006616.html",2017-03-08 01:51:50,必须对上市公司高送转制度加以规范
