标题,链接,发布时间,内容
机构在5月7号就提前知晓利空消息，还诱骗散户接盘，可耻的媒体,"https://guba.eastmoney.com/news,002366,762991275.html",2018-05-29 09:48:12,机构在5月7号就提前知晓利空消息，还诱骗散户接盘，可耻的媒体，我差点就上当了，五月七号那天台海突然放大量，看腾讯财经报道说该股有机构大量买入抄底，当时看起来还真像那么回事，差点就冲动买入了，按照当时的价格买入，每股损失在七块多了，这是彻彻底底的拉高诱骗出货，草，股市太凶险了，搞完这波销户认输，永远不踏足股市了！
3个跌停就差不多了,"https://guba.eastmoney.com/news,002366,762990712.html",2018-05-29 09:47:05,3个跌停就差不多了
存点米，,"https://guba.eastmoney.com/news,002366,762988995.html",2018-05-29 09:44:01,66
唉，无语了,"https://guba.eastmoney.com/news,002366,762986792.html",2018-05-29 09:40:10,唉，无语了
该公司自己都不关心自己的估价了，太费了,"https://guba.eastmoney.com/news,002366,762986341.html",2018-05-29 09:39:24,该公司自己都不关心自己的估价了，太费了
入米半A,"https://guba.eastmoney.com/news,002366,762984466.html",2018-05-29 09:35:42,66
感觉利用利空消息打压吸筹,"https://guba.eastmoney.com/news,002366,762982393.html",2018-05-29 09:30:55,感觉利用利空消息打压吸筹
欲盖弥彰，揭开的全是骗局！,"https://guba.eastmoney.com/news,002366,762982529.html",2018-05-29 09:31:17,"可怜的小散，还在掩耳盗铃。内部人早已不是秘密...
乐视网第二，乐视网第三..."
早盘一股：天泽信息,"https://guba.eastmoney.com/news,002366,762981872.html",2018-05-29 09:29:25,早盘一股：天泽信息
我们的损失太大了，公司真没有问题，必须通过法律途径维护公司及其投资者的合法权益。,"https://guba.eastmoney.com/news,002366,771002320.html",2018-07-06 09:20:00,"我们的损失太大了，公司真没有问题，必须通过法律途径维护公司及其投资者的合法权益。为啥不赶紧报警呢？公司的法律顾问是干什么的？关键时刻要起作用啊！公司不能手软。若真有问题，那就让西南证券负连带赔偿责任吧1
融发核电
台海核电：您好！公司于2018年5月29日披露了《关于媒体报道的澄清公告》（公告编号：2018-049），对于有关媒体或平台违规发布和传播未经核实且恶意揣测的误导性报道，给公司造成不良影响甚至损失的行为，公司保留通过法律途径维护公司合法权益的权利。谢谢！
(来自深交所互动易)答复时间 2018-07-06 09:20:00"
没有造假,"https://guba.eastmoney.com/news,002366,762979974.html",2018-05-29 09:24:13,媒体应该为此事负责，公司应该投诉新浪财金。
最近流行闪崩啊，到处是地雷！,"https://guba.eastmoney.com/news,002366,762979212.html",2018-05-29 09:22:04,最近流行闪崩啊，到处是地雷！
是不是报道不实，市场说的算。认为报道不实的，现在可以抄底了,"https://guba.eastmoney.com/news,002366,762978696.html",2018-05-29 09:20:31,是不是报道不实，市场说的算。认为报道不实的，现在可以抄底了
跌的时候不闻不问，涨的时候停牌问询,"https://guba.eastmoney.com/news,002366,762976981.html",2018-05-29 09:14:07,跌的时候不闻不问，涨的时候停牌问询！荒唐至极！
大买特买，买到庄生活不能自理,"https://guba.eastmoney.com/news,002366,762978071.html",2018-05-29 09:18:31,大买特买，买到庄生活不能自理
假如机构今天突然反转大涨怎么办？,"https://guba.eastmoney.com/news,002366,762971993.html",2018-05-29 08:42:16,T
诚信回报股东是上市公司人品的最低标准！！！,"https://guba.eastmoney.com/news,002366,762975294.html",2018-05-29 09:03:59,但愿台海核电是新的开始！！！新的起点！！！诚信回报股东是上市公司人品的最低标准！！！
应该是阴谋：新闻一震仓一散岀一庄收—突然起飞。求证：,"https://guba.eastmoney.com/news,002366,762973966.html",2018-05-29 08:55:02,十
事实充分证明机构与媒体是股市最大的风险因素,"https://guba.eastmoney.com/news,002366,762973874.html",2018-05-29 08:54:23,事实充分证明机构与媒体是股市最大的风险因素
坚决支持中国核电事业，勇斗机构与媒体黑手打压中国高端制造！,"https://guba.eastmoney.com/news,002366,762963315.html",2018-05-29 07:27:51,"坚决支持中国核电事业，勇斗机构与媒体黑手打压中国高端制造！
据研报显示，台海核电业绩的动力主要来自核电行业，实现从相对单一材料研发生产向高端装备制造转变，总营收18.53亿元，同比增长143.43%。其中反应堆一回路主管道营收5.7亿元，同比增长268%；容器类设备及锻件主要包括反应堆压力容器、蒸发器、稳压器、堆内构件及主泵部件等，2017年开发成功实现营收7.99亿元，业绩占比达到32%。在核电行业高端产品的带动下，公司毛利率提升10个pct达到67.93%，同时期间费用率下降近6个pct到12.91%，使得公司去年业绩实现高增长。应收账款和存货周转率有所下降。由于采购付款、纳税增加，经营活动现金流净额下滑明显由正转负。"
博眼球挖负面，乌龙再现。 新闻的救命稻草？90%以上的媒体都是打打打，其中不乏大,"https://guba.eastmoney.com/news,002366,762961873.html",2018-05-29 07:10:16,"博眼球挖负面，乌龙再现。
新闻的救命稻草？90%以上的媒体都是打打打，其中不乏大媒体，又现风吹一边倒，为啥不能辩证分析？责任心呢？一个绩优龙头高端制造公司就这样被弄得乌烟瘴气，没有被确认的信息就这样满天飞，监管呢。"
希望公司出来辟谣,"https://guba.eastmoney.com/news,002366,762864162.html",2018-05-28 15:54:02,希望公司出来辟谣
九点钟，刚刚打通了电话，公司这边正在连夜加班出澄清公告,"https://guba.eastmoney.com/news,002366,762920783.html",2018-05-28 21:14:53,血淋林的博弈，当市场不产生利润的时候，一些机构就要打击你的融资红线，以创造获取差价的空间
公司必须追究黑记者及新浪的法律责任。,"https://guba.eastmoney.com/news,002366,762965511.html",2018-05-29 07:46:40,公司必须追究黑记者及新浪的法律责任。
什么也不说了，收割机来了，真正原因是3亿多股的解禁，增发价才7块多，铁定套现,"https://guba.eastmoney.com/news,002366,762967020.html",2018-05-29 08:02:46,什么也不说了，收割机来了，真正原因是3亿多股的解禁，增发价才7块多，铁定套现
台海核电05月28日获深股通加仓20.50万股,"https://guba.eastmoney.com/news,002366,762967681.html",2018-05-29 08:06:19,"






























05月28日台海核电深股通持仓数据
收盘价：	19.97	涨跌幅：	-10.00%
持股量：	780.00万股	持股变化：	20.50万股





数据显示，截至05月28日台海核电于深股通持股量为780.00万股，占其A股股本比例为0.89%，比上一交易日增加20.50万股。据数据统计，该股近一个月内累计涨幅为-24.50%，深股通累计加仓184.17万，深股通持仓累计变化比例为30.91%，近三个月内累计涨幅为-24.50%，深股通累计加仓184.17万，深股通持仓累计变化比例为30.91%。


数据来源:东方财富




"
对于满天飞的假消息所对我们散户所造成的损失，怎么赔偿！？,"https://guba.eastmoney.com/news,002366,762966150.html",2018-05-29 07:55:44,对于满天飞的假消息所对我们散户所造成的损失，怎么赔偿！？
可以求证，但别瞎下结论，媒体无责任心至绩优白马高端制造闪崩。,"https://guba.eastmoney.com/news,002366,762962201.html",2018-05-29 07:14:24,可以求证，但别瞎下结论，媒体无责任心至绩优白马高端制造闪崩。
还不停盘自查，澄清啊！反应能力太差了！,"https://guba.eastmoney.com/news,002366,762962759.html",2018-05-29 07:21:35,还不停盘自查，澄清啊！反应能力太差了！
澄清了，没有造假。被这些胡乱发质疑文章的媒体害死了。今天开始应该再涨回去。,"https://guba.eastmoney.com/news,002366,762955887.html",2018-05-29 05:01:12,澄清了，没有造假。被这些胡乱发质疑文章的媒体害死了。今天开始应该再涨回去。
感觉有些人精准打击中国制造如核电五G,"https://guba.eastmoney.com/news,002366,762923421.html",2018-05-28 21:32:49,感觉有些人精准打击中国制造如核电五G
第一段目标价基本实现，今早预言23.31；第二波该19元了吧,"https://guba.eastmoney.com/news,002366,759901949.html",2018-05-11 11:25:20,第一段目标价基本实现，今早预言23.31；第二波该19元了吧
大家都净一静吧，业绩造假是大问题，看公司如何出来澄清，如何去维权。公司的法律顾问,"https://guba.eastmoney.com/news,002366,762962556.html",2018-05-29 07:19:09,大家都净一静吧，业绩造假是大问题，看公司如何出来澄清，如何去维权。公司的法律顾问呢？可能也是个山寨版的
新浪新闻转发21世纪经济报道 台海核电午后闪崩 公司释关联交易之惑 新浪新闻05,"https://guba.eastmoney.com/news,002366,762961027.html",2018-05-29 06:55:59,"新浪新闻转发21世纪经济报道
台海核电午后闪崩 公司释关联交易之惑
新浪新闻05-29 01:43
原标题：台海核电午后闪崩 公司释关联交易之惑"
强烈要求停牌，给我们个说法，不停牌又是个板怎么办,"https://guba.eastmoney.com/news,002366,762957267.html",2018-05-29 05:38:32,强烈要求停牌，给我们个说法，不停牌又是个板怎么办
今天能停牌吗？如开牌应该又是个板呀，散户的损失怎么办,"https://guba.eastmoney.com/news,002366,762957102.html",2018-05-29 05:34:10,今天能停牌吗？如开牌应该又是个板呀，散户的损失怎么办
造假?还是造谣?,"https://guba.eastmoney.com/news,002366,762819351.html",2018-05-28 14:10:02,"造没造假.大股东最清楚
如果真造假.5月七日大股东还增持了386万股.钱发烧啊"
出个公告有多难?,"https://guba.eastmoney.com/news,002366,762934621.html",2018-05-28 22:53:45,"有人说晚9点打通公司电话.说正在加班出澄清公告.草蛋.出个公告有多难?
除非有鬼"
今天估计是没有公告了 失望,"https://guba.eastmoney.com/news,002366,762943375.html",2018-05-29 00:17:19,今天估计是没有公告了 失望
请信永中和出来解释清楚，别当缩头乌龟？,"https://guba.eastmoney.com/news,002366,762938720.html",2018-05-28 23:25:59,请信永中和出来解释清楚，别当缩头乌龟？
太恐怖了,"https://guba.eastmoney.com/news,002366,762790583.html",2018-05-28 13:03:54,
看来新浪说的是真的，不然早就出来澄清了。,"https://guba.eastmoney.com/news,002366,762917335.html",2018-05-28 20:53:00,看来新浪说的是真的，不然早就出来澄清了。
别抱怨了,"https://guba.eastmoney.com/news,002366,762935756.html",2018-05-28 23:02:15,大股东死了.都吊唁去了
业绩都能做假,"https://guba.eastmoney.com/news,002366,762937227.html",2018-05-28 23:13:58,业绩都能做假.大股东你爹是不是也是假的
不敢澄清=明天一首凉凉送给大家,"https://guba.eastmoney.com/news,002366,762934630.html",2018-05-28 22:53:49,不敢澄清=明天一首凉凉送给大家
太可怕了！又见地雷,"https://guba.eastmoney.com/news,002366,762933380.html",2018-05-28 22:43:41,太可怕了！又见地雷
这家企业具有核电三代核心技术，新浪财经这么搞法，如果企业危机谁最高兴？,"https://guba.eastmoney.com/news,002366,762929667.html",2018-05-28 22:15:52,具有核心竞争力的企业需要保护，而不是棒杀。别忘了这家企业有军事题材。希望本次台海能尽快澄清事实，让别有用心的人无可乘之机。
具有核电三代核心技术，新浪财经这么搞法，如果企业危机谁最高兴？,"https://guba.eastmoney.com/news,002366,762930685.html",2018-05-28 22:23:09,具有核心竞争力的企业需要保护，而不是棒杀。别忘了这家企业有军事题材研发生产能力，国之重器。希望本次台海能尽快澄清事实，建立市场信心。
几个意思?怎么跌停了?,"https://guba.eastmoney.com/news,002366,762792661.html",2018-05-28 13:10:42,几个意思?怎么跌停了?
公司说我赖得理你,"https://guba.eastmoney.com/news,002366,762914477.html",2018-05-28 20:34:38,越描越黑，没有那会事，我赖得理你，不做亏心事，不怕鬼敲门。
还好早上割了不然一起20多个点亏死,"https://guba.eastmoney.com/news,002366,762792679.html",2018-05-28 13:10:45,还好早上割了不然一起20多个点亏死
谁有核电联系方式?,"https://guba.eastmoney.com/news,002366,762852297.html",2018-05-28 15:10:42,谁有核电联系方式?
新浪财经黑嘴编辑柳川突袭狂轰为哪般？,"https://guba.eastmoney.com/news,002366,762839667.html",2018-05-28 14:46:20,今天中午新浪财经柳川突然发难，对台海核电发了几遍莫须有罪名的指控文章。逻辑是该公司的审计事务所曾经在审计别的公司时因未尽职被处罚，所以聘请该事务所的台海核电财务有可能造价。台海核电账上货币资金不足，收购项目也就有问题。这些似是而非且莫须有的指控，为的就是把水搞混，混淆是非，其背后一定有着不可告人的目的。且看今天收市之后公司有无澄清公告，有就是正常的，没有则可能包藏更大阴谋，主力与上市公司合谋借黑嘴之口割韭菜？
网上传17年涉业绩造假，请公司加以说明，此事是否属实?,"https://guba.eastmoney.com/news,002366,771002309.html",2018-07-06 09:20:00,"网上传17年涉业绩造假，请公司加以说明，此事是否属实?
融发核电
台海核电：您好！公司于2018年5月29日披露了《关于媒体报道的澄清公告》（公告编号：2018-049），敬请关注。谢谢！
(来自深交所互动易)答复时间 2018-07-06 09:20:00"
已经抄底了，尾盘拉红啊,"https://guba.eastmoney.com/news,002366,762792652.html",2018-05-28 13:10:41,大家跟进
董事会连个解释也没有吗？？？？,"https://guba.eastmoney.com/news,002366,762912408.html",2018-05-28 20:21:29,董事会连个解释也没有吗？？？？
即使是真的，西南证券负连带责任,"https://guba.eastmoney.com/news,002366,762909845.html",2018-05-28 20:04:25,"声明：本独立财务顾问保证持续督导工作报告书内容的真实、准确和完整，对持续督导工作报告书的虚假记载、误导性陈述或者重大遗漏负连带责任。

独立财务顾问西南证券上市公司 台海核电

如果是假的，大家就起诉新浪财经的编辑和文章作者"
是不是，要看今天晚上有没有澄清公告  明天会不会停牌？？？,"https://guba.eastmoney.com/news,002366,762898256.html",2018-05-28 18:42:46,是不是，要看今天晚上有没有澄清公告 明天会不会停牌？？？
原材料抵存货，新浪最近招的实习生是哪些野鸡大学的？,"https://guba.eastmoney.com/news,002366,762913395.html",2018-05-28 20:27:57,公司17年确实有10个亿关联交易，但是所谓台海集团原材料抵存货根本不存在，看审计报告，存货增加不是原材料，是建造合同下的存货增加，新浪小编哪个三本学校财经学校毕业的，不懂多看看会计书，特别是看看会计准则《建造合同》一章。
