标题,链接,发布时间,内容
拖累创业板的垃圾,"https://guba.eastmoney.com/news,300378,743211458.html",2018-01-25 13:45:26,如无意外这垃圾又准备带绿帽了[不赞]
跑车:那只猫最近不见了?,"https://guba.eastmoney.com/news,300378,743200111.html",2018-01-25 13:14:10,跑车:那只猫最近不见了?
感谢邹死惩那个无良记者的报道，让我买到跟朋友的筹码,"https://guba.eastmoney.com/news,300378,743162805.html",2018-01-25 10:38:07,感谢邹死惩那个无良记者的报道，让我买到跟朋友的筹码
垃圾般的控盘水平，创业板反转了,"https://guba.eastmoney.com/news,300378,743139857.html",2018-01-25 09:51:48,垃圾般的控盘水平，创业板反转了
你们进来接盘，就是股东了，光荣啊,"https://guba.eastmoney.com/news,300378,742345976.html",2018-01-19 15:13:16,你们进来接盘，就是股东了，光荣啊
狗屎操盘手看看人家安硕庄是怎么样的实力,"https://guba.eastmoney.com/news,300378,742924419.html",2018-01-24 09:38:47,狗屎操盘手看看人家安硕庄是怎么样的实力
鼎捷软件:关于媒体报道的澄清公告,"https://guba.eastmoney.com/news,300378,742158013.html",2018-01-18 17:54:46,"公告日期：2018-01-18
证券代码：300378 证券简称：鼎捷软件 告编号：2018-01005



鼎捷软件股份有限公司



关于媒体报道的澄清公告



本公司及董事会全体成员保证信息披露内容的真实、准确和完整，没有虚假记载、误导性陈述或重大遗漏。



一、澄清说明



昨日有媒体发布和转载了标题为《鼎捷软件上市后业绩“变脸”涉IPO财



务造假》的文章，该文未经核实，影响恶劣，已对公司造成负面影响，公司表达严正的抗议并已正式委托律师对该媒体发律师函，也在此呼吁广大的投资大众及媒体勿再相信或传播，公司特澄清如下:



1. 公司于《2014年年度报告》中披露，公司于2015年3月26日召开第二



届董事会第七次会议审议通过《关于确认2014年度坏账核销的议案》，于2014



年度予以核销，由公司备查登记并继续催收，其中包括旺旺（中国）投资有限公司等公司的应收款项。



旺旺(中国)投资有限公司于2011年5月5日及8月30日分别向公司购买



易成管理软件及工作流软件，并依合同陆续支付款项。但由于负责新业务的相关公司关停，最终尚有余款并未支付，公司已根据会计准则的相关规定提列坏账准备，相关风险已充分体现，后续核销程序符合相关法律法规及公司内部规定。



公司昨日已正式去电与报导提及的旺旺集团发言人朱纪文先生取得直接联系，并表达严正抗议，朱先生表示并未接受该文记者访问。



该报导文中所提其余客户经公司逐一核查合同及相关核销程序，均合法合规。



2. 近年制造业面临转型，挑战和机遇并存，为积极响应企业客户面对智能



制造迫切的转型需求，公司仍坚持新产品、互联网及物联网整合方案的投入，并分别于2014 年及2015 年发布的新一代中大型 ERP 产品E10及针对大型、



大型集团以及超大型企业的智能制造解决方案 T100，新产品的投入加上人力成



本的上升都使公司于投入期费用压力加重。



3.企业管理软件实施过程中涉及客户企业内部的全流程，较为复杂，且受客户信息化程度及双方配合等因素影响，造成部分客户对信息化结果产生落差，导致部分款项无法收回。因此公司近年除了于合同条款上把控风险外也积极思考转型，逐渐转以实施成果为交付物的营运模式，聚焦客户实施效益，以客户效益/满意度为导向，并能将公司的行业经营优势有效变现，逐步提升公司人均产能，成为公司重要的利润增长点。



4.公司成立迄今36年，始终坚持诚信经营，规范运作，全体员工兢兢业业



不懈努力，公司将扞卫到底，同时，对各界朋友、客户、投资者及媒体朋友的支持、打气与慰问表达衷心的感谢，鼎捷全体员工仍会坚守价值，不忘初心，为广大的企业客户继续提供有感优质的服务，为智能制造不懈努力。



二、其他说明及重要提示



1、公司目前经营稳定，主营业务经营状况良好。公司会按照相关法律、法规以及规定披露信息，积极保障全体股东的合法利益。



2、公司郑重提醒广大投资者，《证券时报》、《中国证券报》及巨潮资讯网（http://www.cninfo.com.cn）为公司指定的信息披露媒体，公司所有信息均以上述指定媒体刊登的信息为准。



3、敬请广大投资者理性投资，注意风险。



特此公告。



鼎捷软件股分有限公司董事会



二零一八年一月十八日




[点击查看PDF原文]
提示：本网不保证其真实性和客观性，一切有关该股的有效信息，以交易所的公告为准，敬请投资者注意风险。
展开阅读全文"
操，就是真的作假也没有浦发银行厉害！,"https://guba.eastmoney.com/news,300378,742819891.html",2018-01-23 14:49:10,操，就是真的作假也没有浦发银行厉害！
一些老狗出来了，逢高减仓吧。,"https://guba.eastmoney.com/news,300378,743089808.html",2018-01-24 20:13:21,一些老狗出来了，逢高减仓吧。
股价还是偏高,"https://guba.eastmoney.com/news,300378,742452073.html",2018-01-21 01:23:50,股价还是偏高
又来了篇报道，明天又麻烦了，小邹你没病吧，有本事去公司找他们去啊，伤我们散户,"https://guba.eastmoney.com/news,300378,742766489.html",2018-01-23 11:37:42,又来了篇报道，明天又麻烦了，小邹你没病吧，有本事去公司找他们去啊，伤我们散户干嘛
作，又报料了！跌吧，我在抄回来[大笑],"https://guba.eastmoney.com/news,300378,742811658.html",2018-01-23 14:29:22,作，又报料了！跌吧，我在抄回来
2017年利润预计增长30%左右！,"https://guba.eastmoney.com/news,300378,743075616.html",2018-01-24 18:06:47,2017年利润预计增长30%左右！
老话说的好便宜没好货 好货不便宜,"https://guba.eastmoney.com/news,300378,743044026.html",2018-01-24 15:05:58,垃圾就是垃圾
东方财富涨停,"https://guba.eastmoney.com/news,300378,743031521.html",2018-01-24 14:36:15,垃圾
打到10以下让台湾佬减持。,"https://guba.eastmoney.com/news,300378,743028509.html",2018-01-24 14:29:15,打到10以下让台湾佬减持。
现在卖出的是SB，创业板反转了,"https://guba.eastmoney.com/news,300378,743021793.html",2018-01-24 14:14:22,垃圾
支持记者搞死这家垃圾公司。最好弄大一点,"https://guba.eastmoney.com/news,300378,743015623.html",2018-01-24 14:00:53,支持记者搞死这家垃圾公司。最好弄大一点
郭台铭的富士康将投资控股鼎捷软件的公告,"https://guba.eastmoney.com/news,300378,634468474.html",2017-04-27 09:43:53,"特大利好：郭台铭的富士康将投资控股鼎捷软件
随着公司T100的推出，已经奠定了公司在智能制造中的领先地位，公司聘了这么多高材生，是不是应该要在大陆市场好好的发展一些像富士康和旺旺集团这样的大客户，一方面开拓市场一方面稳定收入。更何况富士康和本公司都有着台资背景。
鼎捷软件：
: 您好，感谢您的建议。公司目前在亚太地区已经有累计超过50,000家的企业客户，更有多家案例客户，富士康即为公司的案例客户。公司在推出针对大型、大型集团以及超大型企业，融合互联网＋工业4.0的智能制造解决方案T100后，更有能力往超大型企业移动，未来，公司会基于战略发展或业务扩展，开拓更多客户。谢谢关注"
这个记者翻出几年前网上的模糊内容打几个电话就想达到哗众取宠并且实质坑了鼎捷小散。,"https://guba.eastmoney.com/news,300378,742894029.html",2018-01-23 23:47:30,这个记者翻出几年前网上的模糊内容打几个电话就想达到哗众取宠并且实质坑了鼎捷小散。上市前就有质疑的，但仍然通过了审核，说明鼎捷是有实力的，并且是35年的老企业。其实前几年的创业板上市80%都被质疑过。那创业板是否要全部推倒重来。现在翻几年前旧帐没针对现在业绩就是坑小散。并且鼎捷已经是国内数一数二的同行业优秀企业。记者这种打电话发稿模式就是坑小散。
软件股全部涨停,"https://guba.eastmoney.com/news,300378,742965300.html",2018-01-24 11:02:28,鼎捷软件垃圾你
暴风科技  上海钢联  中科信息全部连续涨停,"https://guba.eastmoney.com/news,300378,742974392.html",2018-01-24 11:22:45,创业板即将复制2015年年初牛市走势
买了你这个辣鸡，真是前辈子种下的苦果吗,"https://guba.eastmoney.com/news,300378,743011567.html",2018-01-24 13:51:53,买了你这个辣鸡，真是前辈子种下的苦果吗
跑车，继续往下打，我减仓了2/3。,"https://guba.eastmoney.com/news,300378,743009108.html",2018-01-24 13:46:50,跑车，继续往下打，我减仓了2/3。
今晚会出年度业绩预报，但不用指望了，好也没用的,"https://guba.eastmoney.com/news,300378,743006861.html",2018-01-24 13:42:15,今晚会出年度业绩预报，但不用指望了，好也没用的
不需要涨，继续大跌最好。,"https://guba.eastmoney.com/news,300378,743004622.html",2018-01-24 13:37:40,不需要涨，继续大跌最好。
昨天把暴风科技卖了换了鼎捷软件亏哭了,"https://guba.eastmoney.com/news,300378,742988425.html",2018-01-24 12:33:50,暴风科技明天继续昨天的话 那更加亏大了
会有更低的价格买，我准备三年解套。,"https://guba.eastmoney.com/news,300378,742980974.html",2018-01-24 11:43:39,会有更低的价格买，我准备三年解套。
乐视网复盘，创业板利空出尽是利好,"https://guba.eastmoney.com/news,300378,742879625.html",2018-01-23 21:02:56,创业板明天开始复制2015年1月5日的牛市走势，
狗拖太多，等这些狗拖死完就差不多了。,"https://guba.eastmoney.com/news,300378,742965875.html",2018-01-24 11:03:40,狗拖太多，等这些狗拖死完就差不多了。
只有股价上涨，谣言才能不攻自破！,"https://guba.eastmoney.com/news,300378,742960274.html",2018-01-24 10:51:34,只有股价上涨，谣言才能不攻自破！
"投资机会产业链存在万亿空间 智能制造的本质,是将智能装备通过通信技术有机连接起来","https://guba.eastmoney.com/news,300378,742488196.html",2018-01-21 19:49:25,"投资机会产业链存在万亿空间
智能制造的本质,是将智能装备通过通信技术有机连接起来,实现生产过程自动化;并通过各类感知技术收集生产过程中的各种数据,通过工业以太网等通信手段,上传至工业服务器,在MES/DCS软件系统的管理下进行数据处理分析,并与企业资源管理软件,提供最优化的生产方案或者定制化生产,最终实现智能化生产。
据此可将智能制造划分为感知层、网络层、执行层和应用层。
在实际中,智能制造产业链发展的顺序,首先实现自动化,然后信息化,再次互联化,最后智能化。产业链落地顺序则是从硬件到软件,从物理到网络。
整个产业链中涵盖智能装备、工业互联网、工业软件、3D打印以及将上述环节有机结合的自动化系统集成及生产线集成等。
目前我国智能制造产业已经迈入“万亿时代”。2015年我国智能制造产值在1万亿元左右,2020年有望超过3万亿元,年复合增长率约20%。具体到产业链上的投资机会,主要包含工业机器人、工业互联网、工业软件和3D打印。
工业互联网就是智能工厂的神经。通过各种信息采集和感知技术,将生产中的信息转为数字信号,通过无线传输、总线技术或者工业以太网等技术将信号传递给计算机系统或者展示给生产人员,经过数据分析处理后,实施更加精确和效率更高的工业生产操作。
工业软件方面,国内工业软件ERP渗透率相对较高,而MES/DCS等生产环节控制软件普及率还相当低。据统计,中国到2025年,工业软件的市场需求将会超过1000亿元人民币,而在这个市场上,仍然以国外的软件公司为主导,国内厂商国产替代空间巨大。
同时,未来3D打印行业将保持高速增长,到2018年全球3D打印总收入突破100亿美元。国内3D打印尚处在起步阶段,未来发展空间巨大。
浙商证券认为,每一轮的智能制造主题投资,基本可以按照这样的顺序进行投资:集成商、机器人和数控机床、信息化、传感器和RFID,最后是3D打印和机器视觉等。随着政策力度的不断扩大且此次事件驱动叠加政策预期,智能制造未来发展潜力巨大。
建议关注产业链上的投资机会:第一,工业机器人领域,到2020年,国内工业机器人的保有量将达到60万台,关注机器人、华中数控;第二,工业软件领域MES/DCS等生产环节控制软件的国产替代,关注鼎捷软件、用友网络。"
300378会跌到5元附近……,"https://guba.eastmoney.com/news,300378,742422513.html",2018-01-20 13:06:57,300378会跌到5元附近……
真假,"https://guba.eastmoney.com/news,300378,742877648.html",2018-01-23 20:46:01,可以说上市公司90%以上都是包装上市，毛病在多方（如：券商、会计所、发审委等等），像文章提到这种造假（假设真的存在）也是不值得一提之事，如果这样都退市，那中国股市已无有几家公司了，发审委又做何回答呢？，此记者去告发审委吧。
无良记者露马脚了!,"https://guba.eastmoney.com/news,300378,742874655.html",2018-01-23 20:20:53,有据可查，上次记者言之凿凿，说“经查，旺旺集团并未向鼎捷软件进行过采购。”现在又言之凿凿证明旺旺采购了鼎捷软件的产品，只是往来账目需要澄清，你他妈胆子还真正！
乐视来了，颤抖吧，散户！这才是大跌的原因！,"https://guba.eastmoney.com/news,300378,742895510.html",2018-01-24 00:12:32,乐视来了，颤抖吧，散户！这才是大跌的原因！
智能机器行业喜迎政策红包 11只高成长股凸显潜力,"https://guba.eastmoney.com/news,300378,742891989.html",2018-01-23 23:17:14,智能机器行业喜迎政策红包 11只高成长股凸显潜力
这个记者就是鼎捷的竞争对手来黑鼎捷的。翻出几年前网上的内容打几个电话就想达到哗众,"https://guba.eastmoney.com/news,300378,742891086.html",2018-01-23 23:05:30,这个记者就是鼎捷的竞争对手来黑鼎捷的。翻出几年前网上的内容打几个电话就想达到哗众取宠并且诋毁鼎捷的目的。上市前就有质疑的，但仍然通过了审核，说明鼎捷是有实力的，并且是35年的老企业。其实前几年的创业板上市80%都被质疑过。前几年主板那些无主业负债累累的还都能借到好壳呢，难道你能让那些借壳变成优秀的企业再掏出它的坏账重新去壳，那证券市场就要推倒重来，唯恐天下不乱。现在翻几年前旧帐就是坑小散。并且鼎捷已是国内数一数二的同行业优秀企业。记者有这份心，去盯那些准备上市有残疾的公司才算是真正正义的保护投资者。而不是从网上搜搜就发表，那么记者行业也太容易了。
记者断章取义，文章带有浓烈的个人感情色彩,"https://guba.eastmoney.com/news,300378,742882060.html",2018-01-23 21:24:35,"阅读完成第二篇报道后，所谓的作假核销涉及企业和鼎捷均有合作接触的关系，对其软件也有试用过，只是最后不承认欠债这么多而已，说已经付过了付了多少呢。那不就是欠债的不认账吗，能赖的账谁会代表公司去认账。就像第一篇旺旺集团一会说没有，现在又说有了，说付过了。那付的是不是和鼎捷签合同上的实际金额呢。记者弄了半天除了电话核实了几家电话声称以外就没有任何实际实地的调查了，旺旺在上海鼎捷也在上海啊，怎么不去鼎捷那里查询那几家核销的合同呢。做在办公室里打打字就能出真相了吗

而且核销的又不只是这几家，其余确认到的记者怎么不说就盯着核实不到的在说，选择性失明吗"
认真看了下鼎捷软件发展史还是蛮有潜力的,"https://guba.eastmoney.com/news,300378,742361897.html",2018-01-19 16:50:20,公司94年在台湾成立，有着悠久的历史，比腾讯，阿里巴巴还要悠久，是中国工业软件龙头企业，目前公司销售收入保持年10%增长，今年净利润保持70%增长，今年净利润估计7000万左右，其实公司技术服务占总收入比达50%，毛利率达98%，超过贵州茅台，其他项目的毛利率也有40%以上，如果公司把销售费用相应控制一下，降5个点的话，净利润就增加5000多万，估价市盈率回到20多，估价上30不是梦。
上证50连涨记录20天！,"https://guba.eastmoney.com/news,300378,742880585.html",2018-01-23 21:11:04,上证50连涨记录20天！
它越趺你越买入，真造假的话会有人赔的,"https://guba.eastmoney.com/news,300378,742877459.html",2018-01-23 20:44:24,它越趺你越买入，真造假的话会有人赔的
让狗咬狗，看最后谁赢。坐等看戏。闹越大越好。,"https://guba.eastmoney.com/news,300378,742876828.html",2018-01-23 20:39:00,让狗咬狗，看最后谁赢。坐等看戏。闹越大越好。
希望记者整死这个鸟公司。闹越大越好。总会有真相大白的一天。,"https://guba.eastmoney.com/news,300378,742866087.html",2018-01-23 19:09:06,希望记者整死这个鸟公司。闹越大越好。总会有真相大白的一天。
