标题,链接,发布时间,内容
鼎捷软件这回如何澄清IPO财务造假？一堆“客户”再次否认欠钱！,"https://guba.eastmoney.com/news,300378,742866584.html",2018-01-23 19:13:36,"1月18日，鼎捷软件发布《关于媒体报道的澄清公告》，对《国际金融报》的报道《鼎捷软件上市后业绩“变脸” 涉IPO财务造假》进行质疑，表示文章“严重失实”，声称将保留追究法律责任的权利。


事实胜于雄辩。


现在，我们就让大家看看，是本报的报道“严重失实”，还是鼎捷软件在撒谎？


旺旺表示，不欠钱！未收到过催收文件！


鼎捷软件2014年年报显示，旺旺（中国）投资有限公司欠货款59.85万元，多次催收未果，予以核销。


1月20日，旺旺（中国）投资有限公司给《国际金融报》发来了官方答复函。


内容大致为：



一、本公司为SAN WANT HOLDINGS LIMITED全资子公司，非中国旺旺控股有限公司子公司。


二、就来函提及旺旺（中国）投资有限公司与鼎捷软件股份有限公司账款问题，经查：本公司于2011年5月5日及2011年8月30日曾代为筹建中关联公司，向鼎捷软件股份有限公司购买易成管理软件及实施服务，据本公司记录所示，已付清前述全部应付鼎捷软件股份有限公司款项，且本公司并未收到过鼎捷软件股份有限公司催收文件。


谨慎起见，本公司曾于2018年1月18日下午与鼎捷软件股份有限公司联系，说明据本公司记录双方合作款项已清且本公司可提供财务凭证供其核查，并建议鼎捷软件股份有限公司提供其所宣称的本公司欠款凭证、催款记录或询证函等以便双方厘清核实。





旺旺（中国）投资有限公司加盖过公章的答复函数据来源：收到的答复函


那么，鼎捷软件核销货款的依据在哪？真实性在哪？


重庆新格有色金属有限公司再次表示，不欠钱！


鼎捷软件于澄清公告中表示，“该报道文中所提其余客户经公司逐一核查合同及相关核销程序，均合法合规。”


鼎捷软件2014年年报显示，重庆新格有色金属有限公司欠货款42万元，多次催收未果，予以核销。


此前，《国际金融报》记者就采访过重庆新格有色金属有限公司财务部工作人员，该工作人员明确表示不欠鼎捷软件货款。


为此，《国际金融报》记者再次对重庆新格有色金属有限公司进行采访核实。


重庆新格有色金属有限公司财务部李经理对记者表示，“什么叫多次催收，我们又不欠他们钱。我们账上都没有挂他们的账。后来都没有用他们的软件，当时是全部付清了的，当期按合同的要求付清了。”


重庆百事达汽车有限公司表示，并无债权债务关系！


鼎捷软件2014年年报显示，重庆百事达汽车有限公司欠货款22.5万元，多次催收未果，予以核销。


在上述报道中，《国际金融报》记者就采访过重庆百事达汽车有限公司总经理办公室何主任。


为了核实情况，《国际金融报》记者再次采访了重庆百事达汽车有限公司总经办何主任。


何主任对《国际金融报》记者明确表示，“我之后也询问了我们的财务，因为我们公司有五十几家分公司，我只有通过财务才能确定回复。财务确定回复，没有和鼎捷软件有账务上的往来。然后，我也问了当年有可能负责这个项目的同事，他说鼎捷软件和我们有过接触，曾经讨论过合作，但最终没有成。还没有进入付款这段，就已经终止合作。不会有账面上的往来。从财务口径，我也确认过了没有。从业务口径也确认过了。”


另外，何主任强调，“我在这个公司已经工作很久了。”


当年负责过该项目的何主任同事罗先生对《国际金融报》记者表示，“说实话，我没有义务来回答你的问题。但我认为这件事情出来以后，可能会影响到我们公司的声誉，这个我澄清一下，没有这件事情。当时，我们和他们有接触，就是有个意向。后来在接触过程中，发现他们的产品和服务跟我们之间并不合适，就终止了合作。实际上，我们没有接收他们的任何产品和服务，也就是说，这个应收款就是不存在的事。”


对于接触细节，罗先生表示，“大概发生在2012年，但最后财务上并不构成债权债务关系。当时它并不是一个标准产品，而是一种开发平台，需要定制开发。在前期接触当中，我们认为他们给其他类似客户做的东西还不错。后来由于觉得不合适，很快地就终止了合作。为此，我们公司还损失了几万块钱。”


为何会损失几万元？


罗先生对《国际金融报》记者解释，“就是公司付了预付款，不合作的话，钱可能收不回来。他们也没有开发票，也没有退钱。后面就不了了之，当然不可能构成债权债务关系了。”


此外，记者询问鼎捷软件是否催收过“货款”，罗先生对记者表示，“鼎捷软件的法律部门后来发过一份欠款函，但是因为我们知道具体情况，当时我就和相关部门澄清了这个事情。我想，他们内部来讲按流程公事公办，这问题他们也知道，并没有异议。我想这（问题）是不是出在他们的财务部门，是不是可能账务上没按实际情况，及时做账务处理。这个金额也不是很大，上市公司也可能不在乎这几十万块钱。”


广州市菲星数码科技股份有限公司表示，不欠！不欠！公司有大把钱为什么要欠？


鼎捷软件2014年年报显示，广州市菲星数码科技股份有限公司欠货款21.34万元，多次催收未果，予以核销。


和上述情况一样，此前记者就采访过广州市菲星数码科技股份有限公司相关工作人员。


为了证明《国际金融报》的报道没有任何失实，记者再次采访了广州市菲星数码科技股份有限公司黄经理。


黄经理明确告诉记者，“其实我在这个公司很多年了，从来没听说过欠鼎捷软件货款之事。刚才我也问了财务人员，其也做了五六年，表示没有听说过公司欠鼎捷软件的钱。至于他们是否真的签过这个合同，到付款之前，大概我们不做了，可能会有。但合同签了，也会有首付多少，尾款多少，或者其他约定，有合同就会体现。我们不欠他们钱，我们公司有大把钱，每年利润几千万，为什么要欠？”


记者询问黄经理是否查过公司的账，黄经理对记者表示，“对，上次你打过电话来了。后来同事就问了财务，都说没有这件事。”


黄经理对《国际金融报》记者说，“其实我是2010年8月来的，都没听说过欠鼎捷软件的钱。就是说2010年到目前，都不会欠他们的钱。像我们公司，只有别人欠我们钱，我们没有欠别人钱。”


再问应收款项怪现象


《鼎捷软件上市后业绩“变脸”涉IPO财务造假》提及，为何鼎捷软件上市前应收账款猛增，上市之后应收账款连续下降？为何鼎捷软件上市后坏账损失比上市前明显增加？


另外，鼎捷软件2014年1月于深交所挂牌上市，其2014年年报显示，1年至2年的应收账款约为1亿元。经过两年时间，鼎捷软件2016年年报显示，3年至4年的应收账款约为3688.33万元。


鼎捷软件2013年年报显示，1年至2年的应收账款约为3709.68万元，经过三年时间，鼎捷软件2016年年报显示，4年至5年的应收账款约为1790.04万元。


一位财税专家对记者表示，“应收账款被核销，会减少账面上的应收账款。”


鼎捷软件2013年至2016年实际核销的应收账款分别约为732.9万元、1107.79万元、1104.93万元、318.88万元。


那么这些应收账款有多少被回收了呢？


鼎捷软件于澄清公告中表示，部分客户对信息化结果产生落差，导致部分款项无法收回，逐渐转以实施成果为交付物的营运模式。


那么，因为客户对结果有落差，这部分应收款就无法收回？主要是鼎捷软件的原因，还是客户的“无赖”造成的，或是其他原因？




鼎捷软件澄清公告摘要 数据来源：鼎捷软件公司公告


记者曾于1月18日11点39分，就上述部分问题以采访函的形式发送，并拨打鼎捷软件董秘办电话。




国际金融报采访函记录 来源：企业邮箱


鼎捷软件董秘办工作人员对记者表示，“该说的都已经说过了，不会再对采访函进行回复。”


值得注意的是，鼎捷软件澄清公告表示，其货款的核销“合法合规”，由公司备查登记并继续催收，其中包括旺旺（中国）投资有限公司等公司的应收款项。那么，鼎捷软件是否已尽力催收货款？它需要核销的货款到底有多少？是哪些客户？


为了了解事情的真相，记者要求鼎捷软件提供所有的核销客户名单，但其并没有提供。


著名律师严义明表示，“公司法规定了公司高管的勤勉和忠诚义务，一般情况下，如果对应收账款不做回收努力，简单核销是不负责任的行为，违反了上述公司法义务。”


再问鼎捷软件：何来报道未经核实？


鼎捷软件澄清公告表示，本报《鼎捷软件上市后业绩“变脸”涉IPO财务造假》未经核实。


事实是，在《鼎捷软件上市后业绩“变脸”涉IPO财务造假》发布前一日16点34分，本报就已发采访邮件（注有固机、手机、传真、邮箱、地址等等）至鼎捷软件，随后电话告知其相关工作人员尽快回复。对方表示，采访提纲已收到。但截至发稿，本报并没收到鼎捷软件的回复，对方也没有告知，因为要核实相关问题，需要延后回复。




国际金融报采访函记录 来源：企业邮箱


要强调的是，在本报文章发出后一个小时，鼎捷软件相关人员便联系到记者本人，后来本报也收到其律师函。


而此前，鼎捷软件均未就相关问题，对记者作出答复，或要求延迟。


所以鼎捷软件所谓未经核实的表述，与事实完全不相符合，属于欺骗投资者的不负责行为。


同样，本报对旺旺集团的采访，有着充分证据，包括11个通话，2条短信，16条微信。


旺旺集团北京首席代表林天良多次明确表示，“旺旺（中国）投资有限公司是旺旺集团所属公司，该公司也未向鼎捷软件进行采购。敝集团法务部门将去函鼎捷软件，要求澄清。”


需要说明的是，上述回复是林天良将相关问题转发至旺旺集团发言人室之后，相关方面确认后得到的回复。


林天良对记者强调，上述相关言论请引用旺旺集团发言人朱纪文。


报道发出后，也转给了林天良先生，其也没有对报道的真实性进行质疑。


除了旺旺，本报的上述报道中的每家客户，都按照新闻报道的规范进行了采访，没有任何失实之处。


对于上述任何问题，本报都有充分证据，欢迎鼎捷软件以及广大读者和投资者来查证。
展开阅读全文"
中午再次出现国际金融报记者“反驳事件”，作为国产第二大软件股，你们如何对此做出回,"https://guba.eastmoney.com/news,300378,742860496.html",2018-01-23 18:12:16,中午再次出现国际金融报记者“反驳事件”，作为国产第二大软件股，你们如何对此做出回应？
鼎捷软件连年减持涉嫌违规！,"https://guba.eastmoney.com/news,300378,742864284.html",2018-01-23 18:52:25,鼎捷软件2017年通年大幅减持，紧接着2018年又宣布不间断减持，造成该股股价暴跌，股民损失极其惨重。如果这种明目张胆的掠夺行为不算违规，那么所谓保护中小投资者权益的说法就成了笑柄，往好里想，我们宁可相信这是管理部门疏于管理，让鼎捷软件高管们钻了制度的控子所致。只有说清了他们是违规减持，证监会才可能干预，才可能迫使他们停止减持，并勒令他们增持，鼎捷软件股价才可能真正获得新生，因此，我们要做的就是向证监会举报鼎捷软件违规减持！
鼎捷软件和用友网络那个估计合理  都是一个行业,"https://guba.eastmoney.com/news,300378,742795003.html",2018-01-23 13:48:48,用友现价23，
请问贵公司面对财务造假一事，真假与否、有没有考虑如何维护二级市场中小投资者的利益,"https://guba.eastmoney.com/news,300378,742859810.html",2018-01-23 18:05:24,请问贵公司面对财务造假一事，真假与否、有没有考虑如何维护二级市场中小投资者的利益问题。希望贵公司拿出具体行动。
请问贵公司面对财务造假一事，真假与否、有没有考虑如何维护二级市场中小投资者的利益,"https://guba.eastmoney.com/news,300378,742859293.html",2018-01-23 18:00:26,请问贵公司面对财务造假一事，真假与否、有没有考虑如何维护二级市场中小投资者的利益问题。
造没造假他们股东心里最清楚。,"https://guba.eastmoney.com/news,300378,742846152.html",2018-01-23 16:29:12,造没造假他们股东心里最清楚。
怎样向证监会举报,"https://guba.eastmoney.com/news,300378,742824329.html",2018-01-23 14:59:24,怎样向证监会举报
对于鼎捷是否财务作假，深交所是否发函询问,"https://guba.eastmoney.com/news,300378,742823628.html",2018-01-23 14:57:41,对于鼎捷是否财务作假，深交所是否发函询问
软件服务类行业的合同官司多到打不完，怎么可能每件都起诉,"https://guba.eastmoney.com/news,300378,742837616.html",2018-01-23 15:43:56,软件服务类行业的合同官司多到打不完，而且纠纷很难判断，起诉付出的隐性成本太高，怎么可能每件都起诉
我已经打电话警告鼎捷软件了 如果他们不起诉记者 我就向证监会举报他们。,"https://guba.eastmoney.com/news,300378,742826585.html",2018-01-23 15:05:19,我已经打电话警告鼎捷软件了 如果他们不起诉记者 我就向证监会举报他们。
我已经向公司发信函了 如果不起诉媒体 我将向证监会举报鼎捷科技业绩造假。虽然没买,"https://guba.eastmoney.com/news,300378,742800189.html",2018-01-23 14:02:01,我已经向公司发信函了 如果不起诉媒体 我将向证监会举报鼎捷科技业绩造假。虽然没买多少 但是本人看到这些垃圾台湾巴子骗钱就火大。
希望国际金融报招人要慎重，不要被这种记者坏了名声,"https://guba.eastmoney.com/news,300378,742826874.html",2018-01-23 15:06:15,客观评价，我觉得这个记者要么是想出名想疯了，要么是想钱想疯了，而且无财务专业背景知识，盯着个N年前的应收账款和坏账就直接能得出“IPO造假”？可以原谅你的无专业背景知识，但是这种逻辑怎么毕业的？不过“脑洞”大的挺少有的，脑补能力也是超强的。这么费劲采访这个采访那个，有这时间多去学学专业知识，多去研究研究上市公司财报，绝对让你大有收获，盯着这一家，又没有其他重要科目数据去佐证，绝对是提前锁定好目标的，说目的单纯怎么可能？之所以在这里说这么多话纯粹是看不惯这种记者，看这种低水准文章应该既不是资深记者也不是专业财经记者所写，要是冲着利益去，真看不起这种人，鼎捷软件要是有骨气就应该找证据把这种没有职业道德的人送到公众和法律面前。
这个记者的职业生涯算是到头了，偷鸡不成反蚀把米,"https://guba.eastmoney.com/news,300378,742825807.html",2018-01-23 15:03:04,这个记者的职业生涯算是到头了，偷鸡不成反蚀把米
看来又得明天一早砸盘跌停？,"https://guba.eastmoney.com/news,300378,742821290.html",2018-01-23 14:52:26,看来又得明天一早砸盘跌停？下午还是跟上次一样，没什么动静。董秘的答复死活得等到次日欸。
支持记者实名向证监会举报。由证监会来调查事实真相。,"https://guba.eastmoney.com/news,300378,742817385.html",2018-01-23 14:43:18,支持记者实名向证监会举报。由证监会来调查事实真相。
关于鼎捷财务造假问题,"https://guba.eastmoney.com/news,300378,742787208.html",2018-01-23 13:29:58,如果说上市时有财务造假，那时过去的。这几年的冲账，反而把这几年的实际利润拉低。如果冲账完了，那实际利润是不是上升了。过去的假账，不是现在的假账。
参照欣泰电气 公司和辅导券商要赔偿散户所有损失。[鼓掌],"https://guba.eastmoney.com/news,300378,742804301.html",2018-01-23 14:12:06,参照欣泰电气 公司和辅导券商要赔偿散户所有损失。
这一波要干到12吗？主力耍赖了,"https://guba.eastmoney.com/news,300378,742784483.html",2018-01-23 13:23:06,这一波要干到12吗？主力耍赖了
那个记者是不是人，作假直截向有关机构报道，在这里发布声明意思，唯恐天下不乱之小人,"https://guba.eastmoney.com/news,300378,742784893.html",2018-01-23 13:24:09,那个记者是不是人，作假直截向有关机构报道，在这里发布声明意思，唯恐天下不乱之小人
如果报道属实~上市公司涉嫌IPO财务造假，那就牛了,"https://guba.eastmoney.com/news,300378,742797216.html",2018-01-23 13:54:26,好像这票上市的时候还闹过绯闻就是关于财务报表的
鼎捷和旺旺是台企？而金融时报大股东是谁？ 大家想象一下吧。公司为了几十一百万作假,"https://guba.eastmoney.com/news,300378,742781540.html",2018-01-23 13:14:51,"鼎捷和旺旺是台企？而金融时报大股东是谁？
大家想象一下吧。公司为了几十一百万作假，可能吗？我不信。
"
邹x晨这么做的目的是什么？有过节吗？,"https://guba.eastmoney.com/news,300378,742794815.html",2018-01-23 13:48:20,邹x晨这么做的目的是什么？有过节吗？
真真假假，虚虚实实。,"https://guba.eastmoney.com/news,300378,742786502.html",2018-01-23 13:28:21,弄不清是真造假，还是主力花钱买枪手制造恐慌，打压吸筹。
哥就等着你跳水呢！,"https://guba.eastmoney.com/news,300378,742785402.html",2018-01-23 13:25:29,
12.1有个跳空要填，不填这个空，庄家不收手。,"https://guba.eastmoney.com/news,300378,742781504.html",2018-01-23 13:14:41,12.1有个跳空要填，不填这个空，庄家不收手。
媒体再度发表铁证，下午看跳水表演！（拍桌子）,"https://guba.eastmoney.com/news,300378,742770090.html",2018-01-23 11:57:01,这是否是财务造假？
底部多利空，顶部利好多,"https://guba.eastmoney.com/news,300378,742775675.html",2018-01-23 12:40:31,如题
检索中国裁判文书网发现，贵公司催讨货款或服务费起诉的案件仅有十件，其中客户欠款金,"https://guba.eastmoney.com/news,300378,742770834.html",2018-01-23 11:51:00,"检索中国裁判文书网发现，贵公司催讨货款或服务费起诉的案件仅有十件，其中客户欠款金额在十万元以下的就有四件，其中一个案件的诉讼标的金额仅有10290元。我想问的是，客户欠款几万元甚至仅欠1万元贵公司尚且不遗余力地起诉追讨，为何每年那么多应收账款却未经诉讼就被核销？贵公司的上述做法实在令人难以理解，请贵公司给我们广大投资人一个合情合理合法的解释!
鼎捷软件
鼎捷软件：您好，企业管理软件实施过程中涉及客户企业内部的全流程，较为复杂，且受客户信息化程度及双方配合等因素影响，造成部分客户对信息化结果产生落差，导致部分款项无法收回，合同的认知差异或是款项的收回应走合法合规方式共同寻求解决，视个别案件的情况分别采取协商/催收或是诉讼等方式，核销的原因有多次催收未果，客户企业倒闭、客户歇业、关闭、进行诉讼后核销等。对于收回确实有实际困难，后续公司遵守相关法律法规相关规定进行合法核销。谢谢关注！
(来自深交所互动易)答复时间 2018-01-23 11:51:00"
进驻378,"https://guba.eastmoney.com/news,300378,742777198.html",2018-01-23 12:54:54,进驻378
造假不造假直接反馈到深交所不就行了，股吧里面瞎比比的，都是上市公司和主力演双簧！,"https://guba.eastmoney.com/news,300378,742775579.html",2018-01-23 12:39:46,造假不造假直接反馈到深交所不就行了，股吧里面瞎比比的，都是上市公司和主力演双簧！是谁把细节和数据透露的有模有样？这一点就值得怀疑！这些数据应该属于商业机密吧！……？
做假最好，亏损散户申请索赔。,"https://guba.eastmoney.com/news,300378,742762127.html",2018-01-23 11:24:08,做假最好，亏损散户申请索赔。
狗屎今天没戏唱了，下午看大盘暴跌,"https://guba.eastmoney.com/news,300378,742727961.html",2018-01-23 10:05:08,狗屎今天没戏唱了，下午看大盘暴跌
刚谁割肉的,"https://guba.eastmoney.com/news,300378,742717496.html",2018-01-23 09:42:25,刚谁割肉的
不把这垃圾搞死誓不罢休。,"https://guba.eastmoney.com/news,300378,742761800.html",2018-01-23 11:23:22,不把这垃圾搞死誓不罢休。
这么多狗出来了，看来还要继续向下。,"https://guba.eastmoney.com/news,300378,742749994.html",2018-01-23 10:54:13,这么多狗出来了，看来还要继续向下。
我是230元买的，现在90%没了,"https://guba.eastmoney.com/news,300378,601664215.html",2017-02-06 11:22:34,呜呜呜呜
哎，无耻之尤，还要什么地步才够，非得要搞出人命吗,"https://guba.eastmoney.com/news,300378,742216023.html",2018-01-19 09:27:20,哎，无耻之尤，还要什么地步才够，非得要搞出人命吗
别报有希望了，这股不行的,"https://guba.eastmoney.com/news,300378,742704292.html",2018-01-23 08:07:14,别报有希望了，这股不行的
鼎捷软件必须对股价暴跌负责,"https://guba.eastmoney.com/news,300378,742549196.html",2018-01-22 10:40:00,鼎捷软件必须对股价暴跌负责，理由有三：1.长期以来，高层接连不断减持，致使股价暴跌近百分之九十，声称还要继续坚持，与国家保护中小投资者权益直接违背；2.对中伤公司的谣言迟迟不澄清，致使股价再次暴跌；3股价暴跌后，接二连三发布一些没有实质内容的公告，以继续忽悠投资者，没有任何作为。有鉴如此，我呼吁广大投资者积极行动起来，向证监会举报该公司，迫使他停止减持和增持该公司股票，让股价回到正常价位！
一篇报道的时机，正是前几日拉高放量后的下跌低位时，致使股价再次大跌？……,"https://guba.eastmoney.com/news,300378,742687681.html",2018-01-22 22:54:37,一篇报道的时机，正是前几日拉高放量后的下跌低位时，致使股价再次大跌？……
快买，早晨之星，历史低位。,"https://guba.eastmoney.com/news,300378,742644088.html",2018-01-22 16:43:45,快买，早晨之星，历史低位。
大胆买入,"https://guba.eastmoney.com/news,300378,742619037.html",2018-01-22 14:45:32,大胆买入
12.76全仓买入，下午大涨,"https://guba.eastmoney.com/news,300378,742545298.html",2018-01-22 10:31:11,12.76全仓买入，下午大涨
什么时候出业绩预增公告,"https://guba.eastmoney.com/news,300378,742628952.html",2018-01-22 15:12:01,今晚吗？
大盘要暴跌了，大家小心!,"https://guba.eastmoney.com/news,300378,742532089.html",2018-01-22 10:03:26,大盘要暴跌了，大家小心!
本月必破10元,"https://guba.eastmoney.com/news,300378,742499919.html",2018-01-21 23:28:13,4年了，赤条条来赤条条去，挥一挥衣袖不带走一片云彩
狗庄这样操盘就不好玩了，该拉的时候还是要拉一下,"https://guba.eastmoney.com/news,300378,742585522.html",2018-01-22 13:12:34,狗庄这样操盘就不好玩了，该拉的时候还是要拉一下
绝种股票，伤天害理，迟早给天收,"https://guba.eastmoney.com/news,300378,742591162.html",2018-01-22 13:30:34,绝种股票，伤天害理，迟早给天收
没有二三年不会让解套的，该干嘛干嘛去。,"https://guba.eastmoney.com/news,300378,742588185.html",2018-01-22 13:21:09,没有二三年不会让解套的，该干嘛干嘛去。
割在地板上[胜利],"https://guba.eastmoney.com/news,300378,742582898.html",2018-01-22 13:00:59,割在地板上
必须追究假新闻的鸡者！,"https://guba.eastmoney.com/news,300378,742574238.html",2018-01-22 11:52:30,必须追究假新闻的鸡者！
现在买肯定不会亏，我都亏15个点了，都不怕，你们现在买进怕什么啊,"https://guba.eastmoney.com/news,300378,742306722.html",2018-01-19 13:51:39,现在买肯定不会亏，我都亏15个点了，都不怕，你们现在买进怕什么啊
鼎捷软件庄家也有点小聪明，筹码收集不够，给点钱收买写手，跌停收集筹码，以后慢慢拉,"https://guba.eastmoney.com/news,300378,742572976.html",2018-01-22 11:45:00,鼎捷软件庄家也有点小聪明，筹码收集不够，给点钱收买写手，跌停收集筹码，以后慢慢拉升，高
创业板的败类。,"https://guba.eastmoney.com/news,300378,742563114.html",2018-01-22 11:14:55,创业板的败类。
