标题,链接,发布时间,内容
腾讯现在四处投资，说明什么？说明主业不赚钱啊！只有靠投资回报来保业绩了，不过恕我,"https://guba.eastmoney.com/news,600690,745913795.html",2018-02-08 21:16:40,"
腾讯现在四处投资，说明什么？说明主业不赚钱啊！只有靠投资回报来保业绩了，不过恕我直言，腾讯的投资大多很盲目，中国最赚钱的行业不是超市不是电动汽车不是手游而是家电和房地产，建议有钱就去买家电行业里的海尔格力；或者地产行业里的荣盛发展，估值低而且还是正宗地道的雄安概念，不比什么步步高永辉超市业绩好多了！"
价值崩盘了，上证跌的目瞪口呆,"https://guba.eastmoney.com/news,600690,745846839.html",2018-02-08 14:13:34,哈哈
管理层天天强调的是价值投资，家电是目前最具价值投资的行业，海尔估值非常低，比美的,"https://guba.eastmoney.com/news,600690,745897236.html",2018-02-08 18:02:42,管理层天天强调的是价值投资，家电是目前最具价值投资的行业，海尔估值非常低，比美的格力泡沫小一倍，业绩增长最快，高端家电行业垄断度最高，公认的大白马，下周反弹行情一触即发！
不管海尔什么时候涨，反正它总是要涨的。不像有些股票，呵呵，我就不点名了,"https://guba.eastmoney.com/news,600690,745187541.html",2018-02-05 15:02:59,不管海尔什么时候涨，反正它总是要涨的。不像有些股票，呵呵，我就不点名了
海尔是世界500强，难道只只18块,"https://guba.eastmoney.com/news,600690,745825127.html",2018-02-08 13:11:31,海尔是世界500强，难道只只18块
指数补缺口任务已完成，再跌的理由莫须有。,"https://guba.eastmoney.com/news,600690,745910925.html",2018-02-08 20:43:09,下面是整数关，虽然不是什么强支撑，没有理由下跌是最大支撑。再说，乐视保千里都蜂拥而入，还有什么股不可买呢？！能买股更是强支撑。今天我已经吃了，明天低开不低开开盘再吃，节日前后的红包会有的，因为股价已经回到今年的起涨价了。
散户都看好，就赶紧跑,"https://guba.eastmoney.com/news,600690,745899412.html",2018-02-08 18:30:27,散户都看好，就赶紧跑
现在买入海尔套住你3年,"https://guba.eastmoney.com/news,600690,745908615.html",2018-02-08 20:17:20,现在买入海尔套住你3年
同志们抛货离场买入000651,"https://guba.eastmoney.com/news,600690,745907186.html",2018-02-08 20:02:52,同志们抛货离场买入000651
有人卖有人买,"https://guba.eastmoney.com/news,600690,745906692.html",2018-02-08 19:57:09,kkr赚了钱卖了1亿多股，新加坡政府投资公司GIC继续看好海尔增持1亿多股，海尔股友们，轻松一下吧
海尔牛逼，跨国大公司，德国上市,"https://guba.eastmoney.com/news,600690,745906068.html",2018-02-08 19:49:31,海尔牛逼，跨国大公司，德国上市
三只家电股中相对大盘本周4个交易日，海尔最强,"https://guba.eastmoney.com/news,600690,745892690.html",2018-02-08 17:17:37,"大盘跌去刚好200点，跌幅为5.8%。三只家电股中，海尔跌幅为4.6%；格力跌幅为9.1%；美的跌幅为10.23%。

我们没有理由不坚定对海尔的信心。"
开市全仓进，我就不信它不涨,"https://guba.eastmoney.com/news,600690,745822347.html",2018-02-08 12:59:23,开市全仓进，我就不信它不涨
价值投资树倒猢狲散，牌坊倒下，砸了谁？,"https://guba.eastmoney.com/news,600690,745900361.html",2018-02-08 18:42:50,倒霉的当然还是不散。本不存在的价值投资，即使存在有这样的股，也从来没有这样的机构这样的炒股人。抱团取暖只是出于无奈炒作，偏要披着投资的外衣鼓噪小散抬轿子。不仅如此，更无所不用其极，使尽各种手段操盘，迫使小散进入团子中去！如今，终于原形毕露，暴跌而下，抱团的堰塞湖决了堤，冲击的还是炒股的人！他们的下跌丑态並不比小票的下跌绅士多少！除此之外，砸倒的是中国股市的形象。
唱多的人还很多，估计还得回调到13元左右。,"https://guba.eastmoney.com/news,600690,745900262.html",2018-02-08 18:41:17,唱多的人还很多，估计还得回调到13元左右。
年前海尔到21费劲了,"https://guba.eastmoney.com/news,600690,745897911.html",2018-02-08 18:10:31,年前海尔到21费劲了
抄底抄底第一目标20.8,"https://guba.eastmoney.com/news,600690,745856145.html",2018-02-08 14:37:48,抄底抄底第一目标20.8
18.8买入，明天跑,"https://guba.eastmoney.com/news,600690,745874646.html",2018-02-08 15:43:26,18.8买入，明天跑
今天收红怎么样？,"https://guba.eastmoney.com/news,600690,745858294.html",2018-02-08 14:42:44,行，我看行！
说了到18抄底，真正到了没人敢抄,"https://guba.eastmoney.com/news,600690,745817219.html",2018-02-08 12:15:24,说了到18抄底，真正到了没人敢抄
千金难买牛回头！,"https://guba.eastmoney.com/news,600690,745877532.html",2018-02-08 16:05:25,千金难买牛回头！
快加仓,"https://guba.eastmoney.com/news,600690,745866243.html",2018-02-08 14:59:56,快加仓
看股吧，这热闹度，太多小散在死守了，想反弹难，估计还得跌一阵子，除非主力脑子发热,"https://guba.eastmoney.com/news,600690,745874654.html",2018-02-08 15:43:29,看股吧，这热闹度，太多小散在死守了，想反弹难，估计还得跌一阵子，除非主力脑子发热拉起来让小散们出逃
别人恐惧就买入，没事，低了海尔这么大公司股价至少80,"https://guba.eastmoney.com/news,600690,745821528.html",2018-02-08 12:52:16,别人恐惧就买入，没事，低了海尔这么大公司股价至少80
我只是一个看好增长40%，市盈率16的公司的散户，结果让我意想不到。 花钱买经验,"https://guba.eastmoney.com/news,600690,745807185.html",2018-02-08 11:24:33,我只是一个看好增长40%，市盈率16的公司的散户，结果让我意想不到。 花钱买经验，远离股市
海尔商标就是两兄弟，就是说谁买了海尔，就让你们亏的只剩下内裤。,"https://guba.eastmoney.com/news,600690,745800839.html",2018-02-08 11:07:26,海尔商标就是两兄弟，就是说谁买了海尔，就让你们亏的只剩下内裤。
估计往十块去了[哭][哭][哭][哭],"https://guba.eastmoney.com/news,600690,745807377.html",2018-02-08 11:25:02,估计往十块去了
坚决不买海尔产品！,"https://guba.eastmoney.com/news,600690,745807587.html",2018-02-08 11:25:35,坚决不买海尔产品！
海尔是不是造假了……,"https://guba.eastmoney.com/news,600690,745809675.html",2018-02-08 11:30:58,海尔是不是造假了……
低位吸筹明天可能涨停,"https://guba.eastmoney.com/news,600690,745811370.html",2018-02-08 11:36:56,低位吸筹明天可能涨停
家电就数海尔最低拉起来吧！看好你,"https://guba.eastmoney.com/news,600690,745871297.html",2018-02-08 15:20:47,家电就数海尔最低拉起来吧！看好你
跌吧，17元见,"https://guba.eastmoney.com/news,600690,745804967.html",2018-02-08 11:18:57,跌吧，17元见
再买海尔剁手[傲],"https://guba.eastmoney.com/news,600690,745821889.html",2018-02-08 12:55:13,再买海尔剁手
天天是家电里跌幅第一。[不屑][不屑],"https://guba.eastmoney.com/news,600690,745831091.html",2018-02-08 13:30:15,天天是家电里跌幅第一。[不屑]
看样子真的很垃圾,"https://guba.eastmoney.com/news,600690,745834531.html",2018-02-08 13:39:18,看样子真的很垃圾
挂18.7，没买到！,"https://guba.eastmoney.com/news,600690,745867901.html",2018-02-08 15:04:47,挂18.7，没买到！挂多1毛就好了！
昨天轻轻松松跌0.97元，今天能涨3分不？,"https://guba.eastmoney.com/news,600690,745862152.html",2018-02-08 14:50:50,昨天轻轻松松跌0.97元，今天能涨3分不？
50猛跌，乐视猛涨，价值贞操呢？讽刺不？,"https://guba.eastmoney.com/news,600690,745869019.html",2018-02-08 15:09:15,还是价值投资吗。
兄弟们快上啊！我21.14的本，不转15个点不走,"https://guba.eastmoney.com/news,600690,745856128.html",2018-02-08 14:37:48,兄弟们快上啊！我21.14的本，不转15个点不走
神奇两点半 即将开始,"https://guba.eastmoney.com/news,600690,745847454.html",2018-02-08 14:14:49,神奇两点半 即将开始
弱势反抽。[不屑],"https://guba.eastmoney.com/news,600690,745866343.html",2018-02-08 15:00:16,弱势反抽。[不屑]
加仓艹明天大张,"https://guba.eastmoney.com/news,600690,745865360.html",2018-02-08 14:57:42,加仓艹明天大张
磨磨唧唧的,"https://guba.eastmoney.com/news,600690,745864453.html",2018-02-08 14:55:32,磨磨唧唧的
最后还是要跌的，赶紧出吧，明天跌更多,"https://guba.eastmoney.com/news,600690,745864225.html",2018-02-08 14:55:10,最后还是要跌的，赶紧出吧，明天跌更多
本轮拉升至24.32,"https://guba.eastmoney.com/news,600690,745863858.html",2018-02-08 14:54:21,本轮拉升至24.32
呼叫千手哥啊,"https://guba.eastmoney.com/news,600690,745863488.html",2018-02-08 14:53:37,
快涨吧！,"https://guba.eastmoney.com/news,600690,745861757.html",2018-02-08 14:49:58,快涨吧！
