标题,链接,发布时间,内容
妈的，涨五个点得个把月，跌八个点分分钟！,"https://guba.eastmoney.com/news,600690,746009683.html",2018-02-09 11:03:27,妈的，涨五个点得个把月，跌八个点分分钟！
同志们抛货离场，远离海尔,"https://guba.eastmoney.com/news,600690,746008922.html",2018-02-09 11:02:15,同志们抛货离场，远离海尔
买了1.2亿股我不信不护盘,"https://guba.eastmoney.com/news,600690,746008886.html",2018-02-09 11:02:10,买了1.2亿股我不信不护盘
被吓得增持一万…… ………元,"https://guba.eastmoney.com/news,600690,746008692.html",2018-02-09 11:01:51,"被吓得增持一万……
………元"
下软件，继续加仓，允许跌50%.不看盘，不盯盘，删软件。拜拜。,"https://guba.eastmoney.com/news,600690,746006999.html",2018-02-09 10:59:28,下软件，继续加仓，允许跌50%.不看盘，不盯盘，删软件。拜拜。
大盘跌成这个狗样，任何股都不能幸免，还在瞎bb，赶紧割肉离场吧。,"https://guba.eastmoney.com/news,600690,746006312.html",2018-02-09 10:58:29,大盘跌成这个狗样，任何股都不能幸免，还在瞎bb，赶紧割肉离场吧。
多说地狱有十八层，这回有多少层，我忍着，等着，,"https://guba.eastmoney.com/news,600690,746005687.html",2018-02-09 10:57:38,多说地狱有十八层，这回有多少层，我忍着，等着，
闭市头一天会涨,"https://guba.eastmoney.com/news,600690,746001284.html",2018-02-09 10:52:07,闭市头一天会涨
同志们怎么样,"https://guba.eastmoney.com/news,600690,745999459.html",2018-02-09 10:50:10,同志们怎么样
股灾也好，黎明也罢，我都再经历着大风大浪，然而并不孤独,"https://guba.eastmoney.com/news,600690,745999300.html",2018-02-09 10:50:00,股灾也好，黎明也罢，我都再经历着大风大浪，然而并不孤独
股灾[不屑],"https://guba.eastmoney.com/news,600690,745999163.html",2018-02-09 10:49:50,股灾[不屑]
跌停板等你,"https://guba.eastmoney.com/news,600690,745999138.html",2018-02-09 10:49:48,跌停板等你
必须割肉,"https://guba.eastmoney.com/news,600690,745969224.html",2018-02-09 10:00:06,必须割肉
真的只剩内裤了[兴奋],"https://guba.eastmoney.com/news,600690,745996947.html",2018-02-09 10:47:02,真的只剩内裤了
哇靠，跌停,"https://guba.eastmoney.com/news,600690,745996925.html",2018-02-09 10:47:01,哇靠，跌停
同志们抛货离场,"https://guba.eastmoney.com/news,600690,745996834.html",2018-02-09 10:46:52,同志们抛货离场
"哈哈哈，有看走眼了，又是一次无话可说。。。。。我是SB,不该炒股票","https://guba.eastmoney.com/news,600690,745996755.html",2018-02-09 10:46:44,"哈哈哈，有看走眼了，又是一次无话可说。。。。。我是SB,不该炒股票"
价值投资，鬼话,"https://guba.eastmoney.com/news,600690,745996350.html",2018-02-09 10:46:10,
原形毕露,"https://guba.eastmoney.com/news,600690,745996342.html",2018-02-09 10:46:09,原形毕露
机会来了,"https://guba.eastmoney.com/news,600690,745996074.html",2018-02-09 10:45:41,机会来了
你他妈的给老子跌停来，。。,"https://guba.eastmoney.com/news,600690,745995349.html",2018-02-09 10:44:19,你他妈的给老子跌停来，。。
坑人的海尔啊，何时才能解套,"https://guba.eastmoney.com/news,600690,745993115.html",2018-02-09 10:40:44,坑人的海尔啊，何时才能解套
你妈的青岛海尔，,"https://guba.eastmoney.com/news,600690,745992619.html",2018-02-09 10:40:00,你妈的青岛海尔，
加油，才第二,"https://guba.eastmoney.com/news,600690,745991020.html",2018-02-09 10:37:42,加油，才第二
感觉会跌到半年线,"https://guba.eastmoney.com/news,600690,745990392.html",2018-02-09 10:36:48,感觉会跌到半年线
股市这是要打垟啊？,"https://guba.eastmoney.com/news,600690,745989533.html",2018-02-09 10:35:19,好来好散嘛，指数主力擅长把人家的棺材抬家来哭！
赶紧卖了，留点钱回家过年。,"https://guba.eastmoney.com/news,600690,745989103.html",2018-02-09 10:34:28,赶紧卖了，留点钱回家过年。
海尔出利好都挡不住你下跌的势头！,"https://guba.eastmoney.com/news,600690,745988895.html",2018-02-09 10:34:02,海尔出利好都挡不住你下跌的势头！
随便你跌，反正我留给儿子了！,"https://guba.eastmoney.com/news,600690,745988310.html",2018-02-09 10:32:51,随便你跌，反正我留给儿子了！
在股市不止损就要吃亏,"https://guba.eastmoney.com/news,600690,745975952.html",2018-02-09 10:09:49,在股市不止损就要吃亏
没底了吗？[哭],"https://guba.eastmoney.com/news,600690,745985870.html",2018-02-09 10:27:30,没底了吗？
格力电器确实是中国家电行业的脊梁，海尔乃跟风小丑,"https://guba.eastmoney.com/news,600690,745985113.html",2018-02-09 10:25:49,不要指望投资垃圾公司能够挣到钱
股灾3.0,"https://guba.eastmoney.com/news,600690,745984294.html",2018-02-09 10:24:01,股灾3.0
现在跌成这样，劝大家割肉的贴子，都是庄托,"https://guba.eastmoney.com/news,600690,745983607.html",2018-02-09 10:22:39,现在跌成这样，劝大家割肉的贴子，都是庄托
周末就断定大盘会低开高走，没想到海尔会大跌，更没想到美的，格力都大跌……我个人认,"https://guba.eastmoney.com/news,600690,745208916.html",2018-02-05 16:55:29,周末就断定大盘会低开高走，没想到海尔会大跌，更没想到美的，格力都大跌……我个人认为他们更多时候跟随茅台的走势！
白马中属你最弱。,"https://guba.eastmoney.com/news,600690,745980609.html",2018-02-09 10:17:22,白马中属你最弱。
中国没整明白德国就好了。跌这逼样，能套死真牛逼。,"https://guba.eastmoney.com/news,600690,745978962.html",2018-02-09 10:14:38,中国没整明白德国就好了。跌这逼样，能套死真牛逼。
一天四个点,"https://guba.eastmoney.com/news,600690,745978809.html",2018-02-09 10:14:21,一天四个点
两个大利好叠加下跌5个点。,"https://guba.eastmoney.com/news,600690,745978636.html",2018-02-09 10:14:04,两个大利好叠加下跌5个点。
割肉离场,"https://guba.eastmoney.com/news,600690,745976318.html",2018-02-09 10:10:14,割肉离场
这个红包送的有点大！,"https://guba.eastmoney.com/news,600690,745976249.html",2018-02-09 10:10:10,估摸3200却奔3100而来，3字头能持否？！
10多个点了，该不该割肉,"https://guba.eastmoney.com/news,600690,745965371.html",2018-02-09 09:53:28,10多个点了，该不该割肉
你这个垃圾,"https://guba.eastmoney.com/news,600690,745974954.html",2018-02-09 10:08:30,你这个垃圾
涨的慢，跌的快啊,"https://guba.eastmoney.com/news,600690,745974695.html",2018-02-09 10:08:14,涨的慢，跌的快啊
永远是格力的跟屁虫，格力大涨他小涨，格力小跌他大跌sb傻的不能在傻了。这庄的脑袋,"https://guba.eastmoney.com/news,600690,745974134.html",2018-02-09 10:07:29,永远是格力的跟屁虫，格力大涨他小涨，格力小跌他大跌sb傻的不能在傻了。这庄的脑袋里不知道进了多少水。
千金难买龙回头，加油继续跌,"https://guba.eastmoney.com/news,600690,745959993.html",2018-02-09 09:43:56,千金难买龙回头，加油继续跌
必须防止亏损扩大,"https://guba.eastmoney.com/news,600690,745969052.html",2018-02-09 09:59:47,必须防止亏损扩大
你现在不割难道你亏损50%的时候割吗,"https://guba.eastmoney.com/news,600690,745966594.html",2018-02-09 09:55:31,你现在不割难道你亏损50%的时候割吗
亏损20%必须割肉,"https://guba.eastmoney.com/news,600690,745966106.html",2018-02-09 09:54:42,亏损20%必须割肉
实在受不了，亏13%割肉！呜呜呜呜呜呜呜呜呜呜呜呜呜呜呜呜，,"https://guba.eastmoney.com/news,600690,745943729.html",2018-02-09 09:03:19,实在受不了，亏13%割肉！呜呜呜呜呜呜呜呜呜呜呜呜呜呜呜呜，
涨停快买,"https://guba.eastmoney.com/news,600690,745952361.html",2018-02-09 09:31:48,涨停快买
已无力吐槽。。[大便][大便][大便][大便][大便],"https://guba.eastmoney.com/news,600690,745964731.html",2018-02-09 09:52:29,已无力吐槽。。[大便][大便][大便][大便][大便]
好成功的把老子的钱赔光了真他妈的垃圾,"https://guba.eastmoney.com/news,600690,745963137.html",2018-02-09 09:49:30,好成功的把老子的钱赔光了真他妈的垃圾
跌吧，17我来加仓,"https://guba.eastmoney.com/news,600690,745962161.html",2018-02-09 09:47:46,跌吧，17我来加仓
这么大的利好缺跌成这,"https://guba.eastmoney.com/news,600690,745954872.html",2018-02-09 09:36:17,这么大的利好缺跌成这
拿住手中的股票，坚持到底，别中主力的套,"https://guba.eastmoney.com/news,600690,745961326.html",2018-02-09 09:46:14,拿住手中的股票，坚持到底，别中主力的套
天天大跌，亏死了……这年没法过了！,"https://guba.eastmoney.com/news,600690,745960772.html",2018-02-09 09:45:22,天天大跌，亏死了……这年没法过了！
这股完蛋，已经失去了类似张瑞敏、董明珠企业家的股，没指望,"https://guba.eastmoney.com/news,600690,745960603.html",2018-02-09 09:45:03,这股完蛋，已经失去了类似张瑞敏、董明珠企业家的股，没指望
跌破16我就全部清仓[傲][傲][傲],"https://guba.eastmoney.com/news,600690,745960032.html",2018-02-09 09:44:01,跌破16我就全部清仓
增持有了，但减持更多,"https://guba.eastmoney.com/news,600690,745959559.html",2018-02-09 09:43:09,增持有了，但减持更多
吹牛皮的海尔，还不让发对它不利的消息,"https://guba.eastmoney.com/news,600690,745959170.html",2018-02-09 09:42:26,吹牛皮的海尔，还不让发对它不利的消息
所谓价值投资不过是骗局而已,"https://guba.eastmoney.com/news,600690,745958589.html",2018-02-09 09:41:33,所谓价值投资不过是骗局而已
跌就加,"https://guba.eastmoney.com/news,600690,745957526.html",2018-02-09 09:39:55,跌就加
吹牛皮的海尔，还不让发对它不利的消灭,"https://guba.eastmoney.com/news,600690,745957209.html",2018-02-09 09:39:25,吹牛皮的海尔，还不让发对它不利的消灭
很忐忑，这种走势一但破势特别在年前杀伤力特别强大，期望下午能收复失地！,"https://guba.eastmoney.com/news,600690,745113845.html",2018-02-05 10:47:15,很忐忑，这种走势一但破势特别在年前杀伤力特别强大，期望下午能收复失地！
没见有这么涨，跌起来这么快,"https://guba.eastmoney.com/news,600690,745955354.html",2018-02-09 09:36:56,没见有这么涨，跌起来这么快
第四次股灾 太疯狂了,"https://guba.eastmoney.com/news,600690,745954948.html",2018-02-09 09:36:26,！
美股大涨也没见你涨，美股大跌你跟的还他妈挺快,"https://guba.eastmoney.com/news,600690,745954888.html",2018-02-09 09:36:18,美股大涨也没见你涨，美股大跌你跟的还他妈挺快
今天直接砸跌停，唱多的还敢不敢了,"https://guba.eastmoney.com/news,600690,745954283.html",2018-02-09 09:35:25,今天直接砸跌停，唱多的还敢不敢了
快跑，沙尘暴来了。,"https://guba.eastmoney.com/news,600690,745953315.html",2018-02-09 09:33:39,快跑，沙尘暴来了。
大盘跌停得了，每天跌点累不累,"https://guba.eastmoney.com/news,600690,745952855.html",2018-02-09 09:32:45,大盘跌停得了，每天跌点累不累
快跑,"https://guba.eastmoney.com/news,600690,745951601.html",2018-02-09 09:30:05,快跑
[哭][哭],"https://guba.eastmoney.com/news,600690,745951240.html",2018-02-09 09:29:26,
新加坡政府投资公司在底下等着呢，还有类似的公司吧。,"https://guba.eastmoney.com/news,600690,745951075.html",2018-02-09 09:29:10,新加坡政府投资公司在底下等着呢，还有类似的公司吧。
有利好,"https://guba.eastmoney.com/news,600690,745948816.html",2018-02-09 09:24:39,有利好
停牌吧,"https://guba.eastmoney.com/news,600690,745950709.html",2018-02-09 09:28:30,"停牌吧
"
今天涨停,"https://guba.eastmoney.com/news,600690,745949857.html",2018-02-09 09:27:00,今天涨停
必须止损,"https://guba.eastmoney.com/news,600690,745949538.html",2018-02-09 09:26:20,必须止损
同志们割肉离场,"https://guba.eastmoney.com/news,600690,745947887.html",2018-02-09 09:22:16,同志们割肉离场
海尔股价明显偏低，格力，美的都40几了，海尔才20几，还有很多空间要涨。破小天鹅,"https://guba.eastmoney.com/news,600690,745927106.html",2018-02-09 01:16:13,海尔股价明显偏低，格力，美的都40几了，海尔才20几，还有很多空间要涨。破小天鹅的股价也那么高，而世界名牌股价却如此低，大家看错眼了，18年海尔股价大涨之年，坚守海尔就是挣钱之道。
青岛海尔是货真价实的好股票值得长期持有！,"https://guba.eastmoney.com/news,600690,745897158.html",2018-02-08 18:01:57,青岛海尔是货真价实的好股票值得长期持有！它比其它白电股票便宜，原因不是它比别人差，而是宣传力度不足。董事长总经理都是脚踏实地的实干家，少了点露面机会。人家格力的老板天天上央视作广告，价位就上去了呀！海尔也要学一学才行！股友们看法如何？
被外资抄底了,"https://guba.eastmoney.com/news,600690,745944326.html",2018-02-09 09:06:42,被外资抄底了
增持公告暴露外资已减持0.28亿股:增持减持股数外资公告表达并不清晰并不规范，对,"https://guba.eastmoney.com/news,600690,745925249.html",2018-02-09 00:11:16,增持公告暴露外资已减持0.28亿股:增持减持股数外资公告表达并不清晰并不规范，对比2017/9/30日季报确认其实外资合计减持0.28亿股（2.44-2.16=0.28亿股）。具体对比三季度持股数量，GIC原有0.77亿股现持有2.93亿股2.93-.0.77得出合计增持2.16亿股，而KKR原持有6.06亿股现余3.62亿股6.06-3.62得出合计减持应为2.44亿股（2018/2/9日公告KKR折价6%的1.22亿股减持只涉及50%的减持部分，KKR另外减持的还有一笔1.22亿股折价14%疑似2017/11/09大宗交易并没有明确公告卖方是KKR）
昨天想跑，但是质押中，跑不了,"https://guba.eastmoney.com/news,600690,745943164.html",2018-02-09 08:58:50,昨天想跑，但是质押中，跑不了
有种预感，美股昨晚又崩盘了，大A今天有可能在劫难逃,"https://guba.eastmoney.com/news,600690,745939823.html",2018-02-09 08:28:00,有种预感，美股昨晚又崩盘了，大A今天有可能在劫难逃
我昨天己6.8元买进交通银行，18.9元买进青岛海尔，22.3元买进招商蛇口，拉,"https://guba.eastmoney.com/news,600690,745940437.html",2018-02-09 08:35:43,我昨天己6.8元买进交通银行，18.9元买进青岛海尔，22.3元买进招商蛇口，拉升随时出货短线
来呀！来呀！孩儿，你新大爷来了！你还不撩着撅往上窜,"https://guba.eastmoney.com/news,600690,745939462.html",2018-02-09 08:22:39,来呀！来呀！孩儿，你新大爷来了！你还不撩着撅往上窜
最新头条：青岛海尔要去德国上市发行股票，首批批3家去德国上市的中国企业！境外青岛,"https://guba.eastmoney.com/news,600690,745938566.html",2018-02-09 08:10:22,最新头条：青岛海尔要去德国上市发行股票，首批批3家去德国上市的中国企业！境外青岛海尔被新加坡政府增持近5%。。。
青岛海尔02月08日获沪股通加仓556.65万股,"https://guba.eastmoney.com/news,600690,745936975.html",2018-02-09 08:01:26,"






























02月08日青岛海尔沪股通持仓数据
收盘价：	19.25	涨跌幅：	0.16%
持股量：	4.667亿股	持股变化：	556.65万股





数据显示，截至02月08日青岛海尔于沪股通持股量为4.667亿股，占其A股股本比例为7.65%，比上一交易日增加556.65万股。据数据统计，该股近一个月内累计涨幅为-2.92%，沪股通持仓累计变化比例为-14.98%，近三个月内累计涨幅为6.53%，沪股通持仓累计变化比例为-14.56%。


数据来源:东方财富




"
我擦，跑了3/4仓，来了2利好[滴汗][滴汗]恭喜坚守的人，也恭喜自己还有1/4,"https://guba.eastmoney.com/news,600690,745926423.html",2018-02-09 00:47:24,我擦，跑了3/4仓，来了2利好恭喜坚守的人，也恭喜自己还有1/4仓
国内首家德国上市企业，不知道明天是不是涨停,"https://guba.eastmoney.com/news,600690,745905599.html",2018-02-08 19:44:12,"国内首家德国上市企业，不知道明天是不是涨停
"
现在可以解释一切不解了！只想问：今天你卖出海尔了吗？,"https://guba.eastmoney.com/news,600690,745909649.html",2018-02-08 20:29:09,现在可以解释一切不解了！只想问：今天你卖出海尔了吗？
太贱格了。。,"https://guba.eastmoney.com/news,600690,745929575.html",2018-02-09 03:25:49,太贱格了。。
明天格力涨到55，它涨到23,"https://guba.eastmoney.com/news,600690,745815187.html",2018-02-08 11:59:04,明天格力涨到55，它涨到23
明天会有海尔准备在德国上市的消息，，，注意了,"https://guba.eastmoney.com/news,600690,745905321.html",2018-02-08 19:40:32,明天会有海尔准备在德国上市的消息，，，注意了
[cp]回复@村里人1963:[哈哈]//@村里人1963:三天改变三观。媒体有,"https://guba.eastmoney.com/news,600690,745926346.html",2018-02-09 00:44:21,[cp]回复@村里人1963://@村里人1963:三天改变三观。媒体有人在嘲笑价值投资了，说什么PEPPb那是过去式，企业的价值在未来，说什么银行增长那么低，有价值吗？好像价值投资者都是形而上学者，只会用静止的不变的观点看待PE似的。[/cp]
海尔是世界白电老二，价值投资极品。我的125000股放3年。,"https://guba.eastmoney.com/news,600690,745915119.html",2018-02-08 21:33:13,海尔是世界白电老二，价值投资极品。我的125000股放3年。
海尔为何不整体上市?,"https://guba.eastmoney.com/news,600690,745909823.html",2018-02-08 20:31:00,海尔为何不整体上市?
下午已经发帖，坚定价值投资，我没有什么内幕，也不怎么会看k线，只是小散户一枚。不,"https://guba.eastmoney.com/news,600690,745925312.html",2018-02-09 00:12:50,下午已经发帖，坚定价值投资，我没有什么内幕，也不怎么会看k线，只是小散户一枚。不过我研究了很久海尔这家公司，确实是一家伟大的公司，刚刚公告看到消息，让我更加坚定了，长期持有海尔！
公司点评：关于KKR通过大宗交易转让2%的股权给新加坡政府投资（GIC）的点评,"https://guba.eastmoney.com/news,600690,859780619.html",2018-02-09 00:00:00,
散户都看好，海尔涨不了,"https://guba.eastmoney.com/news,600690,745908942.html",2018-02-08 20:21:31,散户都看好，海尔涨不了
快买海尔明天涨停,"https://guba.eastmoney.com/news,600690,745829568.html",2018-02-08 13:25:59,快买海尔明天涨停
18.8买了5000股，美股在跌，海尔明天会不会跌?有点担心。,"https://guba.eastmoney.com/news,600690,745924088.html",2018-02-08 23:44:17,18.8买了5000股，美股在跌，海尔明天会不会跌?有点担心。
海尔才是真正的世界级公司，新加坡投资公司找投海尔为什么？价值所值吧！将开启海尔腾,"https://guba.eastmoney.com/news,600690,745919242.html",2018-02-08 22:31:42,海尔才是真正的世界级公司，新加坡投资公司找投海尔为什么？价值所值吧！将开启海尔腾飞之时。
上周家电板块行情： 本周（ 1 月 22 日到 1 月 28 日）家用电器行业指,"https://guba.eastmoney.com/news,600690,745923126.html",2018-02-08 23:27:25,"上周家电板块行情：
本周（ 1 月 22 日到 1 月 28 日）家用电器行业指数收益率为 5.68%，高于沪深 300 指数（ 2.24%）。 28 个 SW 一级行业指数涨幅排行榜中，家电排在第1 位。家电三级行业中， 空调涨幅最大， 彩电跌幅最大。
上周行业重要事件及点评：
1 月 22 日，全球空调、制冷和供暖的专业性展览会美国 AHR 制冷展在芝加哥举行。 统计数据显示，海尔+GE Appliances 空调份额为 27.2%，超过伊莱克斯旗下品牌 Frigidaire 位居第一。 最新市场数据显示，美国空调市场份额占比 TOP5 分别是：海尔+GE Appliances 双空调品牌占比 27.2%、伊莱克斯 17.7%、LG11.1%、 Kenmore 5.8%、 Whirlpool 2.5%。产业在线公布的数据显示， 2017冷年美国空调市场规模达到 1094 万套。"
青岛海尔目前操作空间已不大，这次大盘调整刚好调仓换股，明天清仓了，转战宝钢股份，,"https://guba.eastmoney.com/news,600690,745910946.html",2018-02-08 20:43:27,"青岛海尔目前操作空间已不大，这次大盘调整刚好调仓换股，明天清仓了，转战宝钢股份，这
五粮液目前操作空间已不大，这次大盘调整刚好调仓换股，明天清仓了，转战宝钢股份，这次宝钢最佳机会来了，
宝钢：宝钢周五早盘调整后，震荡上行，午后大幅拉升，量价之间配合完美，周五振幅11个点再创新高，但是量能指标环比有所缩小（此种情况非常健康），从技术指标和技术形态看，通过复盘看来看去，都没有看到做头迹象，目前总体比较健康，唯一担心的是，由于涨势教急均线系统不能有效跟进，周五5日均线10.23元.10日均线9.84元，按照惯性推断，今天5日均线10.55元，10日均线10.05元（均线是根据股价变化而变化，所以只能根据体现出来的数据，进行推算，当然误差不会太大），今天均线系统不能有效跟进，理论上讲后市有几种可能走势，（一）高位震荡整理，等待均线系统的跟进（二）快速急跌主动寻求均线支撑。（三）继续快速大幅拉升，迫使均线系统的快速上移跟进。个人认为第一种和第三种概率较高，原因如下：宝钢突破前期高点后，很多散户恐高被洗出局，如果在此位置下跌，那些出局资金势必回来抢筹，换位思考如果您是主力，您会怎么做？？？我会继续拉升，将他们彻底抛弃，同时继续洗出恐高盘和获利盘，快速脱离前期高点位置后，再进行技术指标技术形态的整理，从近期量能指标观察，此种主力意图非常明显。当然由于涨势教急，如果您心里不踏实，在今天如果出现跳空缺口，在拉升过程中，可以考虑适当减仓，如果今天没有出现跳空缺口，如果继续上拉多关注量价之间的配合，如果今天开盘进行调整，直接忽略不必担心，此位置调整是技术性调整，是修复技术形态和技术指标，为继续新高进行蓄势。下面这句话是上周帖子中的观点，复制过来。宝钢10元是价值回归，10元以上是市场对未来的预期，宝钢突破已经创出近10年的新高，前天说站上10元，新的空间瞬间打开，看来看去确实如此，通过这两天的量能变化看，前面几天出局散户相当的多，宝钢股吧估计也就3-5千人，实际场外几十万散户恐高疯狂出局，一季度股东户数56万人，二季度51万人，3季度46万人，此次宝钢再创新高后，估计股东户数不到40万人，一年出局16万人，那些筹码去那了？？？从这几天的技术形态来看，散户出局的筹码已被主力吸走，宝钢后市走势将会越来越快，量能也会越来越小，只要不放天量一直耐心持有，一般很少预估股价，在这保守的预估一下，10元上方已经没有重要压力位，能参考的就是2008年5月份的14元平台，一旦再突破，直接剑指2008年2月的18元高点平台（当然已经10年了，那些参考意义已经不是太大），宝钢天时地利人和都已具备，耐心持有定有非常好的回报。"
新加坡政府投资公司（Government of Singapore Invest,"https://guba.eastmoney.com/news,600690,745908504.html",2018-02-08 20:16:09,"新加坡政府投资公司（Government of Singapore Investment Corp，简称GIC），成立于1981年5月22日，是新加坡最大的国际投资机构，其主要任务是管理新加坡的外汇储备，跨出新加坡国界向海外大举投资。公司一直被称为""亚洲最大及最神秘的投资者""，目前管理的资产超过千亿美元，其规模与巴菲特掌管的投资帝国Berkshire相当。"
这几天的大跌应该与外资減持没有关系，因外资是通过大宗交易减持的，对二级市场的股价,"https://guba.eastmoney.com/news,600690,745918484.html",2018-02-08 22:20:15,这几天的大跌应该与外资減持没有关系，因外资是通过大宗交易减持的，对二级市场的股价没有什么影响。估计还是国内机构投资者减持而引发股价下跌的。
喂喂喂，老大老二都红了，小老三别太过分啊,"https://guba.eastmoney.com/news,600690,745827198.html",2018-02-08 13:18:24,喂喂喂，老大老二都红了，小老三别太过分啊
总觉得现在海尔美的都比格力安全,"https://guba.eastmoney.com/news,600690,745869652.html",2018-02-08 15:12:11,总觉得现在海尔美的都比格力安全
海尔将去德国上市,"https://guba.eastmoney.com/news,600690,745910396.html",2018-02-08 20:37:17,海尔将去德国上市
格力净利润154亿，海尔区区58亿[大笑],"https://guba.eastmoney.com/news,600690,745907258.html",2018-02-08 20:03:33,格力净利润154亿，海尔区区58亿
还不如人家乐视网,"https://guba.eastmoney.com/news,600690,745839771.html",2018-02-08 13:54:41,[大便][大便][大便]
