标题,链接,发布时间,内容
已经买入  现已被套  16块多的高峰,"https://guba.eastmoney.com/news,600803,658488499.html",2017-06-21 10:12:44,哦
庄们快砸到13以下，我要来了！拜托了,"https://guba.eastmoney.com/news,600803,659694855.html",2017-06-23 10:32:06,庄们快砸到13以下，我要来了！拜托了
食用盐,"https://guba.eastmoney.com/news,600803,660208382.html",2017-06-24 20:16:11,食用盐
新奥股份：研判，下周在此点位全仓杀入是否正确（分析讨论）,"https://guba.eastmoney.com/news,600803,657094380.html",2017-06-18 18:26:19,"个股表现：长期走势表现平稳，短期走势相对强于大盘，相对强于行业

主力动向：机构持股集中度较上期无明显变化，近期受机构关注度明显下降，当日资金净流量-4845万元，5日资金净流量-13474万元

行业研究：该股属于化学制品行业，行业中期趋势相对弱于大盘，行业机构持股集中度较上期无明显变化

公司运营：公司在行业内盈利优势一般，公司的成长能力一般，主营业务优势相对较为明显，运营能力相对较差，近期财务状况优秀

投资风险：DMI发出卖出信号。

盘面解读：近期各指的反弹幅度已较高、乖离也较大，而成交没有有效跟进，且股指已遇重要的压力位。因此，回调不可避免，但回调的幅度不会过深。再之后，大盘应上扬创出新高，补上4月中旬的下跌缺口，大为可期!

下周操作策略：继续的布局低位的题材个股！拉升的千万不要追！"
更正：6.23收盘价为14.98元。哈哈哈!,"https://guba.eastmoney.com/news,600803,659470148.html",2017-06-22 22:00:13,更正：6.23收盘价为14.98元。哈哈哈!
这庄太小气  在努力点最起码砸到13.20嘛,"https://guba.eastmoney.com/news,600803,659732344.html",2017-06-23 11:24:49,丟人啊 小庄你这超盘能力让我失望
今天竞价与往有些不同[围观],"https://guba.eastmoney.com/news,600803,659226590.html",2017-06-22 14:13:20,美康生物的三个代表：是次新股中走势最差的代表
为此,"https://guba.eastmoney.com/news,600803,661072961.html",2017-06-27 01:53:13,为此
一大早就蹦出这么多跳蚤，一个个拍死！,"https://guba.eastmoney.com/news,600803,662434740.html",2017-06-29 09:09:38,
停止阻击，卖出走人,"https://guba.eastmoney.com/news,600803,659785337.html",2017-06-23 13:09:57,下月初9元再回来买回！
要下来了。系好安全带。,"https://guba.eastmoney.com/news,600803,659666231.html",2017-06-23 09:48:23,要下来了。系好安全带。
跳水比赛,"https://guba.eastmoney.com/news,600803,659240796.html",2017-06-22 14:31:15,跳水比赛
菲利华:北京盈科(武汉)律师事务所关于公司限制,"https://guba.eastmoney.com/news,600803,660128356.html",2017-06-24 11:16:34,无影脚真是厉害！
明天不跌！天理不容！,"https://guba.eastmoney.com/news,600803,658720150.html",2017-06-21 16:50:28,太不正常了！
这时候下车卖股票，纯属1949年加入国民。胜利在招手……,"https://guba.eastmoney.com/news,600803,661135761.html",2017-06-27 07:04:28,这时候下车卖股票，纯属1949年加入国民。胜利在招手……
新奥股份：这三股有望再起攻势，今日买入是否一本万利,"https://guba.eastmoney.com/news,600803,659970772.html",2017-06-23 20:20:16,"该股诊断：该股为大盘股，中价股。均线系统呈多头排列，均线短期卖出，DMI发出买入信号，长期走势表现平稳，短期走势相对弱于大盘，相对弱于行业。机构持股集中度较上期无明显变化，近期受机构关注度明显下降，当日资金净流量-9252万元，5日资金净流量-18222万元。该股属于化学制品行业，行业中期趋势相对弱于大盘，行业机构持股集中度较上期无明显变化。公司在行业内盈利优势一般，公司的成长能力一般，主营业务优势相对较为明显，运营能力相对较差，近期财务状况优秀。总体价值处于正常水平。机构预测该股未来盈利一般，机构三个月内最新投资评级为增持。


这三股有望再起攻势，逢低介入看涨30%"
骂大师的出来走两步！还有不服的吗？,"https://guba.eastmoney.com/news,600803,659213050.html",2017-06-22 13:55:55,
请问鄂尔多斯招聘试验工程师-石墨烯更新日,"https://guba.eastmoney.com/news,600803,656250074.html",2017-06-16 12:47:05,"请问鄂尔多斯招聘试验工程师-石墨烯更新日期：2017-04-19新奥生态控股股份有限公司 — 新奥集团石墨烯项目组，这是否意味着新奥石墨烯产业化项目归属上市公司体系内？
新奥股份
新奥股份：您好，石墨烯项目并不在公司体系内，其归属于公司实际控制人王玉锁先生控制的其他企业，如欲了解相关情况建议咨询新奥集团。
答复时间 2017-06-27 10:52:59"
600803:新奥股份关于Santos聘任新董事的公告,"https://guba.eastmoney.com/news,600803,660881299.html",2017-06-26 18:38:37,"公告日期：2017-06-27
证券代码：600803 证券简称：新奥股份 公告编号：临2017-068



证券代码：136124 证券简称：16新奥债



新奥生态控股股份有限公司



关于Santos聘任新董事的公告



本公司董事会及全体董事保证本公告内容不存在任何虚假记载、误导性陈述或者重大遗漏，并对其内容的真实性、准确性和完整性承担个别及连带责任。



新奥生态控股股份有限公司（以下简称“公司”）于2017年6月26日接到



Santos通知，Santos董事会提名委员会认为公司提名的董事候选人史玉江先生



具备能够适当履行其作为Santos董事的职责所需的必要技能、知识及经验，



Santos董事会于2017年6月26日任命史玉江先生为Santos非执行董事。该任



命增强了公司对Santos的影响，进一步搭建了公司与Santos之间的沟通合作机



制。



特此公告。



新奥生态控股股份有限公司



董事会



二〇一七年六月二十六日




[点击查看PDF原文]
提示：本网不保证其真实性和客观性，一切有关该股的有效信息，以交易所的公告为准，敬请投资者注意风险。
展开阅读全文"
他妈的，13.65已经割了,"https://guba.eastmoney.com/news,600803,660638456.html",2017-06-26 11:54:53,他妈的，13.65已经割了
坚定持有，待会凑点钱再补仓,"https://guba.eastmoney.com/news,600803,661768744.html",2017-06-28 08:36:41,坚定持有，待会凑点钱再补仓
如你看好就要静待花开，不要急躁，呵护,"https://guba.eastmoney.com/news,600803,661813139.html",2017-06-28 10:02:34,如你看好就要静待花开
安逸,"https://guba.eastmoney.com/news,600803,657468087.html",2017-06-19 14:25:14,我在13左右等你
配股，价多少？,"https://guba.eastmoney.com/news,600803,659001068.html",2017-06-22 07:40:10,配股，价多少？
投资者对配股用脚投票！,"https://guba.eastmoney.com/news,600803,659256288.html",2017-06-22 14:49:45,辣鸡公司
怎么砸的再怎么拉回去!这叫搬起石头砸自己的脚!脚脚脚!狗庄鸟庄怂了?,"https://guba.eastmoney.com/news,600803,659828788.html",2017-06-23 14:23:50,怎么砸的再怎么拉回去!这叫搬起石头砸自己的脚!脚脚脚!狗庄鸟庄怂了?
今后炒大华、茅台、海康就行,"https://guba.eastmoney.com/news,600803,659823257.html",2017-06-23 14:15:10,今后炒大华、茅台、海康就行
一切皆为生意，14.5元的筹码被庄13.5元收走，没有做空只有做多！,"https://guba.eastmoney.com/news,600803,662046418.html",2017-06-28 15:59:35,一切皆为生意，14.5元的筹码被庄13.5元收走，没有做空只有做多！
东吴证券资深投顾彭翔 今天17:32 发改委：对百度等8家企业境外发行债券予以登,"https://guba.eastmoney.com/news,600803,660008103.html",2017-06-23 22:35:21,"东吴证券资深投顾彭翔
今天17:32
发改委：对百度等8家企业境外发行债券予以登记财联社23日讯，据国家发改委网站消息，对八家公司境外发行债券予以登记。包括四家地产公司：碧桂园集团、龙湖地产、金地集团、花样年集团。另四家为百度在线网络技术、山东清源集团、新奥燃气、中泰证券。中国电力建设集团、远东宏信完成境外发行债券。不知是不是真的?"
这种古式国人都难相信,"https://guba.eastmoney.com/news,600803,659923446.html",2017-06-23 17:59:06,哎，太假了，好漂亮的小双底
有重磅利好，等下拉升5个点以上[摊手][献花][献花][献花][献花][献花][,"https://guba.eastmoney.com/news,600803,658039868.html",2017-06-20 14:02:14,有重磅利好，等下拉升5个点以上
买港股2699新奥能源去吧,"https://guba.eastmoney.com/news,600803,659664364.html",2017-06-23 09:44:39,此股没有新奥集团核心资产[大便]
娘了个比的 中午卖出 尾盘拉 还他妈的割肉  过来一看 这个逼样,"https://guba.eastmoney.com/news,600803,660782171.html",2017-06-26 15:38:22,卖假化肥的吧
