标题,链接,发布时间,内容
融创投资乐视失败？孙宏斌:才刚开始我还没开始干,"https://guba.eastmoney.com/news,300104,743575707.html",2018-01-28 11:05:10,"融创投资乐视失败？孙宏斌:才刚开始我还没开始干
2017-11-06 08:47:03　来源: 中国企业家网(北京) 举报
12507分享到：
易信

QQ空间
微博
（原标题：融创投资乐视失败？孙宏斌回应：乐视才刚开始，我还没开始干呢）
融创投资乐视失败？孙宏斌:才刚开始我还没开始干
摄影：肖海强
“老贾就是典型的逆境的时候完全失去平衡。”
近来，关于乐视的坏消息一个接着一个。
先是上任仅5个月的乐视CEO梁军等高管辞职；紧接着又有媒体报道，因乐视网IPO财务造假，参与其IPO的多名发审委委员被采取强制措施。而乐视网的最新财报显示，前三季度，乐视营收60.95亿元，同比下降63.67%，净利润为亏损16.52亿元，同比下降435.02%。
接手了这个“烫手山芋”的孙宏斌现在怎么样？
11月5日，融创中国董事长孙宏斌在出席武大企业家联谊会长三角峰会主办的“新时代?新未来高峰论坛”时主动回应了融创投资乐视和万达的问题。他认为投资乐视符合逻辑，乐视最大的问题是管理问题；投资万达“是一笔太好的生意”。从房地产发展的角度来看，下半场是要为人们构建美好生活，投资乐视、万达，就是投资美好生活。孙宏斌并不回避当前的挑战，但他在逆境的时候浑身是劲。“没什么挑战，成天吃了睡睡了吃，没什么意思，有挑战的时候有意思多了。”
孙宏斌对贾跃亭的评价似乎始终未变。“很多企业家在顺境的时候特别会干，逆境的时候什么都不会干，老贾（贾跃亭）就是典型的逆境的时候完全失去平衡”。他表示，“贾跃亭家里有房子，有点存款，很正常，但他没拿公司的钱回家是事实，但可悲的是舆论不相信，真相被稀释了”。
针对有人认为融创投资乐视失败的问题，孙宏斌表示，“乐视才刚开始，我还没开始干活呢，你就说亏了，失败了，这不符合事实。”
孙宏斌坚信投资乐视是符合逻辑的。他说，投乐视的逻辑，就是投大文化、大娱乐。当时把乐视的账也看得挺明白的。乐视是典型的大文化、大娱乐，因为它的大屏智能电视，是一个家庭娱乐的客厅里很重要的文化娱乐的场景内容。内容将来是越来越值钱的。
孙宏斌认为，乐视最大的问题是管理。因为此前在没有良好管理能力、管理资源的情况下，贾跃亭请了很多所谓的大咖高管，大咖们谁都不服谁，没办法管理。“这段时间自己什么都没干，专心整理股权。现在非上市部分股权结构整理得差不多了，乐视的业务马上开始启动”。
对于房地产行业，孙宏斌认为上半场是房地产的高周转和精品化，融创在上半场就是领跑者。在接下来的下半场，房地产要为人们构建美好生活。
而构建美好生活又与收购万达的项目有关。孙宏斌表示，像万达这样的项目，在中国，从头做，没有十几年的时间做不到今天，而万达从2009年开始做，七八年就成这个样子，是一个成功的公司。
“我们原来做房地产，有个4、5、6。后来买了个3，就是乐视。现在有了万达文旅，就是7，手上的牌成了一把‘顺子’”。孙宏斌说，目前，全世界都在做垂直领域，苹果开始投钱做电影电视，亚马逊也开始投钱做视频、拍电影。未来的发展方向是垂直领域，公司要有自己的IP、渠道、内容、场景，乐视加上融创、万达，就是一个IP内容的渠道和场景，可以对标迪士尼。乐视加上融创、万达，可以构成一个普通人的美好生活，先买套房子，再回家看个乐视电视，电视上放我们的电影，然后出门到万达城玩。
以下是孙宏斌的演讲内容（有删节）：
在90年代到2000年的时候，最早我提了房地产行业的高周转，当时现金到现金的模式是万科最先学的，后来恒大也学，碧桂园也学，那时候是对的。
因为这个行业没有规模就没法玩，规模大才能快速周转。为什么很多人都挣很多钱，因为它容易做规模，因为它有杠杆，因为它可以用银行的钱、客户的钱、建筑商的钱，所有的钱都是应付款，从来没有应收款。
我估计这个阶段还得5年的时间，这是第一阶段。
第二阶段，我们在2008年的时候提出了高端精品，要改善住宅，改善应用的高端。第二个阶段我们在引领市场。
第三个阶段，万科提出房地产是白银时代，我说这太扯了。为什么呢，当时我说我要做利润100亿的时候，他们都说我疯了，现在随便一个公司的利润都超过100亿了，今年融创的利润三四百亿。所以你说这是白银时代，这不扯嘛。
我说这是钻石时代，谁的钻石时代呢？大公司的钻石时代，因为大公司在不断地合并小公司的市场份额。小公司都没了，这个时代就结束了。
我觉得房地产的上半场还会持续5年、10年，这个就结束了。这是我说的中国房地产市场的上半场，我们一直是引领者。
下半场是美好生活。什么叫美好生活？美国人的美好生活就是买房子、买车、度假。我自己觉得中国人的美好生活是：
第一，要买到好房子，买不好的房子肯定不算美好生活。不是说买一套房子，现在谁都有房子，我们要买一套好房子。
第二，买辆好车。
第三，文化、娱乐、旅游、体育、休闲，这些玩的东西。
第四，教育、健康、养老。
我觉得美好生活就这四块，投资美好生活就是投资这些。
最后，我想说乐视的事儿。我们当时投乐视的逻辑，其实我当时说得非常清楚，是投大文化、大娱乐。乐视是典型的大文化、大娱乐，因为它的大屏智能电视，它是一个家庭娱乐的客厅里很重要的文化娱乐的场景内容，内容将来是越来越值钱的，我们投的是大文化、大娱乐。
其实我们当时看乐视的时候，账也看得挺明白的，乐视主要是什么问题呢？贾跃亭确实有前瞻性，这一点是肯定的，老贾确实很擅长，我到现在都说，老贾家里有套房子，家里有点存款，大家都差不多，很正常，但他没拿公司的钱回家这是一个事实，但可悲的是现实不信，这就是自媒体时代，没有信心，把真相稀释了，没有真相。
大家越是不知道什么是对，什么是错，什么是真相，什么是谎言，这个不重要，不相信也行。但这个确实没有办法，它亏了，失败了，我觉得这是挺重要的。乐视问题是什么呢？管理，你没有任何东西，没有这样的管理能力、管理资源，你请了很多大咖，你没有办法管理，五六十个人同时要出来，都是大咖谁都不服谁。
于是公司没有办法管理，没有人善战，不想做创新，没有新东西，你用什么样的东西都管理不好，这么大的盘子，这么大的行业，这么多人，这么多互相不熟悉的人，曾经号称大咖，但实际上未必，这些也是管理性的问题。
我们公司的高层一个都挖不走，中层被别人挖走了一个两个，过几天又回来了，因为他在别的公司没法干。
还有一个问题，很多企业家在顺境的时候特别会干，逆境的时候什么都不会干。一个企业家伟大在哪里，逆境的时候你知道怎么干，逆境的时候是靠决策能力，老贾就是典型的逆境的时候完全失去平衡，这两个问题我们在座很多人都见过。
企业家必须学会面对逆境，因为企业家的成长主要是逆境，顺境的时候不会成长。只要你成功，你一总结一定说你的团队好，你的执行力强，你的文化好，只要挣钱就是这些。你要是亏钱的话，那就是你的事儿，亏钱之后你怎么说，你的技术团队站的对，你也不敢说。
所以逆境是衡量一个企业家最重要的东西，很多人到了逆境就不干了，有些企业家，像我，顺境在干，逆境的时候浑身是劲。没什么挑战，成天吃了睡睡了吃，没什么意思，有挑战的时候有意思多了，我觉得这也是一个主要的问题。
其实我和乐视的投资，从某种意义上来说是对的。我想说作为投资，因为乐视还没开始，这段时间我什么也没干。为什么我没干呢，因为我首先得要整理股权。我把股权整理了。
好多不同的业务都需要时间，我们业务从这周就开始启动了，上周非上市部分股权结构已经差不多了。
我们开始行动了。乐视才刚开始，我还没开始干活呢，你就说亏了，失败了，这不符合事实。我不说了，再说多了不好。
再说说万达。
万达是一个非常了不起的商业模式。我们后面还会有好多新的项目继续做。我觉得这个事儿非常有意思，在中国，从头做，没有十几年的时间做不到今天，万达从2009年开始做，七八年就成这个样子，我想这是一个成功的公司。

中国现在以什么作为背景？Google、苹果、迪士尼都以文化作为背景。美国随便一个什么样的内容公司都有1000亿美元的市值，中国最牛的内容公司是200亿人民币。文化是比较难的，文化确实要有很多年的积淀，需要不断地强化。
我们原来做房地产，有个4、5、6。后来买了个3，就是乐视。现在有了万达文旅，就是7，手上的牌成了一把“顺子”。我们已经改变乐视的商业模式了。全世界都在做垂直整合，苹果开始投钱做电影电视，亚马逊也开始投钱做视频、拍电影。垂直是什么意思？你要有自己的IP、渠道、内容、场景。大家都在垂直角度，垂直角度带来了方向。乐视加上融创、万达，我们还有其他的方面，纯粹就是一个IP内容的渠道和场景。
最后，美好生活是什么？先买套房子，再回家看个电视，电视上放我们的电影，到万达城玩，谢谢大家！
展开阅读全文"
给时间？他们到时办好绿卡了、那债主的一切就完了,"https://guba.eastmoney.com/news,300104,739707903.html",2018-01-03 08:51:40,小微说要大家及政府给时间？恐怕等到她们全家办好了绿卡，到那时所有的债主一切都完了，她们在美国花天洒地谁知道？若是她们真心想还债的话〈隔空喊话“我们会负责到底”有什么用〉、现在就用FF的股权还给债主，否则，她们的一切手段都只是为了办绿卡而拖延时间、达到骗子的目的、、、神仙
孙宏斌说住融创的房子看乐视的股价天天跌,"https://guba.eastmoney.com/news,300104,743580161.html",2018-01-28 12:03:02,拭目以待
立案调查！,"https://guba.eastmoney.com/news,300104,749442356.html",2018-03-15 16:30:08,立案调查！
本神已把”小微“带到了美国,"https://guba.eastmoney.com/news,300104,738953528.html",2017-12-27 16:41:23,任务完成了、、、、、、
你们真乐观，知道董事长意味着什么吗？,"https://guba.eastmoney.com/news,300104,749433779.html",2018-03-15 15:46:27,孙宏斌都TM辞职了你们这些垃圾还唱多？一个公司如果未来前景良好谁TM愿意抛弃老大这职位？[不赞]
乐视网退市股杀一儆百。。,"https://guba.eastmoney.com/news,300104,749434132.html",2018-03-15 15:48:56,
阿里影业接盘乐视大概率！,"https://guba.eastmoney.com/news,300104,749442043.html",2018-03-15 16:28:33,阿里影业接盘乐视大概率！
所有人的成功不是今天去做的、做一件什么事儿，而是你15年之前看到了一个什么趋势。,"https://guba.eastmoney.com/news,300104,749441933.html",2018-03-15 16:28:09,所有人的成功不是今天去做的、做一件什么事儿，而是你15年之前看到了一个什么趋势。”分众传媒的成立初衷，是江南春观察到了“一个趋势和两个机会”，即城市化趋势、分众化机会和电梯场景。
乐视网散户人均持股8929股,"https://guba.eastmoney.com/news,300104,749435802.html",2018-03-15 16:00:32,33.6万散户就把乐视网的30亿股流通筹码全部买光，这力量还有蛮大的。
踩着雷了,"https://guba.eastmoney.com/news,300104,749440441.html",2018-03-15 16:21:07,踩着雷了
人家买了又卖，国家还会罚款啊！你是不是脑子有病啊！炒作假的国家才会罚款，公平合理,"https://guba.eastmoney.com/news,300104,749440384.html",2018-03-15 16:20:50,人家买了又卖，国家还会罚款啊！你是不是脑子有病啊！炒作假的国家才会罚款，公平合理的炒作怎么会罚款，炒作股票买了又卖国家要罚款，那国家就不要开股市啦！人家买了又卖赚钱了是人家的本事，有本事你也来啊！
该退市就退了吧,"https://guba.eastmoney.com/news,300104,749438613.html",2018-03-15 16:12:52,该退市就退了吧
乐视网，中国A股最有可能的第一个BAT,"https://guba.eastmoney.com/news,300104,749304491.html",2018-03-15 07:03:23,什么腾讯，阿里接盘，都弱爆了。真正的最佳、最可行方案根本不是这些。最佳方案一旦实施，乐视网股价将直上100元。
收评：创业板尾盘反弹翻红,"https://guba.eastmoney.com/news,300104,749428710.html",2018-03-15 15:16:19,"沪深早盘两市小幅低开，随后小幅拉升后再度回落维持震荡，临近收盘创业板指迎来一波强势拉升成功翻红。上证50指数和沪深300指数今日低开拉升后收红。截至收盘，沪指微跌0.01%，创业板指涨0.40%。

盘面上，证监会昨日表示，由于次新股普遍具有发行市盈率低、概念新、流通盘小的特点，很容易成为市场炒新、炒小、短线操作的一个集中领域，积聚市场风险和泡沫，次新股集体杀跌，板块指数跌逾5%，华夏航空(002928)、华菱精工(603356)、中科信息(300678)、南都物业(603506)、威唐工业(300707)、创业黑马(300688)等近期的人气股个股纷纷跌停。我国自主研发燃料电池耐久性获重大突破，氢燃料电池概念大涨，长城电工(600192)开盘直线涨停。中金高呼能涨到900元以上，白酒板块涨幅居前，山西汾酒(600809)涨5%，贵州茅台(600519)涨2%。央企国企改革概念表现亮眼，中成股份(000151)、国投中鲁(600962)、洛阳玻璃(600876)、中材节能(603126)、华电能源(600726)、瑞泰科技(002066)等多只个股涨停。新能源汽车异动拉升，亚星客车(600213)涨停。午后独角兽概念发起反扑，合肥城建(002208)直线涨停。
热点板块
9:38 次新股开盘全线回调，华夏航空跌停，华菱精工大跌9%，倍加洁(603059)、中科信息、创业黑马、润都股份(002923)纷纷跟跌。
9:44 燃料电池板块走强，龙头长城电工直线封板，雄韬股份(002733)冲击涨停，大洋电机(002249)、雪人股份(002639)涨6%，新大洲A、华昌化工(002274)跟涨。
9:49 白酒板块早盘走强，龙头酒鬼酒(000799)涨4%，泸州老窖(000568)、口子窖(603589)、山西汾酒、水井坊(600779)纷纷跟涨。
10:15 区块链板块逐渐拉升，龙头安妮股份(002235)封死涨停，易见股份(600093)、新晨科技(300542)快速跟涨。
10:24 新能源汽车板块逆势拉升，龙头亚星客车强势封板，龙二中通客车(000957)大涨7%，安凯客车(000868)、众泰汽车(000980)跟涨。
10:47 央企国企改革概念表现亮眼，龙头中成股份三连板，国投中鲁、洛阳玻璃、中材节能、华电能源、瑞泰科技等多只个股涨停。
11:02 上海国企改革板块直线拉升，龙头股份(600630)直线封板，同达创业(600647)、上海三毛(600689)、上工申贝(600843)迅速跟涨。
11:12 火电板块大幅飙升，龙头华电能源直线封板，吉电股份(000875)涨5%，甘肃电投(000791)、新能泰山(000720)、金山股份(600396)跟涨。
14:11 独角兽板块集体逆势反扑，龙头合肥城建直线冲击涨停，越秀金控(000987)大涨8%。
跌幅榜上，次新股、农机板块跌幅居前。
消息面上
1、证监会副主席阎庆民：CDR将很快推出
监会副主席阎庆民15日在参加全国政协闭幕会议时表示，中国存托凭证(CDR)将很快推出，CDR是解决两地的法律、两地监管的有效措施，有利于已上市、海外退市企业回A股上市。对于如何判断“独角兽”企业名单，阎庆民指出，这需要多个部委共同筛选，科技部、工信部有技术参数，需达到标准，涉及工业互联网、人工智能等。(证券时报)
2、乐视或有新的接盘方 到3月底预计会揭晓
一位长期观察乐视的业内人士对记者表示，接下来要看孙宏斌的接任者是不是融创系，如果不是，那很有可能说明是股权处置有动作，比如贾跃亭的股权处置，有新的接盘方出现。另一位业内资深人士向记者透露，乐视网(300104)新的接盘方有可能是来自互联网的顶级企业。至于乐视网的后续走向，需要看接下来3月底的新进资本能否顺利进来。乐视网下一个“接盘侠”？到3月底预计会揭晓。
操作参考
巨丰投顾认为周三证监会通报北八道操纵市场案，开出55亿罚单，乐视网停牌，对次新股及超跌反弹的市场逻辑有所冲击。外围方面，市场对贸易战的忧虑加剧，欧股创3月7日以来收盘新低，美股三大股指收跌，道指跌逾200点。两大利空因素叠加到一起，将继续对A股施压。国企改革主题连续两个交易日大幅走高，后市有望成为市场新的主线。操作上，逢低关注国资背景的底部小市值股。
展开阅读全文"
以前的老套没割肉；现在的新套又进去了许许多多。,"https://guba.eastmoney.com/news,300104,749437530.html",2018-03-15 16:08:12,抓在里面不让他们出来。
贾跃亭要在广州拿地造车？法拉第未来悄然开了家新公司 2018-03-14&#160;02:,"https://guba.eastmoney.com/news,300104,749220430.html",2018-03-14 14:14:20,"贾跃亭要在广州拿地造车？法拉第未来悄然开了家新公司
2018-03-14 02:36:01 车早茶
T大
原标题:贾跃亭要在广州拿地造车？法拉第未来悄然开了家新公司
贾跃亭投资的电动汽车初创企业法拉第未来（Faraday Future）悄然开启了国内生产计划？
3月13日，法拉第未来关联公司睿驰智能汽车在广州设立的消息被爆出。
工商资料显示，2月12日，睿驰智能汽车（广州）有限公司注册成立，法定代表人为王志刚，注册资本达到3亿美元，公司类型为有限责任公司（台港澳法人独资）。

睿驰智能汽车（广州）有限公司的工商信息
睿驰智能的股东为一家香港公司SMART MOBILITY （HONG KONG） HOLDINGS LIMITED，澎湃新闻记者从香港公司注册处网上查册中心看到，SMART MOBILITY成立于2016年10月，曾用名为FF Hong Kong Holdings Limited，中文名为法法汽车生态（香港）有限公司，2018年1月9日才更名为Smart Mobility。
澎湃新闻获得的法法汽车生态（香港）有限公司更改公司秘书及董事通知书显示，今年1月15日，公司董事王佳伟（Wang Jiawei）辞职，由王志刚接任。王志刚在上述文件中留下的地址在山西省襄汾县汾城镇。贾跃亭正是山西襄汾人。
法拉第未来官方公众号Faraday Future资料显示，其账号主体为法法汽车（中国）有限公司，公司董事长为王佳伟。法法汽车（中国）有限公司背后的股东指向上述的法法汽车生态（香港）有限公司（现已更名Smart Mobility），以及乐视汽车旗下的法法互联网智能电动车有限公司。
因此，睿驰智能和法拉第未来有极大关联。
对此，法拉第未来中国公关部门回应澎湃新闻记者称，FF公司目前在贾总带领下正全力以赴为FF 91量产而努力，对于此类传言，公关部没有收到公司的相关信息，请媒体以公司官方消息为准。
工商资料显示，睿驰智能的经营范围包括汽车销售;可再生能源领域技术咨询、技术服务;汽车零配件设计服务; 节能技术推广服务;车辆工程的技术研究、开发;汽车零配件批发;工程和技术研究和试验发展（人体干细胞、基因诊断与治疗技术除外）;发动机热平衡系统技术研究、开发;机械技术推广服务;汽车零部件及配件制造（不含汽车发动机制造）等。
值得注意的是，睿驰智能注册地址为广州市南沙区海滨路171号9楼。地图显示，广州南沙区海滨路171号临近南沙区万顷沙保税港。

3月初，广州南沙国土资源和规划局官网挂出了“南沙区万顷沙保税港加工制造业区块”（编号：2018NGY-2）的出让信息。出让公告显示，该地块占地面积40.0988万平方米，起拍价3.641亿元。
在对竞买人的要求中，明确提出“竞得人须在竞得土地一个月内引进具备国际一流纯电动汽车研发制造水平的纯电动汽车组装项目”，同时还要求“竞买申请人须在南沙设立项目公司，主要经营范围为车辆工程的技术研究、开发；汽车零部件及配件制造、销售；汽车销售”。
除此之外，公告对竞得人的资本和产出情况也设置了较高的门槛，要求项目注册资本不少于3亿美元，投资强度不低于8274元人民币/平方米，该地块每年每平方米的产出率不低于14.0782万元人民币。
在该公告挂出后，外界都在猜测这次挂牌是否为一直想在中国设厂的特斯拉量身定做，不过特斯拉方面否认了这一消息。
目前来看，法拉第未来的关联公司睿驰智能在南沙设点，如果该公司也被认定为“国际一流纯电动汽车项目”的话，那该公司资料也与上述地块的竞买人要求吻合。不过，目前广州南沙国土资源和规划局挂出的这块地2018NGY-2，仍在挂牌期中，报价期将于4月8日结束。
贾跃亭目前正在推进法拉第未来于2018年底交付首款量产车型FF91，在2月14日的法拉第未来供应商峰会上，贾跃亭还透露法拉第未来获得了15亿美元的融资。但2017年12月澎湃新闻记者前往法拉第未来在美国的汉福德工厂探访时发现，该工厂还尚处于空置的状态。
2017年12月，法拉第未来方面确认，原本的乐视汽车将成为法拉第未来中国，FF将实施中美双主场战略，乐视汽车员工将成为FF中国的员工。广为人知的是，乐视汽车已经于2016年12月在浙江德清拿下一处地块，用于建设乐视汽车小镇。（本文摘自澎湃新闻）"
乐视网中不肯离开的看空者，是乐视网股价下跌的支撑柱，是乐视股票上升的助推器。为什,"https://guba.eastmoney.com/news,300104,749314214.html",2018-03-15 09:06:01,乐视网中不肯离开的看空者，是乐视网股价下跌的支撑柱，是乐视股票上升的助推器。为什么这么说?………………此处省略500字，原因就不分析了，打字太累。
一个逻辑问题： 没有后续资本运作，就必然退市； 决不会退市，就必然有资本运作。,"https://guba.eastmoney.com/news,300104,749405430.html",2018-03-15 14:06:29,"一个逻辑问题：
没有后续资本运作，就必然退市；
决不会退市，就必然有资本运作。
希望公司发言时注意简单的逻辑问题，，，"
乐视网不可能退市～谣媒可以闭嘴了！,"https://guba.eastmoney.com/news,300104,749435567.html",2018-03-15 15:58:36,
乐视网不可能退市，否则将是灾难性的。。,"https://guba.eastmoney.com/news,300104,749430044.html",2018-03-15 15:23:37,
好象大家对停牌都不怕了，好事还是坏事？,"https://guba.eastmoney.com/news,300104,749287543.html",2018-03-14 22:34:08,"每一停牌，都是故事多多，之后又是一地鸡毛。

最关键的，就是主力常用来制造事件，这不大盘又到了关键区！"
乐视网不可能退市，意味深长……,"https://guba.eastmoney.com/news,300104,749430462.html",2018-03-15 15:26:11,尚方宝剑？
这下有大戏要上演了,"https://guba.eastmoney.com/news,300104,749435540.html",2018-03-15 15:58:24,"这次停牌，有几种结果
1：乐视彻底死亡，股价直破2元。
2：平局，股价回到5元。
3：又是3个月停牌，冷却一段时间。
以目前的情况和孙的个性来看，很可能就是，第一种情况最大，我不要的东西，谁都不能拿，还要种贾一定要死的情绪来里面。"
停牌是有道道的,"https://guba.eastmoney.com/news,300104,749434111.html",2018-03-15 15:48:52,先在辞职以前，很多践踏出现，筹码流失假如明天开盘就不会了。看晚上广告吧
雨后彩莲：乐视每一次拉升都是出来的好机会！,"https://guba.eastmoney.com/news,300104,746662647.html",2018-02-16 22:22:12,不到3元以下，根本不要考虑！十分的危险！
大家发现没有：乐视高层的话都得反着听！,"https://guba.eastmoney.com/news,300104,749434667.html",2018-03-15 15:52:37,
