标题,链接,发布时间,内容
资源与科技共舞！谁与争锋,"https://guba.eastmoney.com/news,300104,749453205.html",2018-03-15 18:00:27,"近期市场玩起了萝卜蹲的游戏！
独角兽蹲、独角兽蹲、独角兽蹲完黑天鹅蹲，黑天鹅蹲、黑天鹅蹲、黑天鹅蹲完资源股蹲，资源股蹲、资源股蹲、资源股蹲完......
伴随着短期创业板节后勇往直前的气势受到打压后，独角兽概念全面熄火后资金快速涌入到超跌的黑天鹅中，乐视网、獐子岛、ST保千里纷纷涨停，而随后今日市场的主角则快速切换到资源股身上了，然而可以看到的是每一次市场面临震荡节点时，资金节奏切换的速度只会有过之而无不及。
乐视网午间被临停关小黑屋了，另外两只开盘后便缴械投降，出现回落，避免了被关小黑屋，想必倘若獐子岛和ST保千里早盘继续和乐视一样冲高拉升，估计也跑不了被关小黑屋的窘境吧！
毕竟不是亲生的，一方面管理层持续喊话要引导价值投资支持优质企业上市，抑制资金的炒作风气，另一方面不具备业绩支撑的个股却在市场上持续兴风作浪，这不是赤裸裸打脸的节奏吗？乐视网的临时停牌算是给了那些短线资金炒作的一个警示，毕竟一没利好二没业绩支撑三没题材支持的三无标的拉升靠的自然是纯粹的资金优势了，监管不提前先下手为强那把年后一系列的引入优质企业的喊话置之何处？
这不，今乐视网晚间公告称，董事会于近日收到董事长孙宏斌先生的辞职报告，老孙的原定任期应至2018年10月13日，这下提前离职，看来乐视上市体系的命运后期又将再多坎坷了。
再回到我们今日的主角上——资源股，资源股再度霸屏市场，从下图中可以看到今日科技股和资源股来了个身份互换，市场再现分化漩涡，在资源与科技共舞背景下，概念间此消彼长，跷跷板效应显著。
短期的资金博弈是市场分歧的体现，正所谓百足之虫死而不僵，市场上不管是一只强势的个股还是某一个行业或题材，只要其持续上涨的时间超过一个季度——即三个月，往往在大级别调整来临时也非直接掉头向下的，多采取的是复合顶的形式；而对于一个低位存在反转预期的行业或概念，其上升趋势也并非一蹴而就的，毕竟前期的抛压以及投资者多采取边走边看的心理，因而也会在上行过程中存在反复。
众所周知，周期股的行情起源与供给侧改革紧密相关，纵观过去五年，供给侧改革成效显著，在淘汰、关闭落后产能、处置僵尸企业等一系列整治措施影响下，供给端收缩明显，市场迅速回暖，带动钢价、煤价大幅上涨。
钢铁自16年以来开启了一轮大级别的趋势行情，但值得注意的是，随着供给侧改革进入深水区，供需平衡是必然趋势。在边际效应递减规律下，去产能也将过度到缩量阶段。与此同时，近期周期股尽管在市场上有频繁表现，但从整体表现来看，其持续性较弱，多以反弹为主，一日游居多，资金认可度降低，指数在高位反复以震荡为主，对于该行业后期不宜抱有太大幻想空间。
而对于科技类企业，从监管部门对于独角兽企业开绿灯、再到政策上对于高端制造的支持，可以看到我国正在由粗放型向集约型转变，这个过程科技必不可少，节后大资金逐步对于优质类的高成长标的出现配置，这些科技股近期的强势为今后阶段的进一步走高打下基础，而高成长、高收益、低估值特性又为股价提供了一定的安全边际，值得投资者去追踪。
 整体上来看，市场再度回到分化阶段，震荡期间热点切换节奏较快，对于概念题材切忌追涨杀跌；在资源与科技共舞的背景下，对于仓位可综合配置，做到两手抓，但对于其持股周期需做到心中有数。


展开阅读全文"
3.14.中央汇金已入主乐视网，已出货的捶胸，未买入的叹气！,"https://guba.eastmoney.com/news,300104,749284988.html",2018-03-14 22:02:22,"十大股东排练第三：中央汇金资产管理有限责任公司，增持2799.33万股。所有前十股东，均增持乐视网。
难道滑铁卢战役重现：谁能坚持到最后，谁就是赢家!!
法拉第FF91 法拉第FF91 法拉第FF91 只有百度输入了"
乐视网下周能复牌嘛,"https://guba.eastmoney.com/news,300104,749445793.html",2018-03-15 16:55:35,乐视网下周能复牌嘛
停牌前买进去的，凶多吉少啊,"https://guba.eastmoney.com/news,300104,749452905.html",2018-03-15 17:57:58,停牌前买进去的，凶多吉少啊
叶檀：乐视网，是创业失败还是涉嫌欺诈？,"https://guba.eastmoney.com/news,300104,746674862.html",2018-02-17 16:04:38,央视财经称，乐视用一份份精美的PPT吸引众多投资者（如今他故技重演正用PPT骗美国人钱），股价上涨40多倍，贾跃亭等原始股东从2012年起不断套现，赚的盆满钵满，留下众多机构和散户接盘，损失惨重。乐视网由兴起到危机，到底是创业失败，还是涉嫌欺诈，可能只有在相关部门调查后才会有定论。
如果乐视都不退市 艾古就没有一只股票可以退市！,"https://guba.eastmoney.com/news,300104,749452518.html",2018-03-15 17:54:32,哈哈哈哟哈哈哈
散户想发财，想快速致富，所以投机赌博乐视，亏死活该,"https://guba.eastmoney.com/news,300104,749449610.html",2018-03-15 17:28:33,散户想发财，想快速致富，所以投机赌博乐视，亏死活该
一个房地产商人是不可能把互联网公司经营管理好的，因为他不懂！孙董退出是非常明智的,"https://guba.eastmoney.com/news,300104,749450928.html",2018-03-15 17:40:29,一个房地产商人是不可能把互联网公司经营管理好的，因为他不懂！孙董退出是非常明智的决定。乐视网公司真的就彻底的活了！这个时候买入乐视网股票，就是在捡钱！
3.15打假日乐视网葫芦里究竟卖的什么药,"https://guba.eastmoney.com/news,300104,749452358.html",2018-03-15 17:53:10,"今天周四，惯例股指弱势运行绝大多数都是黑周四的概率，今天也不例外，盘面的上下反复这也与市场热点主要表现在白马股的走势偏强如：保险、超级品牌、酿酒行业、燃料电池和电力、中字头的股票等，军工题材的大飞机、航空航天核航母概念涨幅在前；推动股指总体偏弱的基本点在次新股、高送转和科技类的几大板块开始分化如：通讯行业、电信运营、水泥建材、电信运营、软件服务、5 G概念拖累市场信心拖累指数震荡下跌所致！盘面总体看市场板块个股分化逐渐加大，股指超短线观察有初步稳定的迹象，但是 “盘中小幅反弹，股指筑底困难！”是我们指导实战交易是否择机抄底的基础思考。大盘今天虽然技术面3288点的支撑还有一定的抵抗，可能否起到推动股指反弹作用需要继续观察资金放量收阳才是根本的要求，理论上，今天的日线收盘需要稳定在3298点之上我们超短线才有一定机会，但是大盘中线稳定还需要继续观察，不可操之过急！
今天是3.15打假日啊，盘中的下跌将会使得很多个股产生比较好的买点，相关板块，建议继续留意昨天逆势走强的建材，水泥，另外跟踪，燃料电池，在线教育，独角兽，工业互联。独角兽和工业互联若继续大幅下探，将有望迎来绝地反弹！次新股这么跌，管理层这个时候出手是什么意思，今天很多强势股继续大跌，属于二次补跌了，按照之前的短线调整逻辑，强势股一般回撤10%左右就应该企稳，但今天强势股继续杀跌就有点伤题材股人气了，后面机会主要看蓝筹股吧
乐视网从底部开始反弹已经近60%，昨天下午停盘核查，晚间乐视网公告董事长孙宏斌辞职。市场分析孙宏斌的离职与乐视网经营颓势或许有关，分析称乐视不排除退市可能。如果乐视网最终退市，该股复盘以后就又要连续跌停，近期追入的资金将是血本无归！对市场前期炒作的垃圾股都构成一定的利空，如：獐子岛、ST保千里等，建议大家回避，注意风险。
贵州茅台连续下跌以后，昨天开始反弹，中金就开始高呼：能涨到900元以上。随着后期独角兽等科技股的回归，市场科技蓝筹股将会增多，以前穿旗袍、舞大刀长矛炒作传统产业的时代必将终结，毕竟科技股才有更好的发展前途，至于贵州茅台能否涨到900元？我们不知道，但夕阳产业还是不建议大家介入。"
暴风今天尾盘翻红，暴傻们那个兴奋，A股真的看不懂！,"https://guba.eastmoney.com/news,300104,749452064.html",2018-03-15 17:50:43,暴风今天尾盘翻红，暴傻们那个兴奋，A股真的看不懂！
又该连续跌停了,"https://guba.eastmoney.com/news,300104,749452002.html",2018-03-15 17:50:12,又该连续跌停了
3月15日午间，据中国企业家杂志消息，乐视网内部一位高层否认公司会在资本层面有动,"https://guba.eastmoney.com/news,300104,749451875.html",2018-03-15 17:48:50,3月15日午间，据中国企业家杂志消息，乐视网内部一位高层否认公司会在资本层面有动作，表示停牌原因是“近期炒作过多，不能让中小投资者继续被割，公司不得已。”
一个做房地产的商人来做新经济互联网公司的董事长，本身就是不合时宜的，所以辞去董事,"https://guba.eastmoney.com/news,300104,749279587.html",2018-03-14 21:00:04,一个做房地产的商人来做新经济互联网公司的董事长，本身就是不合时宜的，所以辞去董事长职务是最明智的选择！孙董是个聪明人！对乐视网也是一件好事！
白马：都涨得差不多了吧？资金匀一下,"https://guba.eastmoney.com/news,300104,749451500.html",2018-03-15 17:45:28,"【走势展望】
 受到昨天超大罚单的影响，次新、题材和妖股的炒作均受到打压，今天成为了市场调整的重灾区。昨天我在盘中已经开始提示次新和题材风险，强调远离不要追高，目前一直保持空仓。考虑到下周是两会闭幕，还有美联储加息决议公布，我预计市场会从维稳期过渡到避险期，市场的风险偏好将会下降。所以今天一开盘就很明确地说了我的思路，次新被打击影响市场人气，从而影响题材炒作，这就把资金赶去了政策板块和白马蓝筹。
最典型的政策板块是国企改，今天涨停了七家。逻辑是国企改是政策倡导的方向，而国资背景的企业一般不会遭遇关停。所以一般在题材遭遇打压期间，资金都会来炒作国企改，这是一条规律。但是这里提醒一下大家，虽然没有被关的风险，但是不排除主动申请停牌自查的风险。比如之前的特例中科信息当时市场资金看中这股的科研院背景开始猛炒，但是人家公司是很有觉悟的，知道我们政策导向是市场短期不能出现大幅波动，造成和系统性风险，于是主动申请停牌，表明一下立场。至于停牌喝茶之后是不是接着涨就是市场资金的解读问题了……
 但是未来行情还并不明朗，现在上证50这边以为市场避险情绪上升而出现集体上涨，但是很难判断未来是不是会出现连续性涨幅。比如昨天的水泥板块异动，我就明确说了这是媒体集中发布消息在配合拉升，前几天看到涨价消息的早就埋伏了，结果今天收盘后又出现水泥价格高位微落的消息。这些白马蓝筹处于平台震荡的底部找一些买进去是没有问题的，但是追高的风险就比较大了。
 中小创行情暂时哑火，但是不是真的结束了现在也无法给出定论。尽管今天权重涨得很抢眼，但午后创指反弹后还是轻易反超沪指。昨天的打压针对的是市场操纵、短期大涨，但是并不是明确封死了中小创的道路，毕竟还要迎接独角兽，还得发展新经济。问题是在于市场的炒作方式问题，监管层是不能忍受短期暴涨带来的波动风险的，即使未来中小创行情继续，炒作方式也需要随之进化。
 说来也巧，创业板指今天回踩到了我图中的这个通道上沿，午后回升，最低位相差不到两个点。看过我前两天收评的朋友都知道，我设置的条件是不能有效跌回下跌通道区域，就是以我图中的黄线为界限。所以从技术面上来看，未来几天的走势是比较关键的。确认突破就接着干，确认失败就继续远离。
【热点追踪】
1. 孙宏斌卸任乐视网董事长，融创中国涨幅超6%
今天香港内房股涨得都不错，融创中国、恒大和碧桂园集体上涨，其中碧桂园和恒大是受到利好消息刺激，碧桂园和恒大和万科前两个月的合同销售金额均突破千亿元，稳居前三。行业整体方面，房地产开发投资同比上涨9.9%，增速比去年全年提高2.9个百分点，创下近年来新高。
 但我看了一下A股市场这边房地产板块的没啥反应，万科A早盘冲高一下就回落了。由于香港市场和我们的收盘时间不太一样，看到内房股尾盘冲这么高，不知道我们明天的房地产板块会不会跟一把。
融创今天大涨还有一个很重要的原因就是孙宏斌卸任了乐视网的董事长，市场资金认为利好融创中国，不用再拿钱填窟窿了，昨天中午乐视临时停牌，而昨天早上八九个点追进去的资金就有点尴尬了。现在又有传言有一个互联网顶级企业可能会出手接盘，但是后来乐视网内部一位高层否认公司会在资本层面有动作，表示停牌原因是:近期炒作过多，不能让中小投资者继续被割，公司不得已。照这个说法，高层自己也觉得自己股价还得跌。
2. 养元饮品，又一只破发股
养元饮品的发行价是78.73元，今天收盘78.72元刚好跌破发行价。我在六个核桃的那篇文章中，分析过一次这个股的问题和软饮料市场不景气。破发不要觉得稀奇，次新早就不是什么稀缺标的了，板块体量巨大，加上养元饮品，现在破发的次新股数量达到了八只，五只沪市的股，一只中小板，一只创业板, 其中，赛托生物、常青股份相对发行价下跌超过10%；金麒麟、华达科技相对发行价下跌超4%。但是市场并没有因为它们破发就去特别地关注这些股，未来可能还会出现更多的破发股，没有业绩增长又没有题材亮点，就只有躺着的份儿了……

【投资策略】
市场未来方向不明朗，继续保持空仓，等待信号
【以上内容仅代表个人投资建议，不构成买卖依据，股市有风险，投资需谨慎！】

展开阅读全文"
互联网顶级企业接手乐视，大家猜猜复牌有几个涨停板，我估计12个以上[胜利],"https://guba.eastmoney.com/news,300104,749374856.html",2018-03-15 12:09:45,互联网顶级企业接手乐视，大家猜猜复牌有几个涨停板，我估计12个以上
大家广大上市公司要向悲视好好学习！,"https://guba.eastmoney.com/news,300104,749450502.html",2018-03-15 17:36:24,大家广大上市公司要向悲视好好学习！
造车只能圆他自己的造车梦，只能当他搞大玩具玩，别相信能量产发财，前有特斯拉，后有,"https://guba.eastmoney.com/news,300104,749450438.html",2018-03-15 17:35:51,造车只能圆他自己的造车梦，只能当他搞大玩具玩，别相信能量产发财，前有特斯拉，后有奥迪 奔驰 宝马 保时捷，哪个不比他财大气粗，哪个比他人才少，都比他有市场有影响
三六零关于控股股东股份质押的公告，很有可能360成为乐视接盘侠,"https://guba.eastmoney.com/news,300104,749450407.html",2018-03-15 17:35:34,三六零关于控股股东股份质押的公告，很有可能360成为乐视接盘侠
贾跃亭亲自接盘,"https://guba.eastmoney.com/news,300104,749450186.html",2018-03-15 17:33:22,贾跃亭亲自接盘
午评：国企改革概念股爆发,"https://guba.eastmoney.com/news,300104,749374555.html",2018-03-15 12:07:00,"沪深早盘两市小幅低开，随后震荡翻红，创业板指维持弱势，次新股概念遭重挫，截止午盘，沪指微涨，创业板指小幅下跌。黄金TD午间收盘，涨幅0.01%。

盘面上，次新股早盘集体杀跌，板块指数跌逾3%，华菱精工、中科信息、南都物业、中欣氟材等个股均接近跌停。证监会昨日表示，由于次新股普遍具有发行市盈率低、概念新、流通盘小的特点，很容易成为市场炒新、炒小、短线操作的一个集中领域，积聚市场风险和泡沫。我国自主研发燃料电池耐久性获重大突破，氢燃料电池概念大涨，长城电工涨停、雄韬股份大涨5%。多路资金开始抄底茅台，中金高呼能涨到900元以上，白酒板块涨幅居前，山西汾酒、酒鬼酒分别涨逾5%、4%，贵州茅台涨2%。
热点板块
9:38 次新股开盘全线回调，华夏航空跌停，华菱精工大跌9%，倍加洁、中科信息、创业黑马、润都股份纷纷跟跌。
9:44 燃料电池板块走强，龙头长城电工直线封板，雄韬股份冲击涨停，大洋电机、雪人股份涨6%，新大洲A、华昌化工跟涨。
9:49 白酒板块早盘走强，龙头酒鬼酒涨4%，泸州老窖、口子窖、山西汾酒、水井坊纷纷跟涨。
10:08 军工板块再度拉升，龙头航天晨光直线冲击涨停，航天长峰、中航电测、航天通信、航发科技等纷纷跟涨。
10:15 区块链板块逐渐拉升，龙头安妮股份封死涨停，易见股份、新晨科技快速跟涨。
10:24 新能源汽车板块逆势拉升，龙头亚星客车强势封板，龙二中通客车大涨7%，安凯客车、众泰汽车跟涨。
10:47 央企改革板块再度活跃，龙头中成股份收获三连板，国投中鲁、中粮糖业小幅跟涨。
11:02 上海国企改革板块直线拉升，龙头股份直线封板，同达创业、上海三毛、上工申贝迅速跟涨。
11:12 火电板块大幅飙升，龙头华电能源直线封板，吉电股份涨5%，甘肃电投、新能泰山、金山股份跟涨。
跌幅榜上，次新股、工业互联网板块跌幅居前。
消息面上
1、阎庆民回应“北八道集团巨额罚单”：严监管 当然要重处罚
于北八道集团巨额罚单问题，证监会副主席阎庆民表示，现在是严监管，当然要重处罚，这是肯定的。(中证报)
2、证监会副主席阎庆民：CDR将很快推出
监会副主席阎庆民15日在参加全国政协闭幕会议时表示，中国存托凭证(CDR)将很快推出，CDR是解决两地的法律、两地监管的有效措施，有利于已上市、海外退市企业回A股上市。对于如何判断“独角兽”企业名单，阎庆民指出，这需要多个部委共同筛选，科技部、工信部有技术参数，需达到标准，涉及工业互联网、人工智能等。(证券时报)
3、乐视或有新的接盘方 到3月底预计会揭晓
一位长期观察乐视的业内人士对记者表示，接下来要看孙宏斌的接任者是不是融创系，如果不是，那很有可能说明是股权处置有动作，比如贾跃亭的股权处置，有新的接盘方出现。另一位业内资深人士向记者透露，乐视网(300104)新的接盘方有可能是来自互联网的顶级企业。至于乐视网的后续走向，需要看接下来3月底的新进资本能否顺利进来。乐视网下一个“接盘侠”？到3月底预计会揭晓。(一财)
操作参考
正证券认为A股迎来春天播种季节，底部逐步抬高是趋势，偶尔出现“倒春寒”，甚至大盘波动率加大，也是正常现象。昨大盘继续调整，并留下一个 2.4 个点的缺口，技术上形成向下“岛型反转”雏形，短线关注年线支撑，若有效跌破年线，大盘指数调整还会加深，但我们认为这是小概率事件，且 A 股“独角兽” 行情并未因调整而结束。操作上，轻指数、重个股，逢低关注人工智能、高端制造、国改及底部二线蓝筹股，回避政策利空股。"
跳船了！查查过去两天的大涨谁得知消息！,"https://guba.eastmoney.com/news,300104,749449818.html",2018-03-15 17:30:12,跳船了！查查过去两天的大涨谁得知消息！
股东增加了快一倍。。韭菜涨势很乐观啊,"https://guba.eastmoney.com/news,300104,749449685.html",2018-03-15 17:29:03,财新此前报道，“仅复牌后的13个交易日内，乐视网的股东人数已较复牌前增加81.6%。1月24日复牌前，乐视网自然人股东人数为18.5万人，但截至2月9日，公司自然人股东数量已上升至33.6万人，这也意味着经过13个交易日，公司自然人股东已经增加了15.1万人。”
今天的结果都是不听本神劝阻所至自作自受,"https://guba.eastmoney.com/news,300104,743462343.html",2018-01-26 16:17:30,今天的结果，本神早在乐视股价上170多元时就全力阻止大家不要上当受骗《有贴为证》、可是大家象是喝了迷魂汤似的非要往里面进、有些人不但不听本神劝阻，反而说本神阻止大家发财《现在要发棺材了》、所以大家都要为自己的行为负责、本神现在唯一能做的是给大家一个建议，贾赔不起，孙还是有钱赔偿的，凡是被孙说的：“投资乐视跌最多30%、涨可以翻3倍”、这句原话我就不去查了，你们自己去查，骗进来的投资者可以去咨询律师能后要求孙进行赔偿、、这也是本神给你们出的唯一的希望了、大家觉得有理就把他顶在最上面、、神仙
本神能预知末来看吧,"https://guba.eastmoney.com/news,300104,743577436.html",2018-01-28 11:39:17,"现有3748人阅读过该帖，评论12条。相关帖子286221条

神仙的祖先 影响力 吧龄 4.6年 
发表于 2017-01-16 08:59:53 股吧网页版
V认证举报
孙宏斌是外行人来做内行人的生意注定要失败
孙宏斌是土豪，他自己也说过、曾经投过一个影业公司全亏完了，他亏得起，而广大的散户投资者是亏不起的，所以大家都不要跟着他这个外行人来做内行人的生意，他的这次豪赌最终还是要失败的，拭目以待、、、、、、立此贴为证、、、、、、、、、神仙，"
乐视退市，可能吗？[大笑][大笑][大笑],"https://guba.eastmoney.com/news,300104,749449316.html",2018-03-15 17:25:51,乐视退市，可能吗？
先ST，再加*，然后退市,"https://guba.eastmoney.com/news,300104,749434298.html",2018-03-15 15:50:08,先ST，再加*，然后退市
乐视市值超过30亿是不合理的！现在刚上市的公司市值都在三四十亿，每一家都远超乐视,"https://guba.eastmoney.com/news,300104,749447779.html",2018-03-15 17:12:06,乐视市值超过30亿是不合理的！现在刚上市的公司市值都在三四十亿，每一家都远超乐视！
不可能退市，知道是什么意思吗？,"https://guba.eastmoney.com/news,300104,749449099.html",2018-03-15 17:24:05,不可能退市，知道是什么意思吗？
股民亏你们亏损不重要根本不重要，股民是用来集资这是定性的现实。私募、基金也亏损也,"https://guba.eastmoney.com/news,300104,749449022.html",2018-03-15 17:23:14,股民亏你们亏损不重要根本不重要，股民是用来集资这是定性的现实。私募、基金也亏损也不重要，它是棋子。这么多国资接受贾的质押抵押，价格高高在上，你等见过国资控制内地市场，既是参与又是制定游戏规则，有亏损过？没有，大不了改规则，必须赢。乐视退市让国资亏损，可能吗？
难不成独角兽收购独角兽~~,"https://guba.eastmoney.com/news,300104,749446504.html",2018-03-15 17:00:44,360！！！！
会退市么？？如果退市了我们的钱怎么办,"https://guba.eastmoney.com/news,300104,749290883.html",2018-03-14 23:13:04,"会退市么？？如果退市了我们的钱怎么办


我15000股乐视 成本价虽然说才5.19 但也担心……………………今天下午本来想卖的。结果停牌了"
