标题,链接,发布时间,内容
保千里2016年9月2日投资者调研报告,"https://guba.eastmoney.com/news,600074,605809756.html",2016-09-05 00:00:00,"江苏保千里视像科技集团股份有限公司
JIANGSU PROTRULY VISION TECHNOLOGY GROUP CO.,LTD.

2016年9月2日机构现场调研会议纪要

2016年9月2日，公司接待了部分投资者咨询及调研，现将主要咨询及调研内容汇总如下：
一、公司汽车夜视主动安全系统主要有哪些功能？
公司的汽车夜视主动安全系统运用了公司自主研发的光学成像技术、激光夜视技术、仿生智能算法等核心技术，解决了全天候成像、双向高速移动高速聚焦、行人检测预警、透雾透雪透雨成像等技术难题，目前已实现了路况预警、远程夜视、雨雾雪天透视、行人提示预警、车道偏离预警、眩光屏蔽、激光夜视、防撞预警、行车记录、手机互联等十几项功能，通过复杂环境感知与智能判断，实现全天候预警，能够有效预防交通事故的发生。

二、目前公司在前装市场进展如何？
公司从2013年9月开始进入前装市场，经过几年的持续投入和推进，公司陆续与约40家整车厂签订技术开发协议，展开紧密的技术合作，并在前装流程的不同阶段中持续推进。截止目前已有众泰T600运动版及宝沃BX7旗舰版配备公司的汽车夜视主动安全系统。这些合作能够推动公司与其它汽车整车厂的合作进度，加快前装合作开发流程，促使其它汽车整车厂加快研发和生产配备夜视主动安全系统。除了众泰T600运动版及宝沃BX7旗舰版外，我们正紧密跟进其它汽车整车厂的前装流程。

三、公司未来产品如何规划？
公司紧密围绕“精密光机电 仿生智能算法”的核心技术，产品分为两大类：一类是以视像技术为核心的功能型产品，聚焦服务于汽车视像、商用视像、民用视像、特种视像、智慧视像、安防视像等多个应用领域；一类是以视像智能硬件为载体的平台型产品，即平台型智能硬件，如乐摇宝、合众宝。公司的平台型智能硬件至少采用五寸以上屏幕，便于消费者将智能硬件作为平台的入口与商家进行互动，智能硬件后接云端大数据平台，公司目前正在逐步搭建云平台，同时也在各个行业地区迅速布局硬件,获取数据来源。
汽车夜视主动安全系统也将发展为车用智能硬件，公司正在逐步进行产品升级，目前已可以实现通过车联网进行人车交互、车内以太网技术等，为未来公司切入车的生活场景奠定基础。

四、“智能硬件 ”解决方案的销售模式及上半年的进展？
“智能硬件 ”解决方案以跨界智能硬件打破专业边界、技术和服务领域，方便商家进行全面资源整合；同时，结合大数据分析系统，构建云端技术平台，对智能硬件产生的海量数据进行充分挖掘，获取有价值的商业信息，开展定制化信息推送、电子商务、自媒体、传媒运营等新业务模式，帮助实体企业将消费者转化为高粘性持续消费的用户，进行场景化营销，推动线上线下发展，为实体企业的互联网 提供落地方案。
目前公司的“智能硬件 ”产品主要采用ToB的模式。
“智能硬件 个人”解决方案，主要通过布局打令宝系列产品作为入口，围绕切入个人消费者的日常生活应用场景，目前已推出“神灯机器人”、“魔境机器人”、“打令小宝机器人”三款打令系列机器人，实现销售收入约5600万元，已为母婴、服饰、轻奢、医疗、大健康、房产等细分行业提供了“智能硬件 个人”解决方案，并在服饰、母婴两个行业初步取得突破。
“智能硬件 实体店”解决方案以合众宝为硬件载体，公司销售合众宝实现销售收入。合众宝是基于高清显示大屏的集视像采集、视像显示、多种互联网入口的、支持云端数据交互、信息发布、手机APP互动于一体的、基于实体店开展文化传媒及电子商务运营的智能硬件。例如开展餐饮店的“明厨亮灶”工程如使用合众宝，可以在满足消费者监控食品安全需求的同时，起到为商家做广告和引流等作用。
“智能硬件 公共场所”解决方案以乐摇宝为硬件载体，公司通过销售乐摇宝实现销售收入。乐摇宝可以作为“互联网 ”运营客户的电子商务运营载体、文化传媒入口，通过客户的云平台可以作为近场安全社交平台、推送近场生活优惠、帮助商家促销、推送线上资讯，在多地的商圈运营公司均有应用。

五、从2011年至今公司得到快速发展，主要竞争优势有哪些？
1.核心技术方面的优势，公司拥有来自原奥林巴斯的核心技术团队，通过十几年的深厚技术积累与沉淀，公司确立了“精密光机电 仿生智能算法”的核心竞争优势。公司一直以来深耕核心技术，并不断横向拓展至各个适用领域，目前已掌握系统的光学成像技术、激光夜视技术、图像处理技术、云平台架构技术、人工智能应用技术。
2.公司基于已有的核心技术，结合国家政策及社会需求，研发生产出各类产品投向市场，广泛运用于汽车夜视主动安全、智能硬件 互联网、商显、特种视像、安防视像、智慧城市建设等领域，并获得了市场的认同。
3.公司关注汽车交通安全问题，不断升级汽车夜视主动安全产品，丰富产品功能，随着交通安全问题日益受到重视，市场对汽车夜视主动安全产品需求不断增加。顺应国家“互联网 ”战略，公司推出的智能硬件产品为各行各业“互联网 ”落地实施提供了解决方案，是各行各业“互联网 ”方案落地的主要载体之一。
4.创新的商业模式助推公司快速发展。公司准确选择产品应用领域，从下游客户的角度出发，研发生产出有利于帮助客户创造效益的产品，有效维护客户的忠诚度，达到公司与客户的共赢。
5.公司制定了完善有效的制度规范公司管理，一直推行“以人为本”的管理方针，目前已实施两期股权激励计划，将高管和核心骨干员工纳入激励对象，有效提高管理效率和员工的积极性、创造性与责任心，有力地促进了公司发展。

六、公司为何布局新能源汽车？
汽车领域是公司重点聚焦的智能电子产品应用领域。现阶段，公司为整车厂客户与终端消费者提供汽车夜视主动安全系统等智能电子产品，在此基础上研发推广以车联网智能硬件为入口的互联网 应用平台。公司的夜视传感技术、图像判读技术、主动安全技术、智能驾驶系统是无人驾驶的基础技术之一，该技术目前在国内属于领先地位，正助力公司稳步切入汽车智能驾驶领域。
公司投资的柳州延龙汽车是一家主要从事新能源汽车生产的公司，具备经国家工信部批准的新能源汽车和专用汽车生产资质，累计获得国家工信部205个汽车产品公告，为国家高新技术企业，省级技术中心，柳州市重点扶持民营企业，具备较强的技术水平，具备较大的发展潜力。
公司将通过投资柳州延龙快速切入新能源汽车领域，并结合公司成熟的汽车夜视主动安全系统的应用功能，与公司现有产品产生协同效应，充分整合产业资源，顺势在汽车电子产品上做深度延伸，有利于公司在智能驾驶、无人驾驶领域的发展机会中抢占先机。
公司认为，新能源汽车有望在中国成为市场的主流产品。中国作为全球最大的汽车市场，其自身规模足以支撑起新能源产业链的生存和发展。公司以“电动化、智能化、网联化”以及三化融合为战略目标，通过投资柳州延龙快速布局智能新能源汽车、智能网联汽车领域，分享产业链成长红利。


[点击下载原文]
展开阅读全文"
炒股，哦只服任子行。名符其实。任性行。恁你违规调查，大股东减持，俺就是涨停。,"https://guba.eastmoney.com/news,600074,605798118.html",2017-02-10 22:43:18,炒股，哦只服任子行。名符其实。任性行。恁你违规调查，大股东减持，俺就是涨停。
有效突破30均线,"https://guba.eastmoney.com/news,600074,605765834.html",2017-02-10 19:02:54,我今天加了点。
保千里不。回调13附近。你们找我。。。,"https://guba.eastmoney.com/news,600074,605759098.html",2017-02-10 18:09:01,保千里不。回调13附近。你们找我。。。
又是尾盘拉为下周继续泻做准备,"https://guba.eastmoney.com/news,600074,605758466.html",2017-02-10 18:04:30,又是尾盘拉为下周继续泻做准备
[俏皮]要是周末出一个不错的利好就好了！！万一呢,"https://guba.eastmoney.com/news,600074,605753317.html",2017-02-10 17:31:10,要是周末出一个不错的利好就好了！！万一呢
冲高已出光！周末吃利息，下周再进！,"https://guba.eastmoney.com/news,600074,605690351.html",2017-02-10 15:44:37,冲高已出光！周末吃利息，下周再进！
胜利走人,"https://guba.eastmoney.com/news,600074,605635188.html",2017-02-10 14:57:55,终于卖掉
谢谢不客气！,"https://guba.eastmoney.com/news,600074,605640239.html",2017-02-10 15:01:39,谢谢不客气！
尾盘哥又来了！,"https://guba.eastmoney.com/news,600074,605636382.html",2017-02-10 14:58:51,尾盘哥又来了！
尾盘表现,"https://guba.eastmoney.com/news,600074,605558303.html",2017-02-10 13:56:13,尾盘再次换主的可能性很大
阴气太重，扯呼！,"https://guba.eastmoney.com/news,600074,605618763.html",2017-02-10 14:46:43,阴气太重，扯呼！
短线今天冲高出光！！,"https://guba.eastmoney.com/news,600074,605287084.html",2017-02-10 09:25:10,短线今天冲高出光！！
该账了 ！！！[满仓],"https://guba.eastmoney.com/news,600074,605586109.html",2017-02-10 14:20:25,该账了 ！！！
今天是阳痿的,"https://guba.eastmoney.com/news,600074,605320345.html",2017-02-10 10:01:44,今天是阳痿的
“要重视上市公司的质量！”那么，保千里有质量吗？,"https://guba.eastmoney.com/news,600074,605474993.html",2017-02-10 12:33:35,“要重视上市公司的质量！”那么，保千里有质量吗？
这样的走势，显而易见，在换庄。,"https://guba.eastmoney.com/news,600074,605461271.html",2017-02-10 12:19:46,这样的走势，显而易见，在换庄。
均线看上去走好了，但是还有一次均线再走坏，那么走场买入，现在买还会套你的,"https://guba.eastmoney.com/news,600074,605431167.html",2017-02-10 11:47:33,均线看上去走好了，但是还有一次均线再走坏，那么走场买入，现在买还会套你的
越跌越兴奋，反正我已进场，嘻嘻~,"https://guba.eastmoney.com/news,600074,605407002.html",2017-02-10 11:19:55,不管你们买不买，反正我已开始进场！
跌停前一天买的，现在快回本了,"https://guba.eastmoney.com/news,600074,605418358.html",2017-02-10 11:32:07,跌停前一天买的，现在快回本了
玛德，尾盘进了1400手！权当平台突破！,"https://guba.eastmoney.com/news,600074,604567445.html",2017-02-09 15:22:55,玛德，尾盘进了1400手！权当平台突破！
保千里。明天破13元。。拭目以待,"https://guba.eastmoney.com/news,600074,604105715.html",2017-02-08 22:11:20,保千里。明天破13元。。拭目以待
涨一天跌三天，哈哈哈，泻千里，名副其实,"https://guba.eastmoney.com/news,600074,605340134.html",2017-02-10 10:21:44,涨一天跌三天，哈哈哈，泻千里，名副其实
这个板块连接天堂和地狱,"https://guba.eastmoney.com/news,600074,605271470.html",2017-02-10 09:03:38,这个板块连接天堂和地狱
保千里图雅丽获武器装备质管体系认证,"https://guba.eastmoney.com/news,600074,604670688.html",2017-02-09 19:02:02,保千里图雅丽获武器装备质管体系认证.
确实可以从数字上给GDP做加法,"https://guba.eastmoney.com/news,600074,605236507.html",2017-02-10 08:09:35,确实可以从数字上给GDP做加法
保千里：今天就一个字,"https://guba.eastmoney.com/news,600074,605230159.html",2017-02-10 07:58:56,保千里，今天就一个字：涨！昨天的放量中阳已经说明一切。
世界经济只增长1.9%,"https://guba.eastmoney.com/news,600074,605210353.html",2017-02-10 07:25:45,2015年的5178点；当供求平衡时
保千里,"https://guba.eastmoney.com/news,600074,604640209.html",2017-02-09 17:52:29,保千里
保千里旗下的图雅丽今年会给大家一个惊喜,"https://guba.eastmoney.com/news,600074,586763211.html",2017-01-10 13:43:46,保千里旗下的图雅丽今年会给大家一个惊喜
保千里向来一出利好就比谁跑得快，不知明天如何,"https://guba.eastmoney.com/news,600074,604703938.html",2017-02-09 20:12:32,保千里向来一出利好就比谁跑得快，不知明天如何
我第一次看到大单流入比例这么多才拉2个点的，卖了百分80留20里面，明天应该大跌,"https://guba.eastmoney.com/news,600074,604557069.html",2017-02-09 15:04:30,我第一次看到大单流入比例这么多才拉2个点的，卖了百分80留20里面，明天应该大跌吧。
千里之行始于足下,"https://guba.eastmoney.com/news,600074,592195072.html",2017-01-19 23:25:19,千里之行始于足下
尼玛一万多手的砸,"https://guba.eastmoney.com/news,600074,604552035.html",2017-02-09 14:56:48,尼玛一万多手的砸
大家不要等了，13.19以上建仓一半以上吧！,"https://guba.eastmoney.com/news,600074,603720352.html",2017-02-08 11:00:29,大家不要等了，13.19以上建仓一半以上吧！
尾盘哥，该你表现了,"https://guba.eastmoney.com/news,600074,604552621.html",2017-02-09 14:57:41,尾盘哥，该你表现了
肯定超过13.68,"https://guba.eastmoney.com/news,600074,604551932.html",2017-02-09 14:56:39,肯定超过13.68
买入不急，买出不慌,"https://guba.eastmoney.com/news,600074,604510278.html",2017-02-09 13:56:12,
小心！主力还是在撤退的！,"https://guba.eastmoney.com/news,600074,604492575.html",2017-02-09 13:30:13,拉高抛就对了！
从2015.6月停盘到9月开盘给套住了，能咬定青山不放松吗？准备不捞回来就认了33元目标不变,"https://guba.eastmoney.com/news,600074,604456566.html",2017-02-09 12:17:47,33元
果然是泄千里,"https://guba.eastmoney.com/news,600074,604397372.html",2017-02-09 10:39:35,果然是泄千里
短线开始卖出！,"https://guba.eastmoney.com/news,600074,604377915.html",2017-02-09 10:14:08,短线开始卖出！
早盘哥来啦！,"https://guba.eastmoney.com/news,600074,604356315.html",2017-02-09 09:46:40,早盘哥来啦！
现在又面对600家企业排队的“堰塞湖”,"https://guba.eastmoney.com/news,600074,604315865.html",2017-02-09 08:34:23,与此同时日前
中国“智造”，保千里不可或缺,"https://guba.eastmoney.com/news,600074,604314560.html",2017-02-09 08:31:02,因为信息披露违规被立案调查，机构不敢推荐。让我来吧！看好中国智造，坚决推荐保千里。
现在还是等消息面。,"https://guba.eastmoney.com/news,600074,604173077.html",2017-02-09 01:29:48,现在还是等消息面。
会突破14.28?,"https://guba.eastmoney.com/news,600074,603883222.html",2017-02-08 14:28:53,会突破14.28?
估计周末会有利好消息放出来，可以加仓或买进,"https://guba.eastmoney.com/news,600074,587910379.html",2017-01-13 13:28:03,估计周末会有利好消息放出来，可以加仓或买进
等一季报业绩超预期增长才会有一波行情。此股维持35倍市盈率，高于40清仓，低于3,"https://guba.eastmoney.com/news,600074,603942093.html",2017-02-08 15:41:53,等一季报业绩超预期增长才会有一波行情。此股维持35倍市盈率，高于40清仓，低于30补仓。没信心，没耐心别介入。A股上市公司老总们终极目的是减持兑现，移民走人，股市是屠宰场，铰肉机。真正做强企业，实业报国的寥寥。
大家准备高埋，尾盘哥要来啦！,"https://guba.eastmoney.com/news,600074,603896126.html",2017-02-08 14:42:52,大家准备高埋，尾盘哥要来啦！
嘛呢？！织布呢！,"https://guba.eastmoney.com/news,600074,603819717.html",2017-02-08 13:17:31,嘛呢？！织布呢！
