标题,链接,发布时间,内容
比股控盘能力很强！就看你有没有胆识,"https://guba.eastmoney.com/news,600074,609336773.html",2017-02-16 10:10:55,比股控盘能力很强！就看你有没有胆识
这股就是一典型的僵尸股，没资金关注。,"https://guba.eastmoney.com/news,600074,609335417.html",2017-02-16 10:08:44,天天不死不活的，涨一点儿，跌一点儿，不会有行情了，烂僵尸！
公司VR手机销售如何？,"https://guba.eastmoney.com/news,600074,609200150.html",2017-02-15 20:19:51,公司打造保千里VR手机已销售多少部？
我勒个去,"https://guba.eastmoney.com/news,600074,609323576.html",2017-02-16 09:47:15,这王八主力毫无抵抗的行为，每天一开盘就一路绿下去。
此股已完蛋，可能退市。,"https://guba.eastmoney.com/news,600074,609131484.html",2017-02-15 16:51:02,此股已完蛋，可能退市。
这公司今天又多了个爹，呵呵,"https://guba.eastmoney.com/news,600074,609318896.html",2017-02-16 09:39:22,这公司今天又多了个爹，呵呵
还有相信这垃圾的吗，呵呵,"https://guba.eastmoney.com/news,600074,609316605.html",2017-02-16 09:34:47,还有相信这垃圾的吗，呵呵
理由是,"https://guba.eastmoney.com/news,600074,609317182.html",2017-02-16 09:36:01,理由是
今天又可能回到三十日下方了,"https://guba.eastmoney.com/news,600074,609317136.html",2017-02-16 09:35:48,今天又可能回到三十日下方了
信息披露违法违规，不致于严重到退市或暂停上市吧？那样的话不是一个惨字表达得了！,"https://guba.eastmoney.com/news,600074,609203235.html",2017-02-15 20:30:31,信息披露违法违规，不致于严重到退市或暂停上市吧？那样的话不是一个惨字表达得了！
抄底抄到山顶上！谁交我！怎么解套？,"https://guba.eastmoney.com/news,600074,609236794.html",2017-02-15 22:34:08,抄底抄到山顶上！谁交我！怎么解套？
明天高开5个点,"https://guba.eastmoney.com/news,600074,609233740.html",2017-02-15 22:22:21,明天高开5个点
爽啊，挂在13.65的单全走了，下周低位接回！,"https://guba.eastmoney.com/news,600074,605748658.html",2017-02-10 17:07:07,每日一t，喝尽庄血。
千里智能驾驶新品上市发布会隆重举行,"https://guba.eastmoney.com/news,600074,609166757.html",2017-02-15 18:24:52,千里智能驾驶新品上市发布会隆重举行
"减持等于杀人，增发等于杀人序曲,发新股等于","https://guba.eastmoney.com/news,600074,609201379.html",2017-02-15 20:23:58,"减持等于杀人，增发等于杀人序曲,发新股等于"
走得快，好世界,"https://guba.eastmoney.com/news,600074,609199757.html",2017-02-15 20:18:46,走得快，好世界
还是立刻兑现的好,"https://guba.eastmoney.com/news,600074,609199703.html",2017-02-15 20:18:37,还是立刻兑现的好
如果有把握,"https://guba.eastmoney.com/news,600074,609199648.html",2017-02-15 20:18:27,如果有把握
得到的时候要懂得珍惜,"https://guba.eastmoney.com/news,600074,609199547.html",2017-02-15 20:18:06,得到的时候要懂得珍惜
13.3生死线,"https://guba.eastmoney.com/news,600074,609196658.html",2017-02-15 20:08:19,
现在的问题是：保千里假如真的违规，是否严重到会退市。如果不退市，证监会公告无论是,"https://guba.eastmoney.com/news,600074,608944777.html",2017-02-15 09:42:36,现在的问题是：保千里假如真的违规，是否严重到会退市。如果不退市，证监会公告无论是否违规，都无法阻挡保千里的腾飞。
当你们认为要大跌是！我偏认为要涨！！！,"https://guba.eastmoney.com/news,600074,608986431.html",2017-02-15 10:56:54,当你们认为要大跌是！我偏认为要涨！！！
保千里集黑科技大成 “大宝”机器人造就行业领先,"https://guba.eastmoney.com/news,600074,608991849.html",2017-02-15 11:06:47,国内知名上市公司保千里于今年1月刚刚推出的“大宝”商用机器人，不同于目前市面上投入应用的机器人只拥有一两项核心技术，大宝机器人市场上首个完美糅合多项前沿“黑科技”的机器人，集办公、娱乐和载重等功能于一体，有专家评论，大宝集合了机器人前沿技术大成，是迄今为止最智勇双全的商用服务机器人。
尾盘哥，今天回来么[不屑],"https://guba.eastmoney.com/news,600074,609085333.html",2017-02-15 14:47:02,尾盘哥，今天回来么[不屑]
弱势股就是弱势股，跌起来一点不含糊,"https://guba.eastmoney.com/news,600074,609088778.html",2017-02-15 14:52:07,弱势股就是弱势股，跌起来一点不含糊
没有最低，只有更低，狠狠地砸吧,"https://guba.eastmoney.com/news,600074,609088631.html",2017-02-15 14:51:54,没有最低，只有更低，狠狠地砸吧
大撒比,"https://guba.eastmoney.com/news,600074,609068471.html",2017-02-15 14:19:31,大撒比
看把你们吓得，它会跌多少？会跌停吗？啊？正常的回调！切！！！,"https://guba.eastmoney.com/news,600074,608989486.html",2017-02-15 11:02:23,看把你们吓得，它会跌多少？会跌停吗？啊？正常的回调！切！！！
尾哥，来耍一下,"https://guba.eastmoney.com/news,600074,609057270.html",2017-02-15 13:59:21,尾哥，来耍一下
泻千里，呵呵,"https://guba.eastmoney.com/news,600074,609045719.html",2017-02-15 13:38:32,泻千里，呵呵
大家注意还要深调,"https://guba.eastmoney.com/news,600074,608980254.html",2017-02-15 10:46:14,大家注意还要深调
美股三大股指“气势如虹”，纷纷创历史记录,"https://guba.eastmoney.com/news,600074,608988782.html",2017-02-15 11:01:02,美股三大股指“气势如虹”，纷纷创历史记录，凸显“美国优先”的霸气，A股摇摇欲坠，每天水深火热，用全球第一的增长贯彻“和平发展”的理念。
G食品安全环保产业的强基；行业的翘楚——002637赞宇科技终于浮出水面！！未来10年高速成长,"https://guba.eastmoney.com/news,600074,608985380.html",2017-02-15 10:55:00,食品安全环保产业的强基；行业的翘楚——002637赞宇科技终于浮出水面！！未来10年高速成长
突破前高 建仓,"https://guba.eastmoney.com/news,600074,608959056.html",2017-02-15 10:08:39,突破前高 建仓
看来不妙了，要掉头，彻底破线了，早上估计是跑的机会，估计要跌两个点左右[哭],"https://guba.eastmoney.com/news,600074,608968064.html",2017-02-15 10:24:56,看来不妙了，要掉头，彻底破线了，早上估计是跑的机会，估计要跌两个点左右
这个垃圾不是泻肚子，而是得了胃癌或肠癌，并且是晚期了,"https://guba.eastmoney.com/news,600074,608965306.html",2017-02-15 10:19:48,这个垃圾不是泻肚子，而是得了胃癌或肠癌，并且是晚期了
小宝宝要睡觉了！长眠不醒！,"https://guba.eastmoney.com/news,600074,608960418.html",2017-02-15 10:11:13,小宝宝要睡觉了！长眠不醒！
真牛逼，人家都在涨就你跌,"https://guba.eastmoney.com/news,600074,608959134.html",2017-02-15 10:08:48,真牛逼，人家都在涨就你跌
突破前高 建仓,"https://guba.eastmoney.com/news,600074,608958989.html",2017-02-15 10:08:35,突破前高 建仓
买买买，抱团取暖！,"https://guba.eastmoney.com/news,600074,608958888.html",2017-02-15 10:08:20,买买买，抱团取暖！
现在股市没法做了,"https://guba.eastmoney.com/news,600074,608958386.html",2017-02-15 10:07:24,现在股市没法做了
保千里：预计2016年净利同比增120%-160%,"https://guba.eastmoney.com/news,600074,608958121.html",2017-02-15 10:06:57,"1月17日电 保千里(600074)1月16日晚发布公告，经公司财务部门初步核算，预计2016年度实现归属于上市公司股东的净利润约为82,163万元至97,102万元，与上年同期相比增幅为120%至160%。上年同期归属于上市公司股东的净利润为373,475,409.27元，每股收益为0.18元。"
没救了，没指望了，再见保千里！,"https://guba.eastmoney.com/news,600074,608958143.html",2017-02-15 10:06:56,没救了，没指望了，再见保千里！
"新股小盘绩优发飙股,国内市场占有率分列冠亚军,","https://guba.eastmoney.com/news,600074,608954096.html",2017-02-15 09:59:53,星星科技14亿收购华为供应商深圳联懋
撒比，要跌就速度点,"https://guba.eastmoney.com/news,600074,608938019.html",2017-02-15 09:27:33,撒比，要跌就速度点
垃圾股票,"https://guba.eastmoney.com/news,600074,608951507.html",2017-02-15 09:55:15,垃圾股票
弱爆了[不赞][不赞][不赞],"https://guba.eastmoney.com/news,600074,608945264.html",2017-02-15 09:43:36,弱爆了[不赞][不赞][不赞]
无论如何，这段时间保千里的日线走势至少说明一个问题，这股是有庄的。,"https://guba.eastmoney.com/news,600074,608931844.html",2017-02-15 09:04:29,是吸筹还是出货，猜一猜也是50%概率，总归有个盼头，不是死股。而且目前来看，庄的控盘能力也是基本全控的。
大宝，大宝,"https://guba.eastmoney.com/news,600074,608931021.html",2017-02-15 09:00:35,大宝，大宝
哈哈，里面好多人，都想辣，做梦，明天继续振荡，然后再继续，，，，大家关注永吉股份,"https://guba.eastmoney.com/news,600074,608866840.html",2017-02-15 00:32:08,哈哈，里面好多人，都想辣，做梦，明天继续振荡，然后再继续，，，，大家关注永吉股份，万里马
哥哥我56卖了，再见,"https://guba.eastmoney.com/news,600074,608603019.html",2017-02-14 14:43:53,哥哥我56卖了，再见
千万不要被疯子的意淫所骗到,"https://guba.eastmoney.com/news,600074,608810789.html",2017-02-14 20:05:25,千万不要被疯子的意淫所骗到
这股。呵呵,"https://guba.eastmoney.com/news,600074,608777574.html",2017-02-14 19:10:21,这股。呵呵
市场分化加剧震荡 缩量回调大胆低吸,"https://guba.eastmoney.com/news,600074,608777176.html",2017-02-14 19:09:46,市场分化加剧震荡 缩量回调大胆低吸
市场分化加剧震荡 缩量回调大胆低吸,"https://guba.eastmoney.com/news,600074,608667100.html",2017-02-14 16:09:01,市场分化加剧震荡 缩量回调大胆低吸
捂三个年头了，从2015年6月到现在 不达目标33元不走了,"https://guba.eastmoney.com/news,600074,607954550.html",2017-02-13 20:58:03,不看了
尾盘哥今天拉不拉,"https://guba.eastmoney.com/news,600074,608590766.html",2017-02-14 14:30:48,快买
受不了啦，两分钱玩了好几天了！！,"https://guba.eastmoney.com/news,600074,608606011.html",2017-02-14 14:47:04,受不了啦，两分钱玩了好几天了！！
13.60压力山大！别抱幻想了！,"https://guba.eastmoney.com/news,600074,608597906.html",2017-02-14 14:38:22,13.60压力山大！别抱幻想了！
抓紧买  今天肯定新高,"https://guba.eastmoney.com/news,600074,608595829.html",2017-02-14 14:36:14,抓紧买 今天肯定新高
观望一下！,"https://guba.eastmoney.com/news,600074,608577321.html",2017-02-14 14:15:59,观望一下！
不涨有因,"https://guba.eastmoney.com/news,600074,608566418.html",2017-02-14 13:58:23,主力拿不到筹码也就不愿拉，没有人卖！
现在缺的就是一根中放量阳线。上升通道才能确立。,"https://guba.eastmoney.com/news,600074,608568804.html",2017-02-14 14:02:33,现在缺的就是一根中放量阳线。上升通道才能确立。
小心涨停，不要奇怪。,"https://guba.eastmoney.com/news,600074,608562067.html",2017-02-14 13:50:23,小心涨停
要加仓赶紧，一会没机会了,"https://guba.eastmoney.com/news,600074,608542837.html",2017-02-14 13:16:12,要加仓赶紧，一会没机会了
这个阵势很像几天前的！看起来又是狂拉,"https://guba.eastmoney.com/news,600074,608537343.html",2017-02-14 13:06:41,这个阵势很像几天前的！看起来又是狂拉
加仓点位,"https://guba.eastmoney.com/news,600074,608540336.html",2017-02-14 13:11:46,加仓点位
快报名索赔，可到公司官网上登记，登记后方可赔偿。,"https://guba.eastmoney.com/news,600074,607881888.html",2017-02-13 19:39:15,快报名索赔，可到公司官网上登记，登记后方可赔偿。
能不能动一下,"https://guba.eastmoney.com/news,600074,608458732.html",2017-02-14 11:16:41,能不能动一下
僵尸股,"https://guba.eastmoney.com/news,600074,608432548.html",2017-02-14 10:45:35,换
压力山大，跑！,"https://guba.eastmoney.com/news,600074,608410095.html",2017-02-14 10:20:36,压力山大，跑！
明天又见夕阳红,"https://guba.eastmoney.com/news,600074,608134121.html",2017-02-14 02:55:07,明天又见夕阳红
中国，你们的媒体，说的什么话是真的,"https://guba.eastmoney.com/news,600074,608123261.html",2017-02-14 02:30:47,中国，你们的媒体，说的什么话是真的
恭喜保千里荣登榜首，跌幅板块第一，实在是实至名归的大烂股,"https://guba.eastmoney.com/news,600074,607929077.html",2017-02-13 20:30:07,恭喜保千里荣登榜首，跌幅板块第一，实在是实至名归的大烂股
十三五我国将建480万个充电桩 10股现布局良机,"https://guba.eastmoney.com/news,600074,607860278.html",2017-02-13 19:15:49,实盘3股：国创高新安控科技弘亚数控
烂股中的烂股，大盘猛涨，保千里今天大笔资金流出，放量下跌，起码回调到13.20再,"https://guba.eastmoney.com/news,600074,607856023.html",2017-02-13 19:11:08,烂股中的烂股，大盘猛涨，保千里今天大笔资金流出，放量下跌，起码回调到13.20再看，这真是恶庄
还有这么多做梦的,"https://guba.eastmoney.com/news,600074,607764488.html",2017-02-13 17:28:12,还有这么多做梦的
今天尾盘哥阳痿了？？,"https://guba.eastmoney.com/news,600074,607593307.html",2017-02-13 14:41:59,今天尾盘哥阳痿了？？
涨涨涨涨涨涨………………,"https://guba.eastmoney.com/news,600074,607611251.html",2017-02-13 14:57:06,涨涨涨涨涨涨………………
今天要反方向来下？变伟哥了,"https://guba.eastmoney.com/news,600074,607609398.html",2017-02-13 14:55:48,今天要反方向来下？
"股票虽然没涨,成交量在逐步放大,有启动迹象","https://guba.eastmoney.com/news,600074,607549642.html",2017-02-13 14:04:29,"股票虽然没涨,成交量在逐步放大,有启动迹象"
还要跌倒13快！短期没戏,"https://guba.eastmoney.com/news,600074,607566397.html",2017-02-13 14:19:06,还要跌倒13快！短期没戏
被盘尾哥骗了，这分明是出货的节奏,"https://guba.eastmoney.com/news,600074,607527412.html",2017-02-13 13:45:07,被盘尾哥骗了，这分明是出货的节奏
军工股,"https://guba.eastmoney.com/news,600074,607529346.html",2017-02-13 13:46:44,牛逼
怎么了,"https://guba.eastmoney.com/news,600074,607515369.html",2017-02-13 13:34:26,怎么了
2017年发财就靠他了[鼓掌][鼓掌][鼓掌],"https://guba.eastmoney.com/news,600074,607441748.html",2017-02-13 12:20:52,2017年发财就靠他了
乱发消息明天去看守所报到！,"https://guba.eastmoney.com/news,600074,607416254.html",2017-02-13 11:55:21,乱发消息明天去看守所报到！
你跌我就买！,"https://guba.eastmoney.com/news,600074,607378826.html",2017-02-13 11:24:52,你跌我就买！
今天我加了,"https://guba.eastmoney.com/news,600074,607360449.html",2017-02-13 11:09:51,不管主力如何想，反正我加了1000.
都在涨，，，只有保千里在跌。。哈哈,"https://guba.eastmoney.com/news,600074,607345911.html",2017-02-13 10:55:06,都在涨，，，只有保千里在跌。。哈哈
复盘发现今天的拉高很不一样，下周买不回来了！哭啊！,"https://guba.eastmoney.com/news,600074,605781923.html",2017-02-10 20:51:27,复盘发现今天的拉高很不一样，下周买不回来了！
没有伯乐哪里有千里马！,"https://guba.eastmoney.com/news,600074,607337736.html",2017-02-13 10:40:21,没有伯乐哪里有千里马！
此股已经沦为庄股了,"https://guba.eastmoney.com/news,600074,607331702.html",2017-02-13 10:29:09,庄股
你再不拉，跟风盘 要卖了,"https://guba.eastmoney.com/news,600074,607329240.html",2017-02-13 10:24:43,你再不拉，跟风盘 要卖了
撒比股，老子抛了,"https://guba.eastmoney.com/news,600074,607320514.html",2017-02-13 10:10:16,撒比股，老子抛了
只有拉高卖出免赔偿,"https://guba.eastmoney.com/news,600074,607226479.html",2017-02-12 23:18:15,只有拉高卖出免赔偿
以现在的减持速度 保还要一个月到一个半月的摸底时间[微笑],"https://guba.eastmoney.com/news,600074,606145629.html",2017-02-11 21:45:02,以现在的减持速度 保还要一个月到一个半月的摸底时间
600074:保千里关于立案调查进展暨风险提示的公告,"https://guba.eastmoney.com/news,600074,606907848.html",2017-02-12 16:11:23,如公司因前述立案调查事项被中国证监会最终认定存在重大信息披露违法行为，公司股票存在可能被实施退市风险警示及暂停上市的风险；如公司所涉及的立案调查事项最终未被中国证监会认定为重大信息披露违法行为，公司股票将不存在可能被实施退市风险警示及暂停上市的风险。
叫“东方股神AAA”那个人很阴险，大家小心，在秋林吧害了很多人，现在又来这边了。,"https://guba.eastmoney.com/news,600074,600779641.html",2017-02-05 05:43:12,叫“东方股神AAA”那个人很阴险，大家小心，在秋林吧害了很多人，现在又来这边了。而且他是有团队来忽悠的。
下周关注一板块的机会,"https://guba.eastmoney.com/news,600074,607127647.html",2017-02-12 20:48:23,下周关注一板块的机会
保千里，下周回调12附近。在进,"https://guba.eastmoney.com/news,600074,605714263.html",2017-02-10 16:07:04,保千里，下周回调12附近。在进
第一目标15块，15以下卖的是傻子,"https://guba.eastmoney.com/news,600074,606976600.html",2017-02-12 17:32:08,"第一目标15块，15以下卖的是傻子
第二目标18块"
央行连续六日暂停公开市场逆回购操作 本周净回笼6250亿,"https://guba.eastmoney.com/news,600074,606909864.html",2017-02-12 16:14:00,"周五（2月10日），央行公告称，目前银行体系流动性总量处于较高水平，央行2月10日暂不开展公开市场逆回购，之前2月9日、2月8日、7日、6日和4日均未操作，当日净回笼800亿，本周净回笼6250亿，单周回笼量创2016年7月2日-8日当周以来最高。此外，央行公开市场对7天、14天和28天期逆回购需求进行询量。

　　一位市场机构人士表示，“节前投放、节后回笼资金”是公开市场操作的惯例。今年，央行将逆回购、SLF利率上调后，再暂停逆回购，如此连续举动，被市场人士视为货币政策边际趋紧的延续。中金公司报告认为，春节后，虽然在逆回购、SLF利率上调带动下，回购利率出现上行，但资金面整体仍然宽松。

　　需要指出的是，本周(2月6日至10日)央行公开市场回笼量6250亿元(含上周日顺延)，周一至周五的到期量分别为1500亿、1200亿、1650亿、1500亿、800亿元。下周回笼量将进一步攀升至9000亿元。整个2月，货币市场将有逾2万亿元流动性到期。

　　“虽然本周有6250亿元逆回购到期，但恐难解流动性失衡。”上述市场机构人士说。中信证券固收首席分析师明明也认为，这虽然对调节整体流动性起到一定作用，但流动性的净回笼以及前期政策利率的提高，反而加重了中小银行以及非银金融机构的流动性压力。

　　在明明看来，央行不妨考虑采用正回购与逆回购相结合的方式，即通过向一级交易商做正回购进而回笼流动性，并且做适度的逆回购补充市场资金，这样不仅能从总量上达到回笼过剩流动性的目的，也在一定程度上缓解了货币市场进行拆借机构的流动性压力。

　　国泰君安固收报告也认为，如果外汇占款出现阶段性回流，央行或重启正回购“吸收”新增流动性以维持资金面相对“紧”的状态。短期来看，虽然年后天量净投放回笼，资金面持续承压，但在此期间也不排除央行通过“窗口指导”的方式进行正回购以释放进一步收紧的信号。在资本外流压力大幅缓解的背景下，“零星”正回购与“天量”净投放回笼其实并不矛盾。"
水泥板块继续全面暴涨看好具有水泥维生素之称00,"https://guba.eastmoney.com/news,600074,605808513.html",2017-02-10 23:55:03,短中线淘金：周三操作参考（1.17）
已到春耕时节,"https://guba.eastmoney.com/news,600074,606106666.html",2017-02-11 19:33:13,全仓保千里，明年见
又是450万股，大宗减持交易不断，此股阴跌不断根本原因还是以船王任江阴资本的大小,"https://guba.eastmoney.com/news,600074,604081520.html",2017-02-08 20:00:00,又是450万股，大宗减持交易不断，此股阴跌不断根本原因还是以船王任江阴资本的大小非减持，他们减持是不计成本的，给钱就卖，可恶的狗腿子，有完没完
谁还记得节前最后一日尾盘冲最高的那只股,"https://guba.eastmoney.com/news,600074,605852149.html",2017-02-11 10:48:04,比保千里涨幅更大的
不用你们保千里，保住天天涨俩点就行，一个礼拜后得有几亿来保你们千里。,"https://guba.eastmoney.com/news,600074,605749415.html",2017-02-10 17:10:52,不用你们保千里，保住天天涨俩点就行，一个礼拜后得有几亿来保你们千里。
2005年的998点,"https://guba.eastmoney.com/news,600074,605827518.html",2017-02-11 05:31:47,2005年的998点
