标题,链接,发布时间,内容
沉浮：脏话小丑脑子研究问题比较偏激，着了魔咒的感觉，理解问题比较片面……,"https://guba.eastmoney.com/news,600401,662025090.html",2017-06-28 15:28:10,沉浮：脏话小丑脑子研究问题比较偏激，着了魔咒的感觉，理解问题比较片面……
我和这个吧里几个高手的观点一样，1.4元以下就没必要割肉了，下跌空间有限，除非你,"https://guba.eastmoney.com/news,600401,662021729.html",2017-06-28 15:24:07,我和这个吧里几个高手的观点一样，1.4元以下就没必要割肉了，下跌空间有限，除非你有其他的好股票可以赚到更多的钱才能那么做……
沉浮：脏话小丑确实很变态，说话总是偷偷摸摸，出来说，让别人看看你的丑恶面目,"https://guba.eastmoney.com/news,600401,662022624.html",2017-06-28 15:25:06,沉浮：脏话小丑确实很变态，说话总是偷偷摸摸，出来说，让别人看看你的丑恶面目
601558st瑞电：完蛋了，这个st票要涨停了,"https://guba.eastmoney.com/news,600401,661349758.html",2017-06-27 13:57:54,601558st瑞电：完蛋了，这个st票要涨停了
这只票没什么希望了,"https://guba.eastmoney.com/news,600401,661861773.html",2017-06-28 11:11:05,等退市咯，出售手中的三板股权，有需要留言 电 前1827626
此股狗操盘技术比锐电差，锐电庄家吃饱了,"https://guba.eastmoney.com/news,600401,661429417.html",2017-06-27 15:57:37,此股狗操盘技术比锐电差，锐电庄家吃饱了
大有钱途，现在好多鱼塘都在安装太阳能发电。,"https://guba.eastmoney.com/news,600401,661305616.html",2017-06-27 12:50:21,大有钱途，现在好多鱼塘都在安装太阳能发电。
[心碎],"https://guba.eastmoney.com/news,600401,661777179.html",2017-06-28 08:59:23,[心碎]
沉浮：脏话小丑管住你的脏话连篇的嘴罪恶的心,"https://guba.eastmoney.com/news,600401,661588164.html",2017-06-27 21:01:08,沉浮：脏话小丑管住你的脏话连篇的嘴罪恶的心
新督退都比你的股价高。,"https://guba.eastmoney.com/news,600401,662015462.html",2017-06-28 15:13:34,新督退都比你的股价高。
沉浮：脏话小丑，什么使你2年天天不上班，研究这些和你无关的问题，你是精神出了问题,"https://guba.eastmoney.com/news,600401,662014193.html",2017-06-28 15:13:11,沉浮：脏话小丑，什么使你2年天天不上班，研究这些和你无关的问题，你是精神出了问题吗？
k线系统呈现二个红小兵,"https://guba.eastmoney.com/news,600401,661639790.html",2017-06-27 23:16:40,现在经过反弹之后
沉浮：脏话小丑出来说，你好好掉掉价,"https://guba.eastmoney.com/news,600401,661457570.html",2017-06-27 16:51:33,沉浮：脏话小丑出来说，你好好掉掉价
高不抛?,"https://guba.eastmoney.com/news,600401,661836959.html",2017-06-28 10:34:08,今低抛?
宁夏贺兰6MW屋顶分布式光伏扶贫项目顺利并网,"https://guba.eastmoney.com/news,600401,661519906.html",2017-06-27 18:51:24,"宁夏贺兰6MW屋顶分布式光伏扶贫项目顺利并网
发表于：2017-06-24 10:05:54 来源：索比光伏网 
2017年6月22日，海润光伏宁夏贺兰6MW屋顶分布式光伏扶贫项目顺利抢在“630”前完成一次性并网，提前锁定了预期标杆电价，这也是海润光伏积极响应并支持国家西部扶贫工程的首个并网发电的屋顶分布式光伏扶贫项目。
海润光伏贺兰6MW屋顶分布式光伏扶贫试点项目位于宁夏回族自治区银川市贺兰县洪广镇欣荣村，在黄河入境而过银川平原中部的欣荣村2000多户的农户屋顶安装上光伏组件，每户设计安装3.06KW，共计容量6.12MW。该项目设计年总发电量为796万KWh，年二氧化碳减排量7200吨，项目使用海润255W多晶硅光伏组件，固定式倾角25°安装，经过主变升压后T接至附近110KV暖泉变525洪广线91号杆并入国家电网。



宁夏贺兰6MW项目



“贺兰山下果园成，塞北江南旧有名”，在被誉为塞北江南的贺兰县洪广镇欣荣村项目现场，千户扶贫移民新村农户屋顶的太阳能光伏板排列有序，在阳光下熠熠生辉，该项目以发展光伏发电收益和农村扶贫相结合，开创了光伏市场和光伏产业创新结合的新领域，提高了农户利用自家屋顶资源每月电费收入，有利于发展和壮大集体经济，有利于人民群众生活方式的变革，具有明显的产业带动和社会效益。作为该地区的光伏扶贫示范标杆工程，更体现了贫困地区走绿色发展、可持续发展新理念，实现了经济效益、社会效益、政治效益的多方共赢，极大的助推了当地的县域贫困户脱贫、经济发展和节能减排目标。



在气壮山河的贺兰山下，千古传唱的《满江红》里那句“驾长车踏破贺兰山缺”的豪言壮语仿佛就在耳畔，鼓舞和激励着这支敢打硬仗的海润贺兰项目团队，三战告捷，更可喜可贺! 此次抢在“630”前顺利并网的贺兰项目团队成员是：大区总经理刘遵敬、项目团队闫刚、王维、毛航宇、许院生、张秀等，他们坚守在西北边陲小镇，克服了一个又一个旁人无法想象的各种困难，再次彰显了海润项目团队“团结协作、敢打硬仗、不畏艰难、善于啃硬骨头”的优良作风和核心凝聚力，为树立学习榜样，激励全体员工，公司特对贺兰项目团队通报表扬，希望电站项目部再接再厉，再创佳绩!"
股友们注意了，港股垃圾股今天瀑跌明天会不会殃及池鱼，还是小心为妙啊,"https://guba.eastmoney.com/news,600401,661527723.html",2017-06-27 19:05:16,股友们注意了，港股垃圾股今天瀑跌明天会不会殃及池鱼，还是小心为妙啊
收141,"https://guba.eastmoney.com/news,600401,661289462.html",2017-06-27 12:17:12,收141
请问今年盈利的可能性很大吗？？？？,"https://guba.eastmoney.com/news,600401,657586284.html",2017-06-19 17:47:25,"请问今年盈利的可能性很大吗？？？？ 
退市海润
*ST海润：您好，公司业绩情况请后续关注公司发布的定期财务报告，感谢关注！
答复时间 2017-06-28 11:01:36"
抛新都换海润一年解套[胜利],"https://guba.eastmoney.com/news,600401,661943274.html",2017-06-28 13:35:59,抛新都换海润一年解套
002571st德力：完蛋，这个st票要涨停了,"https://guba.eastmoney.com/news,600401,661968169.html",2017-06-28 14:11:39,002571st德力：完蛋，这个st票要涨停了
明天开盘涨停[赞][赞][赞][赞][赞][赞],"https://guba.eastmoney.com/news,600401,661612417.html",2017-06-27 22:01:15,明天开盘涨停
华君控股(00377)宣布，透过高邮市国土局所举行的拍卖，成功竞投一块江苏省高邮,"https://guba.eastmoney.com/news,600401,661531500.html",2017-06-27 19:12:47,"华君控股(00377)宣布，透过高邮市国土局所举行的拍卖，成功竞投一块江苏省高邮区土地，投标价3.4486亿元人民币(约3.79亿元)，以借贷及内部资源支付。
对此举大家怎么看？"
401尾市一定会飘红,"https://guba.eastmoney.com/news,600401,661966315.html",2017-06-28 14:08:29,401尾市一定会飘红
沉浮：你说你在现实是个人，那么在虚拟也应该一样，表里如一，别做双面人，那是心里变,"https://guba.eastmoney.com/news,600401,661588910.html",2017-06-27 21:03:08,沉浮：你说你在现实是个人，那么在虚拟也应该一样，表里如一，别做双面人，那是心里变态
大盘一个仙人指路吓死一批人，下周猛涨，还有人抛海润光伏？而且今天放量。,"https://guba.eastmoney.com/news,600401,659852805.html",2017-06-23 15:02:00,大盘一个仙人指路吓死一批人，下周猛涨，还有人抛海润光伏？而且今天放量。
我来为沉浮正名,"https://guba.eastmoney.com/news,600401,661789465.html",2017-06-28 09:27:46,我为沉浮正名，沉浮先生二年以前就开始唱空海润，有谁是因为他唱空错失上车的机会吗？我们暂且不分析他和海润有什么仇恨，还是像有些人说的他被海润开除了，在严重点说，他就算是托，那这两年多海润股价也确实是一直下走的，他当时说的能见到1.48元，（其实你不服气也不行）几乎所有人都不敢相信甚至想骂他八辈子祖宗，可到如今，1.48元真的已经见到了，用事实说话最有力，不服的损失大小自己知道，当初信以为真的可能在3左右早跑了从而减少了多少损失，所以一味的骂沉浮真的是有失公平和正义（我现在还是被这苟托拉黑的状态，哈哈哈，沉浮我向你道歉了）
本来很看好的，可以一看评论都看多啊，唱多的托太多，感觉很长时间还是没得涨。,"https://guba.eastmoney.com/news,600401,661775420.html",2017-06-28 08:55:52,本来很看好的，可以一看评论都看多啊，唱多的托太多，感觉很长时间还是没得涨。
枪打出头鸟,"https://guba.eastmoney.com/news,600401,661456036.html",2017-06-27 16:47:43,有的人总想出头，于是他就想尽一切办法出头，甚至会用及其低级恶劣阴暗的各种渠道让股吧误认为他很神、于是他真的出头了。结果会是什么？结果就是这只恶劣的出头鸟必死无疑。
1.42继续定投 与宝哥哥一起快乐增持,"https://guba.eastmoney.com/news,600401,661811061.html",2017-06-28 09:59:36,"1.42继续定投
与宝哥哥一起快乐增持"
祝贺新都退成功超越401,"https://guba.eastmoney.com/news,600401,661974134.html",2017-06-28 14:19:24,祝贺新都退成功超越401
玛的退市了，我就去搬太阳能板去，装到家里发电,"https://guba.eastmoney.com/news,600401,661626860.html",2017-06-27 22:41:57,玛的退市了，我就去搬太阳能板去，装到家里发电
弱弱的问一句，亏了钱还装圣洁，你们不脸红吗？,"https://guba.eastmoney.com/news,600401,660653926.html",2017-06-26 12:27:49,拍着自己的良心好好拷问下自己
几天不见大盘都一个轮回了你垃圾还是1.41；大盘5000和你没关系,"https://guba.eastmoney.com/news,600401,661840217.html",2017-06-28 10:38:48,？
玲珑骰子安红豆,"https://guba.eastmoney.com/news,600401,661390466.html",2017-06-27 14:53:57,玲珑骰子安红豆
浮肿人渣你这个低级小人自认3.9股龄有什么了不起，天天跳出分折垃圾股价值高低，自,"https://guba.eastmoney.com/news,600401,661495497.html",2017-06-27 18:04:33,浮肿人渣你这个低级小人自认3.9股龄有什么了不起，天天跳出分折垃圾股价值高低，自认股民说你是好人，你是一个专搞臭上市人渣，你以经搞臭垃圾股二年多至今为什么无停是等洋垃圾孟诈骗给一点狗粮，你说是股民敢不敢拿出开户手续公布，也可以证实你是个股民，我大佬敢拿出开户十七年手续公布，忠告你快一点收回造谣臭嘴。
不仅坑害股民，还要污蔑国家的光伏政策！,"https://guba.eastmoney.com/news,600401,661567099.html",2017-06-27 20:17:54,"去年海润光伏巨额亏损12亿元，孟广宝说是国家的产业政策造成的。上交所问询以后，大家才知道是做假账造成的。
这是给国家抹黑吗？？？？？？？
一边抹黑国家，一边坑害股民！！！！！！！！！"
601558st锐电，明天很可能大涨，赶紧换股！,"https://guba.eastmoney.com/news,600401,661387402.html",2017-06-27 14:50:03,601558st锐电，明天很可能大涨，赶紧换股！
.,"https://guba.eastmoney.com/news,600401,661380894.html",2017-06-27 14:42:13,.
尾盘拉升诱多，明天又套一大批,"https://guba.eastmoney.com/news,600401,661804711.html",2017-06-28 09:51:48,MSCI就是做空中国的机构，每当一提MSCI，A股就
就是让大家认清这样的人，反应过来，正邪不两立,"https://guba.eastmoney.com/news,600401,661598152.html",2017-06-27 21:25:31,就是让大家认清这样的人，反应过来，正邪不两立
多发公告，趕快去掉st，每天都有10個點漲停,"https://guba.eastmoney.com/news,600401,661469121.html",2017-06-27 17:13:51,多发公告，趕快去掉st，每天都有10個點漲停
王德明，人走了，但是王德明的帐，一定要查，严查，查清楚，保留追究法律责任的权力。,"https://guba.eastmoney.com/news,600401,661861408.html",2017-06-28 11:02:36,【问】王德明，人走了，但是王德明的帐，一定要查，严查，查清楚，保留追究法律责任的权力。。。。 【答】*ST海润：感谢关注！¶¶2017-06-28 11:02:36 §
光伏电站并网发电，算是利好。据光伏电站的朋友说，搞光伏电站很赚钱，运营2年左右，,"https://guba.eastmoney.com/news,600401,661522028.html",2017-06-27 18:54:47,光伏电站并网发电，算是利好。据光伏电站的朋友说，搞光伏电站很赚钱，运营2年左右，成本便可收回。未来的利润空间还是可观的。海润光伏只要两股东和则顺，否则内斗不止，股价有可能还会下探。
我买的锐电咋看都比这货好，当时卖了这破股，只留下一百股看这个穷庄表演，同价置换，,"https://guba.eastmoney.com/news,600401,661202650.html",2017-06-27 10:06:46,我买的锐电咋看都比这货好，当时卖了这破股，只留下一百股看这个穷庄表演，同价置换，几个来回，锐电已赚了十多点，要守这破股，还没出套，欢迎进入锐电。
织布机！,"https://guba.eastmoney.com/news,600401,661946274.html",2017-06-28 13:40:18,织布机！
改成一年到30，三年太,"https://guba.eastmoney.com/news,600401,661485355.html",2017-06-27 17:44:51,真假美猴王，几千亿只为一时的爽？3060我复活了
快点砸到142，挂单十万,"https://guba.eastmoney.com/news,600401,661244593.html",2017-06-27 11:05:19,快点砸到142，挂单十万
肉仔难一肉出局！,"https://guba.eastmoney.com/news,600401,661966059.html",2017-06-28 14:08:13,肉仔难一肉出局！
今天用香港大利空消息来吓死人了！,"https://guba.eastmoney.com/news,600401,661616201.html",2017-06-27 22:12:17,今天用香港大利空消息来吓死人了！
不仅污蔑国家的光伏政策，还要坑害股民！,"https://guba.eastmoney.com/news,600401,661567445.html",2017-06-27 20:18:05,"去年海润光伏巨额亏损12亿元，孟广宝说是国家的产业政策造成的。上交所问询以后，大家才知道是做假账造成的。
这是给国家抹黑吗？？？？？？？
一边抹黑国家，一边坑害股民！！！！！！！！！"
每天织啊织，要把60日均价钱硬生生的磨下来，结合大盘近期的趋势分析，所以此股在很,"https://guba.eastmoney.com/news,600401,661745935.html",2017-06-28 06:46:46,每天织啊织，要把60日均价钱硬生生的磨下来，结合大盘近期的趋势分析，所以此股在很长的一段时间内保持横盘或再次下探1.35元可能性最大
6.00元不出局！1.42元出售去死！,"https://guba.eastmoney.com/news,600401,661977938.html",2017-06-28 14:24:41,6.00元不出局！1.42元出售去死！
有钱慢慢收股票，1、4元,"https://guba.eastmoney.com/news,600401,661353724.html",2017-06-27 14:03:52,有钱慢慢收股票，1、4元
兄弟们，别在这浪费时间了。赶紧买华锐风电还有机会。6月29号开股东会。明天也许有,"https://guba.eastmoney.com/news,600401,661467564.html",2017-06-27 17:11:13,"兄弟们，别在这浪费时间了。赶紧买华锐风电还有机会。6月29号开股东会。明天也许有最后一天上车的机会。华锐风电现在，属于国营单位。数钱数得手抽筋了，数钱数的手发抖
抓紧朋友们，也许还有机会。这股票九十多下来的。买它就是在马路上捡钱一样。太爽了。"
月底3天逆回购，股市缺钱，小心操作,"https://guba.eastmoney.com/news,600401,661816082.html",2017-06-28 10:07:03,月底3天逆回购，股市缺钱，小心操作
1.33和1.44目前是空头命门，一旦再被吃掉那1.45压力位就成一张纸了,"https://guba.eastmoney.com/news,600401,661341256.html",2017-06-27 13:46:12,所以空头还得注意，否则短线就溃不成军
庄家勇气可嘉，如此疯狂砸盘，佩服！[胜利],"https://guba.eastmoney.com/news,600401,661920090.html",2017-06-28 12:58:22,庄家勇气可嘉，如此疯狂砸盘，佩服！
为何不给发？,"https://guba.eastmoney.com/news,600401,661991779.html",2017-06-28 14:43:42,。。。。。。
再肉割肉出局吧！把你的老婆的下巴割了,"https://guba.eastmoney.com/news,600401,661952427.html",2017-06-28 13:49:48,再肉割肉出局吧！把你的老婆的下巴割了
我的持股计划于三年后再说！,"https://guba.eastmoney.com/news,600401,661955309.html",2017-06-28 13:52:23,我的持股计划于三年后再说！
1.44卖，1.42没能买回，明天吧。,"https://guba.eastmoney.com/news,600401,661398822.html",2017-06-27 15:06:29,1.44卖，1.42没能买回，明天吧。
一边污蔑国家的光伏政策，一边坑害股民！,"https://guba.eastmoney.com/news,600401,661565752.html",2017-06-27 20:15:33,"去年海润光伏巨额亏损12亿元，孟广宝说是国家的产业政策造成的。上交所问询以后，大家才知道是做假账造成的。
这是给国家抹黑吗？？？？？？？
一边抹黑国家，一边坑害股民！！！！！！！！！"
十万卖单乌云压头，想涨半分，是不可能的！,"https://guba.eastmoney.com/news,600401,661380101.html",2017-06-27 14:40:27,十万卖单乌云压头，想涨半分，是不可能的！
大利好消息影响！大出货啦！注意安全第一！,"https://guba.eastmoney.com/news,600401,661785944.html",2017-06-28 09:20:30,大利好消息影响！大出货啦！注意安全第一！
三观不正的人最爱造谣，不信大家就仔细观察，因为他内心邪恶，他就会把所有东西都看成,"https://guba.eastmoney.com/news,600401,661594983.html",2017-06-27 21:17:39,三观不正的人最爱造谣，不信大家就仔细观察，因为他内心邪恶，他就会把所有东西都看成邪恶的！炒股哪个不劳而获了，为什么不能谈善不善良，只行你造谣呀！
分析一下新都退，唠唠闲嗑,"https://guba.eastmoney.com/news,600401,661947402.html",2017-06-28 13:41:34,新都退跌到目前地步其实该跑的已经跑了，跑了的也是亏损累累跑的，绝对没有赚钱的。没跑的你觉得还会跑马？我觉得还跑个啥捏！即使现在卖了能卖几个钱，有何用！还不如扔里面爱咋咋地啦，反正里面也不是你一个。为啥新都退到这份上里面还有人炒作？根据规定一般人还炒不了新都退的，都是有头有脸的中大户乃至机构以上的，他们为啥还敢在里面折腾？自由其道理和目的。
不当真i,"https://guba.eastmoney.com/news,600401,661986924.html",2017-06-28 14:35:32,"五穷，六绝，七翻身
还真灵i"
不顾26万人的死活，恶言恶语让人割肉这是什么人人性，这么残忍，你要是说我一个我都,"https://guba.eastmoney.com/news,600401,661600685.html",2017-06-27 21:30:58,不顾26万人的死活，恶言恶语让人割肉这是什么人人性，这么残忍，你要是说我一个我都不理你，不会和你一般见识 你在说的是26万人，你还是人吗？
卖了海润不丢人，丢人的是2.5买的一直拿到现在清仓了,"https://guba.eastmoney.com/news,600401,661827262.html",2017-06-28 10:21:41,
沉浮所说的摸顶1.45已实现，后边是不是和沉浮所说的1.33,"https://guba.eastmoney.com/news,600401,661773306.html",2017-06-28 08:49:50,沉浮所说的摸顶1.45已实现，后边是不是和沉浮所说的1.33
沉浮：Guba老游大和尚这么老实的人你也欺负，你这坏人,"https://guba.eastmoney.com/news,600401,661453840.html",2017-06-27 16:43:22,沉浮：Guba老游大和尚这么老实的人你也欺负，你这坏人
怪我一买什么股票都会跌,"https://guba.eastmoney.com/news,600401,661816948.html",2017-06-28 10:08:31,我走好了，祝你们发财。
煎熬,"https://guba.eastmoney.com/news,600401,661987959.html",2017-06-28 14:38:37,煎熬
但截至2016年10月31日,"https://guba.eastmoney.com/news,600401,661916652.html",2017-06-28 12:51:33,经过近阶段一系列跌宕洗礼尤其是美国加息之事已尘埃落定
利好！去年投的项目多，今年应有收益吧！,"https://guba.eastmoney.com/news,600401,661793486.html",2017-06-28 09:34:36,要再发！
骗人的人都爱死的！,"https://guba.eastmoney.com/news,600401,661955709.html",2017-06-28 13:53:34,骗人的人都爱死的！
空狗们难道真的是闲得蛋疼？,"https://guba.eastmoney.com/news,600401,661938026.html",2017-06-28 13:27:43,如果此股不关你的事，你会闲得蛋疼，几千只股票，你独独会跑来这像狗一样叫唤，你无非想要点便宜筹码，至于像狗一样叫唤吗。
601558st锐电：完蛋了，这个st要涨停,"https://guba.eastmoney.com/news,600401,661367976.html",2017-06-27 14:24:28,601558st锐电：完蛋了，这个st要涨停
散戶越洗越多,"https://guba.eastmoney.com/news,600401,661971313.html",2017-06-28 14:15:47,散戶越洗越多
就会护着1.40怕一个跌停就让杨爆仓,"https://guba.eastmoney.com/news,600401,661978200.html",2017-06-28 14:25:55,就会护着1.40怕一个跌停就让杨爆仓
随便一个项目就五十亿，公司有钱哪,"https://guba.eastmoney.com/news,600401,661973837.html",2017-06-28 14:18:23,随便一个项目就五十亿，公司有钱哪
我坚持坚守岗位三年后的第一天开始啦,"https://guba.eastmoney.com/news,600401,661971139.html",2017-06-28 14:16:05,我坚持坚守岗位三年后的第一天开始啦
002571st德力：完蛋，这个st票成功涨停,"https://guba.eastmoney.com/news,600401,661970008.html",2017-06-28 14:14:56,002571st德力：完蛋，这个st票成功涨停
退市股都比你高价[摊手],"https://guba.eastmoney.com/news,600401,661970973.html",2017-06-28 14:14:42,退市股都比你高价
140白送人,"https://guba.eastmoney.com/news,600401,661969712.html",2017-06-28 14:13:27,没人会感谢你
开板新股和高送转概念股受机构追捧,"https://guba.eastmoney.com/news,600401,661969642.html",2017-06-28 14:13:12,沪胶 空头增持力度更强
何时摘帽？？？？？？!！！!！！,"https://guba.eastmoney.com/news,600401,661969359.html",2017-06-28 14:12:59,何时摘帽？？？？？？!！！!！！
出去了最好的最安全最不会亏本清仓了,"https://guba.eastmoney.com/news,600401,661969443.html",2017-06-28 14:12:51,出去了最好的最安全最不会亏本清仓了
002571st德力：完蛋，这个st票要涨停,"https://guba.eastmoney.com/news,600401,661968501.html",2017-06-28 14:12:14,002571st德力：完蛋，这个st票要涨停
出去最好的,"https://guba.eastmoney.com/news,600401,661968725.html",2017-06-28 14:11:50,出去最好的
肉肉好好吃的东西都肉肉好好吃的东西都肉肉好好,"https://guba.eastmoney.com/news,600401,661968131.html",2017-06-28 14:10:58,肉肉好好吃的东西都肉肉好好吃的东西都肉肉好好吃的东西都肉肉好好吃的东西都
002571st德力：完蛋了，这个st票要涨停,"https://guba.eastmoney.com/news,600401,661966965.html",2017-06-28 14:09:58,002571st德力：完蛋了，这个st票要涨停
002571st德力：完蛋了，这个st票要涨停了,"https://guba.eastmoney.com/news,600401,661967330.html",2017-06-28 14:09:32,002571st德力：完蛋了，这个st票要涨停了
並網發點又怎樣，还不是跌，一分哥！,"https://guba.eastmoney.com/news,600401,661961423.html",2017-06-28 14:02:31,並網發點又怎樣，还不是跌，一分哥！
国家的项目,"https://guba.eastmoney.com/news,600401,661956908.html",2017-06-28 13:55:51,国家的项目
骗鬼！割肉出局割肉出局吧！谢谢你们的肉了！,"https://guba.eastmoney.com/news,600401,661953415.html",2017-06-28 13:50:21,骗鬼！割肉出局割肉出局吧！谢谢你们的肉了！
骗人的招术去骗鬼！,"https://guba.eastmoney.com/news,600401,661954241.html",2017-06-28 13:51:52,骗人的招术去骗鬼！
豪门午宴,"https://guba.eastmoney.com/news,600401,661952597.html",2017-06-28 13:48:52,在南瓜花开的季节，喜啦啦做了一道时菜，南瓜花
狗庄压盘压到1.30元,"https://guba.eastmoney.com/news,600401,661881932.html",2017-06-28 11:42:10,狗庄还要挖坑
不是戏言,"https://guba.eastmoney.com/news,600401,661948040.html",2017-06-28 13:42:37,涨幅靠前；白酒
600112st天成：完蛋了，这个st票要涨停了,"https://guba.eastmoney.com/news,600401,661940865.html",2017-06-28 13:31:55,600112st天成：完蛋了，这个st票要涨停了
最低点后复权27.40，看多的买，我看中性只有向下炒，低吸139-134高一分不,"https://guba.eastmoney.com/news,600401,661939698.html",2017-06-28 13:29:34,最低点后复权27.40，看多的买，我看中性只有向下炒，低吸139-134高一分不要，压力位142看涨142-146，有望震荡向上160
为什么要用消息出来吓人啦！,"https://guba.eastmoney.com/news,600401,661929459.html",2017-06-28 13:14:13,为什么要用消息出来吓人啦！
退市股都追上你了，你还好意思,"https://guba.eastmoney.com/news,600401,661936542.html",2017-06-28 13:25:52,退市股都追上你了，你还好意思
退市票，有什么好研究的。还你争我斗的有意义吗？,"https://guba.eastmoney.com/news,600401,661928727.html",2017-06-28 13:13:26,退市票，有什么好研究的。还你争我斗的有意义吗？
今天能守住1.41吗哈，狂笑大笑,"https://guba.eastmoney.com/news,600401,661926139.html",2017-06-28 13:08:39,
